v_sku,v_name,v_short_description,v_description,v_image,v_url,v_attribute,v_price,v_specials_price,v_specials_expire_date,v_date_added,v_in_stock,v_status,v_viewed,v_ordered,v_category_sku,v_sort_order,v_meta_title,v_meta_keywords,v_meta_description,v_brand_filter,v_class_filter,v_color_filter,v_gender_filter,v_material_filter,v_year_filter,v_origin_filter,v_series_filter,v_spec_filter
BDOSTVR0108,Women Comfy Wearable Casual Espadrille Platform Wedges Slippers,,"<p>Color:Black, White</p><p>Type:Stripe Slippers</p><p>Closure Type:Slip-On</p><p>Heel Type:Wedges Heel</p><p>Heel Height:3-5cm In Low Heel</p><p>Toe Type:Opened</p><p>Pattern:Solid</p><p>Upper Material:PU</p><p>Style:Casual</p><p>Outsole Material:PU</p><p>Structure:Slip-On</p><p>Occasion:Beach</p><p>Function:Breathable</p><p>Season:Summer</p>",img/Slippers/SKUF04077.jpg,,Size#US 5:US 6:US 7:US 8:US 9:US 10:US 11:US 12:,64.28,,,,1,1,,,Slippers,,Women Comfy Wearable Casual Espadrille Platform Wedges Slippers,Women Comfy Wearable Casual Espadrille Platform Wedges Slippers,Women Comfy Wearable Casual Espadrille Platform Wedges Slippers,,,,,,,,,
BDOSTVR0109,Tie Back Backless Crop Tank Top,,<p><b>Style</b>: Casual</p><p><b>Color</b>: Dusty Pink</p><p><b>Pattern Type</b>: Plain</p><p><b>Length</b>: Crop</p><p><b>Season</b>: Summer</p><p><b>Type</b>: Tank</p><p><b>Details</b>: Backless</p><p><b>Details</b>: Tie Back</p><p><b>Neckline</b>: Round Neck</p><p><b>Fit Type</b>: Slim Fit</p><p><b>Sheer</b>: No</p><p><b>Material</b>: Polyester</p><p><b>Composition</b>: 95% Polyester</p><p><b>Composition</b>: 5% Spandex</p><p><b>Fabric</b>: Slight Stretch</p><p><b>Care Instructions</b>: Machine wash or professional dry clean</p>,img/Tank_Tops__Camis/swvest25210107308.jpg,,Size#XS:S:M:L:,30.55,,,,1,1,,,Tank Tops & Cam's,,Tie Back Backless Crop Tank Top,Tie Back Backless Crop Tank Top,Tie Back Backless Crop Tank Top,,,,,,,,,
BDOSTVR0110,Floral Print Mini Skirt,,<p><b>Style</b>: Casual</p><p><b>Color</b>: Blue</p><p><b>Pattern Type</b>: Floral</p><p><b>Pattern Type</b>: All Over Print</p><p><b>Type</b>: A Line</p><p><b>Season</b>: Summer</p><p><b>Waist Line</b>: Natural</p><p><b>Sheer</b>: No</p><p><b>Material</b>: Polyester</p><p><b>Composition</b>: 65% Polyester</p><p><b>Composition</b>: 35% Cotton</p><p><b>Fabric</b>: Medium Stretch</p><p><b>Care Instructions</b>: Machine wash or professional dry clean</p>,img/Skirts/rwskirt25210526390.jpg,,Size#S:M:L:,22.89,,,,1,1,,,Skirts,,Floral Print Mini Skirt,Floral Print Mini Skirt,Floral Print Mini Skirt,,,,,,,,,
BDOSTVR0111,Buffalo Plaid Straight Leg Pants,,<p><b>Style</b>: Preppy</p><p><b>Color</b>: Lime Green</p><p><b>Pattern Type</b>: Gingham</p><p><b>Length</b>: Long</p><p><b>Season</b>: Spring</p><p><b>Type</b>: Straight Leg</p><p><b>Waist Line</b>: High Waist</p><p><b>Fit Type</b>: Regular Fit</p><p><b>Sheer</b>: No</p><p><b>Closure Type</b>: Elastic Waist</p><p><b>Material</b>: Cotton</p><p><b>Composition</b>: 100% Cotton</p><p><b>Fabric</b>: Non-Stretch</p><p><b>Care Instructions</b>: Machine wash or professional dry clean</p>,img/Pants/swpants07210105619.jpg,,Size#XS:S:M:L:XL:,24.0,,,,1,1,,,Pants,,Buffalo Plaid Straight Leg Pants,Buffalo Plaid Straight Leg Pants,Buffalo Plaid Straight Leg Pants,,,,,,,,,
BDOSTVR0112,Colorblock Butterfly Graphic Shorts,,<p><b>Style</b>: Casual</p><p><b>Color</b>: Black and White</p><p><b>Pattern Type</b>: Animal</p><p><b>Pattern Type</b>: Colorblock</p><p><b>Season</b>: Summer</p><p><b>Type</b>: Track Shorts</p><p><b>Waist Line</b>: Natural</p><p><b>Fit Type</b>: Regular Fit</p><p><b>Sheer</b>: No</p><p><b>Closure Type</b>: Elastic Waist</p><p><b>Material</b>: Polyester</p><p><b>Composition</b>: 95% Polyester</p><p><b>Composition</b>: 5% Elastane</p><p><b>Fabric</b>: Slight Stretch</p><p><b>Care Instructions</b>: Machine wash or professional dry clean</p>,img/Shorts/rwshorts25210531477.jpg,,Size#S:M:L:,25.66,,,,1,1,,,Shorts,,Colorblock Butterfly Graphic Shorts,Colorblock Butterfly Graphic Shorts,Colorblock Butterfly Graphic Shorts,,,,,,,,,
BDOSTVR0113,Fashion Colorful Rhinestones Beads Bracelets Vintage Turquoise Bangle Bracelet Gift for Women,,"<p>Type: </p><p>Weight: about 25g</p><p>Size: about 17cm</p><p>
	</p><p>Material: Zinc Alloy, Turquoise, Rhinestones</p><p>1 x Bracelet</p>",img/Bracelets/SKU970398.jpg,,Size#,12.86,,,,1,1,,,Bracelets,,Fashion Colorful Rhinestones Beads Bracelets Vintage Turquoise Bangle Bracelet Gift for Women,Fashion Colorful Rhinestones Beads Bracelets Vintage Turquoise Bangle Bracelet Gift for Women,Fashion Colorful Rhinestones Beads Bracelets Vintage Turquoise Bangle Bracelet Gift for Women,,,,,,,,,
BDOSTVR0114,10pcs Vintage Knuckle Tribal Ethnic Stone Joint Unique Ring,,<p>Style: Punk Ring</p><p>Material: Alloy</p><p>Color: Steel Color</p><p>Weight: about 14g</p><p>Size: As the picture</p><p>1 x 10pcs Ring</p>,img/Rings/SKU450035.jpg,,Size#,11.01,,,,1,1,,,Rings,,10pcs Vintage Knuckle Tribal Ethnic Stone Joint Unique Ring,10pcs Vintage Knuckle Tribal Ethnic Stone Joint Unique Ring,10pcs Vintage Knuckle Tribal Ethnic Stone Joint Unique Ring,,,,,,,,,
BDOSTVR0115,Genuine Leather Tassel Pendant Plaid Handbag Crossbody Bag For Women,,"<p>Bag Type:Tote</p><p>Color:Blue, Black, Purple</p><p>Material:Cow Leather</p><p>Style:Casual</p><p>Decoration:Tassel</p><p>Hardness:Soft</p>",img/Handbags/SKUA72853.jpg,,Size#,73.08,,,,1,1,,,Handbags,,Genuine Leather Tassel Pendant Plaid Handbag Crossbody Bag For Women,Genuine Leather Tassel Pendant Plaid Handbag Crossbody Bag For Women,Genuine Leather Tassel Pendant Plaid Handbag Crossbody Bag For Women,,,,,,,,,
BDOSTVR0116,Men Mesh Breathable Light Weight Soft Sport Running Shoes Lace Up Casual Sneakers,,"<p>Color:Black, White</p><p>Upper Material:Mesh</p><p>Outsole Material:PU</p><p>Function:Breathable</p><p>Closure Type:Lace-up</p><p>Toe Type:Round</p>",img/Sneakers__Athletic/SKUE69665.jpg,,Size#US 6.5:US 7.5:US 8:US 8.5:US 9:US 10:US 10.5:US 11:US 11.5:US 12:,65.41,,,,1,1,,,Sneakers & Athletic,,Men Mesh Breathable Light Weight Soft Sport Running Shoes Lace Up Casual Sneakers,Men Mesh Breathable Light Weight Soft Sport Running Shoes Lace Up Casual Sneakers,Men Mesh Breathable Light Weight Soft Sport Running Shoes Lace Up Casual Sneakers,,,,,,,,,
BDOSTVR0117,Rhinestone Clip Toe Holiday Hollow Out Flip Flops Beach Slippers,,"<p>Color:Black, Pink, Brown</p><p>Heel Type:Flat</p><p>Toe Type:Clip Toe</p><p>Upper Material:PU</p><p>Outsole Material:Rubber</p><p>Occasion:Beach</p><p>Season:Summer</p>",img/Slippers/SKUF22853.jpg,,Size#US 5:US 6:US 7:US 8:US 9:US 10:US 11:,50.8,,,,1,1,,,Slippers,,Rhinestone Clip Toe Holiday Hollow Out Flip Flops Beach Slippers,Rhinestone Clip Toe Holiday Hollow Out Flip Flops Beach Slippers,Rhinestone Clip Toe Holiday Hollow Out Flip Flops Beach Slippers,,,,,,,,,
BDOSTVR0118,Heart Graphic Ringer Crop Halter Top,,<p><b>Style</b>: Casual</p><p><b>Color</b>: Multicolor</p><p><b>Pattern Type</b>: Heart</p><p><b>Length</b>: Crop</p><p><b>Season</b>: Summer</p><p><b>Type</b>: Halter</p><p><b>Details</b>: Tie Back</p><p><b>Details</b>: Contrast Binding</p><p><b>Neckline</b>: Halter</p><p><b>Fit Type</b>: Slim Fit</p><p><b>Sheer</b>: No</p><p><b>Material</b>: Polyester</p><p><b>Composition</b>: 65% Polyester</p><p><b>Composition</b>: 35% Cotton</p><p><b>Fabric</b>: Slight Stretch</p><p><b>Care Instructions</b>: Machine wash or professional dry clean</p>,img/Tank_Tops__Camis/rwvest25210528107.jpg,,Size#S:M:L:,27.65,,,,1,1,,,Tank Tops & Cam's,,Heart Graphic Ringer Crop Halter Top,Heart Graphic Ringer Crop Halter Top,Heart Graphic Ringer Crop Halter Top,,,,,,,,,
BDOSTVR0119,Solid Layered Skirt,,<p><b>Style</b>: Casual</p><p><b>Color</b>: Black</p><p><b>Pattern Type</b>: Plain</p><p><b>Length</b>: Mini</p><p><b>Type</b>: Layered/Tiered</p><p><b>Season</b>: Summer</p><p><b>Details</b>: Frill</p><p><b>Waist Line</b>: Natural</p><p><b>Sheer</b>: No</p><p><b>Material</b>: Cotton</p><p><b>Composition</b>: 65% Cotton</p><p><b>Composition</b>: 35% Polyester</p><p><b>Fabric</b>: Non-Stretch</p><p><b>Care Instructions</b>: Machine wash or professional dry clean</p>,img/Skirts/rwskirt25210520679.jpg,,Size#XS:S:M:L:,28.1,,,,1,1,,,Skirts,,Solid Layered Skirt,Solid Layered Skirt,Solid Layered Skirt,,,,,,,,,
BDOSTVR0120,Solid Elastic Waist Pants,,<p><b>Style</b>: Casual</p><p><b>Color</b>: Army Green</p><p><b>Pattern Type</b>: Plain</p><p><b>Length</b>: Cropped</p><p><b>Type</b>: Tapered/Carrot</p><p><b>Season</b>: Spring/Summer/Fall</p><p><b>Waist Line</b>: High Waist</p><p><b>Fit Type</b>: Regular Fit</p><p><b>Sheer</b>: No</p><p><b>Closure Type</b>: Elastic Waist</p><p><b>Material</b>: Cotton</p><p><b>Composition</b>: 100% Cotton</p><p><b>Fabric</b>: Slight Stretch</p><p><b>Care Instructions</b>: Machine wash or professional dry clean</p>,img/Pants/swpants07210120491.jpg,,Size#XS:S:M:L:,32.04,,,,1,1,,,Pants,,Solid Elastic Waist Pants,Solid Elastic Waist Pants,Solid Elastic Waist Pants,,,,,,,,,
BDOSTVR0121,Colorblock Fire Print Shorts,,<p><b>Style</b>: Casual</p><p><b>Color</b>: Multicolor</p><p><b>Pattern Type</b>: Colorblock</p><p><b>Pattern Type</b>: Fire</p><p><b>Season</b>: Summer</p><p><b>Type</b>: Track Shorts</p><p><b>Waist Line</b>: Natural</p><p><b>Fit Type</b>: Regular Fit</p><p><b>Sheer</b>: No</p><p><b>Closure Type</b>: Elastic Waist</p><p><b>Material</b>: Cotton Blends</p><p><b>Composition</b>: 65% Cotton</p><p><b>Composition</b>: 35% Polyester</p><p><b>Fabric</b>: Slight Stretch</p><p><b>Care Instructions</b>: Machine wash or professional dry clean</p>,img/Shorts/rw2107061954811646.jpg,,Size#S:M:L:,32.92,,,,1,1,,,Shorts,,Colorblock Fire Print Shorts,Colorblock Fire Print Shorts,Colorblock Fire Print Shorts,,,,,,,,,
BDOSTVR0122,Vintage Cuff Bracelets Babysbreath Sakura Dry Flower Glass Wax Rope Ethnic Jewelry for Women,,"<p>
	</p><p>
	</p><p>
</p><p>Notice:</p>",img/Bracelets/SKUA18013.jpg,,Size#,22.52,,,,1,1,,,Bracelets,,Vintage Cuff Bracelets Babysbreath Sakura Dry Flower Glass Wax Rope Ethnic Jewelry for Women,Vintage Cuff Bracelets Babysbreath Sakura Dry Flower Glass Wax Rope Ethnic Jewelry for Women,Vintage Cuff Bracelets Babysbreath Sakura Dry Flower Glass Wax Rope Ethnic Jewelry for Women,,,,,,,,,
BDOSTVR0123,Sweet Pink Flower Charm Letters Engraved Finger Rings Engagement Wedding Jewelry for Women,,"<p>Style: Trendy</p><p>Type: Finger Ring</p><p>Main Color: Silver</p><p>Weight: About 4g</p><p>Material: Zinc Alloy</p><p>Ring Size: 6 / 7 / 8</p><p>(Please see the size reference for size conversion and detail information.)</p><p>1 x Ring</p><p>
	</p>",img/Rings/SKU988085.jpg,,Size#6:7:8:,25.81,,,,1,1,,,Rings,,Sweet Pink Flower Charm Letters Engraved Finger Rings Engagement Wedding Jewelry for Women,Sweet Pink Flower Charm Letters Engraved Finger Rings Engagement Wedding Jewelry for Women,Sweet Pink Flower Charm Letters Engraved Finger Rings Engagement Wedding Jewelry for Women,,,,,,,,,
BDOSTVR0124,Women Genuine Leather Handbag High End Tote Bag Bucket Bag,,"<p>Bag Type:Tote</p><p>Color:Blue, Black, Red</p><p>Material:PU</p><p>Style:Casual</p><p>Hardness:Soft</p>",img/Handbags/SKU683499.jpg,,Size#,71.17,,,,1,1,,,Handbags,,Women Genuine Leather Handbag High End Tote Bag Bucket Bag,Women Genuine Leather Handbag High End Tote Bag Bucket Bag,Women Genuine Leather Handbag High End Tote Bag Bucket Bag,,,,,,,,,
BDOSTVR0125,Men Knitted Fabric Breathable Lace Up Sport Running Athletic Shoes,,"<p>Color:Black, Blue, Grey</p><p>Upper Material:Mesh</p><p>Outsole Material:PU</p><p>Function:Breathable, Soft</p><p>Closure Type:Lace-up</p><p>Season:Summer</p><p>Toe Type:Round</p>",img/Sneakers__Athletic/SKUF70312.jpg,,Size#US 6.5:US 7.5:US 8:US 8.5:US 9:US 10:US 10.5:US 11:,57.29,,,,1,1,,,Sneakers & Athletic,,Men Knitted Fabric Breathable Lace Up Sport Running Athletic Shoes,Men Knitted Fabric Breathable Lace Up Sport Running Athletic Shoes,Men Knitted Fabric Breathable Lace Up Sport Running Athletic Shoes,,,,,,,,,
BDOSTVR0126,Hotmarzz Lovers Casual Beach Slippers Non Slip Sandals,,"<p>Color:Red</p><p>Type:ClipToe Slippers</p><p>Heel Type:Flat</p><p>Heel Height:1-3cm In Flat</p><p>Toe Type:Round</p><p>Pattern:Other</p><p>Design Element:Simple</p><p>Upper Material:PU</p><p>Style:Casual</p><p>Outsole Material:Rubber</p><p>Structure:Clip Toe</p><p>Occasion:Beach</p><p>Function:Breathable, Antiskid</p><p>Season:Summer</p>",img/Slippers/SKU257059.jpg,,Size#US 7:US 8:US 9:US 10:US 11:US 12:US 13:,57.1,,,,1,1,,,Slippers,,Hotmarzz Lovers Casual Beach Slippers Non Slip Sandals,Hotmarzz Lovers Casual Beach Slippers Non Slip Sandals,Hotmarzz Lovers Casual Beach Slippers Non Slip Sandals,,,,,,,,,
BDOSTVR0127,Ditsy Floral Ruffle Crop Cami,,<p><b>Style</b>: Boho</p><p><b>Color</b>: Multicolor</p><p><b>Pattern Type</b>: Ditsy Floral</p><p><b>Length</b>: Crop</p><p><b>Season</b>: Summer</p><p><b>Type</b>: Cami</p><p><b>Details</b>: Ruffle</p><p><b>Details</b>: Knot</p><p><b>Fit Type</b>: Slim Fit</p><p><b>Neckline</b>: Straps</p><p><b>Sheer</b>: No</p><p><b>Material</b>: Polyester</p><p><b>Composition</b>: 97% Polyester</p><p><b>Composition</b>: 3% Elastane</p><p><b>Fabric</b>: Slight Stretch</p><p><b>Care Instructions</b>: Machine wash or professional dry clean</p>,img/Tank_Tops__Camis/rwvest25210517990.jpg,,Size#XS:S:M:L:,30.22,,,,1,1,,,Tank Tops & Cam's,,Ditsy Floral Ruffle Crop Cami,Ditsy Floral Ruffle Crop Cami,Ditsy Floral Ruffle Crop Cami,,,,,,,,,
BDOSTVR0128,Ditsy Floral Ruffle Hem Skirt,,<p><b>Style</b>: Boho</p><p><b>Color</b>: Multicolor</p><p><b>Pattern Type</b>: Ditsy Floral</p><p><b>Length</b>: Short</p><p><b>Type</b>: Flared</p><p><b>Season</b>: Summer</p><p><b>Details</b>: Ruffle Hem</p><p><b>Waist Line</b>: High Waist</p><p><b>Sheer</b>: No</p><p><b>Material</b>: Polyester</p><p><b>Composition</b>: 100% Polyester</p><p><b>Fabric</b>: Non-Stretch</p><p><b>Care Instructions</b>: Machine wash or professional dry clean</p>,img/Skirts/swskirt30210327881.jpg,,Size#S:M:L:XL:,25.57,,,,1,1,,,Skirts,,Ditsy Floral Ruffle Hem Skirt,Ditsy Floral Ruffle Hem Skirt,Ditsy Floral Ruffle Hem Skirt,,,,,,,,,
BDOSTVR0129,Buttoned Front Cow Print Pants,,<p><b>Style</b>: Casual</p><p><b>Color</b>: Black and White</p><p><b>Pattern Type</b>: Animal</p><p><b>Length</b>: Long</p><p><b>Type</b>: Straight Leg</p><p><b>Season</b>: Spring/Summer/Fall</p><p><b>Details</b>: Pocket</p><p><b>Details</b>: Zipper</p><p><b>Details</b>: Button Front</p><p><b>Waist Line</b>: High Waist</p><p><b>Fit Type</b>: Regular Fit</p><p><b>Sheer</b>: No</p><p><b>Closure Type</b>: Zipper Fly</p><p><b>Material</b>: Polyester</p><p><b>Composition</b>: 100% Polyester</p><p><b>Fabric</b>: Non-Stretch</p><p><b>Care Instructions</b>: Machine wash or professional dry clean</p>,img/Pants/swpants07200810222.jpg,,Size#XS:S:M:L:XL:,29.77,,,,1,1,,,Pants,,Buttoned Front Cow Print Pants,Buttoned Front Cow Print Pants,Buttoned Front Cow Print Pants,,,,,,,,,
BDOSTVR0130,Two Tone Letter Shorts,,<p><b>Style</b>: Casual</p><p><b>Color</b>: Multicolor</p><p><b>Pattern Type</b>: Letter</p><p><b>Pattern Type</b>: Colorblock</p><p><b>Season</b>: Summer</p><p><b>Type</b>: Track Shorts</p><p><b>Waist Line</b>: Natural</p><p><b>Fit Type</b>: Regular Fit</p><p><b>Sheer</b>: No</p><p><b>Closure Type</b>: Elastic Waist</p><p><b>Material</b>: Polyester</p><p><b>Composition</b>: 97% Polyester</p><p><b>Composition</b>: 3% Elastane</p><p><b>Fabric</b>: Slight Stretch</p><p><b>Care Instructions</b>: Machine wash or professional dry clean</p>,img/Shorts/rwshorts25210414715.jpg,,Size#S:M:L:,29.22,,,,1,1,,,Shorts,,Two Tone Letter Shorts,Two Tone Letter Shorts,Two Tone Letter Shorts,,,,,,,,,
BDOSTVR0131,Balancing Style Simple Rhinestone Bracelet Alloy Red Stone Bracelet,,"<p>Style: Rhinestone Bracelet</p><p>Material: Alloy, Rhinestone</p><p>Color: Gold</p><p>Weight: about 25g</p><p>Diameter: about 60mm / 2.36'</p><p>1X Bracelet</p><p>1.Please allow 1-5mm differences due to manual measurement.</p><p>2.Due to the light and screen difference, the item's color may be slightly different from the pictures. Please  understand and make sure you don't mind before you bid.</p>",img/Bracelets/SKU488999.jpg,,Size#,15.32,,,,1,1,,,Bracelets,,Balancing Style Simple Rhinestone Bracelet Alloy Red Stone Bracelet,Balancing Style Simple Rhinestone Bracelet Alloy Red Stone Bracelet,Balancing Style Simple Rhinestone Bracelet Alloy Red Stone Bracelet,,,,,,,,,
BDOSTVR0132,Cute Geometric Animal Rhinestone Rings,,"<p>﻿Style: Cute</p><p>Type: Rings</p><p>Color: Silver</p><p>Weight: 10g</p><p>Size: 5,6,7,8,9,10</p><p>Material: Alloy,Rhinestone</p><p>1 x Rings</p>",img/Rings/SKUH21300.jpg,,Size#5:6:7:8:9:10:,26.11,,,,1,1,,,Rings,,Cute Geometric Animal Rhinestone Rings,Cute Geometric Animal Rhinestone Rings,Cute Geometric Animal Rhinestone Rings,,,,,,,,,
BDOSTVR0133,Women Striped Casual Canvas Handbag Crossbody Bag,,"<p>Bag Type:Satchel</p><p>Color:Blue, Black</p><p>Material:Canvas</p><p>Style:Casual</p><p>Hardness:Soft</p>",img/Handbags/SKUE82660.jpg,,Size#,64.27,,,,1,1,,,Handbags,,Women Striped Casual Canvas Handbag Crossbody Bag,Women Striped Casual Canvas Handbag Crossbody Bag,Women Striped Casual Canvas Handbag Crossbody Bag,,,,,,,,,
BDOSTVR0134,Men Brief Knitted Fabric Light Weight Slip-on Hard Wearing Skate Shoes,,"<p>Color:Black, Grey, Beige</p><p>Upper Material:Knitted</p><p>Outsole Material:Rubber</p><p>Type:Skate Shoes</p><p>Function:Hard-wearing, Sport</p><p>Occasion:Outdoor, Sport</p><p>Closure Type:Slip-On</p><p>Season:All Season</p><p>Toe Type:Round</p>",img/Sneakers__Athletic/SKUH31717.jpg,,Size#US 6.5:US 7.5:US 8:US 8.5:US 9:US 10:,65.5,,,,1,1,,,Sneakers & Athletic,,Men Brief Knitted Fabric Light Weight Slip-on Hard Wearing Skate Shoes,Men Brief Knitted Fabric Light Weight Slip-on Hard Wearing Skate Shoes,Men Brief Knitted Fabric Light Weight Slip-on Hard Wearing Skate Shoes,,,,,,,,,
BDOSTVR0135,Women Summer Holiday Fashion Print Comfy Slip On Casual Beach Cork Slippers,,"<p>Color:Yellow, Black, Brown, White</p><p>Closure Type:Slip-On</p><p>Heel Type:Flat</p><p>Heel Height:1-3cm In Flat</p><p>Toe Type:Opened</p><p>Pattern:Animal-print</p><p>Design Element:Print</p><p>Upper Material:PU</p><p>Style:Casual</p><p>Outsole Material:Rubber</p><p>Occasion:Beach, Holiday, Casual</p><p>Function:Hard-wearing</p><p>Season:Summer</p>",img/Slippers/SKUH70813.jpg,,Size#US 5:US 6:US 7:US 8:US 9:US 10:US 11:US 12:,64.84,,,,1,1,,,Slippers,,Women Summer Holiday Fashion Print Comfy Slip On Casual Beach Cork Slippers,Women Summer Holiday Fashion Print Comfy Slip On Casual Beach Cork Slippers,Women Summer Holiday Fashion Print Comfy Slip On Casual Beach Cork Slippers,,,,,,,,,
BDOSTVR0136,Letter Figure Graphic Ribbed Tank Top,,<p><b>Style</b>: Casual</p><p><b>Color</b>: Apricot</p><p><b>Pattern Type</b>: Letter</p><p><b>Pattern Type</b>: Figure</p><p><b>Length</b>: Crop</p><p><b>Season</b>: Summer</p><p><b>Type</b>: Tank</p><p><b>Details</b>: Rib-Knit</p><p><b>Neckline</b>: Round Neck</p><p><b>Fit Type</b>: Slim Fit</p><p><b>Sheer</b>: No</p><p><b>Material</b>: Cotton</p><p><b>Composition</b>: 65% Cotton</p><p><b>Composition</b>: 35% Polyester</p><p><b>Fabric</b>: High Stretch</p><p><b>Care Instructions</b>: Machine wash or professional dry clean</p>,img/Tank_Tops__Camis/rwvest25210608268.jpg,,Size#XS:S:M:L:,32.25,,,,1,1,,,Tank Tops & Cam's,,Letter Figure Graphic Ribbed Tank Top,Letter Figure Graphic Ribbed Tank Top,Letter Figure Graphic Ribbed Tank Top,,,,,,,,,
BDOSTVR0137,Split Hem Tartan Skirt,,<p><b>Style</b>: Preppy</p><p><b>Color</b>: Lilac Purple</p><p><b>Pattern Type</b>: Tartan</p><p><b>Length</b>: Mini</p><p><b>Type</b>: A Line</p><p><b>Season</b>: Summer</p><p><b>Details</b>: Split</p><p><b>Details</b>: Zipper</p><p><b>Waist Line</b>: High Waist</p><p><b>Sheer</b>: No</p><p><b>Material</b>: Polyester</p><p><b>Composition</b>: 97% Polyester</p><p><b>Composition</b>: 3% Spandex</p><p><b>Fabric</b>: Non-Stretch</p><p><b>Care Instructions</b>: Machine wash or professional dry clean</p>,img/Skirts/swskirt07200513840.jpg,,Size#XS:S:M:L:XL:,29.17,,,,1,1,,,Skirts,,Split Hem Tartan Skirt,Split Hem Tartan Skirt,Split Hem Tartan Skirt,,,,,,,,,
BDOSTVR0138,Flap Pocket Buckle Cargo Pants,,<p><b>Style</b>: Casual</p><p><b>Color</b>: Khaki</p><p><b>Length</b>: Long</p><p><b>Type</b>: Cargo Pants</p><p><b>Season</b>: Spring/Summer/Fall</p><p><b>Details</b>: Drawstring</p><p><b>Details</b>: Pocket</p><p><b>Details</b>: Tape</p><p><b>Waist Line</b>: High Waist</p><p><b>Fit Type</b>: Regular Fit</p><p><b>Sheer</b>: No</p><p><b>Closure Type</b>: Drawstring Waist</p><p><b>Material</b>: Polyester</p><p><b>Composition</b>: 100% Polyester</p><p><b>Fabric</b>: Slight Stretch</p><p><b>Care Instructions</b>: Machine wash or professional dry clean</p><p><b>Style</b>: Casual</p><p><b>Color</b>: Baby Pink</p><p><b>Length</b>: Cropped</p><p><b>Type</b>: Cargo Pants</p><p><b>Season</b>: Spring/Summer/Fall</p><p><b>Details</b>: Drawstring</p><p><b>Details</b>: Pocket</p><p><b>Details</b>: Tape</p><p><b>Waist Line</b>: High Waist</p><p><b>Fit Type</b>: Regular Fit</p><p><b>Sheer</b>: No</p><p><b>Closure Type</b>: Drawstring Waist</p><p><b>Material</b>: Polyester</p><p><b>Composition</b>: 100% Polyester</p><p><b>Fabric</b>: Slight Stretch</p><p><b>Care Instructions</b>: Machine wash or professional dry clean</p><p><b>Style</b>: Casual</p><p><b>Color</b>: Black</p><p><b>Pattern Type</b>: Plain</p><p><b>Length</b>: Cropped</p><p><b>Season</b>: All</p><p><b>Fit Type</b>: Regular Fit</p><p><b>Sheer</b>: No</p><p><b>Closure Type</b>: Drawstring Waist</p><p><b>Material</b>: Polyester</p><p><b>Composition</b>: 100% Polyester</p><p><b>Fabric</b>: Slight Stretch</p><p><b>Care Instructions</b>: Machine wash or professional dry clean</p>,img/Pants/swpants00200824860.jpg,,Size#XS:S:M:L:,31.87,,,,1,1,,,Pants,,Flap Pocket Buckle Cargo Pants,Flap Pocket Buckle Cargo Pants,Flap Pocket Buckle Cargo Pants,,,,,,,,,
BDOSTVR0139,Solid Knot Shorts,,<p><b>Style</b>: Casual</p><p><b>Color</b>: Blue</p><p><b>Pattern Type</b>: Plain</p><p><b>Season</b>: Summer</p><p><b>Type</b>: Wide Leg</p><p><b>Details</b>: Knot</p><p><b>Waist Line</b>: Natural</p><p><b>Fit Type</b>: Regular Fit</p><p><b>Sheer</b>: No</p><p><b>Closure Type</b>: Elastic Waist</p><p><b>Material</b>: Polyester</p><p><b>Composition</b>: 100% Polyester</p><p><b>Fabric</b>: Non-Stretch</p><p><b>Care Instructions</b>: Machine wash or professional dry clean</p>,img/Shorts/rwshorts25210520568.jpg,,Size#S:M:L:,25.4,,,,1,1,,,Shorts,,Solid Knot Shorts,Solid Knot Shorts,Solid Knot Shorts,,,,,,,,,
BDOSTVR0140,Bohemian Mulyilayer Bracelet Leather Flower Alloy Bangle Bracelet Vintage Jewelry for Women,,"<p>
	</p><p>
</p><p>
	 </p><p>Notice:</p>",img/Bracelets/SKUA67225.jpg,,Size#,26.4,,,,1,1,,,Bracelets,,Bohemian Mulyilayer Bracelet Leather Flower Alloy Bangle Bracelet Vintage Jewelry for Women,Bohemian Mulyilayer Bracelet Leather Flower Alloy Bangle Bracelet Vintage Jewelry for Women,Bohemian Mulyilayer Bracelet Leather Flower Alloy Bangle Bracelet Vintage Jewelry for Women,,,,,,,,,
BDOSTVR0141,8mm Stainless Steel Mens Rings Tungsten Carbide Rings Unisex Jewelry Gift for Him Her,,"<p>Type: Finger Ring</p><p>Material: Stainless Steel, Carbon Fiber</p><p>Size(US): US 7 / 8 / 9 / 10 / 11 / 12</p><p>(Please see the size reference for size conversion and detail information.)</p><p>1 x Ring</p>",img/Rings/SKU573625.jpg,,Size#7:8:9:10:11:12:,14.3,,,,1,1,,,Rings,,8mm Stainless Steel Mens Rings Tungsten Carbide Rings Unisex Jewelry Gift for Him Her,8mm Stainless Steel Mens Rings Tungsten Carbide Rings Unisex Jewelry Gift for Him Her,8mm Stainless Steel Mens Rings Tungsten Carbide Rings Unisex Jewelry Gift for Him Her,,,,,,,,,
BDOSTVR0142,Women Cat Pattern Handbag Crossbody Bag,,"<p>Bag Type:Satchel</p><p>Color:Blue, Brown, Grey</p><p>Material:PU</p><p>Style:Casual</p><p>Pattern:Cat</p><p>Hardness:Soft</p>",img/Handbags/SKUC10430.jpg,,Size#M:,59.79,,,,1,1,,,Handbags,,Women Cat Pattern Handbag Crossbody Bag,Women Cat Pattern Handbag Crossbody Bag,Women Cat Pattern Handbag Crossbody Bag,,,,,,,,,
BDOSTVR0143,Men Quick Dry Mesh Super Soft Outdoor Multifunctional Boating Water shoes,,"<p>Color:Black, Blue, Grey</p><p>Upper Material:Mesh</p><p>Outsole Material:Rubber</p><p>Type:Water Shoes</p><p>Function:Soft</p><p>Occasion:Daily, Beach</p><p>Closure Type:Lace-up</p><p>Season:All Season</p><p>Toe Type:Round</p>",img/Sneakers__Athletic/SKUC94631.jpg,,Size#US 6.5:US 7.5:US 8:US 8.5:US 9:US 10:US 10.5:US 11:US 11.5:,49.3,,,,1,1,,,Sneakers & Athletic,,Men Quick Dry Mesh Super Soft Outdoor Multifunctional Boating Water shoes,Men Quick Dry Mesh Super Soft Outdoor Multifunctional Boating Water shoes,Men Quick Dry Mesh Super Soft Outdoor Multifunctional Boating Water shoes,,,,,,,,,
BDOSTVR0144,Large Size Women Casual Flowers Open Toe Platform Slippers,,"<p>Color:Yellow, Black, Pink, Blue</p><p>Heel Type:Platforms</p><p>Toe Type:Opened</p><p>Upper Material:PU</p><p>Outsole Material:Rubber</p><p>Season:Summer</p>",img/Slippers/SKUC99632.jpg,,Size#US 5:US 6:US 7:US 8:US 9:US 10:US 11:US 12:,54.22,,,,1,1,,,Slippers,,Large Size Women Casual Flowers Open Toe Platform Slippers,Large Size Women Casual Flowers Open Toe Platform Slippers,Large Size Women Casual Flowers Open Toe Platform Slippers,,,,,,,,,
