v_sku,v_name,v_short_description,v_description,v_image,v_url,v_attribute,v_price,v_specials_price,v_specials_expire_date,v_date_added,v_in_stock,v_status,v_viewed,v_ordered,v_category_sku,v_sort_order,v_meta_title,v_meta_keywords,v_meta_description,v_brand_filter,v_class_filter,v_color_filter,v_gender_filter,v_material_filter,v_year_filter,v_origin_filter,v_series_filter,v_spec_filter
BJMRNXQ0137,Polka Dot Knot Milkmaid Blouse,,<p><b>Style</b>: Casual</p><p><b>Color</b>: Dusty Blue</p><p><b>Pattern Type</b>: Polka Dot</p><p><b>Length</b>: Crop</p><p><b>Season</b>: Summer</p><p><b>Type</b>: Top</p><p><b>Details</b>: Frill</p><p><b>Details</b>: Knot</p><p><b>Sleeve Type</b>: Puff Sleeve</p><p><b>Sleeve Length</b>: Short Sleeve</p><p><b>Fit Type</b>: Slim Fit</p><p><b>Neckline</b>: Sweetheart</p><p><b>Sheer</b>: No</p><p><b>Placket Type</b>: Pullovers</p><p><b>Material</b>: Cotton Blends</p><p><b>Composition</b>: 65% Cotton</p><p><b>Composition</b>: 35% Polyester</p><p><b>Fabric</b>: Non-Stretch</p><p><b>Care Instructions</b>: Machine wash or professional dry clean</p>,img/Blouses/rwblouse25210512658.jpg,,Size#S:M:L:XL:,27.94,,,,1,1,,,Blouses,,Polka Dot Knot Milkmaid Blouse,Polka Dot Knot Milkmaid Blouse,Polka Dot Knot Milkmaid Blouse,,,,,,,,,
BJMRNXQ0138,Cartoon Graphic Crop Tee,,<p><b>Style</b>: Casual</p><p><b>Color</b>: Baby Pink</p><p><b>Pattern Type</b>: Cartoon</p><p><b>Length</b>: Crop</p><p><b>Season</b>: Summer</p><p><b>Neckline</b>: Round Neck</p><p><b>Sleeve Length</b>: Short Sleeve</p><p><b>Fit Type</b>: Slim Fit</p><p><b>Sleeve Type</b>: Regular Sleeve</p><p><b>Placket Type</b>: Pullovers</p><p><b>Sheer</b>: No</p><p><b>Material</b>: Cotton</p><p><b>Composition</b>: 65% Cotton</p><p><b>Composition</b>: 35% Polyester</p><p><b>Fabric</b>: Slight Stretch</p><p><b>Care Instructions</b>: Machine wash or professional dry clean</p>,img/T___Shirts/rw2106285356958905.jpg,,Size#XS:S:M:L:,31.06,,,,1,1,,,T-Shirts,,Cartoon Graphic Crop Tee,Cartoon Graphic Crop Tee,Cartoon Graphic Crop Tee,,,,,,,,,
BJMRNXQ0139,Shirred Waist Schiffy Shorts,,<p><b>Style</b>: Boho</p><p><b>Color</b>: Beige</p><p><b>Pattern Type</b>: Plain</p><p><b>Type</b>: Straight Leg</p><p><b>Season</b>: Summer</p><p><b>Details</b>: Frill</p><p><b>Details</b>: Eyelet Embroidery</p><p><b>Waist Line</b>: High Waist</p><p><b>Fit Type</b>: Regular Fit</p><p><b>Sheer</b>: No</p><p><b>Closure Type</b>: Elastic Waist</p><p><b>Material</b>: Schiffy</p><p><b>Composition</b>: 100% Cotton</p><p><b>Fabric</b>: Non-Stretch</p><p><b>Care Instructions</b>: Machine wash or professional dry clean</p>,img/Shorts/swshorts07210603960.jpg,,Size#XS:S:M:L:XL:,28.63,,,,1,1,,,Shorts,,Shirred Waist Schiffy Shorts,Shirred Waist Schiffy Shorts,Shirred Waist Schiffy Shorts,,,,,,,,,
BJMRNXQ0140,Vintage Multicolor Beautiful Butterfly Pattern Print Butterfly Braided Gemstone Multi-layer Bracelet,,"<p>Style: Retro </p><p>Type: Bracelet</p><p>Main Color: 4 colors for your choose</p><p>Chain Length: 17cm+5cm/6.69inch+1.97inch</p><p>Weight: About 14g</p><p>Material: Alloy, glass</p><p>1 X Bracelet</p>",img/Bracelets/SKUH11007.jpg,,Size#,22.06,,,,1,1,,,Bracelets,,Vintage Multicolor Beautiful Butterfly Pattern Print Butterfly Braided Gemstone Multi-layer Bracelet,Vintage Multicolor Beautiful Butterfly Pattern Print Butterfly Braided Gemstone Multi-layer Bracelet,Vintage Multicolor Beautiful Butterfly Pattern Print Butterfly Braided Gemstone Multi-layer Bracelet,,,,,,,,,
BJMRNXQ0141,Bohemian Goddess Moon Sun Earrings Gold Rhinestone Ear Drop For Women,,"<p>Style:Bohemian</p><p>Type:Earrings</p><p>Main Color:Gold </p><p>Weight: about 20g</p><p>Material:Zinc Alloy,Rhinestone</p><p>1 Pair of Earrings</p>",img/Earrings/SKUC00940.jpg,,Size#,28.28,,,,1,1,,,Earrings,,Bohemian Goddess Moon Sun Earrings Gold Rhinestone Ear Drop For Women,Bohemian Goddess Moon Sun Earrings Gold Rhinestone Ear Drop For Women,Bohemian Goddess Moon Sun Earrings Gold Rhinestone Ear Drop For Women,,,,,,,,,
BJMRNXQ0142,Women Waterproof Printed Nylon Anti-theft Backpack,,"<p>Color:Black, Red</p><p>Material:Nylon</p><p>Style:Casual</p><p>Decoration:Zipper</p><p>Capacity:4A Magazine</p>",img/Backpack/SKUF37216.jpg,,Size#,57.81,,,,1,1,,,Backpack,,Women Waterproof Printed Nylon Anti-theft Backpack,Women Waterproof Printed Nylon Anti-theft Backpack,Women Waterproof Printed Nylon Anti-theft Backpack,,,,,,,,,
BJMRNXQ0143,Women Caual Opened Toe Hasp Woven Decoration Espadrille Wedges Sandals,,"<p>Color:Black</p><p>Type:Wedges  Sandals</p><p>Closure Type:Hasp</p><p>Heel Type:Wedges Heel</p><p>Heel Height:5-8cm In Heel</p><p>Toe Type:Opened</p><p>Pattern:Other</p><p>Design Element:Woven</p><p>Upper Material:PU</p><p>Style:Casual, Brief</p><p>Outsole Material:Rubber</p><p>Structure:Buckle</p><p>Occasion:Casual</p><p>Function:Hard-wearing</p><p>Season:Summer</p>",img/Sandals/SKUH58798.jpg,,Size#US 5:US 7:US 8:US 9:US 10:,59.98,,,,1,1,,,Sandals,,Women Caual Opened Toe Hasp Woven Decoration Espadrille Wedges Sandals,Women Caual Opened Toe Hasp Woven Decoration Espadrille Wedges Sandals,Women Caual Opened Toe Hasp Woven Decoration Espadrille Wedges Sandals,,,,,,,,,
BJMRNXQ0144,Soft Furry Sole Shoes Non-slip For Women Home Outdoor Slippers Flip Flops,,"<p>Color:Tan, Red, Yellow, Black, Pink, Blue, Grey</p><p>Heel Type:Flat</p><p>Toe Type:Clip Toe</p><p>Outsole Material:Rubber</p><p>Occasion:Home</p><p>Function:Soft</p><p>Season:Summer</p>",img/Slippers/SKUF69195.jpg,,Size#US 5:US 6:US 7:US 8:US 9:US 10:US 11:US 12:US 13:,65.18,,,,1,1,,,Slippers,,Soft Furry Sole Shoes Non-slip For Women Home Outdoor Slippers Flip Flops,Soft Furry Sole Shoes Non-slip For Women Home Outdoor Slippers Flip Flops,Soft Furry Sole Shoes Non-slip For Women Home Outdoor Slippers Flip Flops,,,,,,,,,
BJMRNXQ0145,Tie Dye One Shoulder Crop Top,,<p><b>Style</b>: Casual</p><p><b>Color</b>: Multicolor</p><p><b>Pattern Type</b>: Tie Dye</p><p><b>Length</b>: Crop</p><p><b>Season</b>: Summer</p><p><b>Neckline</b>: One Shoulder</p><p><b>Sleeve Length</b>: Sleeveless</p><p><b>Fit Type</b>: Slim Fit</p><p><b>Placket Type</b>: Pullovers</p><p><b>Sheer</b>: No</p><p><b>Material</b>: Polyester</p><p><b>Composition</b>: 95% Polyester</p><p><b>Composition</b>: 5% Spandex</p><p><b>Fabric</b>: Slight Stretch</p><p><b>Care Instructions</b>: Machine wash or professional dry clean</p>,img/Women_Tops/rwtop25210609190.jpg,,Size#S:M:L:,32.03,,,,1,1,,,Women Tops,,Tie Dye One Shoulder Crop Top,Tie Dye One Shoulder Crop Top,Tie Dye One Shoulder Crop Top,,,,,,,,,
BJMRNXQ0146,Solid Button Front Pearl Blouse,,<p><b>Style</b>: Casual</p><p><b>Color</b>: Beige</p><p><b>Pattern Type</b>: Plain</p><p><b>Length</b>: Long</p><p><b>Season</b>: Spring/Summer</p><p><b>Type</b>: Shirt</p><p><b>Details</b>: Pearls</p><p><b>Details</b>: Button Front</p><p><b>Neckline</b>: Collar</p><p><b>Sleeve Length</b>: Long Sleeve</p><p><b>Fit Type</b>: Regular Fit</p><p><b>Sleeve Type</b>: Regular Sleeve</p><p><b>Sheer</b>: No</p><p><b>Placket Type</b>: Placket</p><p><b>Belt</b>: No</p><p><b>Material</b>: Cotton Blends</p><p><b>Composition</b>: 65% Cotton</p><p><b>Composition</b>: 35% Polyester</p><p><b>Fabric</b>: Non-Stretch</p><p><b>Care Instructions</b>: Machine wash or professional dry clean</p>,img/Blouses/rwblouse25210616985.jpg,,Size#S:M:L:,26.59,,,,1,1,,,Blouses,,Solid Button Front Pearl Blouse,Solid Button Front Pearl Blouse,Solid Button Front Pearl Blouse,,,,,,,,,
BJMRNXQ0147,Letter Graphic Two Tone Oversized Tee,,<p><b>Style</b>: Casual</p><p><b>Color</b>: Multicolor</p><p><b>Pattern Type</b>: Letter</p><p><b>Pattern Type</b>: Colorblock</p><p><b>Length</b>: Regular</p><p><b>Season</b>: Summer</p><p><b>Neckline</b>: Round Neck</p><p><b>Sleeve Length</b>: Short Sleeve</p><p><b>Fit Type</b>: Oversized</p><p><b>Sleeve Type</b>: Drop Shoulder</p><p><b>Placket Type</b>: Pullovers</p><p><b>Sheer</b>: No</p><p><b>Material</b>: Cotton</p><p><b>Composition</b>: 65% Cotton</p><p><b>Composition</b>: 35% Polyester</p><p><b>Fabric</b>: Slight Stretch</p><p><b>Care Instructions</b>: Machine wash or professional dry clean</p><p><b>Style</b>: Casual</p><p><b>Color</b>: Multicolor</p><p><b>Pattern Type</b>: Letter</p><p><b>Pattern Type</b>: Colorblock</p><p><b>Length</b>: Long</p><p><b>Season</b>: Summer</p><p><b>Neckline</b>: Round Neck</p><p><b>Sleeve Length</b>: Short Sleeve</p><p><b>Fit Type</b>: Oversized</p><p><b>Sleeve Type</b>: Drop Shoulder</p><p><b>Placket Type</b>: Pullovers</p><p><b>Sheer</b>: No</p><p><b>Material</b>: Cotton</p><p><b>Composition</b>: 65% Cotton</p><p><b>Composition</b>: 35% Polyester</p><p><b>Fabric</b>: Slight Stretch</p><p><b>Care Instructions</b>: Machine wash or professional dry clean</p><p><b>Style</b>: Casual</p><p><b>Color</b>: Black and White</p><p><b>Pattern Type</b>: Letter</p><p><b>Pattern Type</b>: Colorblock</p><p><b>Length</b>: Long</p><p><b>Length</b>: Regular</p><p><b>Season</b>: Summer</p><p><b>Neckline</b>: Round Neck</p><p><b>Sleeve Length</b>: Short Sleeve</p><p><b>Fit Type</b>: Oversized</p><p><b>Sleeve Type</b>: Drop Shoulder</p><p><b>Placket Type</b>: Pullovers</p><p><b>Sheer</b>: No</p><p><b>Material</b>: Cotton</p><p><b>Composition</b>: 65% Cotton</p><p><b>Composition</b>: 35% Polyester</p><p><b>Fabric</b>: Slight Stretch</p><p><b>Care Instructions</b>: Machine wash or professional dry clean</p><p><b>Style</b>: Casual</p><p><b>Color</b>: Multicolor</p><p><b>Pattern Type</b>: Letter</p><p><b>Pattern Type</b>: Colorblock</p><p><b>Length</b>: Long</p><p><b>Season</b>: Summer</p><p><b>Neckline</b>: Round Neck</p><p><b>Sleeve Length</b>: Short Sleeve</p><p><b>Fit Type</b>: Oversized</p><p><b>Sleeve Type</b>: Drop Shoulder</p><p><b>Placket Type</b>: Pullovers</p><p><b>Sheer</b>: No</p><p><b>Material</b>: Cotton</p><p><b>Composition</b>: 65% Cotton</p><p><b>Composition</b>: 35% Polyester</p><p><b>Fabric</b>: Slight Stretch</p><p><b>Care Instructions</b>: Machine wash or professional dry clean</p>,img/T___Shirts/rwtee03210106552.jpg,,Size#XS:S:M:L:,30.53,,,,1,1,,,T-Shirts,,Letter Graphic Two Tone Oversized Tee,Letter Graphic Two Tone Oversized Tee,Letter Graphic Two Tone Oversized Tee,,,,,,,,,
BJMRNXQ0148,Solid Waffle Knot Shorts,,<p><b>Style</b>: Casual</p><p><b>Color</b>: Light Grey</p><p><b>Pattern Type</b>: Plain</p><p><b>Season</b>: Summer</p><p><b>Type</b>: Track Shorts</p><p><b>Details</b>: Knot</p><p><b>Waist Line</b>: Natural</p><p><b>Fit Type</b>: Regular Fit</p><p><b>Sheer</b>: No</p><p><b>Closure Type</b>: Elastic Waist</p><p><b>Material</b>: Cotton</p><p><b>Composition</b>: 65% Cotton</p><p><b>Composition</b>: 35% Polyester</p><p><b>Fabric</b>: Slight Stretch</p><p><b>Care Instructions</b>: Machine wash or professional dry clean</p>,img/Shorts/rwshorts25210521969.jpg,,Size#S:M:L:,28.68,,,,1,1,,,Shorts,,Solid Waffle Knot Shorts,Solid Waffle Knot Shorts,Solid Waffle Knot Shorts,,,,,,,,,
BJMRNXQ0149,Vintage Multicolor Beautiful Opal Bracelet Temperament Multi-layer Tassel Bracelet,,<p>Style: Retro </p><p>Type: Bracelet</p><p>Chain Length: 17cm/6.69inch</p><p>Weight: About 51g</p><p>Material: Alloy</p><p>1 X Bracelet</p>,img/Bracelets/SKUH02228.jpg,,Size#,12.45,,,,1,1,,,Bracelets,,Vintage Multicolor Beautiful Opal Bracelet Temperament Multi-layer Tassel Bracelet,Vintage Multicolor Beautiful Opal Bracelet Temperament Multi-layer Tassel Bracelet,Vintage Multicolor Beautiful Opal Bracelet Temperament Multi-layer Tassel Bracelet,,,,,,,,,
BJMRNXQ0150,Vintage Plum Blossom Women Earrings Agate Synthetic Crystal Pendant Earring,,"<p>Style: Vintage </p><p>Type: Earring</p><p>Color: Green+Red</p><p>Weight: 8.8g</p><p>Size: About 4.85*1.85 cm / 1.91*0.73 in</p><p>Material: Crystal, Agate, Silver Plated</p><p>1 x Earring</p>",img/Earrings/SKUG38458.jpg,,Size#,23.99,,,,1,1,,,Earrings,,Vintage Plum Blossom Women Earrings Agate Synthetic Crystal Pendant Earring,Vintage Plum Blossom Women Earrings Agate Synthetic Crystal Pendant Earring,Vintage Plum Blossom Women Earrings Agate Synthetic Crystal Pendant Earring,,,,,,,,,
BJMRNXQ0151,Women Multi-carry Multi-pocket PU Leather Backpack Crossbody Bag Shoulder Bag,,"<p>Color:Blue, Black, Pink, Red</p><p>Material:PU</p><p>Style:Casual</p><p>Pattern:Solid</p><p>Capacity:4A Magazine</p>",img/Backpack/SKUH48261.jpg,,Size#,61.35,,,,1,1,,,Backpack,,Women Multi-carry Multi-pocket PU Leather Backpack Crossbody Bag Shoulder Bag,Women Multi-carry Multi-pocket PU Leather Backpack Crossbody Bag Shoulder Bag,Women Multi-carry Multi-pocket PU Leather Backpack Crossbody Bag Shoulder Bag,,,,,,,,,
BJMRNXQ0152,Large Size Women Casual Strappy Zipper Clip Toe Sandals,,"<p>Color:Black, Brown, White</p><p>Closure Type:Zipper</p><p>Heel Type:Flat</p><p>Heel Height:1-3cm In Flat</p><p>Toe Type:Clip Toe</p><p>Pattern:Solid</p><p>Design Element:Simple</p><p>Upper Material:PU</p><p>Style:Casual</p><p>Outsole Material:Rubber</p><p>Structure:Clip Toe, Back-zip</p><p>Occasion:Daily</p><p>Decoration:Hollow Out</p><p>Function:Soft</p><p>Season:Summer</p>",img/Sandals/SKUB93217.jpg,,Size#US 5:US 6:US 7:US 8:US 9:US 10:US 11:US 12:,49.56,,,,1,1,,,Sandals,,Large Size Women Casual Strappy Zipper Clip Toe Sandals,Large Size Women Casual Strappy Zipper Clip Toe Sandals,Large Size Women Casual Strappy Zipper Clip Toe Sandals,,,,,,,,,
BJMRNXQ0153,Women Elegant Brief Woven Cross Strap Square Toe Opend Cone Heeled Slippers,,"<p>Color:Green, Black, White</p><p>Type:Stripe Slippers</p><p>Closure Type:Slip-On</p><p>Heel Type:Cone Heel</p><p>Heel Height:5-8cm In Heel</p><p>Toe Type:Square</p><p>Pattern:Solid</p><p>Design Element:Woven</p><p>Upper Material:PU</p><p>Style:Casual</p><p>Outsole Material:Rubber</p><p>Structure:Cross Strap</p><p>Occasion:Casual</p><p>Function:Antiskid, Hard-wearing</p><p>Season:Summer, Spring</p>",img/Slippers/SKUH29726.jpg,,Size#US 5:US 6:US 7:US 8:US 9:US 10:,65.83,,,,1,1,,,Slippers,,Women Elegant Brief Woven Cross Strap Square Toe Opend Cone Heeled Slippers,Women Elegant Brief Woven Cross Strap Square Toe Opend Cone Heeled Slippers,Women Elegant Brief Woven Cross Strap Square Toe Opend Cone Heeled Slippers,,,,,,,,,
BJMRNXQ0154,Solid Frill Crop Bardot Top,,<p><b>Style</b>: Boho</p><p><b>Color</b>: Khaki</p><p><b>Pattern Type</b>: Plain</p><p><b>Length</b>: Crop</p><p><b>Season</b>: Summer</p><p><b>Details</b>: Frill</p><p><b>Sleeve Type</b>: Flounce Sleeve</p><p><b>Neckline</b>: Off the Shoulder</p><p><b>Fit Type</b>: Regular Fit</p><p><b>Sleeve Length</b>: Short Sleeve</p><p><b>Placket Type</b>: Pullovers</p><p><b>Sheer</b>: No</p><p><b>Material</b>: Polyester</p><p><b>Composition</b>: 90% Polyester</p><p><b>Composition</b>: 10% Spandex</p><p><b>Fabric</b>: Slight Stretch</p><p><b>Care Instructions</b>: Machine wash or professional dry clean</p><p><b>Style</b>: Casual</p><p><b>Color</b>: Black</p><p><b>Pattern Type</b>: Plain</p><p><b>Length</b>: Crop</p><p><b>Season</b>: Summer</p><p><b>Details</b>: Frill</p><p><b>Neckline</b>: Off the Shoulder</p><p><b>Sleeve Type</b>: Puff Sleeve</p><p><b>Fit Type</b>: Regular Fit</p><p><b>Sleeve Length</b>: Short Sleeve</p><p><b>Placket Type</b>: Pullovers</p><p><b>Sheer</b>: No</p><p><b>Material</b>: Polyester</p><p><b>Composition</b>: 90% Polyester</p><p><b>Composition</b>: 10% Spandex</p><p><b>Fabric</b>: Slight Stretch</p><p><b>Care Instructions</b>: Machine wash or professional dry clean</p>,img/Women_Tops/swtop30210409275.jpg,,Size#S:M:L:XL:,22.71,,,,1,1,,,Women Tops,,Solid Frill Crop Bardot Top,Solid Frill Crop Bardot Top,Solid Frill Crop Bardot Top,,,,,,,,,
BJMRNXQ0155,Frill Neck Ruffle Armhole Botanical Print Top,,<p><b>Style</b>: Cute</p><p><b>Color</b>: Green</p><p><b>Pattern Type</b>: Floral</p><p><b>Pattern Type</b>: All Over Print</p><p><b>Length</b>: Regular</p><p><b>Season</b>: Summer</p><p><b>Type</b>: Top</p><p><b>Details</b>: Frill</p><p><b>Sleeve Type</b>: Butterfly Sleeve</p><p><b>Sleeve Length</b>: Cap Sleeve</p><p><b>Fit Type</b>: Regular Fit</p><p><b>Neckline</b>: Round Neck</p><p><b>Sheer</b>: No</p><p><b>Placket Type</b>: Pullovers</p><p><b>Material</b>: Polyester</p><p><b>Composition</b>: 100% Polyester</p><p><b>Fabric</b>: Non-Stretch</p><p><b>Care Instructions</b>: Machine wash or professional dry clean</p>,img/Blouses/swblouse07200429409.jpg,,Size#XS:S:M:L:XL:,30.39,,,,1,1,,,Blouses,,Frill Neck Ruffle Armhole Botanical Print Top,Frill Neck Ruffle Armhole Botanical Print Top,Frill Neck Ruffle Armhole Botanical Print Top,,,,,,,,,
BJMRNXQ0156,Graphic Print Tee,,<p><b>Style</b>: Casual</p><p><b>Color</b>: Yellow</p><p><b>Pattern Type</b>: Graphic</p><p><b>Length</b>: Regular</p><p><b>Season</b>: Summer</p><p><b>Neckline</b>: Round Neck</p><p><b>Sleeve Length</b>: Short Sleeve</p><p><b>Fit Type</b>: Regular Fit</p><p><b>Sleeve Type</b>: Regular Sleeve</p><p><b>Placket Type</b>: Pullovers</p><p><b>Sheer</b>: No</p><p><b>Material</b>: Cotton</p><p><b>Composition</b>: 100% Cotton</p><p><b>Fabric</b>: Slight Stretch</p><p><b>Care Instructions</b>: Machine wash or professional dry clean</p><p><b>Style</b>: Casual</p><p><b>Color</b>: Baby Blue</p><p><b>Pattern Type</b>: Graphic</p><p><b>Length</b>: Regular</p><p><b>Season</b>: Summer</p><p><b>Neckline</b>: Round Neck</p><p><b>Sleeve Length</b>: Short Sleeve</p><p><b>Fit Type</b>: Regular Fit</p><p><b>Sleeve Type</b>: Regular Sleeve</p><p><b>Placket Type</b>: Pullovers</p><p><b>Sheer</b>: No</p><p><b>Material</b>: Cotton</p><p><b>Composition</b>: 100% Cotton</p><p><b>Fabric</b>: Slight Stretch</p><p><b>Care Instructions</b>: Machine wash or professional dry clean</p><p><b>Style</b>: Casual</p><p><b>Color</b>: Lilac Purple</p><p><b>Pattern Type</b>: Graphic</p><p><b>Length</b>: Regular</p><p><b>Season</b>: Summer</p><p><b>Neckline</b>: Round Neck</p><p><b>Sleeve Length</b>: Short Sleeve</p><p><b>Fit Type</b>: Regular Fit</p><p><b>Sleeve Type</b>: Regular Sleeve</p><p><b>Placket Type</b>: Pullovers</p><p><b>Sheer</b>: No</p><p><b>Material</b>: Cotton</p><p><b>Composition</b>: 100% Cotton</p><p><b>Fabric</b>: Slight Stretch</p><p><b>Care Instructions</b>: Machine wash or professional dry clean</p><p><b>Style</b>: Casual</p><p><b>Color</b>: White</p><p><b>Pattern Type</b>: Graphic</p><p><b>Length</b>: Regular</p><p><b>Season</b>: Summer</p><p><b>Neckline</b>: Round Neck</p><p><b>Sleeve Length</b>: Short Sleeve</p><p><b>Fit Type</b>: Regular Fit</p><p><b>Sleeve Type</b>: Regular Sleeve</p><p><b>Placket Type</b>: Pullovers</p><p><b>Sheer</b>: No</p><p><b>Material</b>: Cotton</p><p><b>Composition</b>: 100% Cotton</p><p><b>Fabric</b>: Slight Stretch</p><p><b>Care Instructions</b>: Machine wash or professional dry clean</p>,img/T___Shirts/rwtee25210510282.jpg,,Size#S:M:L:XL:,28.7,,,,1,1,,,T-Shirts,,Graphic Print Tee,Graphic Print Tee,Graphic Print Tee,,,,,,,,,
BJMRNXQ0157,Tied Paperbag Waist Cuffed Shorts,,<p><b>Style</b>: Casual</p><p><b>Color</b>: Grey</p><p><b>Pattern Type</b>: Plain</p><p><b>Season</b>: Summer</p><p><b>Type</b>: Wide Leg</p><p><b>Details</b>: Frill</p><p><b>Details</b>: Knot</p><p><b>Details</b>: Paper Bag Waist</p><p><b>Waist Line</b>: High Waist</p><p><b>Fit Type</b>: Regular Fit</p><p><b>Sheer</b>: No</p><p><b>Closure Type</b>: Elastic Waist</p><p><b>Material</b>: Polyester</p><p><b>Composition</b>: 57% Polyester</p><p><b>Composition</b>: 43% Cotton</p><p><b>Fabric</b>: Non-Stretch</p><p><b>Care Instructions</b>: Machine wash or professional dry clean</p>,img/Shorts/swshorts07200424025.jpg,,Size#XS:S:M:L:,28.65,,,,1,1,,,Shorts,,Tied Paperbag Waist Cuffed Shorts,Tied Paperbag Waist Cuffed Shorts,Tied Paperbag Waist Cuffed Shorts,,,,,,,,,
BJMRNXQ0158,Punk Unisex Bracelet Leather Beads Health Bracelet for Her Him,,"<p>Style: Punk Unisex Bracelet</p><p>Material: Stainless Steel, Beads, Leather</p><p>Color: Brown, Black</p><p>Weight: about 23g</p><p>Chain Length: about 21cm / 8.27'</p><p>1 x Bracelet</p>",img/Bracelets/SKU563677.jpg,,Size#,23.66,,,,1,1,,,Bracelets,,Punk Unisex Bracelet Leather Beads Health Bracelet for Her Him,Punk Unisex Bracelet Leather Beads Health Bracelet for Her Him,Punk Unisex Bracelet Leather Beads Health Bracelet for Her Him,,,,,,,,,
BJMRNXQ0159,Elegant Pink Flower Womens Cuff Earrings Fashion Silver Gold Color Piercing Clip Earrings,,"<p>Style: Elegant</p><p>Type: Ear Cuff</p><p>Main Color: Silver, Gold</p><p>Weight: About 10g</p><p>Size: About 4.4cm x 2cm / 1.73' x 0.79'</p><p>Material: Zinc Alloy, Rhinestone</p><p>1 Pair of Earrings</p>",img/Earrings/SKU986816.jpg,,Size#,25.02,,,,1,1,,,Earrings,,Elegant Pink Flower Womens Cuff Earrings Fashion Silver Gold Color Piercing Clip Earrings,Elegant Pink Flower Womens Cuff Earrings Fashion Silver Gold Color Piercing Clip Earrings,Elegant Pink Flower Womens Cuff Earrings Fashion Silver Gold Color Piercing Clip Earrings,,,,,,,,,
BJMRNXQ0160,Women Ethnic Sequined Embroidered Peacock Anti-theft Backpack,,"<p>Color:Blue, Black</p><p>Material:Canvas</p><p>Pattern:Ethnic Pattern</p><p>Capacity:4A Magazine</p>",img/Backpack/SKUG50677.jpg,,Size#,66.46,,,,1,1,,,Backpack,,Women Ethnic Sequined Embroidered Peacock Anti-theft Backpack,Women Ethnic Sequined Embroidered Peacock Anti-theft Backpack,Women Ethnic Sequined Embroidered Peacock Anti-theft Backpack,,,,,,,,,
BJMRNXQ0161,SOCOFY Retro Floral Printed Side Cut-out Slip On Wood Mules Clogs Comfy Wearable Low Heel Sandals For Easter Gifts,,"<p>Color:Black</p><p>Type:Clogs Sandals</p><p>Closure Type:Slip-On</p><p>Heel Type:Platforms</p><p>Heel Height:3-5cm In Low Heel</p><p>Toe Type:Closed Toe</p><p>Pattern:Floral</p><p>Design Element:Hollow out, Print</p><p>Upper Material:PU</p><p>Style:Casual, Retro</p><p>Outsole Material:PU</p><p>Structure:Closed Toe, Slip-On</p><p>Occasion:Daily</p><p>Decoration:Flower, Hollow Out</p><p>Function:Hard-wearing</p><p>Season:Spring&Summer</p>",img/Sandals/SKUH12819.jpg,,Size#US 5:US 6:US 7:US 8:US 9.5:US 10.5:,63.8,,,,1,1,,,Sandals,,SOCOFY Retro Floral Printed Side Cut-out Slip On Wood Mules Clogs Comfy Wearable Low Heel Sandals For Easter Gifts,SOCOFY Retro Floral Printed Side Cut-out Slip On Wood Mules Clogs Comfy Wearable Low Heel Sandals For Easter Gifts,SOCOFY Retro Floral Printed Side Cut-out Slip On Wood Mules Clogs Comfy Wearable Low Heel Sandals For Easter Gifts,,,,,,,,,
BJMRNXQ0162,Plus Size Women Casual Orthopedic Bunion Corrector Clip Toe Wedges Sandals,,<p>Color:Blue</p><p>Heel Type:Wedges Heel</p><p>Toe Type:Clip Toe</p><p>Upper Material:PU</p><p>Outsole Material:PU</p><p>Season:Summer</p>,img/Slippers/SKUF40310.jpg,,Size#US 5:US 6:US 7:US 8:US 9:US 10:US 11:US 12:,49.07,,,,1,1,,,Slippers,,Plus Size Women Casual Orthopedic Bunion Corrector Clip Toe Wedges Sandals,Plus Size Women Casual Orthopedic Bunion Corrector Clip Toe Wedges Sandals,Plus Size Women Casual Orthopedic Bunion Corrector Clip Toe Wedges Sandals,,,,,,,,,
BJMRNXQ0163,Lace Tie Front Top,,<p><b>Style</b>: Sexy</p><p><b>Color</b>: Khaki</p><p><b>Length</b>: Crop</p><p><b>Season</b>: Summer</p><p><b>Details</b>: Tie Front</p><p><b>Fit Type</b>: Regular Fit</p><p><b>Sleeve Length</b>: Short Sleeve</p><p><b>Neckline</b>: V neck</p><p><b>Sleeve Type</b>: Regular Sleeve</p><p><b>Placket Type</b>: Placket</p><p><b>Sheer</b>: No</p><p><b>Material</b>: Mesh</p><p><b>Composition</b>: 65% Polyester</p><p><b>Composition</b>: 30% Cotton</p><p><b>Composition</b>: 5% Elastane</p><p><b>Fabric</b>: Slight Stretch</p><p><b>Care Instructions</b>: Machine wash or professional dry clean</p>,img/Women_Tops/rwtop25210618592.jpg,,Size#S:M:L:,27.98,,,,1,1,,,Women Tops,,Lace Tie Front Top,Lace Tie Front Top,Lace Tie Front Top,,,,,,,,,
BJMRNXQ0164,Tartan Oversized Shirt,,<p><b>Style</b>: Preppy</p><p><b>Color</b>: Multicolor</p><p><b>Pattern Type</b>: Tartan</p><p><b>Length</b>: Long</p><p><b>Season</b>: Spring/Fall</p><p><b>Type</b>: Shirt</p><p><b>Details</b>: Button Front</p><p><b>Neckline</b>: Collar</p><p><b>Sleeve Length</b>: Long Sleeve</p><p><b>Fit Type</b>: Oversized</p><p><b>Sleeve Type</b>: Drop Shoulder</p><p><b>Sheer</b>: No</p><p><b>Placket Type</b>: Placket</p><p><b>Material</b>: Polyester</p><p><b>Composition</b>: 65% Polyester</p><p><b>Composition</b>: 35% Cotton</p><p><b>Fabric</b>: Non-Stretch</p><p><b>Care Instructions</b>: Machine wash or professional dry clean</p>,img/Blouses/rwblouse01200925848.jpg,,Size#XS:S:M:L:XL:,30.71,,,,1,1,,,Blouses,,Tartan Oversized Shirt,Tartan Oversized Shirt,Tartan Oversized Shirt,,,,,,,,,
