v_sku,v_name,v_short_description,v_description,v_image,v_url,v_attribute,v_price,v_specials_price,v_specials_expire_date,v_date_added,v_in_stock,v_status,v_viewed,v_ordered,v_category_sku,v_sort_order,v_meta_title,v_meta_keywords,v_meta_description,v_brand_filter,v_class_filter,v_color_filter,v_gender_filter,v_material_filter,v_year_filter,v_origin_filter,v_series_filter,v_spec_filter
BUNXYPW0137,Plaid Button Front Drawstring Blouse,,<p><b>Style</b>: Preppy</p><p><b>Color</b>: Multicolor</p><p><b>Pattern Type</b>: Plaid</p><p><b>Length</b>: Regular</p><p><b>Season</b>: Spring/Fall</p><p><b>Type</b>: Shirt</p><p><b>Details</b>: Drawstring</p><p><b>Details</b>: Pocket</p><p><b>Details</b>: Button Front</p><p><b>Neckline</b>: Hooded</p><p><b>Sleeve Length</b>: Long Sleeve</p><p><b>Fit Type</b>: Regular Fit</p><p><b>Sleeve Type</b>: Drop Shoulder</p><p><b>Sheer</b>: No</p><p><b>Placket Type</b>: Placket</p><p><b>Belt</b>: No</p><p><b>Body</b>: Unlined</p><p><b>Material</b>: Cotton</p><p><b>Composition</b>: 65% Cotton</p><p><b>Composition</b>: 35% Polyester</p><p><b>Fabric</b>: Non-Stretch</p><p><b>Care Instructions</b>: Machine wash or professional dry clean</p>,img/Blouses/rwblouse00201110797.jpg,,Size#S:M:L:XL:,27.76,,,,1,1,,,Blouses,,Plaid Button Front Drawstring Blouse,Plaid Button Front Drawstring Blouse,Plaid Button Front Drawstring Blouse,,,,,,,,,
BUNXYPW0138,Elastic Waist Flare Leg Marled Pants,,<p><b>Style</b>: Elegant</p><p><b>Color</b>: Grey</p><p><b>Pattern Type</b>: Plain</p><p><b>Length</b>: Long</p><p><b>Type</b>: Flare Leg</p><p><b>Season</b>: Spring/Summer/Fall</p><p><b>Waist Line</b>: Natural</p><p><b>Fit Type</b>: Regular Fit</p><p><b>Sheer</b>: No</p><p><b>Closure Type</b>: Elastic Waist</p><p><b>Material</b>: Polyester</p><p><b>Composition</b>: 95% Polyester</p><p><b>Composition</b>: 5% Spandex</p><p><b>Fabric</b>: Slight Stretch</p><p><b>Care Instructions</b>: Machine wash or professional dry clean</p>,img/Pants/swpants07201223973.jpg,,Size#XS:S:M:L:XL:,25.59,,,,1,1,,,Pants,,Elastic Waist Flare Leg Marled Pants,Elastic Waist Flare Leg Marled Pants,Elastic Waist Flare Leg Marled Pants,,,,,,,,,
BUNXYPW0139,Letter Tennis Racket Graphic Crop Sweatshirt,,<p><b>Style</b>: Casual</p><p><b>Color</b>: Mocha Brown</p><p><b>Pattern Type</b>: Letter</p><p><b>Length</b>: Crop</p><p><b>Season</b>: Spring/Summer</p><p><b>Sleeve Length</b>: Long Sleeve</p><p><b>Neckline</b>: Round Neck</p><p><b>Fit Type</b>: Oversized</p><p><b>Sleeve Type</b>: Drop Shoulder</p><p><b>Placket Type</b>: Pullovers</p><p><b>Sheer</b>: No</p><p><b>Material</b>: Polyester</p><p><b>Composition</b>: 100% Polyester</p><p><b>Fabric</b>: Non-Stretch</p><p><b>Care Instructions</b>: Machine wash or professional dry clean</p>,img/T___Shirts/rwtee25210608619.jpg,,Size#S:M:L:,23.81,,,,1,1,,,T-Shirts,,Letter Tennis Racket Graphic Crop Sweatshirt,Letter Tennis Racket Graphic Crop Sweatshirt,Letter Tennis Racket Graphic Crop Sweatshirt,,,,,,,,,
BUNXYPW0140,Heart Pendant Necklace,,<p><b>Details</b>: Heart</p><p><b>Material</b>: Metal</p><p><b>Type</b>: Pendant Necklaces</p><p><b>Color</b>: Gold</p><p><b>Metal Color</b>: Gold</p><p><b>Style</b>: Fashionable</p>,img/Pendant_Necklaces/rwneck18210519189.jpg,,Size#,11.41,,,,1,1,,,Pendant Necklaces,,Heart Pendant Necklace,Heart Pendant Necklace,Heart Pendant Necklace,,,,,,,,,
BUNXYPW0141,925 Sterling Silver Vintage Earrings Magnolia Long Flower Dangle Earrings Ethnic Jewelry for Women,,"<p>Style: Vintage</p><p>
	Type: Dangle Earrings</p><p>Main Color: Silver</p><p>Weight: About 4.5g</p><p>Size: About 5.3cm x 2cm / 2.08' x 0.78'</p><p>Material: S925 Silver,</p><p> Platinum Plating, Gold Plating</p><p>1 Pair of Earrings</p>",img/Earrings/SKU534053.jpg,,Size#,11.54,,,,1,1,,,Earrings,,925 Sterling Silver Vintage Earrings Magnolia Long Flower Dangle Earrings Ethnic Jewelry for Women,925 Sterling Silver Vintage Earrings Magnolia Long Flower Dangle Earrings Ethnic Jewelry for Women,925 Sterling Silver Vintage Earrings Magnolia Long Flower Dangle Earrings Ethnic Jewelry for Women,,,,,,,,,
BUNXYPW0142,IPRee Oxford Waterproof Card Holder Multifunctional Travel Passport Cover Storage Wallet,,<p>Color:Multicolor</p>,img/Wallets/SKU741344.jpg,,Size#,67.11,,,,1,1,,,Wallets,,IPRee Oxford Waterproof Card Holder Multifunctional Travel Passport Cover Storage Wallet,IPRee Oxford Waterproof Card Holder Multifunctional Travel Passport Cover Storage Wallet,IPRee Oxford Waterproof Card Holder Multifunctional Travel Passport Cover Storage Wallet,,,,,,,,,
BUNXYPW0143,Women Casual Mesh Breathable Chunky Heel Hollow Out Peep-toe Pumps Shoes,,"<p>Color:Yellow, Black</p><p>Type:Peep-toe Pumps shoes</p><p>Closure Type:Back-zip</p><p>Heel Type:Chunky Heel, Block Heel</p><p>Heel Height:3-5cm In Low Heel</p><p>Toe Type:Round</p><p>Pattern:Leopard, Solid, Joint</p><p>Design Element:Hollow out, Fishnet</p><p>Upper Material:Mesh</p><p>Style:Casual, Stylish</p><p>Outsole Material:Rubber</p><p>Structure:Slip-On</p><p>Occasion:Casual</p><p>Function:Breathable</p><p>Season:Summer, Spring</p>",img/Heels/SKUG97724.jpg,,Size#US 5:US 6:US 7:US 8:US 9:US 10:US 11:US 12:,52.82,,,,1,1,,,Heels,,Women Casual Mesh Breathable Chunky Heel Hollow Out Peep-toe Pumps Shoes,Women Casual Mesh Breathable Chunky Heel Hollow Out Peep-toe Pumps Shoes,Women Casual Mesh Breathable Chunky Heel Hollow Out Peep-toe Pumps Shoes,,,,,,,,,
BUNXYPW0144,Women Casual Transparent Sequined Platform Strappy Sandals,,"<p>Color:Black, White</p><p>Closure Type:Lace-up</p><p>Heel Type:Platforms</p><p>Heel Height:3-5cm In Low Heel</p><p>Toe Type:Opened, Round</p><p>Pattern:Solid</p><p>Design Element:Rhinestone</p><p>Upper Material:PU</p><p>Style:Casual</p><p>Outsole Material:PU</p><p>Structure:Strappy</p><p>Occasion:Daily</p><p>Decoration:Crystals</p><p>Function:Hard-wearing</p><p>Season:Summer</p>",img/Sandals/SKUF33414.jpg,,Size#US 5:US 6:US 7:US 8:US 9:US 10:US 11:US 12:,51.15,,,,1,1,,,Sandals,,Women Casual Transparent Sequined Platform Strappy Sandals,Women Casual Transparent Sequined Platform Strappy Sandals,Women Casual Transparent Sequined Platform Strappy Sandals,,,,,,,,,
BUNXYPW0145,Solid Asymmetrical Hem Mini Skirt,,<p><b>Style</b>: Casual</p><p><b>Color</b>: Orange</p><p><b>Pattern Type</b>: Plain</p><p><b>Length</b>: Mini</p><p><b>Type</b>: Bodycon</p><p><b>Season</b>: Summer</p><p><b>Details</b>: Split</p><p><b>Details</b>: Rib-Knit</p><p><b>Waist Line</b>: High Waist</p><p><b>Sheer</b>: No</p><p><b>Material</b>: Polyester</p><p><b>Composition</b>: 66% Polyester</p><p><b>Composition</b>: 29% Cotton</p><p><b>Composition</b>: 5% Elastane</p><p><b>Fabric</b>: Slight Stretch</p><p><b>Care Instructions</b>: Machine wash or professional dry clean</p>,img/Skirts/swskirt07210605039.jpg,,Size#XS:S:M:L:XL:,30.17,,,,1,1,,,Skirts,,Solid Asymmetrical Hem Mini Skirt,Solid Asymmetrical Hem Mini Skirt,Solid Asymmetrical Hem Mini Skirt,,,,,,,,,
BUNXYPW0146,ROMWE X Vincenttrinidadart Wave Graphic Button Front Shirt,,<p><b>Style</b>: Casual</p><p><b>Color</b>: Multicolor</p><p><b>Pattern Type</b>: Graphic</p><p><b>Length</b>: Regular</p><p><b>Season</b>: Summer</p><p><b>Type</b>: Shirt</p><p><b>Details</b>: Button Front</p><p><b>Neckline</b>: Collar</p><p><b>Fit Type</b>: Regular Fit</p><p><b>Sleeve Length</b>: Short Sleeve</p><p><b>Sleeve Type</b>: Regular Sleeve</p><p><b>Sheer</b>: No</p><p><b>Placket Type</b>: Placket</p><p><b>Material</b>: Polyester</p><p><b>Composition</b>: 100% Polyester</p><p><b>Fabric</b>: Non-Stretch</p><p><b>Care Instructions</b>: Machine wash or professional dry clean</p><p><b>Style</b>: Casual</p><p><b>Color</b>: Multicolor</p><p><b>Pattern Type</b>: Graphic</p><p><b>Length</b>: Regular</p><p><b>Season</b>: Summer</p><p><b>Type</b>: Shirt</p><p><b>Details</b>: Button Front</p><p><b>Neckline</b>: Collar</p><p><b>Fit Type</b>: Regular Fit</p><p><b>Sleeve Length</b>: Short Sleeve</p><p><b>Sleeve Type</b>: Drop Shoulder</p><p><b>Sheer</b>: No</p><p><b>Placket Type</b>: Placket</p><p><b>Material</b>: Polyester</p><p><b>Composition</b>: 100% Polyester</p><p><b>Fabric</b>: Non-Stretch</p><p><b>Care Instructions</b>: Machine wash or professional dry clean</p>,img/Blouses/rwblouse25210518432.jpg,,Size#S:M:L:,31.8,,,,1,1,,,Blouses,,ROMWE X Vincenttrinidadart Wave Graphic Button Front Shirt,ROMWE X Vincenttrinidadart Wave Graphic Button Front Shirt,ROMWE X Vincenttrinidadart Wave Graphic Button Front Shirt,,,,,,,,,
BUNXYPW0147,Floral Print Straight Pants,,<p><b>Style</b>: Boho</p><p><b>Color</b>: Multicolor</p><p><b>Pattern Type</b>: Floral</p><p><b>Length</b>: Long</p><p><b>Type</b>: Straight Leg</p><p><b>Season</b>: Spring/Summer/Fall</p><p><b>Details</b>: Belted</p><p><b>Waist Line</b>: High Waist</p><p><b>Fit Type</b>: Regular Fit</p><p><b>Sheer</b>: No</p><p><b>Belt</b>: Yes</p><p><b>Material</b>: Polyester</p><p><b>Composition</b>: 100% Polyester</p><p><b>Fabric</b>: Non-Stretch</p><p><b>Care Instructions</b>: Machine wash or professional dry clean</p>,img/Pants/swpants44201228193.jpg,,Size#XS:S:M:L:,23.64,,,,1,1,,,Pants,,Floral Print Straight Pants,Floral Print Straight Pants,Floral Print Straight Pants,,,,,,,,,
BUNXYPW0148,ROMWE X Betsydoodles Milk Box Graphic Crop Tee,,<p><b>Style</b>: Cute</p><p><b>Color</b>: Blue and White</p><p><b>Pattern Type</b>: Colorblock</p><p><b>Pattern Type</b>: Graphic</p><p><b>Length</b>: Crop</p><p><b>Season</b>: Summer</p><p><b>Sleeve Type</b>: Raglan Sleeve</p><p><b>Neckline</b>: Round Neck</p><p><b>Sleeve Length</b>: Short Sleeve</p><p><b>Fit Type</b>: Regular Fit</p><p><b>Placket Type</b>: Pullovers</p><p><b>Sheer</b>: No</p><p><b>Material</b>: Polyester</p><p><b>Composition</b>: 80% Polyester</p><p><b>Composition</b>: 20% Cotton</p><p><b>Fabric</b>: Medium Stretch</p><p><b>Care Instructions</b>: Machine wash or professional dry clean</p>,img/T___Shirts/rwtee25210426697.jpg,,Size#XS:S:M:L:,32.3,,,,1,1,,,T-Shirts,,ROMWE X Betsydoodles Milk Box Graphic Crop Tee,ROMWE X Betsydoodles Milk Box Graphic Crop Tee,ROMWE X Betsydoodles Milk Box Graphic Crop Tee,,,,,,,,,
BUNXYPW0149,Rhinestone Pendant Necklace,,<p><b>Type</b>: Pendant Necklaces</p><p><b>Details</b>: Rhinestone</p><p><b>Material</b>: Rhinestone</p><p><b>Material</b>: Alloy</p><p><b>Color</b>: Gold</p><p><b>Metal Color</b>: Gold</p><p><b>Style</b>: Casual</p>,img/Pendant_Necklaces/rwneck18210428586.jpg,,Size#,19.72,,,,1,1,,,Pendant Necklaces,,Rhinestone Pendant Necklace,Rhinestone Pendant Necklace,Rhinestone Pendant Necklace,,,,,,,,,
BUNXYPW0150,Vintage Round-shape Inlaid Opal Alloy Earrings,,"<p>Style: Vintage</p><p>Type: Earrings</p><p>Color: Silver</p><p>Weight: 20 g</p><p>Size: About 6*2.5 cm / 2.36*0.98 in</p><p>Material: Alloy,Opal</p><p>Package Includes:</p><p>1 x Earrings</p><p>Notice:</p>",img/Earrings/SKUI28399.jpg,,Size#,24.32,,,,1,1,,,Earrings,,Vintage Round-shape Inlaid Opal Alloy Earrings,Vintage Round-shape Inlaid Opal Alloy Earrings,Vintage Round-shape Inlaid Opal Alloy Earrings,,,,,,,,,
BUNXYPW0151,Oxford Cloth Card Holder Minimalist Short Travel Ticket Cash Wallet Card Separate Passport Pack,,"<p>Color:Orange, Purple, Rose, Dark Blue</p>",img/Wallets/SKUA67852.jpg,,Size#,58.32,,,,1,1,,,Wallets,,Oxford Cloth Card Holder Minimalist Short Travel Ticket Cash Wallet Card Separate Passport Pack,Oxford Cloth Card Holder Minimalist Short Travel Ticket Cash Wallet Card Separate Passport Pack,Oxford Cloth Card Holder Minimalist Short Travel Ticket Cash Wallet Card Separate Passport Pack,,,,,,,,,
BUNXYPW0152,Women Casual Corduroy Chunky Heel Peep-toe Pumps Shoes,,"<p>Color:Black, Blue</p><p>Type:Peep-toe Pumps shoes</p><p>Closure Type:Back-zip</p><p>Heel Type:Chunky Heel, Block Heel</p><p>Heel Height:3-5cm In Low Heel</p><p>Toe Type:Round</p><p>Pattern:Other, Solid</p><p>Design Element:Fishnet</p><p>Upper Material:Mesh</p><p>Style:Casual, Brief</p><p>Outsole Material:Rubber</p><p>Structure:Slip-On</p><p>Occasion:Casual, Special occasion</p><p>Function:Breathable, Antiskid, Hard-wearing</p><p>Season:Summer, Spring</p>",img/Heels/SKUG97722.jpg,,Size#US 5:US 6:US 7:US 8:US 9.5:,55.29,,,,1,1,,,Heels,,Women Casual Corduroy Chunky Heel Peep-toe Pumps Shoes,Women Casual Corduroy Chunky Heel Peep-toe Pumps Shoes,Women Casual Corduroy Chunky Heel Peep-toe Pumps Shoes,,,,,,,,,
BUNXYPW0153,Women Casual Colorful Transparent Open Toe Platform Slide Sandals,,"<p>Color:Beige, Black, Multicolor</p><p>Type:Slides Slipper</p><p>Closure Type:Slip-On</p><p>Heel Type:Platforms</p><p>Heel Height:3-5cm In Low Heel</p><p>Toe Type:Opened, Round</p><p>Pattern:Ombre</p><p>Design Element:Simple</p><p>Upper Material:PU</p><p>Style:Casual</p><p>Outsole Material:Rubber</p><p>Structure:Wide Band</p><p>Occasion:Daily</p><p>Function:Antiskid</p><p>Season:Summer</p>",img/Sandals/SKUF41078.jpg,,Size#US 5:US 6:US 7:US 8:US 9:US 10:US 11:US 12:,49.62,,,,1,1,,,Sandals,,Women Casual Colorful Transparent Open Toe Platform Slide Sandals,Women Casual Colorful Transparent Open Toe Platform Slide Sandals,Women Casual Colorful Transparent Open Toe Platform Slide Sandals,,,,,,,,,
BUNXYPW0154,Ruffle Hem Flare Skirt,,<p><b>Style</b>: Casual</p><p><b>Color</b>: Baby Blue</p><p><b>Pattern Type</b>: Plain</p><p><b>Length</b>: Mini</p><p><b>Type</b>: Flared</p><p><b>Season</b>: Summer</p><p><b>Details</b>: Ruffle Hem</p><p><b>Waist Line</b>: High Waist</p><p><b>Sheer</b>: No</p><p><b>Material</b>: Polyester</p><p><b>Composition</b>: 100% Polyester</p><p><b>Fabric</b>: Non-Stretch</p><p><b>Care Instructions</b>: Machine wash or professional dry clean</p>,img/Skirts/swskirt44201214529.jpg,,Size#XS:S:M:L:,29.48,,,,1,1,,,Skirts,,Ruffle Hem Flare Skirt,Ruffle Hem Flare Skirt,Ruffle Hem Flare Skirt,,,,,,,,,
BUNXYPW0155,Ditsy Floral Shirred Back Knot Detail Crop Top,,<p><b>Style</b>: Boho</p><p><b>Color</b>: Lilac Purple</p><p><b>Pattern Type</b>: Ditsy Floral</p><p><b>Length</b>: Crop</p><p><b>Season</b>: Summer</p><p><b>Type</b>: Top</p><p><b>Details</b>: Frill</p><p><b>Details</b>: Knot</p><p><b>Details</b>: Shirred</p><p><b>Sleeve Type</b>: Puff Sleeve</p><p><b>Sleeve Length</b>: Short Sleeve</p><p><b>Fit Type</b>: Slim Fit</p><p><b>Neckline</b>: Sweetheart</p><p><b>Sheer</b>: No</p><p><b>Placket Type</b>: Pullovers</p><p><b>Material</b>: Polyester</p><p><b>Composition</b>: 100% Polyester</p><p><b>Fabric</b>: Non-Stretch</p><p><b>Care Instructions</b>: Machine wash or professional dry clean</p>,img/Blouses/swblouse04210107086.jpg,,Size#XS:S:M:L:,28.41,,,,1,1,,,Blouses,,Ditsy Floral Shirred Back Knot Detail Crop Top,Ditsy Floral Shirred Back Knot Detail Crop Top,Ditsy Floral Shirred Back Knot Detail Crop Top,,,,,,,,,
BUNXYPW0156,Plaid Belted Pants,,<p><b>Style</b>: Casual</p><p><b>Color</b>: Black and White</p><p><b>Pattern Type</b>: Plaid</p><p><b>Length</b>: Long</p><p><b>Type</b>: Tapered/Carrot</p><p><b>Season</b>: Spring/Summer/Fall</p><p><b>Details</b>: Belted</p><p><b>Details</b>: Paper Bag Waist</p><p><b>Waist Line</b>: High Waist</p><p><b>Fit Type</b>: Regular Fit</p><p><b>Sheer</b>: No</p><p><b>Closure Type</b>: Elastic Waist</p><p><b>Material</b>: Polyester</p><p><b>Composition</b>: 80% Polyester</p><p><b>Composition</b>: 20% Cotton</p><p><b>Fabric</b>: Non-Stretch</p><p><b>Care Instructions</b>: Machine wash or professional dry clean</p>,img/Pants/rwpants25210526743.jpg,,Size#S:M:L:,25.1,,,,1,1,,,Pants,,Plaid Belted Pants,Plaid Belted Pants,Plaid Belted Pants,,,,,,,,,
BUNXYPW0157,Moon Graphic Tee,,<p><b>Style</b>: Casual</p><p><b>Color</b>: Black</p><p><b>Pattern Type</b>: Graphic</p><p><b>Length</b>: Regular</p><p><b>Season</b>: Summer</p><p><b>Neckline</b>: Round Neck</p><p><b>Sleeve Length</b>: Short Sleeve</p><p><b>Fit Type</b>: Regular Fit</p><p><b>Sleeve Type</b>: Regular Sleeve</p><p><b>Placket Type</b>: Pullovers</p><p><b>Sheer</b>: No</p><p><b>Material</b>: Cotton</p><p><b>Composition</b>: 100% Cotton</p><p><b>Fabric</b>: Slight Stretch</p><p><b>Care Instructions</b>: Machine wash or professional dry clean</p>,img/T___Shirts/rwtee03201215037.jpg,,Size#S:M:L:XL:XXL:,24.95,,,,1,1,,,T-Shirts,,Moon Graphic Tee,Moon Graphic Tee,Moon Graphic Tee,,,,,,,,,
BUNXYPW0158,Rhinestone Heart Layered Necklace,,<p><b>Type</b>: Pendant Necklaces</p><p><b>Details</b>: Rhinestone</p><p><b>Material</b>: Alloy</p><p><b>Details</b>: Butterfly</p><p><b>Type</b>: Layer Sets</p><p><b>Color</b>: Gold</p><p><b>Metal Color</b>: Gold</p><p><b>Style</b>: Casual</p>,img/Pendant_Necklaces/swneck18200929153.jpg,,Size#,17.54,,,,1,1,,,Pendant Necklaces,,Rhinestone Heart Layered Necklace,Rhinestone Heart Layered Necklace,Rhinestone Heart Layered Necklace,,,,,,,,,
BUNXYPW0159,Vintage Gemstone Metal Dragonfly Earrings Simple Animal Earrings,,<p>Style: Vintage</p><p>Type: Earrings</p><p>Color: Silver.</p><p>Material:</p><p>Alloy.</p><p>1 x Earrings</p>,img/Earrings/SKUH32979.jpg,,Size#,16.0,,,,1,1,,,Earrings,,Vintage Gemstone Metal Dragonfly Earrings Simple Animal Earrings,Vintage Gemstone Metal Dragonfly Earrings Simple Animal Earrings,Vintage Gemstone Metal Dragonfly Earrings Simple Animal Earrings,,,,,,,,,
BUNXYPW0160,Women Floral Print 6 Card Slots Coin Purse Money Clip Short Wallet,,"<p>Color:Pink, Black, Blue, Khaki</p><p>Wallets Style:Clasp Closure</p><p>Wallet Type:Money Clip, ID Wallets, Coin Purse</p><p>Material:Faux Fur, PU</p><p>Style:Casual</p><p>Pattern:Floral</p>",img/Wallets/SKUG30896.jpg,,Size#,70.16,,,,1,1,,,Wallets,,Women Floral Print 6 Card Slots Coin Purse Money Clip Short Wallet,Women Floral Print 6 Card Slots Coin Purse Money Clip Short Wallet,Women Floral Print 6 Card Slots Coin Purse Money Clip Short Wallet,,,,,,,,,
BUNXYPW0161,SOCOFY Vintage Leather Adjustable Buckle Strap Cut-out Burnished Chunky Heel Heels,,"<p>Color:Camel</p><p>Type:Mary Jane</p><p>Closure Type:Buckle</p><p>Heel Type:Chunky Heel</p><p>Heel Height:3-5cm In Low Heel</p><p>Toe Type:Pointed</p><p>Pattern:Grid</p><p>Design Element:Patchwork, Hollow out</p><p>Upper Material:Leather</p><p>Style:Retro</p><p>Outsole Material:Rubber</p><p>Structure:Buckle</p><p>Occasion:Casual</p><p>Function:Breathable</p><p>Season:Spring&Summer, Autumn, Spring&Fall</p>",img/Heels/SKUE77746.jpg,,Size#US 5:US 6:US 7:US 8:US 9.5:US 10.5:US 11.5:,61.61,,,,1,1,,,Heels,,SOCOFY Vintage Leather Adjustable Buckle Strap Cut-out Burnished Chunky Heel Heels,SOCOFY Vintage Leather Adjustable Buckle Strap Cut-out Burnished Chunky Heel Heels,SOCOFY Vintage Leather Adjustable Buckle Strap Cut-out Burnished Chunky Heel Heels,,,,,,,,,
BUNXYPW0162,Plus Size Women Casual Peep Toe Buckle High Heel Sandals,,"<p>Color:Green, Red, Brown, Grey</p><p>Type:Heeled Sandals</p><p>Closure Type:Buckle</p><p>Heel Type:Chunky Heel</p><p>Heel Height:3-5cm In Low Heel</p><p>Toe Type:Opened, Peep Toe</p><p>Pattern:Solid</p><p>Design Element:Metal, Woven</p><p>Upper Material:PU</p><p>Style:Casual</p><p>Outsole Material:Rubber</p><p>Structure:Buckle, Opened</p><p>Occasion:Party, Daily</p><p>Decoration:Hollow Out</p><p>Function:Soft</p><p>Season:Summer</p>",img/Sandals/SKUC26858.jpg,,Size#US 5:US 6:US 7:US 8:US 9:US 10:US 11:US 12:,65.22,,,,1,1,,,Sandals,,Plus Size Women Casual Peep Toe Buckle High Heel Sandals,Plus Size Women Casual Peep Toe Buckle High Heel Sandals,Plus Size Women Casual Peep Toe Buckle High Heel Sandals,,,,,,,,,
BUNXYPW0163,Plaid Lace-Up Front Pleated Mini Skirt,,<p><b>Style</b>: Preppy</p><p><b>Color</b>: Multicolor</p><p><b>Pattern Type</b>: Plaid</p><p><b>Length</b>: Mini</p><p><b>Type</b>: Pleated</p><p><b>Season</b>: Summer</p><p><b>Details</b>: Lace Up</p><p><b>Details</b>: Pleated</p><p><b>Details</b>: Zipper</p><p><b>Waist Line</b>: High Waist</p><p><b>Sheer</b>: No</p><p><b>Material</b>: Cotton</p><p><b>Composition</b>: 65% Cotton</p><p><b>Composition</b>: 35% Polyester</p><p><b>Fabric</b>: Non-Stretch</p><p><b>Care Instructions</b>: Machine wash or professional dry clean</p><p><b>Style</b>: Preppy</p><p><b>Color</b>: Black</p><p><b>Pattern Type</b>: Plaid</p><p><b>Length</b>: Mini</p><p><b>Type</b>: Pleated</p><p><b>Season</b>: Spring/Summer/Fall</p><p><b>Details</b>: Lace Up</p><p><b>Details</b>: Pleated</p><p><b>Details</b>: Zipper</p><p><b>Waist Line</b>: High Waist</p><p><b>Sheer</b>: No</p><p><b>Material</b>: Cotton</p><p><b>Composition</b>: 65% Cotton</p><p><b>Composition</b>: 35% Polyester</p><p><b>Fabric</b>: Non-Stretch</p><p><b>Care Instructions</b>: Machine wash or professional dry clean</p>,img/Skirts/swskirt07201103796.jpg,,Size#XS:S:M:L:XL:,23.26,,,,1,1,,,Skirts,,Plaid Lace-Up Front Pleated Mini Skirt,Plaid Lace-Up Front Pleated Mini Skirt,Plaid Lace-Up Front Pleated Mini Skirt,,,,,,,,,
BUNXYPW0164,Solid Drawstring Puff Sleeve Sweetheart Neck Crop Blouse,,<p><b>Style</b>: Casual</p><p><b>Color</b>: White</p><p><b>Pattern Type</b>: Plain</p><p><b>Length</b>: Crop</p><p><b>Season</b>: Summer</p><p><b>Type</b>: Top</p><p><b>Details</b>: Drawstring</p><p><b>Details</b>: Ruched</p><p><b>Sleeve Type</b>: Puff Sleeve</p><p><b>Fit Type</b>: Regular Fit</p><p><b>Sleeve Length</b>: Short Sleeve</p><p><b>Neckline</b>: Sweetheart</p><p><b>Sheer</b>: No</p><p><b>Placket Type</b>: Pullovers</p><p><b>Material</b>: Cotton</p><p><b>Composition</b>: 65% Cotton</p><p><b>Composition</b>: 35% Polyester</p><p><b>Fabric</b>: Non-Stretch</p><p><b>Care Instructions</b>: Machine wash or professional dry clean</p>,img/Blouses/rW210513375169913.jpg,,Size#S:M:L:,22.63,,,,1,1,,,Blouses,,Solid Drawstring Puff Sleeve Sweetheart Neck Crop Blouse,Solid Drawstring Puff Sleeve Sweetheart Neck Crop Blouse,Solid Drawstring Puff Sleeve Sweetheart Neck Crop Blouse,,,,,,,,,
BUNXYPW0165,Plaid Flared Pants,,<p><b>Style</b>: Preppy</p><p><b>Color</b>: Multicolor</p><p><b>Pattern Type</b>: Geometric</p><p><b>Length</b>: Long</p><p><b>Type</b>: Flare Leg</p><p><b>Season</b>: Spring/Summer/Fall</p><p><b>Waist Line</b>: High Waist</p><p><b>Fit Type</b>: Regular Fit</p><p><b>Sheer</b>: No</p><p><b>Closure Type</b>: Button Fly</p><p><b>Material</b>: Polyester</p><p><b>Composition</b>: 65% Polyester</p><p><b>Composition</b>: 35% Cotton</p><p><b>Fabric</b>: Non-Stretch</p><p><b>Care Instructions</b>: Machine wash or professional dry clean</p>,img/Pants/rwpants25210413364.jpg,,Size#S:M:L:,30.51,,,,1,1,,,Pants,,Plaid Flared Pants,Plaid Flared Pants,Plaid Flared Pants,,,,,,,,,
BUNXYPW0166,ROMWE X Stevenrhodes Letter Figure Graphic Colorblock Crop Tee,,<p><b>Style</b>: Casual</p><p><b>Color</b>: Multicolor</p><p><b>Pattern Type</b>: Cartoon</p><p><b>Pattern Type</b>: Colorblock</p><p><b>Length</b>: Crop</p><p><b>Season</b>: Summer</p><p><b>Neckline</b>: Round Neck</p><p><b>Sleeve Length</b>: Short Sleeve</p><p><b>Fit Type</b>: Regular Fit</p><p><b>Sleeve Type</b>: Regular Sleeve</p><p><b>Placket Type</b>: Pullovers</p><p><b>Sheer</b>: No</p><p><b>Material</b>: Cotton</p><p><b>Composition</b>: 65% Cotton</p><p><b>Composition</b>: 35% Polyester</p><p><b>Fabric</b>: Slight Stretch</p><p><b>Care Instructions</b>: Machine wash or professional dry clean</p>,img/T___Shirts/rwtee25210618902.jpg,,Size#S:M:L:,22.37,,,,1,1,,,T-Shirts,,ROMWE X Stevenrhodes Letter Figure Graphic Colorblock Crop Tee,ROMWE X Stevenrhodes Letter Figure Graphic Colorblock Crop Tee,ROMWE X Stevenrhodes Letter Figure Graphic Colorblock Crop Tee,,,,,,,,,
BUNXYPW0167,Letter Charm Necklace,,<p><b>Type</b>: Pendant Necklaces</p><p><b>Material</b>: Alloy</p><p><b>Color</b>: Gold</p><p><b>Metal Color</b>: Gold</p><p><b>Style</b>: Casual</p><p><b>Type</b>: Pendant Necklaces</p><p><b>Material</b>: Alloy</p><p><b>Color</b>: Silver</p><p><b>Metal Color</b>: Silver</p><p><b>Style</b>: Casual</p>,img/Pendant_Necklaces/swneck18200922658.jpg,,Size#,24.05,,,,1,1,,,Pendant Necklaces,,Letter Charm Necklace,Letter Charm Necklace,Letter Charm Necklace,,,,,,,,,
BUNXYPW0168,Vintage Geometric Metal Handmade Natural Stone Pendant Earrings Blue Irregular Marble Pattern Earrings,,<p>Style: Vintage</p><p>Type: Earrings</p><p>Main Color: Blue</p><p>Weight: 8g</p><p>Size: 35mm*8.5mm/1.37*0.33in</p><p>Material: Alloy</p><p>1 X Earrings</p>,img/Earrings/SKUF42311.jpg,,Size#,19.95,,,,1,1,,,Earrings,,Vintage Geometric Metal Handmade Natural Stone Pendant Earrings Blue Irregular Marble Pattern Earrings,Vintage Geometric Metal Handmade Natural Stone Pendant Earrings Blue Irregular Marble Pattern Earrings,Vintage Geometric Metal Handmade Natural Stone Pendant Earrings Blue Irregular Marble Pattern Earrings,,,,,,,,,
BUNXYPW0169,Genuine Leather Leaf Insect Cartoon Personalized Wallet Coin Purse For Women,,"<p>Color:Orange, Coffee, Green, Black, Purple, Blue</p><p>Style:Casual, Vintage</p><p>Decoration:Genuine Leather</p>",img/Wallets/SKUA31694.jpg,,Size#,64.6,,,,1,1,,,Wallets,,Genuine Leather Leaf Insect Cartoon Personalized Wallet Coin Purse For Women,Genuine Leather Leaf Insect Cartoon Personalized Wallet Coin Purse For Women,Genuine Leather Leaf Insect Cartoon Personalized Wallet Coin Purse For Women,,,,,,,,,
BUNXYPW0170,SOCOFY Fresh Natural Style Flowers Printed Cowhide Leather Comfy Wearable Lace Up Casual Pumps,,"<p>Color:Green</p><p>Type:Oxfords, Loafers</p><p>Closure Type:Lace-up</p><p>Heel Type:Chunky Heel</p><p>Heel Height:3-5cm In Low Heel</p><p>Toe Type:Round</p><p>Pattern:Calico</p><p>Design Element:Pattern, Stitching</p><p>Style:Casual, Natural</p><p>Outsole Material:Rubber</p><p>Structure:Lace-up</p><p>Occasion:Party, Casual</p><p>Function:Hard-wearing</p><p>Season:Summer, Spring&Fall</p>",img/Heels/SKUG97834.jpg,,Size#US 5:US 6:US 7:US 8:US 9.5:US 10.5:US 11.5:,59.86,,,,1,1,,,Heels,,SOCOFY Fresh Natural Style Flowers Printed Cowhide Leather Comfy Wearable Lace Up Casual Pumps,SOCOFY Fresh Natural Style Flowers Printed Cowhide Leather Comfy Wearable Lace Up Casual Pumps,SOCOFY Fresh Natural Style Flowers Printed Cowhide Leather Comfy Wearable Lace Up Casual Pumps,,,,,,,,,
