v_sku,v_name,v_short_description,v_description,v_image,v_url,v_attribute,v_price,v_specials_price,v_specials_expire_date,v_date_added,v_in_stock,v_status,v_viewed,v_ordered,v_category_sku,v_sort_order,v_meta_title,v_meta_keywords,v_meta_description,v_brand_filter,v_class_filter,v_color_filter,v_gender_filter,v_material_filter,v_year_filter,v_origin_filter,v_series_filter,v_spec_filter
BUNXYPW0001,Letter Graphic Contrast Piping Pleated Skirt,,<p><b>Style</b>: Sporty</p><p><b>Color</b>: White</p><p><b>Pattern Type</b>: Letter</p><p><b>Length</b>: Mini</p><p><b>Type</b>: A Line</p><p><b>Season</b>: Summer</p><p><b>Waist Line</b>: High Waist</p><p><b>Sheer</b>: No</p><p><b>Material</b>: Polyester</p><p><b>Composition</b>: 97% Polyester</p><p><b>Composition</b>: 3% Spandex</p><p><b>Fabric</b>: Non-Stretch</p><p><b>Care Instructions</b>: Machine wash or professional dry clean</p>,img/Skirts/swskirt07210310834.jpg,,Size#XS:S:M:L:XL:,24.32,,,,1,1,,,Skirts,,Letter Graphic Contrast Piping Pleated Skirt,Letter Graphic Contrast Piping Pleated Skirt,Letter Graphic Contrast Piping Pleated Skirt,,,,,,,,,
BUNXYPW0002,Sun & Moon Graphic Button Front Blouse,,<p><b>Style</b>: Casual</p><p><b>Color</b>: Multicolor</p><p><b>Pattern Type</b>: Graphic</p><p><b>Pattern Type</b>: All Over Print</p><p><b>Length</b>: Regular</p><p><b>Season</b>: Summer</p><p><b>Type</b>: Shirt</p><p><b>Details</b>: Button Front</p><p><b>Neckline</b>: Collar</p><p><b>Fit Type</b>: Oversized</p><p><b>Sleeve Length</b>: Short Sleeve</p><p><b>Sleeve Type</b>: Regular Sleeve</p><p><b>Sheer</b>: No</p><p><b>Placket Type</b>: Placket</p><p><b>Material</b>: Polyester</p><p><b>Composition</b>: 100% Polyester</p><p><b>Fabric</b>: Non-Stretch</p><p><b>Care Instructions</b>: Machine wash or professional dry clean</p><p><b>Style</b>: Casual</p><p><b>Color</b>: Black</p><p><b>Pattern Type</b>: Graphic</p><p><b>Length</b>: Regular</p><p><b>Season</b>: Summer</p><p><b>Type</b>: Shirt</p><p><b>Details</b>: Button Front</p><p><b>Neckline</b>: Collar</p><p><b>Fit Type</b>: Oversized</p><p><b>Sleeve Length</b>: Short Sleeve</p><p><b>Sleeve Type</b>: Drop Shoulder</p><p><b>Sheer</b>: No</p><p><b>Placket Type</b>: Placket</p><p><b>Material</b>: Polyester</p><p><b>Composition</b>: 100% Polyester</p><p><b>Fabric</b>: Non-Stretch</p><p><b>Care Instructions</b>: Machine wash or professional dry clean</p><p><b>Style</b>: Casual</p><p><b>Color</b>: Black</p><p><b>Pattern Type</b>: Graphic</p><p><b>Length</b>: Regular</p><p><b>Season</b>: Summer</p><p><b>Type</b>: Shirt</p><p><b>Details</b>: Button Front</p><p><b>Neckline</b>: Collar</p><p><b>Fit Type</b>: Regular Fit</p><p><b>Sleeve Length</b>: Short Sleeve</p><p><b>Sleeve Type</b>: Regular Sleeve</p><p><b>Sheer</b>: No</p><p><b>Placket Type</b>: Placket</p><p><b>Material</b>: Polyester</p><p><b>Composition</b>: 100% Polyester</p><p><b>Fabric</b>: Non-Stretch</p><p><b>Care Instructions</b>: Machine wash or professional dry clean</p><p><b>Style</b>: Casual</p><p><b>Color</b>: Blue</p><p><b>Pattern Type</b>: Letter</p><p><b>Pattern Type</b>: Graphic</p><p><b>Length</b>: Regular</p><p><b>Season</b>: Summer</p><p><b>Type</b>: Shirt</p><p><b>Details</b>: Button Front</p><p><b>Neckline</b>: Collar</p><p><b>Fit Type</b>: Regular Fit</p><p><b>Sleeve Length</b>: Short Sleeve</p><p><b>Sleeve Type</b>: Regular Sleeve</p><p><b>Sheer</b>: No</p><p><b>Placket Type</b>: Placket</p><p><b>Material</b>: Polyester</p><p><b>Composition</b>: 100% Polyester</p><p><b>Fabric</b>: Non-Stretch</p><p><b>Care Instructions</b>: Machine wash or professional dry clean</p>,img/Blouses/rwblouse03201216168.jpg,,Size#S:M:L:XL:,32.3,,,,1,1,,,Blouses,,Sun & Moon Graphic Button Front Blouse,Sun & Moon Graphic Button Front Blouse,Sun & Moon Graphic Button Front Blouse,,,,,,,,,
BUNXYPW0003,Floral Belted Wide Leg Pants,,<p><b>Style</b>: Boho</p><p><b>Color</b>: Multicolor</p><p><b>Pattern Type</b>: Floral</p><p><b>Length</b>: Long</p><p><b>Type</b>: Wide Leg</p><p><b>Season</b>: Spring/Summer/Fall</p><p><b>Details</b>: Belted</p><p><b>Fit Type</b>: Loose</p><p><b>Waist Line</b>: Natural</p><p><b>Sheer</b>: No</p><p><b>Belt</b>: Yes</p><p><b>Material</b>: Polyester</p><p><b>Composition</b>: 100% Polyester</p><p><b>Fabric</b>: Slight Stretch</p><p><b>Care Instructions</b>: Machine wash or professional dry clean</p>,img/Pants/swpants01201222467.jpg,,Size#XS:S:M:L:,28.79,,,,1,1,,,Pants,,Floral Belted Wide Leg Pants,Floral Belted Wide Leg Pants,Floral Belted Wide Leg Pants,,,,,,,,,
BUNXYPW0004,ROMWE X Rebecaalvarezz Hand Graphic Tee,,<p><b>Style</b>: Casual</p><p><b>Color</b>: White</p><p><b>Pattern Type</b>: Graphic</p><p><b>Length</b>: Regular</p><p><b>Season</b>: Summer</p><p><b>Neckline</b>: Round Neck</p><p><b>Sleeve Length</b>: Short Sleeve</p><p><b>Fit Type</b>: Regular Fit</p><p><b>Sleeve Type</b>: Regular Sleeve</p><p><b>Placket Type</b>: Pullovers</p><p><b>Sheer</b>: No</p><p><b>Material</b>: Cotton</p><p><b>Composition</b>: 100% Cotton</p><p><b>Fabric</b>: Slight Stretch</p><p><b>Care Instructions</b>: Machine wash or professional dry clean</p>,img/T___Shirts/rwtee25210419879.jpg,,Size#S:M:L:XL:,29.38,,,,1,1,,,T-Shirts,,ROMWE X Rebecaalvarezz Hand Graphic Tee,ROMWE X Rebecaalvarezz Hand Graphic Tee,ROMWE X Rebecaalvarezz Hand Graphic Tee,,,,,,,,,
BUNXYPW0005,1pc Year Charm Necklace,,<p><b>Composition</b>: 100% Metal</p><p><b>Material</b>: Metal</p><p><b>Type</b>: Pendant Necklaces</p><p><b>Type</b>: Chain Necklaces</p><p><b>Color</b>: Gold</p><p><b>Metal Color</b>: Gold</p><p><b>Style</b>: Casual</p><p><b>Composition</b>: 100% Metal</p><p><b>Material</b>: Metal</p><p><b>Type</b>: Pendant Necklaces</p><p><b>Type</b>: Chain Necklaces</p><p><b>Color</b>: Gold</p><p><b>Metal Color</b>: Gold</p><p><b>Style</b>: Casual</p>,img/Pendant_Necklaces/swneck18191109320.jpg,,Size#,22.52,,,,1,1,,,Pendant Necklaces,,1pc Year Charm Necklace,1pc Year Charm Necklace,1pc Year Charm Necklace,,,,,,,,,
BUNXYPW0006,Vintage Spiral-Shape Women Earrings Jewelry Gift,,"<p>Style: Vintage</p><p>Type: Earrings</p><p>Color: Silver, Gold</p><p>Weight: 10g</p><p>Material: Alloy</p><p>1 x Earrings</p>",img/Earrings/SKUH03701.jpg,,Size#,28.4,,,,1,1,,,Earrings,,Vintage Spiral-Shape Women Earrings Jewelry Gift,Vintage Spiral-Shape Women Earrings Jewelry Gift,Vintage Spiral-Shape Women Earrings Jewelry Gift,,,,,,,,,
BUNXYPW0007,Women 10 Card Slots Rfid Genuine Leather Short Zipper Coin Purse Wallet,,<p>Color:Black</p><p>Style:Vintage</p>,img/Wallets/SKUF34583.jpg,,Size#,58.54,,,,1,1,,,Wallets,,Women 10 Card Slots Rfid Genuine Leather Short Zipper Coin Purse Wallet,Women 10 Card Slots Rfid Genuine Leather Short Zipper Coin Purse Wallet,Women 10 Card Slots Rfid Genuine Leather Short Zipper Coin Purse Wallet,,,,,,,,,
BUNXYPW0008,Women Mesh Flower Embroidery Low-Heeled Loafers Shoes,,"<p>Color:Golden, Black, Pink, Blue</p><p>Type:Loafers</p><p>Closure Type:Slip-On</p><p>Heel Type:Chunky Heel</p><p>Heel Height:1-3cm In Flat</p><p>Toe Type:Pointed</p><p>Pattern:Calico</p><p>Design Element:Embroidered</p><p>Upper Material:Mesh</p><p>Style:Casual, Elegant</p><p>Outsole Material:Rubber</p><p>Occasion:Casual</p><p>Function:Breathable</p><p>Season:Summer, Autumn</p>",img/Heels/SKUH80004.jpg,,Size#US 5:US 6:US 7:US 8:US 9:,65.57,,,,1,1,,,Heels,,Women Mesh Flower Embroidery Low-Heeled Loafers Shoes,Women Mesh Flower Embroidery Low-Heeled Loafers Shoes,Women Mesh Flower Embroidery Low-Heeled Loafers Shoes,,,,,,,,,
BUNXYPW0009,SOCOFY Retro Colorful Super Comfy Hollow Out Genuine Leather Heart Shape Soft Hook Loop Low Heel Gladiator Sandals,,"<p>Color:Red, Blue</p><p>Type:Gladiator sandals</p><p>Closure Type:Hook & Loop</p><p>Heel Type:Chunky Heel</p><p>Heel Height:3-5cm In Low Heel</p><p>Toe Type:Opened</p><p>Pattern:Joint</p><p>Design Element:Patchwork, Hollow out</p><p>Upper Material:Leather</p><p>Style:Retro</p><p>Outsole Material:Rubber</p><p>Structure:Buckle</p><p>Occasion:Daily</p><p>Decoration:Hollow Out</p><p>Function:Soft</p><p>Season:Summer</p>",img/Sandals/SKUA88391.jpg,,Size#US 5:US 6:US 7:US 8:US 9.5:US 10.5:US 11.5:,62.76,,,,1,1,,,Sandals,,SOCOFY Retro Colorful Super Comfy Hollow Out Genuine Leather Heart Shape Soft Hook Loop Low Heel Gladiator Sandals,SOCOFY Retro Colorful Super Comfy Hollow Out Genuine Leather Heart Shape Soft Hook Loop Low Heel Gladiator Sandals,SOCOFY Retro Colorful Super Comfy Hollow Out Genuine Leather Heart Shape Soft Hook Loop Low Heel Gladiator Sandals,,,,,,,,,
BUNXYPW0010,Split Side Pencil Skirt,,<p><b>Style</b>: Casual</p><p><b>Color</b>: Dark Grey</p><p><b>Pattern Type</b>: Plain</p><p><b>Length</b>: Long</p><p><b>Type</b>: Pencil</p><p><b>Season</b>: Spring/Summer/Fall</p><p><b>Details</b>: Split</p><p><b>Waist Line</b>: High Waist</p><p><b>Sheer</b>: No</p><p><b>Arabian Clothing</b>: Yes</p><p><b>Material</b>: Cotton</p><p><b>Composition</b>: 65% Cotton</p><p><b>Composition</b>: 30% Polyester</p><p><b>Composition</b>: 5% Spandex</p><p><b>Fabric</b>: Slight Stretch</p><p><b>Care Instructions</b>: Machine wash or professional dry clean</p>,img/Skirts/swskirt07201216595.jpg,,Size#XS:S:M:L:XL:,30.96,,,,1,1,,,Skirts,,Split Side Pencil Skirt,Split Side Pencil Skirt,Split Side Pencil Skirt,,,,,,,,,
BUNXYPW0011,Polka Dot Knot Milkmaid Blouse,,<p><b>Style</b>: Casual</p><p><b>Color</b>: Dusty Blue</p><p><b>Pattern Type</b>: Polka Dot</p><p><b>Length</b>: Crop</p><p><b>Season</b>: Summer</p><p><b>Type</b>: Top</p><p><b>Details</b>: Frill</p><p><b>Details</b>: Knot</p><p><b>Sleeve Type</b>: Puff Sleeve</p><p><b>Sleeve Length</b>: Short Sleeve</p><p><b>Fit Type</b>: Slim Fit</p><p><b>Neckline</b>: Sweetheart</p><p><b>Sheer</b>: No</p><p><b>Placket Type</b>: Pullovers</p><p><b>Material</b>: Cotton Blends</p><p><b>Composition</b>: 65% Cotton</p><p><b>Composition</b>: 35% Polyester</p><p><b>Fabric</b>: Non-Stretch</p><p><b>Care Instructions</b>: Machine wash or professional dry clean</p>,img/Blouses/rwblouse25210512658.jpg,,Size#S:M:L:XL:,22.17,,,,1,1,,,Blouses,,Polka Dot Knot Milkmaid Blouse,Polka Dot Knot Milkmaid Blouse,Polka Dot Knot Milkmaid Blouse,,,,,,,,,
BUNXYPW0012,Slant Pocket Tartan Pants,,<p><b>Style</b>: Preppy</p><p><b>Color</b>: Black and White</p><p><b>Pattern Type</b>: Plaid</p><p><b>Length</b>: Long</p><p><b>Type</b>: Tapered/Carrot</p><p><b>Season</b>: Spring/Summer/Fall</p><p><b>Details</b>: Button</p><p><b>Details</b>: Pocket</p><p><b>Details</b>: Zipper</p><p><b>Waist Line</b>: High Waist</p><p><b>Fit Type</b>: Regular Fit</p><p><b>Sheer</b>: No</p><p><b>Closure Type</b>: Zipper Fly</p><p><b>Material</b>: Cotton</p><p><b>Composition</b>: 65% Cotton</p><p><b>Composition</b>: 35% Polyester</p><p><b>Fabric</b>: Non-Stretch</p><p><b>Care Instructions</b>: Machine wash or professional dry clean</p>,img/Pants/swpants07200730388.jpg,,Size#XS:S:M:L:XL:,32.65,,,,1,1,,,Pants,,Slant Pocket Tartan Pants,Slant Pocket Tartan Pants,Slant Pocket Tartan Pants,,,,,,,,,
BUNXYPW0013,Cartoon Graphic Crop Tee,,<p><b>Style</b>: Casual</p><p><b>Color</b>: Baby Pink</p><p><b>Pattern Type</b>: Cartoon</p><p><b>Length</b>: Crop</p><p><b>Season</b>: Summer</p><p><b>Neckline</b>: Round Neck</p><p><b>Sleeve Length</b>: Short Sleeve</p><p><b>Fit Type</b>: Slim Fit</p><p><b>Sleeve Type</b>: Regular Sleeve</p><p><b>Placket Type</b>: Pullovers</p><p><b>Sheer</b>: No</p><p><b>Material</b>: Cotton</p><p><b>Composition</b>: 65% Cotton</p><p><b>Composition</b>: 35% Polyester</p><p><b>Fabric</b>: Slight Stretch</p><p><b>Care Instructions</b>: Machine wash or professional dry clean</p>,img/T___Shirts/rw2106285356958905.jpg,,Size#XS:S:M:L:,24.04,,,,1,1,,,T-Shirts,,Cartoon Graphic Crop Tee,Cartoon Graphic Crop Tee,Cartoon Graphic Crop Tee,,,,,,,,,
BUNXYPW0014,Beaded Flower Charm Necklace,,<p><b>Details</b>: Flowers</p><p><b>Type</b>: Pendant Necklaces</p><p><b>Material</b>: Iron</p><p><b>Color</b>: Purple</p><p><b>Metal Color</b>: Gold</p><p><b>Style</b>: Boho</p>,img/Pendant_Necklaces/swneck18200721087.jpg,,Size#,19.98,,,,1,1,,,Pendant Necklaces,,Beaded Flower Charm Necklace,Beaded Flower Charm Necklace,Beaded Flower Charm Necklace,,,,,,,,,
BUNXYPW0015,Bohemian Goddess Moon Sun Earrings Gold Rhinestone Ear Drop For Women,,"<p>Style:Bohemian</p><p>Type:Earrings</p><p>Main Color:Gold </p><p>Weight: about 20g</p><p>Material:Zinc Alloy,Rhinestone</p><p>1 Pair of Earrings</p>",img/Earrings/SKUC00940.jpg,,Size#,18.23,,,,1,1,,,Earrings,,Bohemian Goddess Moon Sun Earrings Gold Rhinestone Ear Drop For Women,Bohemian Goddess Moon Sun Earrings Gold Rhinestone Ear Drop For Women,Bohemian Goddess Moon Sun Earrings Gold Rhinestone Ear Drop For Women,,,,,,,,,
BUNXYPW0016,Women Vintage Genuine Leather Cow Lether Multi-card Slots Money Clips Wallet,,"<p>Color:Orange, Black, Purple, Blue, Red</p><p>Wallet Type:ID Wallets</p><p>Material:Cow Leather</p><p>Style:Vintage</p><p>Pattern:Solid</p>",img/Wallets/SKUH12677.jpg,,Size#,72.93,,,,1,1,,,Wallets,,Women Vintage Genuine Leather Cow Lether Multi-card Slots Money Clips Wallet,Women Vintage Genuine Leather Cow Lether Multi-card Slots Money Clips Wallet,Women Vintage Genuine Leather Cow Lether Multi-card Slots Money Clips Wallet,,,,,,,,,
BUNXYPW0017,Women Buckle Strap Low Heel Elegant Pumps,,"<p>Color:Red, Black</p><p>Type:Mary Jane</p><p>Closure Type:Buckle</p><p>Heel Type:Cone Heel</p><p>Heel Height:5-8cm In Heel</p><p>Toe Type:Round</p><p>Pattern:Solid</p><p>Upper Material:PU</p><p>Style:Casual, Elegant</p><p>Outsole Material:Rubber</p><p>Occasion:Date, Casual</p><p>Function:Hard-wearing</p><p>Season:Summer, Spring&Fall</p>",img/Heels/SKUD20532.jpg,,Size#US 5:US 6:US 7:US 8:US 9:US 10:,60.25,,,,1,1,,,Heels,,Women Buckle Strap Low Heel Elegant Pumps,Women Buckle Strap Low Heel Elegant Pumps,Women Buckle Strap Low Heel Elegant Pumps,,,,,,,,,
BUNXYPW0018,Women Caual Opened Toe Hasp Woven Decoration Espadrille Wedges Sandals,,"<p>Color:Black</p><p>Type:Wedges  Sandals</p><p>Closure Type:Hasp</p><p>Heel Type:Wedges Heel</p><p>Heel Height:5-8cm In Heel</p><p>Toe Type:Opened</p><p>Pattern:Other</p><p>Design Element:Woven</p><p>Upper Material:PU</p><p>Style:Casual, Brief</p><p>Outsole Material:Rubber</p><p>Structure:Buckle</p><p>Occasion:Casual</p><p>Function:Hard-wearing</p><p>Season:Summer</p>",img/Sandals/SKUH58798.jpg,,Size#US 5:US 7:US 8:US 9:US 10:,51.95,,,,1,1,,,Sandals,,Women Caual Opened Toe Hasp Woven Decoration Espadrille Wedges Sandals,Women Caual Opened Toe Hasp Woven Decoration Espadrille Wedges Sandals,Women Caual Opened Toe Hasp Woven Decoration Espadrille Wedges Sandals,,,,,,,,,
BUNXYPW0019,Colorblock Tie Strap Skirt,,<p><b>Style</b>: Casual</p><p><b>Color</b>: Multicolor</p><p><b>Pattern Type</b>: Colorblock</p><p><b>Length</b>: Mini</p><p><b>Type</b>: Straight</p><p><b>Season</b>: Summer</p><p><b>Details</b>: Knot</p><p><b>Details</b>: Cut Out</p><p><b>Details</b>: Rib-Knit</p><p><b>Waist Line</b>: Natural</p><p><b>Sheer</b>: No</p><p><b>Material</b>: Cotton</p><p><b>Composition</b>: 65% Cotton</p><p><b>Composition</b>: 35% Polyester</p><p><b>Fabric</b>: Medium Stretch</p><p><b>Care Instructions</b>: Machine wash or professional dry clean</p>,img/Skirts/rw2106223893292365.jpg,,Size#S:M:L:,32.05,,,,1,1,,,Skirts,,Colorblock Tie Strap Skirt,Colorblock Tie Strap Skirt,Colorblock Tie Strap Skirt,,,,,,,,,
BUNXYPW0020,Tie Dye Button Front Pocket Blouse,,<p><b>Style</b>: Casual</p><p><b>Color</b>: Black and White</p><p><b>Pattern Type</b>: Tie Dye</p><p><b>Length</b>: Regular</p><p><b>Season</b>: Summer</p><p><b>Type</b>: Shirt</p><p><b>Details</b>: Pocket</p><p><b>Details</b>: Button Front</p><p><b>Neckline</b>: Collar</p><p><b>Fit Type</b>: Oversized</p><p><b>Sleeve Length</b>: Short Sleeve</p><p><b>Sleeve Type</b>: Regular Sleeve</p><p><b>Sheer</b>: No</p><p><b>Placket Type</b>: Placket</p><p><b>Material</b>: Polyester</p><p><b>Composition</b>: 100% Polyester</p><p><b>Fabric</b>: Non-Stretch</p><p><b>Care Instructions</b>: Machine wash or professional dry clean</p>,img/Blouses/rwblouse25210510040.jpg,,Size#S:M:L:,22.82,,,,1,1,,,Blouses,,Tie Dye Button Front Pocket Blouse,Tie Dye Button Front Pocket Blouse,Tie Dye Button Front Pocket Blouse,,,,,,,,,
BUNXYPW0021,Drawstring Waist Wide Leg Pants,,<p><b>Style</b>: Casual</p><p><b>Color</b>: Black</p><p><b>Pattern Type</b>: Plain</p><p><b>Length</b>: Long</p><p><b>Type</b>: Wide Leg</p><p><b>Season</b>: Spring/Summer/Fall</p><p><b>Details</b>: Drawstring</p><p><b>Details</b>: Pocket</p><p><b>Details</b>: Rib-Knit</p><p><b>Waist Line</b>: High Waist</p><p><b>Fit Type</b>: Loose</p><p><b>Sheer</b>: No</p><p><b>Closure Type</b>: Drawstring Waist</p><p><b>Material</b>: Polyester</p><p><b>Composition</b>: 95% Polyester</p><p><b>Composition</b>: 5% Spandex</p><p><b>Fabric</b>: Slight Stretch</p><p><b>Care Instructions</b>: Machine wash or professional dry clean</p>,img/Pants/swpants07201014105.jpg,,Size#XS:S:M:L:XL:,26.68,,,,1,1,,,Pants,,Drawstring Waist Wide Leg Pants,Drawstring Waist Wide Leg Pants,Drawstring Waist Wide Leg Pants,,,,,,,,,
BUNXYPW0022,Graphic Oversized Tee,,<p><b>Style</b>: Casual</p><p><b>Color</b>: Black</p><p><b>Pattern Type</b>: Graphic</p><p><b>Length</b>: Long</p><p><b>Season</b>: Summer</p><p><b>Neckline</b>: Round Neck</p><p><b>Sleeve Length</b>: Short Sleeve</p><p><b>Fit Type</b>: Oversized</p><p><b>Sleeve Type</b>: Drop Shoulder</p><p><b>Placket Type</b>: Pullovers</p><p><b>Sheer</b>: No</p><p><b>Material</b>: Cotton</p><p><b>Composition</b>: 100% Cotton</p><p><b>Fabric</b>: Slight Stretch</p><p><b>Care Instructions</b>: Machine wash or professional dry clean</p><p><b>Style</b>: Casual</p><p><b>Color</b>: White</p><p><b>Pattern Type</b>: Graphic</p><p><b>Length</b>: Long</p><p><b>Season</b>: Summer</p><p><b>Neckline</b>: Round Neck</p><p><b>Sleeve Length</b>: Short Sleeve</p><p><b>Fit Type</b>: Oversized</p><p><b>Sleeve Type</b>: Drop Shoulder</p><p><b>Placket Type</b>: Pullovers</p><p><b>Sheer</b>: No</p><p><b>Material</b>: Cotton</p><p><b>Composition</b>: 100% Cotton</p><p><b>Fabric</b>: Slight Stretch</p><p><b>Care Instructions</b>: Machine wash or professional dry clean</p>,img/T___Shirts/rwtee25210617210.jpg,,Size#S:M:L:,31.65,,,,1,1,,,T-Shirts,,Graphic Oversized Tee,Graphic Oversized Tee,Graphic Oversized Tee,,,,,,,,,
BUNXYPW0023,Colorful Beaded Necklace,,<p><b>Material</b>: Glass</p><p><b>Type</b>: Pendant Necklaces</p><p><b>Color</b>: Multicolor</p><p><b>Style</b>: Casual</p>,img/Pendant_Necklaces/rwneck18210420382.jpg,,Size#,26.57,,,,1,1,,,Pendant Necklaces,,Colorful Beaded Necklace,Colorful Beaded Necklace,Colorful Beaded Necklace,,,,,,,,,
BUNXYPW0024,Elegant Irregular Gem Dangle Earrings Fashion Colorful Crystal Silver Earrings for Women,,"<p>Style: Elegant</p><p>Type: Ear Drop</p><p>Weight: about 3g</p><p>Size: about 3.5cm x 1.2cm</p><p>Material: Zinc Alloy, Crystal</p><p>
	</p><p>1 Pair of Earrings</p>",img/Earrings/SKU965951.jpg,,Size#,13.4,,,,1,1,,,Earrings,,Elegant Irregular Gem Dangle Earrings Fashion Colorful Crystal Silver Earrings for Women,Elegant Irregular Gem Dangle Earrings Fashion Colorful Crystal Silver Earrings for Women,Elegant Irregular Gem Dangle Earrings Fashion Colorful Crystal Silver Earrings for Women,,,,,,,,,
BUNXYPW0025,Women 15 Card Slots Patchwork Long Wallet Purse,,"<p>Color:Pink, Black, Brown, Blue, Red</p><p>Material:PU</p><p>Style:Casual</p>",img/Wallets/SKUD61629.jpg,,Size#,59.35,,,,1,1,,,Wallets,,Women 15 Card Slots Patchwork Long Wallet Purse,Women 15 Card Slots Patchwork Long Wallet Purse,Women 15 Card Slots Patchwork Long Wallet Purse,,,,,,,,,
BUNXYPW0026,Large Size Women Peep Toe Hollow Out Breathable Back Zipper Chunky Heel Sandals,,"<p>Color:Pink, Brown, Grey</p><p>Closure Type:Back-zip</p><p>Heel Type:Chunky Heel</p><p>Heel Height:3-5cm In Low Heel</p><p>Pattern:Solid</p><p>Upper Material:PU</p><p>Style:Casual</p><p>Outsole Material:Rubber</p><p>Occasion:Casual</p><p>Function:Hard-wearing</p><p>Season:Summer</p>",img/Heels/SKUH89262.jpg,,Size#US 5:US 6:US 7:US 8:US 9:US 10:US 11:US 12:,63.18,,,,1,1,,,Heels,,Large Size Women Peep Toe Hollow Out Breathable Back Zipper Chunky Heel Sandals,Large Size Women Peep Toe Hollow Out Breathable Back Zipper Chunky Heel Sandals,Large Size Women Peep Toe Hollow Out Breathable Back Zipper Chunky Heel Sandals,,,,,,,,,
BUNXYPW0027,SOCOFY Leather Bohemian Cutout Flower Pattern Hook Loop Open Toe Casual Comfy Wedge Sandals,,"<p>Color:Blue</p><p>Type:Wedges  Sandals</p><p>Closure Type:Hook & Loop</p><p>Heel Type:Wedges Heel</p><p>Heel Height:5-8cm In Heel</p><p>Toe Type:Opened</p><p>Pattern:Plants</p><p>Design Element:Print</p><p>Upper Material:Leather</p><p>Style:Bohemia</p><p>Outsole Material:Rubber</p><p>Structure:Hook & Loop, T-strap, Opened</p><p>Occasion:Daily</p><p>Decoration:Hollow Out</p><p>Function:Soft</p><p>Season:Spring&Summer</p>",img/Sandals/SKUF20409.jpg,,Size#US 5:US 6:US 7:US 8:US 9.5:US 10.5:US 11.5:,57.92,,,,1,1,,,Sandals,,SOCOFY Leather Bohemian Cutout Flower Pattern Hook Loop Open Toe Casual Comfy Wedge Sandals,SOCOFY Leather Bohemian Cutout Flower Pattern Hook Loop Open Toe Casual Comfy Wedge Sandals,SOCOFY Leather Bohemian Cutout Flower Pattern Hook Loop Open Toe Casual Comfy Wedge Sandals,,,,,,,,,
BUNXYPW0028,Slit Hem Ditsy Floral Print Skirt,,<p><b>Style</b>: Boho</p><p><b>Color</b>: Black and White</p><p><b>Pattern Type</b>: Ditsy Floral</p><p><b>Length</b>: Mini</p><p><b>Type</b>: A Line</p><p><b>Season</b>: Summer</p><p><b>Details</b>: Split</p><p><b>Waist Line</b>: Natural</p><p><b>Sheer</b>: No</p><p><b>Material</b>: Polyester</p><p><b>Composition</b>: 95% Polyester</p><p><b>Composition</b>: 5% Spandex</p><p><b>Fabric</b>: Slight Stretch</p><p><b>Care Instructions</b>: Machine wash or professional dry clean</p>,img/Skirts/swskirt07200227659.jpg,,Size#XS:S:M:L:XL:,27.49,,,,1,1,,,Skirts,,Slit Hem Ditsy Floral Print Skirt,Slit Hem Ditsy Floral Print Skirt,Slit Hem Ditsy Floral Print Skirt,,,,,,,,,
BUNXYPW0029,Strawberry Graphic Ruched Blouse,,<p><b>Style</b>: Casual</p><p><b>Color</b>: Multicolor</p><p><b>Pattern Type</b>: Fruit&Vegetable</p><p><b>Pattern Type</b>: All Over Print</p><p><b>Length</b>: Crop</p><p><b>Season</b>: Summer</p><p><b>Type</b>: Top</p><p><b>Sleeve Type</b>: Puff Sleeve</p><p><b>Fit Type</b>: Regular Fit</p><p><b>Sleeve Length</b>: Short Sleeve</p><p><b>Neckline</b>: Sweetheart</p><p><b>Sheer</b>: No</p><p><b>Placket Type</b>: Pullovers</p><p><b>Material</b>: Polyester</p><p><b>Composition</b>: 100% Polyester</p><p><b>Fabric</b>: Non-Stretch</p><p><b>Care Instructions</b>: Machine wash or professional dry clean</p>,img/Blouses/rwblouse25210525076.jpg,,Size#XS:S:M:L:,25.4,,,,1,1,,,Blouses,,Strawberry Graphic Ruched Blouse,Strawberry Graphic Ruched Blouse,Strawberry Graphic Ruched Blouse,,,,,,,,,
BUNXYPW0030,High Waisted Windbreaker Cargo Joggers,,<p><b>Style</b>: Casual</p><p><b>Color</b>: Lilac Purple</p><p><b>Pattern Type</b>: Plain</p><p><b>Length</b>: Long</p><p><b>Season</b>: All</p><p><b>Type</b>: Cargo Pants</p><p><b>Details</b>: Pocket</p><p><b>Waist Line</b>: High Waist</p><p><b>Fit Type</b>: Regular Fit</p><p><b>Sheer</b>: No</p><p><b>Closure Type</b>: Elastic Waist</p><p><b>Material</b>: Cotton</p><p><b>Composition</b>: 100% Cotton</p><p><b>Fabric</b>: Non-Stretch</p><p><b>Care Instructions</b>: Machine wash or professional dry clean</p>,img/Pants/swpants07200511787.jpg,,Size#XS:S:M:L:XL:,23.27,,,,1,1,,,Pants,,High Waisted Windbreaker Cargo Joggers,High Waisted Windbreaker Cargo Joggers,High Waisted Windbreaker Cargo Joggers,,,,,,,,,
BUNXYPW0031,ROMWE X Ellstrations Hands Print Colorblock Tee,,<p><b>Style</b>: Casual</p><p><b>Color</b>: Black and White</p><p><b>Pattern Type</b>: Colorblock</p><p><b>Pattern Type</b>: Graphic</p><p><b>Length</b>: Crop</p><p><b>Season</b>: Summer</p><p><b>Neckline</b>: Round Neck</p><p><b>Sleeve Length</b>: Short Sleeve</p><p><b>Fit Type</b>: Regular Fit</p><p><b>Sleeve Type</b>: Regular Sleeve</p><p><b>Placket Type</b>: Pullovers</p><p><b>Sheer</b>: No</p><p><b>Material</b>: Polyester</p><p><b>Composition</b>: 65% Polyester</p><p><b>Composition</b>: 30% Cotton</p><p><b>Composition</b>: 5% Spandex</p><p><b>Fabric</b>: Medium Stretch</p><p><b>Care Instructions</b>: Machine wash or professional dry clean</p>,img/T___Shirts/rW210609268467265.jpg,,Size#S:M:L:,32.49,,,,1,1,,,T-Shirts,,ROMWE X Ellstrations Hands Print Colorblock Tee,ROMWE X Ellstrations Hands Print Colorblock Tee,ROMWE X Ellstrations Hands Print Colorblock Tee,,,,,,,,,
BUNXYPW0032,Heart Crystal Pendant Necklace,,<p><b>Details</b>: Crystal</p><p><b>Details</b>: Heart</p><p><b>Type</b>: Pendant Necklaces</p><p><b>Material</b>: Alloy</p><p><b>Color</b>: Blue</p><p><b>Metal Color</b>: Silver</p><p><b>Style</b>: Glamorous</p>,img/Pendant_Necklaces/rwneck18210310137.jpg,,Size#,19.6,,,,1,1,,,Pendant Necklaces,,Heart Crystal Pendant Necklace,Heart Crystal Pendant Necklace,Heart Crystal Pendant Necklace,,,,,,,,,
BUNXYPW0033,Vintage 925 Silver Plated Earrings Simple Tree Leaf Pendant Earrings,,<p>Style: Vintage </p><p>Type: Earrings</p><p>Color: Silver</p><p>Weight: 4.5g</p><p>Length: About 4*1.2 cm / 1.57*0.47 in</p><p>Material: Silver Plated</p><p>1 x Earrings</p>,img/Earrings/SKUG45567.jpg,,Size#,23.77,,,,1,1,,,Earrings,,Vintage 925 Silver Plated Earrings Simple Tree Leaf Pendant Earrings,Vintage 925 Silver Plated Earrings Simple Tree Leaf Pendant Earrings,Vintage 925 Silver Plated Earrings Simple Tree Leaf Pendant Earrings,,,,,,,,,
BUNXYPW0034,Women Genuine Leather Round Coin Purse Wallet,,"<p>Color:Yellow, Orange, Coffee, Green, Black, Brown, Blue, Red</p><p>Wallets Style:Clasp Closure</p><p>Wallet Type:Coin Purse</p><p>Material:Cow Leather</p><p>Pattern:Solid</p>",img/Wallets/SKUG27708.jpg,,Size#S:L:,62.81,,,,1,1,,,Wallets,,Women Genuine Leather Round Coin Purse Wallet,Women Genuine Leather Round Coin Purse Wallet,Women Genuine Leather Round Coin Purse Wallet,,,,,,,,,
