v_sku,v_name,v_short_description,v_description,v_image,v_url,v_attribute,v_price,v_specials_price,v_specials_expire_date,v_date_added,v_in_stock,v_status,v_viewed,v_ordered,v_category_sku,v_sort_order,v_meta_title,v_meta_keywords,v_meta_description,v_brand_filter,v_class_filter,v_color_filter,v_gender_filter,v_material_filter,v_year_filter,v_origin_filter,v_series_filter,v_spec_filter
BUNXYPW0035,SOCOFY Splicing Tie-dye Stitching Rivet Leather Hook Loop Metal Strap Comfy Wearable Cone Heel Pumps,,"<p>Color:Grey</p><p>Type:Loafers</p><p>Closure Type:Hook & Loop</p><p>Heel Type:Cone Heel</p><p>Heel Height:5-8cm In Heel</p><p>Toe Type:Round</p><p>Pattern:Tie-dye</p><p>Design Element:Patchwork, Print</p><p>Upper Material:PU, Leather</p><p>Style:Casual</p><p>Outsole Material:Rubber</p><p>Structure:Hook & Loop</p><p>Occasion:Party, Casual</p><p>Function:Hard-wearing</p><p>Season:Summer, Spring&Fall</p>",img/Heels/SKUH18396.jpg,,Size#US 5:US 6:US 7:US 8:US 9.5:US 10.5:US 11.5:,60.47,,,,1,1,,,Heels,,SOCOFY Splicing Tie-dye Stitching Rivet Leather Hook Loop Metal Strap Comfy Wearable Cone Heel Pumps,SOCOFY Splicing Tie-dye Stitching Rivet Leather Hook Loop Metal Strap Comfy Wearable Cone Heel Pumps,SOCOFY Splicing Tie-dye Stitching Rivet Leather Hook Loop Metal Strap Comfy Wearable Cone Heel Pumps,,,,,,,,,
BUNXYPW0036,Women Casual Holiday Leopard Buckle Stripe Sandals,,"<p>Color:Black, Pink, Brown</p><p>Type:Stripe Sandals</p><p>Closure Type:Buckle</p><p>Heel Type:Flat</p><p>Heel Height:1-3cm In Flat</p><p>Toe Type:Round</p><p>Pattern:Leopard</p><p>Upper Material:PU</p><p>Style:Casual</p><p>Outsole Material:Rubber</p><p>Structure:Buckle</p><p>Occasion:Beach, Holiday, Daily</p><p>Function:Hard-wearing</p><p>Season:Spring&Summer</p>",img/Sandals/SKUH97050.jpg,,Size#US 5:US 6:US 7:US 8:US 9:US 10:US 11:,50.7,,,,1,1,,,Sandals,,Women Casual Holiday Leopard Buckle Stripe Sandals,Women Casual Holiday Leopard Buckle Stripe Sandals,Women Casual Holiday Leopard Buckle Stripe Sandals,,,,,,,,,
BUNXYPW0037,Ditsy Floral Ruffle Hem Skirt,,<p><b>Style</b>: Boho</p><p><b>Color</b>: Multicolor</p><p><b>Pattern Type</b>: Ditsy Floral</p><p><b>Length</b>: Short</p><p><b>Type</b>: Flared</p><p><b>Season</b>: Summer</p><p><b>Details</b>: Ruffle Hem</p><p><b>Waist Line</b>: High Waist</p><p><b>Sheer</b>: No</p><p><b>Material</b>: Polyester</p><p><b>Composition</b>: 100% Polyester</p><p><b>Fabric</b>: Non-Stretch</p><p><b>Care Instructions</b>: Machine wash or professional dry clean</p>,img/Skirts/swskirt30210327881.jpg,,Size#S:M:L:XL:,29.22,,,,1,1,,,Skirts,,Ditsy Floral Ruffle Hem Skirt,Ditsy Floral Ruffle Hem Skirt,Ditsy Floral Ruffle Hem Skirt,,,,,,,,,
BUNXYPW0038,Polka Dot Shirred Crop Blouse,,<p><b>Style</b>: Casual</p><p><b>Color</b>: Red</p><p><b>Pattern Type</b>: Polka Dot</p><p><b>Length</b>: Crop</p><p><b>Season</b>: Summer</p><p><b>Type</b>: Top</p><p><b>Details</b>: Shirred</p><p><b>Sleeve Type</b>: Puff Sleeve</p><p><b>Fit Type</b>: Regular Fit</p><p><b>Sleeve Length</b>: Short Sleeve</p><p><b>Neckline</b>: Sweetheart</p><p><b>Sheer</b>: No</p><p><b>Placket Type</b>: Pullovers</p><p><b>Material</b>: Polyester</p><p><b>Composition</b>: 100% Polyester</p><p><b>Fabric</b>: Non-Stretch</p><p><b>Care Instructions</b>: Machine wash or professional dry clean</p>,img/Blouses/rwblouse25210604297.jpg,,Size#S:M:L:,31.05,,,,1,1,,,Blouses,,Polka Dot Shirred Crop Blouse,Polka Dot Shirred Crop Blouse,Polka Dot Shirred Crop Blouse,,,,,,,,,
BUNXYPW0039,Buttoned Front Cow Print Pants,,<p><b>Style</b>: Casual</p><p><b>Color</b>: Black and White</p><p><b>Pattern Type</b>: Animal</p><p><b>Length</b>: Long</p><p><b>Type</b>: Straight Leg</p><p><b>Season</b>: Spring/Summer/Fall</p><p><b>Details</b>: Pocket</p><p><b>Details</b>: Zipper</p><p><b>Details</b>: Button Front</p><p><b>Waist Line</b>: High Waist</p><p><b>Fit Type</b>: Regular Fit</p><p><b>Sheer</b>: No</p><p><b>Closure Type</b>: Zipper Fly</p><p><b>Material</b>: Polyester</p><p><b>Composition</b>: 100% Polyester</p><p><b>Fabric</b>: Non-Stretch</p><p><b>Care Instructions</b>: Machine wash or professional dry clean</p>,img/Pants/swpants07200810222.jpg,,Size#XS:S:M:L:XL:,27.24,,,,1,1,,,Pants,,Buttoned Front Cow Print Pants,Buttoned Front Cow Print Pants,Buttoned Front Cow Print Pants,,,,,,,,,
BUNXYPW0040,Butterfly & Floral Graphic Tee,,<p><b>Style</b>: Casual</p><p><b>Color</b>: Black</p><p><b>Pattern Type</b>: Floral</p><p><b>Pattern Type</b>: Animal</p><p><b>Length</b>: Long</p><p><b>Season</b>: Summer</p><p><b>Neckline</b>: Round Neck</p><p><b>Sleeve Length</b>: Short Sleeve</p><p><b>Fit Type</b>: Regular Fit</p><p><b>Sleeve Type</b>: Drop Shoulder</p><p><b>Placket Type</b>: Pullovers</p><p><b>Sheer</b>: No</p><p><b>Material</b>: Polyester</p><p><b>Composition</b>: 62.3% Polyester</p><p><b>Composition</b>: 34% Cotton</p><p><b>Composition</b>: 3.7% Spandex</p><p><b>Fabric</b>: Slight Stretch</p><p><b>Care Instructions</b>: Machine wash or professional dry clean</p>,img/T___Shirts/rwtee25210604646.jpg,,Size#S:M:L:XL:,28.16,,,,1,1,,,T-Shirts,,Butterfly & Floral Graphic Tee,Butterfly & Floral Graphic Tee,Butterfly & Floral Graphic Tee,,,,,,,,,
BUNXYPW0041,4pcs Lock & Safety Pin Pendant Necklace,,<p><b>Type</b>: Pendant Necklaces</p><p><b>Details</b>: Rhinestone</p><p><b>Material</b>: Alloy</p><p><b>Color</b>: Silver</p><p><b>Style</b>: Glamorous</p>,img/Pendant_Necklaces/swneck18201029719.jpg,,Size#,19.13,,,,1,1,,,Pendant Necklaces,,4pcs Lock & Safety Pin Pendant Necklace,4pcs Lock & Safety Pin Pendant Necklace,4pcs Lock & Safety Pin Pendant Necklace,,,,,,,,,
BUNXYPW0042,Statement Colorful Hollow Teardrop Spiral Earrings Stainless Steel Drop Earrings Fashion Jewelry,,"<p>Style: Statement</p><p>Type: Ear Drop</p><p>Weight: About 7g</p><p>Material: Stainless Steel</p><p>Main Color: Blue, Colorful</p><p>Size: About 9.7cm * 3cm / 3.82' * 1.18'</p><p>1 Pair of Earrings</p>",img/Earrings/SKU885129.jpg,,Size#,28.91,,,,1,1,,,Earrings,,Statement Colorful Hollow Teardrop Spiral Earrings Stainless Steel Drop Earrings Fashion Jewelry,Statement Colorful Hollow Teardrop Spiral Earrings Stainless Steel Drop Earrings Fashion Jewelry,Statement Colorful Hollow Teardrop Spiral Earrings Stainless Steel Drop Earrings Fashion Jewelry,,,,,,,,,
BUNXYPW0043,Women Short Candy Color Wallet Card Holder Purse,,"<p>Color:Pink, Black, Grey, Purple, Blue</p><p>Material:PU</p>",img/Wallets/SKU599677.jpg,,Size#,57.39,,,,1,1,,,Wallets,,Women Short Candy Color Wallet Card Holder Purse,Women Short Candy Color Wallet Card Holder Purse,Women Short Candy Color Wallet Card Holder Purse,,,,,,,,,
BUNXYPW0044,Women Comfy Rhinestone Peep Toe Breathable Hollow Out Block Heel Business Shoes,,"<p>Color:Beige, Black</p><p>Type:Business Shoes</p><p>Closure Type:Slip-On</p><p>Heel Type:Block Heel</p><p>Heel Height:3-5cm In Low Heel</p><p>Toe Type:AlmondToe</p><p>Pattern:Solid, Joint</p><p>Design Element:Rhinestone</p><p>Upper Material:PU</p><p>Style:Brief</p><p>Outsole Material:Rubber</p><p>Structure:Slip-On</p><p>Occasion:Versatile</p><p>Function:Breathable, Hard-wearing</p><p>Season:Summer, Spring</p>",img/Heels/SKUH16274.jpg,,Size#US 5:US 6:US 7:US 8:US 9:,50.6,,,,1,1,,,Heels,,Women Comfy Rhinestone Peep Toe Breathable Hollow Out Block Heel Business Shoes,Women Comfy Rhinestone Peep Toe Breathable Hollow Out Block Heel Business Shoes,Women Comfy Rhinestone Peep Toe Breathable Hollow Out Block Heel Business Shoes,,,,,,,,,
BUNXYPW0045,Women Casual Black And White Stitched Weaving Hollow-out Fisherman's Sandals,,"<p>Color:Black, White, Black&white</p><p>Type:Fisherman's Sandals</p><p>Closure Type:Hook & Loop</p><p>Heel Type:Flat</p><p>Heel Height:1-3cm In Flat</p><p>Toe Type:Round</p><p>Pattern:Other</p><p>Design Element:Woven, Stitching</p><p>Upper Material:PU</p><p>Style:Casual</p><p>Outsole Material:Rubber</p><p>Structure:Hook & Loop</p><p>Occasion:Casual</p><p>Function:Hard-wearing</p><p>Season:Summer</p>",img/Sandals/SKUI11485.jpg,,Size#US 5:US 6:US 7:US 8:US 9:,62.02,,,,1,1,,,Sandals,,Women Casual Black And White Stitched Weaving Hollow-out Fisherman's Sandals,Women Casual Black And White Stitched Weaving Hollow-out Fisherman's Sandals,Women Casual Black And White Stitched Weaving Hollow-out Fisherman's Sandals,,,,,,,,,
BUNXYPW0046,Lace Up Waist Flare Skirt,,<p><b>Style</b>: Preppy</p><p><b>Color</b>: Black</p><p><b>Length</b>: Mini</p><p><b>Type</b>: Flared</p><p><b>Season</b>: Summer</p><p><b>Details</b>: Lace Up</p><p><b>Details</b>: Grommet Eyelet</p><p><b>Waist Line</b>: High Waist</p><p><b>Sheer</b>: No</p><p><b>Material</b>: Polyester</p><p><b>Composition</b>: 100% Polyester</p><p><b>Fabric</b>: Non-Stretch</p><p><b>Care Instructions</b>: Machine wash or professional dry clean</p>,img/Skirts/swskirt07210415847.jpg,,Size#XS:S:M:L:XL:,23.93,,,,1,1,,,Skirts,,Lace Up Waist Flare Skirt,Lace Up Waist Flare Skirt,Lace Up Waist Flare Skirt,,,,,,,,,
BUNXYPW0047,Tartan Oversized Shirt,,<p><b>Style</b>: Preppy</p><p><b>Color</b>: Multicolor</p><p><b>Pattern Type</b>: Tartan</p><p><b>Length</b>: Long</p><p><b>Season</b>: Spring/Fall</p><p><b>Type</b>: Shirt</p><p><b>Details</b>: Button Front</p><p><b>Neckline</b>: Collar</p><p><b>Sleeve Length</b>: Long Sleeve</p><p><b>Fit Type</b>: Oversized</p><p><b>Sleeve Type</b>: Drop Shoulder</p><p><b>Sheer</b>: No</p><p><b>Placket Type</b>: Placket</p><p><b>Material</b>: Polyester</p><p><b>Composition</b>: 65% Polyester</p><p><b>Composition</b>: 35% Cotton</p><p><b>Fabric</b>: Non-Stretch</p><p><b>Care Instructions</b>: Machine wash or professional dry clean</p>,img/Blouses/rwblouse01200925848.jpg,,Size#XS:S:M:L:XL:,29.77,,,,1,1,,,Blouses,,Tartan Oversized Shirt,Tartan Oversized Shirt,Tartan Oversized Shirt,,,,,,,,,
BUNXYPW0048,Allover Print Self Tie Wide Leg Pants,,<p><b>Style</b>: Casual</p><p><b>Color</b>: Mocha Brown</p><p><b>Pattern Type</b>: All Over Print</p><p><b>Length</b>: Cropped</p><p><b>Type</b>: Wide Leg</p><p><b>Season</b>: Spring/Summer/Fall</p><p><b>Details</b>: Belted</p><p><b>Details</b>: Paper Bag Waist</p><p><b>Waist Line</b>: High Waist</p><p><b>Fit Type</b>: Loose</p><p><b>Sheer</b>: No</p><p><b>Closure Type</b>: Elastic Waist</p><p><b>Belt</b>: Yes</p><p><b>Material</b>: Polyester</p><p><b>Composition</b>: 100% Polyester</p><p><b>Fabric</b>: Slight Stretch</p><p><b>Care Instructions</b>: Machine wash or professional dry clean</p>,img/Pants/swpants00201214164.jpg,,Size#S:M:L:XL:,31.46,,,,1,1,,,Pants,,Allover Print Self Tie Wide Leg Pants,Allover Print Self Tie Wide Leg Pants,Allover Print Self Tie Wide Leg Pants,,,,,,,,,
BUNXYPW0049,Letter Sunflower Graphic Tee,,<p><b>Style</b>: Casual</p><p><b>Color</b>: Beige</p><p><b>Pattern Type</b>: Letter</p><p><b>Pattern Type</b>: Floral</p><p><b>Length</b>: Regular</p><p><b>Season</b>: Summer</p><p><b>Neckline</b>: Round Neck</p><p><b>Sleeve Length</b>: Short Sleeve</p><p><b>Fit Type</b>: Regular Fit</p><p><b>Sleeve Type</b>: Regular Sleeve</p><p><b>Placket Type</b>: Pullovers</p><p><b>Sheer</b>: No</p><p><b>Material</b>: Cotton</p><p><b>Composition</b>: 65% Cotton</p><p><b>Composition</b>: 35% Polyester</p><p><b>Fabric</b>: Medium Stretch</p><p><b>Care Instructions</b>: Machine wash or professional dry clean</p><p><b>Style</b>: Casual</p><p><b>Color</b>: Chocolate Brown</p><p><b>Pattern Type</b>: Letter</p><p><b>Pattern Type</b>: Floral</p><p><b>Length</b>: Regular</p><p><b>Season</b>: Summer</p><p><b>Neckline</b>: Round Neck</p><p><b>Sleeve Length</b>: Short Sleeve</p><p><b>Fit Type</b>: Regular Fit</p><p><b>Sleeve Type</b>: Regular Sleeve</p><p><b>Placket Type</b>: Pullovers</p><p><b>Sheer</b>: No</p><p><b>Material</b>: Cotton</p><p><b>Composition</b>: 65% Cotton</p><p><b>Composition</b>: 35% Polyester</p><p><b>Fabric</b>: Medium Stretch</p><p><b>Care Instructions</b>: Machine wash or professional dry clean</p><p><b>Style</b>: Casual</p><p><b>Color</b>: Green</p><p><b>Pattern Type</b>: Letter</p><p><b>Pattern Type</b>: Floral</p><p><b>Length</b>: Regular</p><p><b>Season</b>: Summer</p><p><b>Neckline</b>: Round Neck</p><p><b>Sleeve Length</b>: Short Sleeve</p><p><b>Fit Type</b>: Regular Fit</p><p><b>Sleeve Type</b>: Regular Sleeve</p><p><b>Placket Type</b>: Pullovers</p><p><b>Sheer</b>: No</p><p><b>Material</b>: Cotton</p><p><b>Composition</b>: 65% Cotton</p><p><b>Composition</b>: 35% Polyester</p><p><b>Fabric</b>: Medium Stretch</p><p><b>Care Instructions</b>: Machine wash or professional dry clean</p>,img/T___Shirts/rwtee25210421212.jpg,,Size#XS:S:M:L:,25.67,,,,1,1,,,T-Shirts,,Letter Sunflower Graphic Tee,Letter Sunflower Graphic Tee,Letter Sunflower Graphic Tee,,,,,,,,,
BUNXYPW0050,Bottle Flower Pendant Chain Necklace,,<p><b>Type</b>: Pendant Necklaces</p><p><b>Color</b>: Multicolor</p><p><b>Metal Color</b>: Silver</p><p><b>Style</b>: Boho</p>,img/Pendant_Necklaces/necklacenc180307322.jpg,,Size#,12.89,,,,1,1,,,Pendant Necklaces,,Bottle Flower Pendant Chain Necklace,Bottle Flower Pendant Chain Necklace,Bottle Flower Pendant Chain Necklace,,,,,,,,,
BUNXYPW0051,Trendy Cherry Pendant Earrings Transparent Dried Petal Fruit Shape Earrings,,"<p>Style: </p><p>Elegant,</p><p>Trendy.</p><p>Type: Earrings</p><p>Color: Red.</p><p>Weight:16.2</p><p>g</p><p>Size: </p><p>About </p><p>8cm /3.15 in</p><p>Material: Glaze.</p><p>1 x Earrings</p>",img/Earrings/SKUH35758.jpg,,Size#,20.07,,,,1,1,,,Earrings,,Trendy Cherry Pendant Earrings Transparent Dried Petal Fruit Shape Earrings,Trendy Cherry Pendant Earrings Transparent Dried Petal Fruit Shape Earrings,Trendy Cherry Pendant Earrings Transparent Dried Petal Fruit Shape Earrings,,,,,,,,,
BUNXYPW0052,Men And Women Long MultiColor Suede Zipper Wallet Leisure 26 Card Slot Purse,,"<p>Color:Pink, Coffee, Green, Black, Grey, Purple, Blue, Red</p><p>Material:PU</p><p>Style:Casual</p>",img/Wallets/SKU869498.jpg,,Size#,57.2,,,,1,1,,,Wallets,,Men And Women Long MultiColor Suede Zipper Wallet Leisure 26 Card Slot Purse,Men And Women Long MultiColor Suede Zipper Wallet Leisure 26 Card Slot Purse,Men And Women Long MultiColor Suede Zipper Wallet Leisure 26 Card Slot Purse,,,,,,,,,
BUNXYPW0053,SOCOFY Retro Hand Stitching Printed Cowhide Leather Comfy Wearable Lace Up Casual Pumps,,"<p>Color:Brown</p><p>Type:Loafers</p><p>Closure Type:Lace-up</p><p>Heel Type:Chunky Heel</p><p>Heel Height:3-5cm In Low Heel</p><p>Toe Type:Round</p><p>Pattern:Calico</p><p>Design Element:Print, Stitching</p><p>Style:Casual, Retro</p><p>Outsole Material:Rubber</p><p>Structure:Lace-up</p><p>Occasion:Party, Casual</p><p>Function:Hard-wearing</p><p>Season:Summer, Spring&Fall</p>",img/Heels/SKUG97931.jpg,,Size#US 5:US 6:US 7:US 8:US 9.5:US 10.5:US 11.5:,58.2,,,,1,1,,,Heels,,SOCOFY Retro Hand Stitching Printed Cowhide Leather Comfy Wearable Lace Up Casual Pumps,SOCOFY Retro Hand Stitching Printed Cowhide Leather Comfy Wearable Lace Up Casual Pumps,SOCOFY Retro Hand Stitching Printed Cowhide Leather Comfy Wearable Lace Up Casual Pumps,,,,,,,,,
BUNXYPW0054,Large Size Comfortable Elastic Band Clip Toe Flat Beach Sandals,,"<p>Color:Golden, Beige, Black, Blue</p><p>Type:T-Strap Sandals</p><p>Closure Type:Slip-On</p><p>Heel Type:Flat</p><p>Heel Height:1-3cm In Flat</p><p>Toe Type:Clip Toe</p><p>Pattern:Solid</p><p>Design Element:Elastic Waist, Metal</p><p>Upper Material:PU</p><p>Style:Bohemia</p><p>Outsole Material:Rubber</p><p>Structure:T-strap</p><p>Occasion:Beach, Daily</p><p>Function:Soft, Hard-wearing</p><p>Season:Summer</p>",img/Sandals/SKU674097.jpg,,Size#US 5:US 6:US 7:US 8:US 9:US 10:US 11:US 12:,61.7,,,,1,1,,,Sandals,,Large Size Comfortable Elastic Band Clip Toe Flat Beach Sandals,Large Size Comfortable Elastic Band Clip Toe Flat Beach Sandals,Large Size Comfortable Elastic Band Clip Toe Flat Beach Sandals,,,,,,,,,
BUNXYPW0055,Solid Elastic Waist Flared Skirt,,<p><b>Style</b>: Casual</p><p><b>Color</b>: Black</p><p><b>Pattern Type</b>: Plain</p><p><b>Length</b>: Midi</p><p><b>Type</b>: Flared</p><p><b>Season</b>: Spring/Summer/Fall</p><p><b>Waist Line</b>: High Waist</p><p><b>Sheer</b>: No</p><p><b>Material</b>: Viscose</p><p><b>Composition</b>: 89% Viscose</p><p><b>Composition</b>: 11% Polyester</p><p><b>Fabric</b>: Non-Stretch</p><p><b>Care Instructions</b>: Machine wash or professional dry clean</p><p><b>Style</b>: Casual</p><p><b>Color</b>: Blue</p><p><b>Pattern Type</b>: Plain</p><p><b>Length</b>: Midi</p><p><b>Type</b>: Flared</p><p><b>Season</b>: Spring/Summer/Fall</p><p><b>Size Fit</b>: Asian sizes are smaller than European and US sizes.</p><p><b>Waist Line</b>: High Waist</p><p><b>Sheer</b>: No</p><p><b>Material</b>: Viscose</p><p><b>Composition</b>: 89% Viscose</p><p><b>Composition</b>: 11% Polyester</p><p><b>Fabric</b>: Non-Stretch</p><p><b>Care Instructions</b>: Machine wash or professional dry clean</p>,img/Skirts/swskirt30210420471.jpg,,Size#S:M:L:XL:,26.05,,,,1,1,,,Skirts,,Solid Elastic Waist Flared Skirt,Solid Elastic Waist Flared Skirt,Solid Elastic Waist Flared Skirt,,,,,,,,,
BUNXYPW0056,Cat Graphic Button Up Blouse,,<p><b>Style</b>: Casual</p><p><b>Color</b>: Black and White</p><p><b>Pattern Type</b>: Cartoon</p><p><b>Length</b>: Regular</p><p><b>Season</b>: Spring/Fall</p><p><b>Type</b>: Shirt</p><p><b>Details</b>: Button Front</p><p><b>Neckline</b>: Collar</p><p><b>Sleeve Length</b>: Long Sleeve</p><p><b>Fit Type</b>: Regular Fit</p><p><b>Sleeve Type</b>: Regular Sleeve</p><p><b>Sheer</b>: No</p><p><b>Placket Type</b>: Placket</p><p><b>Material</b>: Polyester</p><p><b>Composition</b>: 100% Polyester</p><p><b>Fabric</b>: Non-Stretch</p><p><b>Care Instructions</b>: Machine wash or professional dry clean</p>,img/Blouses/swblouse03191223622.jpg,,Size#S:M:L:XL:,23.57,,,,1,1,,,Blouses,,Cat Graphic Button Up Blouse,Cat Graphic Button Up Blouse,Cat Graphic Button Up Blouse,,,,,,,,,
BUNXYPW0057,LUUKSE All Over Print Wide Leg Pants,,<p><b>Style</b>: Boho</p><p><b>Color</b>: Multicolor</p><p><b>Pattern Type</b>: All Over Print</p><p><b>Length</b>: Long</p><p><b>Type</b>: Wide Leg</p><p><b>Season</b>: Spring/Summer/Fall</p><p><b>Details</b>: Zipper</p><p><b>Waist Line</b>: High Waist</p><p><b>Fit Type</b>: Loose</p><p><b>Sheer</b>: No</p><p><b>Closure Type</b>: Zipper Fly</p><p><b>Material</b>: Rayon</p><p><b>Composition</b>: 100% Rayon</p><p><b>Fabric</b>: Non-Stretch</p><p><b>Care Instructions</b>: Machine wash or professional dry clean</p>,img/Pants/swpants42210323352.jpg,,Size#S:M:L:XL:,31.02,,,,1,1,,,Pants,,LUUKSE All Over Print Wide Leg Pants,LUUKSE All Over Print Wide Leg Pants,LUUKSE All Over Print Wide Leg Pants,,,,,,,,,
BUNXYPW0058,2 In 1 Slogan Graphic Tee,,<p><b>Style</b>: Casual</p><p><b>Color</b>: Black</p><p><b>Pattern Type</b>: Letter</p><p><b>Pattern Type</b>: Striped</p><p><b>Length</b>: Regular</p><p><b>Season</b>: Spring/Fall</p><p><b>Sleeve Length</b>: Long Sleeve</p><p><b>Neckline</b>: High Neck</p><p><b>Fit Type</b>: Regular Fit</p><p><b>Sleeve Type</b>: Drop Shoulder</p><p><b>Placket Type</b>: Pullovers</p><p><b>Sheer</b>: No</p><p><b>Material</b>: Polyester</p><p><b>Composition</b>: 65% Polyester</p><p><b>Composition</b>: 35% Cotton</p><p><b>Fabric</b>: Slight Stretch</p><p><b>Care Instructions</b>: Machine wash or professional dry clean</p>,img/T___Shirts/rwtee03201124798.jpg,,Size#S:M:L:,22.54,,,,1,1,,,T-Shirts,,2 In 1 Slogan Graphic Tee,2 In 1 Slogan Graphic Tee,2 In 1 Slogan Graphic Tee,,,,,,,,,
BUNXYPW0059,Rhinestone Trim Heart Shaped Friendship Necklace 2pcs,,<p><b>Composition</b>: 100% Metal</p><p><b>Type</b>: Pendant Necklaces</p><p><b>Details</b>: Rhinestone</p><p><b>Color</b>: Silver</p><p><b>Metal Color</b>: Silver</p><p><b>Style</b>: Casual</p>,img/Pendant_Necklaces/necklaceNC170504302.jpg,,Size#,17.36,,,,1,1,,,Pendant Necklaces,,Rhinestone Trim Heart Shaped Friendship Necklace 2pcs,Rhinestone Trim Heart Shaped Friendship Necklace 2pcs,Rhinestone Trim Heart Shaped Friendship Necklace 2pcs,,,,,,,,,
BUNXYPW0060,Vintage 925 Silver Plated Women Earrings Simple Symmetry Tree Leaf Pendant Earrings,,<p>Style: Vintage </p><p>Type: Earrings</p><p>Color: Silver</p><p>Weight: 3.5g</p><p>Length: About 4.3*1.4 cm / 1.69*0.55 in</p><p>Material: 925 Silver Plated</p><p>1 x Earrings</p>,img/Earrings/SKUG45571.jpg,,Size#,20.86,,,,1,1,,,Earrings,,Vintage 925 Silver Plated Women Earrings Simple Symmetry Tree Leaf Pendant Earrings,Vintage 925 Silver Plated Women Earrings Simple Symmetry Tree Leaf Pendant Earrings,Vintage 925 Silver Plated Women Earrings Simple Symmetry Tree Leaf Pendant Earrings,,,,,,,,,
BUNXYPW0061,Women PU Leather Rose Floral Money Clips 6.5 Inch Phone Bag Wallet Purse,,"<p>Color:Pink, Black, Grey, Purple, Red</p><p>Wallets Style:Zipper</p><p>Wallet Type:Money Clip, Phone Holder</p><p>Material:PU</p><p>Pattern:Floral</p>",img/Wallets/SKUH12669.jpg,,Size#,69.25,,,,1,1,,,Wallets,,Women PU Leather Rose Floral Money Clips 6.5 Inch Phone Bag Wallet Purse,Women PU Leather Rose Floral Money Clips 6.5 Inch Phone Bag Wallet Purse,Women PU Leather Rose Floral Money Clips 6.5 Inch Phone Bag Wallet Purse,,,,,,,,,
BUNXYPW0062,Women Fashion Almond Toe Backless Low Heeled Slingback Shoes,,"<p>Color:Red, Black, Brown, Apricot</p><p>Type:Mary Jane</p><p>Closure Type:Slip-On</p><p>Heel Type:Chunky Heel</p><p>Heel Height:3-5cm In Low Heel</p><p>Toe Type:AlmondToe</p><p>Pattern:Leopard, Solid</p><p>Design Element:Simple</p><p>Upper Material:PU</p><p>Style:Casual</p><p>Outsole Material:Rubber</p><p>Occasion:Date, Holiday, Casual</p><p>Function:Antiskid, Hard-wearing</p><p>Season:Summer, Autumn</p>",img/Heels/SKUH92304.jpg,,Size#US 5:US 6:US 7:US 8:US 9:US 10:US 11:US 12:,53.56,,,,1,1,,,Heels,,Women Fashion Almond Toe Backless Low Heeled Slingback Shoes,Women Fashion Almond Toe Backless Low Heeled Slingback Shoes,Women Fashion Almond Toe Backless Low Heeled Slingback Shoes,,,,,,,,,
BUNXYPW0063,SOCOFY Bohemian Flower Handmade Stitching Genuine Leather Low Heel Adjustable Hook Loop Wedge Sandals,,"<p>Color:Green, Purple, Blue</p><p>Type:Wedges  Sandals</p><p>Closure Type:Slip-On</p><p>Heel Type:Wedges Heel</p><p>Heel Height:3-5cm In Low Heel</p><p>Toe Type:Opened</p><p>Pattern:Calico, Leaf</p><p>Design Element:Floral, Print, Stitching</p><p>Upper Material:Leather</p><p>Style:Casual, Retro, Bohemia</p><p>Outsole Material:Rubber</p><p>Structure:Slip-On</p><p>Occasion:Beach, Daily</p><p>Decoration:Flower</p><p>Function:Hard-wearing</p><p>Season:Summer</p>",img/Sandals/SKU901209.jpg,,Size#US 5:US 6:US 7:US 8:US 9:US 10:US 11:,49.32,,,,1,1,,,Sandals,,SOCOFY Bohemian Flower Handmade Stitching Genuine Leather Low Heel Adjustable Hook Loop Wedge Sandals,SOCOFY Bohemian Flower Handmade Stitching Genuine Leather Low Heel Adjustable Hook Loop Wedge Sandals,SOCOFY Bohemian Flower Handmade Stitching Genuine Leather Low Heel Adjustable Hook Loop Wedge Sandals,,,,,,,,,
BUNXYPW0064,Plaid Print Slit Hem Skirt,,<p><b>Style</b>: Preppy</p><p><b>Color</b>: Blue</p><p><b>Pattern Type</b>: Plaid</p><p><b>Length</b>: Short</p><p><b>Type</b>: A Line</p><p><b>Season</b>: Summer</p><p><b>Details</b>: Split</p><p><b>Waist Line</b>: High Waist</p><p><b>Sheer</b>: No</p><p><b>Material</b>: Polyester</p><p><b>Composition</b>: 100% Polyester</p><p><b>Fabric</b>: Non-Stretch</p><p><b>Care Instructions</b>: Machine wash or professional dry clean</p>,img/Skirts/swskirt02200330025.jpg,,Size#XS:S:M:L:,30.61,,,,1,1,,,Skirts,,Plaid Print Slit Hem Skirt,Plaid Print Slit Hem Skirt,Plaid Print Slit Hem Skirt,,,,,,,,,
BUNXYPW0065,Letter Skull Graphic Button Front Shirt,,<p><b>Style</b>: Casual</p><p><b>Color</b>: Black</p><p><b>Pattern Type</b>: Letter</p><p><b>Pattern Type</b>: Halloween</p><p><b>Length</b>: Long</p><p><b>Season</b>: Summer</p><p><b>Type</b>: Shirt</p><p><b>Details</b>: Button Front</p><p><b>Neckline</b>: Collar</p><p><b>Fit Type</b>: Regular Fit</p><p><b>Sleeve Length</b>: Short Sleeve</p><p><b>Sleeve Type</b>: Regular Sleeve</p><p><b>Sheer</b>: No</p><p><b>Placket Type</b>: Placket</p><p><b>Material</b>: Polyester</p><p><b>Composition</b>: 98% Polyester</p><p><b>Composition</b>: 2% Elastane</p><p><b>Fabric</b>: Slight Stretch</p><p><b>Care Instructions</b>: Machine wash or professional dry clean</p>,img/Blouses/sW210617245607608.jpg,,Size#S:M:L:,26.29,,,,1,1,,,Blouses,,Letter Skull Graphic Button Front Shirt,Letter Skull Graphic Button Front Shirt,Letter Skull Graphic Button Front Shirt,,,,,,,,,
BUNXYPW0066,Striped Crop Pants,,<p><b>Style</b>: Casual</p><p><b>Color</b>: Navy Blue</p><p><b>Pattern Type</b>: Striped</p><p><b>Length</b>: Cropped</p><p><b>Type</b>: Tapered/Carrot</p><p><b>Season</b>: Spring/Summer/Fall</p><p><b>Details</b>: Pocket</p><p><b>Waist Line</b>: High Waist</p><p><b>Fit Type</b>: Regular Fit</p><p><b>Sheer</b>: No</p><p><b>Closure Type</b>: Elastic Waist</p><p><b>Material</b>: Cotton</p><p><b>Composition</b>: 65% Cotton</p><p><b>Composition</b>: 35% Polyester</p><p><b>Fabric</b>: Non-Stretch</p><p><b>Care Instructions</b>: Machine wash or professional dry clean</p>,img/Pants/swpants07210113828.jpg,,Size#XS:S:M:L:,28.76,,,,1,1,,,Pants,,Striped Crop Pants,Striped Crop Pants,Striped Crop Pants,,,,,,,,,
BUNXYPW0067,Sun & Floral Print Tee,,<p><b>Style</b>: Casual</p><p><b>Color</b>: Apricot</p><p><b>Pattern Type</b>: Letter</p><p><b>Pattern Type</b>: Graphic</p><p><b>Length</b>: Regular</p><p><b>Season</b>: Summer</p><p><b>Neckline</b>: Round Neck</p><p><b>Sleeve Length</b>: Short Sleeve</p><p><b>Fit Type</b>: Regular Fit</p><p><b>Sleeve Type</b>: Regular Sleeve</p><p><b>Placket Type</b>: Pullovers</p><p><b>Sheer</b>: No</p><p><b>Material</b>: Polyester</p><p><b>Composition</b>: 65% Polyester</p><p><b>Composition</b>: 35% Cotton</p><p><b>Fabric</b>: High Stretch</p><p><b>Care Instructions</b>: Machine wash or professional dry clean</p>,img/T___Shirts/sW210526181490513.jpg,,Size#S:M:L:,25.62,,,,1,1,,,T-Shirts,,Sun & Floral Print Tee,Sun & Floral Print Tee,Sun & Floral Print Tee,,,,,,,,,
