v_sku,v_name,v_short_description,v_description,v_image,v_url,v_attribute,v_price,v_specials_price,v_specials_expire_date,v_date_added,v_in_stock,v_status,v_viewed,v_ordered,v_category_sku,v_sort_order,v_meta_title,v_meta_keywords,v_meta_description,v_brand_filter,v_class_filter,v_color_filter,v_gender_filter,v_material_filter,v_year_filter,v_origin_filter,v_series_filter,v_spec_filter
DTPOJRY0001,Floral Embroidery Contrast Mesh Crop Top,,<p><b>Style</b>: Boho</p><p><b>Color</b>: Multicolor</p><p><b>Pattern Type</b>: Floral</p><p><b>Length</b>: Crop</p><p><b>Season</b>: Summer</p><p><b>Details</b>: Embroidery</p><p><b>Sleeve Type</b>: Puff Sleeve</p><p><b>Sleeve Length</b>: Short Sleeve</p><p><b>Fit Type</b>: Slim Fit</p><p><b>Neckline</b>: Sweetheart</p><p><b>Placket Type</b>: Pullovers</p><p><b>Sheer</b>: Semi-Sheer</p><p><b>Chest pad</b>: No Padding</p><p><b>Material</b>: Schiffy</p><p><b>Composition</b>: 95% Polyester</p><p><b>Composition</b>: 5% Spandex</p><p><b>Fabric</b>: High Stretch</p><p><b>Care Instructions</b>: Machine wash or professional dry clean</p>,img/Women_Tops/rwtop25210507382.jpg,,Size#S:M:L:,27.89,,,,1,1,,,Women Tops,,Floral Embroidery Contrast Mesh Crop Top,Floral Embroidery Contrast Mesh Crop Top,Floral Embroidery Contrast Mesh Crop Top,,,,,,,,,
DTPOJRY0002,Contrast Binding Wide Waistband Shorts,,<p><b>Style</b>: Sporty</p><p><b>Color</b>: Black</p><p><b>Season</b>: Summer</p><p><b>Type</b>: Track Shorts</p><p><b>Details</b>: Contrast Binding</p><p><b>Waist Line</b>: High Waist</p><p><b>Fit Type</b>: Skinny</p><p><b>Sheer</b>: No</p><p><b>Closure Type</b>: Elastic Waist</p><p><b>Material</b>: Polyester</p><p><b>Composition</b>: 100% Polyester</p><p><b>Fabric</b>: Medium Stretch</p><p><b>Care Instructions</b>: Machine wash or professional dry clean</p>,img/Shorts/swshorts23210531801.jpg,,Size#S:M:L:XL:,25.57,,,,1,1,,,Shorts,,Contrast Binding Wide Waistband Shorts,Contrast Binding Wide Waistband Shorts,Contrast Binding Wide Waistband Shorts,,,,,,,,,
DTPOJRY0003,Floral & Letter Graphic Tank Top,,<p><b>Style</b>: Casual</p><p><b>Color</b>: Lime Green</p><p><b>Pattern Type</b>: Floral</p><p><b>Pattern Type</b>: Letter</p><p><b>Length</b>: Crop</p><p><b>Season</b>: Summer</p><p><b>Type</b>: Tank</p><p><b>Details</b>: Rib-Knit</p><p><b>Neckline</b>: Round Neck</p><p><b>Fit Type</b>: Slim Fit</p><p><b>Sheer</b>: No</p><p><b>Material</b>: Polyester</p><p><b>Composition</b>: 100% Polyester</p><p><b>Fabric</b>: Medium Stretch</p><p><b>Care Instructions</b>: Machine wash or professional dry clean</p>,img/Tank_Tops__Camis/sW210617266771678.jpg,,Size#S:M:L:,29.97,,,,1,1,,,Tank Tops & Cam's,,Floral & Letter Graphic Tank Top,Floral & Letter Graphic Tank Top,Floral & Letter Graphic Tank Top,,,,,,,,,
DTPOJRY0004,Solid Drawstring Bodycon Cami Dress,,<p><b>Style</b>: Casual</p><p><b>Color</b>: Chocolate Brown</p><p><b>Pattern Type</b>: Plain</p><p><b>Length</b>: Mini</p><p><b>Season</b>: Summer</p><p><b>Type</b>: Cami</p><p><b>Details</b>: Rib-Knit</p><p><b>Details</b>: Tie Front</p><p><b>Details</b>: Ruched Bust</p><p><b>Sleeve Length</b>: Sleeveless</p><p><b>Neckline</b>: Spaghetti Strap</p><p><b>Waist Line</b>: Natural</p><p><b>Fit Type</b>: Regular Fit</p><p><b>Sheer</b>: No</p><p><b>Hem Shaped</b>: Straight</p><p><b>Material</b>: Cotton</p><p><b>Composition</b>: 80% Cotton</p><p><b>Composition</b>: 20% Polyester</p><p><b>Fabric</b>: Slight Stretch</p><p><b>Care Instructions</b>: Machine wash or professional dry clean</p>,img/Dresses/rwdress25210609954.jpg,,Size#S:M:L:,22.72,,,,1,1,,,Dresses,,Solid Drawstring Bodycon Cami Dress,Solid Drawstring Bodycon Cami Dress,Solid Drawstring Bodycon Cami Dress,,,,,,,,,
DTPOJRY0005,2pcs Faux Pearl Decor Necklace,,<p><b>Details</b>: Pearls</p><p><b>Material</b>: Pearls</p><p><b>Type</b>: Pendant Necklaces</p><p><b>Color</b>: Silver</p><p><b>Metal Color</b>: Silver</p><p><b>Style</b>: Glamorous</p><p><b>Details</b>: Pearls</p><p><b>Material</b>: Pearls</p><p><b>Type</b>: Pendant Necklaces</p><p><b>Color</b>: Gold</p><p><b>Metal Color</b>: Gold</p><p><b>Style</b>: Glamorous</p>,img/Pendant_Necklaces/swneck18200707386.jpg,,Size#,19.49,,,,1,1,,,Pendant Necklaces,,2pcs Faux Pearl Decor Necklace,2pcs Faux Pearl Decor Necklace,2pcs Faux Pearl Decor Necklace,,,,,,,,,
DTPOJRY0006,Alloy Copper Temperament Wild Flower Dripping Diamond Ring,,"<p>Style: Vintage</p><p>Type: Earrings</p><p>Color: Silver,S925</p><p>Weight: 4.8g</p><p>Size: 6/ 7/ 8/ 9/ 10</p><p>Material: Alloy,Copper</p><p>Package Includes:</p><p>1 x Ring</p><p>Notice:</p>",img/Rings/SKUH75898.jpg,,Size#6:7:8:9:10:,18.15,,,,1,1,,,Rings,,Alloy Copper Temperament Wild Flower Dripping Diamond Ring,Alloy Copper Temperament Wild Flower Dripping Diamond Ring,Alloy Copper Temperament Wild Flower Dripping Diamond Ring,,,,,,,,,
DTPOJRY0007,Women Casual PU Faux Leather Zipper Multi-carry Backpack,,"<p>Color:Blue, Brown, Black, Pink, Red</p><p>Material:Faux Fur, PU</p><p>Pattern:Solid</p>",img/Backpack/SKUC81822.jpg,,Size#M:,64.98,,,,1,1,,,Backpack,,Women Casual PU Faux Leather Zipper Multi-carry Backpack,Women Casual PU Faux Leather Zipper Multi-carry Backpack,Women Casual PU Faux Leather Zipper Multi-carry Backpack,,,,,,,,,
DTPOJRY0008,Men Color Blocking Breathable Knitted Fabric Light Weight Casual Walking Shoes,,"<p>Color:Black, White</p><p>Upper Material:Knitted</p><p>Outsole Material:Rubber</p><p>Type:Walking Shoes</p><p>Function:Breathable, Hard-wearing, Sport, Slip Resistant</p><p>Occasion:Outdoor, Sport</p><p>Closure Type:Slip-On</p><p>Season:All Season</p><p>Toe Type:Round</p>",img/Sneakers__Athletic/SKUH37515.jpg,,Size#US 7.5:US 8:US 8.5:US 9:US 10:US 10.5:US 11:,61.43,,,,1,1,,,Sneakers & Athletic,,Men Color Blocking Breathable Knitted Fabric Light Weight Casual Walking Shoes,Men Color Blocking Breathable Knitted Fabric Light Weight Casual Walking Shoes,Men Color Blocking Breathable Knitted Fabric Light Weight Casual Walking Shoes,,,,,,,,,
DTPOJRY0009,Women Closed Toe Hook Loop Hollow Comfy Slip Resistant Casual Loafers,,"<p>Color:Beige, Black, Brown, White, Blue</p><p>Closure Type:Hook & Loop</p><p>Toe Type:Round</p><p>Upper Material:Leather</p><p>Style:Casual</p><p>Outsole Material:Rubber</p><p>Occasion:Daily</p><p>Function:Breathable, Soft</p><p>Season:Summer</p>",img/Flats/SKUF04106.jpg,,Size#US 5:US 6:US 7:US 8:US 9:US 10:US 11:,64.14,,,,1,1,,,Flats,,Women Closed Toe Hook Loop Hollow Comfy Slip Resistant Casual Loafers,Women Closed Toe Hook Loop Hollow Comfy Slip Resistant Casual Loafers,Women Closed Toe Hook Loop Hollow Comfy Slip Resistant Casual Loafers,,,,,,,,,
DTPOJRY0010,Solid Drawstring Crop Top,,<p><b>Style</b>: Sexy</p><p><b>Color</b>: Black</p><p><b>Pattern Type</b>: Plain</p><p><b>Length</b>: Crop</p><p><b>Season</b>: Summer</p><p><b>Details</b>: Cut Out</p><p><b>Details</b>: Drawstring</p><p><b>Details</b>: Ruched</p><p><b>Sleeve Length</b>: Sleeveless</p><p><b>Fit Type</b>: Slim Fit</p><p><b>Neckline</b>: Sweetheart</p><p><b>Placket Type</b>: Pullovers</p><p><b>Sheer</b>: No</p><p><b>Material</b>: Polyester</p><p><b>Composition</b>: 100% Polyester</p><p><b>Fabric</b>: Non-Stretch</p><p><b>Care Instructions</b>: Machine wash or professional dry clean</p>,img/Women_Tops/rwtop25210508334.jpg,,Size#S:M:L:,24.57,,,,1,1,,,Women Tops,,Solid Drawstring Crop Top,Solid Drawstring Crop Top,Solid Drawstring Crop Top,,,,,,,,,
DTPOJRY0011,Plaid Drawstring Shorts,,<p><b>Style</b>: Casual</p><p><b>Color</b>: Multicolor</p><p><b>Pattern Type</b>: Plaid</p><p><b>Season</b>: Summer</p><p><b>Type</b>: Wide Leg</p><p><b>Details</b>: Knot</p><p><b>Waist Line</b>: Natural</p><p><b>Fit Type</b>: Regular Fit</p><p><b>Sheer</b>: No</p><p><b>Closure Type</b>: Elastic Waist</p><p><b>Material</b>: Polyester</p><p><b>Composition</b>: 80% Polyester</p><p><b>Composition</b>: 20% Cotton</p><p><b>Fabric</b>: Non-Stretch</p><p><b>Care Instructions</b>: Machine wash or professional dry clean</p>,img/Shorts/rwshorts25210618821.jpg,,Size#XS:S:M:L:,28.28,,,,1,1,,,Shorts,,Plaid Drawstring Shorts,Plaid Drawstring Shorts,Plaid Drawstring Shorts,,,,,,,,,
DTPOJRY0012,Floral Graphic Drawstring Ruched Crop Cami,,<p><b>Style</b>: Boho</p><p><b>Color</b>: Pink</p><p><b>Pattern Type</b>: Floral</p><p><b>Length</b>: Crop</p><p><b>Season</b>: Summer</p><p><b>Type</b>: Cami</p><p><b>Details</b>: Drawstring</p><p><b>Details</b>: Ruched</p><p><b>Fit Type</b>: Slim Fit</p><p><b>Neckline</b>: Spaghetti Strap</p><p><b>Sheer</b>: No</p><p><b>Material</b>: Polyester</p><p><b>Composition</b>: 80% Polyester</p><p><b>Composition</b>: 20% Cotton</p><p><b>Fabric</b>: High Stretch</p><p><b>Care Instructions</b>: Machine wash or professional dry clean</p>,img/Tank_Tops__Camis/sW210604480596757.jpg,,Size#XS:S:M:L:,28.15,,,,1,1,,,Tank Tops & Cam's,,Floral Graphic Drawstring Ruched Crop Cami,Floral Graphic Drawstring Ruched Crop Cami,Floral Graphic Drawstring Ruched Crop Cami,,,,,,,,,
DTPOJRY0013,Swiss Dot Cami Dress,,<p><b>Style</b>: Casual</p><p><b>Color</b>: White</p><p><b>Pattern Type</b>: Plain</p><p><b>Length</b>: Mini</p><p><b>Season</b>: Summer</p><p><b>Type</b>: Cami</p><p><b>Sleeve Length</b>: Sleeveless</p><p><b>Neckline</b>: Spaghetti Strap</p><p><b>Waist Line</b>: High Waist</p><p><b>Fit Type</b>: Regular Fit</p><p><b>Sheer</b>: No</p><p><b>Hem Shaped</b>: Flounce</p><p><b>Material</b>: Polyester</p><p><b>Composition</b>: 100% Polyester</p><p><b>Fabric</b>: Non-Stretch</p><p><b>Care Instructions</b>: Machine wash or professional dry clean</p><p><b>Style</b>: Casual</p><p><b>Color</b>: Green</p><p><b>Pattern Type</b>: Plain</p><p><b>Length</b>: Mini</p><p><b>Season</b>: Summer</p><p><b>Type</b>: Cami</p><p><b>Details</b>: Wrap</p><p><b>Sleeve Length</b>: Sleeveless</p><p><b>Neckline</b>: Spaghetti Strap</p><p><b>Waist Line</b>: High Waist</p><p><b>Fit Type</b>: Regular Fit</p><p><b>Sheer</b>: No</p><p><b>Hem Shaped</b>: Flounce</p><p><b>Material</b>: Polyester</p><p><b>Composition</b>: 100% Polyester</p><p><b>Fabric</b>: Non-Stretch</p><p><b>Care Instructions</b>: Machine wash or professional dry clean</p><p><b>Style</b>: Casual</p><p><b>Color</b>: Baby Blue</p><p><b>Pattern Type</b>: Plain</p><p><b>Length</b>: Mini</p><p><b>Season</b>: Summer</p><p><b>Type</b>: Cami</p><p><b>Sleeve Length</b>: Sleeveless</p><p><b>Neckline</b>: Spaghetti Strap</p><p><b>Waist Line</b>: High Waist</p><p><b>Fit Type</b>: Regular Fit</p><p><b>Sheer</b>: No</p><p><b>Hem Shaped</b>: Flounce</p><p><b>Material</b>: Polyester</p><p><b>Composition</b>: 100% Polyester</p><p><b>Fabric</b>: Non-Stretch</p><p><b>Care Instructions</b>: Machine wash or professional dry clean</p>,img/Dresses/rwdress25210518942.jpg,,Size#XS:S:M:L:,23.35,,,,1,1,,,Dresses,,Swiss Dot Cami Dress,Swiss Dot Cami Dress,Swiss Dot Cami Dress,,,,,,,,,
DTPOJRY0014,Faux Pearl Layered Necklace,,<p><b>Details</b>: Pearls</p><p><b>Type</b>: Pendant Necklaces</p><p><b>Material</b>: Plastic</p><p><b>Details</b>: Rhinestone</p><p><b>Type</b>: Layer Sets</p><p><b>Color</b>: Gold</p><p><b>Metal Color</b>: Gold</p><p><b>Style</b>: Casual</p>,img/Pendant_Necklaces/swneck18201022792.jpg,,Size#,15.3,,,,1,1,,,Pendant Necklaces,,Faux Pearl Layered Necklace,Faux Pearl Layered Necklace,Faux Pearl Layered Necklace,,,,,,,,,
DTPOJRY0015,Elegant Finger Ring Rose Gold 18K Gold Zircon Simple Geometric Rings Hands Jewelry for Women,,"<p>
	</p><p>
	</p><p>
	</p><p>
	</p><p>
	</p><p>
	</p><p>
	</p><p>
</p><p>
	 </p><p>Notice:</p>",img/Rings/SKU993890.jpg,,Size#6:7:8:,17.22,,,,1,1,,,Rings,,Elegant Finger Ring Rose Gold 18K Gold Zircon Simple Geometric Rings Hands Jewelry for Women,Elegant Finger Ring Rose Gold 18K Gold Zircon Simple Geometric Rings Hands Jewelry for Women,Elegant Finger Ring Rose Gold 18K Gold Zircon Simple Geometric Rings Hands Jewelry for Women,,,,,,,,,
DTPOJRY0016,Women Large Capacity Floral Waterproof Anti theft Backpack,,<p>Color:Red</p><p>Material:Nylon</p><p>Style:Casual</p><p>Capacity:4A Magazine</p>,img/Backpack/SKUF85902.jpg,,Size#,64.32,,,,1,1,,,Backpack,,Women Large Capacity Floral Waterproof Anti theft Backpack,Women Large Capacity Floral Waterproof Anti theft Backpack,Women Large Capacity Floral Waterproof Anti theft Backpack,,,,,,,,,
DTPOJRY0017,Men Mesh Breathable Outdoor Slip Resistant Hiking Shoes,,"<p>Color:Black, Grey</p><p>Upper Material:Mesh</p><p>Outsole Material:Rubber</p><p>Occasion:Outdoor</p><p>Closure Type:Lace-up</p><p>Toe Type:Round</p>",img/Sneakers__Athletic/SKUE69297.jpg,,Size#US 6.5:US 7.5:US 8:US 8.5:US 9:US 10:US 10.5:US 11:,59.95,,,,1,1,,,Sneakers & Athletic,,Men Mesh Breathable Outdoor Slip Resistant Hiking Shoes,Men Mesh Breathable Outdoor Slip Resistant Hiking Shoes,Men Mesh Breathable Outdoor Slip Resistant Hiking Shoes,,,,,,,,,
DTPOJRY0018,Women Elegant Comfy Veins Color Block Joint Pointed Toe Ballet Flats,,"<p>Color:Green, Red, Blue</p><p>Type:Ballet Flat</p><p>Closure Type:Slip-On</p><p>Heel Type:Flat</p><p>Heel Height:1-3cm In Flat</p><p>Toe Type:Pointed</p><p>Pattern:Color Block, Joint</p><p>Design Element:Veins</p><p>Upper Material:PU</p><p>Style:Casual, Elegant</p><p>Outsole Material:Rubber</p><p>Structure:Slip-On</p><p>Occasion:Casual</p><p>Function:Antiskid, Hard-wearing</p><p>Season:All Season</p>",img/Flats/SKUH16282.jpg,,Size#US 4:US 5:US 6:US 7:US 8:,55.69,,,,1,1,,,Flats,,Women Elegant Comfy Veins Color Block Joint Pointed Toe Ballet Flats,Women Elegant Comfy Veins Color Block Joint Pointed Toe Ballet Flats,Women Elegant Comfy Veins Color Block Joint Pointed Toe Ballet Flats,,,,,,,,,
DTPOJRY0019,Butterfly Print Mesh Sheer Top Without Bra,,<p><b>Style</b>: Casual</p><p><b>Color</b>: Multicolor</p><p><b>Pattern Type</b>: Animal</p><p><b>Length</b>: Crop</p><p><b>Season</b>: Summer</p><p><b>Details</b>: Lettuce Trim</p><p><b>Details</b>: Sheer</p><p><b>Neckline</b>: Round Neck</p><p><b>Sleeve Length</b>: Short Sleeve</p><p><b>Fit Type</b>: Slim Fit</p><p><b>Sleeve Type</b>: Regular Sleeve</p><p><b>Placket Type</b>: Pullovers</p><p><b>Sheer</b>: Yes</p><p><b>Material</b>: Mesh</p><p><b>Composition</b>: 95% Polyester</p><p><b>Composition</b>: 5% Spandex</p><p><b>Fabric</b>: High Stretch</p><p><b>Care Instructions</b>: Machine wash or professional dry clean</p>,img/Women_Tops/swtop07210203855.jpg,,Size#XS:S:M:L:,26.05,,,,1,1,,,Women Tops,,Butterfly Print Mesh Sheer Top Without Bra,Butterfly Print Mesh Sheer Top Without Bra,Butterfly Print Mesh Sheer Top Without Bra,,,,,,,,,
DTPOJRY0020,Striped Tie Front Shorts,,<p><b>Style</b>: Boho</p><p><b>Color</b>: Multicolor</p><p><b>Pattern Type</b>: Striped</p><p><b>Season</b>: Summer</p><p><b>Type</b>: Wide Leg</p><p><b>Details</b>: Paper Bag Waist</p><p><b>Waist Line</b>: High Waist</p><p><b>Fit Type</b>: Loose</p><p><b>Sheer</b>: No</p><p><b>Closure Type</b>: Elastic Waist</p><p><b>Belt</b>: Yes</p><p><b>Material</b>: Polyester</p><p><b>Composition</b>: 100% Polyester</p><p><b>Fabric</b>: Non-Stretch</p><p><b>Care Instructions</b>: Machine wash or professional dry clean</p>,img/Shorts/swshorts23210129419.jpg,,Size#S:M:L:XL:,23.47,,,,1,1,,,Shorts,,Striped Tie Front Shorts,Striped Tie Front Shorts,Striped Tie Front Shorts,,,,,,,,,
DTPOJRY0021,Contrast Lace Ruched Bust Cami,,<p><b>Style</b>: Casual</p><p><b>Color</b>: Pink</p><p><b>Pattern Type</b>: Ditsy Floral</p><p><b>Length</b>: Crop</p><p><b>Season</b>: Summer</p><p><b>Type</b>: Cami</p><p><b>Details</b>: Contrast Lace</p><p><b>Details</b>: Ruched Bust</p><p><b>Fit Type</b>: Regular Fit</p><p><b>Neckline</b>: Spaghetti Strap</p><p><b>Sheer</b>: No</p><p><b>Material</b>: Polyester</p><p><b>Composition</b>: 97% Polyester</p><p><b>Composition</b>: 3% Elastane</p><p><b>Fabric</b>: Medium Stretch</p><p><b>Care Instructions</b>: Machine wash or professional dry clean</p><p><b>Style</b>: Casual</p><p><b>Color</b>: Coral Orange</p><p><b>Length</b>: Crop</p><p><b>Season</b>: Summer</p><p><b>Type</b>: Cami</p><p><b>Details</b>: Contrast Lace</p><p><b>Details</b>: Ruched Bust</p><p><b>Fit Type</b>: Regular Fit</p><p><b>Neckline</b>: Spaghetti Strap</p><p><b>Sheer</b>: No</p><p><b>Material</b>: Polyester</p><p><b>Composition</b>: 97% Polyester</p><p><b>Composition</b>: 3% Elastane</p><p><b>Fabric</b>: Medium Stretch</p><p><b>Care Instructions</b>: Machine wash or professional dry clean</p><p><b>Style</b>: Casual</p><p><b>Color</b>: Multicolor</p><p><b>Length</b>: Crop</p><p><b>Season</b>: Summer</p><p><b>Type</b>: Cami</p><p><b>Details</b>: Contrast Lace</p><p><b>Details</b>: Ruched Bust</p><p><b>Fit Type</b>: Regular Fit</p><p><b>Neckline</b>: Spaghetti Strap</p><p><b>Sheer</b>: No</p><p><b>Material</b>: Polyester</p><p><b>Composition</b>: 97% Polyester</p><p><b>Composition</b>: 3% Elastane</p><p><b>Fabric</b>: Medium Stretch</p><p><b>Care Instructions</b>: Machine wash or professional dry clean</p>,img/Tank_Tops__Camis/rwvest25210513281.jpg,,Size#S:M:L:,23.53,,,,1,1,,,Tank Tops & Cam's,,Contrast Lace Ruched Bust Cami,Contrast Lace Ruched Bust Cami,Contrast Lace Ruched Bust Cami,,,,,,,,,
DTPOJRY0022,Twist Front Cut-out Backless Bodycon Dress,,<p><b>Style</b>: Sexy</p><p><b>Color</b>: Apricot</p><p><b>Pattern Type</b>: Plain</p><p><b>Length</b>: Mini</p><p><b>Season</b>: Summer</p><p><b>Type</b>: Bodycon</p><p><b>Details</b>: Backless</p><p><b>Details</b>: Ruched</p><p><b>Details</b>: Cut Out</p><p><b>Details</b>: Twist</p><p><b>Sleeve Length</b>: Sleeveless</p><p><b>Waist Line</b>: Natural</p><p><b>Fit Type</b>: Slim Fit</p><p><b>Neckline</b>: Straps</p><p><b>Sheer</b>: No</p><p><b>Hem Shaped</b>: Pencil</p><p><b>Material</b>: Polyester</p><p><b>Composition</b>: 100% Polyester</p><p><b>Fabric</b>: Slight Stretch</p><p><b>Care Instructions</b>: Machine wash or professional dry clean</p>,img/Dresses/swdress25210526099.jpg,,Size#XS:S:M:L:,25.66,,,,1,1,,,Dresses,,Twist Front Cut-out Backless Bodycon Dress,Twist Front Cut-out Backless Bodycon Dress,Twist Front Cut-out Backless Bodycon Dress,,,,,,,,,
DTPOJRY0023,Open and Close Photos Geometric Pendant Necklace 1pc,,<p><b>Composition</b>: 100% Alloy</p><p><b>Type</b>: Pendant Necklaces</p><p><b>Color</b>: Gold</p><p><b>Metal Color</b>: Gold</p><p><b>Style</b>: Casual</p>,img/Pendant_Necklaces/swneck03190828200.jpg,,Size#,19.76,,,,1,1,,,Pendant Necklaces,,Open and Close Photos Geometric Pendant Necklace 1pc,Open and Close Photos Geometric Pendant Necklace 1pc,Open and Close Photos Geometric Pendant Necklace 1pc,,,,,,,,,
DTPOJRY0024,Vintage Stylish Alloy Sunflower Pattern Wedding Party Ring,,<p>Style: Vintage</p><p>Type: Ring</p><p>Color: Silver/Gold/Rose Gold.</p><p>Diameter Length: About16.5/ 17.3/ 18.1/ 18.9/ 19.8mm</p><p>Material:  Alloy</p><p>Ring Size:  6/7 / 8 / 9 / 10</p><p>(Please see the size reference for size conversion and detail information.)</p><p>Package Includes:</p><p>1 x Ring</p>,img/Rings/SKUH15325.jpg,,Size#6:7:8:9:10:,24.85,,,,1,1,,,Rings,,Vintage Stylish Alloy Sunflower Pattern Wedding Party Ring,Vintage Stylish Alloy Sunflower Pattern Wedding Party Ring,Vintage Stylish Alloy Sunflower Pattern Wedding Party Ring,,,,,,,,,
DTPOJRY0025,Women Anti theft Large Capacity Waterproof Backpack School Bag,,"<p>Color:Purple, Blue, Black, Pink</p><p>Material:Nylon</p><p>Style:Preppy</p><p>Pattern:Solid</p><p>Capacity:15.6 Inch Laptop</p>",img/Backpack/SKUF56905.jpg,,Size#,58.62,,,,1,1,,,Backpack,,Women Anti theft Large Capacity Waterproof Backpack School Bag,Women Anti theft Large Capacity Waterproof Backpack School Bag,Women Anti theft Large Capacity Waterproof Backpack School Bag,,,,,,,,,
DTPOJRY0026,Men Street Breathable Microfiber Leather Comfy Wearable Lace Up Casual Sneakers,,"<p>Color:Black, White, Khaki</p><p>Upper Material:PU</p><p>Outsole Material:PVC</p><p>Type:Skate Shoes</p><p>Function:Breathable, Soft, Slip Resistant</p><p>Occasion:Daily, Sport</p><p>Closure Type:Lace-up</p><p>Season:Summer, Spring&Fall</p><p>Toe Type:Round</p>",img/Sneakers__Athletic/SKUH25782.jpg,,Size#US 6.5:US 7.5:US 8:US 8.5:US 9:US 10:,64.95,,,,1,1,,,Sneakers & Athletic,,Men Street Breathable Microfiber Leather Comfy Wearable Lace Up Casual Sneakers,Men Street Breathable Microfiber Leather Comfy Wearable Lace Up Casual Sneakers,Men Street Breathable Microfiber Leather Comfy Wearable Lace Up Casual Sneakers,,,,,,,,,
DTPOJRY0027,Women Casual Print Pig Square Toe Large Size Loafers Shoes,,"<p>Color:Orange, Green</p><p>Type:Loafers</p><p>Closure Type:Elastic Band</p><p>Heel Type:Flat</p><p>Heel Height:1-3cm In Flat</p><p>Toe Type:Square</p><p>Pattern:Animal-print</p><p>Design Element:Pattern, Print</p><p>Upper Material:Canvas</p><p>Style:Casual, Stylish</p><p>Outsole Material:Rubber</p><p>Structure:Elastic Band</p><p>Occasion:Casual</p><p>Function:Antiskid, Hard-wearing</p><p>Season:All Season</p>",img/Flats/SKUG95656.jpg,,Size#US 5:US 6:US 7:US 8:US 9:US 10:US 11:US 12:,54.76,,,,1,1,,,Flats,,Women Casual Print Pig Square Toe Large Size Loafers Shoes,Women Casual Print Pig Square Toe Large Size Loafers Shoes,Women Casual Print Pig Square Toe Large Size Loafers Shoes,,,,,,,,,
DTPOJRY0028,Two Tone Tie Front Ribbed Top,,<p><b>Style</b>: Casual</p><p><b>Color</b>: Multicolor</p><p><b>Pattern Type</b>: Colorblock</p><p><b>Length</b>: Crop</p><p><b>Season</b>: Summer</p><p><b>Details</b>: Lettuce Trim</p><p><b>Details</b>: Rib-Knit</p><p><b>Details</b>: Tie Front</p><p><b>Sleeve Length</b>: Short Sleeve</p><p><b>Fit Type</b>: Slim Fit</p><p><b>Neckline</b>: V neck</p><p><b>Sleeve Type</b>: Regular Sleeve</p><p><b>Placket Type</b>: Placket</p><p><b>Sheer</b>: No</p><p><b>Material</b>: Cotton</p><p><b>Composition</b>: 65% Cotton</p><p><b>Composition</b>: 35% Polyester</p><p><b>Fabric</b>: High Stretch</p><p><b>Care Instructions</b>: Machine wash or professional dry clean</p>,img/Women_Tops/sW210611041758793.jpg,,Size#S:M:L:,27.87,,,,1,1,,,Women Tops,,Two Tone Tie Front Ribbed Top,Two Tone Tie Front Ribbed Top,Two Tone Tie Front Ribbed Top,,,,,,,,,
DTPOJRY0029,Elastic Waist Zebra Striped Shorts,,<p><b>Style</b>: Casual</p><p><b>Color</b>: Black and White</p><p><b>Pattern Type</b>: Zebra Stripe</p><p><b>Type</b>: Straight Leg</p><p><b>Season</b>: Summer</p><p><b>Waist Line</b>: Natural</p><p><b>Fit Type</b>: Regular Fit</p><p><b>Sheer</b>: No</p><p><b>Closure Type</b>: Elastic Waist</p><p><b>Material</b>: Polyester</p><p><b>Composition</b>: 92% Polyester</p><p><b>Composition</b>: 8% Spandex</p><p><b>Fabric</b>: Slight Stretch</p><p><b>Care Instructions</b>: Machine wash or professional dry clean</p>,img/Shorts/swshorts07210113765.jpg,,Size#XS:S:M:L:XL:,25.36,,,,1,1,,,Shorts,,Elastic Waist Zebra Striped Shorts,Elastic Waist Zebra Striped Shorts,Elastic Waist Zebra Striped Shorts,,,,,,,,,
DTPOJRY0030,Tie Dye Ribbed Halter Top,,<p><b>Style</b>: Casual</p><p><b>Color</b>: Multicolor</p><p><b>Pattern Type</b>: Tie Dye</p><p><b>Length</b>: Crop</p><p><b>Season</b>: Summer</p><p><b>Type</b>: Halter</p><p><b>Details</b>: Knot</p><p><b>Details</b>: Ruched</p><p><b>Details</b>: Rib-Knit</p><p><b>Neckline</b>: Halter</p><p><b>Fit Type</b>: Regular Fit</p><p><b>Sheer</b>: No</p><p><b>Material</b>: Cotton Blends</p><p><b>Composition</b>: 65% Cotton</p><p><b>Composition</b>: 35% Polyester</p><p><b>Fabric</b>: Medium Stretch</p><p><b>Care Instructions</b>: Machine wash or professional dry clean</p>,img/Tank_Tops__Camis/rwvest01210324899.jpg,,Size#XS:S:M:L:,23.63,,,,1,1,,,Tank Tops & Cam's,,Tie Dye Ribbed Halter Top,Tie Dye Ribbed Halter Top,Tie Dye Ribbed Halter Top,,,,,,,,,
DTPOJRY0031,One Shoulder Tie Dye Bodycon Dress,,<p><b>Style</b>: Sexy</p><p><b>Color</b>: Green</p><p><b>Pattern Type</b>: Tie Dye</p><p><b>Length</b>: Mini</p><p><b>Season</b>: Summer</p><p><b>Type</b>: Bodycon</p><p><b>Details</b>: Cut Out</p><p><b>Details</b>: Asymmetrical</p><p><b>Neckline</b>: One Shoulder</p><p><b>Sleeve Length</b>: Sleeveless</p><p><b>Waist Line</b>: Natural</p><p><b>Fit Type</b>: Slim Fit</p><p><b>Sheer</b>: No</p><p><b>Hem Shaped</b>: Pencil</p><p><b>Material</b>: Polyester</p><p><b>Composition</b>: 95% Polyester</p><p><b>Composition</b>: 5% Elastane</p><p><b>Fabric</b>: High Stretch</p><p><b>Care Instructions</b>: Machine wash or professional dry clean</p>,img/Dresses/swdress23210423668.jpg,,Size#XS:S:M:L:,32.7,,,,1,1,,,Dresses,,One Shoulder Tie Dye Bodycon Dress,One Shoulder Tie Dye Bodycon Dress,One Shoulder Tie Dye Bodycon Dress,,,,,,,,,
DTPOJRY0032,Slogan Pendant Necklace,,<p><b>Type</b>: Pendant Necklaces</p><p><b>Color</b>: Silver</p><p><b>Metal Color</b>: Silver</p><p><b>Style</b>: Casual</p>,img/Pendant_Necklaces/necklacenc180330305.jpg,,Size#,15.41,,,,1,1,,,Pendant Necklaces,,Slogan Pendant Necklace,Slogan Pendant Necklace,Slogan Pendant Necklace,,,,,,,,,
DTPOJRY0033,Vintage Alloy Butterfly-shape Wedding Party Ring,,<p>Style: Vintage</p><p>Type: Ring</p><p>Color: Silver</p><p>Weight: 18g</p><p>Diameter Length: About 15.7/ 16.5/ 17.3/ 18.2/ 18.9/ 19.8/ 20.6mm</p><p>Material:  Alloy</p><p>Ring Size: 6/ 7 / 8 / 9 / 10 </p><p>(Please see the size reference for size conversion and detail information.)</p><p>Package Includes:</p><p>1 x Ring</p>,img/Rings/SKUH03680.jpg,,Size#6:7:8:9:10:,20.47,,,,1,1,,,Rings,,Vintage Alloy Butterfly-shape Wedding Party Ring,Vintage Alloy Butterfly-shape Wedding Party Ring,Vintage Alloy Butterfly-shape Wedding Party Ring,,,,,,,,,
DTPOJRY0034,Women Waterproof Lightweight Multi-carry Large Capacity  Mommy Backpack Crossbody Bag,,"<p>Color:Grey, Black, Green, Pink</p><p>Material:Nylon</p><p>Style:Casual</p><p>Pattern:Solid</p><p>Capacity:15.6 Inch Laptop</p>",img/Backpack/SKUG23174.jpg,,Size#,68.51,,,,1,1,,,Backpack,,Women Waterproof Lightweight Multi-carry Large Capacity  Mommy Backpack Crossbody Bag,Women Waterproof Lightweight Multi-carry Large Capacity  Mommy Backpack Crossbody Bag,Women Waterproof Lightweight Multi-carry Large Capacity  Mommy Backpack Crossbody Bag,,,,,,,,,
