v_sku,v_name,v_short_description,v_description,v_image,v_url,v_attribute,v_price,v_specials_price,v_specials_expire_date,v_date_added,v_in_stock,v_status,v_viewed,v_ordered,v_category_sku,v_sort_order,v_meta_title,v_meta_keywords,v_meta_description,v_brand_filter,v_class_filter,v_color_filter,v_gender_filter,v_material_filter,v_year_filter,v_origin_filter,v_series_filter,v_spec_filter
DTPOJRY0139,Solid Ruched Bust Tie Shoulder Dress,,<p><b>Style</b>: Casual</p><p><b>Color</b>: Yellow</p><p><b>Pattern Type</b>: Plain</p><p><b>Length</b>: Short</p><p><b>Season</b>: Summer</p><p><b>Type</b>: Cami</p><p><b>Details</b>: Knot</p><p><b>Sleeve Length</b>: Sleeveless</p><p><b>Waist Line</b>: High Waist</p><p><b>Fit Type</b>: Regular Fit</p><p><b>Neckline</b>: Straps</p><p><b>Sheer</b>: No</p><p><b>Hem Shaped</b>: Flared</p><p><b>Material</b>: Polyester</p><p><b>Composition</b>: 95% Polyester</p><p><b>Composition</b>: 5% Elastane</p><p><b>Fabric</b>: Slight Stretch</p><p><b>Care Instructions</b>: Machine wash or professional dry clean</p>,img/Dresses/rwdress25210604881.jpg,,Size#S:M:L:,32.65,,,,1,1,,,Dresses,,Solid Ruched Bust Tie Shoulder Dress,Solid Ruched Bust Tie Shoulder Dress,Solid Ruched Bust Tie Shoulder Dress,,,,,,,,,
DTPOJRY0140,Moon Charm Layered Necklace,,<p><b>Type</b>: Pendant Necklaces</p><p><b>Details</b>: Star</p><p><b>Material</b>: Alloy</p><p><b>Type</b>: Layer Sets</p><p><b>Color</b>: Gold</p><p><b>Metal Color</b>: Gold</p><p><b>Style</b>: Casual</p>,img/Pendant_Necklaces/swneck18201030773.jpg,,Size#,21.83,,,,1,1,,,Pendant Necklaces,,Moon Charm Layered Necklace,Moon Charm Layered Necklace,Moon Charm Layered Necklace,,,,,,,,,
DTPOJRY0141,Trendy Multilayer Micro-Zircon Inlaid Pearl Ring,,"<p>
	</p><p>
	</p><p>
	</p><p>
	</p><p>
	</p><p>
	</p><p>
	 </p><p>
	</p><p>
	</p><p>
	</p><p>
	</p><p>
</p><p>Notice:</p>",img/Rings/SKU566688.jpg,,Size#,15.86,,,,1,1,,,Rings,,Trendy Multilayer Micro-Zircon Inlaid Pearl Ring,Trendy Multilayer Micro-Zircon Inlaid Pearl Ring,Trendy Multilayer Micro-Zircon Inlaid Pearl Ring,,,,,,,,,
DTPOJRY0142,Women Retro Large Capacity Anti-theft Backpack,,"<p>Color:Brown, Black</p><p>Material:Faux Fur, PU</p><p>Pattern:Solid</p>",img/Backpack/SKUG80443.jpg,,Size#,66.17,,,,1,1,,,Backpack,,Women Retro Large Capacity Anti-theft Backpack,Women Retro Large Capacity Anti-theft Backpack,Women Retro Large Capacity Anti-theft Backpack,,,,,,,,,
DTPOJRY0143,Men Mesh Super Breathable Light Weight Sport Running Sneakers,,"<p>Color:Black, Grey</p><p>Upper Material:Mesh</p><p>Outsole Material:PU</p><p>Function:Soft</p><p>Closure Type:Lace-up</p><p>Toe Type:Round</p>",img/Sneakers__Athletic/SKU914144.jpg,,Size#US 6.5:US 7.5:US 8:US 8.5:US 9:US 10:,65.67,,,,1,1,,,Sneakers & Athletic,,Men Mesh Super Breathable Light Weight Sport Running Sneakers,Men Mesh Super Breathable Light Weight Sport Running Sneakers,Men Mesh Super Breathable Light Weight Sport Running Sneakers,,,,,,,,,
DTPOJRY0144,Women Elegant Lace Floral Slip-On Breathable Round Toe Flat Loafers Shoes,,"<p>Color:Khaki, Silver, White</p><p>Type:Loafers</p><p>Closure Type:Slip-On</p><p>Heel Type:Flat</p><p>Heel Height:1-3cm In Flat</p><p>Toe Type:Round</p><p>Pattern:Calico, Floral</p><p>Design Element:Lace</p><p>Upper Material:Lace</p><p>Style:Casual, Elegant</p><p>Outsole Material:Rubber</p><p>Structure:Slip-On</p><p>Occasion:Casual</p><p>Function:Breathable, Antiskid, Hard-wearing</p><p>Season:Summer, Spring</p>",img/Flats/SKUH16384.jpg,,Size#US 5:US 6:US 7:US 8:US 9:,62.64,,,,1,1,,,Flats,,Women Elegant Lace Floral Slip-On Breathable Round Toe Flat Loafers Shoes,Women Elegant Lace Floral Slip-On Breathable Round Toe Flat Loafers Shoes,Women Elegant Lace Floral Slip-On Breathable Round Toe Flat Loafers Shoes,,,,,,,,,
DTPOJRY0145,Contrast Lace Mesh Tie Front Top,,<p><b>Style</b>: Sexy</p><p><b>Color</b>: Khaki</p><p><b>Pattern Type</b>: Plain</p><p><b>Length</b>: Crop</p><p><b>Season</b>: Spring/Summer</p><p><b>Details</b>: Tie Front</p><p><b>Sleeve Length</b>: Long Sleeve</p><p><b>Fit Type</b>: Regular Fit</p><p><b>Neckline</b>: V neck</p><p><b>Sleeve Type</b>: Regular Sleeve</p><p><b>Placket Type</b>: Placket</p><p><b>Sheer</b>: Yes</p><p><b>Material</b>: Mesh</p><p><b>Composition</b>: 65% Polyester</p><p><b>Composition</b>: 30% Cotton</p><p><b>Composition</b>: 5% Elastane</p><p><b>Fabric</b>: Slight Stretch</p><p><b>Care Instructions</b>: Machine wash or professional dry clean</p>,img/Women_Tops/rw2106291376281815.jpg,,Size#S:M:L:,26.16,,,,1,1,,,Women Tops,,Contrast Lace Mesh Tie Front Top,Contrast Lace Mesh Tie Front Top,Contrast Lace Mesh Tie Front Top,,,,,,,,,
DTPOJRY0146,Letter Colorblock Track Shorts,,<p><b>Style</b>: Casual</p><p><b>Color</b>: Multicolor</p><p><b>Pattern Type</b>: Letter</p><p><b>Season</b>: Summer</p><p><b>Type</b>: Track Shorts</p><p><b>Waist Line</b>: Natural</p><p><b>Fit Type</b>: Regular Fit</p><p><b>Sheer</b>: No</p><p><b>Closure Type</b>: Elastic Waist</p><p><b>Material</b>: Cotton Blends</p><p><b>Composition</b>: 65% Cotton</p><p><b>Composition</b>: 35% Polyester</p><p><b>Fabric</b>: Slight Stretch</p><p><b>Care Instructions</b>: Machine wash or professional dry clean</p>,img/Shorts/sW210608057110311.jpg,,Size#XS:S:M:L:,32.67,,,,1,1,,,Shorts,,Letter Colorblock Track Shorts,Letter Colorblock Track Shorts,Letter Colorblock Track Shorts,,,,,,,,,
DTPOJRY0147,Letter Graphic Tank Top,,<p><b>Style</b>: Casual</p><p><b>Color</b>: Apricot</p><p><b>Pattern Type</b>: Letter</p><p><b>Pattern Type</b>: Graphic</p><p><b>Length</b>: Crop</p><p><b>Season</b>: Summer</p><p><b>Type</b>: Tank</p><p><b>Details</b>: Rib-Knit</p><p><b>Neckline</b>: Round Neck</p><p><b>Fit Type</b>: Slim Fit</p><p><b>Sheer</b>: No</p><p><b>Material</b>: Polyester</p><p><b>Composition</b>: 100% Polyester</p><p><b>Fabric</b>: High Stretch</p><p><b>Care Instructions</b>: Machine wash or professional dry clean</p>,img/Tank_Tops__Camis/rw2106305444556492.jpg,,Size#S:M:L:,30.52,,,,1,1,,,Tank Tops & Cam's,,Letter Graphic Tank Top,Letter Graphic Tank Top,Letter Graphic Tank Top,,,,,,,,,
DTPOJRY0148,Solid Shirred Knot Dress,,<p><b>Style</b>: Casual</p><p><b>Color</b>: Baby Blue</p><p><b>Pattern Type</b>: Plain</p><p><b>Length</b>: Short</p><p><b>Season</b>: Summer</p><p><b>Type</b>: Cami</p><p><b>Details</b>: Ruffle</p><p><b>Details</b>: Knot</p><p><b>Details</b>: Shirred</p><p><b>Sleeve Length</b>: Sleeveless</p><p><b>Waist Line</b>: High Waist</p><p><b>Fit Type</b>: Slim Fit</p><p><b>Neckline</b>: Straps</p><p><b>Sheer</b>: No</p><p><b>Hem Shaped</b>: Flared</p><p><b>Material</b>: Cotton</p><p><b>Composition</b>: 65% Cotton</p><p><b>Composition</b>: 35% Polyester</p><p><b>Fabric</b>: Non-Stretch</p><p><b>Care Instructions</b>: Machine wash or professional dry clean</p>,img/Dresses/rwdress25210616982.jpg,,Size#XS:S:M:L:,32.85,,,,1,1,,,Dresses,,Solid Shirred Knot Dress,Solid Shirred Knot Dress,Solid Shirred Knot Dress,,,,,,,,,
DTPOJRY0149,Moon Charm Layered Necklace,,<p><b>Type</b>: Pendant Necklaces</p><p><b>Details</b>: Star</p><p><b>Material</b>: Alloy</p><p><b>Type</b>: Layer Sets</p><p><b>Color</b>: Gold</p><p><b>Metal Color</b>: Gold</p><p><b>Style</b>: Casual</p>,img/Pendant_Necklaces/swneck18201030773.jpg,,Size#,24.02,,,,1,1,,,Pendant Necklaces,,Moon Charm Layered Necklace,Moon Charm Layered Necklace,Moon Charm Layered Necklace,,,,,,,,,
DTPOJRY0150,Vintage Literary Hollow Bee Honeycomb Insect Opening Ring,,<p>Style: Vintage</p><p>Type: Ring</p><p>Color: Silver</p><p>Weight: 6g</p><p>Length: About 2 cm / 0.78 in</p><p>Material:  Alloy</p><p>Package Includes:</p><p>1 x Ring</p>,img/Rings/SKUH03684.jpg,,Size#,23.63,,,,1,1,,,Rings,,Vintage Literary Hollow Bee Honeycomb Insect Opening Ring,Vintage Literary Hollow Bee Honeycomb Insect Opening Ring,Vintage Literary Hollow Bee Honeycomb Insect Opening Ring,,,,,,,,,
DTPOJRY0151,Women Men Cat Striped Pattern Printing Large Capacity Backpack,,"<p>Color:Blue, Brown, Red</p><p>Style:Casual</p><p>Pattern:Cat, Striped</p><p>Capacity:15.6 Inch Laptop</p>",img/Backpack/SKUG83983.jpg,,Size#,66.74,,,,1,1,,,Backpack,,Women Men Cat Striped Pattern Printing Large Capacity Backpack,Women Men Cat Striped Pattern Printing Large Capacity Backpack,Women Men Cat Striped Pattern Printing Large Capacity Backpack,,,,,,,,,
DTPOJRY0152,Men Knitted Fabric Lightweight Sport Casual Running Sneakers,,"<p>Color:Black, Grey, White</p><p>Upper Material:Mesh</p><p>Outsole Material:PU</p><p>Function:Breathable, Slip Resistant</p><p>Closure Type:Lace-up</p><p>Toe Type:Round</p>",img/Sneakers__Athletic/SKUE68570.jpg,,Size#US 6.5:US 7.5:US 8:US 8.5:US 9:US 10:US 10.5:,58.12,,,,1,1,,,Sneakers & Athletic,,Men Knitted Fabric Lightweight Sport Casual Running Sneakers,Men Knitted Fabric Lightweight Sport Casual Running Sneakers,Men Knitted Fabric Lightweight Sport Casual Running Sneakers,,,,,,,,,
DTPOJRY0153,Women Casual PU Leather Lace Up White Flat Shoes,,"<p>Color:White</p><p>Type:Loafers</p><p>Closure Type:Slip-On</p><p>Heel Type:Flat</p><p>Heel Height:1-3cm In Flat</p><p>Toe Type:Round</p><p>Pattern:Solid</p><p>Design Element:Ruffle</p><p>Upper Material:PU</p><p>Style:Casual</p><p>Outsole Material:Rubber</p><p>Structure:Elastic Band</p><p>Occasion:Daily</p><p>Function:Antiskid, Soft</p><p>Season:All Season</p>",img/Flats/SKUB71145.jpg,,Size#US 5:US 6:US 7:US 8:US 9:,52.59,,,,1,1,,,Flats,,Women Casual PU Leather Lace Up White Flat Shoes,Women Casual PU Leather Lace Up White Flat Shoes,Women Casual PU Leather Lace Up White Flat Shoes,,,,,,,,,
DTPOJRY0154,Solid Tie Front Ribbed Crop Top,,<p><b>Style</b>: Casual</p><p><b>Color</b>: Dusty Blue</p><p><b>Pattern Type</b>: Plain</p><p><b>Length</b>: Crop</p><p><b>Season</b>: Spring/Fall</p><p><b>Details</b>: Lettuce Trim</p><p><b>Details</b>: Rib-Knit</p><p><b>Details</b>: Tie Front</p><p><b>Sleeve Length</b>: Long Sleeve</p><p><b>Fit Type</b>: Slim Fit</p><p><b>Neckline</b>: V neck</p><p><b>Sleeve Type</b>: Regular Sleeve</p><p><b>Placket Type</b>: Placket</p><p><b>Sheer</b>: No</p><p><b>Material</b>: Cotton</p><p><b>Composition</b>: 65% Cotton</p><p><b>Composition</b>: 35% Polyester</p><p><b>Fabric</b>: Slight Stretch</p><p><b>Care Instructions</b>: Machine wash or professional dry clean</p><p><b>Style</b>: Casual</p><p><b>Color</b>: Beige</p><p><b>Pattern Type</b>: Plain</p><p><b>Length</b>: Crop</p><p><b>Season</b>: Spring/Fall</p><p><b>Details</b>: Lettuce Trim</p><p><b>Details</b>: Rib-Knit</p><p><b>Details</b>: Tie Front</p><p><b>Sleeve Length</b>: Long Sleeve</p><p><b>Fit Type</b>: Slim Fit</p><p><b>Neckline</b>: V neck</p><p><b>Sleeve Type</b>: Regular Sleeve</p><p><b>Placket Type</b>: Placket</p><p><b>Sheer</b>: No</p><p><b>Material</b>: Cotton</p><p><b>Composition</b>: 65% Cotton</p><p><b>Composition</b>: 35% Polyester</p><p><b>Fabric</b>: Slight Stretch</p><p><b>Care Instructions</b>: Machine wash or professional dry clean</p>,img/Women_Tops/rwtop25210508660.jpg,,Size#XS:S:M:L:XL:XXL:,31.77,,,,1,1,,,Women Tops,,Solid Tie Front Ribbed Crop Top,Solid Tie Front Ribbed Crop Top,Solid Tie Front Ribbed Crop Top,,,,,,,,,
DTPOJRY0155,Letter Embroidery Tape Waist Shorts,,<p><b>Style</b>: Sporty</p><p><b>Color</b>: Black</p><p><b>Pattern Type</b>: Letter</p><p><b>Season</b>: Summer</p><p><b>Type</b>: Track Shorts</p><p><b>Details</b>: Embroidery</p><p><b>Waist Line</b>: Natural</p><p><b>Fit Type</b>: Regular Fit</p><p><b>Sheer</b>: No</p><p><b>Closure Type</b>: Elastic Waist</p><p><b>Material</b>: Cotton</p><p><b>Composition</b>: 65% Cotton</p><p><b>Composition</b>: 35% Polyester</p><p><b>Fabric</b>: Slight Stretch</p><p><b>Care Instructions</b>: Machine wash or professional dry clean</p>,img/Shorts/rw2106287759666207.jpg,,Size#S:M:L:,26.24,,,,1,1,,,Shorts,,Letter Embroidery Tape Waist Shorts,Letter Embroidery Tape Waist Shorts,Letter Embroidery Tape Waist Shorts,,,,,,,,,
DTPOJRY0156,Solid Cut Out Halter Top,,<p><b>Style</b>: Casual</p><p><b>Color</b>: Coffee Brown</p><p><b>Pattern Type</b>: Plain</p><p><b>Length</b>: Crop</p><p><b>Season</b>: Summer</p><p><b>Type</b>: Halter</p><p><b>Details</b>: Cut Out</p><p><b>Neckline</b>: Halter</p><p><b>Fit Type</b>: Slim Fit</p><p><b>Sheer</b>: No</p><p><b>Material</b>: Cotton</p><p><b>Composition</b>: 65% Cotton</p><p><b>Composition</b>: 35% Polyester</p><p><b>Fabric</b>: Slight Stretch</p><p><b>Care Instructions</b>: Machine wash or professional dry clean</p><p><b>Style</b>: Casual</p><p><b>Color</b>: Black</p><p><b>Pattern Type</b>: Plain</p><p><b>Length</b>: Crop</p><p><b>Season</b>: Summer</p><p><b>Type</b>: Halter</p><p><b>Details</b>: Cut Out</p><p><b>Neckline</b>: Halter</p><p><b>Fit Type</b>: Slim Fit</p><p><b>Sheer</b>: No</p><p><b>Material</b>: Cotton</p><p><b>Composition</b>: 65% Cotton</p><p><b>Composition</b>: 35% Polyester</p><p><b>Fabric</b>: Slight Stretch</p><p><b>Care Instructions</b>: Machine wash or professional dry clean</p>,img/Tank_Tops__Camis/rwvest25210608574.jpg,,Size#S:M:L:XL:,24.37,,,,1,1,,,Tank Tops & Cam's,,Solid Cut Out Halter Top,Solid Cut Out Halter Top,Solid Cut Out Halter Top,,,,,,,,,
DTPOJRY0157,Fire Print One Shoulder Drawstring Ruched Dress,,<p><b>Style</b>: Sexy</p><p><b>Color</b>: Pink</p><p><b>Pattern Type</b>: Fire</p><p><b>Length</b>: Short</p><p><b>Season</b>: Summer</p><p><b>Type</b>: Bodycon</p><p><b>Details</b>: Ruched</p><p><b>Details</b>: Drawstring</p><p><b>Neckline</b>: One Shoulder</p><p><b>Sleeve Length</b>: Sleeveless</p><p><b>Waist Line</b>: Natural</p><p><b>Fit Type</b>: Slim Fit</p><p><b>Sheer</b>: No</p><p><b>Hem Shaped</b>: Pencil</p><p><b>Material</b>: Cotton</p><p><b>Composition</b>: 65% Cotton</p><p><b>Composition</b>: 35% Polyester</p><p><b>Fabric</b>: Medium Stretch</p><p><b>Care Instructions</b>: Machine wash or professional dry clean</p>,img/Dresses/rwdress25210508734.jpg,,Size#S:M:L:,25.1,,,,1,1,,,Dresses,,Fire Print One Shoulder Drawstring Ruched Dress,Fire Print One Shoulder Drawstring Ruched Dress,Fire Print One Shoulder Drawstring Ruched Dress,,,,,,,,,
DTPOJRY0158,Butterfly Charm Layered Necklace,,<p><b>Type</b>: Pendant Necklaces</p><p><b>Material</b>: Alloy</p><p><b>Details</b>: Butterfly</p><p><b>Type</b>: Layer Sets</p><p><b>Color</b>: Silver</p><p><b>Metal Color</b>: Silver</p><p><b>Style</b>: Casual</p>,img/Pendant_Necklaces/swneck18200628413.jpg,,Size#,20.68,,,,1,1,,,Pendant Necklaces,,Butterfly Charm Layered Necklace,Butterfly Charm Layered Necklace,Butterfly Charm Layered Necklace,,,,,,,,,
DTPOJRY0159,Alloy Punk Hip Hop 3D Animal Owl Unisex Engraving Animal-shape Ring,,"<p>Style: Vintage,Punk,Hip-hop</p><p>Type: Rings</p><p>Color: Grey</p><p>Weight: 4.8g</p><p>Size: 6/ 7/ 8/ 9/ 10/11/ 12</p><p>Material: Alloy</p><p>Package Includes:</p><p>1 x Ring</p><p>Notice:</p>",img/Rings/SKUH75899.jpg,,Size#6:7:8:9:10:11:12:,15.91,,,,1,1,,,Rings,,Alloy Punk Hip Hop 3D Animal Owl Unisex Engraving Animal-shape Ring,Alloy Punk Hip Hop 3D Animal Owl Unisex Engraving Animal-shape Ring,Alloy Punk Hip Hop 3D Animal Owl Unisex Engraving Animal-shape Ring,,,,,,,,,
DTPOJRY0160,3 PCS PU Leather Women Backpacks Students Schoolbags,,"<p>Color:Grey, Black, Pink</p><p>Material:PU</p><p>Style:Casual</p>",img/Backpack/SKU663352.jpg,,Size#,60.26,,,,1,1,,,Backpack,,3 PCS PU Leather Women Backpacks Students Schoolbags,3 PCS PU Leather Women Backpacks Students Schoolbags,3 PCS PU Leather Women Backpacks Students Schoolbags,,,,,,,,,
DTPOJRY0161,Men Anti-collision Breathable Knitted Fabric Outdoor Hiking Shoes,,"<p>Color:Black, Brown</p><p>Upper Material:PU, Knitted</p><p>Outsole Material:Rubber</p><p>Type:Outdoor Shoes, Hiking Shoes</p><p>Function:Breathable, Hard-wearing, Sport, Slip Resistant</p><p>Occasion:Outdoor, Daily, Sport, Climbing</p><p>Closure Type:Lace-up</p><p>Season:All Season</p><p>Toe Type:Round</p>",img/Sneakers__Athletic/SKUH43132.jpg,,Size#US 6.5:US 7.5:US 8:US 8.5:US 9:US 10:US 10.5:US 11:,53.59,,,,1,1,,,Sneakers & Athletic,,Men Anti-collision Breathable Knitted Fabric Outdoor Hiking Shoes,Men Anti-collision Breathable Knitted Fabric Outdoor Hiking Shoes,Men Anti-collision Breathable Knitted Fabric Outdoor Hiking Shoes,,,,,,,,,
DTPOJRY0162,SOCOFY Retro Printing Genuine Leather Splicing Floral Folkways Hook Loop Shoes,,"<p>Color:Camel</p><p>Type:Hand Stitching shoes, Loafers</p><p>Closure Type:Hook & Loop</p><p>Heel Type:Flat</p><p>Heel Height:1-3cm In Flat</p><p>Toe Type:Round</p><p>Pattern:Calico</p><p>Design Element:Floral, Print, Stitching</p><p>Upper Material:Leather</p><p>Style:Casual, Retro, Stylish, Elegant</p><p>Outsole Material:Rubber</p><p>Structure:Hook & Loop</p><p>Occasion:Daily, School</p><p>Function:Hard-wearing</p><p>Season:Summer</p>",img/Flats/SKUE59000.jpg,,Size#US 5:US 6:US 7:US 8:US 9.5:US 10.5:US 11.5:,52.64,,,,1,1,,,Flats,,SOCOFY Retro Printing Genuine Leather Splicing Floral Folkways Hook Loop Shoes,SOCOFY Retro Printing Genuine Leather Splicing Floral Folkways Hook Loop Shoes,SOCOFY Retro Printing Genuine Leather Splicing Floral Folkways Hook Loop Shoes,,,,,,,,,
DTPOJRY0163,Striped Tie Front Crop Top,,<p><b>Style</b>: Sexy</p><p><b>Color</b>: Black and White</p><p><b>Pattern Type</b>: Striped</p><p><b>Length</b>: Crop</p><p><b>Season</b>: Summer</p><p><b>Details</b>: Tie Front</p><p><b>Sleeve Length</b>: Short Sleeve</p><p><b>Fit Type</b>: Slim Fit</p><p><b>Sleeve Type</b>: Regular Sleeve</p><p><b>Placket Type</b>: Placket</p><p><b>Sheer</b>: No</p><p><b>Material</b>: Cotton</p><p><b>Composition</b>: 95% Cotton</p><p><b>Composition</b>: 5% Elastane</p><p><b>Fabric</b>: Medium Stretch</p><p><b>Care Instructions</b>: Machine wash or professional dry clean</p>,img/Women_Tops/swtop25210602900.jpg,,Size#XS:S:M:L:,31.14,,,,1,1,,,Women Tops,,Striped Tie Front Crop Top,Striped Tie Front Crop Top,Striped Tie Front Crop Top,,,,,,,,,
DTPOJRY0164,Two Tone Tie Front Shorts,,<p><b>Style</b>: Casual</p><p><b>Color</b>: Blue</p><p><b>Pattern Type</b>: Colorblock</p><p><b>Season</b>: Summer</p><p><b>Type</b>: Track Shorts</p><p><b>Details</b>: Tie Front</p><p><b>Waist Line</b>: Natural</p><p><b>Fit Type</b>: Regular Fit</p><p><b>Sheer</b>: No</p><p><b>Closure Type</b>: Elastic Waist</p><p><b>Material</b>: Polyester</p><p><b>Composition</b>: 65% Polyester</p><p><b>Composition</b>: 35% Cotton</p><p><b>Fabric</b>: Slight Stretch</p><p><b>Care Instructions</b>: Machine wash or professional dry clean</p>,img/Shorts/rwshorts25210420261.jpg,,Size#XS:S:M:L:,32.9,,,,1,1,,,Shorts,,Two Tone Tie Front Shorts,Two Tone Tie Front Shorts,Two Tone Tie Front Shorts,,,,,,,,,
DTPOJRY0165,Solid Crop Tank Top,,<p><b>Style</b>: Casual</p><p><b>Color</b>: White</p><p><b>Pattern Type</b>: Plain</p><p><b>Length</b>: Crop</p><p><b>Season</b>: Summer</p><p><b>Type</b>: Tank</p><p><b>Neckline</b>: Round Neck</p><p><b>Fit Type</b>: Slim Fit</p><p><b>Sheer</b>: No</p><p><b>Material</b>: Polyester</p><p><b>Composition</b>: 100% Polyester</p><p><b>Fabric</b>: Medium Stretch</p><p><b>Care Instructions</b>: Machine wash or professional dry clean</p>,img/Tank_Tops__Camis/rwvest03210126472.jpg,,Size#XS:S:M:L:,25.97,,,,1,1,,,Tank Tops & Cam's,,Solid Crop Tank Top,Solid Crop Tank Top,Solid Crop Tank Top,,,,,,,,,
DTPOJRY0166,Plunging Neck Cut-out Bodycon Dress,,<p><b>Style</b>: Sexy</p><p><b>Color</b>: Black</p><p><b>Pattern Type</b>: Plain</p><p><b>Length</b>: Mini</p><p><b>Season</b>: Summer</p><p><b>Type</b>: Bodycon</p><p><b>Details</b>: Cut Out</p><p><b>Details</b>: Rib-Knit</p><p><b>Sleeve Length</b>: Sleeveless</p><p><b>Neckline</b>: Halter</p><p><b>Waist Line</b>: Natural</p><p><b>Fit Type</b>: Slim Fit</p><p><b>Sheer</b>: No</p><p><b>Hem Shaped</b>: Pencil</p><p><b>Material</b>: Polyester</p><p><b>Composition</b>: 100% Polyester</p><p><b>Fabric</b>: Medium Stretch</p><p><b>Care Instructions</b>: Machine wash or professional dry clean</p>,img/Dresses/swdress25210518911.jpg,,Size#XS:S:M:L:,29.45,,,,1,1,,,Dresses,,Plunging Neck Cut-out Bodycon Dress,Plunging Neck Cut-out Bodycon Dress,Plunging Neck Cut-out Bodycon Dress,,,,,,,,,
DTPOJRY0167,Cherry Charm Necklace,,<p><b>Type</b>: Pendant Necklaces</p><p><b>Material</b>: Copper</p><p><b>Details</b>: Fruit</p><p><b>Color</b>: Rose Gold</p><p><b>Metal Color</b>: Gold</p><p><b>Style</b>: Casual</p>,img/Pendant_Necklaces/swneck18201110833.jpg,,Size#,22.97,,,,1,1,,,Pendant Necklaces,,Cherry Charm Necklace,Cherry Charm Necklace,Cherry Charm Necklace,,,,,,,,,
DTPOJRY0168,Vintage 925 Thai Silver Amethyst Ring Hollow Inlaid Diamond Women Ring,,"<p>Style: Vintage </p><p>Type: Ring</p><p>Color: Silver</p><p>Weight: 6g</p><p>Size: 6, 7, 8, 9, 10, 11</p><p>Material: Alloy, Amethyst </p><p>1 x Ring</p>",img/Rings/SKUG59162.jpg,,Size#6:7:8:9:10:11:,27.32,,,,1,1,,,Rings,,Vintage 925 Thai Silver Amethyst Ring Hollow Inlaid Diamond Women Ring,Vintage 925 Thai Silver Amethyst Ring Hollow Inlaid Diamond Women Ring,Vintage 925 Thai Silver Amethyst Ring Hollow Inlaid Diamond Women Ring,,,,,,,,,
DTPOJRY0169,Women Oxford Large Capacity Waterproof Anti theft Backpack,,"<p>Color:Blue, Grey, Black, Green, Army Green, Red</p><p>Style:Preppy, Casual</p><p>Pattern:Other</p><p>Decoration:Other</p><p>Capacity:15.6 Inch Laptop</p>",img/Backpack/SKUF23524.jpg,,Size#,63.33,,,,1,1,,,Backpack,,Women Oxford Large Capacity Waterproof Anti theft Backpack,Women Oxford Large Capacity Waterproof Anti theft Backpack,Women Oxford Large Capacity Waterproof Anti theft Backpack,,,,,,,,,
DTPOJRY0170,Men Anti-smash Puncture-proof Insulated Steel Toe Cap Soft Sole Safety Work Shoes,,"<p>Color:Black</p><p>Upper Material:Knitted</p><p>Outsole Material:Rubber</p><p>Type:Safety shoes</p><p>Function:Breathable, Soft, Slip Resistant</p><p>Occasion:Sport</p><p>Closure Type:Lace-up</p><p>Season:Spring&Summer, Spring&Fall</p><p>Toe Type:Round</p>",img/Sneakers__Athletic/SKUF80455.jpg,,Size#US 6.5:US 7.5:US 8:US 8.5:US 9:US 10:US 10.5:US 11:US 11.5:US 12:,57.65,,,,1,1,,,Sneakers & Athletic,,Men Anti-smash Puncture-proof Insulated Steel Toe Cap Soft Sole Safety Work Shoes,Men Anti-smash Puncture-proof Insulated Steel Toe Cap Soft Sole Safety Work Shoes,Men Anti-smash Puncture-proof Insulated Steel Toe Cap Soft Sole Safety Work Shoes,,,,,,,,,
DTPOJRY0171,SOCOFY Folkways Floral Pattern Genuine Leather Splicing Jacquard Comfortable Zipper Flat Shoes,,"<p>Color:Green</p><p>Type:Loafers</p><p>Closure Type:Zipper</p><p>Heel Type:Flat</p><p>Heel Height:1-3cm In Flat</p><p>Toe Type:Round</p><p>Pattern:Tribal, Calico</p><p>Design Element:Print, Stitching</p><p>Upper Material:Leather</p><p>Style:Casual, Retro, Classic, Elegant</p><p>Outsole Material:Rubber</p><p>Structure:Slip-On</p><p>Occasion:Daily</p><p>Function:Hard-wearing</p><p>Season:Summer</p>",img/Flats/SKUC26435.jpg,,Size#US 5:US 6:US 7:US 8:US 9:US 10:US 11:,55.6,,,,1,1,,,Flats,,SOCOFY Folkways Floral Pattern Genuine Leather Splicing Jacquard Comfortable Zipper Flat Shoes,SOCOFY Folkways Floral Pattern Genuine Leather Splicing Jacquard Comfortable Zipper Flat Shoes,SOCOFY Folkways Floral Pattern Genuine Leather Splicing Jacquard Comfortable Zipper Flat Shoes,,,,,,,,,
DTPOJRY0172,Solid Tie Front Crop Top Without Cami Top,,<p><b>Style</b>: Casual</p><p><b>Color</b>: Black</p><p><b>Pattern Type</b>: Plain</p><p><b>Length</b>: Crop</p><p><b>Season</b>: Spring/Summer</p><p><b>Details</b>: Tie Front</p><p><b>Sleeve Length</b>: Long Sleeve</p><p><b>Fit Type</b>: Regular Fit</p><p><b>Neckline</b>: Scoop Neck</p><p><b>Sleeve Type</b>: Regular Sleeve</p><p><b>Placket Type</b>: Placket</p><p><b>Sheer</b>: No</p><p><b>Material</b>: Polyester</p><p><b>Composition</b>: 60% Polyester</p><p><b>Composition</b>: 35% Cotton</p><p><b>Composition</b>: 5% Elastane</p><p><b>Fabric</b>: Medium Stretch</p><p><b>Care Instructions</b>: Machine wash or professional dry clean</p><p><b>Style</b>: Casual</p><p><b>Color</b>: White</p><p><b>Pattern Type</b>: Plain</p><p><b>Length</b>: Crop</p><p><b>Season</b>: Spring/Summer</p><p><b>Details</b>: Tie Front</p><p><b>Sleeve Length</b>: Long Sleeve</p><p><b>Fit Type</b>: Regular Fit</p><p><b>Neckline</b>: Scoop Neck</p><p><b>Sleeve Type</b>: Regular Sleeve</p><p><b>Placket Type</b>: Placket</p><p><b>Sheer</b>: No</p><p><b>Material</b>: Polyester</p><p><b>Composition</b>: 60% Polyester</p><p><b>Composition</b>: 35% Cotton</p><p><b>Composition</b>: 5% Elastane</p><p><b>Fabric</b>: Medium Stretch</p><p><b>Care Instructions</b>: Machine wash or professional dry clean</p>,img/Women_Tops/swtop30210407502.jpg,,Size#S:M:L:XL:,22.23,,,,1,1,,,Women Tops,,Solid Tie Front Crop Top Without Cami Top,Solid Tie Front Crop Top Without Cami Top,Solid Tie Front Crop Top Without Cami Top,,,,,,,,,
DTPOJRY0173,Contrast Binding Butterfly Print Track Shorts,,<p><b>Style</b>: Casual</p><p><b>Color</b>: Multicolor</p><p><b>Pattern Type</b>: Animal</p><p><b>Type</b>: Track Shorts</p><p><b>Season</b>: Spring/Summer/Fall</p><p><b>Details</b>: Knot</p><p><b>Details</b>: Contrast Binding</p><p><b>Waist Line</b>: High Waist</p><p><b>Fit Type</b>: Regular Fit</p><p><b>Sheer</b>: No</p><p><b>Closure Type</b>: Elastic Waist</p><p><b>Material</b>: Polyester</p><p><b>Composition</b>: 95% Polyester</p><p><b>Composition</b>: 5% Spandex</p><p><b>Fabric</b>: Non-Stretch</p><p><b>Care Instructions</b>: Machine wash or professional dry clean</p>,img/Shorts/swshorts07201228130.jpg,,Size#XS:S:M:L:XL:,28.91,,,,1,1,,,Shorts,,Contrast Binding Butterfly Print Track Shorts,Contrast Binding Butterfly Print Track Shorts,Contrast Binding Butterfly Print Track Shorts,,,,,,,,,
