v_sku,v_name,v_short_description,v_description,v_image,v_url,v_attribute,v_price,v_specials_price,v_specials_expire_date,v_date_added,v_in_stock,v_status,v_viewed,v_ordered,v_category_sku,v_sort_order,v_meta_title,v_meta_keywords,v_meta_description,v_brand_filter,v_class_filter,v_color_filter,v_gender_filter,v_material_filter,v_year_filter,v_origin_filter,v_series_filter,v_spec_filter
DTPOJRY0035,Men Brief Pure Color Warm Lining Lace-up Mid Calf Walking Shoes,,"<p>Color:Black</p><p>Upper Material:PU</p><p>Outsole Material:Rubber</p><p>Type:Walking Shoes</p><p>Function:Warm Lined, Hard-wearing</p><p>Occasion:Outdoor, Sport</p><p>Closure Type:Lace-up</p><p>Season:Winter, Autumn</p><p>Toe Type:Round</p>",img/Sneakers__Athletic/SKUH10772.jpg,,Size#US 6.5:US 7.5:US 8:US 8.5:US 9:US 10:,53.93,,,,1,1,,,Sneakers & Athletic,,Men Brief Pure Color Warm Lining Lace-up Mid Calf Walking Shoes,Men Brief Pure Color Warm Lining Lace-up Mid Calf Walking Shoes,Men Brief Pure Color Warm Lining Lace-up Mid Calf Walking Shoes,,,,,,,,,
DTPOJRY0036,SOCOFY Ethnic Splicing Colorful Striped Linen Comfy Breathable Slip On Casual Espadrille Flat Shoes,,"<p>Color:Green, Blue</p><p>Type:Loafers</p><p>Closure Type:Slip-On</p><p>Heel Type:Flat</p><p>Heel Height:1-3cm In Flat</p><p>Toe Type:Round</p><p>Pattern:Striped</p><p>Design Element:Stitching</p><p>Style:Casual, Ethnic</p><p>Outsole Material:Rubber</p><p>Structure:Slip-On</p><p>Occasion:Casual, Daily</p><p>Function:Breathable, Hard-wearing</p><p>Season:Summer, Spring&Fall</p>",img/Flats/SKUG88477.jpg,,Size#US 5:US 6:US 7:US 8:US 9:US 10:US 11:,53.26,,,,1,1,,,Flats,,SOCOFY Ethnic Splicing Colorful Striped Linen Comfy Breathable Slip On Casual Espadrille Flat Shoes,SOCOFY Ethnic Splicing Colorful Striped Linen Comfy Breathable Slip On Casual Espadrille Flat Shoes,SOCOFY Ethnic Splicing Colorful Striped Linen Comfy Breathable Slip On Casual Espadrille Flat Shoes,,,,,,,,,
DTPOJRY0037,Plaid Tie Front Crop Top,,<p><b>Style</b>: Casual</p><p><b>Color</b>: Navy Blue</p><p><b>Pattern Type</b>: Plaid</p><p><b>Length</b>: Crop</p><p><b>Season</b>: Summer</p><p><b>Details</b>: Tie Front</p><p><b>Neckline</b>: Deep V Neck</p><p><b>Sleeve Type</b>: Puff Sleeve</p><p><b>Fit Type</b>: Regular Fit</p><p><b>Sleeve Length</b>: Short Sleeve</p><p><b>Placket Type</b>: Placket</p><p><b>Sheer</b>: No</p><p><b>Material</b>: Polyester</p><p><b>Composition</b>: 80% Polyester</p><p><b>Composition</b>: 20% Cotton</p><p><b>Fabric</b>: Non-Stretch</p><p><b>Care Instructions</b>: Machine wash or professional dry clean</p>,img/Women_Tops/sW210609298409327.jpg,,Size#XS:S:M:L:,29.35,,,,1,1,,,Women Tops,,Plaid Tie Front Crop Top,Plaid Tie Front Crop Top,Plaid Tie Front Crop Top,,,,,,,,,
DTPOJRY0038,ROMWE X Dooom Two Tone Floral Graphic Shorts,,<p><b>Style</b>: Casual</p><p><b>Color</b>: Black and White</p><p><b>Pattern Type</b>: Floral</p><p><b>Pattern Type</b>: Colorblock</p><p><b>Season</b>: Summer</p><p><b>Type</b>: Track Shorts</p><p><b>Details</b>: Tie Front</p><p><b>Waist Line</b>: Natural</p><p><b>Fit Type</b>: Regular Fit</p><p><b>Sheer</b>: No</p><p><b>Closure Type</b>: Elastic Waist</p><p><b>Material</b>: Cotton</p><p><b>Composition</b>: 65% Cotton</p><p><b>Composition</b>: 35% Polyester</p><p><b>Fabric</b>: Slight Stretch</p><p><b>Care Instructions</b>: Machine wash or professional dry clean</p>,img/Shorts/rwshorts25210415358.jpg,,Size#S:M:L:,29.32,,,,1,1,,,Shorts,,ROMWE X Dooom Two Tone Floral Graphic Shorts,ROMWE X Dooom Two Tone Floral Graphic Shorts,ROMWE X Dooom Two Tone Floral Graphic Shorts,,,,,,,,,
DTPOJRY0039,Two Tone Tie Front Ribbed Cami,,<p><b>Style</b>: Casual</p><p><b>Color</b>: Multicolor</p><p><b>Pattern Type</b>: Colorblock</p><p><b>Length</b>: Crop</p><p><b>Season</b>: Summer</p><p><b>Type</b>: Cami</p><p><b>Details</b>: Rib-Knit</p><p><b>Details</b>: Tie Front</p><p><b>Fit Type</b>: Regular Fit</p><p><b>Neckline</b>: Spaghetti Strap</p><p><b>Sheer</b>: No</p><p><b>Material</b>: Polyester</p><p><b>Composition</b>: 97% Polyester</p><p><b>Composition</b>: 3% Elastane</p><p><b>Fabric</b>: Medium Stretch</p><p><b>Care Instructions</b>: Machine wash or professional dry clean</p>,img/Tank_Tops__Camis/rwvest25210428589.jpg,,Size#S:M:L:,28.49,,,,1,1,,,Tank Tops & Cam's,,Two Tone Tie Front Ribbed Cami,Two Tone Tie Front Ribbed Cami,Two Tone Tie Front Ribbed Cami,,,,,,,,,
DTPOJRY0040,Solid Button Pinafore Dress,,<p><b>Style</b>: Preppy</p><p><b>Color</b>: Baby Blue</p><p><b>Pattern Type</b>: Plain</p><p><b>Length</b>: Short</p><p><b>Season</b>: Summer</p><p><b>Type</b>: Pinafore</p><p><b>Sleeve Length</b>: Sleeveless</p><p><b>Waist Line</b>: Natural</p><p><b>Fit Type</b>: Regular Fit</p><p><b>Neckline</b>: Straps</p><p><b>Sheer</b>: No</p><p><b>Hem Shaped</b>: Flared</p><p><b>Material</b>: Polyester</p><p><b>Composition</b>: 100% Polyester</p><p><b>Fabric</b>: Non-Stretch</p><p><b>Care Instructions</b>: Machine wash or professional dry clean</p>,img/Dresses/rwdress25210608160.jpg,,Size#S:M:L:,27.45,,,,1,1,,,Dresses,,Solid Button Pinafore Dress,Solid Button Pinafore Dress,Solid Button Pinafore Dress,,,,,,,,,
DTPOJRY0041,Rhinestone Trim Heart Shaped Friendship Necklace 2pcs,,<p><b>Composition</b>: 100% Metal</p><p><b>Type</b>: Pendant Necklaces</p><p><b>Details</b>: Rhinestone</p><p><b>Color</b>: Silver</p><p><b>Metal Color</b>: Silver</p><p><b>Style</b>: Casual</p>,img/Pendant_Necklaces/necklaceNC170504302.jpg,,Size#,12.77,,,,1,1,,,Pendant Necklaces,,Rhinestone Trim Heart Shaped Friendship Necklace 2pcs,Rhinestone Trim Heart Shaped Friendship Necklace 2pcs,Rhinestone Trim Heart Shaped Friendship Necklace 2pcs,,,,,,,,,
DTPOJRY0042,Vintage Alloy Mushroom Star Flower Leaf Pattern Wedding Party Ring,,<p>Style: Vintage</p><p>Type: Ring</p><p>Color: Silver</p><p>Weight: 4.6g</p><p>Diameter Length: About 17.3/ 18.1/ 18.9/ 19.8/ 20.6/21.4mm</p><p>Material:  Alloy</p><p>Ring Size:  7 / 8 / 9 / 10 /11/12</p><p>(Please see the size reference for size conversion and detail information.)</p><p>Package Includes:</p><p>1 x Ring</p>,img/Rings/SKUH18787.jpg,,Size#7:8:9:10:11:12:,13.27,,,,1,1,,,Rings,,Vintage Alloy Mushroom Star Flower Leaf Pattern Wedding Party Ring,Vintage Alloy Mushroom Star Flower Leaf Pattern Wedding Party Ring,Vintage Alloy Mushroom Star Flower Leaf Pattern Wedding Party Ring,,,,,,,,,
DTPOJRY0043,Multi-Functional High-Capacity Mummy Bag Shopping Travel Package,,"<p>Color:Purple, Blue, Black, Red</p>",img/Backpack/SKU703049.jpg,,Size#,72.1,,,,1,1,,,Backpack,,Multi-Functional High-Capacity Mummy Bag Shopping Travel Package,Multi-Functional High-Capacity Mummy Bag Shopping Travel Package,Multi-Functional High-Capacity Mummy Bag Shopping Travel Package,,,,,,,,,
DTPOJRY0044,Men Mesh Breathable Lace Up Sport Running Casual Shoes,,"<p>Color:Blue, Red</p><p>Upper Material:Mesh, PU</p><p>Outsole Material:Rubber</p><p>Type:Walking Shoes, Running Shoes</p><p>Function:Breathable, Soft</p><p>Occasion:Daily, Sport, Board</p><p>Closure Type:Lace-up</p><p>Season:All Season</p><p>Toe Type:Round</p>",img/Sneakers__Athletic/SKUG17116.jpg,,Size#US 6.5:US 7.5:US 8:US 8.5:US 9:US 10:,59.73,,,,1,1,,,Sneakers & Athletic,,Men Mesh Breathable Lace Up Sport Running Casual Shoes,Men Mesh Breathable Lace Up Sport Running Casual Shoes,Men Mesh Breathable Lace Up Sport Running Casual Shoes,,,,,,,,,
DTPOJRY0045,LOSTISY Women Large Size Floral Embroidery Stitching Soft Flats Leather Loafers,,"<p>Color:Rose, Orange, Yellow, Black, Blue</p><p>Type:Driving  Shoes</p><p>Closure Type:Slip-On</p><p>Heel Type:Flat</p><p>Heel Height:1-3cm In Flat</p><p>Toe Type:Round</p><p>Pattern:Floral</p><p>Design Element:Floral, Embroidered</p><p>Upper Material:Leather</p><p>Style:Casual</p><p>Outsole Material:Rubber</p><p>Structure:Slip-On</p><p>Occasion:Daily</p><p>Function:Breathable, Soft</p><p>Season:Summer</p>",img/Flats/SKU591991.jpg,,Size#US 5:US 6:US 7:US 8:US 9:US 10:US 11:US 12:US 13:,54.08,,,,1,1,,,Flats,,LOSTISY Women Large Size Floral Embroidery Stitching Soft Flats Leather Loafers,LOSTISY Women Large Size Floral Embroidery Stitching Soft Flats Leather Loafers,LOSTISY Women Large Size Floral Embroidery Stitching Soft Flats Leather Loafers,,,,,,,,,
DTPOJRY0046,Sheer Lettuce Trim Mesh Top,,<p><b>Style</b>: Casual</p><p><b>Color</b>: Multicolor</p><p><b>Pattern Type</b>: Tie Dye</p><p><b>Length</b>: Crop</p><p><b>Season</b>: Spring/Summer</p><p><b>Details</b>: Lettuce Trim</p><p><b>Details</b>: Sheer</p><p><b>Sleeve Length</b>: Long Sleeve</p><p><b>Fit Type</b>: Regular Fit</p><p><b>Neckline</b>: Round Neck</p><p><b>Sleeve Type</b>: Regular Sleeve</p><p><b>Placket Type</b>: Pullovers</p><p><b>Sheer</b>: Semi-Sheer</p><p><b>Material</b>: Mesh</p><p><b>Composition</b>: 94% Polyester</p><p><b>Composition</b>: 6% Elastane</p><p><b>Fabric</b>: Medium Stretch</p><p><b>Care Instructions</b>: Machine wash or professional dry clean</p>,img/Women_Tops/swtop30210521793.jpg,,Size#S:M:L:XL:,22.64,,,,1,1,,,Women Tops,,Sheer Lettuce Trim Mesh Top,Sheer Lettuce Trim Mesh Top,Sheer Lettuce Trim Mesh Top,,,,,,,,,
DTPOJRY0047,Two Tone Letter Shorts,,<p><b>Style</b>: Casual</p><p><b>Color</b>: Multicolor</p><p><b>Pattern Type</b>: Letter</p><p><b>Pattern Type</b>: Colorblock</p><p><b>Season</b>: Summer</p><p><b>Type</b>: Track Shorts</p><p><b>Waist Line</b>: Natural</p><p><b>Fit Type</b>: Regular Fit</p><p><b>Sheer</b>: No</p><p><b>Closure Type</b>: Elastic Waist</p><p><b>Material</b>: Polyester</p><p><b>Composition</b>: 97% Polyester</p><p><b>Composition</b>: 3% Elastane</p><p><b>Fabric</b>: Slight Stretch</p><p><b>Care Instructions</b>: Machine wash or professional dry clean</p>,img/Shorts/rwshorts25210414715.jpg,,Size#S:M:L:,22.36,,,,1,1,,,Shorts,,Two Tone Letter Shorts,Two Tone Letter Shorts,Two Tone Letter Shorts,,,,,,,,,
DTPOJRY0048,Ditsy Floral Ruffle Crop Cami,,<p><b>Style</b>: Boho</p><p><b>Color</b>: Multicolor</p><p><b>Pattern Type</b>: Ditsy Floral</p><p><b>Length</b>: Crop</p><p><b>Season</b>: Summer</p><p><b>Type</b>: Cami</p><p><b>Details</b>: Ruffle</p><p><b>Details</b>: Knot</p><p><b>Fit Type</b>: Slim Fit</p><p><b>Neckline</b>: Straps</p><p><b>Sheer</b>: No</p><p><b>Material</b>: Polyester</p><p><b>Composition</b>: 97% Polyester</p><p><b>Composition</b>: 3% Elastane</p><p><b>Fabric</b>: Slight Stretch</p><p><b>Care Instructions</b>: Machine wash or professional dry clean</p>,img/Tank_Tops__Camis/rwvest25210517990.jpg,,Size#XS:S:M:L:,30.56,,,,1,1,,,Tank Tops & Cam's,,Ditsy Floral Ruffle Crop Cami,Ditsy Floral Ruffle Crop Cami,Ditsy Floral Ruffle Crop Cami,,,,,,,,,
DTPOJRY0049,2pcs Solid Cami Dress,,<p><b>Style</b>: Sexy</p><p><b>Color</b>: Multicolor</p><p><b>Pattern Type</b>: Plain</p><p><b>Length</b>: Short</p><p><b>Season</b>: Summer</p><p><b>Type</b>: Bodycon</p><p><b>Details</b>: Rib-Knit</p><p><b>Sleeve Length</b>: Sleeveless</p><p><b>Neckline</b>: Spaghetti Strap</p><p><b>Waist Line</b>: Natural</p><p><b>Fit Type</b>: Slim Fit</p><p><b>Sheer</b>: No</p><p><b>Hem Shaped</b>: Pencil</p><p><b>Material</b>: Polyester</p><p><b>Composition</b>: 95% Polyester</p><p><b>Composition</b>: 5% Spandex</p><p><b>Fabric</b>: High Stretch</p><p><b>Care Instructions</b>: Machine wash or professional dry clean</p>,img/Dresses/rwdress25210419193.jpg,,Size#S:M:L:,24.12,,,,1,1,,,Dresses,,2pcs Solid Cami Dress,2pcs Solid Cami Dress,2pcs Solid Cami Dress,,,,,,,,,
DTPOJRY0050,4pcs Lock & Safety Pin Pendant Necklace,,<p><b>Type</b>: Pendant Necklaces</p><p><b>Details</b>: Rhinestone</p><p><b>Material</b>: Alloy</p><p><b>Color</b>: Silver</p><p><b>Style</b>: Glamorous</p>,img/Pendant_Necklaces/swneck18201029719.jpg,,Size#,21.66,,,,1,1,,,Pendant Necklaces,,4pcs Lock & Safety Pin Pendant Necklace,4pcs Lock & Safety Pin Pendant Necklace,4pcs Lock & Safety Pin Pendant Necklace,,,,,,,,,
DTPOJRY0051,Cute Geometric Animal Rhinestone Rings,,"<p>﻿Style: Cute</p><p>Type: Rings</p><p>Color: Silver</p><p>Weight: 10g</p><p>Size: 5,6,7,8,9,10</p><p>Material: Alloy,Rhinestone</p><p>1 x Rings</p>",img/Rings/SKUH21300.jpg,,Size#5:6:7:8:9:10:,14.56,,,,1,1,,,Rings,,Cute Geometric Animal Rhinestone Rings,Cute Geometric Animal Rhinestone Rings,Cute Geometric Animal Rhinestone Rings,,,,,,,,,
DTPOJRY0052,Women Bohemia Nylon Multi-Carry Geometric Color Circle Pattern Print Backpack,,"<p>Color:Blue, Grey, Black, Red</p><p>Style:Bohemia, Casual</p><p>Pattern:Geometric</p><p>Capacity:4A Magazine</p>",img/Backpack/SKUH28789.jpg,,Size#,72.7,,,,1,1,,,Backpack,,Women Bohemia Nylon Multi-Carry Geometric Color Circle Pattern Print Backpack,Women Bohemia Nylon Multi-Carry Geometric Color Circle Pattern Print Backpack,Women Bohemia Nylon Multi-Carry Geometric Color Circle Pattern Print Backpack,,,,,,,,,
DTPOJRY0053,Men Brief Knitted Fabric Light Weight Slip-on Hard Wearing Skate Shoes,,"<p>Color:Black, Grey, Beige</p><p>Upper Material:Knitted</p><p>Outsole Material:Rubber</p><p>Type:Skate Shoes</p><p>Function:Hard-wearing, Sport</p><p>Occasion:Outdoor, Sport</p><p>Closure Type:Slip-On</p><p>Season:All Season</p><p>Toe Type:Round</p>",img/Sneakers__Athletic/SKUH31717.jpg,,Size#US 6.5:US 7.5:US 8:US 8.5:US 9:US 10:,55.82,,,,1,1,,,Sneakers & Athletic,,Men Brief Knitted Fabric Light Weight Slip-on Hard Wearing Skate Shoes,Men Brief Knitted Fabric Light Weight Slip-on Hard Wearing Skate Shoes,Men Brief Knitted Fabric Light Weight Slip-on Hard Wearing Skate Shoes,,,,,,,,,
DTPOJRY0054,Women Comfy Breathable Knitted Pointed Toe Ballet Shoes Soft Sole Slip On Flats,,"<p>Color:Red, Black, Blue</p><p>Type:Ballet Flat</p><p>Closure Type:Slip-On</p><p>Heel Type:Flat</p><p>Heel Height:1-3cm In Flat</p><p>Toe Type:Pointed</p><p>Pattern:Other</p><p>Design Element:Simple</p><p>Upper Material:Knitted</p><p>Style:Casual, Elegant</p><p>Outsole Material:PU</p><p>Structure:Slip-On</p><p>Occasion:Holiday, Casual</p><p>Function:Antiskid, Soft</p><p>Season:Spring&Summer, Autumn</p>",img/Flats/SKUG33642.jpg,,Size#US 5:US 6:US 7:US 8:US 9:US 10:,59.57,,,,1,1,,,Flats,,Women Comfy Breathable Knitted Pointed Toe Ballet Shoes Soft Sole Slip On Flats,Women Comfy Breathable Knitted Pointed Toe Ballet Shoes Soft Sole Slip On Flats,Women Comfy Breathable Knitted Pointed Toe Ballet Shoes Soft Sole Slip On Flats,,,,,,,,,
DTPOJRY0055,Ditsy Floral Off The Shoulder Shirred Crop Top,,<p><b>Style</b>: Boho</p><p><b>Color</b>: Red</p><p><b>Pattern Type</b>: Ditsy Floral</p><p><b>Length</b>: Crop</p><p><b>Season</b>: Summer</p><p><b>Details</b>: Shirred</p><p><b>Neckline</b>: Off the Shoulder</p><p><b>Sleeve Length</b>: Short Sleeve</p><p><b>Fit Type</b>: Slim Fit</p><p><b>Sleeve Type</b>: Regular Sleeve</p><p><b>Placket Type</b>: Pullovers</p><p><b>Sheer</b>: No</p><p><b>Body</b>: Unlined</p><p><b>Material</b>: Polyester</p><p><b>Composition</b>: 100% Polyester</p><p><b>Fabric</b>: Slight Stretch</p><p><b>Care Instructions</b>: Machine wash or professional dry clean</p>,img/Women_Tops/rwtop25210608093.jpg,,Size#S:M:L:XL:,32.79,,,,1,1,,,Women Tops,,Ditsy Floral Off The Shoulder Shirred Crop Top,Ditsy Floral Off The Shoulder Shirred Crop Top,Ditsy Floral Off The Shoulder Shirred Crop Top,,,,,,,,,
DTPOJRY0056,ROMWE X Vwpstd Letter Graphic Two Tone Shorts,,<p><b>Style</b>: Casual</p><p><b>Color</b>: Multicolor</p><p><b>Pattern Type</b>: Colorblock</p><p><b>Pattern Type</b>: Graphic</p><p><b>Season</b>: Summer</p><p><b>Type</b>: Track Shorts</p><p><b>Waist Line</b>: Natural</p><p><b>Fit Type</b>: Regular Fit</p><p><b>Sheer</b>: No</p><p><b>Closure Type</b>: Elastic Waist</p><p><b>Material</b>: Polyester</p><p><b>Composition</b>: 95% Polyester</p><p><b>Composition</b>: 5% Spandex</p><p><b>Fabric</b>: Non-Stretch</p><p><b>Care Instructions</b>: Machine wash or professional dry clean</p>,img/Shorts/rwshorts25210603236.jpg,,Size#S:M:L:,32.18,,,,1,1,,,Shorts,,ROMWE X Vwpstd Letter Graphic Two Tone Shorts,ROMWE X Vwpstd Letter Graphic Two Tone Shorts,ROMWE X Vwpstd Letter Graphic Two Tone Shorts,,,,,,,,,
DTPOJRY0057,Heart Graphic Drawstring Ruched Ribbed Tank Top,,<p><b>Style</b>: Casual</p><p><b>Color</b>: Black</p><p><b>Pattern Type</b>: Heart</p><p><b>Length</b>: Crop</p><p><b>Season</b>: Summer</p><p><b>Type</b>: Tank</p><p><b>Details</b>: Drawstring</p><p><b>Details</b>: Ruched</p><p><b>Details</b>: Rib-Knit</p><p><b>Neckline</b>: Scoop Neck</p><p><b>Fit Type</b>: Slim Fit</p><p><b>Sheer</b>: No</p><p><b>Material</b>: Cotton Blends</p><p><b>Composition</b>: 65% Cotton</p><p><b>Composition</b>: 35% Polyester</p><p><b>Fabric</b>: Medium Stretch</p><p><b>Care Instructions</b>: Machine wash or professional dry clean</p>,img/Tank_Tops__Camis/rwvest25210604942.jpg,,Size#S:M:L:,22.34,,,,1,1,,,Tank Tops & Cam's,,Heart Graphic Drawstring Ruched Ribbed Tank Top,Heart Graphic Drawstring Ruched Ribbed Tank Top,Heart Graphic Drawstring Ruched Ribbed Tank Top,,,,,,,,,
DTPOJRY0058,Off Shoulder Ruffle Trim Buttoned Front Belted Dress,,<p><b>Style</b>: Elegant</p><p><b>Color</b>: Pink</p><p><b>Pattern Type</b>: Plain</p><p><b>Length</b>: Long</p><p><b>Season</b>: Spring/Summer</p><p><b>Type</b>: A Line</p><p><b>Details</b>: Ruffle</p><p><b>Details</b>: Belted</p><p><b>Details</b>: Zipper</p><p><b>Details</b>: Button Front</p><p><b>Sleeve Type</b>: Flounce Sleeve</p><p><b>Neckline</b>: Off the Shoulder</p><p><b>Sleeve Length</b>: Short Sleeve</p><p><b>Waist Line</b>: High Waist</p><p><b>Fit Type</b>: Regular Fit</p><p><b>Sheer</b>: No</p><p><b>Hem Shaped</b>: Flared</p><p><b>Belt</b>: Yes</p><p><b>Arabian Clothing</b>: Yes</p><p><b>Material</b>: Polyester</p><p><b>Composition</b>: 80% Polyester</p><p><b>Composition</b>: 20% Cotton</p><p><b>Fabric</b>: Non-Stretch</p><p><b>Care Instructions</b>: Machine wash or professional dry clean</p>,img/Dresses/swdress07191128268.jpg,,Size#XS:S:M:L:XL:,25.08,,,,1,1,,,Dresses,,Off Shoulder Ruffle Trim Buttoned Front Belted Dress,Off Shoulder Ruffle Trim Buttoned Front Belted Dress,Off Shoulder Ruffle Trim Buttoned Front Belted Dress,,,,,,,,,
DTPOJRY0059,Letter Charm Necklace,,<p><b>Type</b>: Pendant Necklaces</p><p><b>Material</b>: Alloy</p><p><b>Color</b>: Gold</p><p><b>Metal Color</b>: Gold</p><p><b>Style</b>: Casual</p><p><b>Type</b>: Pendant Necklaces</p><p><b>Material</b>: Alloy</p><p><b>Color</b>: Silver</p><p><b>Metal Color</b>: Silver</p><p><b>Style</b>: Casual</p>,img/Pendant_Necklaces/swneck18200922658.jpg,,Size#,24.78,,,,1,1,,,Pendant Necklaces,,Letter Charm Necklace,Letter Charm Necklace,Letter Charm Necklace,,,,,,,,,
DTPOJRY0060,7 Pcs Vintage Bohemian Colorful Beaded Hollow Line Geometric Shape Alloy Iron CCB Ring Set,,"<p>Style: Vintage,Bohemian </p><p>Type: Ring</p><p>Weight: 8.8 g</p><p>Size: As the picture shown</p><p>Material: Alloy,Iron,CCB,Beaded</p><p>Quantity: 7 pcs</p><p>Package Includes:</p><p>1 x Ring Set</p><p>Notice:</p>",img/Rings/SKUI17794.jpg,,Size#,23.38,,,,1,1,,,Rings,,7 Pcs Vintage Bohemian Colorful Beaded Hollow Line Geometric Shape Alloy Iron CCB Ring Set,7 Pcs Vintage Bohemian Colorful Beaded Hollow Line Geometric Shape Alloy Iron CCB Ring Set,7 Pcs Vintage Bohemian Colorful Beaded Hollow Line Geometric Shape Alloy Iron CCB Ring Set,,,,,,,,,
DTPOJRY0061,Women 3Pcs Printed Dinosaur School Backpack Meal Bag Pencil Case,,<p>Color:Green</p><p>Material:Nylon</p><p>Style:Preppy</p><p>Capacity:4A Magazine</p>,img/Backpack/SKUF36365.jpg,,Size#,62.76,,,,1,1,,,Backpack,,Women 3Pcs Printed Dinosaur School Backpack Meal Bag Pencil Case,Women 3Pcs Printed Dinosaur School Backpack Meal Bag Pencil Case,Women 3Pcs Printed Dinosaur School Backpack Meal Bag Pencil Case,,,,,,,,,
DTPOJRY0062,Men Stylish Letter Pattern Sport Casual Lace-up Forrest Shoes,,"<p>Color:Grey, White, Beige</p><p>Upper Material:Mesh, PU</p><p>Outsole Material:Rubber</p><p>Type:Walking Shoes</p><p>Function:Breathable, Soft, Hard-wearing, Sport</p><p>Occasion:Outdoor, Daily, Sport</p><p>Closure Type:Lace-up, Slip-On</p><p>Season:All Season</p><p>Toe Type:Round</p>",img/Sneakers__Athletic/SKUH16500.jpg,,Size#US 6.5:US 7.5:US 8:US 8.5:US 9:US 10:,57.23,,,,1,1,,,Sneakers & Athletic,,Men Stylish Letter Pattern Sport Casual Lace-up Forrest Shoes,Men Stylish Letter Pattern Sport Casual Lace-up Forrest Shoes,Men Stylish Letter Pattern Sport Casual Lace-up Forrest Shoes,,,,,,,,,
DTPOJRY0063,Women Casual Soft Rivet Slip On Round Toe Flat Loafers,,<p>Color:Pink</p><p>Closure Type:Slip-On</p><p>Toe Type:Round</p><p>Upper Material:PU</p><p>Style:Casual</p><p>Outsole Material:PU</p><p>Occasion:Daily</p><p>Function:Soft</p><p>Season:Summer</p>,img/Flats/SKUF41162.jpg,,Size#US 4:US 5:US 6:US 7:US 8:US 9:US 10:US 11:US 12:,49.85,,,,1,1,,,Flats,,Women Casual Soft Rivet Slip On Round Toe Flat Loafers,Women Casual Soft Rivet Slip On Round Toe Flat Loafers,Women Casual Soft Rivet Slip On Round Toe Flat Loafers,,,,,,,,,
DTPOJRY0064,Ditsy Floral Shirred Cami Top,,<p><b>Style</b>: Boho</p><p><b>Color</b>: Multicolor</p><p><b>Pattern Type</b>: Ditsy Floral</p><p><b>Length</b>: Crop</p><p><b>Season</b>: Summer</p><p><b>Details</b>: Knot</p><p><b>Details</b>: Ruffle</p><p><b>Details</b>: Shirred</p><p><b>Sleeve Length</b>: Sleeveless</p><p><b>Fit Type</b>: Slim Fit</p><p><b>Neckline</b>: Straps</p><p><b>Placket Type</b>: Pullovers</p><p><b>Sheer</b>: No</p><p><b>Material</b>: Polyester</p><p><b>Composition</b>: 100% Polyester</p><p><b>Fabric</b>: Slight Stretch</p><p><b>Care Instructions</b>: Machine wash or professional dry clean</p>,img/Women_Tops/rW210611611737864.jpg,,Size#S:M:L:,28.02,,,,1,1,,,Women Tops,,Ditsy Floral Shirred Cami Top,Ditsy Floral Shirred Cami Top,Ditsy Floral Shirred Cami Top,,,,,,,,,
DTPOJRY0065,Knotted Tie Dye Shorts,,<p><b>Style</b>: Boho</p><p><b>Color</b>: Black and White</p><p><b>Pattern Type</b>: Tie Dye</p><p><b>Season</b>: Summer</p><p><b>Type</b>: Track Shorts</p><p><b>Details</b>: Knot</p><p><b>Waist Line</b>: High Waist</p><p><b>Fit Type</b>: Regular Fit</p><p><b>Sheer</b>: No</p><p><b>Closure Type</b>: Elastic Waist</p><p><b>Belt</b>: No</p><p><b>Material</b>: Rayon</p><p><b>Composition</b>: 94% Rayon</p><p><b>Composition</b>: 6% Spandex</p><p><b>Fabric</b>: Slight Stretch</p><p><b>Care Instructions</b>: Machine wash or professional dry clean</p>,img/Shorts/swshorts07200429308.jpg,,Size#XS:S:M:L:XL:,29.43,,,,1,1,,,Shorts,,Knotted Tie Dye Shorts,Knotted Tie Dye Shorts,Knotted Tie Dye Shorts,,,,,,,,,
DTPOJRY0066,Heart Print Tie Dye Tank Top,,<p><b>Style</b>: Casual</p><p><b>Color</b>: Multicolor</p><p><b>Pattern Type</b>: Tie Dye</p><p><b>Pattern Type</b>: Heart</p><p><b>Length</b>: Crop</p><p><b>Season</b>: Summer</p><p><b>Type</b>: Tank</p><p><b>Neckline</b>: Scoop Neck</p><p><b>Fit Type</b>: Slim Fit</p><p><b>Sheer</b>: No</p><p><b>Material</b>: Polyester</p><p><b>Composition</b>: 92% Polyester</p><p><b>Composition</b>: 8% Elastane</p><p><b>Fabric</b>: Slight Stretch</p><p><b>Care Instructions</b>: Machine wash or professional dry clean</p>,img/Tank_Tops__Camis/swvest07210330084.jpg,,Size#XS:S:M:L:XL:,25.06,,,,1,1,,,Tank Tops & Cam's,,Heart Print Tie Dye Tank Top,Heart Print Tie Dye Tank Top,Heart Print Tie Dye Tank Top,,,,,,,,,
DTPOJRY0067,Rolled Sleeve Tunic Tee Dress,,<p><b>Style</b>: Basics</p><p><b>Color</b>: Black</p><p><b>Pattern Type</b>: Plain</p><p><b>Length</b>: Short</p><p><b>Season</b>: Summer</p><p><b>Type</b>: Tee</p><p><b>Sleeve Type</b>: Roll Up Sleeve</p><p><b>Sleeve Length</b>: Short Sleeve</p><p><b>Neckline</b>: Round Neck</p><p><b>Fit Type</b>: Loose</p><p><b>Sheer</b>: No</p><p><b>Hem Shaped</b>: Straight</p><p><b>Material</b>: Polyester</p><p><b>Composition</b>: 97% Polyester</p><p><b>Composition</b>: 3% Spandex</p><p><b>Fabric</b>: Slight Stretch</p><p><b>Care Instructions</b>: Machine wash or professional dry clean</p>,img/Dresses/dress170719108.jpg,,Size#S:M:L:XL:,22.48,,,,1,1,,,Dresses,,Rolled Sleeve Tunic Tee Dress,Rolled Sleeve Tunic Tee Dress,Rolled Sleeve Tunic Tee Dress,,,,,,,,,
DTPOJRY0068,4pcs Rhinestone Dragon Charm Necklace,,<p><b>Details</b>: Geometric</p><p><b>Material</b>: Metallic</p><p><b>Type</b>: Pendant Necklaces</p><p><b>Details</b>: Rhinestone</p><p><b>Type</b>: Layer Sets</p><p><b>Color</b>: Gold</p><p><b>Metal Color</b>: Gold</p>,img/Pendant_Necklaces/swneck18200512932.jpg,,Size#,20.7,,,,1,1,,,Pendant Necklaces,,4pcs Rhinestone Dragon Charm Necklace,4pcs Rhinestone Dragon Charm Necklace,4pcs Rhinestone Dragon Charm Necklace,,,,,,,,,
DTPOJRY0069,Cute Cat Women Earrings Adjustable Open Index Finger Ring Tail Ring,,<p>Style: Elegant</p><p>Type: Ring </p><p>Color: Silver</p><p>Size: Adjustable</p><p>Material: Alloy</p><p>1 x Ring</p>,img/Rings/SKUG63212.jpg,,Size#,28.33,,,,1,1,,,Rings,,Cute Cat Women Earrings Adjustable Open Index Finger Ring Tail Ring,Cute Cat Women Earrings Adjustable Open Index Finger Ring Tail Ring,Cute Cat Women Earrings Adjustable Open Index Finger Ring Tail Ring,,,,,,,,,
DTPOJRY0070,Women 3D Space Rocket Cat Storage Bag Backpack,,<p>Color:Multicolor</p><p>Style:Casual</p><p>Pattern:Cat</p><p>Capacity:13.3 Inch Laptop</p>,img/Backpack/SKUG77097.jpg,,Size#,71.45,,,,1,1,,,Backpack,,Women 3D Space Rocket Cat Storage Bag Backpack,Women 3D Space Rocket Cat Storage Bag Backpack,Women 3D Space Rocket Cat Storage Bag Backpack,,,,,,,,,
DTPOJRY0071,Men Microfiber Leather Outdoor Slip Resistant Lace Up Hiking Shoes,,"<p>Color:Black, Grey</p><p>Upper Material:PU</p><p>Outsole Material:Rubber</p><p>Function:Slip Resistant</p><p>Occasion:Outdoor</p><p>Closure Type:Lace-up</p><p>Toe Type:Round</p>",img/Sneakers__Athletic/SKUC80766.jpg,,Size#US 6.5:US 7.5:US 8:US 8.5:US 9:US 10:,60.57,,,,1,1,,,Sneakers & Athletic,,Men Microfiber Leather Outdoor Slip Resistant Lace Up Hiking Shoes,Men Microfiber Leather Outdoor Slip Resistant Lace Up Hiking Shoes,Men Microfiber Leather Outdoor Slip Resistant Lace Up Hiking Shoes,,,,,,,,,
