v_sku,v_name,v_short_description,v_description,v_image,v_url,v_attribute,v_price,v_specials_price,v_specials_expire_date,v_date_added,v_in_stock,v_status,v_viewed,v_ordered,v_category_sku,v_sort_order,v_meta_title,v_meta_keywords,v_meta_description,v_brand_filter,v_class_filter,v_color_filter,v_gender_filter,v_material_filter,v_year_filter,v_origin_filter,v_series_filter,v_spec_filter
DTPOJRY0072,Women Hollow Brogue Tassel Decor Breathable Comfy Slip-on Casual Loafers,,"<p>Color:Grey</p><p>Type:Loafers</p><p>Closure Type:Slip-On</p><p>Heel Type:Flat</p><p>Heel Height:1-3cm In Flat</p><p>Toe Type:AlmondToe</p><p>Pattern:Plain</p><p>Design Element:Tassel</p><p>Upper Material:PU</p><p>Style:Casual</p><p>Outsole Material:Rubber</p><p>Structure:Slip-On</p><p>Occasion:Daily</p><p>Function:Breathable, Hard-wearing</p><p>Season:Spring&Summer, Spring&Fall</p>",img/Flats/SKUG13739.jpg,,Size#US 5:US 6:US 7:US 8:US 9:US 10:US 11:US 12:,51.6,,,,1,1,,,Flats,,Women Hollow Brogue Tassel Decor Breathable Comfy Slip-on Casual Loafers,Women Hollow Brogue Tassel Decor Breathable Comfy Slip-on Casual Loafers,Women Hollow Brogue Tassel Decor Breathable Comfy Slip-on Casual Loafers,,,,,,,,,
DTPOJRY0073,1pc Mock Neck Color-block Mesh Panel Crop Top,,<p><b>Style</b>: Sexy</p><p><b>Color</b>: Multicolor</p><p><b>Pattern Type</b>: Colorblock</p><p><b>Length</b>: Crop</p><p><b>Season</b>: Spring/Summer</p><p><b>Details</b>: Sheer</p><p><b>Sleeve Length</b>: Long Sleeve</p><p><b>Fit Type</b>: Slim Fit</p><p><b>Neckline</b>: Stand Collar</p><p><b>Sleeve Type</b>: Regular Sleeve</p><p><b>Placket Type</b>: Pullovers</p><p><b>Sheer</b>: Yes</p><p><b>Material</b>: Polyester</p><p><b>Composition</b>: 95% Polyester</p><p><b>Composition</b>: 5% Elastane</p><p><b>Fabric</b>: High Stretch</p><p><b>Care Instructions</b>: Machine wash or professional dry clean</p>,img/Women_Tops/swtop25210615421.jpg,,Size#XS:S:M:L:,28.63,,,,1,1,,,Women Tops,,1pc Mock Neck Color-block Mesh Panel Crop Top,1pc Mock Neck Color-block Mesh Panel Crop Top,1pc Mock Neck Color-block Mesh Panel Crop Top,,,,,,,,,
DTPOJRY0074,Letter Graphic Shorts,,<p><b>Style</b>: Casual</p><p><b>Color</b>: Black</p><p><b>Pattern Type</b>: Letter</p><p><b>Season</b>: Summer</p><p><b>Type</b>: Track Shorts</p><p><b>Details</b>: Drawstring</p><p><b>Details</b>: Tie Front</p><p><b>Waist Line</b>: Natural</p><p><b>Fit Type</b>: Regular Fit</p><p><b>Sheer</b>: No</p><p><b>Closure Type</b>: Drawstring Waist</p><p><b>Material</b>: Cotton</p><p><b>Composition</b>: 100% Cotton</p><p><b>Fabric</b>: Slight Stretch</p><p><b>Care Instructions</b>: Machine wash or professional dry clean</p>,img/Shorts/rw2107076114285313.jpg,,Size#S:M:L:,22.96,,,,1,1,,,Shorts,,Letter Graphic Shorts,Letter Graphic Shorts,Letter Graphic Shorts,,,,,,,,,
DTPOJRY0075,Letter Car Graphic Tank Top,,<p><b>Style</b>: Casual</p><p><b>Color</b>: Black</p><p><b>Pattern Type</b>: Letter</p><p><b>Pattern Type</b>: Graphic</p><p><b>Length</b>: Crop</p><p><b>Season</b>: Summer</p><p><b>Type</b>: Tank</p><p><b>Neckline</b>: Scoop Neck</p><p><b>Fit Type</b>: Slim Fit</p><p><b>Sheer</b>: No</p><p><b>Material</b>: Polyester</p><p><b>Composition</b>: 80% Polyester</p><p><b>Composition</b>: 20% Cotton</p><p><b>Fabric</b>: Slight Stretch</p><p><b>Care Instructions</b>: Machine wash or professional dry clean</p><p><b>Style</b>: Casual</p><p><b>Color</b>: White</p><p><b>Pattern Type</b>: Letter</p><p><b>Pattern Type</b>: Graphic</p><p><b>Length</b>: Crop</p><p><b>Season</b>: Summer</p><p><b>Type</b>: Tank</p><p><b>Neckline</b>: Scoop Neck</p><p><b>Fit Type</b>: Slim Fit</p><p><b>Sheer</b>: No</p><p><b>Material</b>: Polyester</p><p><b>Composition</b>: 80% Polyester</p><p><b>Composition</b>: 20% Cotton</p><p><b>Fabric</b>: Slight Stretch</p><p><b>Care Instructions</b>: Machine wash or professional dry clean</p>,img/Tank_Tops__Camis/rwvest25210603748.jpg,,Size#XS:S:M:L:XL:XXL:,29.54,,,,1,1,,,Tank Tops & Cam's,,Letter Car Graphic Tank Top,Letter Car Graphic Tank Top,Letter Car Graphic Tank Top,,,,,,,,,
DTPOJRY0076,Floral Print Drawstring Ruched Dress,,<p><b>Style</b>: Boho</p><p><b>Color</b>: Multicolor</p><p><b>Pattern Type</b>: Floral</p><p><b>Pattern Type</b>: All Over Print</p><p><b>Length</b>: Mini</p><p><b>Season</b>: Summer</p><p><b>Type</b>: Bodycon</p><p><b>Details</b>: Ruched</p><p><b>Details</b>: Drawstring</p><p><b>Sleeve Length</b>: Sleeveless</p><p><b>Neckline</b>: Halter</p><p><b>Waist Line</b>: Natural</p><p><b>Fit Type</b>: Slim Fit</p><p><b>Sheer</b>: No</p><p><b>Hem Shaped</b>: Pencil</p><p><b>Material</b>: Cotton Blends</p><p><b>Composition</b>: 65% Cotton</p><p><b>Composition</b>: 35% Polyester</p><p><b>Fabric</b>: Medium Stretch</p><p><b>Care Instructions</b>: Machine wash or professional dry clean</p>,img/Dresses/sW210602571111290.jpg,,Size#S:M:L:,23.84,,,,1,1,,,Dresses,,Floral Print Drawstring Ruched Dress,Floral Print Drawstring Ruched Dress,Floral Print Drawstring Ruched Dress,,,,,,,,,
DTPOJRY0077,Open and Close Photos Geometric Pendant Necklace 1pc,,<p><b>Composition</b>: 100% Alloy</p><p><b>Type</b>: Pendant Necklaces</p><p><b>Color</b>: Gold</p><p><b>Metal Color</b>: Gold</p><p><b>Style</b>: Casual</p>,img/Pendant_Necklaces/swneck03190828200.jpg,,Size#,21.26,,,,1,1,,,Pendant Necklaces,,Open and Close Photos Geometric Pendant Necklace 1pc,Open and Close Photos Geometric Pendant Necklace 1pc,Open and Close Photos Geometric Pendant Necklace 1pc,,,,,,,,,
DTPOJRY0078,Vintage 925 Sterling Silver Cute Fish Tail Animal Open Ring,,<p>Style: Vintage</p><p>Type: Ring</p><p>Color: Silver</p><p>Weight: 1.1g</p><p>Length: About 2 cm / 0.78 in</p><p>Material:  925 Sterling Silver</p><p>Package Includes:</p><p>1 x Ring</p>,img/Rings/SKUH04933.jpg,,Size#,25.47,,,,1,1,,,Rings,,Vintage 925 Sterling Silver Cute Fish Tail Animal Open Ring,Vintage 925 Sterling Silver Cute Fish Tail Animal Open Ring,Vintage 925 Sterling Silver Cute Fish Tail Animal Open Ring,,,,,,,,,
DTPOJRY0079,Women Multifunction Bag Waterproof Solid Large Capacity Backpack,,"<p>Color:Purple, Blue, Brown, Black, Pink</p><p>Material:PU</p><p>Style:Preppy</p>",img/Backpack/SKUE04873.jpg,,Size#L:,56.38,,,,1,1,,,Backpack,,Women Multifunction Bag Waterproof Solid Large Capacity Backpack,Women Multifunction Bag Waterproof Solid Large Capacity Backpack,Women Multifunction Bag Waterproof Solid Large Capacity Backpack,,,,,,,,,
DTPOJRY0080,Men Casual Stitching Knitted Fabric Breathable Work Style Shoes,,"<p>Color:Black, Beige, Khaki</p><p>Upper Material:Knitted</p><p>Outsole Material:Rubber</p><p>Type:Skate Shoes</p><p>Function:Breathable, Hard-wearing</p><p>Occasion:Outdoor, Sport</p><p>Closure Type:Lace-up</p><p>Season:All Season</p><p>Toe Type:Round</p>",img/Sneakers__Athletic/SKUH24480.jpg,,Size#US 6.5:US 7.5:US 8:US 8.5:US 9:US 10:,57.15,,,,1,1,,,Sneakers & Athletic,,Men Casual Stitching Knitted Fabric Breathable Work Style Shoes,Men Casual Stitching Knitted Fabric Breathable Work Style Shoes,Men Casual Stitching Knitted Fabric Breathable Work Style Shoes,,,,,,,,,
DTPOJRY0081,Women Soft Sole Print Cat Square Toe Canvas Loafers Flats,,"<p>Color:Green, White, Blue</p><p>Type:Loafers</p><p>Closure Type:Slip-On</p><p>Heel Type:Flat</p><p>Heel Height:1-3cm In Flat</p><p>Toe Type:Square</p><p>Pattern:Animal-print, Cat</p><p>Design Element:Pattern, Print</p><p>Upper Material:Canvas</p><p>Style:Casual, Stylish</p><p>Outsole Material:Rubber</p><p>Structure:Slip-On</p><p>Occasion:Casual</p><p>Function:Antiskid, Hard-wearing</p><p>Season:All Season</p>",img/Flats/SKUG95809.jpg,,Size#US 5:US 6:US 7:US 8:US 9:US 10:US 11:US 12:,53.45,,,,1,1,,,Flats,,Women Soft Sole Print Cat Square Toe Canvas Loafers Flats,Women Soft Sole Print Cat Square Toe Canvas Loafers Flats,Women Soft Sole Print Cat Square Toe Canvas Loafers Flats,,,,,,,,,
DTPOJRY0082,Twist Detail Crisscross Front Tie Back Crop Top,,<p><b>Style</b>: Boho</p><p><b>Color</b>: Orange</p><p><b>Pattern Type</b>: Plain</p><p><b>Length</b>: Crop</p><p><b>Season</b>: Summer</p><p><b>Details</b>: Backless</p><p><b>Details</b>: Criss Cross</p><p><b>Details</b>: Twist</p><p><b>Sleeve Length</b>: Short Sleeve</p><p><b>Fit Type</b>: Slim Fit</p><p><b>Neckline</b>: Sweetheart</p><p><b>Sleeve Type</b>: Regular Sleeve</p><p><b>Placket Type</b>: Pullovers</p><p><b>Sheer</b>: No</p><p><b>Material</b>: Viscose</p><p><b>Composition</b>: 95% Viscose</p><p><b>Composition</b>: 5% Elastane</p><p><b>Fabric</b>: Medium Stretch</p><p><b>Care Instructions</b>: Machine wash or professional dry clean</p>,img/Women_Tops/swtee07210514597.jpg,,Size#XS:S:M:L:XL:,27.29,,,,1,1,,,Women Tops,,Twist Detail Crisscross Front Tie Back Crop Top,Twist Detail Crisscross Front Tie Back Crop Top,Twist Detail Crisscross Front Tie Back Crop Top,,,,,,,,,
DTPOJRY0083,Drawstring Waist Letter Embroidery Track Shorts,,<p><b>Style</b>: Sporty</p><p><b>Color</b>: Hot Pink</p><p><b>Pattern Type</b>: Letter</p><p><b>Type</b>: Track Shorts</p><p><b>Season</b>: Spring/Summer/Fall</p><p><b>Details</b>: Drawstring</p><p><b>Details</b>: Embroidery</p><p><b>Details</b>: Pocket</p><p><b>Waist Line</b>: High Waist</p><p><b>Fit Type</b>: Loose</p><p><b>Sheer</b>: No</p><p><b>Closure Type</b>: Drawstring Waist</p><p><b>Material</b>: Polyester</p><p><b>Composition</b>: 50% Polyester</p><p><b>Composition</b>: 45% Cotton</p><p><b>Composition</b>: 5% Spandex</p><p><b>Fabric</b>: Slight Stretch</p><p><b>Care Instructions</b>: Machine wash or professional dry clean</p>,img/Shorts/swshorts07210127302.jpg,,Size#XS:S:M:L:XL:,22.46,,,,1,1,,,Shorts,,Drawstring Waist Letter Embroidery Track Shorts,Drawstring Waist Letter Embroidery Track Shorts,Drawstring Waist Letter Embroidery Track Shorts,,,,,,,,,
DTPOJRY0084,Heart Graphic Crop Halter Top,,<p><b>Style</b>: Casual</p><p><b>Color</b>: Khaki</p><p><b>Pattern Type</b>: Heart</p><p><b>Pattern Type</b>: All Over Print</p><p><b>Length</b>: Crop</p><p><b>Season</b>: Summer</p><p><b>Type</b>: Halter</p><p><b>Neckline</b>: Halter</p><p><b>Fit Type</b>: Slim Fit</p><p><b>Sheer</b>: No</p><p><b>Material</b>: Polyester</p><p><b>Composition</b>: 65% Polyester</p><p><b>Composition</b>: 35% Cotton</p><p><b>Fabric</b>: Medium Stretch</p><p><b>Care Instructions</b>: Machine wash or professional dry clean</p>,img/Tank_Tops__Camis/rwvest25210603747.jpg,,Size#S:M:L:,28.51,,,,1,1,,,Tank Tops & Cam's,,Heart Graphic Crop Halter Top,Heart Graphic Crop Halter Top,Heart Graphic Crop Halter Top,,,,,,,,,
DTPOJRY0085,Knot Backless Ruffle Hem Cami Dress,,<p><b>Style</b>: Boho</p><p><b>Color</b>: Black</p><p><b>Pattern Type</b>: Plain</p><p><b>Length</b>: Long</p><p><b>Season</b>: Summer</p><p><b>Type</b>: Cami</p><p><b>Details</b>: Ruffle Hem</p><p><b>Details</b>: Tie Back</p><p><b>Sleeve Length</b>: Sleeveless</p><p><b>Neckline</b>: Spaghetti Strap</p><p><b>Waist Line</b>: High Waist</p><p><b>Fit Type</b>: Regular Fit</p><p><b>Sheer</b>: No</p><p><b>Hem Shaped</b>: Flounce</p><p><b>Material</b>: Cotton</p><p><b>Composition</b>: 100% Cotton</p><p><b>Fabric</b>: Non-Stretch</p><p><b>Care Instructions</b>: Machine wash or professional dry clean</p>,img/Dresses/swdress25210430012.jpg,,Size#XS:S:M:L:,32.43,,,,1,1,,,Dresses,,Knot Backless Ruffle Hem Cami Dress,Knot Backless Ruffle Hem Cami Dress,Knot Backless Ruffle Hem Cami Dress,,,,,,,,,
DTPOJRY0086,Letter Graphic Heart Charm Necklace,,<p><b>Details</b>: Heart</p><p><b>Type</b>: Pendant Necklaces</p><p><b>Material</b>: Stainless Steel</p><p><b>Color</b>: Silver</p><p><b>Metal Color</b>: Silver</p><p><b>Style</b>: Casual</p><p><b>Details</b>: Heart</p><p><b>Type</b>: Pendant Necklaces</p><p><b>Material</b>: Stainless Steel</p><p><b>Color</b>: Silver</p><p><b>Metal Color</b>: Silver</p><p><b>Style</b>: Casual</p><p><b>Details</b>: Heart</p><p><b>Type</b>: Pendant Necklaces</p><p><b>Material</b>: Stainless Steel</p><p><b>Color</b>: Silver</p><p><b>Metal Color</b>: Silver</p><p><b>Style</b>: Casual</p><p><b>Details</b>: Heart</p><p><b>Type</b>: Pendant Necklaces</p><p><b>Material</b>: Stainless Steel</p><p><b>Color</b>: Silver</p><p><b>Metal Color</b>: Silver</p><p><b>Style</b>: Casual</p>,img/Pendant_Necklaces/swneck18201028978.jpg,,Size#,25.36,,,,1,1,,,Pendant Necklaces,,Letter Graphic Heart Charm Necklace,Letter Graphic Heart Charm Necklace,Letter Graphic Heart Charm Necklace,,,,,,,,,
DTPOJRY0087,13 Pcs/Set Exaggerate Punk Metal Ring Set Star Black Gem Mount Women Ring Jewelry Kit,,"<p>Style: Punk, Exaggerate</p><p>Type: Ring Set</p><p>Color: Gold</p><p>Weight: About 39.5g</p><p>Size: As the picture shows</p><p>Material: Alloy</p><p>Quantity: 13 pcs</p><p>1 X Ring Set</p>",img/Rings/SKUE71704.jpg,,Size#,17.19,,,,1,1,,,Rings,,13 Pcs/Set Exaggerate Punk Metal Ring Set Star Black Gem Mount Women Ring Jewelry Kit,13 Pcs/Set Exaggerate Punk Metal Ring Set Star Black Gem Mount Women Ring Jewelry Kit,13 Pcs/Set Exaggerate Punk Metal Ring Set Star Black Gem Mount Women Ring Jewelry Kit,,,,,,,,,
DTPOJRY0088,Women 2Pcs Anti theft Genuine Leather Solid Casual Backpack Crossbody Bag Shoulder Bag,,"<p>Color:Purple, Blue, Black, Khaki</p><p>Material:Nylon</p><p>Style:Casual</p><p>Capacity:4A Magazine</p>",img/Backpack/SKUE79397.jpg,,Size#,70.32,,,,1,1,,,Backpack,,Women 2Pcs Anti theft Genuine Leather Solid Casual Backpack Crossbody Bag Shoulder Bag,Women 2Pcs Anti theft Genuine Leather Solid Casual Backpack Crossbody Bag Shoulder Bag,Women 2Pcs Anti theft Genuine Leather Solid Casual Backpack Crossbody Bag Shoulder Bag,,,,,,,,,
DTPOJRY0089,Men Outdoor Anti-collision Toe Non Slip Wearable Sole Casual Hiking Shoes,,"<p>Color:Black, Brown, Grey</p><p>Upper Material:PU</p><p>Outsole Material:TPR</p><p>Type:Hiking Shoes</p><p>Function:Slip Resistant</p><p>Occasion:Sport, Climbing</p><p>Closure Type:Lace-up</p><p>Season:All Season</p><p>Toe Type:Round</p>",img/Sneakers__Athletic/SKUG43315.jpg,,Size#US 6.5:US 7.5:US 8:US 8.5:US 9:US 10:US 10.5:US 11:US 11.5:US 12:,50.47,,,,1,1,,,Sneakers & Athletic,,Men Outdoor Anti-collision Toe Non Slip Wearable Sole Casual Hiking Shoes,Men Outdoor Anti-collision Toe Non Slip Wearable Sole Casual Hiking Shoes,Men Outdoor Anti-collision Toe Non Slip Wearable Sole Casual Hiking Shoes,,,,,,,,,
DTPOJRY0090,Women Lace-up Color Block Patchwork Loafers Shoes Casual Stitching Comfy Flats,,"<p>Color:Beige, Black, Brown</p><p>Type:Loafers</p><p>Closure Type:Lace-up</p><p>Heel Type:Platforms</p><p>Heel Height:1-3cm In Flat</p><p>Toe Type:Round</p><p>Pattern:Color Block</p><p>Design Element:Patchwork, Stitching</p><p>Style:Casual</p><p>Outsole Material:Rubber</p><p>Structure:Lace-up</p><p>Occasion:Casual, Daily</p><p>Function:Soft, Hard-wearing</p><p>Season:Summer, Winter, Autumn, Spring</p>",img/Flats/SKUI18303.jpg,,Size#US 5:US 6:US 7:US 8:US 9:,49.76,,,,1,1,,,Flats,,Women Lace-up Color Block Patchwork Loafers Shoes Casual Stitching Comfy Flats,Women Lace-up Color Block Patchwork Loafers Shoes Casual Stitching Comfy Flats,Women Lace-up Color Block Patchwork Loafers Shoes Casual Stitching Comfy Flats,,,,,,,,,
DTPOJRY0091,V-neck Button Front Lettuce Trim Top,,<p><b>Style</b>: Casual</p><p><b>Color</b>: Black</p><p><b>Pattern Type</b>: Plain</p><p><b>Length</b>: Crop</p><p><b>Season</b>: Summer</p><p><b>Details</b>: Lettuce Trim</p><p><b>Details</b>: Button Front</p><p><b>Size Fit</b>: Asian sizes are smaller than European and US sizes.</p><p><b>Fit Type</b>: Regular Fit</p><p><b>Sleeve Length</b>: Short Sleeve</p><p><b>Neckline</b>: V neck</p><p><b>Sleeve Type</b>: Regular Sleeve</p><p><b>Placket Type</b>: Placket</p><p><b>Sheer</b>: No</p><p><b>Material</b>: Polyester</p><p><b>Composition</b>: 65% Polyester</p><p><b>Composition</b>: 35% Cotton</p><p><b>Fabric</b>: Medium Stretch</p><p><b>Care Instructions</b>: Machine wash or professional dry clean</p><p><b>Style</b>: Casual</p><p><b>Color</b>: Khaki</p><p><b>Pattern Type</b>: Plain</p><p><b>Length</b>: Crop</p><p><b>Season</b>: Summer</p><p><b>Details</b>: Lettuce Trim</p><p><b>Details</b>: Button Front</p><p><b>Fit Type</b>: Regular Fit</p><p><b>Sleeve Length</b>: Short Sleeve</p><p><b>Neckline</b>: V neck</p><p><b>Sleeve Type</b>: Regular Sleeve</p><p><b>Placket Type</b>: Placket</p><p><b>Sheer</b>: No</p><p><b>Material</b>: Polyester</p><p><b>Composition</b>: 65% Polyester</p><p><b>Composition</b>: 35% Cotton</p><p><b>Fabric</b>: Medium Stretch</p><p><b>Care Instructions</b>: Machine wash or professional dry clean</p><p><b>Style</b>: Casual</p><p><b>Color</b>: Mustard Yellow</p><p><b>Pattern Type</b>: Plain</p><p><b>Length</b>: Crop</p><p><b>Season</b>: Summer</p><p><b>Details</b>: Lettuce Trim</p><p><b>Details</b>: Rib-Knit</p><p><b>Details</b>: Button Front</p><p><b>Fit Type</b>: Regular Fit</p><p><b>Sleeve Length</b>: Short Sleeve</p><p><b>Neckline</b>: V neck</p><p><b>Sleeve Type</b>: Regular Sleeve</p><p><b>Placket Type</b>: Placket</p><p><b>Sheer</b>: No</p><p><b>Material</b>: Polyester</p><p><b>Composition</b>: 65% Polyester</p><p><b>Composition</b>: 35% Cotton</p><p><b>Fabric</b>: Medium Stretch</p><p><b>Care Instructions</b>: Machine wash or professional dry clean</p>,img/Women_Tops/swtop30210416357.jpg,,Size#S:M:L:XL:,28.69,,,,1,1,,,Women Tops,,V-neck Button Front Lettuce Trim Top,V-neck Button Front Lettuce Trim Top,V-neck Button Front Lettuce Trim Top,,,,,,,,,
DTPOJRY0092,Chevron Print Shorts,,<p><b>Style</b>: Casual</p><p><b>Color</b>: Multicolor</p><p><b>Pattern Type</b>: Chevron</p><p><b>Season</b>: Summer</p><p><b>Type</b>: Wide Leg</p><p><b>Details</b>: Belted</p><p><b>Details</b>: Paper Bag Waist</p><p><b>Waist Line</b>: Natural</p><p><b>Fit Type</b>: Regular Fit</p><p><b>Sheer</b>: No</p><p><b>Closure Type</b>: Elastic Waist</p><p><b>Material</b>: Cotton Blends</p><p><b>Composition</b>: 65% Cotton</p><p><b>Composition</b>: 35% Polyester</p><p><b>Fabric</b>: Non-Stretch</p><p><b>Care Instructions</b>: Machine wash or professional dry clean</p>,img/Shorts/sW210611570204400.jpg,,Size#S:M:L:,24.53,,,,1,1,,,Shorts,,Chevron Print Shorts,Chevron Print Shorts,Chevron Print Shorts,,,,,,,,,
DTPOJRY0093,Solid Drawstring Ruched Ribbed Tank Top,,<p><b>Style</b>: Casual</p><p><b>Color</b>: Mint Green</p><p><b>Pattern Type</b>: Plain</p><p><b>Length</b>: Crop</p><p><b>Season</b>: Summer</p><p><b>Type</b>: Tank</p><p><b>Details</b>: Drawstring</p><p><b>Details</b>: Ruched</p><p><b>Details</b>: Rib-Knit</p><p><b>Fit Type</b>: Slim Fit</p><p><b>Neckline</b>: Stand Collar</p><p><b>Sheer</b>: No</p><p><b>Material</b>: Polyester</p><p><b>Composition</b>: 80% Polyester</p><p><b>Composition</b>: 20% Cotton</p><p><b>Fabric</b>: High Stretch</p><p><b>Care Instructions</b>: Machine wash or professional dry clean</p>,img/Tank_Tops__Camis/rwvest25210601531.jpg,,Size#S:M:L:XL:,32.41,,,,1,1,,,Tank Tops & Cam's,,Solid Drawstring Ruched Ribbed Tank Top,Solid Drawstring Ruched Ribbed Tank Top,Solid Drawstring Ruched Ribbed Tank Top,,,,,,,,,
DTPOJRY0094,Striped Button Belted Dress,,<p><b>Style</b>: Casual</p><p><b>Color</b>: Blue and White</p><p><b>Pattern Type</b>: Striped</p><p><b>Length</b>: Mini</p><p><b>Season</b>: Summer</p><p><b>Type</b>: Cami</p><p><b>Details</b>: Belted</p><p><b>Details</b>: Button</p><p><b>Sleeve Length</b>: Sleeveless</p><p><b>Neckline</b>: Spaghetti Strap</p><p><b>Waist Line</b>: Natural</p><p><b>Fit Type</b>: Regular Fit</p><p><b>Sheer</b>: No</p><p><b>Hem Shaped</b>: Flared</p><p><b>Material</b>: Cotton</p><p><b>Composition</b>: 85% Cotton</p><p><b>Composition</b>: 15% Polyester</p><p><b>Fabric</b>: Slight Stretch</p><p><b>Care Instructions</b>: Machine wash or professional dry clean</p>,img/Dresses/rwdress25210611162.jpg,,Size#S:M:L:,29.31,,,,1,1,,,Dresses,,Striped Button Belted Dress,Striped Button Belted Dress,Striped Button Belted Dress,,,,,,,,,
DTPOJRY0095,3pcs Simple Moon Decor Necklace,,<p><b>Type</b>: Pendant Necklaces</p><p><b>Details</b>: Rhinestone</p><p><b>Material</b>: Iron</p><p><b>Color</b>: Gold</p><p><b>Metal Color</b>: Gold</p><p><b>Style</b>: Casual</p>,img/Pendant_Necklaces/swneck18200923853.jpg,,Size#,14.44,,,,1,1,,,Pendant Necklaces,,3pcs Simple Moon Decor Necklace,3pcs Simple Moon Decor Necklace,3pcs Simple Moon Decor Necklace,,,,,,,,,
DTPOJRY0096,Vintage Alloy Animal-shape Frog Prince Ring Opening Adjustable,,<p>Style: Vintage</p><p>Type: Ring</p><p>Color: Silver</p><p>Weight: 4g</p><p>Length: About 2 cm / 0.78 in</p><p>Material:  Alloy</p><p>Package Includes:</p><p>1 x Ring</p>,img/Rings/SKUH03679.jpg,,Size#,22.53,,,,1,1,,,Rings,,Vintage Alloy Animal-shape Frog Prince Ring Opening Adjustable,Vintage Alloy Animal-shape Frog Prince Ring Opening Adjustable,Vintage Alloy Animal-shape Frog Prince Ring Opening Adjustable,,,,,,,,,
DTPOJRY0097,Women 2Pcs Anti theft Solid Casual Backpack Shoulder Bag,,"<p>Color:Blue, Grey, Black, Green, Khaki, Pink, Red</p><p>Material:Nylon</p><p>Style:Casual</p><p>Capacity:4A Magazine</p>",img/Backpack/SKUE79389.jpg,,Size#,63.98,,,,1,1,,,Backpack,,Women 2Pcs Anti theft Solid Casual Backpack Shoulder Bag,Women 2Pcs Anti theft Solid Casual Backpack Shoulder Bag,Women 2Pcs Anti theft Solid Casual Backpack Shoulder Bag,,,,,,,,,
DTPOJRY0098,Men Steel Cap Toe Anti Smashing Puncture Proof Safety Shoes,,<p>Color:Black</p><p>Upper Material:PU</p><p>Outsole Material:Rubber</p><p>Function:Slip Resistant</p><p>Occasion:Outdoor</p><p>Closure Type:Lace-up</p><p>Toe Type:Round</p>,img/Sneakers__Athletic/SKUA93506.jpg,,Size#US 6.5:US 7.5:US 8:US 8.5:US 9:US 10:US 10.5:,51.16,,,,1,1,,,Sneakers & Athletic,,Men Steel Cap Toe Anti Smashing Puncture Proof Safety Shoes,Men Steel Cap Toe Anti Smashing Puncture Proof Safety Shoes,Men Steel Cap Toe Anti Smashing Puncture Proof Safety Shoes,,,,,,,,,
DTPOJRY0099,Women Casual Printing Calico Pattern Hard-wearing Flat Loafers Shoes,,"<p>Color:Green</p><p>Type:Loafers</p><p>Closure Type:Slip-On</p><p>Heel Type:Flat</p><p>Heel Height:1-3cm In Flat</p><p>Toe Type:Round</p><p>Pattern:Calico, Plants, Floral</p><p>Design Element:Pattern, Print</p><p>Upper Material:Canvas</p><p>Style:Casual</p><p>Outsole Material:Rubber</p><p>Structure:Slip-On</p><p>Occasion:Casual</p><p>Function:Antiskid, Hard-wearing</p><p>Season:All Season</p>",img/Flats/SKUH21802.jpg,,Size#US 5:US 6:US 7:US 8:US 9:US 10:US 11:US 12:,52.12,,,,1,1,,,Flats,,Women Casual Printing Calico Pattern Hard-wearing Flat Loafers Shoes,Women Casual Printing Calico Pattern Hard-wearing Flat Loafers Shoes,Women Casual Printing Calico Pattern Hard-wearing Flat Loafers Shoes,,,,,,,,,
DTPOJRY0100,Marble Print Frill Trim Mesh Crop Top,,<p><b>Style</b>: Casual</p><p><b>Color</b>: Green</p><p><b>Pattern Type</b>: All Over Print</p><p><b>Length</b>: Crop</p><p><b>Season</b>: Summer</p><p><b>Details</b>: Lettuce Trim</p><p><b>Details</b>: Sheer</p><p><b>Details</b>: Contrast Binding</p><p><b>Neckline</b>: Round Neck</p><p><b>Sleeve Length</b>: Short Sleeve</p><p><b>Fit Type</b>: Slim Fit</p><p><b>Sleeve Type</b>: Regular Sleeve</p><p><b>Placket Type</b>: Pullovers</p><p><b>Sheer</b>: Yes</p><p><b>Material</b>: Mesh</p><p><b>Composition</b>: 100% Polyester</p><p><b>Fabric</b>: Slight Stretch</p><p><b>Care Instructions</b>: Machine wash or professional dry clean</p>,img/Women_Tops/swtop07210604123.jpg,,Size#XS:S:M:L:XL:,28.48,,,,1,1,,,Women Tops,,Marble Print Frill Trim Mesh Crop Top,Marble Print Frill Trim Mesh Crop Top,Marble Print Frill Trim Mesh Crop Top,,,,,,,,,
DTPOJRY0101,Argyle Pattern Tie Front Shorts,,<p><b>Style</b>: Sporty</p><p><b>Color</b>: Multicolor</p><p><b>Pattern Type</b>: Geometric</p><p><b>Season</b>: Summer</p><p><b>Type</b>: Track Shorts</p><p><b>Details</b>: Knot</p><p><b>Waist Line</b>: Natural</p><p><b>Fit Type</b>: Regular Fit</p><p><b>Sheer</b>: No</p><p><b>Closure Type</b>: Elastic Waist</p><p><b>Material</b>: Cotton Blends</p><p><b>Composition</b>: 65% Cotton</p><p><b>Composition</b>: 35% Polyester</p><p><b>Fabric</b>: Slight Stretch</p><p><b>Care Instructions</b>: Machine wash or professional dry clean</p>,img/Shorts/rwshorts25210511896.jpg,,Size#S:M:L:,25.26,,,,1,1,,,Shorts,,Argyle Pattern Tie Front Shorts,Argyle Pattern Tie Front Shorts,Argyle Pattern Tie Front Shorts,,,,,,,,,
DTPOJRY0102,Devil Print Crop Ringer Cami Top,,<p><b>Style</b>: Casual</p><p><b>Color</b>: Baby Pink</p><p><b>Pattern Type</b>: Letter</p><p><b>Pattern Type</b>: Cartoon</p><p><b>Length</b>: Crop</p><p><b>Season</b>: Summer</p><p><b>Type</b>: Cami</p><p><b>Details</b>: Contrast Binding</p><p><b>Fit Type</b>: Slim Fit</p><p><b>Neckline</b>: Spaghetti Strap</p><p><b>Material</b>: Polyester</p><p><b>Composition</b>: 65% Polyester</p><p><b>Composition</b>: 35% Cotton</p><p><b>Fabric</b>: High Stretch</p><p><b>Care Instructions</b>: Machine wash or professional dry clean</p>,img/Tank_Tops__Camis/swvest01190813363.jpg,,Size#S:M:L:,24.81,,,,1,1,,,Tank Tops & Cam's,,Devil Print Crop Ringer Cami Top,Devil Print Crop Ringer Cami Top,Devil Print Crop Ringer Cami Top,,,,,,,,,
DTPOJRY0103,Plaid Print Tie Detail A-Line Dress,,<p><b>Style</b>: Preppy</p><p><b>Color</b>: Multicolor</p><p><b>Pattern Type</b>: Tartan</p><p><b>Length</b>: Short</p><p><b>Season</b>: Spring/Fall</p><p><b>Type</b>: Shirt</p><p><b>Details</b>: Zipper</p><p><b>Details</b>: Button Front</p><p><b>Sleeve Length</b>: Long Sleeve</p><p><b>Neckline</b>: Collar</p><p><b>Waist Line</b>: High Waist</p><p><b>Fit Type</b>: Regular Fit</p><p><b>Sleeve Type</b>: Regular Sleeve</p><p><b>Sheer</b>: No</p><p><b>Hem Shaped</b>: Flared</p><p><b>Material</b>: Polyester</p><p><b>Composition</b>: 95% Polyester</p><p><b>Composition</b>: 5% Elastane</p><p><b>Fabric</b>: Non-Stretch</p><p><b>Care Instructions</b>: Machine wash or professional dry clean</p>,img/Dresses/swdress25210602133.jpg,,Size#XS:S:M:L:,23.88,,,,1,1,,,Dresses,,Plaid Print Tie Detail A-Line Dress,Plaid Print Tie Detail A-Line Dress,Plaid Print Tie Detail A-Line Dress,,,,,,,,,
