v_sku,v_name,v_short_description,v_description,v_image,v_url,v_attribute,v_price,v_specials_price,v_specials_expire_date,v_date_added,v_in_stock,v_status,v_viewed,v_ordered,v_category_sku,v_sort_order,v_meta_title,v_meta_keywords,v_meta_description,v_brand_filter,v_class_filter,v_color_filter,v_gender_filter,v_material_filter,v_year_filter,v_origin_filter,v_series_filter,v_spec_filter
ENCSGLF0139,Cherry Print Button Front Blouse,,<p><b>Style</b>: Casual</p><p><b>Color</b>: Black</p><p><b>Pattern Type</b>: Fruit&Vegetable</p><p><b>Pattern Type</b>: All Over Print</p><p><b>Length</b>: Regular</p><p><b>Season</b>: Summer</p><p><b>Type</b>: Shirt</p><p><b>Details</b>: Button Front</p><p><b>Neckline</b>: Collar</p><p><b>Fit Type</b>: Regular Fit</p><p><b>Sleeve Length</b>: Short Sleeve</p><p><b>Sleeve Type</b>: Regular Sleeve</p><p><b>Sheer</b>: No</p><p><b>Placket Type</b>: Placket</p><p><b>Material</b>: Polyester</p><p><b>Composition</b>: 100% Polyester</p><p><b>Fabric</b>: Non-Stretch</p><p><b>Care Instructions</b>: Machine wash or professional dry clean</p>,img/Blouses/rwblouse25210513072.jpg,,Size#S:M:L:,31.07,,,,1,1,,,Blouses,,Cherry Print Button Front Blouse,Cherry Print Button Front Blouse,Cherry Print Button Front Blouse,,,,,,,,,
ENCSGLF0140,Vintage Round-shape Three-dimensional Carved Branches Inlaid Rubies Alloy Earrings,,<p>Style: Vintage</p><p>Type: Earrings</p><p>Color: Silver</p><p>Weight: 20 g</p><p>Size: About 2.2*3 cm / 0.87*1.18 in</p><p>Material: Alloy</p><p>Package Includes:</p><p>1 x Earrings</p><p>Notice:</p>,img/Earrings/SKUI28396.jpg,,Size#,27.29,,,,1,1,,,Earrings,,Vintage Round-shape Three-dimensional Carved Branches Inlaid Rubies Alloy Earrings,Vintage Round-shape Three-dimensional Carved Branches Inlaid Rubies Alloy Earrings,Vintage Round-shape Three-dimensional Carved Branches Inlaid Rubies Alloy Earrings,,,,,,,,,
ENCSGLF0141,Vintage Red Crystal Ring Temperament Metal Rhinestone Ring,,<p>Style: Vintage</p><p>Type: Ring</p><p>Color: Gold.</p><p>Diameter Length: About 15.7 /16.5/ 17.3/ 18.1/ 18.9/ 19.8/ 20.6mm</p><p>Material:  Alloy</p><p>Ring Size:  5 / 6 /7 / 8 / 9 / 10 / 11</p><p>(Please see the size reference for size conversion and detail information.)</p><p>Package Includes:</p><p>1 x Ring</p>,img/Rings/SKUH02245.jpg,,Size#5:6:7:8:9:10:11:,14.0,,,,1,1,,,Rings,,Vintage Red Crystal Ring Temperament Metal Rhinestone Ring,Vintage Red Crystal Ring Temperament Metal Rhinestone Ring,Vintage Red Crystal Ring Temperament Metal Rhinestone Ring,,,,,,,,,
ENCSGLF0142,Vintage Tassel Bucket Bag Shoulder Bag For Women,,"<p>Color:Black, Brown, Green, Pink, Beige, Red</p><p>Material:PU</p><p>Style:Casual, Vintage</p><p>Decoration:Tassel</p><p>Hardness:Soft</p>",img/Handbags/SKUA47935.jpg,,Size#,68.83,,,,1,1,,,Handbags,,Vintage Tassel Bucket Bag Shoulder Bag For Women,Vintage Tassel Bucket Bag Shoulder Bag For Women,Vintage Tassel Bucket Bag Shoulder Bag For Women,,,,,,,,,
ENCSGLF0143,Women Metal Decoration Embroidered Low Heeled Mule Shoes,,"<p>Color:Black, Multicolor</p><p>Closure Type:Slip-On</p><p>Heel Type:Chunky Heel</p><p>Heel Height:1-3cm In Flat</p><p>Toe Type:Pointed</p><p>Pattern:Calico</p><p>Design Element:Embroidered, Metal</p><p>Upper Material:Cloth</p><p>Style:Casual</p><p>Outsole Material:Rubber</p><p>Occasion:Holiday, Casual, Shopping</p><p>Function:Antiskid</p><p>Season:Summer, Autumn</p>",img/Heels/SKUH80181.jpg,,Size#US 5:US 6:US 7:US 8:US 9:US 10:US 11:,62.49,,,,1,1,,,Heels,,Women Metal Decoration Embroidered Low Heeled Mule Shoes,Women Metal Decoration Embroidered Low Heeled Mule Shoes,Women Metal Decoration Embroidered Low Heeled Mule Shoes,,,,,,,,,
ENCSGLF0144,Men Comfy Light Weight Lace Up Sport Casual Trainers,,"<p>Color:Black, Brown, Grey, White</p><p>Upper Material:PU</p><p>Outsole Material:Rubber</p><p>Function:Soft</p><p>Occasion:Daily</p><p>Closure Type:Lace-up</p>",img/Sneakers__Athletic/SKUF24867.jpg,,Size#US 6.5:US 7.5:US 8:US 8.5:US 9:US 10:,65.13,,,,1,1,,,Sneakers & Athletic,,Men Comfy Light Weight Lace Up Sport Casual Trainers,Men Comfy Light Weight Lace Up Sport Casual Trainers,Men Comfy Light Weight Lace Up Sport Casual Trainers,,,,,,,,,
ENCSGLF0145,Asymmetrical Waist Belted Denim Shorts,,"<p><b>Color</b>: Light Wash</p><p><b>Pattern Type</b>: Plain</p><p><b>Type</b>: Track Shorts</p><p><b>Details</b>: Belted</p><p><b>Details</b>: Asymmetrical</p><p><b>Details</b>: Button</p><p><b>Details</b>: Pocket</p><p><b>Details</b>: Zipper</p><p><b>Waist Line</b>: High Waist</p><p><b>Fit Type</b>: Regular Fit</p><p><b>Sheer</b>: No</p><p><b>Closure Type</b>: Zipper Fly</p><p><b>Belt</b>: Yes</p><p><b>Material</b>: Denim</p><p><b>Composition</b>: 85% Cotton</p><p><b>Composition</b>: 15% Polyester</p><p><b>Fabric</b>: Non-Stretch</p><p><b>Care Instructions</b>: Machine wash, do not dry clean</p>",img/Denim_Shorts/swshorts25210513001.jpg,,Size#XS:S:M:L:,30.29,,,,1,1,,,Denim Shorts,,Asymmetrical Waist Belted Denim Shorts,Asymmetrical Waist Belted Denim Shorts,Asymmetrical Waist Belted Denim Shorts,,,,,,,,,
ENCSGLF0146,Butterfly Embroidery Drawstring Tank Top,,<p><b>Style</b>: Casual</p><p><b>Color</b>: Black</p><p><b>Pattern Type</b>: Animal</p><p><b>Length</b>: Crop</p><p><b>Season</b>: Summer</p><p><b>Type</b>: Tank</p><p><b>Details</b>: Embroidery</p><p><b>Details</b>: Drawstring</p><p><b>Details</b>: Ruched</p><p><b>Neckline</b>: Round Neck</p><p><b>Fit Type</b>: Slim Fit</p><p><b>Sheer</b>: No</p><p><b>Material</b>: Polyester</p><p><b>Composition</b>: 100% Polyester</p><p><b>Fabric</b>: Medium Stretch</p><p><b>Care Instructions</b>: Machine wash or professional dry clean</p>,img/Tank_Tops__Camis/rwvest25210508630.jpg,,Size#XS:S:M:L:,32.95,,,,1,1,,,Tank Tops & Cam's,,Butterfly Embroidery Drawstring Tank Top,Butterfly Embroidery Drawstring Tank Top,Butterfly Embroidery Drawstring Tank Top,,,,,,,,,
ENCSGLF0147,Letter Graphic Contrast Piping Pleated Skirt,,<p><b>Style</b>: Sporty</p><p><b>Color</b>: White</p><p><b>Pattern Type</b>: Letter</p><p><b>Length</b>: Mini</p><p><b>Type</b>: A Line</p><p><b>Season</b>: Summer</p><p><b>Waist Line</b>: High Waist</p><p><b>Sheer</b>: No</p><p><b>Material</b>: Polyester</p><p><b>Composition</b>: 97% Polyester</p><p><b>Composition</b>: 3% Spandex</p><p><b>Fabric</b>: Non-Stretch</p><p><b>Care Instructions</b>: Machine wash or professional dry clean</p>,img/Skirts/swskirt07210310834.jpg,,Size#XS:S:M:L:XL:,29.55,,,,1,1,,,Skirts,,Letter Graphic Contrast Piping Pleated Skirt,Letter Graphic Contrast Piping Pleated Skirt,Letter Graphic Contrast Piping Pleated Skirt,,,,,,,,,
ENCSGLF0148,Sun & Moon Graphic Button Front Blouse,,<p><b>Style</b>: Casual</p><p><b>Color</b>: Multicolor</p><p><b>Pattern Type</b>: Graphic</p><p><b>Pattern Type</b>: All Over Print</p><p><b>Length</b>: Regular</p><p><b>Season</b>: Summer</p><p><b>Type</b>: Shirt</p><p><b>Details</b>: Button Front</p><p><b>Neckline</b>: Collar</p><p><b>Fit Type</b>: Oversized</p><p><b>Sleeve Length</b>: Short Sleeve</p><p><b>Sleeve Type</b>: Regular Sleeve</p><p><b>Sheer</b>: No</p><p><b>Placket Type</b>: Placket</p><p><b>Material</b>: Polyester</p><p><b>Composition</b>: 100% Polyester</p><p><b>Fabric</b>: Non-Stretch</p><p><b>Care Instructions</b>: Machine wash or professional dry clean</p><p><b>Style</b>: Casual</p><p><b>Color</b>: Black</p><p><b>Pattern Type</b>: Graphic</p><p><b>Length</b>: Regular</p><p><b>Season</b>: Summer</p><p><b>Type</b>: Shirt</p><p><b>Details</b>: Button Front</p><p><b>Neckline</b>: Collar</p><p><b>Fit Type</b>: Oversized</p><p><b>Sleeve Length</b>: Short Sleeve</p><p><b>Sleeve Type</b>: Drop Shoulder</p><p><b>Sheer</b>: No</p><p><b>Placket Type</b>: Placket</p><p><b>Material</b>: Polyester</p><p><b>Composition</b>: 100% Polyester</p><p><b>Fabric</b>: Non-Stretch</p><p><b>Care Instructions</b>: Machine wash or professional dry clean</p><p><b>Style</b>: Casual</p><p><b>Color</b>: Black</p><p><b>Pattern Type</b>: Graphic</p><p><b>Length</b>: Regular</p><p><b>Season</b>: Summer</p><p><b>Type</b>: Shirt</p><p><b>Details</b>: Button Front</p><p><b>Neckline</b>: Collar</p><p><b>Fit Type</b>: Regular Fit</p><p><b>Sleeve Length</b>: Short Sleeve</p><p><b>Sleeve Type</b>: Regular Sleeve</p><p><b>Sheer</b>: No</p><p><b>Placket Type</b>: Placket</p><p><b>Material</b>: Polyester</p><p><b>Composition</b>: 100% Polyester</p><p><b>Fabric</b>: Non-Stretch</p><p><b>Care Instructions</b>: Machine wash or professional dry clean</p><p><b>Style</b>: Casual</p><p><b>Color</b>: Blue</p><p><b>Pattern Type</b>: Letter</p><p><b>Pattern Type</b>: Graphic</p><p><b>Length</b>: Regular</p><p><b>Season</b>: Summer</p><p><b>Type</b>: Shirt</p><p><b>Details</b>: Button Front</p><p><b>Neckline</b>: Collar</p><p><b>Fit Type</b>: Regular Fit</p><p><b>Sleeve Length</b>: Short Sleeve</p><p><b>Sleeve Type</b>: Regular Sleeve</p><p><b>Sheer</b>: No</p><p><b>Placket Type</b>: Placket</p><p><b>Material</b>: Polyester</p><p><b>Composition</b>: 100% Polyester</p><p><b>Fabric</b>: Non-Stretch</p><p><b>Care Instructions</b>: Machine wash or professional dry clean</p>,img/Blouses/rwblouse03201216168.jpg,,Size#S:M:L:XL:,24.85,,,,1,1,,,Blouses,,Sun & Moon Graphic Button Front Blouse,Sun & Moon Graphic Button Front Blouse,Sun & Moon Graphic Button Front Blouse,,,,,,,,,
ENCSGLF0149,Vintage Spiral-Shape Women Earrings Jewelry Gift,,"<p>Style: Vintage</p><p>Type: Earrings</p><p>Color: Silver, Gold</p><p>Weight: 10g</p><p>Material: Alloy</p><p>1 x Earrings</p>",img/Earrings/SKUH03701.jpg,,Size#,22.67,,,,1,1,,,Earrings,,Vintage Spiral-Shape Women Earrings Jewelry Gift,Vintage Spiral-Shape Women Earrings Jewelry Gift,Vintage Spiral-Shape Women Earrings Jewelry Gift,,,,,,,,,
ENCSGLF0150,Vintage Inlaid Diamond Women Ring Hollow Painted Flower Leaf Ring Jewelry Gift,,"<p>Style: Vintage </p><p>Type: Ring</p><p>Color: Gold</p><p>Weight: 11.5g</p><p>Size: 7, 8, 9, 10, 11</p><p>Material: Alloy</p><p>1 x Ring</p>",img/Rings/SKUG97546.jpg,,Size#7:8:9:10:11:,27.86,,,,1,1,,,Rings,,Vintage Inlaid Diamond Women Ring Hollow Painted Flower Leaf Ring Jewelry Gift,Vintage Inlaid Diamond Women Ring Hollow Painted Flower Leaf Ring Jewelry Gift,Vintage Inlaid Diamond Women Ring Hollow Painted Flower Leaf Ring Jewelry Gift,,,,,,,,,
ENCSGLF0151,Cowhide Embroidery Handbags Vintage Craft Shoulder Crossbody Bags,,"<p>Bag Type:Satchel</p><p>Color:Coffee, Green, Beige, Purple</p><p>Material:Cow Leather</p><p>Style:Vintage</p>",img/Handbags/SKU912243.jpg,,Size#,59.12,,,,1,1,,,Handbags,,Cowhide Embroidery Handbags Vintage Craft Shoulder Crossbody Bags,Cowhide Embroidery Handbags Vintage Craft Shoulder Crossbody Bags,Cowhide Embroidery Handbags Vintage Craft Shoulder Crossbody Bags,,,,,,,,,
ENCSGLF0152,Women Mesh Flower Embroidery Low-Heeled Loafers Shoes,,"<p>Color:Golden, Black, Pink, Blue</p><p>Type:Loafers</p><p>Closure Type:Slip-On</p><p>Heel Type:Chunky Heel</p><p>Heel Height:1-3cm In Flat</p><p>Toe Type:Pointed</p><p>Pattern:Calico</p><p>Design Element:Embroidered</p><p>Upper Material:Mesh</p><p>Style:Casual, Elegant</p><p>Outsole Material:Rubber</p><p>Occasion:Casual</p><p>Function:Breathable</p><p>Season:Summer, Autumn</p>",img/Heels/SKUH80004.jpg,,Size#US 5:US 6:US 7:US 8:US 9:,63.24,,,,1,1,,,Heels,,Women Mesh Flower Embroidery Low-Heeled Loafers Shoes,Women Mesh Flower Embroidery Low-Heeled Loafers Shoes,Women Mesh Flower Embroidery Low-Heeled Loafers Shoes,,,,,,,,,
ENCSGLF0153,Men Pure Color Leather Lace Up Sport Casual Running Shoes,,"<p>Color:Black, Blue, Grey, White</p><p>Upper Material:PU</p><p>Outsole Material:Rubber</p><p>Type:Walking Shoes</p><p>Function:Slip Resistant</p><p>Closure Type:Lace-up</p><p>Season:All Season</p><p>Toe Type:Round</p>",img/Sneakers__Athletic/SKUD79070.jpg,,Size#US 6.5:US 7.5:US 8:US 8.5:US 9:US 10:US 10.5:US 11:,50.51,,,,1,1,,,Sneakers & Athletic,,Men Pure Color Leather Lace Up Sport Casual Running Shoes,Men Pure Color Leather Lace Up Sport Casual Running Shoes,Men Pure Color Leather Lace Up Sport Casual Running Shoes,,,,,,,,,
ENCSGLF0154,Tie Dye Fringe Hem Denim Shorts,,"<p><b>Color</b>: Multicolor</p><p><b>Pattern Type</b>: Tie Dye</p><p><b>Type</b>: Straight Leg</p><p><b>Details</b>: Fringe</p><p><b>Details</b>: Button</p><p><b>Details</b>: Pocket</p><p><b>Details</b>: Zipper</p><p><b>Waist Line</b>: Natural</p><p><b>Fit Type</b>: Regular Fit</p><p><b>Sheer</b>: No</p><p><b>Closure Type</b>: Zipper Fly</p><p><b>Material</b>: Denim</p><p><b>Composition</b>: 85% Cotton</p><p><b>Composition</b>: 13% Polyester</p><p><b>Composition</b>: 2% Elastane</p><p><b>Fabric</b>: Medium Stretch</p><p><b>Care Instructions</b>: Machine wash, do not dry clean</p>",img/Denim_Shorts/swshorts25210429190.jpg,,Size#26:27:28:29:30:,29.62,,,,1,1,,,Denim Shorts,,Tie Dye Fringe Hem Denim Shorts,Tie Dye Fringe Hem Denim Shorts,Tie Dye Fringe Hem Denim Shorts,,,,,,,,,
ENCSGLF0155,Tartan Crop Tank Top,,<p><b>Style</b>: Sexy</p><p><b>Color</b>: Multicolor</p><p><b>Pattern Type</b>: Tartan</p><p><b>Length</b>: Crop</p><p><b>Season</b>: Summer</p><p><b>Type</b>: Cami</p><p><b>Details</b>: Shirred</p><p><b>Fit Type</b>: Slim Fit</p><p><b>Neckline</b>: Spaghetti Strap</p><p><b>Sheer</b>: No</p><p><b>Material</b>: Polyester</p><p><b>Composition</b>: 100% Polyester</p><p><b>Fabric</b>: Non-Stretch</p><p><b>Care Instructions</b>: Machine wash or professional dry clean</p>,img/Tank_Tops__Camis/rwvest03201201486.jpg,,Size#S:M:,29.3,,,,1,1,,,Tank Tops & Cam's,,Tartan Crop Tank Top,Tartan Crop Tank Top,Tartan Crop Tank Top,,,,,,,,,
ENCSGLF0156,Zipper Side Plaid Pleated Skirt,,<p><b>Style</b>: Preppy</p><p><b>Color</b>: Black and White</p><p><b>Pattern Type</b>: Plaid</p><p><b>Length</b>: Mini</p><p><b>Type</b>: Pleated</p><p><b>Season</b>: Summer</p><p><b>Details</b>: Pleated</p><p><b>Details</b>: Zipper</p><p><b>Waist Line</b>: High Waist</p><p><b>Sheer</b>: No</p><p><b>Material</b>: Polyester</p><p><b>Composition</b>: 95% Polyester</p><p><b>Composition</b>: 5% Spandex</p><p><b>Fabric</b>: Slight Stretch</p><p><b>Care Instructions</b>: Machine wash or professional dry clean</p>,img/Skirts/swskirt07200925431.jpg,,Size#XS:S:M:L:XL:,27.3,,,,1,1,,,Skirts,,Zipper Side Plaid Pleated Skirt,Zipper Side Plaid Pleated Skirt,Zipper Side Plaid Pleated Skirt,,,,,,,,,
ENCSGLF0157,Sun And Moon Graphic Blouse,,<p><b>Style</b>: Casual</p><p><b>Color</b>: Black</p><p><b>Pattern Type</b>: Graphic</p><p><b>Length</b>: Long</p><p><b>Season</b>: Summer</p><p><b>Type</b>: Shirt</p><p><b>Details</b>: Button Front</p><p><b>Neckline</b>: Collar</p><p><b>Fit Type</b>: Regular Fit</p><p><b>Sleeve Length</b>: Short Sleeve</p><p><b>Sleeve Type</b>: Regular Sleeve</p><p><b>Sheer</b>: No</p><p><b>Placket Type</b>: Placket</p><p><b>Material</b>: Polyester</p><p><b>Composition</b>: 100% Polyester</p><p><b>Fabric</b>: Non-Stretch</p><p><b>Care Instructions</b>: Machine wash or professional dry clean</p>,img/Blouses/sW210602008111009.jpg,,Size#XS:S:M:L:,29.43,,,,1,1,,,Blouses,,Sun And Moon Graphic Blouse,Sun And Moon Graphic Blouse,Sun And Moon Graphic Blouse,,,,,,,,,
ENCSGLF0158,Vintage Twist Drop-Shaped Women Earrings Color Separation Amethyst Pendant Earrings,,"<p>Style: Vintage </p><p>Type: Earrings</p><p>Color: Purple</p><p>Weight: 6.5g</p><p>Size: About 4.1*1.3 cm / 1.61*0.51 in</p><p>Material: Alloy, Amethyst </p><p>1 x Earring</p>",img/Earrings/SKUG53311.jpg,,Size#,17.89,,,,1,1,,,Earrings,,Vintage Twist Drop-Shaped Women Earrings Color Separation Amethyst Pendant Earrings,Vintage Twist Drop-Shaped Women Earrings Color Separation Amethyst Pendant Earrings,Vintage Twist Drop-Shaped Women Earrings Color Separation Amethyst Pendant Earrings,,,,,,,,,
ENCSGLF0159,Elegant Opening Diamond Nail Ring Tail Ring,,<p>Notice:</p>,img/Rings/SKUH07244.jpg,,Size#Gold:Silver:,20.77,,,,1,1,,,Rings,,Elegant Opening Diamond Nail Ring Tail Ring,Elegant Opening Diamond Nail Ring Tail Ring,Elegant Opening Diamond Nail Ring Tail Ring,,,,,,,,,
ENCSGLF0160,Women 4 PCS Geometric Patchwork Handbag Shoulder Bag Crossbody Bag,,"<p>Bag Type:Bag Set</p><p>Color:Black, Brown, Green, Pink, Grey, Red</p><p>Material:PU, Faux Fur</p><p>Style:Casual</p><p>Capacity:4A Magazine</p><p>Hardness:Soft</p>",img/Handbags/SKUG31771.jpg,,Size#,71.49,,,,1,1,,,Handbags,,Women 4 PCS Geometric Patchwork Handbag Shoulder Bag Crossbody Bag,Women 4 PCS Geometric Patchwork Handbag Shoulder Bag Crossbody Bag,Women 4 PCS Geometric Patchwork Handbag Shoulder Bag Crossbody Bag,,,,,,,,,
ENCSGLF0161,Large Size Women Floral Printing Buckle Chunky Heel Mary Jane Pumps,,"<p>Color:Blue</p><p>Type:Mary Jane</p><p>Closure Type:Buckle</p><p>Heel Type:Chunky Heel</p><p>Heel Height:3-5cm In Low Heel</p><p>Toe Type:Round</p><p>Pattern:Floral</p><p>Design Element:Floral, Print</p><p>Upper Material:PU</p><p>Style:Casual</p><p>Outsole Material:Rubber</p><p>Structure:Ankle Strap</p><p>Occasion:Date, Casual</p><p>Function:Antiskid, Hard-wearing</p><p>Season:Summer, Autumn, Spring</p>",img/Heels/SKUE96522.jpg,,Size#US 5:US 6:US 7:US 8:US 9:US 10:US 11:US 12:,49.53,,,,1,1,,,Heels,,Large Size Women Floral Printing Buckle Chunky Heel Mary Jane Pumps,Large Size Women Floral Printing Buckle Chunky Heel Mary Jane Pumps,Large Size Women Floral Printing Buckle Chunky Heel Mary Jane Pumps,,,,,,,,,
ENCSGLF0162,Men Outdoor Round Toe Side Stripes Mesh Fabric Breathable Sneakers,,"<p>Color:Black, Beige, Khaki</p><p>Upper Material:Mesh, PU</p><p>Outsole Material:Rubber</p><p>Type:Skate Shoes</p><p>Function:Breathable, Hard-wearing</p><p>Occasion:Outdoor, Daily, Sport</p><p>Closure Type:Lace-up</p><p>Season:All Season</p><p>Toe Type:Round</p>",img/Sneakers__Athletic/SKUH24472.jpg,,Size#US 6.5:US 7.5:US 8:US 8.5:US 9:US 10:,51.76,,,,1,1,,,Sneakers & Athletic,,Men Outdoor Round Toe Side Stripes Mesh Fabric Breathable Sneakers,Men Outdoor Round Toe Side Stripes Mesh Fabric Breathable Sneakers,Men Outdoor Round Toe Side Stripes Mesh Fabric Breathable Sneakers,,,,,,,,,
ENCSGLF0163,High Waist Paisley Print Raw Hem Denim Shorts,,"<p><b>Color</b>: Light Wash</p><p><b>Pattern Type</b>: Paisley</p><p><b>Type</b>: Curvy</p><p><b>Details</b>: Raw Hem</p><p><b>Details</b>: Button</p><p><b>Details</b>: Pocket</p><p><b>Details</b>: Zipper</p><p><b>Waist Line</b>: High Waist</p><p><b>Fit Type</b>: Regular Fit</p><p><b>Sheer</b>: No</p><p><b>Closure Type</b>: Zipper Fly</p><p><b>Material</b>: Denim</p><p><b>Composition</b>: 85% Cotton</p><p><b>Composition</b>: 15% Polyester</p><p><b>Fabric</b>: Non-Stretch</p><p><b>Care Instructions</b>: Machine wash, do not dry clean</p>",img/Denim_Shorts/swshorts25210413310.jpg,,Size#26:27:28:29:30:,30.58,,,,1,1,,,Denim Shorts,,High Waist Paisley Print Raw Hem Denim Shorts,High Waist Paisley Print Raw Hem Denim Shorts,High Waist Paisley Print Raw Hem Denim Shorts,,,,,,,,,
ENCSGLF0164,Letter Bear Graphic Tank Top,,<p><b>Style</b>: Preppy</p><p><b>Color</b>: Black</p><p><b>Pattern Type</b>: Letter</p><p><b>Pattern Type</b>: Cartoon</p><p><b>Length</b>: Crop</p><p><b>Season</b>: Summer</p><p><b>Type</b>: Tank</p><p><b>Fit Type</b>: Regular Fit</p><p><b>Neckline</b>: Scoop Neck</p><p><b>Sheer</b>: No</p><p><b>Material</b>: Cotton</p><p><b>Composition</b>: 65% Cotton</p><p><b>Composition</b>: 35% Polyester</p><p><b>Fabric</b>: Slight Stretch</p><p><b>Care Instructions</b>: Machine wash or professional dry clean</p>,img/Tank_Tops__Camis/sW210615527327849.jpg,,Size#S:M:L:,29.91,,,,1,1,,,Tank Tops & Cam's,,Letter Bear Graphic Tank Top,Letter Bear Graphic Tank Top,Letter Bear Graphic Tank Top,,,,,,,,,
ENCSGLF0165,Ditsy Floral Shirred Skirt,,<p><b>Style</b>: Boho</p><p><b>Color</b>: Multicolor</p><p><b>Pattern Type</b>: Ditsy Floral</p><p><b>Length</b>: Mini</p><p><b>Type</b>: A Line</p><p><b>Season</b>: Summer</p><p><b>Details</b>: Shirred</p><p><b>Waist Line</b>: Natural</p><p><b>Sheer</b>: No</p><p><b>Material</b>: Polyester</p><p><b>Composition</b>: 100% Polyester</p><p><b>Fabric</b>: Non-Stretch</p><p><b>Care Instructions</b>: Machine wash or professional dry clean</p>,img/Skirts/sW210517251866114.jpg,,Size#S:M:L:,32.57,,,,1,1,,,Skirts,,Ditsy Floral Shirred Skirt,Ditsy Floral Shirred Skirt,Ditsy Floral Shirred Skirt,,,,,,,,,
ENCSGLF0166,Solid Contrast Lace Trim Puff Sleeve Blouse,,<p><b>Style</b>: Cute</p><p><b>Color</b>: White</p><p><b>Pattern Type</b>: Plain</p><p><b>Length</b>: Regular</p><p><b>Season</b>: Summer</p><p><b>Type</b>: Shirt</p><p><b>Details</b>: Contrast Lace</p><p><b>Sleeve Type</b>: Puff Sleeve</p><p><b>Neckline</b>: Collar</p><p><b>Fit Type</b>: Regular Fit</p><p><b>Sleeve Length</b>: Short Sleeve</p><p><b>Sheer</b>: No</p><p><b>Placket Type</b>: Placket</p><p><b>Material</b>: Polyester</p><p><b>Composition</b>: 100% Polyester</p><p><b>Fabric</b>: Non-Stretch</p><p><b>Care Instructions</b>: Machine wash or professional dry clean</p>,img/Blouses/swblouse03201216026.jpg,,Size#S:M:L:XL:XXL:,31.25,,,,1,1,,,Blouses,,Solid Contrast Lace Trim Puff Sleeve Blouse,Solid Contrast Lace Trim Puff Sleeve Blouse,Solid Contrast Lace Trim Puff Sleeve Blouse,,,,,,,,,
ENCSGLF0167,Three-dimensional Rhinestone Metal Lizard-Shaped Pierced Ear Hook Vintage Animal-Shape Earrings,,"<p>Style: Vintage</p><p>Type: Earrings</p><p>Color: Gold,Silver</p><p>Weight: 5g</p><p>Length: About 5.5*4cm / 2.17*1.57 in</p><p>Material:  Alloy</p><p>1 x </p><p>Earring</p>",img/Earrings/SKUH17645.jpg,,Size#,14.98,,,,1,1,,,Earrings,,Three-dimensional Rhinestone Metal Lizard-Shaped Pierced Ear Hook Vintage Animal-Shape Earrings,Three-dimensional Rhinestone Metal Lizard-Shaped Pierced Ear Hook Vintage Animal-Shape Earrings,Three-dimensional Rhinestone Metal Lizard-Shaped Pierced Ear Hook Vintage Animal-Shape Earrings,,,,,,,,,
ENCSGLF0168,Vintage Two-Tone Sapphire Ring Imitation Branch Tree Vine Inlaid Diamond Ring,,"<p>Style: Vintage </p><p>Type: Ring</p><p>Color: Gold</p><p>Weight: 7g</p><p>Size: 6, 7, 8, 9, 10</p><p>Material: Alloy, Amethyst</p><p>1 x Ring</p>",img/Rings/SKUG59167.jpg,,Size#6:7:8:9:10:,26.31,,,,1,1,,,Rings,,Vintage Two-Tone Sapphire Ring Imitation Branch Tree Vine Inlaid Diamond Ring,Vintage Two-Tone Sapphire Ring Imitation Branch Tree Vine Inlaid Diamond Ring,Vintage Two-Tone Sapphire Ring Imitation Branch Tree Vine Inlaid Diamond Ring,,,,,,,,,
ENCSGLF0169,Women Oil Wax Leather Tote Bag Retro Shoulder Bags Handbags,,"<p>Bag Type:Satchel</p><p>Color:Blue, Black, Brown</p><p>Material:PU</p><p>Style:Vintage</p><p>Hardness:Hard</p>",img/Handbags/SKU755870.jpg,,Size#,56.24,,,,1,1,,,Handbags,,Women Oil Wax Leather Tote Bag Retro Shoulder Bags Handbags,Women Oil Wax Leather Tote Bag Retro Shoulder Bags Handbags,Women Oil Wax Leather Tote Bag Retro Shoulder Bags Handbags,,,,,,,,,
ENCSGLF0170,Women Hollow Comfy Wearable Peep Toe Fashion T-Strap Pumps,,"<p>Color:Green, Red, Black, Brown, Blue</p><p>Closure Type:Buckle</p><p>Heel Type:Chunky Heel</p><p>Heel Height:5-8cm In Heel</p><p>Pattern:Solid</p><p>Upper Material:PU</p><p>Style:Casual</p><p>Outsole Material:Rubber</p><p>Occasion:Date, Casual</p><p>Function:Breathable</p><p>Season:Summer</p>",img/Heels/SKUF03300.jpg,,Size#US 5:US 6:US 7:US 8:US 9:US 10:US 11:US 12:,57.1,,,,1,1,,,Heels,,Women Hollow Comfy Wearable Peep Toe Fashion T-Strap Pumps,Women Hollow Comfy Wearable Peep Toe Fashion T-Strap Pumps,Women Hollow Comfy Wearable Peep Toe Fashion T-Strap Pumps,,,,,,,,,
ENCSGLF0171,Men Non-slip Woven Breathable Comfy Sock Sneakers,,"<p>Color:Black, White, Orange</p><p>Upper Material:Cloth</p><p>Outsole Material:Rubber</p><p>Type:Basketball Shoes, Running Shoes</p><p>Function:Breathable, Soft, Sport</p><p>Closure Type:Lace-up</p><p>Season:All Season</p><p>Toe Type:Round</p>",img/Sneakers__Athletic/SKUG58221.jpg,,Size#US 6.5:US 7.5:US 8:US 8.5:US 9:US 10:,58.24,,,,1,1,,,Sneakers & Athletic,,Men Non-slip Woven Breathable Comfy Sock Sneakers,Men Non-slip Woven Breathable Comfy Sock Sneakers,Men Non-slip Woven Breathable Comfy Sock Sneakers,,,,,,,,,
ENCSGLF0172,High Waist Cuffed Denim Shorts,,"<p><b>Color</b>: Light Wash</p><p><b>Pattern Type</b>: Plain</p><p><b>Type</b>: Straight Leg</p><p><b>Details</b>: Pocket</p><p><b>Waist Line</b>: High Waist</p><p><b>Fit Type</b>: Regular Fit</p><p><b>Sheer</b>: No</p><p><b>Closure Type</b>: Zipper Fly</p><p><b>Material</b>: Denim</p><p><b>Composition</b>: 85% Cotton</p><p><b>Composition</b>: 15% Polyester</p><p><b>Fabric</b>: Non-Stretch</p><p><b>Care Instructions</b>: Machine wash, do not dry clean</p>",img/Denim_Shorts/swshorts01201125470.jpg,,Size#XS:S:M:L:XL:,22.47,,,,1,1,,,Denim Shorts,,High Waist Cuffed Denim Shorts,High Waist Cuffed Denim Shorts,High Waist Cuffed Denim Shorts,,,,,,,,,
ENCSGLF0173,Solid Criss Cross Crop Cami,,<p><b>Style</b>: Casual</p><p><b>Color</b>: White</p><p><b>Pattern Type</b>: Plain</p><p><b>Length</b>: Crop</p><p><b>Season</b>: Summer</p><p><b>Type</b>: Cami</p><p><b>Details</b>: Criss Cross</p><p><b>Fit Type</b>: Slim Fit</p><p><b>Neckline</b>: Spaghetti Strap</p><p><b>Sheer</b>: No</p><p><b>Material</b>: Polyester</p><p><b>Composition</b>: 90% Polyester</p><p><b>Composition</b>: 10% Spandex</p><p><b>Fabric</b>: High Stretch</p><p><b>Care Instructions</b>: Machine wash or professional dry clean</p><p><b>Style</b>: Casual</p><p><b>Color</b>: Black</p><p><b>Pattern Type</b>: Plain</p><p><b>Length</b>: Crop</p><p><b>Season</b>: Summer</p><p><b>Type</b>: Cami</p><p><b>Details</b>: Criss Cross</p><p><b>Fit Type</b>: Slim Fit</p><p><b>Neckline</b>: Spaghetti Strap</p><p><b>Sheer</b>: No</p><p><b>Material</b>: Polyester</p><p><b>Composition</b>: 90% Polyester</p><p><b>Composition</b>: 10% Spandex</p><p><b>Fabric</b>: High Stretch</p><p><b>Care Instructions</b>: Machine wash or professional dry clean</p>,img/Tank_Tops__Camis/rwvest03200730340.jpg,,Size#XS:S:M:L:XL:XXL:,27.36,,,,1,1,,,Tank Tops & Cam's,,Solid Criss Cross Crop Cami,Solid Criss Cross Crop Cami,Solid Criss Cross Crop Cami,,,,,,,,,
