v_sku,v_name,v_short_description,v_description,v_image,v_url,v_attribute,v_price,v_specials_price,v_specials_expire_date,v_date_added,v_in_stock,v_status,v_viewed,v_ordered,v_category_sku,v_sort_order,v_meta_title,v_meta_keywords,v_meta_description,v_brand_filter,v_class_filter,v_color_filter,v_gender_filter,v_material_filter,v_year_filter,v_origin_filter,v_series_filter,v_spec_filter
LGTIYZB0001,Solid Button Front Crop Top,,<p><b>Style</b>: Casual</p><p><b>Color</b>: Purple</p><p><b>Pattern Type</b>: Plain</p><p><b>Length</b>: Crop</p><p><b>Season</b>: Spring/Summer</p><p><b>Details</b>: Button Front</p><p><b>Fit Type</b>: Regular Fit</p><p><b>Sleeve Length</b>: Short Sleeve</p><p><b>Neckline</b>: V neck</p><p><b>Sleeve Type</b>: Regular Sleeve</p><p><b>Placket Type</b>: Placket</p><p><b>Sheer</b>: No</p><p><b>Material</b>: Polyester</p><p><b>Composition</b>: 95% Polyester</p><p><b>Composition</b>: 5% Elastane</p><p><b>Fabric</b>: High Stretch</p><p><b>Care Instructions</b>: Machine wash or professional dry clean</p>,img/Women_Tops/swtop30210602107.jpg,,Size#S:M:L:XL:,27.97,,,,1,1,,,Women Tops,,Solid Button Front Crop Top,Solid Button Front Crop Top,Solid Button Front Crop Top,,,,,,,,,
LGTIYZB0002,Allover Floral High Waist Pants,,<p><b>Style</b>: Casual</p><p><b>Color</b>: Multicolor</p><p><b>Pattern Type</b>: Floral</p><p><b>Pattern Type</b>: All Over Print</p><p><b>Length</b>: Long</p><p><b>Type</b>: Straight Leg</p><p><b>Season</b>: Spring/Summer/Fall</p><p><b>Details</b>: Button</p><p><b>Details</b>: Pocket</p><p><b>Details</b>: Zipper</p><p><b>Waist Line</b>: High Waist</p><p><b>Fit Type</b>: Regular Fit</p><p><b>Sheer</b>: No</p><p><b>Closure Type</b>: Zipper Fly</p><p><b>Material</b>: Polyester</p><p><b>Composition</b>: 100% Polyester</p><p><b>Fabric</b>: Non-Stretch</p><p><b>Care Instructions</b>: Machine wash or professional dry clean</p>,img/Pants/swpants25210602629.jpg,,Size#XS:S:M:L:,22.84,,,,1,1,,,Pants,,Allover Floral High Waist Pants,Allover Floral High Waist Pants,Allover Floral High Waist Pants,,,,,,,,,
LGTIYZB0003,Gingham Tie Front Dress,,<p><b>Style</b>: Preppy</p><p><b>Color</b>: Blue and White</p><p><b>Pattern Type</b>: Gingham</p><p><b>Length</b>: Mini</p><p><b>Season</b>: Summer</p><p><b>Type</b>: Fitted</p><p><b>Details</b>: Tie Front</p><p><b>Sleeve Type</b>: Puff Sleeve</p><p><b>Sleeve Length</b>: Short Sleeve</p><p><b>Waist Line</b>: Natural</p><p><b>Fit Type</b>: Regular Fit</p><p><b>Neckline</b>: Sweetheart</p><p><b>Sheer</b>: No</p><p><b>Hem Shaped</b>: Straight</p><p><b>Material</b>: Polyester</p><p><b>Composition</b>: 100% Polyester</p><p><b>Fabric</b>: Non-Stretch</p><p><b>Care Instructions</b>: Machine wash or professional dry clean</p>,img/Dresses/sW210524131684877.jpg,,Size#S:M:L:,30.08,,,,1,1,,,Dresses,,Gingham Tie Front Dress,Gingham Tie Front Dress,Gingham Tie Front Dress,,,,,,,,,
LGTIYZB0004,Elastic Waist Zebra Striped Shorts,,<p><b>Style</b>: Casual</p><p><b>Color</b>: Black and White</p><p><b>Pattern Type</b>: Zebra Stripe</p><p><b>Type</b>: Straight Leg</p><p><b>Season</b>: Summer</p><p><b>Waist Line</b>: Natural</p><p><b>Fit Type</b>: Regular Fit</p><p><b>Sheer</b>: No</p><p><b>Closure Type</b>: Elastic Waist</p><p><b>Material</b>: Polyester</p><p><b>Composition</b>: 92% Polyester</p><p><b>Composition</b>: 8% Spandex</p><p><b>Fabric</b>: Slight Stretch</p><p><b>Care Instructions</b>: Machine wash or professional dry clean</p>,img/Shorts/swshorts07210113765.jpg,,Size#XS:S:M:L:XL:,32.66,,,,1,1,,,Shorts,,Elastic Waist Zebra Striped Shorts,Elastic Waist Zebra Striped Shorts,Elastic Waist Zebra Striped Shorts,,,,,,,,,
LGTIYZB0005,Stylish Open Silver Diamond Nail Ring,,<p>Notice:</p>,img/Rings/SKUH07253.jpg,,Size#Gold:Silver:,25.86,,,,1,1,,,Rings,,Stylish Open Silver Diamond Nail Ring,Stylish Open Silver Diamond Nail Ring,Stylish Open Silver Diamond Nail Ring,,,,,,,,,
LGTIYZB0006,Vintage Crystal Gem Key Women Earrings Symmetry Plum Blossom Pendant Earrings Jewelry Gift,,"<p>Style: Vintage </p><p>Type: Earrings</p><p>Color: Green, Blue, Purple</p><p>Weight: 6g</p><p>Size: About 4*1.4 cm / 1.57*0.55 in</p><p>Material: Alloy</p><p>1 x Earrings</p>",img/Earrings/SKUH01676.jpg,,Size#,23.97,,,,1,1,,,Earrings,,Vintage Crystal Gem Key Women Earrings Symmetry Plum Blossom Pendant Earrings Jewelry Gift,Vintage Crystal Gem Key Women Earrings Symmetry Plum Blossom Pendant Earrings Jewelry Gift,Vintage Crystal Gem Key Women Earrings Symmetry Plum Blossom Pendant Earrings Jewelry Gift,,,,,,,,,
LGTIYZB0007,Women Brown Vintage PU Leather Multi-Layers Handbag Shoulder Bag Crossbody Bag Satchel Bag,,"<p>Bag Type:Satchel</p><p>Color:Black, Brown</p><p>Material:PU</p><p>Style:Vintage</p><p>Pattern:Solid</p><p>Hardness:Soft</p>",img/Handbags/SKUH27818.jpg,,Size#,67.86,,,,1,1,,,Handbags,,Women Brown Vintage PU Leather Multi-Layers Handbag Shoulder Bag Crossbody Bag Satchel Bag,Women Brown Vintage PU Leather Multi-Layers Handbag Shoulder Bag Crossbody Bag Satchel Bag,Women Brown Vintage PU Leather Multi-Layers Handbag Shoulder Bag Crossbody Bag Satchel Bag,,,,,,,,,
LGTIYZB0008,Women Casual Solid Color Hand Stitch Platforms Comforable Loafers Shoes,,"<p>Color:Yellow, Black, White, Blue</p><p>Type:Loafers</p><p>Closure Type:Slip-On</p><p>Heel Type:Platforms</p><p>Heel Height:1-3cm In Flat</p><p>Toe Type:Round</p><p>Pattern:Solid</p><p>Design Element:Quilting</p><p>Upper Material:PU</p><p>Style:Casual</p><p>Outsole Material:Rubber</p><p>Structure:Slip-On</p><p>Occasion:Daily</p><p>Function:Antiskid, Hard-wearing</p><p>Season:Summer, Autumn, Spring</p>",img/Flats/SKUG89470.jpg,,Size#US 5:US 6:US 7:US 8:US 9:US 10:US 11:,50.19,,,,1,1,,,Flats,,Women Casual Solid Color Hand Stitch Platforms Comforable Loafers Shoes,Women Casual Solid Color Hand Stitch Platforms Comforable Loafers Shoes,Women Casual Solid Color Hand Stitch Platforms Comforable Loafers Shoes,,,,,,,,,
LGTIYZB0009,Plus Size Women Serpentine Stripe Buckle Flat Sandals,,"<p>Color:Red, Black, Blue</p><p>Type:Stripe Sandals</p><p>Closure Type:Buckle</p><p>Heel Type:Flat</p><p>Heel Height:1-3cm In Flat</p><p>Toe Type:Opened, Round</p><p>Pattern:Snake</p><p>Design Element:Veins</p><p>Upper Material:PU</p><p>Style:Casual</p><p>Structure:Buckle</p><p>Occasion:Casual</p><p>Function:Antiskid, Light Weight</p><p>Season:Summer, Autumn, Spring</p>",img/Sandals/SKUH92781.jpg,,Size#US 5:US 6:US 7:US 8:US 9:US 10:US 11:US 12:,63.31,,,,1,1,,,Sandals,,Plus Size Women Serpentine Stripe Buckle Flat Sandals,Plus Size Women Serpentine Stripe Buckle Flat Sandals,Plus Size Women Serpentine Stripe Buckle Flat Sandals,,,,,,,,,
LGTIYZB0010,Marble Print Frill Trim Mesh Crop Top,,<p><b>Style</b>: Casual</p><p><b>Color</b>: Green</p><p><b>Pattern Type</b>: All Over Print</p><p><b>Length</b>: Crop</p><p><b>Season</b>: Summer</p><p><b>Details</b>: Lettuce Trim</p><p><b>Details</b>: Sheer</p><p><b>Details</b>: Contrast Binding</p><p><b>Neckline</b>: Round Neck</p><p><b>Sleeve Length</b>: Short Sleeve</p><p><b>Fit Type</b>: Slim Fit</p><p><b>Sleeve Type</b>: Regular Sleeve</p><p><b>Placket Type</b>: Pullovers</p><p><b>Sheer</b>: Yes</p><p><b>Material</b>: Mesh</p><p><b>Composition</b>: 100% Polyester</p><p><b>Fabric</b>: Slight Stretch</p><p><b>Care Instructions</b>: Machine wash or professional dry clean</p>,img/Women_Tops/swtop07210604123.jpg,,Size#XS:S:M:L:XL:,30.18,,,,1,1,,,Women Tops,,Marble Print Frill Trim Mesh Crop Top,Marble Print Frill Trim Mesh Crop Top,Marble Print Frill Trim Mesh Crop Top,,,,,,,,,
LGTIYZB0011,High Waist Flare Leg Corduroy Pants Without Belt,,<p><b>Style</b>: Elegant</p><p><b>Color</b>: Blue</p><p><b>Pattern Type</b>: Plain</p><p><b>Length</b>: Long</p><p><b>Type</b>: Flare Leg</p><p><b>Details</b>: Button</p><p><b>Details</b>: Pocket</p><p><b>Details</b>: Zipper</p><p><b>Waist Line</b>: Natural</p><p><b>Fit Type</b>: Regular Fit</p><p><b>Sheer</b>: No</p><p><b>Closure Type</b>: Zipper Fly</p><p><b>Belt</b>: No</p><p><b>Material</b>: Corduroy</p><p><b>Composition</b>: 85% Cotton</p><p><b>Composition</b>: 13% Polyester</p><p><b>Composition</b>: 2% Spandex</p><p><b>Fabric</b>: High Stretch</p><p><b>Care Instructions</b>: Machine wash or professional dry clean</p>,img/Pants/swpants04210118925.jpg,,Size#XS:S:M:L:,32.6,,,,1,1,,,Pants,,High Waist Flare Leg Corduroy Pants Without Belt,High Waist Flare Leg Corduroy Pants Without Belt,High Waist Flare Leg Corduroy Pants Without Belt,,,,,,,,,
LGTIYZB0012,Plaid Print Tie Detail A-Line Dress,,<p><b>Style</b>: Preppy</p><p><b>Color</b>: Multicolor</p><p><b>Pattern Type</b>: Tartan</p><p><b>Length</b>: Short</p><p><b>Season</b>: Spring/Fall</p><p><b>Type</b>: Shirt</p><p><b>Details</b>: Zipper</p><p><b>Details</b>: Button Front</p><p><b>Sleeve Length</b>: Long Sleeve</p><p><b>Neckline</b>: Collar</p><p><b>Waist Line</b>: High Waist</p><p><b>Fit Type</b>: Regular Fit</p><p><b>Sleeve Type</b>: Regular Sleeve</p><p><b>Sheer</b>: No</p><p><b>Hem Shaped</b>: Flared</p><p><b>Material</b>: Polyester</p><p><b>Composition</b>: 95% Polyester</p><p><b>Composition</b>: 5% Elastane</p><p><b>Fabric</b>: Non-Stretch</p><p><b>Care Instructions</b>: Machine wash or professional dry clean</p>,img/Dresses/swdress25210602133.jpg,,Size#XS:S:M:L:,32.52,,,,1,1,,,Dresses,,Plaid Print Tie Detail A-Line Dress,Plaid Print Tie Detail A-Line Dress,Plaid Print Tie Detail A-Line Dress,,,,,,,,,
LGTIYZB0013,Argyle Pattern Tie Front Shorts,,<p><b>Style</b>: Sporty</p><p><b>Color</b>: Multicolor</p><p><b>Pattern Type</b>: Geometric</p><p><b>Season</b>: Summer</p><p><b>Type</b>: Track Shorts</p><p><b>Details</b>: Knot</p><p><b>Waist Line</b>: Natural</p><p><b>Fit Type</b>: Regular Fit</p><p><b>Sheer</b>: No</p><p><b>Closure Type</b>: Elastic Waist</p><p><b>Material</b>: Cotton Blends</p><p><b>Composition</b>: 65% Cotton</p><p><b>Composition</b>: 35% Polyester</p><p><b>Fabric</b>: Slight Stretch</p><p><b>Care Instructions</b>: Machine wash or professional dry clean</p>,img/Shorts/rwshorts25210511896.jpg,,Size#S:M:L:,23.6,,,,1,1,,,Shorts,,Argyle Pattern Tie Front Shorts,Argyle Pattern Tie Front Shorts,Argyle Pattern Tie Front Shorts,,,,,,,,,
LGTIYZB0014,14 Pcs Vintage Trendy Yin Yang Relief Elephant Geometric Shape Alloy Ring Set,,"<p>Style: Vintage,Trendy</p><p>Type: Ring</p><p>Weight: 32.9 g</p><p>Size: As the picture shown</p><p>Material: Alloy</p><p>Quantity: 14 pcs</p><p>Package Includes:</p><p>1 x Ring Set</p><p>Notice:</p>",img/Rings/SKUI17793.jpg,,Size#,23.04,,,,1,1,,,Rings,,14 Pcs Vintage Trendy Yin Yang Relief Elephant Geometric Shape Alloy Ring Set,14 Pcs Vintage Trendy Yin Yang Relief Elephant Geometric Shape Alloy Ring Set,14 Pcs Vintage Trendy Yin Yang Relief Elephant Geometric Shape Alloy Ring Set,,,,,,,,,
LGTIYZB0015,Retro Geometric Fan-shaped Pendant Earrings Ethnic Metal Triangle Colored Glass Earrings,,<p>Style: Vintage</p><p>Type: Earrings</p><p>Main Color: Green</p><p>Weight: 7g</p><p>Material: Alloy</p><p>1 X Earrings</p>,img/Earrings/SKUF91559.jpg,,Size#,16.71,,,,1,1,,,Earrings,,Retro Geometric Fan-shaped Pendant Earrings Ethnic Metal Triangle Colored Glass Earrings,Retro Geometric Fan-shaped Pendant Earrings Ethnic Metal Triangle Colored Glass Earrings,Retro Geometric Fan-shaped Pendant Earrings Ethnic Metal Triangle Colored Glass Earrings,,,,,,,,,
LGTIYZB0016,Brenice Multifunction Soft Handbags Vintage Bohemia Shoulder Bags Backpack,,"<p>Bag Type:Satchel</p><p>Color:Black, Brown, Grey, Purple, Red</p><p>Material:PU</p><p>Style:Casual</p><p>Decoration:Hardware</p><p>Hardness:Soft</p>",img/Handbags/SKU963353.jpg,,Size#,67.54,,,,1,1,,,Handbags,,Brenice Multifunction Soft Handbags Vintage Bohemia Shoulder Bags Backpack,Brenice Multifunction Soft Handbags Vintage Bohemia Shoulder Bags Backpack,Brenice Multifunction Soft Handbags Vintage Bohemia Shoulder Bags Backpack,,,,,,,,,
LGTIYZB0017,Women Zipper Loafers Denim Comfy Casual Slip On Flat Shoes,,"<p>Color:Beige, Black, Pink, Blue</p><p>Type:Loafers</p><p>Closure Type:Slip-On</p><p>Heel Type:Flat</p><p>Heel Height:1-3cm In Flat</p><p>Toe Type:Round</p><p>Pattern:Solid</p><p>Design Element:Buckle</p><p>Upper Material:Canvas</p><p>Style:Casual</p><p>Outsole Material:Rubber</p><p>Structure:Slip-On</p><p>Occasion:Daily</p><p>Function:Antiskid, Soft, Hard-wearing</p><p>Season:Summer, Autumn, Spring</p>",img/Flats/SKUE55410.jpg,,Size#US 5:US 6:US 7:US 8:US 9:US 10:US 11:US 12:,57.83,,,,1,1,,,Flats,,Women Zipper Loafers Denim Comfy Casual Slip On Flat Shoes,Women Zipper Loafers Denim Comfy Casual Slip On Flat Shoes,Women Zipper Loafers Denim Comfy Casual Slip On Flat Shoes,,,,,,,,,
LGTIYZB0018,Women Solid Color Hasp Suede Casual Platform Sandals,,"<p>Color:Red, Black, Pink, Blue</p><p>Closure Type:Hasp</p><p>Heel Type:Platforms</p><p>Heel Height:3-5cm In Low Heel</p><p>Toe Type:Closed Toe</p><p>Pattern:Solid</p><p>Design Element:Simple</p><p>Upper Material:Suede</p><p>Style:Casual</p><p>Outsole Material:EVA</p><p>Occasion:Casual, Shopping, Daily</p><p>Function:Hard-wearing</p><p>Season:Summer, Autumn, Spring</p>",img/Sandals/SKUH70980.jpg,,Size#US 5:US 6:US 7:US 8:US 9:US 10:US 11:,56.16,,,,1,1,,,Sandals,,Women Solid Color Hasp Suede Casual Platform Sandals,Women Solid Color Hasp Suede Casual Platform Sandals,Women Solid Color Hasp Suede Casual Platform Sandals,,,,,,,,,
LGTIYZB0019,Solid One Shoulder Top,,<p><b>Style</b>: Sexy</p><p><b>Color</b>: Black</p><p><b>Pattern Type</b>: Plain</p><p><b>Length</b>: Crop</p><p><b>Season</b>: Summer</p><p><b>Details</b>: Cut Out</p><p><b>Details</b>: Rib-Knit</p><p><b>Neckline</b>: One Shoulder</p><p><b>Sleeve Length</b>: Sleeveless</p><p><b>Fit Type</b>: Slim Fit</p><p><b>Placket Type</b>: Pullovers</p><p><b>Sheer</b>: No</p><p><b>Material</b>: Polyester</p><p><b>Composition</b>: 95% Polyester</p><p><b>Composition</b>: 5% Elastane</p><p><b>Fabric</b>: High Stretch</p><p><b>Care Instructions</b>: Machine wash or professional dry clean</p>,img/Women_Tops/sW210531348895144.jpg,,Size#S:M:L:,29.24,,,,1,1,,,Women Tops,,Solid One Shoulder Top,Solid One Shoulder Top,Solid One Shoulder Top,,,,,,,,,
LGTIYZB0020,Solid Belted Cargo Pants,,<p><b>Style</b>: Casual</p><p><b>Color</b>: Black</p><p><b>Pattern Type</b>: Plain</p><p><b>Length</b>: Long</p><p><b>Season</b>: All</p><p><b>Type</b>: Cargo Pants</p><p><b>Details</b>: Belted</p><p><b>Details</b>: Pocket</p><p><b>Waist Line</b>: High Waist</p><p><b>Fit Type</b>: Regular Fit</p><p><b>Sheer</b>: No</p><p><b>Closure Type</b>: Elastic Waist</p><p><b>Belt</b>: Yes</p><p><b>Material</b>: Cotton</p><p><b>Composition</b>: 65% Cotton</p><p><b>Composition</b>: 35% Polyester</p><p><b>Fabric</b>: Slight Stretch</p><p><b>Care Instructions</b>: Machine wash or professional dry clean</p>,img/Pants/rwpants03201111486.jpg,,Size#XS:S:M:L:XL:XXL:,28.28,,,,1,1,,,Pants,,Solid Belted Cargo Pants,Solid Belted Cargo Pants,Solid Belted Cargo Pants,,,,,,,,,
LGTIYZB0021,Gingham Cami Dress,,<p><b>Style</b>: Boho</p><p><b>Color</b>: Orange</p><p><b>Pattern Type</b>: Gingham</p><p><b>Length</b>: Maxi</p><p><b>Season</b>: Summer</p><p><b>Type</b>: Cami</p><p><b>Details</b>: Ruffle Hem</p><p><b>Sleeve Length</b>: Sleeveless</p><p><b>Neckline</b>: Spaghetti Strap</p><p><b>Waist Line</b>: High Waist</p><p><b>Fit Type</b>: Regular Fit</p><p><b>Sheer</b>: No</p><p><b>Hem Shaped</b>: Flounce</p><p><b>Material</b>: Cotton</p><p><b>Composition</b>: 100% Cotton</p><p><b>Fabric</b>: Non-Stretch</p><p><b>Care Instructions</b>: Machine wash or professional dry clean</p>,img/Dresses/swdress07210605373.jpg,,Size#XS:S:M:L:XL:,31.19,,,,1,1,,,Dresses,,Gingham Cami Dress,Gingham Cami Dress,Gingham Cami Dress,,,,,,,,,
LGTIYZB0022,Paisley Print Drawstring Front Shorts,,<p><b>Style</b>: Casual</p><p><b>Color</b>: Coffee Brown</p><p><b>Pattern Type</b>: Paisley</p><p><b>Season</b>: Summer</p><p><b>Type</b>: Biker Shorts</p><p><b>Details</b>: Drawstring</p><p><b>Waist Line</b>: High Waist</p><p><b>Fit Type</b>: Skinny</p><p><b>Sheer</b>: No</p><p><b>Closure Type</b>: Elastic Waist</p><p><b>Material</b>: Polyester</p><p><b>Composition</b>: 91% Polyester</p><p><b>Composition</b>: 9% Elastane</p><p><b>Fabric</b>: High Stretch</p><p><b>Care Instructions</b>: Machine wash or professional dry clean</p>,img/Shorts/swshorts44210414004.jpg,,Size#XS:S:M:L:,25.22,,,,1,1,,,Shorts,,Paisley Print Drawstring Front Shorts,Paisley Print Drawstring Front Shorts,Paisley Print Drawstring Front Shorts,,,,,,,,,
LGTIYZB0023,Vintage Geometric Hollow Rhinestone Butterfly Rings,,"<p>Style: Trendy</p><p>Type: Rings</p><p>Color: Silver</p><p>Weight: 5g</p><p>Length: As the picture shows</p><p>Material:Alloy,Rhinestone</p><p>2 x Ring</p>",img/Rings/SKUH15343.jpg,,Size#,12.48,,,,1,1,,,Rings,,Vintage Geometric Hollow Rhinestone Butterfly Rings,Vintage Geometric Hollow Rhinestone Butterfly Rings,Vintage Geometric Hollow Rhinestone Butterfly Rings,,,,,,,,,
LGTIYZB0024,Trendy Cartilage Earrings Simple Style Punk No Piercing Ear Clip Earrings for Women Men,,"<p>Style: Trendy</p><p>Type: Ear Clip</p><p>Weight: About 4.2g</p><p>Material: Zinc Alloy</p><p>Size: About 1.4cm x 0.4cm / 0.55' x 0.16'</p><p>Color: Steel Color, Black, Gold, Colorful, Blue</p><p>1 Pair of Earrings</p>",img/Earrings/SKU948452.jpg,,Size#,12.04,,,,1,1,,,Earrings,,Trendy Cartilage Earrings Simple Style Punk No Piercing Ear Clip Earrings for Women Men,Trendy Cartilage Earrings Simple Style Punk No Piercing Ear Clip Earrings for Women Men,Trendy Cartilage Earrings Simple Style Punk No Piercing Ear Clip Earrings for Women Men,,,,,,,,,
LGTIYZB0025,Women Faux Leather Three-piece Set Handbag Shoulder Bag Clutch Bag,,"<p>Bag Type:Bag Set</p><p>Color:Black, Brown, Grey, Red</p><p>Material:PU</p><p>Style:Vintage</p><p>Hardness:Soft, Hard</p>",img/Handbags/SKUA52892.jpg,,Size#,57.54,,,,1,1,,,Handbags,,Women Faux Leather Three-piece Set Handbag Shoulder Bag Clutch Bag,Women Faux Leather Three-piece Set Handbag Shoulder Bag Clutch Bag,Women Faux Leather Three-piece Set Handbag Shoulder Bag Clutch Bag,,,,,,,,,
LGTIYZB0026,Women Casual Print Leopard Pattern Square Toe Canvas Loafers Shoes,,"<p>Color:Green, Light Green</p><p>Type:Loafers</p><p>Closure Type:Elastic Band</p><p>Heel Type:Flat</p><p>Heel Height:1-3cm In Flat</p><p>Toe Type:Square</p><p>Pattern:Animal-print, Leopard, Plants</p><p>Design Element:Pattern, Print</p><p>Upper Material:Canvas</p><p>Style:Casual</p><p>Outsole Material:Rubber</p><p>Structure:Elastic Band</p><p>Occasion:Casual</p><p>Function:Antiskid, Hard-wearing</p><p>Season:All Season</p>",img/Flats/SKUG98102.jpg,,Size#US 5:US 6:US 8:US 9:US 10:US 11:US 12:,56.13,,,,1,1,,,Flats,,Women Casual Print Leopard Pattern Square Toe Canvas Loafers Shoes,Women Casual Print Leopard Pattern Square Toe Canvas Loafers Shoes,Women Casual Print Leopard Pattern Square Toe Canvas Loafers Shoes,,,,,,,,,
LGTIYZB0027,Large Size Women Daily Strappy Open Toe Non Slip Platform Sandals,,"<p>Color:Khaki, White</p><p>Type:Stripe Sandals</p><p>Closure Type:Slip-On</p><p>Heel Type:Platforms</p><p>Heel Height:3-5cm In Low Heel</p><p>Toe Type:Opened, Round</p><p>Pattern:Solid</p><p>Design Element:Buckle</p><p>Upper Material:PU</p><p>Style:Casual</p><p>Outsole Material:PU</p><p>Structure:Double Band</p><p>Occasion:Daily</p><p>Function:Antiskid, Hard-wearing</p><p>Season:Summer</p>",img/Sandals/SKUF41080.jpg,,Size#US 5:US 6:US 7:US 8:US 9:US 10:US 11:US 12:,65.35,,,,1,1,,,Sandals,,Large Size Women Daily Strappy Open Toe Non Slip Platform Sandals,Large Size Women Daily Strappy Open Toe Non Slip Platform Sandals,Large Size Women Daily Strappy Open Toe Non Slip Platform Sandals,,,,,,,,,
LGTIYZB0028,Marble Print One Shoulder Top,,<p><b>Style</b>: Casual</p><p><b>Color</b>: Blue</p><p><b>Pattern Type</b>: Marble</p><p><b>Length</b>: Crop</p><p><b>Season</b>: Summer</p><p><b>Details</b>: Rib-Knit</p><p><b>Neckline</b>: One Shoulder</p><p><b>Sleeve Length</b>: Sleeveless</p><p><b>Fit Type</b>: Slim Fit</p><p><b>Placket Type</b>: Pullovers</p><p><b>Sheer</b>: No</p><p><b>Material</b>: Polyester</p><p><b>Composition</b>: 80% Polyester</p><p><b>Composition</b>: 20% Cotton</p><p><b>Fabric</b>: High Stretch</p><p><b>Care Instructions</b>: Machine wash or professional dry clean</p>,img/Women_Tops/sW210618739946898.jpg,,Size#XS:S:M:L:,27.05,,,,1,1,,,Women Tops,,Marble Print One Shoulder Top,Marble Print One Shoulder Top,Marble Print One Shoulder Top,,,,,,,,,
LGTIYZB0029,Plaid Belted Pants,,<p><b>Style</b>: Casual</p><p><b>Color</b>: Black and White</p><p><b>Pattern Type</b>: Plaid</p><p><b>Length</b>: Long</p><p><b>Type</b>: Tapered/Carrot</p><p><b>Season</b>: Spring/Summer/Fall</p><p><b>Details</b>: Belted</p><p><b>Details</b>: Paper Bag Waist</p><p><b>Waist Line</b>: High Waist</p><p><b>Fit Type</b>: Regular Fit</p><p><b>Sheer</b>: No</p><p><b>Closure Type</b>: Elastic Waist</p><p><b>Material</b>: Polyester</p><p><b>Composition</b>: 80% Polyester</p><p><b>Composition</b>: 20% Cotton</p><p><b>Fabric</b>: Non-Stretch</p><p><b>Care Instructions</b>: Machine wash or professional dry clean</p>,img/Pants/rwpants25210526743.jpg,,Size#S:M:L:,22.83,,,,1,1,,,Pants,,Plaid Belted Pants,Plaid Belted Pants,Plaid Belted Pants,,,,,,,,,
LGTIYZB0030,Cartoon Slogan Graphic Drawstring Dress,,<p><b>Style</b>: Casual</p><p><b>Color</b>: Black</p><p><b>Pattern Type</b>: Cartoon</p><p><b>Length</b>: Short</p><p><b>Season</b>: Summer</p><p><b>Type</b>: Fitted</p><p><b>Details</b>: Ruched</p><p><b>Details</b>: Drawstring</p><p><b>Sleeve Length</b>: Short Sleeve</p><p><b>Neckline</b>: Round Neck</p><p><b>Waist Line</b>: Natural</p><p><b>Fit Type</b>: Regular Fit</p><p><b>Sleeve Type</b>: Regular Sleeve</p><p><b>Sheer</b>: No</p><p><b>Hem Shaped</b>: Pencil</p><p><b>Material</b>: Polyester</p><p><b>Composition</b>: 95% Polyester</p><p><b>Composition</b>: 5% Spandex</p><p><b>Fabric</b>: Slight Stretch</p><p><b>Care Instructions</b>: Machine wash or professional dry clean</p><p><b>Style</b>: Casual</p><p><b>Color</b>: Coffee Brown</p><p><b>Pattern Type</b>: Cartoon</p><p><b>Length</b>: Short</p><p><b>Season</b>: Summer</p><p><b>Type</b>: Fitted</p><p><b>Details</b>: Ruched</p><p><b>Details</b>: Drawstring</p><p><b>Sleeve Length</b>: Short Sleeve</p><p><b>Neckline</b>: Round Neck</p><p><b>Waist Line</b>: Natural</p><p><b>Fit Type</b>: Regular Fit</p><p><b>Sleeve Type</b>: Regular Sleeve</p><p><b>Sheer</b>: No</p><p><b>Hem Shaped</b>: Pencil</p><p><b>Material</b>: Polyester</p><p><b>Composition</b>: 95% Polyester</p><p><b>Composition</b>: 5% Spandex</p><p><b>Fabric</b>: Slight Stretch</p><p><b>Care Instructions</b>: Machine wash or professional dry clean</p>,img/Dresses/rwdress25210510069.jpg,,Size#XS:S:M:L:,27.46,,,,1,1,,,Dresses,,Cartoon Slogan Graphic Drawstring Dress,Cartoon Slogan Graphic Drawstring Dress,Cartoon Slogan Graphic Drawstring Dress,,,,,,,,,
LGTIYZB0031,Colorblock Bear Print Shorts,,<p><b>Style</b>: Casual</p><p><b>Color</b>: Multicolor</p><p><b>Pattern Type</b>: Cartoon</p><p><b>Season</b>: Summer</p><p><b>Type</b>: Track Shorts</p><p><b>Waist Line</b>: Natural</p><p><b>Fit Type</b>: Regular Fit</p><p><b>Sheer</b>: No</p><p><b>Closure Type</b>: Elastic Waist</p><p><b>Material</b>: Cotton</p><p><b>Composition</b>: 65% Cotton</p><p><b>Composition</b>: 35% Polyester</p><p><b>Fabric</b>: Medium Stretch</p><p><b>Care Instructions</b>: Machine wash or professional dry clean</p>,img/Shorts/rW210601482004384.jpg,,Size#S:M:L:,30.63,,,,1,1,,,Shorts,,Colorblock Bear Print Shorts,Colorblock Bear Print Shorts,Colorblock Bear Print Shorts,,,,,,,,,
LGTIYZB0032,Vintage Shepherd Girl Rings Star Thai Silver Ring,,"<p>Style: Vintage</p><p>Type: Ring</p><p>Color: Silver</p><p>Weight: 11g</p><p>Size: 7, 8, 9, 10, 11</p><p>Material: 925 Ancient Silver</p><p>1 x Ring</p>",img/Rings/SKUH10803.jpg,,Size#7:8:9:10:11:,22.05,,,,1,1,,,Rings,,Vintage Shepherd Girl Rings Star Thai Silver Ring,Vintage Shepherd Girl Rings Star Thai Silver Ring,Vintage Shepherd Girl Rings Star Thai Silver Ring,,,,,,,,,
LGTIYZB0033,Vintage Gemstone Metal Dragonfly Earrings Simple Animal Earrings,,<p>Style: Vintage</p><p>Type: Earrings</p><p>Color: Silver.</p><p>Material:</p><p>Alloy.</p><p>1 x Earrings</p>,img/Earrings/SKUH32979.jpg,,Size#,11.15,,,,1,1,,,Earrings,,Vintage Gemstone Metal Dragonfly Earrings Simple Animal Earrings,Vintage Gemstone Metal Dragonfly Earrings Simple Animal Earrings,Vintage Gemstone Metal Dragonfly Earrings Simple Animal Earrings,,,,,,,,,
LGTIYZB0034,KVKY Canvas Tote Handbags Simple Shoulder Bags Summer Shopping Bags,,"<p>Bag Type:Satchel</p><p>Color:Blue, Black, Grey, Beige</p><p>Material:Canvas</p><p>Style:Casual</p><p>Decoration:Hardware</p><p>Hardness:Soft</p>",img/Handbags/SKU957514.jpg,,Size#,67.9,,,,1,1,,,Handbags,,KVKY Canvas Tote Handbags Simple Shoulder Bags Summer Shopping Bags,KVKY Canvas Tote Handbags Simple Shoulder Bags Summer Shopping Bags,KVKY Canvas Tote Handbags Simple Shoulder Bags Summer Shopping Bags,,,,,,,,,
LGTIYZB0035,Women Retro Flowers Round Toe Hook Loop Flats,,"<p>Color:Purple, Brown, Blue, Grey</p><p>Type:Driving  Shoes</p><p>Closure Type:Hook & Loop</p><p>Heel Type:Flat</p><p>Heel Height:1-3cm In Flat</p><p>Toe Type:Round</p><p>Pattern:Calico</p><p>Design Element:Floral</p><p>Upper Material:PU</p><p>Style:Casual, Retro</p><p>Outsole Material:Rubber</p><p>Structure:Buckle</p><p>Occasion:Daily</p><p>Function:Soft</p><p>Season:All Season</p>",img/Flats/SKUC48683.jpg,,Size#US 5:US 6:US 7:US 8:US 9:US 10:US 11:US 12:,51.25,,,,1,1,,,Flats,,Women Retro Flowers Round Toe Hook Loop Flats,Women Retro Flowers Round Toe Hook Loop Flats,Women Retro Flowers Round Toe Hook Loop Flats,,,,,,,,,
