v_sku,v_name,v_short_description,v_description,v_image,v_url,v_attribute,v_price,v_specials_price,v_specials_expire_date,v_date_added,v_in_stock,v_status,v_viewed,v_ordered,v_category_sku,v_sort_order,v_meta_title,v_meta_keywords,v_meta_description,v_brand_filter,v_class_filter,v_color_filter,v_gender_filter,v_material_filter,v_year_filter,v_origin_filter,v_series_filter,v_spec_filter
LGTIYZB0143,Women Metal Rhinestone Decoration Comfortable Flat Loafers Shoes,,"<p>Color:Black, Brown</p><p>Type:Loafers</p><p>Closure Type:Slip-On</p><p>Heel Type:Flat</p><p>Heel Height:1-3cm In Flat</p><p>Toe Type:Round</p><p>Pattern:Solid</p><p>Design Element:Rhinestone, Metal</p><p>Upper Material:PU</p><p>Style:Casual</p><p>Outsole Material:Rubber</p><p>Occasion:Daily</p><p>Function:Breathable, Antiskid, Soft, Hard-wearing</p><p>Season:Summer, Autumn</p>",img/Flats/SKUH92792.jpg,,Size#US 5:US 6:US 7:US 8:US 9:US 10:US 11:,53.06,,,,1,1,,,Flats,,Women Metal Rhinestone Decoration Comfortable Flat Loafers Shoes,Women Metal Rhinestone Decoration Comfortable Flat Loafers Shoes,Women Metal Rhinestone Decoration Comfortable Flat Loafers Shoes,,,,,,,,,
LGTIYZB0144,Women Casual Hollow Out Soft Sole Clip Toe Buckle Flat Sandals,,"<p>Color:Red, Golden, White</p><p>Type:Thong Sandal</p><p>Closure Type:Buckle</p><p>Heel Type:Flat</p><p>Heel Height:1-3cm In Flat</p><p>Toe Type:Clip Toe</p><p>Pattern:Solid</p><p>Design Element:Hollow out</p><p>Upper Material:PU</p><p>Style:Casual</p><p>Outsole Material:Rubber</p><p>Structure:Buckle</p><p>Occasion:Casual</p><p>Function:Antiskid, Soft</p><p>Season:Summer, Autumn, Spring</p>",img/Sandals/SKUH89843.jpg,,Size#US 5:US 6:US 7:US 8:US 9:US 10:US 11:,54.11,,,,1,1,,,Sandals,,Women Casual Hollow Out Soft Sole Clip Toe Buckle Flat Sandals,Women Casual Hollow Out Soft Sole Clip Toe Buckle Flat Sandals,Women Casual Hollow Out Soft Sole Clip Toe Buckle Flat Sandals,,,,,,,,,
LGTIYZB0145,Fishing Net Sheer Top With Bra,,<p><b>Style</b>: Sexy</p><p><b>Color</b>: Black</p><p><b>Pattern Type</b>: Plain</p><p><b>Length</b>: Crop</p><p><b>Season</b>: Spring/Summer/Fall</p><p><b>Details</b>: Cut Out</p><p><b>Details</b>: Sheer</p><p><b>Sleeve Length</b>: Long Sleeve</p><p><b>Fit Type</b>: Regular Fit</p><p><b>Neckline</b>: Round Neck</p><p><b>Sleeve Type</b>: Regular Sleeve</p><p><b>Placket Type</b>: Pullovers</p><p><b>Sheer</b>: Yes</p><p><b>Belt</b>: No</p><p><b>Material</b>: Mesh</p><p><b>Composition</b>: 95% Polyester</p><p><b>Composition</b>: 5% Elastane</p><p><b>Fabric</b>: Slight Stretch</p><p><b>Care Instructions</b>: Machine wash or professional dry clean</p>,img/Women_Tops/swtop25210420091.jpg,,Size#XS:S:M:L:,22.06,,,,1,1,,,Women Tops,,Fishing Net Sheer Top With Bra,Fishing Net Sheer Top With Bra,Fishing Net Sheer Top With Bra,,,,,,,,,
LGTIYZB0146,Split Hem Flare Leg Pants,,<p><b>Style</b>: Vintage</p><p><b>Color</b>: Black</p><p><b>Pattern Type</b>: Plain</p><p><b>Length</b>: Long</p><p><b>Type</b>: Flare Leg</p><p><b>Season</b>: Spring/Summer/Fall</p><p><b>Details</b>: Split</p><p><b>Waist Line</b>: High Waist</p><p><b>Fit Type</b>: Regular Fit</p><p><b>Sheer</b>: No</p><p><b>Closure Type</b>: Elastic Waist</p><p><b>Material</b>: Polyester</p><p><b>Composition</b>: 96% Polyester</p><p><b>Composition</b>: 4% Spandex</p><p><b>Fabric</b>: Slight Stretch</p><p><b>Care Instructions</b>: Machine wash or professional dry clean</p>,img/Pants/swpants07201231724.jpg,,Size#XS:S:M:L:XL:,26.58,,,,1,1,,,Pants,,Split Hem Flare Leg Pants,Split Hem Flare Leg Pants,Split Hem Flare Leg Pants,,,,,,,,,
LGTIYZB0147,Ditsy Floral Twist Cut Out Cami Dress,,<p><b>Style</b>: Boho</p><p><b>Color</b>: Green</p><p><b>Pattern Type</b>: Ditsy Floral</p><p><b>Length</b>: Short</p><p><b>Season</b>: Summer</p><p><b>Type</b>: Cami</p><p><b>Details</b>: Twist</p><p><b>Sleeve Length</b>: Sleeveless</p><p><b>Neckline</b>: Spaghetti Strap</p><p><b>Waist Line</b>: High Waist</p><p><b>Fit Type</b>: Regular Fit</p><p><b>Sheer</b>: No</p><p><b>Hem Shaped</b>: Flared</p><p><b>Material</b>: Polyester</p><p><b>Composition</b>: 65% Polyester</p><p><b>Composition</b>: 35% Cotton</p><p><b>Fabric</b>: Non-Stretch</p><p><b>Care Instructions</b>: Machine wash or professional dry clean</p>,img/Dresses/rwdress03210305190.jpg,,Size#S:M:L:,26.65,,,,1,1,,,Dresses,,Ditsy Floral Twist Cut Out Cami Dress,Ditsy Floral Twist Cut Out Cami Dress,Ditsy Floral Twist Cut Out Cami Dress,,,,,,,,,
LGTIYZB0148,Colorblock Tartan Shorts,,<p><b>Style</b>: Preppy</p><p><b>Color</b>: Multicolor</p><p><b>Pattern Type</b>: Colorblock</p><p><b>Pattern Type</b>: Tartan</p><p><b>Season</b>: Summer</p><p><b>Type</b>: Wide Leg</p><p><b>Details</b>: Knot</p><p><b>Waist Line</b>: High Waist</p><p><b>Fit Type</b>: Loose</p><p><b>Sheer</b>: No</p><p><b>Closure Type</b>: Elastic Waist</p><p><b>Material</b>: Polyester</p><p><b>Composition</b>: 60% Polyester</p><p><b>Composition</b>: 40% Cotton</p><p><b>Fabric</b>: Non-Stretch</p><p><b>Care Instructions</b>: Machine wash or professional dry clean</p>,img/Shorts/swshorts07201126031.jpg,,Size#XS:S:M:L:XL:,30.06,,,,1,1,,,Shorts,,Colorblock Tartan Shorts,Colorblock Tartan Shorts,Colorblock Tartan Shorts,,,,,,,,,
LGTIYZB0149,Vintage Thai Silver Women Ring Adjustable Open Small Daisy Ring Jewelry Gift,,<p>Style: Vintage</p><p>Type: Ring</p><p>Color: Silver</p><p>Weight: 10g</p><p>Size: Adjustable</p><p>Material: Alloy</p><p>1 x Ring</p>,img/Rings/SKUH01669.jpg,,Size#,11.3,,,,1,1,,,Rings,,Vintage Thai Silver Women Ring Adjustable Open Small Daisy Ring Jewelry Gift,Vintage Thai Silver Women Ring Adjustable Open Small Daisy Ring Jewelry Gift,Vintage Thai Silver Women Ring Adjustable Open Small Daisy Ring Jewelry Gift,,,,,,,,,
LGTIYZB0150,Ethnic Turquoise Women Long Earrings Vintage Geometric Pattern Engraved Piering Drop Dangle Earrings,,"<p>Style: Vintage</p><p>Type: Ear Drop</p><p>Main Color: Green</p><p>Weight: About 3.8g</p><p>Length: About 6.5cm / 2.56'</p><p>Material: Zinc Alloy, Turquoise</p><p>1 Pair of Earrings</p>",img/Earrings/SKU984862.jpg,,Size#,12.15,,,,1,1,,,Earrings,,Ethnic Turquoise Women Long Earrings Vintage Geometric Pattern Engraved Piering Drop Dangle Earrings,Ethnic Turquoise Women Long Earrings Vintage Geometric Pattern Engraved Piering Drop Dangle Earrings,Ethnic Turquoise Women Long Earrings Vintage Geometric Pattern Engraved Piering Drop Dangle Earrings,,,,,,,,,
LGTIYZB0151,Brenice Genuine Leather Embosssing Shoulder Bags National Style Crossbody Bag For Women,,<p>Bag Type:Satchel</p><p>Color:Black</p><p>Material:PU</p><p>Style:Vintage</p><p>Hardness:Hard</p>,img/Handbags/SKU804766.jpg,,Size#,66.01,,,,1,1,,,Handbags,,Brenice Genuine Leather Embosssing Shoulder Bags National Style Crossbody Bag For Women,Brenice Genuine Leather Embosssing Shoulder Bags National Style Crossbody Bag For Women,Brenice Genuine Leather Embosssing Shoulder Bags National Style Crossbody Bag For Women,,,,,,,,,
LGTIYZB0152,Women Comfortable Wearable PU Round Toe Buckle Casual Slip On Flats Shoes,,,img/Flats/SKUF91668.jpg,,Size#US 5:US 6:US 7:US 8:US 9:,49.1,,,,1,1,,,Flats,,Women Comfortable Wearable PU Round Toe Buckle Casual Slip On Flats Shoes,Women Comfortable Wearable PU Round Toe Buckle Casual Slip On Flats Shoes,Women Comfortable Wearable PU Round Toe Buckle Casual Slip On Flats Shoes,,,,,,,,,
LGTIYZB0153,Women Garden Shoes Classic Clog Shoes Comfy Non Slip Water Shoes Breathable Hollow Out Beach Sandals,,"<p>Color:Rose, Purple, Pink, Blue</p><p>Type:Clogs Sandals</p><p>Closure Type:Slip-On</p><p>Heel Type:Flat</p><p>Heel Height:1-3cm In Flat</p><p>Toe Type:Closed Toe</p><p>Pattern:Color Block</p><p>Design Element:Hollow out</p><p>Upper Material:EVA Foam</p><p>Style:Casual</p><p>Outsole Material:EVA</p><p>Occasion:Outdoor, Beach, Home, Daily</p><p>Function:Antiskid, Soft, Light Weight</p><p>Season:Summer</p>",img/Sandals/SKUH54064.jpg,,Size#US 5:US 6:US 7:US 8:US 9:,65.52,,,,1,1,,,Sandals,,Women Garden Shoes Classic Clog Shoes Comfy Non Slip Water Shoes Breathable Hollow Out Beach Sandals,Women Garden Shoes Classic Clog Shoes Comfy Non Slip Water Shoes Breathable Hollow Out Beach Sandals,Women Garden Shoes Classic Clog Shoes Comfy Non Slip Water Shoes Breathable Hollow Out Beach Sandals,,,,,,,,,
LGTIYZB0154,Solid Crop Tube Top,,<p><b>Style</b>: Casual</p><p><b>Color</b>: Mint Green</p><p><b>Pattern Type</b>: Plain</p><p><b>Length</b>: Crop</p><p><b>Season</b>: Summer</p><p><b>Sleeve Length</b>: Sleeveless</p><p><b>Fit Type</b>: Slim Fit</p><p><b>Neckline</b>: Strapless</p><p><b>Placket Type</b>: Pullovers</p><p><b>Sheer</b>: No</p><p><b>Material</b>: Polyester</p><p><b>Composition</b>: 100% Polyester</p><p><b>Fabric</b>: Medium Stretch</p><p><b>Care Instructions</b>: Machine wash or professional dry clean</p>,img/Women_Tops/rwtop25210526091.jpg,,Size#XS:S:M:L:,25.43,,,,1,1,,,Women Tops,,Solid Crop Tube Top,Solid Crop Tube Top,Solid Crop Tube Top,,,,,,,,,
LGTIYZB0155,Lace Up Fire Dragon Print Pants,,<p><b>Style</b>: Casual</p><p><b>Color</b>: Multicolor</p><p><b>Pattern Type</b>: Animal</p><p><b>Length</b>: Long</p><p><b>Type</b>: Flare Leg</p><p><b>Season</b>: Spring/Summer/Fall</p><p><b>Details</b>: Lace Up</p><p><b>Details</b>: Ruched</p><p><b>Details</b>: Tie Back</p><p><b>Waist Line</b>: Natural</p><p><b>Fit Type</b>: Regular Fit</p><p><b>Sheer</b>: No</p><p><b>Closure Type</b>: Elastic Waist</p><p><b>Material</b>: Polyester</p><p><b>Composition</b>: 92% Polyester</p><p><b>Composition</b>: 8% Spandex</p><p><b>Fabric</b>: Slight Stretch</p><p><b>Care Instructions</b>: Machine wash or professional dry clean</p>,img/Pants/swpants07210401332.jpg,,Size#XS:S:M:L:XL:,24.83,,,,1,1,,,Pants,,Lace Up Fire Dragon Print Pants,Lace Up Fire Dragon Print Pants,Lace Up Fire Dragon Print Pants,,,,,,,,,
LGTIYZB0156,Ditsy Floral Frill Dress,,<p><b>Style</b>: Boho</p><p><b>Color</b>: Mint Blue</p><p><b>Pattern Type</b>: Ditsy Floral</p><p><b>Length</b>: Short</p><p><b>Season</b>: Summer</p><p><b>Type</b>: Cami</p><p><b>Details</b>: Frill</p><p><b>Details</b>: Knot</p><p><b>Sleeve Length</b>: Sleeveless</p><p><b>Neckline</b>: Spaghetti Strap</p><p><b>Waist Line</b>: Natural</p><p><b>Fit Type</b>: Regular Fit</p><p><b>Sheer</b>: No</p><p><b>Hem Shaped</b>: Flared</p><p><b>Material</b>: Polyester</p><p><b>Composition</b>: 100% Polyester</p><p><b>Fabric</b>: Non-Stretch</p><p><b>Care Instructions</b>: Machine wash or professional dry clean</p>,img/Dresses/rwdress25210521701.jpg,,Size#S:M:L:,27.81,,,,1,1,,,Dresses,,Ditsy Floral Frill Dress,Ditsy Floral Frill Dress,Ditsy Floral Frill Dress,,,,,,,,,
LGTIYZB0157,Plaid Knot Shorts,,<p><b>Style</b>: Casual</p><p><b>Color</b>: Multicolor</p><p><b>Pattern Type</b>: Plaid</p><p><b>Season</b>: Summer</p><p><b>Type</b>: Wide Leg</p><p><b>Details</b>: Knot</p><p><b>Waist Line</b>: Natural</p><p><b>Fit Type</b>: Regular Fit</p><p><b>Sheer</b>: No</p><p><b>Closure Type</b>: Elastic Waist</p><p><b>Material</b>: Cotton</p><p><b>Composition</b>: 65% Cotton</p><p><b>Composition</b>: 35% Polyester</p><p><b>Fabric</b>: Non-Stretch</p><p><b>Care Instructions</b>: Machine wash or professional dry clean</p>,img/Shorts/sW210602586254402.jpg,,Size#S:M:L:XL:,31.82,,,,1,1,,,Shorts,,Plaid Knot Shorts,Plaid Knot Shorts,Plaid Knot Shorts,,,,,,,,,
LGTIYZB0158,Men's Twelve Rome Digital Rotatable Ring Stainless Steel Ring,,<p>Type: Ring</p><p>Material: Stainless Steel</p><p>Main Color: Black</p><p>Weight: About 7g</p><p>Size(US): 8 / 9 / 10 / 11</p><p>1 x Ring </p>,img/Rings/SKU781315.jpg,,Size#8:9:10:11:,22.53,,,,1,1,,,Rings,,Men's Twelve Rome Digital Rotatable Ring Stainless Steel Ring,Men's Twelve Rome Digital Rotatable Ring Stainless Steel Ring,Men's Twelve Rome Digital Rotatable Ring Stainless Steel Ring,,,,,,,,,
LGTIYZB0159,Vintage Luxury Earrings Women's Hollow Sapphire Dangle Earrings Gold Drop Shap Rhinestones Earrings,,"<p>Type: Ear Drop</p><p>
	</p><p>Material: Zinc Alloy, Rhinestones, Crystal, Antique Gold Plated, Stainless Steel Needle</p><p>1 Pair of Earrings</p>",img/Earrings/SKU848296.jpg,,Size#,28.16,,,,1,1,,,Earrings,,Vintage Luxury Earrings Women's Hollow Sapphire Dangle Earrings Gold Drop Shap Rhinestones Earrings,Vintage Luxury Earrings Women's Hollow Sapphire Dangle Earrings Gold Drop Shap Rhinestones Earrings,Vintage Luxury Earrings Women's Hollow Sapphire Dangle Earrings Gold Drop Shap Rhinestones Earrings,,,,,,,,,
LGTIYZB0160,Women Casual Large Capacity Multifunction Handbag Solid Shoulder Bag,,"<p>Bag Type:Satchel</p><p>Color:Blue, Black, Brown, Pink, Khaki</p><p>Material:PU, Faux Fur</p><p>Style:Vintage</p><p>Hardness:Hard</p>",img/Handbags/SKUC98436.jpg,,Size#L:,67.5,,,,1,1,,,Handbags,,Women Casual Large Capacity Multifunction Handbag Solid Shoulder Bag,Women Casual Large Capacity Multifunction Handbag Solid Shoulder Bag,Women Casual Large Capacity Multifunction Handbag Solid Shoulder Bag,,,,,,,,,
LGTIYZB0161,Casual Stylish Soft Round Toe Printing Calico Canvas Loafers Flats For Women,,"<p>Color:Multicolor</p><p>Type:Loafers</p><p>Closure Type:Slip-On</p><p>Heel Type:Flat</p><p>Heel Height:1-3cm In Flat</p><p>Toe Type:Round</p><p>Pattern:Calico, Floral</p><p>Design Element:Pattern, Print</p><p>Upper Material:Canvas</p><p>Style:Casual</p><p>Outsole Material:Rubber</p><p>Structure:Slip-On</p><p>Occasion:Casual</p><p>Function:Antiskid, Hard-wearing</p><p>Season:All Season</p>",img/Flats/SKUH21800.jpg,,Size#US 5:US 6:US 7:US 8:US 9:US 10:US 11:US 12:,57.04,,,,1,1,,,Flats,,Casual Stylish Soft Round Toe Printing Calico Canvas Loafers Flats For Women,Casual Stylish Soft Round Toe Printing Calico Canvas Loafers Flats For Women,Casual Stylish Soft Round Toe Printing Calico Canvas Loafers Flats For Women,,,,,,,,,
LGTIYZB0162,Women Retro Non Slip Ring Toe Back Zipper Casual Flat Slide Sandals,,"<p>Color:Khaki, Beige, Black</p><p>Type:Thong Sandal</p><p>Closure Type:Zipper</p><p>Heel Type:Flat</p><p>Heel Height:1-3cm In Flat</p><p>Toe Type:Clip Toe</p><p>Pattern:Plain</p><p>Design Element:Metal, Simple</p><p>Upper Material:PU</p><p>Style:Casual, Retro</p><p>Outsole Material:PU</p><p>Structure:Buckle</p><p>Occasion:Outdoor, Casual</p><p>Function:Soft, Hard-wearing</p><p>Season:Summer</p>",img/Sandals/SKUE93573.jpg,,Size#US 5:US 6:US 7:US 8:US 9:US 10:US 11:US 12:,50.23,,,,1,1,,,Sandals,,Women Retro Non Slip Ring Toe Back Zipper Casual Flat Slide Sandals,Women Retro Non Slip Ring Toe Back Zipper Casual Flat Slide Sandals,Women Retro Non Slip Ring Toe Back Zipper Casual Flat Slide Sandals,,,,,,,,,
LGTIYZB0163,Layered Ruffle Trim Crop Tube Top,,<p><b>Style</b>: Boho</p><p><b>Color</b>: White</p><p><b>Pattern Type</b>: Plain</p><p><b>Length</b>: Crop</p><p><b>Season</b>: Summer</p><p><b>Details</b>: Ruffle Hem</p><p><b>Details</b>: Tiered Layer</p><p><b>Sleeve Length</b>: Sleeveless</p><p><b>Fit Type</b>: Slim Fit</p><p><b>Neckline</b>: Strapless</p><p><b>Placket Type</b>: Pullovers</p><p><b>Sheer</b>: No</p><p><b>Material</b>: Polyester</p><p><b>Composition</b>: 100% Polyester</p><p><b>Fabric</b>: Non-Stretch</p><p><b>Care Instructions</b>: Machine wash or professional dry clean</p>,img/Women_Tops/swtop44210426662.jpg,,Size#XS:S:M:L:,25.07,,,,1,1,,,Women Tops,,Layered Ruffle Trim Crop Tube Top,Layered Ruffle Trim Crop Tube Top,Layered Ruffle Trim Crop Tube Top,,,,,,,,,
LGTIYZB0164,High Waist Leopard Flare Leg Pants,,<p><b>Style</b>: Casual</p><p><b>Color</b>: Multicolor</p><p><b>Pattern Type</b>: Leopard</p><p><b>Length</b>: Long</p><p><b>Type</b>: Flare Leg</p><p><b>Season</b>: Spring/Summer/Fall</p><p><b>Waist Line</b>: High Waist</p><p><b>Fit Type</b>: Regular Fit</p><p><b>Sheer</b>: No</p><p><b>Closure Type</b>: Elastic Waist</p><p><b>Material</b>: Polyester</p><p><b>Composition</b>: 70% Polyester</p><p><b>Composition</b>: 30% Cotton</p><p><b>Fabric</b>: High Stretch</p><p><b>Care Instructions</b>: Machine wash or professional dry clean</p>,img/Pants/swpants04201019897.jpg,,Size#XS:S:M:L:,26.63,,,,1,1,,,Pants,,High Waist Leopard Flare Leg Pants,High Waist Leopard Flare Leg Pants,High Waist Leopard Flare Leg Pants,,,,,,,,,
LGTIYZB0165,Zebra Stripe Cut Out Tie Back Halter Mini Dress,,<p><b>Style</b>: Sexy</p><p><b>Color</b>: Multicolor</p><p><b>Pattern Type</b>: Graphic</p><p><b>Length</b>: Short</p><p><b>Season</b>: Summer</p><p><b>Type</b>: Bodycon</p><p><b>Details</b>: Backless</p><p><b>Details</b>: Ruched</p><p><b>Details</b>: Tie Back</p><p><b>Sleeve Length</b>: Sleeveless</p><p><b>Neckline</b>: Halter</p><p><b>Waist Line</b>: High Waist</p><p><b>Fit Type</b>: Slim Fit</p><p><b>Sheer</b>: No</p><p><b>Hem Shaped</b>: Pencil</p><p><b>Material</b>: Polyester</p><p><b>Composition</b>: 94% Polyester</p><p><b>Composition</b>: 6% Elastane</p><p><b>Fabric</b>: Slight Stretch</p><p><b>Care Instructions</b>: Machine wash or professional dry clean</p>,img/Dresses/swdress07210525770.jpg,,Size#XS:S:M:L:XL:,28.62,,,,1,1,,,Dresses,,Zebra Stripe Cut Out Tie Back Halter Mini Dress,Zebra Stripe Cut Out Tie Back Halter Mini Dress,Zebra Stripe Cut Out Tie Back Halter Mini Dress,,,,,,,,,
LGTIYZB0166,Skeleton Print Shorts,,<p><b>Style</b>: Casual</p><p><b>Color</b>: Black</p><p><b>Pattern Type</b>: Halloween</p><p><b>Season</b>: Summer</p><p><b>Type</b>: Track Shorts</p><p><b>Details</b>: Drawstring</p><p><b>Details</b>: Tie Front</p><p><b>Waist Line</b>: Natural</p><p><b>Fit Type</b>: Regular Fit</p><p><b>Sheer</b>: No</p><p><b>Closure Type</b>: Drawstring Waist</p><p><b>Material</b>: Cotton</p><p><b>Composition</b>: 100% Cotton</p><p><b>Fabric</b>: Slight Stretch</p><p><b>Care Instructions</b>: Machine wash or professional dry clean</p>,img/Shorts/rw2107077989908068.jpg,,Size#S:M:L:,27.86,,,,1,1,,,Shorts,,Skeleton Print Shorts,Skeleton Print Shorts,Skeleton Print Shorts,,,,,,,,,
LGTIYZB0167,Vintage Astronomical Ball Ring Flip Deformation Cosmic Ring Couple Creative Lettering Finger Ring,,"<p>Style: Vintage</p><p>Type:</p><p>Finger Ring</p><p>Main Color: Gold,Silver</p><p>Weight: About 100g</p><p>Material: Copper Alloy,925 Silver</p><p>Size: As the picture shows</p><p>1 x Ring </p>",img/Rings/SKUC21873.jpg,,Size#925 silver:Copper:6:7:8:9:10:,12.63,,,,1,1,,,Rings,,Vintage Astronomical Ball Ring Flip Deformation Cosmic Ring Couple Creative Lettering Finger Ring,Vintage Astronomical Ball Ring Flip Deformation Cosmic Ring Couple Creative Lettering Finger Ring,Vintage Astronomical Ball Ring Flip Deformation Cosmic Ring Couple Creative Lettering Finger Ring,,,,,,,,,
LGTIYZB0168,Vintage Hollow Triangle Earrings Two-Tone Amethyst Opal Pendant Earrings,,<p>Style: Vintage </p><p>Type: Earrings</p><p>Color: Silver</p><p>Weight: 8.5g</p><p>Length: About 5*1.5 cm / 1.97*0.59 in</p><p>Material: 925 Silver Plated</p><p>1 x Earrings</p>,img/Earrings/SKUG45557.jpg,,Size#,11.0,,,,1,1,,,Earrings,,Vintage Hollow Triangle Earrings Two-Tone Amethyst Opal Pendant Earrings,Vintage Hollow Triangle Earrings Two-Tone Amethyst Opal Pendant Earrings,Vintage Hollow Triangle Earrings Two-Tone Amethyst Opal Pendant Earrings,,,,,,,,,
LGTIYZB0169,Women Vintage Handbag Oil Wax Leather Three-layer Crosssbody Bag,,"<p>Bag Type:Satchel</p><p>Color:Black, Brown, Green, Red</p><p>Material:PU</p><p>Style:Vintage</p><p>Decoration:Hardware</p><p>Hardness:Hard</p>",img/Handbags/SKUE87726.jpg,,Size#,70.84,,,,1,1,,,Handbags,,Women Vintage Handbag Oil Wax Leather Three-layer Crosssbody Bag,Women Vintage Handbag Oil Wax Leather Three-layer Crosssbody Bag,Women Vintage Handbag Oil Wax Leather Three-layer Crosssbody Bag,,,,,,,,,
LGTIYZB0170,LOSTISY Women Casual Lace-up Zipper Design Colorful Pattern Flat Loafers Shoes,,"<p>Color:Yellow, White, Blue</p><p>Type:Loafers</p><p>Closure Type:Lace-up</p><p>Heel Type:Flat</p><p>Heel Height:1-3cm In Flat</p><p>Toe Type:Round</p><p>Pattern:Other</p><p>Design Element:Chain</p><p>Upper Material:PU</p><p>Style:Casual, Natural</p><p>Outsole Material:Rubber</p><p>Structure:Slip-On</p><p>Occasion:Casual</p><p>Function:Antiskid, Hard-wearing</p><p>Season:All Season</p>",img/Flats/SKUH22494.jpg,,Size#US 5:US 6:US 7:US 8:US 9:US 10:US 11:,55.55,,,,1,1,,,Flats,,LOSTISY Women Casual Lace-up Zipper Design Colorful Pattern Flat Loafers Shoes,LOSTISY Women Casual Lace-up Zipper Design Colorful Pattern Flat Loafers Shoes,LOSTISY Women Casual Lace-up Zipper Design Colorful Pattern Flat Loafers Shoes,,,,,,,,,
LGTIYZB0171,Plus Size Women Retro Casual Closed Toe Hollow Hook Loop Flat Sandals,,"<p>Color:Orange, Green, Blue, Grey</p><p>Closure Type:Hook & Loop</p><p>Heel Type:Flat</p><p>Heel Height:1-3cm In Flat</p><p>Toe Type:Round</p><p>Pattern:Solid</p><p>Design Element:Ripped</p><p>Upper Material:PU</p><p>Style:Casual, Retro</p><p>Outsole Material:PU</p><p>Structure:Closed Toe, Slip-On</p><p>Occasion:Daily</p><p>Decoration:Hollow Out</p><p>Function:Antiskid</p><p>Season:Summer</p>",img/Sandals/SKUF04926.jpg,,Size#US 5:US 6:US 7:US 8:US 9:US 10:US 11:US 12:,64.31,,,,1,1,,,Sandals,,Plus Size Women Retro Casual Closed Toe Hollow Hook Loop Flat Sandals,Plus Size Women Retro Casual Closed Toe Hollow Hook Loop Flat Sandals,Plus Size Women Retro Casual Closed Toe Hollow Hook Loop Flat Sandals,,,,,,,,,
LGTIYZB0172,Tie Dye One Shoulder Crop Top,,<p><b>Style</b>: Casual</p><p><b>Color</b>: Multicolor</p><p><b>Pattern Type</b>: Tie Dye</p><p><b>Length</b>: Crop</p><p><b>Season</b>: Summer</p><p><b>Neckline</b>: One Shoulder</p><p><b>Sleeve Length</b>: Sleeveless</p><p><b>Fit Type</b>: Slim Fit</p><p><b>Placket Type</b>: Pullovers</p><p><b>Sheer</b>: No</p><p><b>Material</b>: Polyester</p><p><b>Composition</b>: 95% Polyester</p><p><b>Composition</b>: 5% Spandex</p><p><b>Fabric</b>: Slight Stretch</p><p><b>Care Instructions</b>: Machine wash or professional dry clean</p>,img/Women_Tops/rwtop25210609190.jpg,,Size#S:M:L:,31.12,,,,1,1,,,Women Tops,,Tie Dye One Shoulder Crop Top,Tie Dye One Shoulder Crop Top,Tie Dye One Shoulder Crop Top,,,,,,,,,
LGTIYZB0173,Polka Dot Capris Wide Leg Pants,,<p><b>Style</b>: Boho</p><p><b>Color</b>: Black</p><p><b>Pattern Type</b>: Polka Dot</p><p><b>Length</b>: Capris</p><p><b>Type</b>: Wide Leg</p><p><b>Season</b>: Spring/Summer/Fall</p><p><b>Waist Line</b>: High Waist</p><p><b>Fit Type</b>: Loose</p><p><b>Sheer</b>: No</p><p><b>Closure Type</b>: Elastic Waist</p><p><b>Material</b>: Polyester</p><p><b>Composition</b>: 100% Polyester</p><p><b>Fabric</b>: Non-Stretch</p><p><b>Care Instructions</b>: Machine wash or professional dry clean</p>,img/Pants/swpants30210406609.jpg,,Size#S:M:L:XL:,25.08,,,,1,1,,,Pants,,Polka Dot Capris Wide Leg Pants,Polka Dot Capris Wide Leg Pants,Polka Dot Capris Wide Leg Pants,,,,,,,,,
LGTIYZB0174,Solid Tie Shoulder Dress,,<p><b>Style</b>: Casual</p><p><b>Color</b>: Dusty Blue</p><p><b>Pattern Type</b>: Plain</p><p><b>Length</b>: Mini</p><p><b>Season</b>: Summer</p><p><b>Type</b>: Cami</p><p><b>Details</b>: Frill</p><p><b>Details</b>: Knot</p><p><b>Sleeve Length</b>: Sleeveless</p><p><b>Waist Line</b>: High Waist</p><p><b>Fit Type</b>: Regular Fit</p><p><b>Neckline</b>: Straps</p><p><b>Sheer</b>: No</p><p><b>Hem Shaped</b>: Layered/Tiered</p><p><b>Material</b>: Cotton</p><p><b>Composition</b>: 65% Cotton</p><p><b>Composition</b>: 35% Polyester</p><p><b>Fabric</b>: Non-Stretch</p><p><b>Care Instructions</b>: Machine wash or professional dry clean</p><p><b>Style</b>: Casual</p><p><b>Color</b>: Mint Green</p><p><b>Pattern Type</b>: Plain</p><p><b>Length</b>: Mini</p><p><b>Season</b>: Summer</p><p><b>Type</b>: Cami</p><p><b>Details</b>: Frill</p><p><b>Details</b>: Knot</p><p><b>Sleeve Length</b>: Sleeveless</p><p><b>Waist Line</b>: High Waist</p><p><b>Fit Type</b>: Regular Fit</p><p><b>Neckline</b>: Straps</p><p><b>Sheer</b>: No</p><p><b>Hem Shaped</b>: Layered/Tiered</p><p><b>Material</b>: Cotton</p><p><b>Composition</b>: 65% Cotton</p><p><b>Composition</b>: 35% Polyester</p><p><b>Fabric</b>: Non-Stretch</p><p><b>Care Instructions</b>: Machine wash or professional dry clean</p>,img/Dresses/rwdress25210617147.jpg,,Size#S:M:L:,29.32,,,,1,1,,,Dresses,,Solid Tie Shoulder Dress,Solid Tie Shoulder Dress,Solid Tie Shoulder Dress,,,,,,,,,
LGTIYZB0175,Solid Waffle Knot Shorts,,<p><b>Style</b>: Casual</p><p><b>Color</b>: Light Grey</p><p><b>Pattern Type</b>: Plain</p><p><b>Season</b>: Summer</p><p><b>Type</b>: Track Shorts</p><p><b>Details</b>: Knot</p><p><b>Waist Line</b>: Natural</p><p><b>Fit Type</b>: Regular Fit</p><p><b>Sheer</b>: No</p><p><b>Closure Type</b>: Elastic Waist</p><p><b>Material</b>: Cotton</p><p><b>Composition</b>: 65% Cotton</p><p><b>Composition</b>: 35% Polyester</p><p><b>Fabric</b>: Slight Stretch</p><p><b>Care Instructions</b>: Machine wash or professional dry clean</p>,img/Shorts/rwshorts25210521969.jpg,,Size#S:M:L:,29.23,,,,1,1,,,Shorts,,Solid Waffle Knot Shorts,Solid Waffle Knot Shorts,Solid Waffle Knot Shorts,,,,,,,,,
LGTIYZB0176,Vintage Hug Frog Ring Three-dimensional Animal Ring,,"<p>Style: Vintage,Lovely.</p><p>Type: Ring</p><p>Color: Silver.</p><p>Diameter Length: About 1.6 cm/0.63 in</p><p>Material:  Alloy</p><p>1 x Ring</p>",img/Rings/SKUH39259.jpg,,Size#,27.0,,,,1,1,,,Rings,,Vintage Hug Frog Ring Three-dimensional Animal Ring,Vintage Hug Frog Ring Three-dimensional Animal Ring,Vintage Hug Frog Ring Three-dimensional Animal Ring,,,,,,,,,
LGTIYZB0177,Vintage Plum Blossom Women Earrings Agate Synthetic Crystal Pendant Earring,,"<p>Style: Vintage </p><p>Type: Earring</p><p>Color: Green+Red</p><p>Weight: 8.8g</p><p>Size: About 4.85*1.85 cm / 1.91*0.73 in</p><p>Material: Crystal, Agate, Silver Plated</p><p>1 x Earring</p>",img/Earrings/SKUG38458.jpg,,Size#,25.8,,,,1,1,,,Earrings,,Vintage Plum Blossom Women Earrings Agate Synthetic Crystal Pendant Earring,Vintage Plum Blossom Women Earrings Agate Synthetic Crystal Pendant Earring,Vintage Plum Blossom Women Earrings Agate Synthetic Crystal Pendant Earring,,,,,,,,,
