v_sku,v_name,v_short_description,v_description,v_image,v_url,v_attribute,v_price,v_specials_price,v_specials_expire_date,v_date_added,v_in_stock,v_status,v_viewed,v_ordered,v_category_sku,v_sort_order,v_meta_title,v_meta_keywords,v_meta_description,v_brand_filter,v_class_filter,v_color_filter,v_gender_filter,v_material_filter,v_year_filter,v_origin_filter,v_series_filter,v_spec_filter
MPSFWXE0001,Solid Drawstring Puff Sleeve Sweetheart Neck Crop Blouse,,<p><b>Style</b>: Casual</p><p><b>Color</b>: White</p><p><b>Pattern Type</b>: Plain</p><p><b>Length</b>: Crop</p><p><b>Season</b>: Summer</p><p><b>Type</b>: Top</p><p><b>Details</b>: Drawstring</p><p><b>Details</b>: Ruched</p><p><b>Sleeve Type</b>: Puff Sleeve</p><p><b>Fit Type</b>: Regular Fit</p><p><b>Sleeve Length</b>: Short Sleeve</p><p><b>Neckline</b>: Sweetheart</p><p><b>Sheer</b>: No</p><p><b>Placket Type</b>: Pullovers</p><p><b>Material</b>: Cotton</p><p><b>Composition</b>: 65% Cotton</p><p><b>Composition</b>: 35% Polyester</p><p><b>Fabric</b>: Non-Stretch</p><p><b>Care Instructions</b>: Machine wash or professional dry clean</p>,img/Blouses/rW210513375169913.jpg,,Size#S:M:L:,30.97,,,,1,1,,,Blouses,,Solid Drawstring Puff Sleeve Sweetheart Neck Crop Blouse,Solid Drawstring Puff Sleeve Sweetheart Neck Crop Blouse,Solid Drawstring Puff Sleeve Sweetheart Neck Crop Blouse,,,,,,,,,
MPSFWXE0002,ROMWE X Vwpstd Letter Graphic Two Tone Shorts,,<p><b>Style</b>: Casual</p><p><b>Color</b>: Multicolor</p><p><b>Pattern Type</b>: Colorblock</p><p><b>Pattern Type</b>: Graphic</p><p><b>Season</b>: Summer</p><p><b>Type</b>: Track Shorts</p><p><b>Waist Line</b>: Natural</p><p><b>Fit Type</b>: Regular Fit</p><p><b>Sheer</b>: No</p><p><b>Closure Type</b>: Elastic Waist</p><p><b>Material</b>: Polyester</p><p><b>Composition</b>: 95% Polyester</p><p><b>Composition</b>: 5% Spandex</p><p><b>Fabric</b>: Non-Stretch</p><p><b>Care Instructions</b>: Machine wash or professional dry clean</p>,img/Shorts/rwshorts25210603236.jpg,,Size#S:M:L:,25.69,,,,1,1,,,Shorts,,ROMWE X Vwpstd Letter Graphic Two Tone Shorts,ROMWE X Vwpstd Letter Graphic Two Tone Shorts,ROMWE X Vwpstd Letter Graphic Two Tone Shorts,,,,,,,,,
MPSFWXE0003,Heart Graphic Drawstring Ruched Ribbed Tank Top,,<p><b>Style</b>: Casual</p><p><b>Color</b>: Black</p><p><b>Pattern Type</b>: Heart</p><p><b>Length</b>: Crop</p><p><b>Season</b>: Summer</p><p><b>Type</b>: Tank</p><p><b>Details</b>: Drawstring</p><p><b>Details</b>: Ruched</p><p><b>Details</b>: Rib-Knit</p><p><b>Neckline</b>: Scoop Neck</p><p><b>Fit Type</b>: Slim Fit</p><p><b>Sheer</b>: No</p><p><b>Material</b>: Cotton Blends</p><p><b>Composition</b>: 65% Cotton</p><p><b>Composition</b>: 35% Polyester</p><p><b>Fabric</b>: Medium Stretch</p><p><b>Care Instructions</b>: Machine wash or professional dry clean</p>,img/Tank_Tops__Camis/rwvest25210604942.jpg,,Size#S:M:L:,25.03,,,,1,1,,,Tank Tops & Cam's,,Heart Graphic Drawstring Ruched Ribbed Tank Top,Heart Graphic Drawstring Ruched Ribbed Tank Top,Heart Graphic Drawstring Ruched Ribbed Tank Top,,,,,,,,,
MPSFWXE0004,Plaid Lace-Up Front Pleated Mini Skirt,,<p><b>Style</b>: Preppy</p><p><b>Color</b>: Multicolor</p><p><b>Pattern Type</b>: Plaid</p><p><b>Length</b>: Mini</p><p><b>Type</b>: Pleated</p><p><b>Season</b>: Summer</p><p><b>Details</b>: Lace Up</p><p><b>Details</b>: Pleated</p><p><b>Details</b>: Zipper</p><p><b>Waist Line</b>: High Waist</p><p><b>Sheer</b>: No</p><p><b>Material</b>: Cotton</p><p><b>Composition</b>: 65% Cotton</p><p><b>Composition</b>: 35% Polyester</p><p><b>Fabric</b>: Non-Stretch</p><p><b>Care Instructions</b>: Machine wash or professional dry clean</p><p><b>Style</b>: Preppy</p><p><b>Color</b>: Black</p><p><b>Pattern Type</b>: Plaid</p><p><b>Length</b>: Mini</p><p><b>Type</b>: Pleated</p><p><b>Season</b>: Spring/Summer/Fall</p><p><b>Details</b>: Lace Up</p><p><b>Details</b>: Pleated</p><p><b>Details</b>: Zipper</p><p><b>Waist Line</b>: High Waist</p><p><b>Sheer</b>: No</p><p><b>Material</b>: Cotton</p><p><b>Composition</b>: 65% Cotton</p><p><b>Composition</b>: 35% Polyester</p><p><b>Fabric</b>: Non-Stretch</p><p><b>Care Instructions</b>: Machine wash or professional dry clean</p>,img/Skirts/swskirt07201103796.jpg,,Size#XS:S:M:L:XL:,24.99,,,,1,1,,,Skirts,,Plaid Lace-Up Front Pleated Mini Skirt,Plaid Lace-Up Front Pleated Mini Skirt,Plaid Lace-Up Front Pleated Mini Skirt,,,,,,,,,
MPSFWXE0005,Vintage Geometric Metal Handmade Natural Stone Pendant Earrings Blue Irregular Marble Pattern Earrings,,<p>Style: Vintage</p><p>Type: Earrings</p><p>Main Color: Blue</p><p>Weight: 8g</p><p>Size: 35mm*8.5mm/1.37*0.33in</p><p>Material: Alloy</p><p>1 X Earrings</p>,img/Earrings/SKUF42311.jpg,,Size#,17.3,,,,1,1,,,Earrings,,Vintage Geometric Metal Handmade Natural Stone Pendant Earrings Blue Irregular Marble Pattern Earrings,Vintage Geometric Metal Handmade Natural Stone Pendant Earrings Blue Irregular Marble Pattern Earrings,Vintage Geometric Metal Handmade Natural Stone Pendant Earrings Blue Irregular Marble Pattern Earrings,,,,,,,,,
MPSFWXE0006,Letter Charm Necklace,,<p><b>Type</b>: Pendant Necklaces</p><p><b>Material</b>: Alloy</p><p><b>Color</b>: Gold</p><p><b>Metal Color</b>: Gold</p><p><b>Style</b>: Casual</p><p><b>Type</b>: Pendant Necklaces</p><p><b>Material</b>: Alloy</p><p><b>Color</b>: Silver</p><p><b>Metal Color</b>: Silver</p><p><b>Style</b>: Casual</p>,img/Pendant_Necklaces/swneck18200922658.jpg,,Size#,23.06,,,,1,1,,,Pendant Necklaces,,Letter Charm Necklace,Letter Charm Necklace,Letter Charm Necklace,,,,,,,,,
MPSFWXE0007,Genuine Leather Leaf Insect Cartoon Personalized Wallet Coin Purse For Women,,"<p>Color:Orange, Coffee, Green, Black, Purple, Blue</p><p>Style:Casual, Vintage</p><p>Decoration:Genuine Leather</p>",img/Wallets/SKUA31694.jpg,,Size#,56.43,,,,1,1,,,Wallets,,Genuine Leather Leaf Insect Cartoon Personalized Wallet Coin Purse For Women,Genuine Leather Leaf Insect Cartoon Personalized Wallet Coin Purse For Women,Genuine Leather Leaf Insect Cartoon Personalized Wallet Coin Purse For Women,,,,,,,,,
MPSFWXE0008,Men Stylish Letter Pattern Sport Casual Lace-up Forrest Shoes,,"<p>Color:Grey, White, Beige</p><p>Upper Material:Mesh, PU</p><p>Outsole Material:Rubber</p><p>Type:Walking Shoes</p><p>Function:Breathable, Soft, Hard-wearing, Sport</p><p>Occasion:Outdoor, Daily, Sport</p><p>Closure Type:Lace-up, Slip-On</p><p>Season:All Season</p><p>Toe Type:Round</p>",img/Sneakers__Athletic/SKUH16500.jpg,,Size#US 6.5:US 7.5:US 8:US 8.5:US 9:US 10:,50.06,,,,1,1,,,Sneakers & Athletic,,Men Stylish Letter Pattern Sport Casual Lace-up Forrest Shoes,Men Stylish Letter Pattern Sport Casual Lace-up Forrest Shoes,Men Stylish Letter Pattern Sport Casual Lace-up Forrest Shoes,,,,,,,,,
MPSFWXE0009,SIKETU Women Casual Metal Decor Hollow Out Clip Toe Wedges Slippers,,"<p>Color:Red, Black, White, Apricot</p><p>Type:ClipToe Slippers</p><p>Closure Type:Slip-On</p><p>Heel Type:Wedges Heel</p><p>Heel Height:3-5cm In Low Heel</p><p>Toe Type:Clip Toe</p><p>Pattern:Solid</p><p>Design Element:Hollow out, Metal</p><p>Upper Material:PU</p><p>Style:Casual</p><p>Outsole Material:PU</p><p>Structure:Clip Toe</p><p>Occasion:Beach, Casual</p><p>Decoration:Hardware</p><p>Function:Backless, Antiskid, Soft, Hard-wearing</p><p>Season:Summer, Spring</p>",img/Slippers/SKUG89009.jpg,,Size#US 5:US 6:US 7:US 8:US 9:US 10:US 11:US 12:,58.93,,,,1,1,,,Slippers,,SIKETU Women Casual Metal Decor Hollow Out Clip Toe Wedges Slippers,SIKETU Women Casual Metal Decor Hollow Out Clip Toe Wedges Slippers,SIKETU Women Casual Metal Decor Hollow Out Clip Toe Wedges Slippers,,,,,,,,,
MPSFWXE0010,Solid Button Front Pearl Blouse,,<p><b>Style</b>: Casual</p><p><b>Color</b>: Beige</p><p><b>Pattern Type</b>: Plain</p><p><b>Length</b>: Long</p><p><b>Season</b>: Spring/Summer</p><p><b>Type</b>: Shirt</p><p><b>Details</b>: Pearls</p><p><b>Details</b>: Button Front</p><p><b>Neckline</b>: Collar</p><p><b>Sleeve Length</b>: Long Sleeve</p><p><b>Fit Type</b>: Regular Fit</p><p><b>Sleeve Type</b>: Regular Sleeve</p><p><b>Sheer</b>: No</p><p><b>Placket Type</b>: Placket</p><p><b>Belt</b>: No</p><p><b>Material</b>: Cotton Blends</p><p><b>Composition</b>: 65% Cotton</p><p><b>Composition</b>: 35% Polyester</p><p><b>Fabric</b>: Non-Stretch</p><p><b>Care Instructions</b>: Machine wash or professional dry clean</p>,img/Blouses/rwblouse25210616985.jpg,,Size#S:M:L:,25.67,,,,1,1,,,Blouses,,Solid Button Front Pearl Blouse,Solid Button Front Pearl Blouse,Solid Button Front Pearl Blouse,,,,,,,,,
MPSFWXE0011,Solid Waffle Knot Shorts,,<p><b>Style</b>: Casual</p><p><b>Color</b>: Light Grey</p><p><b>Pattern Type</b>: Plain</p><p><b>Season</b>: Summer</p><p><b>Type</b>: Track Shorts</p><p><b>Details</b>: Knot</p><p><b>Waist Line</b>: Natural</p><p><b>Fit Type</b>: Regular Fit</p><p><b>Sheer</b>: No</p><p><b>Closure Type</b>: Elastic Waist</p><p><b>Material</b>: Cotton</p><p><b>Composition</b>: 65% Cotton</p><p><b>Composition</b>: 35% Polyester</p><p><b>Fabric</b>: Slight Stretch</p><p><b>Care Instructions</b>: Machine wash or professional dry clean</p>,img/Shorts/rwshorts25210521969.jpg,,Size#S:M:L:,32.7,,,,1,1,,,Shorts,,Solid Waffle Knot Shorts,Solid Waffle Knot Shorts,Solid Waffle Knot Shorts,,,,,,,,,
MPSFWXE0012,Rib-knit Cut Out Tank Top,,<p><b>Style</b>: Casual</p><p><b>Color</b>: Baby Blue</p><p><b>Pattern Type</b>: Plain</p><p><b>Length</b>: Crop</p><p><b>Season</b>: Summer</p><p><b>Type</b>: Tank</p><p><b>Details</b>: Cut Out</p><p><b>Details</b>: Rib-Knit</p><p><b>Neckline</b>: Round Neck</p><p><b>Fit Type</b>: Slim Fit</p><p><b>Sheer</b>: No</p><p><b>Material</b>: Polyester</p><p><b>Composition</b>: 60% Polyester</p><p><b>Composition</b>: 35% Cotton</p><p><b>Composition</b>: 5% Spandex</p><p><b>Fabric</b>: Slight Stretch</p><p><b>Care Instructions</b>: Machine wash or professional dry clean</p>,img/Tank_Tops__Camis/swvest23201218218.jpg,,Size#S:M:L:XL:,23.59,,,,1,1,,,Tank Tops & Cam's,,Rib-knit Cut Out Tank Top,Rib-knit Cut Out Tank Top,Rib-knit Cut Out Tank Top,,,,,,,,,
MPSFWXE0013,Letter Tape Waist Camo Skirt,,<p><b>Style</b>: Casual</p><p><b>Color</b>: Multicolor</p><p><b>Pattern Type</b>: Letter</p><p><b>Pattern Type</b>: Camo</p><p><b>Length</b>: Midi</p><p><b>Type</b>: Pencil</p><p><b>Season</b>: Spring/Summer/Fall</p><p><b>Details</b>: Tape</p><p><b>Waist Line</b>: High Waist</p><p><b>Sheer</b>: No</p><p><b>Arabian Clothing</b>: Yes</p><p><b>Material</b>: Polyester</p><p><b>Composition</b>: 95% Polyester</p><p><b>Composition</b>: 5% Spandex</p><p><b>Fabric</b>: Slight Stretch</p><p><b>Care Instructions</b>: Machine wash or professional dry clean</p>,img/Skirts/swskirt07200730101.jpg,,Size#XS:S:M:L:XL:,29.57,,,,1,1,,,Skirts,,Letter Tape Waist Camo Skirt,Letter Tape Waist Camo Skirt,Letter Tape Waist Camo Skirt,,,,,,,,,
MPSFWXE0014,Vintage Plum Blossom Women Earrings Agate Synthetic Crystal Pendant Earring,,"<p>Style: Vintage </p><p>Type: Earring</p><p>Color: Green+Red</p><p>Weight: 8.8g</p><p>Size: About 4.85*1.85 cm / 1.91*0.73 in</p><p>Material: Crystal, Agate, Silver Plated</p><p>1 x Earring</p>",img/Earrings/SKUG38458.jpg,,Size#,17.36,,,,1,1,,,Earrings,,Vintage Plum Blossom Women Earrings Agate Synthetic Crystal Pendant Earring,Vintage Plum Blossom Women Earrings Agate Synthetic Crystal Pendant Earring,Vintage Plum Blossom Women Earrings Agate Synthetic Crystal Pendant Earring,,,,,,,,,
MPSFWXE0015,Butterfly & Heart Charm Layered Necklace,,<p><b>Details</b>: Heart</p><p><b>Type</b>: Pendant Necklaces</p><p><b>Material</b>: Alloy</p><p><b>Details</b>: Butterfly</p><p><b>Color</b>: Gold</p><p><b>Metal Color</b>: Gold</p><p><b>Style</b>: Casual</p>,img/Pendant_Necklaces/swneck18200915286.jpg,,Size#,27.5,,,,1,1,,,Pendant Necklaces,,Butterfly & Heart Charm Layered Necklace,Butterfly & Heart Charm Layered Necklace,Butterfly & Heart Charm Layered Necklace,,,,,,,,,
MPSFWXE0016,Women Touch Screen Multi-card Slots 6.5 Inch Phone Holder Leather Wallet Purse,,"<p>Color:Pink, Yellow, Green, Black, Brown, Blue, Red</p><p>Wallets Style:Clasp Closure</p><p>Wallet Type:Money Clip, Phone Holder, Coin Purse</p><p>Material:Faux Fur, PU</p><p>Style:Casual</p><p>Pattern:Solid</p>",img/Wallets/SKUG30838.jpg,,Size#,62.46,,,,1,1,,,Wallets,,Women Touch Screen Multi-card Slots 6.5 Inch Phone Holder Leather Wallet Purse,Women Touch Screen Multi-card Slots 6.5 Inch Phone Holder Leather Wallet Purse,Women Touch Screen Multi-card Slots 6.5 Inch Phone Holder Leather Wallet Purse,,,,,,,,,
MPSFWXE0017,Men Mesh Splicing Comfy Soft Outdoor Slip Resistant Casual Sneakers,,"<p>Color:Black, Blue, Grey</p><p>Outsole Material:Rubber</p><p>Function:Soft</p><p>Occasion:Outdoor</p><p>Closure Type:Slip-On</p><p>Toe Type:Round</p>",img/Sneakers__Athletic/SKUB49271.jpg,,Size#US 7.5:US 8:US 8.5:US 9:US 10:US 10.5:US 11:,55.88,,,,1,1,,,Sneakers & Athletic,,Men Mesh Splicing Comfy Soft Outdoor Slip Resistant Casual Sneakers,Men Mesh Splicing Comfy Soft Outdoor Slip Resistant Casual Sneakers,Men Mesh Splicing Comfy Soft Outdoor Slip Resistant Casual Sneakers,,,,,,,,,
MPSFWXE0018,Women Elegant Brief Woven Cross Strap Square Toe Opend Cone Heeled Slippers,,"<p>Color:Green, Black, White</p><p>Type:Stripe Slippers</p><p>Closure Type:Slip-On</p><p>Heel Type:Cone Heel</p><p>Heel Height:5-8cm In Heel</p><p>Toe Type:Square</p><p>Pattern:Solid</p><p>Design Element:Woven</p><p>Upper Material:PU</p><p>Style:Casual</p><p>Outsole Material:Rubber</p><p>Structure:Cross Strap</p><p>Occasion:Casual</p><p>Function:Antiskid, Hard-wearing</p><p>Season:Summer, Spring</p>",img/Slippers/SKUH29726.jpg,,Size#US 5:US 6:US 7:US 8:US 9:US 10:,58.38,,,,1,1,,,Slippers,,Women Elegant Brief Woven Cross Strap Square Toe Opend Cone Heeled Slippers,Women Elegant Brief Woven Cross Strap Square Toe Opend Cone Heeled Slippers,Women Elegant Brief Woven Cross Strap Square Toe Opend Cone Heeled Slippers,,,,,,,,,
MPSFWXE0019,Lightning Button Front Blouse,,<p><b>Style</b>: Casual</p><p><b>Color</b>: Multicolor</p><p><b>Pattern Type</b>: Graphic</p><p><b>Length</b>: Long</p><p><b>Season</b>: Summer</p><p><b>Type</b>: Shirt</p><p><b>Details</b>: Button Front</p><p><b>Neckline</b>: Collar</p><p><b>Fit Type</b>: Regular Fit</p><p><b>Sleeve Length</b>: Short Sleeve</p><p><b>Sleeve Type</b>: Regular Sleeve</p><p><b>Sheer</b>: No</p><p><b>Placket Type</b>: Placket</p><p><b>Material</b>: Polyester</p><p><b>Composition</b>: 100% Polyester</p><p><b>Fabric</b>: Non-Stretch</p><p><b>Care Instructions</b>: Machine wash or professional dry clean</p>,img/Blouses/rw2106228121322385.jpg,,Size#S:M:L:,23.05,,,,1,1,,,Blouses,,Lightning Button Front Blouse,Lightning Button Front Blouse,Lightning Button Front Blouse,,,,,,,,,
MPSFWXE0020,Paisley Print Drawstring Front Shorts,,<p><b>Style</b>: Casual</p><p><b>Color</b>: Coffee Brown</p><p><b>Pattern Type</b>: Paisley</p><p><b>Season</b>: Summer</p><p><b>Type</b>: Biker Shorts</p><p><b>Details</b>: Drawstring</p><p><b>Waist Line</b>: High Waist</p><p><b>Fit Type</b>: Skinny</p><p><b>Sheer</b>: No</p><p><b>Closure Type</b>: Elastic Waist</p><p><b>Material</b>: Polyester</p><p><b>Composition</b>: 91% Polyester</p><p><b>Composition</b>: 9% Elastane</p><p><b>Fabric</b>: High Stretch</p><p><b>Care Instructions</b>: Machine wash or professional dry clean</p>,img/Shorts/swshorts44210414004.jpg,,Size#XS:S:M:L:,31.13,,,,1,1,,,Shorts,,Paisley Print Drawstring Front Shorts,Paisley Print Drawstring Front Shorts,Paisley Print Drawstring Front Shorts,,,,,,,,,
MPSFWXE0021,ROMWE X Tacikworks Stitching Trim Letter Graphic Tank Top,,<p><b>Style</b>: Casual</p><p><b>Color</b>: Coffee Brown</p><p><b>Pattern Type</b>: Letter</p><p><b>Pattern Type</b>: Cartoon</p><p><b>Length</b>: Crop</p><p><b>Season</b>: Summer</p><p><b>Type</b>: Tank</p><p><b>Fit Type</b>: Regular Fit</p><p><b>Neckline</b>: Round Neck</p><p><b>Sheer</b>: No</p><p><b>Material</b>: Polyester</p><p><b>Composition</b>: 65% Polyester</p><p><b>Composition</b>: 35% Cotton</p><p><b>Fabric</b>: High Stretch</p><p><b>Care Instructions</b>: Machine wash or professional dry clean</p><p><b>Style</b>: Casual</p><p><b>Color</b>: Mint Green</p><p><b>Pattern Type</b>: Letter</p><p><b>Pattern Type</b>: Graphic</p><p><b>Length</b>: Crop</p><p><b>Season</b>: Summer</p><p><b>Type</b>: Tank</p><p><b>Neckline</b>: Round Neck</p><p><b>Fit Type</b>: Slim Fit</p><p><b>Sheer</b>: No</p><p><b>Material</b>: Polyester</p><p><b>Composition</b>: 65% Polyester</p><p><b>Composition</b>: 35% Cotton</p><p><b>Fabric</b>: High Stretch</p><p><b>Care Instructions</b>: Machine wash or professional dry clean</p><p><b>Style</b>: Casual</p><p><b>Color</b>: Black</p><p><b>Pattern Type</b>: Letter</p><p><b>Pattern Type</b>: Graphic</p><p><b>Length</b>: Crop</p><p><b>Season</b>: Summer</p><p><b>Type</b>: Tank</p><p><b>Neckline</b>: Round Neck</p><p><b>Fit Type</b>: Slim Fit</p><p><b>Sheer</b>: No</p><p><b>Material</b>: Polyester</p><p><b>Composition</b>: 65% Polyester</p><p><b>Composition</b>: 35% Cotton</p><p><b>Fabric</b>: High Stretch</p><p><b>Care Instructions</b>: Machine wash or professional dry clean</p><p><b>Style</b>: Casual</p><p><b>Color</b>: Red</p><p><b>Pattern Type</b>: Letter</p><p><b>Pattern Type</b>: Graphic</p><p><b>Length</b>: Crop</p><p><b>Season</b>: Summer</p><p><b>Type</b>: Tank</p><p><b>Neckline</b>: Round Neck</p><p><b>Fit Type</b>: Slim Fit</p><p><b>Sheer</b>: No</p><p><b>Material</b>: Polyester</p><p><b>Composition</b>: 65% Polyester</p><p><b>Composition</b>: 35% Cotton</p><p><b>Fabric</b>: High Stretch</p><p><b>Care Instructions</b>: Machine wash or professional dry clean</p><p><b>Style</b>: Casual</p><p><b>Color</b>: Apricot</p><p><b>Pattern Type</b>: Letter</p><p><b>Pattern Type</b>: Cartoon</p><p><b>Length</b>: Crop</p><p><b>Season</b>: Summer</p><p><b>Type</b>: Tank</p><p><b>Fit Type</b>: Regular Fit</p><p><b>Neckline</b>: Round Neck</p><p><b>Sheer</b>: No</p><p><b>Material</b>: Polyester</p><p><b>Composition</b>: 65% Polyester</p><p><b>Composition</b>: 35% Cotton</p><p><b>Fabric</b>: High Stretch</p><p><b>Care Instructions</b>: Machine wash or professional dry clean</p>,img/Tank_Tops__Camis/rwvest25210428884.jpg,,Size#S:M:L:XL:,25.63,,,,1,1,,,Tank Tops & Cam's,,ROMWE X Tacikworks Stitching Trim Letter Graphic Tank Top,ROMWE X Tacikworks Stitching Trim Letter Graphic Tank Top,ROMWE X Tacikworks Stitching Trim Letter Graphic Tank Top,,,,,,,,,
MPSFWXE0022,Solid Knot Side Skirt,,<p><b>Style</b>: Casual</p><p><b>Color</b>: Brown</p><p><b>Pattern Type</b>: Plain</p><p><b>Length</b>: Short</p><p><b>Season</b>: Summer</p><p><b>Type</b>: Wrap</p><p><b>Details</b>: Wrap</p><p><b>Details</b>: Knot</p><p><b>Waist Line</b>: Natural</p><p><b>Sheer</b>: Semi-Sheer</p><p><b>Material</b>: Recycle Polyester</p><p><b>Composition</b>: 65% Polyester</p><p><b>Composition</b>: 35% Cotton</p><p><b>Fabric</b>: Non-Stretch</p><p><b>Care Instructions</b>: Machine wash or professional dry clean</p>,img/Skirts/sW210603515879994.jpg,,Size#S:M:L:XL:,28.77,,,,1,1,,,Skirts,,Solid Knot Side Skirt,Solid Knot Side Skirt,Solid Knot Side Skirt,,,,,,,,,
MPSFWXE0023,Trendy Cartilage Earrings Simple Style Punk No Piercing Ear Clip Earrings for Women Men,,"<p>Style: Trendy</p><p>Type: Ear Clip</p><p>Weight: About 4.2g</p><p>Material: Zinc Alloy</p><p>Size: About 1.4cm x 0.4cm / 0.55' x 0.16'</p><p>Color: Steel Color, Black, Gold, Colorful, Blue</p><p>1 Pair of Earrings</p>",img/Earrings/SKU948452.jpg,,Size#,20.22,,,,1,1,,,Earrings,,Trendy Cartilage Earrings Simple Style Punk No Piercing Ear Clip Earrings for Women Men,Trendy Cartilage Earrings Simple Style Punk No Piercing Ear Clip Earrings for Women Men,Trendy Cartilage Earrings Simple Style Punk No Piercing Ear Clip Earrings for Women Men,,,,,,,,,
MPSFWXE0024,1pc Eagle & Sky Pattern Ball Pendant Necklace,,<p><b>Composition</b>: 80% Glass</p><p><b>Composition</b>: 20% Alloy</p><p><b>Type</b>: Pendant Necklaces</p><p><b>Material</b>: Resin</p><p><b>Color</b>: Silver</p><p><b>Metal Color</b>: Silver</p><p><b>Style</b>: Casual</p>,img/Pendant_Necklaces/swneck18191231103.jpg,,Size#,20.18,,,,1,1,,,Pendant Necklaces,,1pc Eagle & Sky Pattern Ball Pendant Necklace,1pc Eagle & Sky Pattern Ball Pendant Necklace,1pc Eagle & Sky Pattern Ball Pendant Necklace,,,,,,,,,
MPSFWXE0025,Women PU Leather Cute Crab Shape Coin Bag Casual Key Bag,,"<p>Color:Pink, Yellow, Red</p><p>Material:PU</p><p>Style:Casual</p>",img/Wallets/SKU814022.jpg,,Size#,65.98,,,,1,1,,,Wallets,,Women PU Leather Cute Crab Shape Coin Bag Casual Key Bag,Women PU Leather Cute Crab Shape Coin Bag Casual Key Bag,Women PU Leather Cute Crab Shape Coin Bag Casual Key Bag,,,,,,,,,
MPSFWXE0026,Men Brief Pure Color Stitching Outdoor Work Style Shoes,,"<p>Color:Black, White, Khaki</p><p>Upper Material:PU</p><p>Outsole Material:Rubber</p><p>Type:Skate Shoes</p><p>Function:Hard-wearing, Sport, Slip Resistant</p><p>Occasion:Outdoor, Sport</p><p>Closure Type:Lace-up, Slip-On</p><p>Season:All Season</p><p>Toe Type:Round</p>",img/Sneakers__Athletic/SKUH24517.jpg,,Size#US 6.5:US 7.5:US 8:US 8.5:US 9:US 10:,51.39,,,,1,1,,,Sneakers & Athletic,,Men Brief Pure Color Stitching Outdoor Work Style Shoes,Men Brief Pure Color Stitching Outdoor Work Style Shoes,Men Brief Pure Color Stitching Outdoor Work Style Shoes,,,,,,,,,
MPSFWXE0027,Plus Size Color Splicing Bow Round Toe Flat Summer Slippers For Women,,"<p>Color:Red, Yellow, Golden</p><p>Type:Slides Slipper</p><p>Closure Type:Slip-On</p><p>Heel Type:Flat</p><p>Heel Height:1-3cm In Flat</p><p>Toe Type:Round</p><p>Pattern:Other</p><p>Design Element:Splice, Bowknot</p><p>Upper Material:PU</p><p>Style:Casual</p><p>Outsole Material:Rubber</p><p>Structure:Slip-On</p><p>Occasion:Casual</p><p>Decoration:Bowknot</p><p>Function:Antiskid, Light Weight</p><p>Season:Summer</p>",img/Slippers/SKUH61843.jpg,,Size#US 5:US 6:US 7:US 8:US 9:US 10:US 11:US 12:,61.47,,,,1,1,,,Slippers,,Plus Size Color Splicing Bow Round Toe Flat Summer Slippers For Women,Plus Size Color Splicing Bow Round Toe Flat Summer Slippers For Women,Plus Size Color Splicing Bow Round Toe Flat Summer Slippers For Women,,,,,,,,,
MPSFWXE0028,Tie Neck Dobby Mesh Raglan Sleeve Top,,<p><b>Style</b>: Elegant</p><p><b>Color</b>: Yellow</p><p><b>Pattern Type</b>: Polka Dot</p><p><b>Length</b>: Regular</p><p><b>Season</b>: Spring</p><p><b>Type</b>: Top</p><p><b>Details</b>: Sheer</p><p><b>Details</b>: Contrast Mesh</p><p><b>Sleeve Type</b>: Raglan Sleeve</p><p><b>Sleeve Length</b>: Long Sleeve</p><p><b>Fit Type</b>: Regular Fit</p><p><b>Neckline</b>: Stand Collar</p><p><b>Neckline</b>: Tie Neck</p><p><b>Sheer</b>: No</p><p><b>Placket Type</b>: Pullovers</p><p><b>Material</b>: Polyester</p><p><b>Composition</b>: 100% Polyester</p><p><b>Fabric</b>: Non-Stretch</p><p><b>Care Instructions</b>: Machine wash or professional dry clean</p><p><b>Style</b>: Elegant</p><p><b>Color</b>: Baby Pink</p><p><b>Pattern Type</b>: Polka Dot</p><p><b>Length</b>: Regular</p><p><b>Season</b>: Spring</p><p><b>Type</b>: Top</p><p><b>Details</b>: Sheer</p><p><b>Details</b>: Contrast Mesh</p><p><b>Sleeve Type</b>: Raglan Sleeve</p><p><b>Sleeve Length</b>: Long Sleeve</p><p><b>Fit Type</b>: Regular Fit</p><p><b>Neckline</b>: Stand Collar</p><p><b>Neckline</b>: Tie Neck</p><p><b>Sheer</b>: No</p><p><b>Placket Type</b>: Pullovers</p><p><b>Material</b>: Polyester</p><p><b>Composition</b>: 100% Polyester</p><p><b>Fabric</b>: Non-Stretch</p><p><b>Care Instructions</b>: Machine wash or professional dry clean</p>,img/Blouses/swblouse07191211080.jpg,,Size#XS:S:M:L:XL:,29.87,,,,1,1,,,Blouses,,Tie Neck Dobby Mesh Raglan Sleeve Top,Tie Neck Dobby Mesh Raglan Sleeve Top,Tie Neck Dobby Mesh Raglan Sleeve Top,,,,,,,,,
MPSFWXE0029,Car & Palm Tree Print Shorts,,<p><b>Style</b>: Casual</p><p><b>Color</b>: Apricot</p><p><b>Pattern Type</b>: Letter</p><p><b>Pattern Type</b>: Graphic</p><p><b>Season</b>: Summer</p><p><b>Type</b>: Track Shorts</p><p><b>Waist Line</b>: Natural</p><p><b>Fit Type</b>: Regular Fit</p><p><b>Sheer</b>: No</p><p><b>Closure Type</b>: Elastic Waist</p><p><b>Material</b>: Polyester</p><p><b>Composition</b>: 65% Polyester</p><p><b>Composition</b>: 35% Cotton</p><p><b>Fabric</b>: Slight Stretch</p><p><b>Care Instructions</b>: Machine wash or professional dry clean</p>,img/Shorts/sW210618147419099.jpg,,Size#S:M:L:,23.23,,,,1,1,,,Shorts,,Car & Palm Tree Print Shorts,Car & Palm Tree Print Shorts,Car & Palm Tree Print Shorts,,,,,,,,,
MPSFWXE0030,Scallop Trim Halter Top,,<p><b>Style</b>: Elegant</p><p><b>Color</b>: Green</p><p><b>Pattern Type</b>: Plain</p><p><b>Length</b>: Regular</p><p><b>Season</b>: Spring</p><p><b>Type</b>: Halter</p><p><b>Details</b>: Scallop</p><p><b>Details</b>: Button</p><p><b>Neckline</b>: Halter</p><p><b>Fit Type</b>: Regular Fit</p><p><b>Sheer</b>: No</p><p><b>Material</b>: Polyester</p><p><b>Composition</b>: 95% Polyester</p><p><b>Composition</b>: 5% Spandex</p><p><b>Fabric</b>: Slight Stretch</p><p><b>Care Instructions</b>: Machine wash or professional dry clean</p>,img/Tank_Tops__Camis/swvest07200226658.jpg,,Size#XS:S:M:L:XL:,31.79,,,,1,1,,,Tank Tops & Cam's,,Scallop Trim Halter Top,Scallop Trim Halter Top,Scallop Trim Halter Top,,,,,,,,,
MPSFWXE0031,Split Hem Leopard Skirt,,<p><b>Style</b>: Sexy</p><p><b>Color</b>: Multicolor</p><p><b>Pattern Type</b>: Leopard</p><p><b>Length</b>: Mini</p><p><b>Type</b>: Bodycon</p><p><b>Season</b>: Summer</p><p><b>Details</b>: Zipper</p><p><b>Waist Line</b>: High Waist</p><p><b>Sheer</b>: No</p><p><b>Material</b>: Polyester</p><p><b>Composition</b>: 100% Polyester</p><p><b>Fabric</b>: Non-Stretch</p><p><b>Care Instructions</b>: Machine wash or professional dry clean</p>,img/Skirts/swskirt07200318464.jpg,,Size#XS:S:M:L:XL:,22.38,,,,1,1,,,Skirts,,Split Hem Leopard Skirt,Split Hem Leopard Skirt,Split Hem Leopard Skirt,,,,,,,,,
