v_sku,v_name,v_short_description,v_description,v_image,v_url,v_attribute,v_price,v_specials_price,v_specials_expire_date,v_date_added,v_in_stock,v_status,v_viewed,v_ordered,v_category_sku,v_sort_order,v_meta_title,v_meta_keywords,v_meta_description,v_brand_filter,v_class_filter,v_color_filter,v_gender_filter,v_material_filter,v_year_filter,v_origin_filter,v_series_filter,v_spec_filter
MPSFWXE0032,Bohemian Alloy Stereo Mushroom Pendant Earrings Temperament Dripping Earrings,,"<p>Style: </p><p>Elegant,</p><p>Trendy.</p><p>Type: Earrings</p><p>Color:Orange.</p><p>Weight:19</p><p>g</p><p>Size: </p><p>About </p><p>2.4 *4.5cm /0.94*1.77 in</p><p>Material: Alloy.</p><p>1 x Earrings</p>",img/Earrings/SKUH26716.jpg,,Size#Orange:,27.83,,,,1,1,,,Earrings,,Bohemian Alloy Stereo Mushroom Pendant Earrings Temperament Dripping Earrings,Bohemian Alloy Stereo Mushroom Pendant Earrings Temperament Dripping Earrings,Bohemian Alloy Stereo Mushroom Pendant Earrings Temperament Dripping Earrings,,,,,,,,,
MPSFWXE0033,4pcs Minimalist Pendant Necklace,,<p><b>Type</b>: Pendant Necklaces</p><p><b>Details</b>: Rhinestone</p><p><b>Material</b>: Alloy</p><p><b>Color</b>: Silver</p><p><b>Metal Color</b>: Silver</p><p><b>Style</b>: Casual</p>,img/Pendant_Necklaces/swneck18200721215.jpg,,Size#,24.59,,,,1,1,,,Pendant Necklaces,,4pcs Minimalist Pendant Necklace,4pcs Minimalist Pendant Necklace,4pcs Minimalist Pendant Necklace,,,,,,,,,
MPSFWXE0034,Women Genuine Leather Cartoon Animal Koala Creative Cute Storage Bag Coin Bag Wallet,,"<p>Color:Pink, Brown, Blue</p><p>Wallets Style:Zipper</p><p>Wallet Type:Coin Purse</p><p>Material:Cow Leather</p><p>Style:Lovely</p>",img/Wallets/SKUG52926.jpg,,Size#,64.77,,,,1,1,,,Wallets,,Women Genuine Leather Cartoon Animal Koala Creative Cute Storage Bag Coin Bag Wallet,Women Genuine Leather Cartoon Animal Koala Creative Cute Storage Bag Coin Bag Wallet,Women Genuine Leather Cartoon Animal Koala Creative Cute Storage Bag Coin Bag Wallet,,,,,,,,,
MPSFWXE0035,Men Quick Drying Mesh Outdoor Rubber Toe Cap Water Casual Shoes,,"<p>Color:Black, Brown, Blue, Grey</p><p>Upper Material:Mesh, PU</p><p>Outsole Material:Rubber</p><p>Type:Water Shoes</p><p>Function:Soft</p><p>Occasion:Outdoor, Daily</p><p>Closure Type:Lace-up</p><p>Season:Summer</p><p>Toe Type:Round</p>",img/Sneakers__Athletic/SKUF13727.jpg,,Size#US 6.5:US 7.5:US 8:US 8.5:US 9:US 10:US 10.5:US 11:US 11.5:US 12:,60.08,,,,1,1,,,Sneakers & Athletic,,Men Quick Drying Mesh Outdoor Rubber Toe Cap Water Casual Shoes,Men Quick Drying Mesh Outdoor Rubber Toe Cap Water Casual Shoes,Men Quick Drying Mesh Outdoor Rubber Toe Cap Water Casual Shoes,,,,,,,,,
MPSFWXE0036,Women Flowers Decor Non Slip Massage Soft Comfy Retro Sandals,,"<p>Color:Red, Beige, Brown, Blue, Grey</p><p>Heel Type:Wedges Heel</p><p>Toe Type:Opened</p><p>Upper Material:PU</p><p>Outsole Material:PU</p><p>Function:Breathable, Soft</p><p>Season:Summer</p>",img/Slippers/SKUE88580.jpg,,Size#US 5:US 6:US 7:US 8:US 9:US 10:US 11:,50.26,,,,1,1,,,Slippers,,Women Flowers Decor Non Slip Massage Soft Comfy Retro Sandals,Women Flowers Decor Non Slip Massage Soft Comfy Retro Sandals,Women Flowers Decor Non Slip Massage Soft Comfy Retro Sandals,,,,,,,,,
MPSFWXE0037,Ditsy Floral Ruffle Peplum Blouse,,<p><b>Style</b>: Boho</p><p><b>Color</b>: Red</p><p><b>Pattern Type</b>: Ditsy Floral</p><p><b>Length</b>: Crop</p><p><b>Season</b>: Summer</p><p><b>Type</b>: Peplum</p><p><b>Details</b>: Ruffle</p><p><b>Fit Type</b>: Regular Fit</p><p><b>Sleeve Length</b>: Sleeveless</p><p><b>Neckline</b>: V neck</p><p><b>Sheer</b>: No</p><p><b>Placket Type</b>: Pullovers</p><p><b>Material</b>: Polyester</p><p><b>Composition</b>: 100% Polyester</p><p><b>Fabric</b>: Slight Stretch</p><p><b>Care Instructions</b>: Machine wash or professional dry clean</p>,img/Blouses/sW210611504573077.jpg,,Size#S:M:L:,29.01,,,,1,1,,,Blouses,,Ditsy Floral Ruffle Peplum Blouse,Ditsy Floral Ruffle Peplum Blouse,Ditsy Floral Ruffle Peplum Blouse,,,,,,,,,
MPSFWXE0038,Ditsy Floral & Plaid Print Shorts,,<p><b>Style</b>: Boho</p><p><b>Color</b>: Green</p><p><b>Pattern Type</b>: Plaid</p><p><b>Pattern Type</b>: Ditsy Floral</p><p><b>Type</b>: Straight Leg</p><p><b>Season</b>: Summer</p><p><b>Details</b>: Knot</p><p><b>Waist Line</b>: High Waist</p><p><b>Fit Type</b>: Regular Fit</p><p><b>Sheer</b>: No</p><p><b>Closure Type</b>: Elastic Waist</p><p><b>Material</b>: Viscose</p><p><b>Composition</b>: 50% Polyester</p><p><b>Composition</b>: 50% Viscose</p><p><b>Fabric</b>: Non-Stretch</p><p><b>Care Instructions</b>: Machine wash or professional dry clean</p>,img/Shorts/swshorts07210508291.jpg,,Size#XS:S:M:L:XL:,22.11,,,,1,1,,,Shorts,,Ditsy Floral & Plaid Print Shorts,Ditsy Floral & Plaid Print Shorts,Ditsy Floral & Plaid Print Shorts,,,,,,,,,
MPSFWXE0039,ROMWE X Tacikworks Stitching Trim Letter Graphic Tank Top,,<p><b>Style</b>: Casual</p><p><b>Color</b>: Coffee Brown</p><p><b>Pattern Type</b>: Letter</p><p><b>Pattern Type</b>: Cartoon</p><p><b>Length</b>: Crop</p><p><b>Season</b>: Summer</p><p><b>Type</b>: Tank</p><p><b>Fit Type</b>: Regular Fit</p><p><b>Neckline</b>: Round Neck</p><p><b>Sheer</b>: No</p><p><b>Material</b>: Polyester</p><p><b>Composition</b>: 65% Polyester</p><p><b>Composition</b>: 35% Cotton</p><p><b>Fabric</b>: High Stretch</p><p><b>Care Instructions</b>: Machine wash or professional dry clean</p><p><b>Style</b>: Casual</p><p><b>Color</b>: Mint Green</p><p><b>Pattern Type</b>: Letter</p><p><b>Pattern Type</b>: Graphic</p><p><b>Length</b>: Crop</p><p><b>Season</b>: Summer</p><p><b>Type</b>: Tank</p><p><b>Neckline</b>: Round Neck</p><p><b>Fit Type</b>: Slim Fit</p><p><b>Sheer</b>: No</p><p><b>Material</b>: Polyester</p><p><b>Composition</b>: 65% Polyester</p><p><b>Composition</b>: 35% Cotton</p><p><b>Fabric</b>: High Stretch</p><p><b>Care Instructions</b>: Machine wash or professional dry clean</p><p><b>Style</b>: Casual</p><p><b>Color</b>: Black</p><p><b>Pattern Type</b>: Letter</p><p><b>Pattern Type</b>: Graphic</p><p><b>Length</b>: Crop</p><p><b>Season</b>: Summer</p><p><b>Type</b>: Tank</p><p><b>Neckline</b>: Round Neck</p><p><b>Fit Type</b>: Slim Fit</p><p><b>Sheer</b>: No</p><p><b>Material</b>: Polyester</p><p><b>Composition</b>: 65% Polyester</p><p><b>Composition</b>: 35% Cotton</p><p><b>Fabric</b>: High Stretch</p><p><b>Care Instructions</b>: Machine wash or professional dry clean</p><p><b>Style</b>: Casual</p><p><b>Color</b>: Red</p><p><b>Pattern Type</b>: Letter</p><p><b>Pattern Type</b>: Graphic</p><p><b>Length</b>: Crop</p><p><b>Season</b>: Summer</p><p><b>Type</b>: Tank</p><p><b>Neckline</b>: Round Neck</p><p><b>Fit Type</b>: Slim Fit</p><p><b>Sheer</b>: No</p><p><b>Material</b>: Polyester</p><p><b>Composition</b>: 65% Polyester</p><p><b>Composition</b>: 35% Cotton</p><p><b>Fabric</b>: High Stretch</p><p><b>Care Instructions</b>: Machine wash or professional dry clean</p><p><b>Style</b>: Casual</p><p><b>Color</b>: Apricot</p><p><b>Pattern Type</b>: Letter</p><p><b>Pattern Type</b>: Cartoon</p><p><b>Length</b>: Crop</p><p><b>Season</b>: Summer</p><p><b>Type</b>: Tank</p><p><b>Fit Type</b>: Regular Fit</p><p><b>Neckline</b>: Round Neck</p><p><b>Sheer</b>: No</p><p><b>Material</b>: Polyester</p><p><b>Composition</b>: 65% Polyester</p><p><b>Composition</b>: 35% Cotton</p><p><b>Fabric</b>: High Stretch</p><p><b>Care Instructions</b>: Machine wash or professional dry clean</p>,img/Tank_Tops__Camis/rwvest25210428884.jpg,,Size#S:M:L:XL:,32.27,,,,1,1,,,Tank Tops & Cam's,,ROMWE X Tacikworks Stitching Trim Letter Graphic Tank Top,ROMWE X Tacikworks Stitching Trim Letter Graphic Tank Top,ROMWE X Tacikworks Stitching Trim Letter Graphic Tank Top,,,,,,,,,
MPSFWXE0040,Elastic Waist A-line Skirt,,<p><b>Style</b>: Elegant</p><p><b>Color</b>: White</p><p><b>Pattern Type</b>: Plain</p><p><b>Length</b>: Long</p><p><b>Type</b>: A Line</p><p><b>Season</b>: Spring/Summer/Fall</p><p><b>Waist Line</b>: High Waist</p><p><b>Sheer</b>: No</p><p><b>Body</b>: Lined</p><p><b>Material</b>: Polyester</p><p><b>Composition</b>: 100% Polyester</p><p><b>Lining</b>: 100% Polyester</p><p><b>Fabric</b>: Non-Stretch</p><p><b>Care Instructions</b>: Machine wash or professional dry clean</p>,img/Skirts/swskirt30210531241.jpg,,Size#S:M:L:XL:,26.8,,,,1,1,,,Skirts,,Elastic Waist A-line Skirt,Elastic Waist A-line Skirt,Elastic Waist A-line Skirt,,,,,,,,,
MPSFWXE0041,18K Gold Plated Zircon Earrings,,"<p>Style: Trendy</p><p>Type: Hoop Earrings</p><p>Material: Gold Plated, Zircon</p><p>Color: Gold</p><p>Diameter: About 1.1cm</p><p>Width: About 0.2cm   </p><p>Weight: About 10g</p>",img/Earrings/SKU298394.jpg,,Size#,17.79,,,,1,1,,,Earrings,,18K Gold Plated Zircon Earrings,18K Gold Plated Zircon Earrings,18K Gold Plated Zircon Earrings,,,,,,,,,
MPSFWXE0042,Disc Charm Layered Necklace,,<p><b>Details</b>: Geometric</p><p><b>Material</b>: Metal</p><p><b>Type</b>: Pendant Necklaces</p><p><b>Details</b>: Round</p><p><b>Type</b>: Layer Sets</p><p><b>Color</b>: Gold</p><p><b>Metal Color</b>: Gold</p><p><b>Style</b>: Casual</p>,img/Pendant_Necklaces/swneck18210105034.jpg,,Size#,22.16,,,,1,1,,,Pendant Necklaces,,Disc Charm Layered Necklace,Disc Charm Layered Necklace,Disc Charm Layered Necklace,,,,,,,,,
MPSFWXE0043,Women Cute Shiba Inu Dog Touch Screen Phone Purse Plush Coin Bag,,"<p>Color:Brown, Blue, Red</p>",img/Wallets/SKUB41667.jpg,,Size#S:,62.33,,,,1,1,,,Wallets,,Women Cute Shiba Inu Dog Touch Screen Phone Purse Plush Coin Bag,Women Cute Shiba Inu Dog Touch Screen Phone Purse Plush Coin Bag,Women Cute Shiba Inu Dog Touch Screen Phone Purse Plush Coin Bag,,,,,,,,,
MPSFWXE0044,Men Casual Breathable Mesh Fabric Non-slip Outdoor Casual Sneakers,,"<p>Color:Black, Brown, Grey</p><p>Upper Material:Mesh, PU</p><p>Outsole Material:Rubber</p><p>Type:Skate Shoes</p><p>Function:Breathable, Hard-wearing, Sport</p><p>Occasion:Outdoor, Sport</p><p>Closure Type:Lace-up</p><p>Season:All Season</p><p>Toe Type:Round</p>",img/Sneakers__Athletic/SKUH24519.jpg,,Size#US 6.5:US 7.5:US 8:US 8.5:US 9:US 10:,52.7,,,,1,1,,,Sneakers & Athletic,,Men Casual Breathable Mesh Fabric Non-slip Outdoor Casual Sneakers,Men Casual Breathable Mesh Fabric Non-slip Outdoor Casual Sneakers,Men Casual Breathable Mesh Fabric Non-slip Outdoor Casual Sneakers,,,,,,,,,
MPSFWXE0045,Women Solid Color Buckle Outdoors Casual Flip Flips,,"<p>Color:Red, Black, Pink, Blue</p><p>Type:Flip Flops</p><p>Closure Type:Slip-On</p><p>Heel Type:Platforms</p><p>Heel Height:1-3cm In Flat</p><p>Toe Type:Clip Toe</p><p>Pattern:Solid</p><p>Design Element:Buckle</p><p>Upper Material:PU</p><p>Style:Casual</p><p>Outsole Material:EVA</p><p>Occasion:Casual</p><p>Function:Soft</p><p>Season:Summer, Spring</p>",img/Slippers/SKUH36793.jpg,,Size#US 5:US 6:US 7:US 8:US 9:US 10:US 11:US 12:,52.97,,,,1,1,,,Slippers,,Women Solid Color Buckle Outdoors Casual Flip Flips,Women Solid Color Buckle Outdoors Casual Flip Flips,Women Solid Color Buckle Outdoors Casual Flip Flips,,,,,,,,,
MPSFWXE0046,Flap-Pocket Plaid Boyfriend Shirt,,<p><b>Style</b>: Casual</p><p><b>Color</b>: Black</p><p><b>Pattern Type</b>: Plaid</p><p><b>Length</b>: Long</p><p><b>Season</b>: Spring/Fall</p><p><b>Type</b>: Shirt</p><p><b>Details</b>: Pocket</p><p><b>Details</b>: Button Front</p><p><b>Neckline</b>: Collar</p><p><b>Sleeve Length</b>: Long Sleeve</p><p><b>Fit Type</b>: Oversized</p><p><b>Sleeve Type</b>: Drop Shoulder</p><p><b>Sheer</b>: No</p><p><b>Placket Type</b>: Placket</p><p><b>Material</b>: Cotton</p><p><b>Composition</b>: 65% Cotton</p><p><b>Composition</b>: 35% Polyester</p><p><b>Fabric</b>: Non-Stretch</p><p><b>Care Instructions</b>: Machine wash or professional dry clean</p>,img/Blouses/rwblouse01201109989.jpg,,Size#XS:S:M:L:XXL:,32.29,,,,1,1,,,Blouses,,Flap-Pocket Plaid Boyfriend Shirt,Flap-Pocket Plaid Boyfriend Shirt,Flap-Pocket Plaid Boyfriend Shirt,,,,,,,,,
MPSFWXE0047,Knot Detail Wide Leg Shorts,,<p><b>Style</b>: Casual</p><p><b>Color</b>: Blue</p><p><b>Pattern Type</b>: Plain</p><p><b>Season</b>: Summer</p><p><b>Type</b>: Track Shorts</p><p><b>Details</b>: Knot</p><p><b>Waist Line</b>: Natural</p><p><b>Fit Type</b>: Regular Fit</p><p><b>Sheer</b>: No</p><p><b>Closure Type</b>: Elastic Waist</p><p><b>Material</b>: Polyester</p><p><b>Composition</b>: 92% Polyester</p><p><b>Composition</b>: 8% Elastane</p><p><b>Fabric</b>: High Stretch</p><p><b>Care Instructions</b>: Machine wash or professional dry clean</p>,img/Shorts/swshorts25210525610.jpg,,Size#XS:S:M:L:,32.2,,,,1,1,,,Shorts,,Knot Detail Wide Leg Shorts,Knot Detail Wide Leg Shorts,Knot Detail Wide Leg Shorts,,,,,,,,,
MPSFWXE0048,Black Triangle Crop Cami Top,,<p><b>Style</b>: Sexy</p><p><b>Color</b>: Black</p><p><b>Pattern Type</b>: Plain</p><p><b>Length</b>: Crop</p><p><b>Season</b>: Summer</p><p><b>Type</b>: Cami</p><p><b>Fit Type</b>: Slim Fit</p><p><b>Neckline</b>: Spaghetti Strap</p><p><b>Sheer</b>: No</p><p><b>Body</b>: Lined</p><p><b>Chest pad</b>: No Padding</p><p><b>Material</b>: Polyester</p><p><b>Composition</b>: 90% Polyester</p><p><b>Composition</b>: 10% Elastane</p><p><b>Fabric</b>: Slight Stretch</p><p><b>Care Instructions</b>: Machine wash or professional dry clean</p>,img/Tank_Tops__Camis/vest170612302.jpg,,Size#S:M:L:,22.07,,,,1,1,,,Tank Tops & Cam's,,Black Triangle Crop Cami Top,Black Triangle Crop Cami Top,Black Triangle Crop Cami Top,,,,,,,,,
MPSFWXE0049,Buckled Tape Corduroy Skirt,,<p><b>Style</b>: Casual</p><p><b>Color</b>: Army Green</p><p><b>Pattern Type</b>: Colorblock</p><p><b>Length</b>: Short</p><p><b>Type</b>: A Line</p><p><b>Season</b>: Spring/Fall</p><p><b>Details</b>: Tape</p><p><b>Waist Line</b>: High Waist</p><p><b>Sheer</b>: No</p><p><b>Body</b>: Unlined</p><p><b>Material</b>: Corduroy</p><p><b>Composition</b>: 100% Polyester</p><p><b>Fabric</b>: Non-Stretch</p><p><b>Care Instructions</b>: Machine wash or professional dry clean</p>,img/Skirts/swskirt23210609644.jpg,,Size#S:M:L:XL:,28.32,,,,1,1,,,Skirts,,Buckled Tape Corduroy Skirt,Buckled Tape Corduroy Skirt,Buckled Tape Corduroy Skirt,,,,,,,,,
MPSFWXE0050,1 Pair LED Christmas Ear Studs Stainless Steel Zircon Unisex Stud Earrings for Women,,"<p>Weight: About 5g</p><p>
	Zircon Size: About 0.7cm</p>",img/Earrings/SKU095242.jpg,,Size#,25.85,,,,1,1,,,Earrings,,1 Pair LED Christmas Ear Studs Stainless Steel Zircon Unisex Stud Earrings for Women,1 Pair LED Christmas Ear Studs Stainless Steel Zircon Unisex Stud Earrings for Women,1 Pair LED Christmas Ear Studs Stainless Steel Zircon Unisex Stud Earrings for Women,,,,,,,,,
MPSFWXE0051,1pc Letter Charm Necklace,,<p><b>Composition</b>: 100% Alloy</p><p><b>Type</b>: Pendant Necklaces</p><p><b>Color</b>: Gold</p><p><b>Metal Color</b>: Gold</p><p><b>Style</b>: Casual</p>,img/Pendant_Necklaces/swneck03191210138.jpg,,Size#,17.31,,,,1,1,,,Pendant Necklaces,,1pc Letter Charm Necklace,1pc Letter Charm Necklace,1pc Letter Charm Necklace,,,,,,,,,
MPSFWXE0052,Crocodile Cowhide Wallet Vintage Casual Short Wallet For Women,,"<p>Color:Orange, Coffee, Black, Red</p><p>Style:Casual, Business, Vintage</p>",img/Wallets/SKU975002.jpg,,Size#,63.72,,,,1,1,,,Wallets,,Crocodile Cowhide Wallet Vintage Casual Short Wallet For Women,Crocodile Cowhide Wallet Vintage Casual Short Wallet For Women,Crocodile Cowhide Wallet Vintage Casual Short Wallet For Women,,,,,,,,,
MPSFWXE0053,Men Steel Toe Cap Mesh Breather Soft Slip Resistant Work Safety Shoes,,"<p>Color:Black</p><p>Upper Material:Cloth</p><p>Outsole Material:Rubber</p><p>Type:Safety Shoes</p><p>Function:Protect toes, Slip Resistant</p><p>Occasion:Outdoor</p><p>Closure Type:Lace-up</p><p>Season:All Season</p><p>Toe Type:Round</p>",img/Sneakers__Athletic/SKUD71604.jpg,,Size#US 6.5:US 7.5:US 8:US 8.5:US 9:US 10:US 10.5:US 11:,56.85,,,,1,1,,,Sneakers & Athletic,,Men Steel Toe Cap Mesh Breather Soft Slip Resistant Work Safety Shoes,Men Steel Toe Cap Mesh Breather Soft Slip Resistant Work Safety Shoes,Men Steel Toe Cap Mesh Breather Soft Slip Resistant Work Safety Shoes,,,,,,,,,
MPSFWXE0054,EVA Clip Toe Flip Flops High Heels Platform Beach Slippers,,"<p>Color:Black, Pink, White</p><p>Type:ClipToe Slippers</p><p>Closure Type:Slip-On</p><p>Heel Type:Wedges Heel</p><p>Heel Height:5-8cm In Heel</p><p>Toe Type:Clip Toe</p><p>Pattern:Solid</p><p>Design Element:Simple</p><p>Upper Material:EVA Foam</p><p>Style:Casual</p><p>Outsole Material:EVA</p><p>Structure:Clip Toe</p><p>Occasion:Beach, Home</p><p>Function:Breathable, Soft</p><p>Season:Summer</p>",img/Slippers/SKU434478.jpg,,Size#36:37:38:39:,60.88,,,,1,1,,,Slippers,,EVA Clip Toe Flip Flops High Heels Platform Beach Slippers,EVA Clip Toe Flip Flops High Heels Platform Beach Slippers,EVA Clip Toe Flip Flops High Heels Platform Beach Slippers,,,,,,,,,
MPSFWXE0055,Off Shoulder Mixed Media Button Front Blouse,,<p><b>Style</b>: Casual</p><p><b>Color</b>: Black and White</p><p><b>Pattern Type</b>: Colorblock</p><p><b>Length</b>: Regular</p><p><b>Season</b>: Spring/Fall</p><p><b>Type</b>: Top</p><p><b>Details</b>: Asymmetrical</p><p><b>Details</b>: Button</p><p><b>Sleeve Length</b>: Long Sleeve</p><p><b>Neckline</b>: Off the Shoulder</p><p><b>Fit Type</b>: Regular Fit</p><p><b>Sleeve Type</b>: Regular Sleeve</p><p><b>Sheer</b>: No</p><p><b>Hem Shaped</b>: Asymmetrical</p><p><b>Placket Type</b>: Pullovers</p><p><b>Material</b>: Polyester</p><p><b>Composition</b>: 95% Polyester</p><p><b>Composition</b>: 5% Spandex</p><p><b>Fabric</b>: Slight Stretch</p><p><b>Care Instructions</b>: Machine wash or professional dry clean</p>,img/Blouses/swblouse04191018556.jpg,,Size#XS:S:M:L:,24.45,,,,1,1,,,Blouses,,Off Shoulder Mixed Media Button Front Blouse,Off Shoulder Mixed Media Button Front Blouse,Off Shoulder Mixed Media Button Front Blouse,,,,,,,,,
MPSFWXE0056,Slant Pocket Wide Leg Shorts,,<p><b>Style</b>: Casual</p><p><b>Color</b>: White</p><p><b>Pattern Type</b>: Plain</p><p><b>Season</b>: Summer</p><p><b>Type</b>: Track Shorts</p><p><b>Details</b>: Pocket</p><p><b>Waist Line</b>: High Waist</p><p><b>Fit Type</b>: Loose</p><p><b>Sheer</b>: No</p><p><b>Closure Type</b>: Elastic Waist</p><p><b>Material</b>: Cotton</p><p><b>Composition</b>: 78% Cotton</p><p><b>Composition</b>: 17% Polyester</p><p><b>Composition</b>: 5% Elastane</p><p><b>Fabric</b>: Slight Stretch</p><p><b>Care Instructions</b>: Machine wash or professional dry clean</p>,img/Shorts/swshorts07210525209.jpg,,Size#XS:S:M:L:XL:,31.38,,,,1,1,,,Shorts,,Slant Pocket Wide Leg Shorts,Slant Pocket Wide Leg Shorts,Slant Pocket Wide Leg Shorts,,,,,,,,,
MPSFWXE0057,Solid Double V-Neck Fitted Cami Top,,<p><b>Style</b>: Basics</p><p><b>Color</b>: White</p><p><b>Pattern Type</b>: Plain</p><p><b>Length</b>: Regular</p><p><b>Season</b>: Summer</p><p><b>Type</b>: Cami</p><p><b>Fit Type</b>: Slim Fit</p><p><b>Neckline</b>: Spaghetti Strap</p><p><b>Composition</b>: 90% Rayon</p><p><b>Composition</b>: 10% Spandex</p><p><b>Fabric</b>: High Stretch</p><p><b>Care Instructions</b>: Machine wash or professional dry clean</p><p><b>Style</b>: Casual</p><p><b>Color</b>: Black</p><p><b>Pattern Type</b>: Plain</p><p><b>Length</b>: Regular</p><p><b>Season</b>: Summer</p><p><b>Type</b>: Cami</p><p><b>Fit Type</b>: Slim Fit</p><p><b>Neckline</b>: Spaghetti Strap</p><p><b>Neckline</b>: V neck</p><p><b>Material</b>: Rayon</p><p><b>Composition</b>: 90% Rayon</p><p><b>Composition</b>: 10% Spandex</p><p><b>Fabric</b>: High Stretch</p><p><b>Care Instructions</b>: Machine wash or professional dry clean</p>,img/Tank_Tops__Camis/swvest07190311253.jpg,,Size#XS:S:M:L:,26.81,,,,1,1,,,Tank Tops & Cam's,,Solid Double V-Neck Fitted Cami Top,Solid Double V-Neck Fitted Cami Top,Solid Double V-Neck Fitted Cami Top,,,,,,,,,
MPSFWXE0058,Solid Ruffle Hem Skirt,,<p><b>Style</b>: Casual</p><p><b>Color</b>: Black</p><p><b>Pattern Type</b>: Plain</p><p><b>Length</b>: Mini</p><p><b>Type</b>: Layered/Tiered</p><p><b>Season</b>: Summer</p><p><b>Details</b>: Lace Up</p><p><b>Details</b>: Ruffle Hem</p><p><b>Waist Line</b>: Natural</p><p><b>Sheer</b>: No</p><p><b>Material</b>: Cotton</p><p><b>Composition</b>: 65% Cotton</p><p><b>Composition</b>: 35% Polyester</p><p><b>Fabric</b>: Non-Stretch</p><p><b>Care Instructions</b>: Machine wash or professional dry clean</p>,img/Skirts/sW210611333086366.jpg,,Size#S:M:L:,28.11,,,,1,1,,,Skirts,,Solid Ruffle Hem Skirt,Solid Ruffle Hem Skirt,Solid Ruffle Hem Skirt,,,,,,,,,
MPSFWXE0059,Stylish Trendy Star Sun Moon Rhinestone Crystal Stellar Dangle Earrings for Women Bohemian Jewelry,,<p>Sun: About 8.5cm x 3.5cm</p>,img/Earrings/SKU176194.jpg,,Size#,21.87,,,,1,1,,,Earrings,,Stylish Trendy Star Sun Moon Rhinestone Crystal Stellar Dangle Earrings for Women Bohemian Jewelry,Stylish Trendy Star Sun Moon Rhinestone Crystal Stellar Dangle Earrings for Women Bohemian Jewelry,Stylish Trendy Star Sun Moon Rhinestone Crystal Stellar Dangle Earrings for Women Bohemian Jewelry,,,,,,,,,
MPSFWXE0060,4pcs Geo Charm Layered Chain Necklace,,<p><b>Details</b>: Geometric</p><p><b>Type</b>: Pendant Necklaces</p><p><b>Material</b>: Alloy</p><p><b>Type</b>: Chain Necklaces</p><p><b>Color</b>: Silver</p><p><b>Metal Color</b>: Silver</p><p><b>Style</b>: Casual</p>,img/Pendant_Necklaces/swneck18200818396.jpg,,Size#,22.01,,,,1,1,,,Pendant Necklaces,,4pcs Geo Charm Layered Chain Necklace,4pcs Geo Charm Layered Chain Necklace,4pcs Geo Charm Layered Chain Necklace,,,,,,,,,
MPSFWXE0061,Women Genuine Leather Anti-theft Travel Wallet Multi-function Ticket Holder ID Card Wallet,,"<p>Color:Camel, Green, Black, Blue</p><p>Wallets Style:Zipper</p><p>Wallet Type:Money Clip, ID Wallets, Coin Purse</p><p>Style:Casual</p><p>Pattern:Solid</p>",img/Wallets/SKUF67826.jpg,,Size#,68.69,,,,1,1,,,Wallets,,Women Genuine Leather Anti-theft Travel Wallet Multi-function Ticket Holder ID Card Wallet,Women Genuine Leather Anti-theft Travel Wallet Multi-function Ticket Holder ID Card Wallet,Women Genuine Leather Anti-theft Travel Wallet Multi-function Ticket Holder ID Card Wallet,,,,,,,,,
MPSFWXE0062,Men British Style Brogue Lace Up Leathers Casual Sneakers,,"<p>Color:Black, Brown, Grey</p><p>Upper Material:PU</p><p>Outsole Material:Rubber</p><p>Function:Soft, Slip Resistant</p><p>Occasion:Daily</p><p>Closure Type:Lace-up</p><p>Toe Type:Round</p>",img/Sneakers__Athletic/SKUF74675.jpg,,Size#US 6.5:US 7.5:US 8:US 8.5:US 9:US 10:,64.47,,,,1,1,,,Sneakers & Athletic,,Men British Style Brogue Lace Up Leathers Casual Sneakers,Men British Style Brogue Lace Up Leathers Casual Sneakers,Men British Style Brogue Lace Up Leathers Casual Sneakers,,,,,,,,,
MPSFWXE0063,Women Large Size Two Part Open Toe Comfy Flat Slippers,,"<p>Color:Beige, Black, Pink, White, Blue</p><p>Heel Type:Flat</p><p>Toe Type:Opened</p><p>Upper Material:PU</p><p>Outsole Material:EVA</p><p>Function:Breathable, Soft</p><p>Season:Summer</p>",img/Slippers/SKUE51662.jpg,,Size#US 5:US 6:US 7:US 8:US 9:US 10:US 11:US 12:,51.25,,,,1,1,,,Slippers,,Women Large Size Two Part Open Toe Comfy Flat Slippers,Women Large Size Two Part Open Toe Comfy Flat Slippers,Women Large Size Two Part Open Toe Comfy Flat Slippers,,,,,,,,,
MPSFWXE0064,Off Shoulder Lantern Sleeve Crop Top,,<p><b>Style</b>: Glamorous</p><p><b>Color</b>: White</p><p><b>Pattern Type</b>: Plain</p><p><b>Length</b>: Crop</p><p><b>Season</b>: Spring/Summer</p><p><b>Type</b>: Top</p><p><b>Details</b>: Zipper</p><p><b>Sleeve Type</b>: Bishop Sleeve</p><p><b>Sleeve Length</b>: Long Sleeve</p><p><b>Neckline</b>: Off the Shoulder</p><p><b>Fit Type</b>: Slim Fit</p><p><b>Sheer</b>: No</p><p><b>Hem Shaped</b>: Tight Hem</p><p><b>Placket Type</b>: Pullovers</p><p><b>Material</b>: Cotton</p><p><b>Composition</b>: 97% Cotton</p><p><b>Composition</b>: 3% Spandex</p><p><b>Fabric</b>: Slight Stretch</p><p><b>Care Instructions</b>: Machine wash or professional dry clean</p>,img/Blouses/swblouse07200709746.jpg,,Size#XS:S:M:L:,32.55,,,,1,1,,,Blouses,,Off Shoulder Lantern Sleeve Crop Top,Off Shoulder Lantern Sleeve Crop Top,Off Shoulder Lantern Sleeve Crop Top,,,,,,,,,
MPSFWXE0065,Contrast Binding Butterfly Print Track Shorts,,<p><b>Style</b>: Casual</p><p><b>Color</b>: Multicolor</p><p><b>Pattern Type</b>: Animal</p><p><b>Type</b>: Track Shorts</p><p><b>Season</b>: Spring/Summer/Fall</p><p><b>Details</b>: Knot</p><p><b>Details</b>: Contrast Binding</p><p><b>Waist Line</b>: High Waist</p><p><b>Fit Type</b>: Regular Fit</p><p><b>Sheer</b>: No</p><p><b>Closure Type</b>: Elastic Waist</p><p><b>Material</b>: Polyester</p><p><b>Composition</b>: 95% Polyester</p><p><b>Composition</b>: 5% Spandex</p><p><b>Fabric</b>: Non-Stretch</p><p><b>Care Instructions</b>: Machine wash or professional dry clean</p>,img/Shorts/swshorts07201228130.jpg,,Size#XS:S:M:L:XL:,28.94,,,,1,1,,,Shorts,,Contrast Binding Butterfly Print Track Shorts,Contrast Binding Butterfly Print Track Shorts,Contrast Binding Butterfly Print Track Shorts,,,,,,,,,
MPSFWXE0066,Chain Detail Halter Neck Top,,<p><b>Style</b>: Glamorous</p><p><b>Color</b>: Black</p><p><b>Pattern Type</b>: Plain</p><p><b>Length</b>: Crop</p><p><b>Season</b>: All</p><p><b>Type</b>: Halter</p><p><b>Details</b>: Asymmetrical</p><p><b>Details</b>: Chain</p><p><b>Neckline</b>: Halter</p><p><b>Fit Type</b>: Slim Fit</p><p><b>Sheer</b>: No</p><p><b>Hem Shaped</b>: Asymmetrical</p><p><b>Material</b>: Velvet</p><p><b>Composition</b>: 95% Polyester</p><p><b>Composition</b>: 5% Spandex</p><p><b>Fabric</b>: Slight Stretch</p><p><b>Care Instructions</b>: Machine wash or professional dry clean</p>,img/Tank_Tops__Camis/swvest07201116158.jpg,,Size#XS:S:M:L:XL:,28.92,,,,1,1,,,Tank Tops & Cam's,,Chain Detail Halter Neck Top,Chain Detail Halter Neck Top,Chain Detail Halter Neck Top,,,,,,,,,
