v_sku,v_name,v_short_description,v_description,v_image,v_url,v_attribute,v_price,v_specials_price,v_specials_expire_date,v_date_added,v_in_stock,v_status,v_viewed,v_ordered,v_category_sku,v_sort_order,v_meta_title,v_meta_keywords,v_meta_description,v_brand_filter,v_class_filter,v_color_filter,v_gender_filter,v_material_filter,v_year_filter,v_origin_filter,v_series_filter,v_spec_filter
MPSFWXE0136,Plaid Button Front Crop Blouse,,<p><b>Style</b>: Preppy</p><p><b>Color</b>: Black</p><p><b>Pattern Type</b>: Plaid</p><p><b>Length</b>: Crop</p><p><b>Season</b>: Spring/Fall</p><p><b>Type</b>: Shirt</p><p><b>Details</b>: Button Front</p><p><b>Neckline</b>: Collar</p><p><b>Sleeve Length</b>: Long Sleeve</p><p><b>Fit Type</b>: Regular Fit</p><p><b>Sleeve Type</b>: Drop Shoulder</p><p><b>Sheer</b>: No</p><p><b>Material</b>: Polyester</p><p><b>Composition</b>: 100% Polyester</p><p><b>Fabric</b>: Non-Stretch</p><p><b>Care Instructions</b>: Machine wash or professional dry clean</p>,img/Blouses/rwblouse25210604271.jpg,,Size#S:M:L:XL:,24.64,,,,1,1,,,Blouses,,Plaid Button Front Crop Blouse,Plaid Button Front Crop Blouse,Plaid Button Front Crop Blouse,,,,,,,,,
MPSFWXE0137,Striped Tie Front Shorts,,<p><b>Style</b>: Boho</p><p><b>Color</b>: Multicolor</p><p><b>Pattern Type</b>: Striped</p><p><b>Season</b>: Summer</p><p><b>Type</b>: Wide Leg</p><p><b>Details</b>: Paper Bag Waist</p><p><b>Waist Line</b>: High Waist</p><p><b>Fit Type</b>: Loose</p><p><b>Sheer</b>: No</p><p><b>Closure Type</b>: Elastic Waist</p><p><b>Belt</b>: Yes</p><p><b>Material</b>: Polyester</p><p><b>Composition</b>: 100% Polyester</p><p><b>Fabric</b>: Non-Stretch</p><p><b>Care Instructions</b>: Machine wash or professional dry clean</p>,img/Shorts/swshorts23210129419.jpg,,Size#S:M:L:XL:,27.39,,,,1,1,,,Shorts,,Striped Tie Front Shorts,Striped Tie Front Shorts,Striped Tie Front Shorts,,,,,,,,,
MPSFWXE0138,Contrast Lace Ruched Bust Cami,,<p><b>Style</b>: Casual</p><p><b>Color</b>: Pink</p><p><b>Pattern Type</b>: Ditsy Floral</p><p><b>Length</b>: Crop</p><p><b>Season</b>: Summer</p><p><b>Type</b>: Cami</p><p><b>Details</b>: Contrast Lace</p><p><b>Details</b>: Ruched Bust</p><p><b>Fit Type</b>: Regular Fit</p><p><b>Neckline</b>: Spaghetti Strap</p><p><b>Sheer</b>: No</p><p><b>Material</b>: Polyester</p><p><b>Composition</b>: 97% Polyester</p><p><b>Composition</b>: 3% Elastane</p><p><b>Fabric</b>: Medium Stretch</p><p><b>Care Instructions</b>: Machine wash or professional dry clean</p><p><b>Style</b>: Casual</p><p><b>Color</b>: Coral Orange</p><p><b>Length</b>: Crop</p><p><b>Season</b>: Summer</p><p><b>Type</b>: Cami</p><p><b>Details</b>: Contrast Lace</p><p><b>Details</b>: Ruched Bust</p><p><b>Fit Type</b>: Regular Fit</p><p><b>Neckline</b>: Spaghetti Strap</p><p><b>Sheer</b>: No</p><p><b>Material</b>: Polyester</p><p><b>Composition</b>: 97% Polyester</p><p><b>Composition</b>: 3% Elastane</p><p><b>Fabric</b>: Medium Stretch</p><p><b>Care Instructions</b>: Machine wash or professional dry clean</p><p><b>Style</b>: Casual</p><p><b>Color</b>: Multicolor</p><p><b>Length</b>: Crop</p><p><b>Season</b>: Summer</p><p><b>Type</b>: Cami</p><p><b>Details</b>: Contrast Lace</p><p><b>Details</b>: Ruched Bust</p><p><b>Fit Type</b>: Regular Fit</p><p><b>Neckline</b>: Spaghetti Strap</p><p><b>Sheer</b>: No</p><p><b>Material</b>: Polyester</p><p><b>Composition</b>: 97% Polyester</p><p><b>Composition</b>: 3% Elastane</p><p><b>Fabric</b>: Medium Stretch</p><p><b>Care Instructions</b>: Machine wash or professional dry clean</p>,img/Tank_Tops__Camis/rwvest25210513281.jpg,,Size#S:M:L:,32.89,,,,1,1,,,Tank Tops & Cam's,,Contrast Lace Ruched Bust Cami,Contrast Lace Ruched Bust Cami,Contrast Lace Ruched Bust Cami,,,,,,,,,
MPSFWXE0139,Frill Trim Dobby Mesh Skirt,,<p><b>Style</b>: Casual</p><p><b>Color</b>: White</p><p><b>Pattern Type</b>: Plain</p><p><b>Length</b>: Long</p><p><b>Type</b>: A Line</p><p><b>Season</b>: Spring/Summer/Fall</p><p><b>Details</b>: Frill</p><p><b>Waist Line</b>: High Waist</p><p><b>Sheer</b>: Semi-Sheer</p><p><b>Material</b>: Polyester</p><p><b>Composition</b>: 100% Polyester</p><p><b>Fabric</b>: Non-Stretch</p><p><b>Care Instructions</b>: Machine wash or professional dry clean</p>,img/Skirts/swskirt30210428333.jpg,,Size#S:M:L:XL:,32.47,,,,1,1,,,Skirts,,Frill Trim Dobby Mesh Skirt,Frill Trim Dobby Mesh Skirt,Frill Trim Dobby Mesh Skirt,,,,,,,,,
MPSFWXE0140,Vintage Animal Printed Women Earrings Cat Dog Glass Pendant Earrings,,"<p>Style: Vintage</p><p>Type: Earrings</p><p>Color: Bronze</p><p>Weight: 12g</p><p>Size: About 1.6 cm / 0.63 in</p><p>Material: Alloy, Glass</p><p>1 x Earrings</p>",img/Earrings/SKUG60829.jpg,,Size#,15.29,,,,1,1,,,Earrings,,Vintage Animal Printed Women Earrings Cat Dog Glass Pendant Earrings,Vintage Animal Printed Women Earrings Cat Dog Glass Pendant Earrings,Vintage Animal Printed Women Earrings Cat Dog Glass Pendant Earrings,,,,,,,,,
MPSFWXE0141,Open and Close Photos Geometric Pendant Necklace 1pc,,<p><b>Composition</b>: 100% Alloy</p><p><b>Type</b>: Pendant Necklaces</p><p><b>Color</b>: Gold</p><p><b>Metal Color</b>: Gold</p><p><b>Style</b>: Casual</p>,img/Pendant_Necklaces/swneck03190828200.jpg,,Size#,19.2,,,,1,1,,,Pendant Necklaces,,Open and Close Photos Geometric Pendant Necklace 1pc,Open and Close Photos Geometric Pendant Necklace 1pc,Open and Close Photos Geometric Pendant Necklace 1pc,,,,,,,,,
MPSFWXE0142,National Style Genuine Leather Trifold Long Wallet Card Holder Phone Bag Purse For Women,,"<p>Color:Coffee, Blue</p><p>Style:Vintage</p>",img/Wallets/SKU782719.jpg,,Size#,72.88,,,,1,1,,,Wallets,,National Style Genuine Leather Trifold Long Wallet Card Holder Phone Bag Purse For Women,National Style Genuine Leather Trifold Long Wallet Card Holder Phone Bag Purse For Women,National Style Genuine Leather Trifold Long Wallet Card Holder Phone Bag Purse For Women,,,,,,,,,
MPSFWXE0143,Men Street Breathable Microfiber Leather Comfy Wearable Lace Up Casual Sneakers,,"<p>Color:Black, White, Khaki</p><p>Upper Material:PU</p><p>Outsole Material:PVC</p><p>Type:Skate Shoes</p><p>Function:Breathable, Soft, Slip Resistant</p><p>Occasion:Daily, Sport</p><p>Closure Type:Lace-up</p><p>Season:Summer, Spring&Fall</p><p>Toe Type:Round</p>",img/Sneakers__Athletic/SKUH25782.jpg,,Size#US 6.5:US 7.5:US 8:US 8.5:US 9:US 10:,58.5,,,,1,1,,,Sneakers & Athletic,,Men Street Breathable Microfiber Leather Comfy Wearable Lace Up Casual Sneakers,Men Street Breathable Microfiber Leather Comfy Wearable Lace Up Casual Sneakers,Men Street Breathable Microfiber Leather Comfy Wearable Lace Up Casual Sneakers,,,,,,,,,
MPSFWXE0144,Women Square Toe Retro Knitted Casual Double Band Stripe Slippers,,"<p>Color:Red, Black, Brown, White</p><p>Type:Stripe Slippers</p><p>Closure Type:Slip-On</p><p>Heel Type:Flat</p><p>Heel Height:1-3cm In Flat</p><p>Toe Type:Square</p><p>Pattern:Solid</p><p>Design Element:Pattern</p><p>Upper Material:Knitted</p><p>Style:Casual, Retro</p><p>Outsole Material:PU</p><p>Structure:Double Band</p><p>Occasion:Holiday, Home, Casual</p><p>Function:Breathable</p><p>Season:Summer, Autumn, Spring</p>",img/Slippers/SKUH76608.jpg,,Size#US 5:US 6:US 7:US 8:US 9:US 10:US 11:US 12:,65.36,,,,1,1,,,Slippers,,Women Square Toe Retro Knitted Casual Double Band Stripe Slippers,Women Square Toe Retro Knitted Casual Double Band Stripe Slippers,Women Square Toe Retro Knitted Casual Double Band Stripe Slippers,,,,,,,,,
MPSFWXE0145,Plaid Button Front Drawstring Blouse,,<p><b>Style</b>: Preppy</p><p><b>Color</b>: Multicolor</p><p><b>Pattern Type</b>: Plaid</p><p><b>Length</b>: Regular</p><p><b>Season</b>: Spring/Fall</p><p><b>Type</b>: Shirt</p><p><b>Details</b>: Drawstring</p><p><b>Details</b>: Pocket</p><p><b>Details</b>: Button Front</p><p><b>Neckline</b>: Hooded</p><p><b>Sleeve Length</b>: Long Sleeve</p><p><b>Fit Type</b>: Regular Fit</p><p><b>Sleeve Type</b>: Drop Shoulder</p><p><b>Sheer</b>: No</p><p><b>Placket Type</b>: Placket</p><p><b>Belt</b>: No</p><p><b>Body</b>: Unlined</p><p><b>Material</b>: Cotton</p><p><b>Composition</b>: 65% Cotton</p><p><b>Composition</b>: 35% Polyester</p><p><b>Fabric</b>: Non-Stretch</p><p><b>Care Instructions</b>: Machine wash or professional dry clean</p>,img/Blouses/rwblouse00201110797.jpg,,Size#S:M:L:XL:,31.99,,,,1,1,,,Blouses,,Plaid Button Front Drawstring Blouse,Plaid Button Front Drawstring Blouse,Plaid Button Front Drawstring Blouse,,,,,,,,,
MPSFWXE0146,Floral And Galaxy Print Drawstring Track Shorts,,<p><b>Style</b>: Casual</p><p><b>Color</b>: Dark Grey</p><p><b>Pattern Type</b>: Floral</p><p><b>Pattern Type</b>: Galaxy</p><p><b>Season</b>: Summer</p><p><b>Type</b>: Track Shorts</p><p><b>Details</b>: Drawstring</p><p><b>Details</b>: Pocket</p><p><b>Waist Line</b>: High Waist</p><p><b>Fit Type</b>: Regular Fit</p><p><b>Sheer</b>: No</p><p><b>Closure Type</b>: Drawstring Waist</p><p><b>Body</b>: Unlined</p><p><b>Material</b>: Polyester</p><p><b>Composition</b>: 95% Polyester</p><p><b>Composition</b>: 5% Elastane</p><p><b>Fabric</b>: Non-Stretch</p><p><b>Care Instructions</b>: Machine wash or professional dry clean</p>,img/Shorts/swshorts23210507273.jpg,,Size#S:M:L:XL:,30.3,,,,1,1,,,Shorts,,Floral And Galaxy Print Drawstring Track Shorts,Floral And Galaxy Print Drawstring Track Shorts,Floral And Galaxy Print Drawstring Track Shorts,,,,,,,,,
MPSFWXE0147,Daisy Contrast Binding Crop Cami,,<p><b>Style</b>: Casual</p><p><b>Color</b>: Black</p><p><b>Pattern Type</b>: Floral</p><p><b>Length</b>: Crop</p><p><b>Season</b>: Summer</p><p><b>Type</b>: Cami</p><p><b>Details</b>: Appliques</p><p><b>Details</b>: Rib-Knit</p><p><b>Details</b>: Contrast Binding</p><p><b>Fit Type</b>: Slim Fit</p><p><b>Neckline</b>: Straps</p><p><b>Sheer</b>: No</p><p><b>Material</b>: Polyester</p><p><b>Composition</b>: 95% Polyester</p><p><b>Composition</b>: 5% Elastane</p><p><b>Fabric</b>: High Stretch</p><p><b>Care Instructions</b>: Machine wash or professional dry clean</p>,img/Tank_Tops__Camis/rwvest25210429924.jpg,,Size#XS:S:M:L:,23.55,,,,1,1,,,Tank Tops & Cam's,,Daisy Contrast Binding Crop Cami,Daisy Contrast Binding Crop Cami,Daisy Contrast Binding Crop Cami,,,,,,,,,
MPSFWXE0148,Paper Clip Decor Split Skirt,,<p><b>Style</b>: Sexy</p><p><b>Color</b>: Black</p><p><b>Pattern Type</b>: Plain</p><p><b>Length</b>: Mini</p><p><b>Type</b>: Bodycon</p><p><b>Season</b>: Summer</p><p><b>Waist Line</b>: High Waist</p><p><b>Sheer</b>: No</p><p><b>Material</b>: Polyester</p><p><b>Composition</b>: 80% Polyester</p><p><b>Composition</b>: 20% Cotton</p><p><b>Fabric</b>: Slight Stretch</p><p><b>Care Instructions</b>: Machine wash or professional dry clean</p>,img/Skirts/rwskirt25210506425.jpg,,Size#S:M:L:,23.56,,,,1,1,,,Skirts,,Paper Clip Decor Split Skirt,Paper Clip Decor Split Skirt,Paper Clip Decor Split Skirt,,,,,,,,,
MPSFWXE0149,925 Sterling Silver Vintage Earrings Magnolia Long Flower Dangle Earrings Ethnic Jewelry for Women,,"<p>Style: Vintage</p><p>
	Type: Dangle Earrings</p><p>Main Color: Silver</p><p>Weight: About 4.5g</p><p>Size: About 5.3cm x 2cm / 2.08' x 0.78'</p><p>Material: S925 Silver,</p><p> Platinum Plating, Gold Plating</p><p>1 Pair of Earrings</p>",img/Earrings/SKU534053.jpg,,Size#,27.65,,,,1,1,,,Earrings,,925 Sterling Silver Vintage Earrings Magnolia Long Flower Dangle Earrings Ethnic Jewelry for Women,925 Sterling Silver Vintage Earrings Magnolia Long Flower Dangle Earrings Ethnic Jewelry for Women,925 Sterling Silver Vintage Earrings Magnolia Long Flower Dangle Earrings Ethnic Jewelry for Women,,,,,,,,,
MPSFWXE0150,Heart Pendant Necklace,,<p><b>Details</b>: Heart</p><p><b>Material</b>: Metal</p><p><b>Type</b>: Pendant Necklaces</p><p><b>Color</b>: Gold</p><p><b>Metal Color</b>: Gold</p><p><b>Style</b>: Fashionable</p>,img/Pendant_Necklaces/rwneck18210519189.jpg,,Size#,14.54,,,,1,1,,,Pendant Necklaces,,Heart Pendant Necklace,Heart Pendant Necklace,Heart Pendant Necklace,,,,,,,,,
MPSFWXE0151,IPRee Oxford Waterproof Card Holder Multifunctional Travel Passport Cover Storage Wallet,,<p>Color:Multicolor</p>,img/Wallets/SKU741344.jpg,,Size#,69.64,,,,1,1,,,Wallets,,IPRee Oxford Waterproof Card Holder Multifunctional Travel Passport Cover Storage Wallet,IPRee Oxford Waterproof Card Holder Multifunctional Travel Passport Cover Storage Wallet,IPRee Oxford Waterproof Card Holder Multifunctional Travel Passport Cover Storage Wallet,,,,,,,,,
MPSFWXE0152,Men Knitted Fabric Non Slip Working Casual Safety Shoes,,"<p>Color:Black, Blue, Khaki</p><p>Upper Material:Cloth, Knitted</p><p>Outsole Material:Rubber</p><p>Function:Slip Resistant</p><p>Occasion:Daily</p><p>Closure Type:Lace-up</p><p>Toe Type:Round</p>",img/Sneakers__Athletic/SKUD44572.jpg,,Size#US 6.5:US 7.5:US 8:US 8.5:US 9:US 10:US 10.5:US 11:US 11.5:US 12:,65.21,,,,1,1,,,Sneakers & Athletic,,Men Knitted Fabric Non Slip Working Casual Safety Shoes,Men Knitted Fabric Non Slip Working Casual Safety Shoes,Men Knitted Fabric Non Slip Working Casual Safety Shoes,,,,,,,,,
MPSFWXE0153,Big Size Hollow Out Breathable Open Heel Slip On Flat Casual Beach Sandals,,"<p>Color:Green, Red, Black, White, Blue</p><p>Closure Type:Slip-On</p><p>Heel Type:Flat</p><p>Heel Height:1-3cm In Flat</p><p>Toe Type:Closed Toe</p><p>Pattern:Cartoon</p><p>Design Element:Ripped</p><p>Upper Material:EVA Foam</p><p>Style:Casual</p><p>Outsole Material:EVA</p><p>Structure:Slip-On</p><p>Occasion:Beach, Home</p><p>Function:Breathable, Soft</p><p>Season:Summer, Autumn, Spring</p>",img/Slippers/SKU434946.jpg,,Size#US 5:US 6:US 7:US 8:US 9:US 10:US 11:US 12:US 13:,51.5,,,,1,1,,,Slippers,,Big Size Hollow Out Breathable Open Heel Slip On Flat Casual Beach Sandals,Big Size Hollow Out Breathable Open Heel Slip On Flat Casual Beach Sandals,Big Size Hollow Out Breathable Open Heel Slip On Flat Casual Beach Sandals,,,,,,,,,
MPSFWXE0154,Schiffy Drawstring Crop Top,,<p><b>Style</b>: Boho</p><p><b>Color</b>: White</p><p><b>Pattern Type</b>: Plain</p><p><b>Length</b>: Crop</p><p><b>Season</b>: Summer</p><p><b>Type</b>: Top</p><p><b>Details</b>: Drawstring</p><p><b>Details</b>: Shirred</p><p><b>Details</b>: Eyelet Embroidery</p><p><b>Sleeve Type</b>: Flounce Sleeve</p><p><b>Sleeve Length</b>: Short Sleeve</p><p><b>Fit Type</b>: Slim Fit</p><p><b>Neckline</b>: Sweetheart</p><p><b>Sheer</b>: No</p><p><b>Placket Type</b>: Pullovers</p><p><b>Material</b>: Schiffy</p><p><b>Composition</b>: 65% Cotton</p><p><b>Composition</b>: 35% Polyester</p><p><b>Fabric</b>: Non-Stretch</p><p><b>Care Instructions</b>: Machine wash or professional dry clean</p>,img/Blouses/rwblouse03190426314.jpg,,Size#XS:S:M:L:XL:,31.29,,,,1,1,,,Blouses,,Schiffy Drawstring Crop Top,Schiffy Drawstring Crop Top,Schiffy Drawstring Crop Top,,,,,,,,,
MPSFWXE0155,Solid Dolphin Shorts,,<p><b>Style</b>: Casual</p><p><b>Color</b>: Redwood</p><p><b>Pattern Type</b>: Plain</p><p><b>Season</b>: Summer</p><p><b>Type</b>: Track Shorts</p><p><b>Waist Line</b>: Natural</p><p><b>Fit Type</b>: Regular Fit</p><p><b>Sheer</b>: No</p><p><b>Closure Type</b>: Elastic Waist</p><p><b>Material</b>: Cotton</p><p><b>Composition</b>: 65% Cotton</p><p><b>Composition</b>: 35% Polyester</p><p><b>Fabric</b>: Slight Stretch</p><p><b>Care Instructions</b>: Machine wash or professional dry clean</p>,img/Shorts/rwshorts25210603102.jpg,,Size#XS:S:M:L:,29.28,,,,1,1,,,Shorts,,Solid Dolphin Shorts,Solid Dolphin Shorts,Solid Dolphin Shorts,,,,,,,,,
MPSFWXE0156,Leopard Halter Crop Top,,<p><b>Style</b>: Sexy</p><p><b>Color</b>: Multicolor</p><p><b>Pattern Type</b>: Leopard</p><p><b>Length</b>: Crop</p><p><b>Season</b>: Summer</p><p><b>Type</b>: Halter</p><p><b>Details</b>: Backless</p><p><b>Details</b>: Asymmetrical</p><p><b>Details</b>: Tie Back</p><p><b>Neckline</b>: Halter</p><p><b>Fit Type</b>: Slim Fit</p><p><b>Sheer</b>: No</p><p><b>Material</b>: Polyester</p><p><b>Composition</b>: 93% Polyester</p><p><b>Composition</b>: 7% Spandex</p><p><b>Fabric</b>: Slight Stretch</p><p><b>Care Instructions</b>: Machine wash or professional dry clean</p>,img/Tank_Tops__Camis/swvest07201208404.jpg,,Size#XS:S:M:L:XL:,25.95,,,,1,1,,,Tank Tops & Cam's,,Leopard Halter Crop Top,Leopard Halter Crop Top,Leopard Halter Crop Top,,,,,,,,,
MPSFWXE0157,Ditsy Floral Drawstring Ruched Skirt,,<p><b>Style</b>: Boho</p><p><b>Color</b>: Multicolor</p><p><b>Pattern Type</b>: Ditsy Floral</p><p><b>Length</b>: Mini</p><p><b>Type</b>: Straight</p><p><b>Season</b>: Summer</p><p><b>Details</b>: Knot</p><p><b>Details</b>: Drawstring</p><p><b>Details</b>: Ruched</p><p><b>Details</b>: Zipper</p><p><b>Waist Line</b>: Natural</p><p><b>Sheer</b>: No</p><p><b>Material</b>: Polyester</p><p><b>Composition</b>: 100% Polyester</p><p><b>Fabric</b>: Non-Stretch</p><p><b>Care Instructions</b>: Machine wash or professional dry clean</p>,img/Skirts/swskirt07210313587.jpg,,Size#XS:S:M:L:XL:,25.41,,,,1,1,,,Skirts,,Ditsy Floral Drawstring Ruched Skirt,Ditsy Floral Drawstring Ruched Skirt,Ditsy Floral Drawstring Ruched Skirt,,,,,,,,,
MPSFWXE0158,Vintage Handmade Lace Agate Women Earrings Pearl Pendant Earrings,,"<p>Style: Vintage </p><p>Type: Earrings</p><p>Color: Silver</p><p>Weight: 6g</p><p>Size: About 5*1.7 cm / 1.97*0.67 in</p><p>Material: Alloy, Pearl</p><p>1 x Earrings</p>",img/Earrings/SKUG80818.jpg,,Size#,20.99,,,,1,1,,,Earrings,,Vintage Handmade Lace Agate Women Earrings Pearl Pendant Earrings,Vintage Handmade Lace Agate Women Earrings Pearl Pendant Earrings,Vintage Handmade Lace Agate Women Earrings Pearl Pendant Earrings,,,,,,,,,
MPSFWXE0159,Sun Pendant Necklace,,<p><b>Type</b>: Pendant Necklaces</p><p><b>Material</b>: Stone</p><p><b>Material</b>: Alloy</p><p><b>Color</b>: Gold</p><p><b>Metal Color</b>: Gold</p><p><b>Style</b>: Fashionable</p>,img/Pendant_Necklaces/rwneck18210512752.jpg,,Size#,18.11,,,,1,1,,,Pendant Necklaces,,Sun Pendant Necklace,Sun Pendant Necklace,Sun Pendant Necklace,,,,,,,,,
MPSFWXE0160,Vegetable Tanned Leather Hand-polished Long Retro Wallet,,"<p>Color:Coffee, Black, Brown</p><p>Wallets Style:Zipper</p><p>Wallet Type:Long Purse</p><p>Material:Cow Leather</p><p>Style:Vintage</p>",img/Wallets/SKUI15931.jpg,,Size#,70.05,,,,1,1,,,Wallets,,Vegetable Tanned Leather Hand-polished Long Retro Wallet,Vegetable Tanned Leather Hand-polished Long Retro Wallet,Vegetable Tanned Leather Hand-polished Long Retro Wallet,,,,,,,,,
MPSFWXE0161,Men Quick-Drying Mesh Hand Stitching Outdoor Water Shoes,,"<p>Color:Black, Brown</p><p>Upper Material:Mesh, PU</p><p>Outsole Material:Rubber</p><p>Function:Soft</p><p>Occasion:Outdoor, Daily</p><p>Closure Type:Hook & Loop</p><p>Season:Summer</p><p>Toe Type:Round</p>",img/Sneakers__Athletic/SKUF04084.jpg,,Size#US 6.5:US 7.5:US 8:US 8.5:US 9:US 10:US 10.5:US 11:US 11.5:US 12:,51.28,,,,1,1,,,Sneakers & Athletic,,Men Quick-Drying Mesh Hand Stitching Outdoor Water Shoes,Men Quick-Drying Mesh Hand Stitching Outdoor Water Shoes,Men Quick-Drying Mesh Hand Stitching Outdoor Water Shoes,,,,,,,,,
MPSFWXE0162,Women Casual Crystal Butterflies Wedges Heel Soft Comfy Beach Thumb Slippers,,"<p>Color:Black, White</p><p>Closure Type:Slip-On</p><p>Heel Type:Wedges Heel</p><p>Heel Height:3-5cm In Low Heel</p><p>Toe Type:Round</p><p>Pattern:Animal-print</p><p>Design Element:Rhinestone</p><p>Upper Material:Cloth, Mesh</p><p>Style:Casual</p><p>Outsole Material:Bubble</p><p>Structure:Slip-On</p><p>Occasion:Beach, Casual</p><p>Decoration:Crystals</p><p>Function:Soft, Hard-wearing</p><p>Season:Summer</p>",img/Slippers/SKUI14481.jpg,,Size#US 5:US 6:US 7:US 8:US 9:US 10:US 11:,58.68,,,,1,1,,,Slippers,,Women Casual Crystal Butterflies Wedges Heel Soft Comfy Beach Thumb Slippers,Women Casual Crystal Butterflies Wedges Heel Soft Comfy Beach Thumb Slippers,Women Casual Crystal Butterflies Wedges Heel Soft Comfy Beach Thumb Slippers,,,,,,,,,
MPSFWXE0163,All Over Print Button Front Blouse,,<p><b>Style</b>: Casual</p><p><b>Color</b>: Multicolor</p><p><b>Pattern Type</b>: All Over Print</p><p><b>Length</b>: Long</p><p><b>Season</b>: Summer</p><p><b>Type</b>: Shirt</p><p><b>Details</b>: Button Front</p><p><b>Neckline</b>: Collar</p><p><b>Fit Type</b>: Regular Fit</p><p><b>Sleeve Length</b>: Short Sleeve</p><p><b>Sleeve Type</b>: Regular Sleeve</p><p><b>Sheer</b>: No</p><p><b>Placket Type</b>: Placket</p><p><b>Material</b>: Cotton Blends</p><p><b>Composition</b>: 65% Cotton</p><p><b>Composition</b>: 35% Polyester</p><p><b>Fabric</b>: Non-Stretch</p><p><b>Care Instructions</b>: Machine wash or professional dry clean</p>,img/Blouses/rw2106215213259214.jpg,,Size#S:M:L:,32.86,,,,1,1,,,Blouses,,All Over Print Button Front Blouse,All Over Print Button Front Blouse,All Over Print Button Front Blouse,,,,,,,,,
MPSFWXE0164,Contrast Binding Wide Waistband Shorts,,<p><b>Style</b>: Sporty</p><p><b>Color</b>: Black</p><p><b>Season</b>: Summer</p><p><b>Type</b>: Track Shorts</p><p><b>Details</b>: Contrast Binding</p><p><b>Waist Line</b>: High Waist</p><p><b>Fit Type</b>: Skinny</p><p><b>Sheer</b>: No</p><p><b>Closure Type</b>: Elastic Waist</p><p><b>Material</b>: Polyester</p><p><b>Composition</b>: 100% Polyester</p><p><b>Fabric</b>: Medium Stretch</p><p><b>Care Instructions</b>: Machine wash or professional dry clean</p>,img/Shorts/swshorts23210531801.jpg,,Size#S:M:L:XL:,24.19,,,,1,1,,,Shorts,,Contrast Binding Wide Waistband Shorts,Contrast Binding Wide Waistband Shorts,Contrast Binding Wide Waistband Shorts,,,,,,,,,
MPSFWXE0165,Floral & Letter Graphic Tank Top,,<p><b>Style</b>: Casual</p><p><b>Color</b>: Lime Green</p><p><b>Pattern Type</b>: Floral</p><p><b>Pattern Type</b>: Letter</p><p><b>Length</b>: Crop</p><p><b>Season</b>: Summer</p><p><b>Type</b>: Tank</p><p><b>Details</b>: Rib-Knit</p><p><b>Neckline</b>: Round Neck</p><p><b>Fit Type</b>: Slim Fit</p><p><b>Sheer</b>: No</p><p><b>Material</b>: Polyester</p><p><b>Composition</b>: 100% Polyester</p><p><b>Fabric</b>: Medium Stretch</p><p><b>Care Instructions</b>: Machine wash or professional dry clean</p>,img/Tank_Tops__Camis/sW210617266771678.jpg,,Size#S:M:L:,32.21,,,,1,1,,,Tank Tops & Cam's,,Floral & Letter Graphic Tank Top,Floral & Letter Graphic Tank Top,Floral & Letter Graphic Tank Top,,,,,,,,,
MPSFWXE0166,Ditsy Floral Frill Skirt,,<p><b>Style</b>: Boho</p><p><b>Color</b>: Baby Blue</p><p><b>Pattern Type</b>: Ditsy Floral</p><p><b>Length</b>: Mini</p><p><b>Type</b>: A Line</p><p><b>Season</b>: Summer</p><p><b>Details</b>: Knot</p><p><b>Details</b>: Frill</p><p><b>Details</b>: Paper Bag Waist</p><p><b>Waist Line</b>: High Waist</p><p><b>Sheer</b>: No</p><p><b>Material</b>: Polyester</p><p><b>Composition</b>: 95% Polyester</p><p><b>Composition</b>: 5% Spandex</p><p><b>Fabric</b>: Non-Stretch</p><p><b>Care Instructions</b>: Machine wash or professional dry clean</p>,img/Skirts/rwskirt25210407894.jpg,,Size#S:M:L:,30.79,,,,1,1,,,Skirts,,Ditsy Floral Frill Skirt,Ditsy Floral Frill Skirt,Ditsy Floral Frill Skirt,,,,,,,,,
MPSFWXE0167,3 Pairs Vintage Bohemian Colorful Tassel Geometric Shape Alloy Earrings Set,,"<p>Style: Vintage,Bohemian </p><p>Type: Earrings Set</p><p>Weight: 20 g</p><p>Size: As the picture shown </p><p>Material: Alloy </p><p>Quantity: 3 Pairs</p><p>Package Includes:</p><p>1 x Earrings Set</p><p>Notice:</p>",img/Earrings/SKUH93926.jpg,,Size#,22.87,,,,1,1,,,Earrings,,3 Pairs Vintage Bohemian Colorful Tassel Geometric Shape Alloy Earrings Set,3 Pairs Vintage Bohemian Colorful Tassel Geometric Shape Alloy Earrings Set,3 Pairs Vintage Bohemian Colorful Tassel Geometric Shape Alloy Earrings Set,,,,,,,,,
MPSFWXE0168,2pcs Faux Pearl Decor Necklace,,<p><b>Details</b>: Pearls</p><p><b>Material</b>: Pearls</p><p><b>Type</b>: Pendant Necklaces</p><p><b>Color</b>: Silver</p><p><b>Metal Color</b>: Silver</p><p><b>Style</b>: Glamorous</p><p><b>Details</b>: Pearls</p><p><b>Material</b>: Pearls</p><p><b>Type</b>: Pendant Necklaces</p><p><b>Color</b>: Gold</p><p><b>Metal Color</b>: Gold</p><p><b>Style</b>: Glamorous</p>,img/Pendant_Necklaces/swneck18200707386.jpg,,Size#,14.17,,,,1,1,,,Pendant Necklaces,,2pcs Faux Pearl Decor Necklace,2pcs Faux Pearl Decor Necklace,2pcs Faux Pearl Decor Necklace,,,,,,,,,
MPSFWXE0169,Classic Vintage Gear Unique Design Stitch Craft Textured Hardware EDC Card Holder Wallet,,"<p>Color:Coffee</p><p>Wallets Style:Snap Closure</p><p>Wallet Type:Money Clip, ID Wallets</p><p>Material:Faux Fur, PU</p><p>Style:Business, Vintage</p>",img/Wallets/SKUI09706.jpg,,Size#,59.42,,,,1,1,,,Wallets,,Classic Vintage Gear Unique Design Stitch Craft Textured Hardware EDC Card Holder Wallet,Classic Vintage Gear Unique Design Stitch Craft Textured Hardware EDC Card Holder Wallet,Classic Vintage Gear Unique Design Stitch Craft Textured Hardware EDC Card Holder Wallet,,,,,,,,,
MPSFWXE0170,Men Color Blocking Breathable Knitted Fabric Light Weight Casual Walking Shoes,,"<p>Color:Black, White</p><p>Upper Material:Knitted</p><p>Outsole Material:Rubber</p><p>Type:Walking Shoes</p><p>Function:Breathable, Hard-wearing, Sport, Slip Resistant</p><p>Occasion:Outdoor, Sport</p><p>Closure Type:Slip-On</p><p>Season:All Season</p><p>Toe Type:Round</p>",img/Sneakers__Athletic/SKUH37515.jpg,,Size#US 7.5:US 8:US 8.5:US 9:US 10:US 10.5:US 11:,64.29,,,,1,1,,,Sneakers & Athletic,,Men Color Blocking Breathable Knitted Fabric Light Weight Casual Walking Shoes,Men Color Blocking Breathable Knitted Fabric Light Weight Casual Walking Shoes,Men Color Blocking Breathable Knitted Fabric Light Weight Casual Walking Shoes,,,,,,,,,
