v_sku,v_name,v_short_description,v_description,v_image,v_url,v_attribute,v_price,v_specials_price,v_specials_expire_date,v_date_added,v_in_stock,v_status,v_viewed,v_ordered,v_category_sku,v_sort_order,v_meta_title,v_meta_keywords,v_meta_description,v_brand_filter,v_class_filter,v_color_filter,v_gender_filter,v_material_filter,v_year_filter,v_origin_filter,v_series_filter,v_spec_filter
OKHPAZX0001,Cartoon Slogan Graphic Drawstring Dress,,<p><b>Style</b>: Casual</p><p><b>Color</b>: Black</p><p><b>Pattern Type</b>: Cartoon</p><p><b>Length</b>: Short</p><p><b>Season</b>: Summer</p><p><b>Type</b>: Fitted</p><p><b>Details</b>: Ruched</p><p><b>Details</b>: Drawstring</p><p><b>Sleeve Length</b>: Short Sleeve</p><p><b>Neckline</b>: Round Neck</p><p><b>Waist Line</b>: Natural</p><p><b>Fit Type</b>: Regular Fit</p><p><b>Sleeve Type</b>: Regular Sleeve</p><p><b>Sheer</b>: No</p><p><b>Hem Shaped</b>: Pencil</p><p><b>Material</b>: Polyester</p><p><b>Composition</b>: 95% Polyester</p><p><b>Composition</b>: 5% Spandex</p><p><b>Fabric</b>: Slight Stretch</p><p><b>Care Instructions</b>: Machine wash or professional dry clean</p><p><b>Style</b>: Casual</p><p><b>Color</b>: Coffee Brown</p><p><b>Pattern Type</b>: Cartoon</p><p><b>Length</b>: Short</p><p><b>Season</b>: Summer</p><p><b>Type</b>: Fitted</p><p><b>Details</b>: Ruched</p><p><b>Details</b>: Drawstring</p><p><b>Sleeve Length</b>: Short Sleeve</p><p><b>Neckline</b>: Round Neck</p><p><b>Waist Line</b>: Natural</p><p><b>Fit Type</b>: Regular Fit</p><p><b>Sleeve Type</b>: Regular Sleeve</p><p><b>Sheer</b>: No</p><p><b>Hem Shaped</b>: Pencil</p><p><b>Material</b>: Polyester</p><p><b>Composition</b>: 95% Polyester</p><p><b>Composition</b>: 5% Spandex</p><p><b>Fabric</b>: Slight Stretch</p><p><b>Care Instructions</b>: Machine wash or professional dry clean</p>,img/Dresses/rwdress25210510069.jpg,,Size#XS:S:M:L:,30.18,,,,1,1,,,Dresses,,Cartoon Slogan Graphic Drawstring Dress,Cartoon Slogan Graphic Drawstring Dress,Cartoon Slogan Graphic Drawstring Dress,,,,,,,,,
OKHPAZX0002,Marble Print One Shoulder Top,,<p><b>Style</b>: Casual</p><p><b>Color</b>: Blue</p><p><b>Pattern Type</b>: Marble</p><p><b>Length</b>: Crop</p><p><b>Season</b>: Summer</p><p><b>Details</b>: Rib-Knit</p><p><b>Neckline</b>: One Shoulder</p><p><b>Sleeve Length</b>: Sleeveless</p><p><b>Fit Type</b>: Slim Fit</p><p><b>Placket Type</b>: Pullovers</p><p><b>Sheer</b>: No</p><p><b>Material</b>: Polyester</p><p><b>Composition</b>: 80% Polyester</p><p><b>Composition</b>: 20% Cotton</p><p><b>Fabric</b>: High Stretch</p><p><b>Care Instructions</b>: Machine wash or professional dry clean</p>,img/Women_Tops/sW210618739946898.jpg,,Size#XS:S:M:L:,27.95,,,,1,1,,,Women Tops,,Marble Print One Shoulder Top,Marble Print One Shoulder Top,Marble Print One Shoulder Top,,,,,,,,,
OKHPAZX0003,Colorblock Bear Print Shorts,,<p><b>Style</b>: Casual</p><p><b>Color</b>: Multicolor</p><p><b>Pattern Type</b>: Cartoon</p><p><b>Season</b>: Summer</p><p><b>Type</b>: Track Shorts</p><p><b>Waist Line</b>: Natural</p><p><b>Fit Type</b>: Regular Fit</p><p><b>Sheer</b>: No</p><p><b>Closure Type</b>: Elastic Waist</p><p><b>Material</b>: Cotton</p><p><b>Composition</b>: 65% Cotton</p><p><b>Composition</b>: 35% Polyester</p><p><b>Fabric</b>: Medium Stretch</p><p><b>Care Instructions</b>: Machine wash or professional dry clean</p>,img/Shorts/rW210601482004384.jpg,,Size#S:M:L:,23.61,,,,1,1,,,Shorts,,Colorblock Bear Print Shorts,Colorblock Bear Print Shorts,Colorblock Bear Print Shorts,,,,,,,,,
OKHPAZX0004,Ruffle Hem Flare Skirt,,<p><b>Style</b>: Casual</p><p><b>Color</b>: Baby Blue</p><p><b>Pattern Type</b>: Plain</p><p><b>Length</b>: Mini</p><p><b>Type</b>: Flared</p><p><b>Season</b>: Summer</p><p><b>Details</b>: Ruffle Hem</p><p><b>Waist Line</b>: High Waist</p><p><b>Sheer</b>: No</p><p><b>Material</b>: Polyester</p><p><b>Composition</b>: 100% Polyester</p><p><b>Fabric</b>: Non-Stretch</p><p><b>Care Instructions</b>: Machine wash or professional dry clean</p>,img/Skirts/swskirt44201214529.jpg,,Size#XS:S:M:L:,25.78,,,,1,1,,,Skirts,,Ruffle Hem Flare Skirt,Ruffle Hem Flare Skirt,Ruffle Hem Flare Skirt,,,,,,,,,
OKHPAZX0005,108pcs Tibetan Buddhist Ceramic Beaded Bracelet Bohemian Multilayer Bracelet for Women for Men,,<p>Style: Bohemian</p><p>Type: Bead Bracelet</p><p>Material: Ceramic</p><p>Main Color: Multicolor</p><p>Weight: About 35g</p><p>Chain Length: About 70cm / 27.56'</p><p>1 x Bracelet</p>,img/Bracelets/SKU824299.jpg,,Size#,13.86,,,,1,1,,,Bracelets,,108pcs Tibetan Buddhist Ceramic Beaded Bracelet Bohemian Multilayer Bracelet for Women for Men,108pcs Tibetan Buddhist Ceramic Beaded Bracelet Bohemian Multilayer Bracelet for Women for Men,108pcs Tibetan Buddhist Ceramic Beaded Bracelet Bohemian Multilayer Bracelet for Women for Men,,,,,,,,,
OKHPAZX0006,Vintage Shepherd Girl Rings Star Thai Silver Ring,,"<p>Style: Vintage</p><p>Type: Ring</p><p>Color: Silver</p><p>Weight: 11g</p><p>Size: 7, 8, 9, 10, 11</p><p>Material: 925 Ancient Silver</p><p>1 x Ring</p>",img/Rings/SKUH10803.jpg,,Size#7:8:9:10:11:,22.67,,,,1,1,,,Rings,,Vintage Shepherd Girl Rings Star Thai Silver Ring,Vintage Shepherd Girl Rings Star Thai Silver Ring,Vintage Shepherd Girl Rings Star Thai Silver Ring,,,,,,,,,
OKHPAZX0007,Women Floral Print 6 Card Slots Coin Purse Money Clip Short Wallet,,"<p>Color:Pink, Black, Blue, Khaki</p><p>Wallets Style:Clasp Closure</p><p>Wallet Type:Money Clip, ID Wallets, Coin Purse</p><p>Material:Faux Fur, PU</p><p>Style:Casual</p><p>Pattern:Floral</p>",img/Wallets/SKUG30896.jpg,,Size#,70.29,,,,1,1,,,Wallets,,Women Floral Print 6 Card Slots Coin Purse Money Clip Short Wallet,Women Floral Print 6 Card Slots Coin Purse Money Clip Short Wallet,Women Floral Print 6 Card Slots Coin Purse Money Clip Short Wallet,,,,,,,,,
OKHPAZX0008,SOCOFY Vintage Leather Adjustable Buckle Strap Cut-out Burnished Chunky Heel Heels,,"<p>Color:Camel</p><p>Type:Mary Jane</p><p>Closure Type:Buckle</p><p>Heel Type:Chunky Heel</p><p>Heel Height:3-5cm In Low Heel</p><p>Toe Type:Pointed</p><p>Pattern:Grid</p><p>Design Element:Patchwork, Hollow out</p><p>Upper Material:Leather</p><p>Style:Retro</p><p>Outsole Material:Rubber</p><p>Structure:Buckle</p><p>Occasion:Casual</p><p>Function:Breathable</p><p>Season:Spring&Summer, Autumn, Spring&Fall</p>",img/Heels/SKUE77746.jpg,,Size#US 5:US 6:US 7:US 8:US 9.5:US 10.5:US 11.5:,56.36,,,,1,1,,,Heels,,SOCOFY Vintage Leather Adjustable Buckle Strap Cut-out Burnished Chunky Heel Heels,SOCOFY Vintage Leather Adjustable Buckle Strap Cut-out Burnished Chunky Heel Heels,SOCOFY Vintage Leather Adjustable Buckle Strap Cut-out Burnished Chunky Heel Heels,,,,,,,,,
OKHPAZX0009,Men Outdoor Cap Toe Non Slip Lace Up Casual Hiking Shoes,,"<p>Color:Black, Brown</p><p>Upper Material:Cowhide</p><p>Outsole Material:Rubber</p><p>Type:Outdoor Shoes, Hiking Shoes</p><p>Function:Protect toes, Slip Resistant</p><p>Occasion:Outdoor, Climbing, Camping & Hiking</p><p>Closure Type:Lace-up</p><p>Season:All Season</p><p>Toe Type:Round</p>",img/Sneakers__Athletic/SKUG88176.jpg,,Size#US 6.5:US 7.5:US 8:US 8.5:US 9:US 10:,52.8,,,,1,1,,,Sneakers & Athletic,,Men Outdoor Cap Toe Non Slip Lace Up Casual Hiking Shoes,Men Outdoor Cap Toe Non Slip Lace Up Casual Hiking Shoes,Men Outdoor Cap Toe Non Slip Lace Up Casual Hiking Shoes,,,,,,,,,
OKHPAZX0010,Plaid Print Double Breasted Belted Cami Dress,,<p><b>Style</b>: Preppy</p><p><b>Color</b>: Multicolor</p><p><b>Pattern Type</b>: Plaid</p><p><b>Length</b>: Short</p><p><b>Season</b>: Summer</p><p><b>Type</b>: Cami</p><p><b>Details</b>: Belted</p><p><b>Details</b>: Double Button</p><p><b>Sleeve Length</b>: Sleeveless</p><p><b>Waist Line</b>: High Waist</p><p><b>Fit Type</b>: Regular Fit</p><p><b>Neckline</b>: Straps</p><p><b>Sheer</b>: No</p><p><b>Hem Shaped</b>: Straight</p><p><b>Belt</b>: Yes</p><p><b>Material</b>: Polyester</p><p><b>Composition</b>: 100% Polyester</p><p><b>Fabric</b>: Non-Stretch</p><p><b>Care Instructions</b>: Machine wash or professional dry clean</p>,img/Dresses/swdress25210616448.jpg,,Size#XS:S:M:L:,29.15,,,,1,1,,,Dresses,,Plaid Print Double Breasted Belted Cami Dress,Plaid Print Double Breasted Belted Cami Dress,Plaid Print Double Breasted Belted Cami Dress,,,,,,,,,
OKHPAZX0011,Solid One Shoulder Ribbed Crop Top,,<p><b>Style</b>: Casual</p><p><b>Color</b>: Khaki</p><p><b>Pattern Type</b>: Plain</p><p><b>Length</b>: Crop</p><p><b>Season</b>: Summer</p><p><b>Details</b>: Rib-Knit</p><p><b>Neckline</b>: One Shoulder</p><p><b>Sleeve Length</b>: Sleeveless</p><p><b>Fit Type</b>: Slim Fit</p><p><b>Placket Type</b>: Pullovers</p><p><b>Sheer</b>: No</p><p><b>Material</b>: Cotton</p><p><b>Composition</b>: 65% Cotton</p><p><b>Composition</b>: 35% Polyester</p><p><b>Fabric</b>: Slight Stretch</p><p><b>Care Instructions</b>: Machine wash or professional dry clean</p>,img/Women_Tops/sW210519632074616.jpg,,Size#S:M:L:,30.42,,,,1,1,,,Women Tops,,Solid One Shoulder Ribbed Crop Top,Solid One Shoulder Ribbed Crop Top,Solid One Shoulder Ribbed Crop Top,,,,,,,,,
OKHPAZX0012,Paperbag Waist Solid Shorts,,<p><b>Style</b>: Boho</p><p><b>Color</b>: Beige</p><p><b>Pattern Type</b>: Plain</p><p><b>Season</b>: Summer</p><p><b>Type</b>: Wide Leg</p><p><b>Details</b>: Knot</p><p><b>Details</b>: Paper Bag Waist</p><p><b>Waist Line</b>: High Waist</p><p><b>Fit Type</b>: Loose</p><p><b>Sheer</b>: No</p><p><b>Closure Type</b>: Elastic Waist</p><p><b>Material</b>: Polyester</p><p><b>Composition</b>: 45% Polyester</p><p><b>Composition</b>: 33% Viscose</p><p><b>Composition</b>: 15% Linen</p><p><b>Composition</b>: 7% Cotton</p><p><b>Fabric</b>: Non-Stretch</p><p><b>Care Instructions</b>: Machine wash or professional dry clean</p>,img/Shorts/swshorts07210104476.jpg,,Size#XS:S:M:L:XL:,27.99,,,,1,1,,,Shorts,,Paperbag Waist Solid Shorts,Paperbag Waist Solid Shorts,Paperbag Waist Solid Shorts,,,,,,,,,
OKHPAZX0013,Solid High Waisted Pleated Skirt,,<p><b>Style</b>: Preppy</p><p><b>Color</b>: White</p><p><b>Pattern Type</b>: Plain</p><p><b>Length</b>: Short</p><p><b>Type</b>: Pleated</p><p><b>Season</b>: Summer</p><p><b>Details</b>: Pleated</p><p><b>Waist Line</b>: High Waist</p><p><b>Sheer</b>: No</p><p><b>Material</b>: Polyester</p><p><b>Composition</b>: 100% Polyester</p><p><b>Fabric</b>: Slight Stretch</p><p><b>Care Instructions</b>: Machine wash or professional dry clean</p>,img/Skirts/swskirt01210304152.jpg,,Size#XS:S:M:L:,24.14,,,,1,1,,,Skirts,,Solid High Waisted Pleated Skirt,Solid High Waisted Pleated Skirt,Solid High Waisted Pleated Skirt,,,,,,,,,
OKHPAZX0014,Fashion Hollow Roman Number Bangle Bracelets Titanium Steel Charm Gold Bracelets for Women for Men,,<p>Type: </p><p>Material: Titanium Steel</p><p>Internal Diameter Size: About 58mm / 2.28'</p><p>1 x Bracelet</p>,img/Bracelets/SKU925437.jpg,,Size#,25.91,,,,1,1,,,Bracelets,,Fashion Hollow Roman Number Bangle Bracelets Titanium Steel Charm Gold Bracelets for Women for Men,Fashion Hollow Roman Number Bangle Bracelets Titanium Steel Charm Gold Bracelets for Women for Men,Fashion Hollow Roman Number Bangle Bracelets Titanium Steel Charm Gold Bracelets for Women for Men,,,,,,,,,
OKHPAZX0015,Vintage Metal Bee Ring Simple Three-dimensional Animal Ring,,"<p>Style: Vintage,Lovely.</p><p>Type: Ring</p><p>Color: Silver.</p><p>Diameter Length: </p><p>About 1.8 cm/0.7 in</p><p>Material:  Alloy</p><p>1 x Ring</p>",img/Rings/SKUH32460.jpg,,Size#,27.74,,,,1,1,,,Rings,,Vintage Metal Bee Ring Simple Three-dimensional Animal Ring,Vintage Metal Bee Ring Simple Three-dimensional Animal Ring,Vintage Metal Bee Ring Simple Three-dimensional Animal Ring,,,,,,,,,
OKHPAZX0016,RFID Antimagnetic Genuine Leather Cowhide 13 card slots Tassel Card Holder For Women Men,,"<p>Color:Coffee, Black, Purple, Brown, Blue, Red</p><p>Style:Casual</p>",img/Wallets/SKU527346.jpg,,Size#,72.42,,,,1,1,,,Wallets,,RFID Antimagnetic Genuine Leather Cowhide 13 card slots Tassel Card Holder For Women Men,RFID Antimagnetic Genuine Leather Cowhide 13 card slots Tassel Card Holder For Women Men,RFID Antimagnetic Genuine Leather Cowhide 13 card slots Tassel Card Holder For Women Men,,,,,,,,,
OKHPAZX0017,SOCOFY Vintage Flowers Splicing Genuine Leather Round Toe Chunky Heel Ankle Zipper Heels,,"<p>Color:Red</p><p>Type:Loafers</p><p>Closure Type:Side-zip</p><p>Heel Type:Chunky Heel</p><p>Heel Height:5-8cm In Heel</p><p>Toe Type:Round</p><p>Pattern:Calico</p><p>Design Element:Patchwork, Floral</p><p>Style:Casual, Elegant</p><p>Outsole Material:Rubber</p><p>Structure:Side-zip</p><p>Occasion:Party, Casual</p><p>Function:Hard-wearing</p><p>Season:Spring&Summer, Spring&Fall</p>",img/Heels/SKUF86970.jpg,,Size#US 5:US 6:US 7:US 8:US 9.5:US 10.5:US 11.5:,51.53,,,,1,1,,,Heels,,SOCOFY Vintage Flowers Splicing Genuine Leather Round Toe Chunky Heel Ankle Zipper Heels,SOCOFY Vintage Flowers Splicing Genuine Leather Round Toe Chunky Heel Ankle Zipper Heels,SOCOFY Vintage Flowers Splicing Genuine Leather Round Toe Chunky Heel Ankle Zipper Heels,,,,,,,,,
OKHPAZX0018,Mens Air Cushion Sole Fabric Breathable Running Shoes,,"<p>Color:Black, Blue, Grey</p><p>Upper Material:Mesh, Knitted</p><p>Outsole Material:PU</p><p>Function:Breathable, Soft</p><p>Closure Type:Lace-up</p><p>Season:Summer</p><p>Toe Type:Round</p>",img/Sneakers__Athletic/SKUF04055.jpg,,Size#US 6.5:US 7.5:US 8:US 8.5:US 9:US 10:,64.39,,,,1,1,,,Sneakers & Athletic,,Mens Air Cushion Sole Fabric Breathable Running Shoes,Mens Air Cushion Sole Fabric Breathable Running Shoes,Mens Air Cushion Sole Fabric Breathable Running Shoes,,,,,,,,,
OKHPAZX0019,Ditsy Floral Shirred Waist Dress,,<p><b>Style</b>: Boho</p><p><b>Color</b>: Multicolor</p><p><b>Pattern Type</b>: Ditsy Floral</p><p><b>Length</b>: Short</p><p><b>Season</b>: Summer</p><p><b>Type</b>: A Line</p><p><b>Details</b>: Shirred</p><p><b>Neckline</b>: V neck</p><p><b>Sleeve Length</b>: Short Sleeve</p><p><b>Waist Line</b>: High Waist</p><p><b>Fit Type</b>: Regular Fit</p><p><b>Sleeve Type</b>: Regular Sleeve</p><p><b>Sheer</b>: No</p><p><b>Hem Shaped</b>: Flared</p><p><b>Material</b>: Polyester</p><p><b>Composition</b>: 95% Polyester</p><p><b>Composition</b>: 5% Spandex</p><p><b>Fabric</b>: Non-Stretch</p><p><b>Care Instructions</b>: Machine wash or professional dry clean</p>,img/Dresses/swdress25210419226.jpg,,Size#XS:S:M:L:,29.12,,,,1,1,,,Dresses,,Ditsy Floral Shirred Waist Dress,Ditsy Floral Shirred Waist Dress,Ditsy Floral Shirred Waist Dress,,,,,,,,,
OKHPAZX0020,Solid Drawstring Ruched Ribbed Crop Tube Top,,<p><b>Style</b>: Casual</p><p><b>Color</b>: Baby Pink</p><p><b>Pattern Type</b>: Plain</p><p><b>Length</b>: Crop</p><p><b>Season</b>: Summer</p><p><b>Details</b>: Drawstring</p><p><b>Details</b>: Ruched</p><p><b>Details</b>: Rib-Knit</p><p><b>Sleeve Length</b>: Sleeveless</p><p><b>Fit Type</b>: Slim Fit</p><p><b>Neckline</b>: Strapless</p><p><b>Placket Type</b>: Pullovers</p><p><b>Sheer</b>: No</p><p><b>Material</b>: Polyester</p><p><b>Composition</b>: 95% Polyester</p><p><b>Composition</b>: 5% Elastane</p><p><b>Fabric</b>: Slight Stretch</p><p><b>Care Instructions</b>: Machine wash or professional dry clean</p>,img/Women_Tops/rwtop25210531292.jpg,,Size#XS:S:M:L:,24.37,,,,1,1,,,Women Tops,,Solid Drawstring Ruched Ribbed Crop Tube Top,Solid Drawstring Ruched Ribbed Crop Tube Top,Solid Drawstring Ruched Ribbed Crop Tube Top,,,,,,,,,
OKHPAZX0021,Striped Tie Front Shorts,,<p><b>Style</b>: Boho</p><p><b>Color</b>: Multicolor</p><p><b>Pattern Type</b>: Striped</p><p><b>Season</b>: Summer</p><p><b>Type</b>: Wide Leg</p><p><b>Details</b>: Paper Bag Waist</p><p><b>Waist Line</b>: High Waist</p><p><b>Fit Type</b>: Loose</p><p><b>Sheer</b>: No</p><p><b>Closure Type</b>: Elastic Waist</p><p><b>Belt</b>: Yes</p><p><b>Material</b>: Polyester</p><p><b>Composition</b>: 100% Polyester</p><p><b>Fabric</b>: Non-Stretch</p><p><b>Care Instructions</b>: Machine wash or professional dry clean</p>,img/Shorts/swshorts23210129419.jpg,,Size#S:M:L:XL:,22.88,,,,1,1,,,Shorts,,Striped Tie Front Shorts,Striped Tie Front Shorts,Striped Tie Front Shorts,,,,,,,,,
OKHPAZX0022,Frill Trim Dobby Mesh Skirt,,<p><b>Style</b>: Casual</p><p><b>Color</b>: White</p><p><b>Pattern Type</b>: Plain</p><p><b>Length</b>: Long</p><p><b>Type</b>: A Line</p><p><b>Season</b>: Spring/Summer/Fall</p><p><b>Details</b>: Frill</p><p><b>Waist Line</b>: High Waist</p><p><b>Sheer</b>: Semi-Sheer</p><p><b>Material</b>: Polyester</p><p><b>Composition</b>: 100% Polyester</p><p><b>Fabric</b>: Non-Stretch</p><p><b>Care Instructions</b>: Machine wash or professional dry clean</p>,img/Skirts/swskirt30210428333.jpg,,Size#S:M:L:XL:,29.41,,,,1,1,,,Skirts,,Frill Trim Dobby Mesh Skirt,Frill Trim Dobby Mesh Skirt,Frill Trim Dobby Mesh Skirt,,,,,,,,,
OKHPAZX0023,Ethnic Hand-woven Ceramic Beads Bracelet Geometric Metal Flower Ceramic Beads Pendant Bracelet,,"<p>Style:Ethnic</p><p>Type:Bracelet</p><p>Color:Red,Green</p><p>Weight: About 35g</p><p>Size:Adjustable</p><p>Material:Wax line</p><p>1 x Bracelet</p>",img/Bracelets/SKUF23471.jpg,,Size#,27.91,,,,1,1,,,Bracelets,,Ethnic Hand-woven Ceramic Beads Bracelet Geometric Metal Flower Ceramic Beads Pendant Bracelet,Ethnic Hand-woven Ceramic Beads Bracelet Geometric Metal Flower Ceramic Beads Pendant Bracelet,Ethnic Hand-woven Ceramic Beads Bracelet Geometric Metal Flower Ceramic Beads Pendant Bracelet,,,,,,,,,
OKHPAZX0024,Vintage 14K Rose Gold Hollow Flower Ring Retro Alloy Engagement Ring,,"<p>Style:Elegant,Retro.</p><p>Type: Ring</p><p>Color: </p><p>Silver</p><p>.</p><p>Diameter Length: About 16.5/ 17.3/ 18.1/ 18.9/ 19.8 mm</p><p>Material: Alloy</p><p>Ring Size: 6 /7 / 8 / 9 / 10</p><p>(Please see the size reference for size conversion and detail information.)</p><p>Package Includes:</p><p>1 x Ring</p>",img/Rings/SKUH02220.jpg,,Size#6:7:8:9:10:,20.37,,,,1,1,,,Rings,,Vintage 14K Rose Gold Hollow Flower Ring Retro Alloy Engagement Ring,Vintage 14K Rose Gold Hollow Flower Ring Retro Alloy Engagement Ring,Vintage 14K Rose Gold Hollow Flower Ring Retro Alloy Engagement Ring,,,,,,,,,
OKHPAZX0025,RFID Men And Women Genuine Leather 24 Card Slot Large Capacity Card Holder Passport Case,,"<p>Color:Yellow, Coffee, Green, Black, Blue, Red, Khaki</p><p>Style:Vintage</p><p>Decoration:Genuine Leather</p>",img/Wallets/SKU821850.jpg,,Size#,62.91,,,,1,1,,,Wallets,,RFID Men And Women Genuine Leather 24 Card Slot Large Capacity Card Holder Passport Case,RFID Men And Women Genuine Leather 24 Card Slot Large Capacity Card Holder Passport Case,RFID Men And Women Genuine Leather 24 Card Slot Large Capacity Card Holder Passport Case,,,,,,,,,
OKHPAZX0026,SOCOFY Retro Cutout Cowhide Leather Solid Color Comfy Wearable Casaul Lace-up Heels Shoes,,"<p>Color:Brown</p><p>Type:Party Shoes</p><p>Closure Type:Lace-up</p><p>Heel Type:Chunky Heel</p><p>Heel Height:5-8cm In Heel</p><p>Toe Type:Round</p><p>Pattern:Solid</p><p>Design Element:Hollow out</p><p>Style:Casual, Elegant</p><p>Outsole Material:Rubber</p><p>Structure:Lace-up</p><p>Occasion:Party, Casual</p><p>Function:Breathable, Hard-wearing</p><p>Season:Spring&Summer, Autumn, Spring&Fall</p>",img/Heels/SKUF96695.jpg,,Size#US 5:US 6:US 7:US 8:US 9.5:US 10.5:US 11.5:,56.95,,,,1,1,,,Heels,,SOCOFY Retro Cutout Cowhide Leather Solid Color Comfy Wearable Casaul Lace-up Heels Shoes,SOCOFY Retro Cutout Cowhide Leather Solid Color Comfy Wearable Casaul Lace-up Heels Shoes,SOCOFY Retro Cutout Cowhide Leather Solid Color Comfy Wearable Casaul Lace-up Heels Shoes,,,,,,,,,
OKHPAZX0027,Men Stylish Laser Sequins Lace-up Round Toe Pattern Chunky Sneakers,,"<p>Color:Black, Red, Yellow</p><p>Upper Material:Mesh, PU</p><p>Outsole Material:Rubber</p><p>Type:Chunky Sneaker shoes</p><p>Function:Breathable, Hard-wearing</p><p>Occasion:Outdoor, Daily, Sport</p><p>Closure Type:Lace-up</p><p>Season:All Season</p><p>Toe Type:Round</p>",img/Sneakers__Athletic/SKUH14269.jpg,,Size#US 6.5:US 7.5:US 8:US 8.5:US 9:US 10:,49.58,,,,1,1,,,Sneakers & Athletic,,Men Stylish Laser Sequins Lace-up Round Toe Pattern Chunky Sneakers,Men Stylish Laser Sequins Lace-up Round Toe Pattern Chunky Sneakers,Men Stylish Laser Sequins Lace-up Round Toe Pattern Chunky Sneakers,,,,,,,,,
OKHPAZX0028,Zebra Stripe Cut Out Tie Back Halter Mini Dress,,<p><b>Style</b>: Sexy</p><p><b>Color</b>: Multicolor</p><p><b>Pattern Type</b>: Graphic</p><p><b>Length</b>: Short</p><p><b>Season</b>: Summer</p><p><b>Type</b>: Bodycon</p><p><b>Details</b>: Backless</p><p><b>Details</b>: Ruched</p><p><b>Details</b>: Tie Back</p><p><b>Sleeve Length</b>: Sleeveless</p><p><b>Neckline</b>: Halter</p><p><b>Waist Line</b>: High Waist</p><p><b>Fit Type</b>: Slim Fit</p><p><b>Sheer</b>: No</p><p><b>Hem Shaped</b>: Pencil</p><p><b>Material</b>: Polyester</p><p><b>Composition</b>: 94% Polyester</p><p><b>Composition</b>: 6% Elastane</p><p><b>Fabric</b>: Slight Stretch</p><p><b>Care Instructions</b>: Machine wash or professional dry clean</p>,img/Dresses/swdress07210525770.jpg,,Size#XS:S:M:L:XL:,25.5,,,,1,1,,,Dresses,,Zebra Stripe Cut Out Tie Back Halter Mini Dress,Zebra Stripe Cut Out Tie Back Halter Mini Dress,Zebra Stripe Cut Out Tie Back Halter Mini Dress,,,,,,,,,
OKHPAZX0029,Layered Ruffle Trim Crop Tube Top,,<p><b>Style</b>: Boho</p><p><b>Color</b>: White</p><p><b>Pattern Type</b>: Plain</p><p><b>Length</b>: Crop</p><p><b>Season</b>: Summer</p><p><b>Details</b>: Ruffle Hem</p><p><b>Details</b>: Tiered Layer</p><p><b>Sleeve Length</b>: Sleeveless</p><p><b>Fit Type</b>: Slim Fit</p><p><b>Neckline</b>: Strapless</p><p><b>Placket Type</b>: Pullovers</p><p><b>Sheer</b>: No</p><p><b>Material</b>: Polyester</p><p><b>Composition</b>: 100% Polyester</p><p><b>Fabric</b>: Non-Stretch</p><p><b>Care Instructions</b>: Machine wash or professional dry clean</p>,img/Women_Tops/swtop44210426662.jpg,,Size#XS:S:M:L:,25.04,,,,1,1,,,Women Tops,,Layered Ruffle Trim Crop Tube Top,Layered Ruffle Trim Crop Tube Top,Layered Ruffle Trim Crop Tube Top,,,,,,,,,
OKHPAZX0030,Skeleton Print Shorts,,<p><b>Style</b>: Casual</p><p><b>Color</b>: Black</p><p><b>Pattern Type</b>: Halloween</p><p><b>Season</b>: Summer</p><p><b>Type</b>: Track Shorts</p><p><b>Details</b>: Drawstring</p><p><b>Details</b>: Tie Front</p><p><b>Waist Line</b>: Natural</p><p><b>Fit Type</b>: Regular Fit</p><p><b>Sheer</b>: No</p><p><b>Closure Type</b>: Drawstring Waist</p><p><b>Material</b>: Cotton</p><p><b>Composition</b>: 100% Cotton</p><p><b>Fabric</b>: Slight Stretch</p><p><b>Care Instructions</b>: Machine wash or professional dry clean</p>,img/Shorts/rw2107077989908068.jpg,,Size#S:M:L:,27.64,,,,1,1,,,Shorts,,Skeleton Print Shorts,Skeleton Print Shorts,Skeleton Print Shorts,,,,,,,,,
OKHPAZX0031,Solid Cord Skirt,,<p><b>Style</b>: Casual</p><p><b>Color</b>: Brown</p><p><b>Pattern Type</b>: Plain</p><p><b>Length</b>: Mini</p><p><b>Type</b>: Straight</p><p><b>Season</b>: Fall/Winter</p><p><b>Details</b>: Button</p><p><b>Details</b>: Pocket</p><p><b>Details</b>: Zipper</p><p><b>Waist Line</b>: High Waist</p><p><b>Sheer</b>: No</p><p><b>Material</b>: Corduroy</p><p><b>Composition</b>: 100% Polyester</p><p><b>Fabric</b>: Non-Stretch</p><p><b>Care Instructions</b>: Machine wash or professional dry clean</p>,img/Skirts/swskirt07200909925.jpg,,Size#XS:S:M:L:XL:,32.33,,,,1,1,,,Skirts,,Solid Cord Skirt,Solid Cord Skirt,Solid Cord Skirt,,,,,,,,,
OKHPAZX0032,Silver Plated Blue Rhinestone Bangle Bracelet,,<p>Notice:</p>,img/Bracelets/SKU306761.jpg,,Size#,24.23,,,,1,1,,,Bracelets,,Silver Plated Blue Rhinestone Bangle Bracelet,Silver Plated Blue Rhinestone Bangle Bracelet,Silver Plated Blue Rhinestone Bangle Bracelet,,,,,,,,,
OKHPAZX0033,Vintage Astronomical Ball Ring Flip Deformation Cosmic Ring Couple Creative Lettering Finger Ring,,"<p>Style: Vintage</p><p>Type:</p><p>Finger Ring</p><p>Main Color: Gold,Silver</p><p>Weight: About 100g</p><p>Material: Copper Alloy,925 Silver</p><p>Size: As the picture shows</p><p>1 x Ring </p>",img/Rings/SKUC21873.jpg,,Size#925 silver:Copper:6:7:8:9:10:,18.19,,,,1,1,,,Rings,,Vintage Astronomical Ball Ring Flip Deformation Cosmic Ring Couple Creative Lettering Finger Ring,Vintage Astronomical Ball Ring Flip Deformation Cosmic Ring Couple Creative Lettering Finger Ring,Vintage Astronomical Ball Ring Flip Deformation Cosmic Ring Couple Creative Lettering Finger Ring,,,,,,,,,
OKHPAZX0034,Women Men Waterproof Boarding Must-have Passport Bag Purse Wallet,,"<p>Color:Grey, Purple, Blue</p><p>Style:Casual</p>",img/Wallets/SKU923013.jpg,,Size#,64.03,,,,1,1,,,Wallets,,Women Men Waterproof Boarding Must-have Passport Bag Purse Wallet,Women Men Waterproof Boarding Must-have Passport Bag Purse Wallet,Women Men Waterproof Boarding Must-have Passport Bag Purse Wallet,,,,,,,,,
OKHPAZX0035,Socofy Retro Floral Print Genuine Leather Comfy Low Heel Metal Buckle Chunky Heel Mary Jane Pumps,,"<p>Color:Red, Black, White</p><p>Type:Mary Jane</p><p>Closure Type:Buckle</p><p>Heel Type:Chunky Heel</p><p>Heel Height:3-5cm In Low Heel</p><p>Toe Type:Round</p><p>Pattern:Floral</p><p>Design Element:Floral, Buckle, Print</p><p>Upper Material:Leather</p><p>Style:Retro, Elegant</p><p>Outsole Material:Rubber</p><p>Structure:Buckle</p><p>Occasion:Casual, Versatile</p><p>Function:Soft, Hard-wearing</p><p>Season:Summer, Autumn, Spring</p>",img/Heels/SKUH87880.jpg,,Size#US 5:US 6:US 7:US 8:US 9:US 10:,53.31,,,,1,1,,,Heels,,Socofy Retro Floral Print Genuine Leather Comfy Low Heel Metal Buckle Chunky Heel Mary Jane Pumps,Socofy Retro Floral Print Genuine Leather Comfy Low Heel Metal Buckle Chunky Heel Mary Jane Pumps,Socofy Retro Floral Print Genuine Leather Comfy Low Heel Metal Buckle Chunky Heel Mary Jane Pumps,,,,,,,,,
