v_sku,v_name,v_short_description,v_description,v_image,v_url,v_attribute,v_price,v_specials_price,v_specials_expire_date,v_date_added,v_in_stock,v_status,v_viewed,v_ordered,v_category_sku,v_sort_order,v_meta_title,v_meta_keywords,v_meta_description,v_brand_filter,v_class_filter,v_color_filter,v_gender_filter,v_material_filter,v_year_filter,v_origin_filter,v_series_filter,v_spec_filter
OKHPAZX0139,Solid Elastic Waist Flared Skirt,,<p><b>Style</b>: Casual</p><p><b>Color</b>: Black</p><p><b>Pattern Type</b>: Plain</p><p><b>Length</b>: Midi</p><p><b>Type</b>: Flared</p><p><b>Season</b>: Spring/Summer/Fall</p><p><b>Waist Line</b>: High Waist</p><p><b>Sheer</b>: No</p><p><b>Material</b>: Viscose</p><p><b>Composition</b>: 89% Viscose</p><p><b>Composition</b>: 11% Polyester</p><p><b>Fabric</b>: Non-Stretch</p><p><b>Care Instructions</b>: Machine wash or professional dry clean</p><p><b>Style</b>: Casual</p><p><b>Color</b>: Blue</p><p><b>Pattern Type</b>: Plain</p><p><b>Length</b>: Midi</p><p><b>Type</b>: Flared</p><p><b>Season</b>: Spring/Summer/Fall</p><p><b>Size Fit</b>: Asian sizes are smaller than European and US sizes.</p><p><b>Waist Line</b>: High Waist</p><p><b>Sheer</b>: No</p><p><b>Material</b>: Viscose</p><p><b>Composition</b>: 89% Viscose</p><p><b>Composition</b>: 11% Polyester</p><p><b>Fabric</b>: Non-Stretch</p><p><b>Care Instructions</b>: Machine wash or professional dry clean</p>,img/Skirts/swskirt30210420471.jpg,,Size#S:M:L:XL:,28.35,,,,1,1,,,Skirts,,Solid Elastic Waist Flared Skirt,Solid Elastic Waist Flared Skirt,Solid Elastic Waist Flared Skirt,,,,,,,,,
OKHPAZX0140,Vintage Colorful Natural Agate Stone Beaded Bracelet Irregular Pattern Bracelet Ethnic Jewelry,,<p>Style: Vintage</p><p>Type: Beaded Bracelet</p><p>Main Color: Colorful</p><p>Size: About 17.4cm/6.85'</p><p>Weight: About 6.4g</p><p>Material: Agate stone</p><p>1 x Bracelet</p>,img/Bracelets/SKUC96366.jpg,,Size#,24.54,,,,1,1,,,Bracelets,,Vintage Colorful Natural Agate Stone Beaded Bracelet Irregular Pattern Bracelet Ethnic Jewelry,Vintage Colorful Natural Agate Stone Beaded Bracelet Irregular Pattern Bracelet Ethnic Jewelry,Vintage Colorful Natural Agate Stone Beaded Bracelet Irregular Pattern Bracelet Ethnic Jewelry,,,,,,,,,
OKHPAZX0141,Vintage Alloy Mushroom Star Flower Leaf Pattern Wedding Party Ring,,<p>Style: Vintage</p><p>Type: Ring</p><p>Color: Silver</p><p>Weight: 4.6g</p><p>Diameter Length: About 17.3/ 18.1/ 18.9/ 19.8/ 20.6/21.4mm</p><p>Material:  Alloy</p><p>Ring Size:  7 / 8 / 9 / 10 /11/12</p><p>(Please see the size reference for size conversion and detail information.)</p><p>Package Includes:</p><p>1 x Ring</p>,img/Rings/SKUH18787.jpg,,Size#7:8:9:10:11:12:,13.59,,,,1,1,,,Rings,,Vintage Alloy Mushroom Star Flower Leaf Pattern Wedding Party Ring,Vintage Alloy Mushroom Star Flower Leaf Pattern Wedding Party Ring,Vintage Alloy Mushroom Star Flower Leaf Pattern Wedding Party Ring,,,,,,,,,
OKHPAZX0142,Women PU Leather Rose Floral Money Clips 6.5 Inch Phone Bag Wallet Purse,,"<p>Color:Pink, Black, Grey, Purple, Red</p><p>Wallets Style:Zipper</p><p>Wallet Type:Money Clip, Phone Holder</p><p>Material:PU</p><p>Pattern:Floral</p>",img/Wallets/SKUH12669.jpg,,Size#,64.08,,,,1,1,,,Wallets,,Women PU Leather Rose Floral Money Clips 6.5 Inch Phone Bag Wallet Purse,Women PU Leather Rose Floral Money Clips 6.5 Inch Phone Bag Wallet Purse,Women PU Leather Rose Floral Money Clips 6.5 Inch Phone Bag Wallet Purse,,,,,,,,,
OKHPAZX0143,Women Fashion Almond Toe Backless Low Heeled Slingback Shoes,,"<p>Color:Red, Black, Brown, Apricot</p><p>Type:Mary Jane</p><p>Closure Type:Slip-On</p><p>Heel Type:Chunky Heel</p><p>Heel Height:3-5cm In Low Heel</p><p>Toe Type:AlmondToe</p><p>Pattern:Leopard, Solid</p><p>Design Element:Simple</p><p>Upper Material:PU</p><p>Style:Casual</p><p>Outsole Material:Rubber</p><p>Occasion:Date, Holiday, Casual</p><p>Function:Antiskid, Hard-wearing</p><p>Season:Summer, Autumn</p>",img/Heels/SKUH92304.jpg,,Size#US 5:US 6:US 7:US 8:US 9:US 10:US 11:US 12:,64.78,,,,1,1,,,Heels,,Women Fashion Almond Toe Backless Low Heeled Slingback Shoes,Women Fashion Almond Toe Backless Low Heeled Slingback Shoes,Women Fashion Almond Toe Backless Low Heeled Slingback Shoes,,,,,,,,,
OKHPAZX0144,Men Mesh Breathable Lace Up Sport Running Casual Shoes,,"<p>Color:Blue, Red</p><p>Upper Material:Mesh, PU</p><p>Outsole Material:Rubber</p><p>Type:Walking Shoes, Running Shoes</p><p>Function:Breathable, Soft</p><p>Occasion:Daily, Sport, Board</p><p>Closure Type:Lace-up</p><p>Season:All Season</p><p>Toe Type:Round</p>",img/Sneakers__Athletic/SKUG17116.jpg,,Size#US 6.5:US 7.5:US 8:US 8.5:US 9:US 10:,56.72,,,,1,1,,,Sneakers & Athletic,,Men Mesh Breathable Lace Up Sport Running Casual Shoes,Men Mesh Breathable Lace Up Sport Running Casual Shoes,Men Mesh Breathable Lace Up Sport Running Casual Shoes,,,,,,,,,
OKHPAZX0145,Solid Halter Drawstring Ruched Dress,,<p><b>Style</b>: Sexy</p><p><b>Color</b>: Mint Green</p><p><b>Pattern Type</b>: Plain</p><p><b>Length</b>: Short</p><p><b>Season</b>: Summer</p><p><b>Type</b>: Bodycon</p><p><b>Details</b>: Ruched</p><p><b>Details</b>: Drawstring</p><p><b>Sleeve Length</b>: Sleeveless</p><p><b>Neckline</b>: Halter</p><p><b>Waist Line</b>: Natural</p><p><b>Fit Type</b>: Slim Fit</p><p><b>Sheer</b>: No</p><p><b>Hem Shaped</b>: Pencil</p><p><b>Material</b>: Polyester</p><p><b>Composition</b>: 100% Polyester</p><p><b>Fabric</b>: High Stretch</p><p><b>Care Instructions</b>: Machine wash or professional dry clean</p><p><b>Style</b>: Sexy</p><p><b>Color</b>: Black</p><p><b>Pattern Type</b>: Plain</p><p><b>Length</b>: Short</p><p><b>Season</b>: Summer</p><p><b>Type</b>: Bodycon</p><p><b>Details</b>: Ruched</p><p><b>Details</b>: Drawstring</p><p><b>Sleeve Length</b>: Sleeveless</p><p><b>Neckline</b>: Halter</p><p><b>Waist Line</b>: Natural</p><p><b>Fit Type</b>: Slim Fit</p><p><b>Sheer</b>: No</p><p><b>Hem Shaped</b>: Pencil</p><p><b>Material</b>: Polyester</p><p><b>Composition</b>: 100% Polyester</p><p><b>Fabric</b>: High Stretch</p><p><b>Care Instructions</b>: Machine wash or professional dry clean</p>,img/Dresses/rw2107012444242172.jpg,,Size#S:M:L:,29.9,,,,1,1,,,Dresses,,Solid Halter Drawstring Ruched Dress,Solid Halter Drawstring Ruched Dress,Solid Halter Drawstring Ruched Dress,,,,,,,,,
OKHPAZX0146,Colorblock Tie Front Ribbed Top,,<p><b>Style</b>: Casual</p><p><b>Color</b>: Multicolor</p><p><b>Pattern Type</b>: Colorblock</p><p><b>Length</b>: Crop</p><p><b>Season</b>: Summer</p><p><b>Details</b>: Lettuce Trim</p><p><b>Details</b>: Rib-Knit</p><p><b>Details</b>: Tie Front</p><p><b>Fit Type</b>: Regular Fit</p><p><b>Sleeve Length</b>: Short Sleeve</p><p><b>Neckline</b>: V neck</p><p><b>Sleeve Type</b>: Regular Sleeve</p><p><b>Placket Type</b>: Placket</p><p><b>Sheer</b>: No</p><p><b>Material</b>: Cotton</p><p><b>Composition</b>: 65% Cotton</p><p><b>Composition</b>: 35% Polyester</p><p><b>Fabric</b>: Slight Stretch</p><p><b>Care Instructions</b>: Machine wash or professional dry clean</p>,img/Women_Tops/sW210615020329888.jpg,,Size#S:M:L:XL:,24.05,,,,1,1,,,Women Tops,,Colorblock Tie Front Ribbed Top,Colorblock Tie Front Ribbed Top,Colorblock Tie Front Ribbed Top,,,,,,,,,
OKHPAZX0147,Solid Paper Bag Waist Drawstring Shorts,,<p><b>Style</b>: Casual</p><p><b>Color</b>: Army Green</p><p><b>Pattern Type</b>: Plain</p><p><b>Season</b>: Summer</p><p><b>Type</b>: Wide Leg</p><p><b>Details</b>: Drawstring</p><p><b>Details</b>: Pocket</p><p><b>Details</b>: Paper Bag Waist</p><p><b>Waist Line</b>: High Waist</p><p><b>Fit Type</b>: Loose</p><p><b>Sheer</b>: No</p><p><b>Closure Type</b>: Drawstring Waist</p><p><b>Material</b>: Cotton</p><p><b>Composition</b>: 100% Cotton</p><p><b>Fabric</b>: Non-Stretch</p><p><b>Care Instructions</b>: Machine wash or professional dry clean</p>,img/Shorts/swshorts29210104354.jpg,,Size#S:M:L:XL:,26.28,,,,1,1,,,Shorts,,Solid Paper Bag Waist Drawstring Shorts,Solid Paper Bag Waist Drawstring Shorts,Solid Paper Bag Waist Drawstring Shorts,,,,,,,,,
OKHPAZX0148,Letter Graphic Contrast Piping Pleated Skirt,,<p><b>Style</b>: Sporty</p><p><b>Color</b>: White</p><p><b>Pattern Type</b>: Letter</p><p><b>Length</b>: Mini</p><p><b>Type</b>: A Line</p><p><b>Season</b>: Summer</p><p><b>Waist Line</b>: High Waist</p><p><b>Sheer</b>: No</p><p><b>Material</b>: Polyester</p><p><b>Composition</b>: 97% Polyester</p><p><b>Composition</b>: 3% Spandex</p><p><b>Fabric</b>: Non-Stretch</p><p><b>Care Instructions</b>: Machine wash or professional dry clean</p>,img/Skirts/swskirt07210310834.jpg,,Size#XS:S:M:L:XL:,32.45,,,,1,1,,,Skirts,,Letter Graphic Contrast Piping Pleated Skirt,Letter Graphic Contrast Piping Pleated Skirt,Letter Graphic Contrast Piping Pleated Skirt,,,,,,,,,
OKHPAZX0149,Vintage Printed Black Cat Flower Women Bracelet Multilayer Butterfly Pendant Bracelet,,"<p>Style: Vintage</p><p>Type: Bracelet </p><p>Color: Blue, White, Brown, Pink</p><p>Weight: 14g</p><p>Size</p><p>: About 17+5 cm / 6</p><p>.69</p><p>+1.97 in</p><p>Glass Size: About 2.5 cm / 0.98 in</p><p>Material: Alloy, Glass, Leather</p><p>1 x </p><p>Bracelet </p>",img/Bracelets/SKUG60638.jpg,,Size#,18.8,,,,1,1,,,Bracelets,,Vintage Printed Black Cat Flower Women Bracelet Multilayer Butterfly Pendant Bracelet,Vintage Printed Black Cat Flower Women Bracelet Multilayer Butterfly Pendant Bracelet,Vintage Printed Black Cat Flower Women Bracelet Multilayer Butterfly Pendant Bracelet,,,,,,,,,
OKHPAZX0150,Vintage Inlaid Diamond Women Ring Hollow Painted Flower Leaf Ring Jewelry Gift,,"<p>Style: Vintage </p><p>Type: Ring</p><p>Color: Gold</p><p>Weight: 11.5g</p><p>Size: 7, 8, 9, 10, 11</p><p>Material: Alloy</p><p>1 x Ring</p>",img/Rings/SKUG97546.jpg,,Size#7:8:9:10:11:,15.15,,,,1,1,,,Rings,,Vintage Inlaid Diamond Women Ring Hollow Painted Flower Leaf Ring Jewelry Gift,Vintage Inlaid Diamond Women Ring Hollow Painted Flower Leaf Ring Jewelry Gift,Vintage Inlaid Diamond Women Ring Hollow Painted Flower Leaf Ring Jewelry Gift,,,,,,,,,
OKHPAZX0151,Women 10 Card Slots Rfid Genuine Leather Short Zipper Coin Purse Wallet,,<p>Color:Black</p><p>Style:Vintage</p>,img/Wallets/SKUF34583.jpg,,Size#,62.57,,,,1,1,,,Wallets,,Women 10 Card Slots Rfid Genuine Leather Short Zipper Coin Purse Wallet,Women 10 Card Slots Rfid Genuine Leather Short Zipper Coin Purse Wallet,Women 10 Card Slots Rfid Genuine Leather Short Zipper Coin Purse Wallet,,,,,,,,,
OKHPAZX0152,Women Mesh Flower Embroidery Low-Heeled Loafers Shoes,,"<p>Color:Golden, Black, Pink, Blue</p><p>Type:Loafers</p><p>Closure Type:Slip-On</p><p>Heel Type:Chunky Heel</p><p>Heel Height:1-3cm In Flat</p><p>Toe Type:Pointed</p><p>Pattern:Calico</p><p>Design Element:Embroidered</p><p>Upper Material:Mesh</p><p>Style:Casual, Elegant</p><p>Outsole Material:Rubber</p><p>Occasion:Casual</p><p>Function:Breathable</p><p>Season:Summer, Autumn</p>",img/Heels/SKUH80004.jpg,,Size#US 5:US 6:US 7:US 8:US 9:,56.67,,,,1,1,,,Heels,,Women Mesh Flower Embroidery Low-Heeled Loafers Shoes,Women Mesh Flower Embroidery Low-Heeled Loafers Shoes,Women Mesh Flower Embroidery Low-Heeled Loafers Shoes,,,,,,,,,
OKHPAZX0153,Men Pure Color Leather Lace Up Sport Casual Running Shoes,,"<p>Color:Black, Blue, Grey, White</p><p>Upper Material:PU</p><p>Outsole Material:Rubber</p><p>Type:Walking Shoes</p><p>Function:Slip Resistant</p><p>Closure Type:Lace-up</p><p>Season:All Season</p><p>Toe Type:Round</p>",img/Sneakers__Athletic/SKUD79070.jpg,,Size#US 6.5:US 7.5:US 8:US 8.5:US 9:US 10:US 10.5:US 11:,63.57,,,,1,1,,,Sneakers & Athletic,,Men Pure Color Leather Lace Up Sport Casual Running Shoes,Men Pure Color Leather Lace Up Sport Casual Running Shoes,Men Pure Color Leather Lace Up Sport Casual Running Shoes,,,,,,,,,
OKHPAZX0154,Solid Drawstring Ruched Halter Dress,,<p><b>Style</b>: Sexy</p><p><b>Color</b>: Mint Green</p><p><b>Pattern Type</b>: Plain</p><p><b>Length</b>: Mini</p><p><b>Season</b>: Summer</p><p><b>Type</b>: Bodycon</p><p><b>Details</b>: Ruched</p><p><b>Details</b>: Drawstring</p><p><b>Details</b>: Knot</p><p><b>Details</b>: Rib-Knit</p><p><b>Sleeve Length</b>: Sleeveless</p><p><b>Neckline</b>: Halter</p><p><b>Waist Line</b>: Natural</p><p><b>Fit Type</b>: Slim Fit</p><p><b>Sheer</b>: No</p><p><b>Hem Shaped</b>: Pencil</p><p><b>Material</b>: Cotton Blends</p><p><b>Composition</b>: 65% Cotton</p><p><b>Composition</b>: 35% Polyester</p><p><b>Fabric</b>: Medium Stretch</p><p><b>Care Instructions</b>: Machine wash or professional dry clean</p><p><b>Style</b>: Sexy</p><p><b>Color</b>: Black</p><p><b>Pattern Type</b>: Plain</p><p><b>Length</b>: Mini</p><p><b>Season</b>: Summer</p><p><b>Type</b>: Bodycon</p><p><b>Details</b>: Ruched</p><p><b>Details</b>: Drawstring</p><p><b>Details</b>: Knot</p><p><b>Details</b>: Rib-Knit</p><p><b>Sleeve Length</b>: Sleeveless</p><p><b>Neckline</b>: Halter</p><p><b>Waist Line</b>: Natural</p><p><b>Fit Type</b>: Slim Fit</p><p><b>Sheer</b>: No</p><p><b>Hem Shaped</b>: Pencil</p><p><b>Material</b>: Cotton Blends</p><p><b>Composition</b>: 65% Cotton</p><p><b>Composition</b>: 35% Polyester</p><p><b>Fabric</b>: Medium Stretch</p><p><b>Care Instructions</b>: Machine wash or professional dry clean</p>,img/Dresses/rwdress25210603302.jpg,,Size#S:M:L:,29.39,,,,1,1,,,Dresses,,Solid Drawstring Ruched Halter Dress,Solid Drawstring Ruched Halter Dress,Solid Drawstring Ruched Halter Dress,,,,,,,,,
OKHPAZX0155,Colorblock Stitch Trim One Shoulder Top,,<p><b>Style</b>: Casual</p><p><b>Color</b>: Multicolor</p><p><b>Pattern Type</b>: Colorblock</p><p><b>Length</b>: Crop</p><p><b>Season</b>: Summer</p><p><b>Details</b>: Rib-Knit</p><p><b>Neckline</b>: One Shoulder</p><p><b>Sleeve Length</b>: Sleeveless</p><p><b>Fit Type</b>: Slim Fit</p><p><b>Placket Type</b>: Pullovers</p><p><b>Sheer</b>: No</p><p><b>Material</b>: Polyester</p><p><b>Composition</b>: 100% Polyester</p><p><b>Fabric</b>: High Stretch</p><p><b>Care Instructions</b>: Machine wash or professional dry clean</p>,img/Women_Tops/rwtop25210618315.jpg,,Size#S:M:L:,28.9,,,,1,1,,,Women Tops,,Colorblock Stitch Trim One Shoulder Top,Colorblock Stitch Trim One Shoulder Top,Colorblock Stitch Trim One Shoulder Top,,,,,,,,,
OKHPAZX0156,Embroidered Butterfly Graphic Drawstring Shorts,,<p><b>Style</b>: Casual</p><p><b>Color</b>: Green</p><p><b>Pattern Type</b>: Animal</p><p><b>Season</b>: Summer</p><p><b>Type</b>: Track Shorts</p><p><b>Details</b>: Drawstring</p><p><b>Details</b>: Embroidery</p><p><b>Waist Line</b>: Natural</p><p><b>Fit Type</b>: Regular Fit</p><p><b>Sheer</b>: No</p><p><b>Closure Type</b>: Drawstring Waist</p><p><b>Closure Type</b>: Elastic Waist</p><p><b>Material</b>: Polyester</p><p><b>Composition</b>: 95% Polyester</p><p><b>Composition</b>: 5% Spandex</p><p><b>Fabric</b>: Slight Stretch</p><p><b>Care Instructions</b>: Machine wash or professional dry clean</p>,img/Shorts/swshorts07200525103.jpg,,Size#XS:S:M:L:XL:,28.95,,,,1,1,,,Shorts,,Embroidered Butterfly Graphic Drawstring Shorts,Embroidered Butterfly Graphic Drawstring Shorts,Embroidered Butterfly Graphic Drawstring Shorts,,,,,,,,,
OKHPAZX0157,Ditsy Floral Split Skirt,,<p><b>Style</b>: Boho</p><p><b>Color</b>: Multicolor</p><p><b>Pattern Type</b>: Ditsy Floral</p><p><b>Length</b>: Mini</p><p><b>Type</b>: Straight</p><p><b>Season</b>: Summer</p><p><b>Details</b>: Split</p><p><b>Waist Line</b>: High Waist</p><p><b>Sheer</b>: No</p><p><b>Belt</b>: No</p><p><b>Body</b>: Lined</p><p><b>Material</b>: Cotton</p><p><b>Composition</b>: 65% Cotton</p><p><b>Composition</b>: 35% Polyester</p><p><b>Fabric</b>: Slight Stretch</p><p><b>Care Instructions</b>: Machine wash or professional dry clean</p>,img/Skirts/rwskirt03210310298.jpg,,Size#S:M:L:,31.98,,,,1,1,,,Skirts,,Ditsy Floral Split Skirt,Ditsy Floral Split Skirt,Ditsy Floral Split Skirt,,,,,,,,,
OKHPAZX0158,Ethnic Multi-Layer Beaded Bracelet Colorful Natural Stone Alloy Pendant Bracelet For Women,,"<p>Style:Ethnic</p><p>Type:Bracelet</p><p>Main Color: /Color:4 Colors for choose</p><p>Weight: about 37.2g</p><p>Chain Length:about 180mm/7.08</p><p>Material:Zinc Alloy,Acrylic,Resin</p><p>1 x Bracelet</p>",img/Bracelets/SKUB66818.jpg,,Size#,18.63,,,,1,1,,,Bracelets,,Ethnic Multi-Layer Beaded Bracelet Colorful Natural Stone Alloy Pendant Bracelet For Women,Ethnic Multi-Layer Beaded Bracelet Colorful Natural Stone Alloy Pendant Bracelet For Women,Ethnic Multi-Layer Beaded Bracelet Colorful Natural Stone Alloy Pendant Bracelet For Women,,,,,,,,,
OKHPAZX0159,Elegant Zircon Inlaid Gold Daisy Hollow Platinum Rings Topaz Zirconia Rings for Women Gift,,"<p>Type: </p><p>Main Color: Gold, Silver, Yellow</p><p>Weight: About 5.7g</p><p>
	</p><p>1 x Ring</p>",img/Rings/SKU844512.jpg,,Size#6:7:8:9:,14.04,,,,1,1,,,Rings,,Elegant Zircon Inlaid Gold Daisy Hollow Platinum Rings Topaz Zirconia Rings for Women Gift,Elegant Zircon Inlaid Gold Daisy Hollow Platinum Rings Topaz Zirconia Rings for Women Gift,Elegant Zircon Inlaid Gold Daisy Hollow Platinum Rings Topaz Zirconia Rings for Women Gift,,,,,,,,,
OKHPAZX0160,Women Vintage Bifold Genuine Leather Patchwork Long Wallet,,<p>Style:Vintage</p>,img/Wallets/SKUC02724.jpg,,Size#,59.65,,,,1,1,,,Wallets,,Women Vintage Bifold Genuine Leather Patchwork Long Wallet,Women Vintage Bifold Genuine Leather Patchwork Long Wallet,Women Vintage Bifold Genuine Leather Patchwork Long Wallet,,,,,,,,,
OKHPAZX0161,SOCOFY Retro Metal Buckle Strap Decor Flowers Embossed Leather Side Zipper Chunky Heel Shoes,,"<p>Color:Black</p><p>Type:Mary Jane</p><p>Closure Type:Side-zip</p><p>Heel Type:Chunky Heel</p><p>Heel Height:3-5cm In Low Heel</p><p>Toe Type:AlmondToe</p><p>Pattern:Calico</p><p>Design Element:Metal</p><p>Style:Casual, Retro</p><p>Outsole Material:Rubber</p><p>Structure:Side-zip</p><p>Occasion:Party, Casual</p><p>Function:Hard-wearing</p><p>Season:Spring&Summer, Spring&Fall</p>",img/Heels/SKUG03747.jpg,,Size#US 5:US 6:US 7:US 8:US 9.5:US 10.5:US 11.5:,50.0,,,,1,1,,,Heels,,SOCOFY Retro Metal Buckle Strap Decor Flowers Embossed Leather Side Zipper Chunky Heel Shoes,SOCOFY Retro Metal Buckle Strap Decor Flowers Embossed Leather Side Zipper Chunky Heel Shoes,SOCOFY Retro Metal Buckle Strap Decor Flowers Embossed Leather Side Zipper Chunky Heel Shoes,,,,,,,,,
OKHPAZX0162,Men Breathable Slip Resistant Casual Daily Canvas Sneakers,,"<p>Color:Black, Grey, Khaki</p><p>Upper Material:Canvas</p><p>Outsole Material:Rubber</p><p>Type:Skate Shoes</p><p>Function:Breathable, Hard-wearing</p><p>Occasion:Daily, Sport</p><p>Closure Type:Lace-up</p><p>Season:Summer, Spring&Fall</p><p>Toe Type:Round</p>",img/Sneakers__Athletic/SKUH16470.jpg,,Size#US 6.5:US 7.5:US 8:US 8.5:US 9:US 10:,55.28,,,,1,1,,,Sneakers & Athletic,,Men Breathable Slip Resistant Casual Daily Canvas Sneakers,Men Breathable Slip Resistant Casual Daily Canvas Sneakers,Men Breathable Slip Resistant Casual Daily Canvas Sneakers,,,,,,,,,
OKHPAZX0163,Plaid Button Front Dress,,<p><b>Style</b>: Preppy</p><p><b>Color</b>: Multicolor</p><p><b>Pattern Type</b>: Plaid</p><p><b>Length</b>: Mini</p><p><b>Season</b>: Summer</p><p><b>Type</b>: Fitted</p><p><b>Details</b>: Button Front</p><p><b>Sleeve Length</b>: Short Sleeve</p><p><b>Neckline</b>: Lapel</p><p><b>Waist Line</b>: Natural</p><p><b>Fit Type</b>: Regular Fit</p><p><b>Sleeve Type</b>: Regular Sleeve</p><p><b>Sheer</b>: No</p><p><b>Hem Shaped</b>: Straight</p><p><b>Material</b>: Cotton</p><p><b>Composition</b>: 65% Cotton</p><p><b>Composition</b>: 35% Polyester</p><p><b>Fabric</b>: Non-Stretch</p><p><b>Care Instructions</b>: Machine wash or professional dry clean</p>,img/Dresses/rwdress25210607367.jpg,,Size#XS:S:M:L:,22.85,,,,1,1,,,Dresses,,Plaid Button Front Dress,Plaid Button Front Dress,Plaid Button Front Dress,,,,,,,,,
OKHPAZX0164,Floral Embroidery Mesh Crop Tube Top,,<p><b>Style</b>: Sexy</p><p><b>Color</b>: Multicolor</p><p><b>Pattern Type</b>: Floral</p><p><b>Length</b>: Crop</p><p><b>Season</b>: Summer</p><p><b>Details</b>: Embroidery</p><p><b>Sleeve Length</b>: Sleeveless</p><p><b>Fit Type</b>: Slim Fit</p><p><b>Neckline</b>: Strapless</p><p><b>Placket Type</b>: Placket</p><p><b>Sheer</b>: Yes</p><p><b>Material</b>: Schiffy</p><p><b>Composition</b>: 95% Polyester</p><p><b>Composition</b>: 5% Spandex</p><p><b>Fabric</b>: Slight Stretch</p><p><b>Care Instructions</b>: Machine wash or professional dry clean</p><p><b>Style</b>: Sexy</p><p><b>Color</b>: Red and White</p><p><b>Pattern Type</b>: Floral</p><p><b>Length</b>: Crop</p><p><b>Season</b>: Summer</p><p><b>Details</b>: Embroidery</p><p><b>Sleeve Length</b>: Sleeveless</p><p><b>Fit Type</b>: Slim Fit</p><p><b>Neckline</b>: Strapless</p><p><b>Placket Type</b>: Placket</p><p><b>Sheer</b>: Yes</p><p><b>Material</b>: Schiffy</p><p><b>Composition</b>: 95% Polyester</p><p><b>Composition</b>: 5% Spandex</p><p><b>Fabric</b>: Slight Stretch</p><p><b>Care Instructions</b>: Machine wash or professional dry clean</p><p><b>Style</b>: Sexy</p><p><b>Color</b>: Black and White</p><p><b>Pattern Type</b>: Floral</p><p><b>Length</b>: Crop</p><p><b>Season</b>: Summer</p><p><b>Details</b>: Embroidery</p><p><b>Sleeve Length</b>: Sleeveless</p><p><b>Fit Type</b>: Slim Fit</p><p><b>Neckline</b>: Strapless</p><p><b>Placket Type</b>: Placket</p><p><b>Sheer</b>: Yes</p><p><b>Material</b>: Schiffy</p><p><b>Composition</b>: 95% Polyester</p><p><b>Composition</b>: 5% Spandex</p><p><b>Fabric</b>: Slight Stretch</p><p><b>Care Instructions</b>: Machine wash or professional dry clean</p><p><b>Style</b>: Casual</p><p><b>Color</b>: Blue and White</p><p><b>Pattern Type</b>: Floral</p><p><b>Length</b>: Crop</p><p><b>Season</b>: Summer</p><p><b>Details</b>: Embroidery</p><p><b>Sleeve Length</b>: Sleeveless</p><p><b>Fit Type</b>: Slim Fit</p><p><b>Neckline</b>: Strapless</p><p><b>Placket Type</b>: Pullovers</p><p><b>Sheer</b>: Yes</p><p><b>Material</b>: Schiffy</p><p><b>Composition</b>: 95% Polyester</p><p><b>Composition</b>: 5% Spandex</p><p><b>Fabric</b>: Slight Stretch</p><p><b>Care Instructions</b>: Machine wash or professional dry clean</p>,img/Women_Tops/rwtop25210507545.jpg,,Size#S:M:L:,22.36,,,,1,1,,,Women Tops,,Floral Embroidery Mesh Crop Tube Top,Floral Embroidery Mesh Crop Tube Top,Floral Embroidery Mesh Crop Tube Top,,,,,,,,,
OKHPAZX0165,Letter Embroidery Shorts,,<p><b>Style</b>: Casual</p><p><b>Color</b>: Khaki</p><p><b>Pattern Type</b>: Letter</p><p><b>Season</b>: Summer</p><p><b>Type</b>: Track Shorts</p><p><b>Details</b>: Embroidery</p><p><b>Waist Line</b>: Natural</p><p><b>Fit Type</b>: Regular Fit</p><p><b>Sheer</b>: No</p><p><b>Closure Type</b>: Elastic Waist</p><p><b>Material</b>: Polyester</p><p><b>Composition</b>: 100% Polyester</p><p><b>Fabric</b>: Medium Stretch</p><p><b>Care Instructions</b>: Machine wash or professional dry clean</p>,img/Shorts/rwshorts25210524858.jpg,,Size#S:M:L:,32.84,,,,1,1,,,Shorts,,Letter Embroidery Shorts,Letter Embroidery Shorts,Letter Embroidery Shorts,,,,,,,,,
OKHPAZX0166,Sun & Moon Graphic Drawstring Skirt,,<p><b>Style</b>: Casual</p><p><b>Color</b>: Black</p><p><b>Pattern Type</b>: Graphic</p><p><b>Length</b>: Mini</p><p><b>Type</b>: Bodycon</p><p><b>Season</b>: Summer</p><p><b>Details</b>: Drawstring</p><p><b>Details</b>: Ruched</p><p><b>Waist Line</b>: Natural</p><p><b>Sheer</b>: No</p><p><b>Material</b>: Cotton</p><p><b>Composition</b>: 65% Cotton</p><p><b>Composition</b>: 35% Polyester</p><p><b>Fabric</b>: Medium Stretch</p><p><b>Care Instructions</b>: Machine wash or professional dry clean</p>,img/Skirts/rw2106218119879915.jpg,,Size#S:M:L:,22.83,,,,1,1,,,Skirts,,Sun & Moon Graphic Drawstring Skirt,Sun & Moon Graphic Drawstring Skirt,Sun & Moon Graphic Drawstring Skirt,,,,,,,,,
OKHPAZX0167,Vintage Purple Cat Pattern Print Butterfly Braided Gemstone Multi-layer Bracelet,,"<p>Style: Retro </p><p>Type: Bracelet</p><p>Main Color: 4 colors for your choose</p><p>Chain Length: 17cm+5cm/6.69inch+1.97inch</p><p>Weight: About 14g</p><p>Material: Alloy, glass</p><p>1 X Bracelet</p>",img/Bracelets/SKUH10999.jpg,,Size#,24.21,,,,1,1,,,Bracelets,,Vintage Purple Cat Pattern Print Butterfly Braided Gemstone Multi-layer Bracelet,Vintage Purple Cat Pattern Print Butterfly Braided Gemstone Multi-layer Bracelet,Vintage Purple Cat Pattern Print Butterfly Braided Gemstone Multi-layer Bracelet,,,,,,,,,
OKHPAZX0168,Alloy Diamond 3D Butterfly-shape Ring For Women,,"<p>Style: Vintage</p><p>Type: Rings</p><p>Color: Silver,Green,Pink</p><p>Weight: 9g</p><p>Length: As the picture shown</p><p>Material:  Alloy</p><p>Package Includes:</p><p>1 x Ring</p><p>Notice:</p>",img/Rings/SKUH70915.jpg,,Size#,21.71,,,,1,1,,,Rings,,Alloy Diamond 3D Butterfly-shape Ring For Women,Alloy Diamond 3D Butterfly-shape Ring For Women,Alloy Diamond 3D Butterfly-shape Ring For Women,,,,,,,,,
OKHPAZX0169,Women Vintage Multifunction Hand-printed Ethnic Chinese Style Wallet,,"<p>Color:Khaki</p><p>Wallets Style:Zipper</p><p>Wallet Type:Money Clip, Phone Holder</p><p>Material:Faux Fur, Canvas, PU</p>",img/Wallets/SKUH12716.jpg,,Size#,59.94,,,,1,1,,,Wallets,,Women Vintage Multifunction Hand-printed Ethnic Chinese Style Wallet,Women Vintage Multifunction Hand-printed Ethnic Chinese Style Wallet,Women Vintage Multifunction Hand-printed Ethnic Chinese Style Wallet,,,,,,,,,
OKHPAZX0170,Women Comfy Soft Sole Hollow Stitching Buckle Heels Sandals,,"<p>Color:Black, Brown, Apricot</p><p>Type:Peep-toe Pumps shoes</p><p>Closure Type:Buckle</p><p>Heel Type:Chunky Heel</p><p>Heel Height:5-8cm In Heel</p><p>Toe Type:AlmondToe</p><p>Pattern:Solid</p><p>Design Element:Hollow out, Stitching</p><p>Upper Material:PU</p><p>Style:Casual</p><p>Outsole Material:Rubber</p><p>Structure:Buckle</p><p>Occasion:Casual</p><p>Function:Breathable, Antiskid</p><p>Season:Summer, Autumn, Spring</p>",img/Heels/SKUH95515.jpg,,Size#US 5:US 6:US 7:US 8:US 9:US 10:,61.34,,,,1,1,,,Heels,,Women Comfy Soft Sole Hollow Stitching Buckle Heels Sandals,Women Comfy Soft Sole Hollow Stitching Buckle Heels Sandals,Women Comfy Soft Sole Hollow Stitching Buckle Heels Sandals,,,,,,,,,
