v_sku,v_name,v_short_description,v_description,v_image,v_url,v_attribute,v_price,v_specials_price,v_specials_expire_date,v_date_added,v_in_stock,v_status,v_viewed,v_ordered,v_category_sku,v_sort_order,v_meta_title,v_meta_keywords,v_meta_description,v_brand_filter,v_class_filter,v_color_filter,v_gender_filter,v_material_filter,v_year_filter,v_origin_filter,v_series_filter,v_spec_filter
OKHPAZX0036,Men Fabric Mesh Comfy Non Slip Breathable Casual Sports Sneakers,,"<p>Color:Black, Grey</p><p>Outsole Material:PU</p><p>Function:Breathable, Soft, Slip Resistant</p><p>Closure Type:Lace-up</p><p>Season:Summer</p><p>Toe Type:Round</p>",img/Sneakers__Athletic/SKUE91806.jpg,,Size#US 6.5:US 7.5:US 8:US 8.5:US 9:US 10:US 10.5:US 11:US 11.5:US 12:,54.61,,,,1,1,,,Sneakers & Athletic,,Men Fabric Mesh Comfy Non Slip Breathable Casual Sports Sneakers,Men Fabric Mesh Comfy Non Slip Breathable Casual Sports Sneakers,Men Fabric Mesh Comfy Non Slip Breathable Casual Sports Sneakers,,,,,,,,,
OKHPAZX0037,Ditsy Floral Ruched Bust Cami Dress,,<p><b>Style</b>: Boho</p><p><b>Color</b>: Mint Blue</p><p><b>Pattern Type</b>: Ditsy Floral</p><p><b>Length</b>: Mini</p><p><b>Season</b>: Summer</p><p><b>Type</b>: Cami</p><p><b>Details</b>: Ruched Bust</p><p><b>Sleeve Length</b>: Sleeveless</p><p><b>Neckline</b>: Spaghetti Strap</p><p><b>Waist Line</b>: Natural</p><p><b>Fit Type</b>: Slim Fit</p><p><b>Sheer</b>: No</p><p><b>Hem Shaped</b>: Straight</p><p><b>Material</b>: Polyester</p><p><b>Composition</b>: 95% Polyester</p><p><b>Composition</b>: 5% Elastane</p><p><b>Fabric</b>: Medium Stretch</p><p><b>Care Instructions</b>: Machine wash or professional dry clean</p>,img/Dresses/rwdress25210609794.jpg,,Size#XS:S:M:L:,28.17,,,,1,1,,,Dresses,,Ditsy Floral Ruched Bust Cami Dress,Ditsy Floral Ruched Bust Cami Dress,Ditsy Floral Ruched Bust Cami Dress,,,,,,,,,
OKHPAZX0038,Leopard Criss Cross Crop Tube Top,,<p><b>Style</b>: Sexy</p><p><b>Color</b>: Multicolor</p><p><b>Pattern Type</b>: Leopard</p><p><b>Length</b>: Crop</p><p><b>Season</b>: Summer</p><p><b>Details</b>: Criss Cross</p><p><b>Fit Type</b>: Regular Fit</p><p><b>Sleeve Length</b>: Sleeveless</p><p><b>Neckline</b>: Strapless</p><p><b>Placket Type</b>: Pullovers</p><p><b>Sheer</b>: No</p><p><b>Material</b>: Polyester</p><p><b>Composition</b>: 65% Polyester</p><p><b>Composition</b>: 35% Cotton</p><p><b>Fabric</b>: Slight Stretch</p><p><b>Care Instructions</b>: Machine wash or professional dry clean</p>,img/Women_Tops/rwtop25210519316.jpg,,Size#S:M:L:,22.89,,,,1,1,,,Women Tops,,Leopard Criss Cross Crop Tube Top,Leopard Criss Cross Crop Tube Top,Leopard Criss Cross Crop Tube Top,,,,,,,,,
OKHPAZX0039,Knot Front Paper Bag Waist Shorts,,<p><b>Style</b>: Casual</p><p><b>Color</b>: Navy Blue</p><p><b>Pattern Type</b>: Plain</p><p><b>Length</b>: Cropped</p><p><b>Season</b>: Summer</p><p><b>Type</b>: Wide Leg</p><p><b>Details</b>: Drawstring</p><p><b>Waist Line</b>: Natural</p><p><b>Fit Type</b>: Regular Fit</p><p><b>Sheer</b>: No</p><p><b>Closure Type</b>: Drawstring Waist</p><p><b>Material</b>: Polyester</p><p><b>Composition</b>: 100% Polyester</p><p><b>Fabric</b>: Non-Stretch</p><p><b>Care Instructions</b>: Machine wash or professional dry clean</p>,img/Shorts/swshorts44210527519.jpg,,Size#XS:S:M:L:,28.49,,,,1,1,,,Shorts,,Knot Front Paper Bag Waist Shorts,Knot Front Paper Bag Waist Shorts,Knot Front Paper Bag Waist Shorts,,,,,,,,,
OKHPAZX0040,Solid Paperclip Detail Mini Skirt,,<p><b>Style</b>: Casual</p><p><b>Color</b>: Black</p><p><b>Pattern Type</b>: Plain</p><p><b>Length</b>: Short</p><p><b>Type</b>: A Line</p><p><b>Details</b>: Zipper</p><p><b>Waist Line</b>: High Waist</p><p><b>Sheer</b>: No</p><p><b>Belt</b>: No</p><p><b>Material</b>: Polyester</p><p><b>Composition</b>: 95% Polyester</p><p><b>Composition</b>: 5% Elastane</p><p><b>Fabric</b>: Slight Stretch</p><p><b>Care Instructions</b>: Machine wash or professional dry clean</p>,img/Skirts/swskirt25210604517.jpg,,Size#XS:S:M:L:,24.31,,,,1,1,,,Skirts,,Solid Paperclip Detail Mini Skirt,Solid Paperclip Detail Mini Skirt,Solid Paperclip Detail Mini Skirt,,,,,,,,,
OKHPAZX0041,Ethnic Tibetan Silver Leaf Pendant Colorful Bead Bracelet Bohemian Bangle for Her,,"<p>Style: Bohemian</p><p>Weight: About 30g</p><p>Type: Bead Bracelet</p><p>Main Color: Red, Black, Blue</p><p>Length: About 20cm / 7.87' (Adjustable)</p><p>Material: Tibetan Silver, Zinc Alloy, Acrylic, Stainless Steel, Resin</p><p>1 x Bracelet</p>",img/Bracelets/SKU824302.jpg,,Size#,15.59,,,,1,1,,,Bracelets,,Ethnic Tibetan Silver Leaf Pendant Colorful Bead Bracelet Bohemian Bangle for Her,Ethnic Tibetan Silver Leaf Pendant Colorful Bead Bracelet Bohemian Bangle for Her,Ethnic Tibetan Silver Leaf Pendant Colorful Bead Bracelet Bohemian Bangle for Her,,,,,,,,,
OKHPAZX0042,Vintage Starry Moonstone Ring,,"<p>Style: Vintage</p><p>Type: Ring</p><p>Color: Silver</p><p>Weight: 12g</p><p>Size: 6,7, 8, 9, 10</p><p>Material: 925 Ancient Silver</p><p>1 x Ring</p>",img/Rings/SKUH10804.jpg,,Size#6:7:8:9:10:,20.48,,,,1,1,,,Rings,,Vintage Starry Moonstone Ring,Vintage Starry Moonstone Ring,Vintage Starry Moonstone Ring,,,,,,,,,
OKHPAZX0043,Women Genuine Leather RIFD Money Clip Wallet Purse Coin Purse,,"<p>Color:Pink, Yellow, Black, Khaki, Rose</p><p>Wallets Style:RFID, Zipper</p><p>Wallet Type:Money Clip, ID Wallets, Coin Purse</p><p>Style:Casual</p><p>Pattern:Solid</p>",img/Wallets/SKUF67825.jpg,,Size#,68.97,,,,1,1,,,Wallets,,Women Genuine Leather RIFD Money Clip Wallet Purse Coin Purse,Women Genuine Leather RIFD Money Clip Wallet Purse Coin Purse,Women Genuine Leather RIFD Money Clip Wallet Purse Coin Purse,,,,,,,,,
OKHPAZX0044,SOCOFY Floral Cloth Splicing Printed Leather Colorful Ankle Metal Strap Side Zipper Comfy Wearable Heels Pumps,,"<p>Color:Brown</p><p>Type:Loafers</p><p>Closure Type:Side-zip</p><p>Heel Type:Cone Heel</p><p>Heel Height:5-8cm In Heel</p><p>Toe Type:Round</p><p>Pattern:Floral</p><p>Design Element:Patchwork, Pattern</p><p>Upper Material:Leather, Cloth</p><p>Style:Casual, Retro</p><p>Outsole Material:Rubber</p><p>Structure:Buckle, Side-zip</p><p>Occasion:Party, Casual</p><p>Function:Hard-wearing</p><p>Season:Summer, Spring&Fall</p>",img/Heels/SKUH18388.jpg,,Size#US 5:US 6:US 7:US 8:US 9.5:US 10.5:US 11.5:,51.67,,,,1,1,,,Heels,,SOCOFY Floral Cloth Splicing Printed Leather Colorful Ankle Metal Strap Side Zipper Comfy Wearable Heels Pumps,SOCOFY Floral Cloth Splicing Printed Leather Colorful Ankle Metal Strap Side Zipper Comfy Wearable Heels Pumps,SOCOFY Floral Cloth Splicing Printed Leather Colorful Ankle Metal Strap Side Zipper Comfy Wearable Heels Pumps,,,,,,,,,
OKHPAZX0045,Men Breathable Knitted Fabric Color Blocking Lace-up Chunky Sneaker Shoes,,"<p>Color:White, Red</p><p>Upper Material:Mesh, PU</p><p>Outsole Material:EVA</p><p>Type:Walking Shoes, Chunky Sneaker shoes</p><p>Function:Breathable, Hard-wearing, Sport</p><p>Occasion:Outdoor, Daily, Sport</p><p>Closure Type:Lace-up</p><p>Season:Summer</p><p>Toe Type:Round</p>",img/Sneakers__Athletic/SKUH46839.jpg,,Size#US 7.5:US 8:US 8.5:US 9:US 10:,52.61,,,,1,1,,,Sneakers & Athletic,,Men Breathable Knitted Fabric Color Blocking Lace-up Chunky Sneaker Shoes,Men Breathable Knitted Fabric Color Blocking Lace-up Chunky Sneaker Shoes,Men Breathable Knitted Fabric Color Blocking Lace-up Chunky Sneaker Shoes,,,,,,,,,
OKHPAZX0046,Slit Side Contrast Binding Dress,,<p><b>Style</b>: Casual</p><p><b>Color</b>: Lilac Purple</p><p><b>Length</b>: Mini</p><p><b>Season</b>: Summer</p><p><b>Type</b>: Bodycon</p><p><b>Details</b>: Split</p><p><b>Details</b>: Rib-Knit</p><p><b>Details</b>: Contrast Binding</p><p><b>Sleeve Length</b>: Sleeveless</p><p><b>Neckline</b>: Round Neck</p><p><b>Waist Line</b>: Natural</p><p><b>Fit Type</b>: Slim Fit</p><p><b>Sheer</b>: No</p><p><b>Hem Shaped</b>: Pencil</p><p><b>Material</b>: Cotton</p><p><b>Composition</b>: 94% Cotton</p><p><b>Composition</b>: 6% Elastane</p><p><b>Fabric</b>: Slight Stretch</p><p><b>Care Instructions</b>: Machine wash or professional dry clean</p>,img/Dresses/swdress07210512398.jpg,,Size#XS:S:M:L:XL:,28.26,,,,1,1,,,Dresses,,Slit Side Contrast Binding Dress,Slit Side Contrast Binding Dress,Slit Side Contrast Binding Dress,,,,,,,,,
OKHPAZX0047,Floral Lace Mesh Ruched Bust Top,,<p><b>Style</b>: Sexy</p><p><b>Color</b>: Black</p><p><b>Pattern Type</b>: Ditsy Floral</p><p><b>Length</b>: Crop</p><p><b>Season</b>: Summer</p><p><b>Details</b>: Frill</p><p><b>Details</b>: Ruched Bust</p><p><b>Sleeve Length</b>: Sleeveless</p><p><b>Fit Type</b>: Slim Fit</p><p><b>Neckline</b>: Straps</p><p><b>Placket Type</b>: Pullovers</p><p><b>Sheer</b>: Semi-Sheer</p><p><b>Material</b>: Mesh</p><p><b>Composition</b>: 100% Polyester</p><p><b>Fabric</b>: Slight Stretch</p><p><b>Care Instructions</b>: Machine wash or professional dry clean</p>,img/Women_Tops/sW210616010654120.jpg,,Size#XS:S:M:L:,32.5,,,,1,1,,,Women Tops,,Floral Lace Mesh Ruched Bust Top,Floral Lace Mesh Ruched Bust Top,Floral Lace Mesh Ruched Bust Top,,,,,,,,,
OKHPAZX0048,Chinese Dragon Color Block Shorts,,<p><b>Style</b>: Casual</p><p><b>Color</b>: Multicolor</p><p><b>Pattern Type</b>: Animal</p><p><b>Pattern Type</b>: Colorblock</p><p><b>Season</b>: Summer</p><p><b>Type</b>: Track Shorts</p><p><b>Waist Line</b>: High Waist</p><p><b>Fit Type</b>: Regular Fit</p><p><b>Sheer</b>: No</p><p><b>Closure Type</b>: Elastic Waist</p><p><b>Material</b>: Cotton</p><p><b>Composition</b>: 65% Cotton</p><p><b>Composition</b>: 35% Polyester</p><p><b>Fabric</b>: Slight Stretch</p><p><b>Care Instructions</b>: Machine wash or professional dry clean</p>,img/Shorts/swshorts23210127650.jpg,,Size#S:M:L:XL:,24.65,,,,1,1,,,Shorts,,Chinese Dragon Color Block Shorts,Chinese Dragon Color Block Shorts,Chinese Dragon Color Block Shorts,,,,,,,,,
OKHPAZX0049,Slit Hem Ditsy Floral Print Skirt,,<p><b>Style</b>: Boho</p><p><b>Color</b>: Black and White</p><p><b>Pattern Type</b>: Ditsy Floral</p><p><b>Length</b>: Mini</p><p><b>Type</b>: A Line</p><p><b>Season</b>: Summer</p><p><b>Details</b>: Split</p><p><b>Waist Line</b>: Natural</p><p><b>Sheer</b>: No</p><p><b>Material</b>: Polyester</p><p><b>Composition</b>: 95% Polyester</p><p><b>Composition</b>: 5% Spandex</p><p><b>Fabric</b>: Slight Stretch</p><p><b>Care Instructions</b>: Machine wash or professional dry clean</p>,img/Skirts/swskirt07200227659.jpg,,Size#XS:S:M:L:XL:,26.51,,,,1,1,,,Skirts,,Slit Hem Ditsy Floral Print Skirt,Slit Hem Ditsy Floral Print Skirt,Slit Hem Ditsy Floral Print Skirt,,,,,,,,,
OKHPAZX0050,Ethnic Beaded Bracelet Colorful Charm Bracelet Coloured Glaze Accessories Handmade Gift for Women,,"<p>Style: Vintage</p><p>Type: </p><p>Beaded Bracelet</p><p>Main Color: Silver</p><p>Weight: About 10g </p><p>Size: About 18cm + 5cm / 7.09' + 1.97' </p><p>Material: Zinc Alloy, Coloured Glaze</p><p>1 x Bracelet</p>",img/Bracelets/SKU984709.jpg,,Size#,19.33,,,,1,1,,,Bracelets,,Ethnic Beaded Bracelet Colorful Charm Bracelet Coloured Glaze Accessories Handmade Gift for Women,Ethnic Beaded Bracelet Colorful Charm Bracelet Coloured Glaze Accessories Handmade Gift for Women,Ethnic Beaded Bracelet Colorful Charm Bracelet Coloured Glaze Accessories Handmade Gift for Women,,,,,,,,,
OKHPAZX0051,Vintage Brief Flowers Woodpecker Hollow Alloy Rings,,"<p>Style: Vintage,Brief </p><p>Type: Rings</p><p>Color: Silver</p><p>Weight: 6 g</p><p>Ring Size: Diameter About 1.7 cm / 0.67 in</p><p>Material: Alloy</p><p>Package Includes:</p><p>1 x Ring</p><p>Notice:</p>",img/Rings/SKUI07549.jpg,,Size#,17.71,,,,1,1,,,Rings,,Vintage Brief Flowers Woodpecker Hollow Alloy Rings,Vintage Brief Flowers Woodpecker Hollow Alloy Rings,Vintage Brief Flowers Woodpecker Hollow Alloy Rings,,,,,,,,,
OKHPAZX0052,Women Genuine Leather Round Coin Purse Wallet,,"<p>Color:Yellow, Orange, Coffee, Green, Black, Brown, Blue, Red</p><p>Wallets Style:Clasp Closure</p><p>Wallet Type:Coin Purse</p><p>Material:Cow Leather</p><p>Pattern:Solid</p>",img/Wallets/SKUG27708.jpg,,Size#S:L:,70.44,,,,1,1,,,Wallets,,Women Genuine Leather Round Coin Purse Wallet,Women Genuine Leather Round Coin Purse Wallet,Women Genuine Leather Round Coin Purse Wallet,,,,,,,,,
OKHPAZX0053,SOCOFY Splicing Tie-dye Stitching Rivet Leather Hook Loop Metal Strap Comfy Wearable Cone Heel Pumps,,"<p>Color:Grey</p><p>Type:Loafers</p><p>Closure Type:Hook & Loop</p><p>Heel Type:Cone Heel</p><p>Heel Height:5-8cm In Heel</p><p>Toe Type:Round</p><p>Pattern:Tie-dye</p><p>Design Element:Patchwork, Print</p><p>Upper Material:PU, Leather</p><p>Style:Casual</p><p>Outsole Material:Rubber</p><p>Structure:Hook & Loop</p><p>Occasion:Party, Casual</p><p>Function:Hard-wearing</p><p>Season:Summer, Spring&Fall</p>",img/Heels/SKUH18396.jpg,,Size#US 5:US 6:US 7:US 8:US 9.5:US 10.5:US 11.5:,57.3,,,,1,1,,,Heels,,SOCOFY Splicing Tie-dye Stitching Rivet Leather Hook Loop Metal Strap Comfy Wearable Cone Heel Pumps,SOCOFY Splicing Tie-dye Stitching Rivet Leather Hook Loop Metal Strap Comfy Wearable Cone Heel Pumps,SOCOFY Splicing Tie-dye Stitching Rivet Leather Hook Loop Metal Strap Comfy Wearable Cone Heel Pumps,,,,,,,,,
OKHPAZX0054,Men Sport Fashion Comfy Wearable Platform Sneakers,,"<p>Color:Black, Blue, White, Orange</p><p>Upper Material:PU</p><p>Outsole Material:PVC</p><p>Type:Skate Shoes</p><p>Function:Hard-wearing</p><p>Occasion:Sport</p><p>Closure Type:Lace-up</p><p>Season:Summer, Spring&Fall</p><p>Toe Type:Round</p>",img/Sneakers__Athletic/SKUH25779.jpg,,Size#US 6.5:US 7.5:US 8:US 8.5:US 9:US 10:,51.26,,,,1,1,,,Sneakers & Athletic,,Men Sport Fashion Comfy Wearable Platform Sneakers,Men Sport Fashion Comfy Wearable Platform Sneakers,Men Sport Fashion Comfy Wearable Platform Sneakers,,,,,,,,,
OKHPAZX0055,Plaid Drop Sleeve Belted Shirt Dress,,<p><b>Style</b>: Casual</p><p><b>Color</b>: Multicolor</p><p><b>Pattern Type</b>: Plaid</p><p><b>Length</b>: Short</p><p><b>Season</b>: Spring/Fall</p><p><b>Type</b>: Shirt</p><p><b>Details</b>: Belted</p><p><b>Details</b>: Button</p><p><b>Sleeve Type</b>: Bishop Sleeve</p><p><b>Sleeve Length</b>: Long Sleeve</p><p><b>Neckline</b>: Collar</p><p><b>Waist Line</b>: High Waist</p><p><b>Fit Type</b>: Regular Fit</p><p><b>Sleeve Type</b>: Drop Shoulder</p><p><b>Sheer</b>: No</p><p><b>Hem Shaped</b>: Straight</p><p><b>Belt</b>: Yes</p><p><b>Material</b>: Polyester</p><p><b>Composition</b>: 100% Polyester</p><p><b>Fabric</b>: Non-Stretch</p><p><b>Care Instructions</b>: Machine wash or professional dry clean</p>,img/Dresses/swdress25210616201.jpg,,Size#XS:S:M:L:,32.98,,,,1,1,,,Dresses,,Plaid Drop Sleeve Belted Shirt Dress,Plaid Drop Sleeve Belted Shirt Dress,Plaid Drop Sleeve Belted Shirt Dress,,,,,,,,,
OKHPAZX0056,Stitching Trim Lace Up Top,,<p><b>Style</b>: Casual</p><p><b>Color</b>: Multicolor</p><p><b>Pattern Type</b>: Colorblock</p><p><b>Pattern Type</b>: Graphic</p><p><b>Length</b>: Crop</p><p><b>Season</b>: Spring/Fall</p><p><b>Details</b>: Lace Up</p><p><b>Sleeve Length</b>: Long Sleeve</p><p><b>Fit Type</b>: Regular Fit</p><p><b>Neckline</b>: Sweetheart</p><p><b>Sleeve Type</b>: Regular Sleeve</p><p><b>Placket Type</b>: Pullovers</p><p><b>Sheer</b>: No</p><p><b>Material</b>: Polyester</p><p><b>Composition</b>: 100% Polyester</p><p><b>Fabric</b>: Medium Stretch</p><p><b>Care Instructions</b>: Machine wash or professional dry clean</p>,img/Women_Tops/rwtop25210607531.jpg,,Size#S:M:L:,23.1,,,,1,1,,,Women Tops,,Stitching Trim Lace Up Top,Stitching Trim Lace Up Top,Stitching Trim Lace Up Top,,,,,,,,,
OKHPAZX0057,Contrast Binding Butterfly Print Track Shorts,,<p><b>Style</b>: Casual</p><p><b>Color</b>: Multicolor</p><p><b>Pattern Type</b>: Animal</p><p><b>Type</b>: Track Shorts</p><p><b>Season</b>: Spring/Summer/Fall</p><p><b>Details</b>: Knot</p><p><b>Details</b>: Contrast Binding</p><p><b>Waist Line</b>: High Waist</p><p><b>Fit Type</b>: Regular Fit</p><p><b>Sheer</b>: No</p><p><b>Closure Type</b>: Elastic Waist</p><p><b>Material</b>: Polyester</p><p><b>Composition</b>: 95% Polyester</p><p><b>Composition</b>: 5% Spandex</p><p><b>Fabric</b>: Non-Stretch</p><p><b>Care Instructions</b>: Machine wash or professional dry clean</p>,img/Shorts/swshorts07201228130.jpg,,Size#XS:S:M:L:XL:,25.94,,,,1,1,,,Shorts,,Contrast Binding Butterfly Print Track Shorts,Contrast Binding Butterfly Print Track Shorts,Contrast Binding Butterfly Print Track Shorts,,,,,,,,,
OKHPAZX0058,Zip Side Pleated Skirt,,<p><b>Style</b>: Preppy</p><p><b>Color</b>: White</p><p><b>Pattern Type</b>: Plain</p><p><b>Length</b>: Mini</p><p><b>Type</b>: Pleated</p><p><b>Season</b>: Summer</p><p><b>Details</b>: Pleated</p><p><b>Details</b>: Zipper</p><p><b>Waist Line</b>: High Waist</p><p><b>Sheer</b>: No</p><p><b>Material</b>: Polyester</p><p><b>Composition</b>: 97% Polyester</p><p><b>Composition</b>: 3% Spandex</p><p><b>Fabric</b>: Non-Stretch</p><p><b>Care Instructions</b>: Machine wash or professional dry clean</p><p><b>Style</b>: Preppy</p><p><b>Color</b>: Black</p><p><b>Pattern Type</b>: Plain</p><p><b>Length</b>: Mini</p><p><b>Type</b>: Pleated</p><p><b>Season</b>: Summer</p><p><b>Details</b>: Zipper</p><p><b>Waist Line</b>: High Waist</p><p><b>Sheer</b>: No</p><p><b>Material</b>: Polyester</p><p><b>Composition</b>: 95% Polyester</p><p><b>Composition</b>: 5% Spandex</p><p><b>Fabric</b>: Non-Stretch</p><p><b>Care Instructions</b>: Machine wash or professional dry clean</p>,img/Skirts/swskirt07201207234.jpg,,Size#XS:S:M:L:XL:,24.07,,,,1,1,,,Skirts,,Zip Side Pleated Skirt,Zip Side Pleated Skirt,Zip Side Pleated Skirt,,,,,,,,,
OKHPAZX0059,Bohemian Metal Star Moon Rhinestone Adjustable Bracelet Geometric Peach Heart Five-pointed Star Multi-layer Bracelet,,"<p>Style: Bohemian</p><p>Type: Bracelet</p><p>Color: Gold,Silver</p><p>Weight: About 20g</p><p>Dimensions: </p><p>Adjustable</p><p>4 x Bracelet</p>",img/Bracelets/SKUF70401.jpg,,Size#,13.41,,,,1,1,,,Bracelets,,Bohemian Metal Star Moon Rhinestone Adjustable Bracelet Geometric Peach Heart Five-pointed Star Multi-layer Bracelet,Bohemian Metal Star Moon Rhinestone Adjustable Bracelet Geometric Peach Heart Five-pointed Star Multi-layer Bracelet,Bohemian Metal Star Moon Rhinestone Adjustable Bracelet Geometric Peach Heart Five-pointed Star Multi-layer Bracelet,,,,,,,,,
OKHPAZX0060,Elegant Zircon Heart-shaped Rhinestone Ring Engagement Party Ring Jewelry,,<p>Style:Elegant</p><p>Type: Ring</p><p>Color: </p><p>Silver</p><p>.</p><p>Diameter Length: About 15.7 /16.5/ 17.3/ 18.1/ 18.9/ 19.8/ 20.6mm</p><p>Material: Alloy</p><p>Ring Size:  5 / 6 /7 / 8 / 9 / 10 / 11</p><p>(Please see the size reference for size conversion and detail information.)</p><p>Package Includes:</p><p>1 x Ring</p>,img/Rings/SKUH02219.jpg,,Size#5:6:7:8:9:10:11:,28.46,,,,1,1,,,Rings,,Elegant Zircon Heart-shaped Rhinestone Ring Engagement Party Ring Jewelry,Elegant Zircon Heart-shaped Rhinestone Ring Engagement Party Ring Jewelry,Elegant Zircon Heart-shaped Rhinestone Ring Engagement Party Ring Jewelry,,,,,,,,,
OKHPAZX0061,Women Genuine Leather Coin Purse Key Earphone Storage Short Purse,,"<p>Color:Yellow, Coffee, Black, Blue, Red</p><p>Wallet Type:Mini Wallets, Coin Purse</p><p>Material:Cow Leather</p><p>Style:Casual</p><p>Pattern:Solid</p>",img/Wallets/SKUF67104.jpg,,Size#,70.07,,,,1,1,,,Wallets,,Women Genuine Leather Coin Purse Key Earphone Storage Short Purse,Women Genuine Leather Coin Purse Key Earphone Storage Short Purse,Women Genuine Leather Coin Purse Key Earphone Storage Short Purse,,,,,,,,,
OKHPAZX0062,Socofy Retro Stylish Snakeskin Print Genuine Leather Side Zipper Cone Heel Business Shoes Low Heel Pumps,,"<p>Color:Yellow</p><p>Type:Business Shoes</p><p>Closure Type:Side-zip</p><p>Heel Type:Cone Heel</p><p>Heel Height:3-5cm In Low Heel</p><p>Toe Type:Pointed, Closed Toe</p><p>Pattern:Snake</p><p>Design Element:Print</p><p>Upper Material:Leather</p><p>Style:Retro, Natural, Formal</p><p>Outsole Material:Rubber</p><p>Structure:Side-zip</p><p>Occasion:Date, Prom, Party, Versatile</p><p>Function:Hard-wearing</p><p>Season:Summer, Autumn, Spring</p>",img/Heels/SKUH93422.jpg,,Size#US 6:US 7:US 8:US 9.5:US 10.5:US 11.5:,56.56,,,,1,1,,,Heels,,Socofy Retro Stylish Snakeskin Print Genuine Leather Side Zipper Cone Heel Business Shoes Low Heel Pumps,Socofy Retro Stylish Snakeskin Print Genuine Leather Side Zipper Cone Heel Business Shoes Low Heel Pumps,Socofy Retro Stylish Snakeskin Print Genuine Leather Side Zipper Cone Heel Business Shoes Low Heel Pumps,,,,,,,,,
OKHPAZX0063,Men Knitted Fabric Non Slip Breathable Running Casual Sneakers,,"<p>Color:Black, Brown</p><p>Upper Material:Cloth, Knitted</p><p>Type:Walking Shoes</p><p>Function:Breathable</p><p>Occasion:Daily, School, Sport</p><p>Closure Type:Lace-up</p><p>Season:All Season</p><p>Toe Type:Round</p>",img/Sneakers__Athletic/SKUF74665.jpg,,Size#US 6.5:US 7.5:US 8:US 8.5:US 9:US 10:,61.44,,,,1,1,,,Sneakers & Athletic,,Men Knitted Fabric Non Slip Breathable Running Casual Sneakers,Men Knitted Fabric Non Slip Breathable Running Casual Sneakers,Men Knitted Fabric Non Slip Breathable Running Casual Sneakers,,,,,,,,,
OKHPAZX0064,Striped Trim Letter Graphic Bodycon Dress,,<p><b>Style</b>: Sporty</p><p><b>Color</b>: White</p><p><b>Pattern Type</b>: Striped</p><p><b>Pattern Type</b>: Letter</p><p><b>Length</b>: Mini</p><p><b>Season</b>: Summer</p><p><b>Type</b>: Bodycon</p><p><b>Details</b>: Ruched</p><p><b>Details</b>: Drawstring</p><p><b>Sleeve Length</b>: Sleeveless</p><p><b>Waist Line</b>: Natural</p><p><b>Neckline</b>: Scoop Neck</p><p><b>Fit Type</b>: Slim Fit</p><p><b>Sheer</b>: No</p><p><b>Hem Shaped</b>: Pencil</p><p><b>Material</b>: Nylon</p><p><b>Composition</b>: 87% Polyamide</p><p><b>Composition</b>: 13% Elastane</p><p><b>Fabric</b>: Slight Stretch</p><p><b>Care Instructions</b>: Machine wash or professional dry clean</p>,img/Dresses/swdress07210529282.jpg,,Size#XS:S:M:L:XL:,27.14,,,,1,1,,,Dresses,,Striped Trim Letter Graphic Bodycon Dress,Striped Trim Letter Graphic Bodycon Dress,Striped Trim Letter Graphic Bodycon Dress,,,,,,,,,
OKHPAZX0065,Ditsy Floral Tie Front Crop Top,,<p><b>Style</b>: Casual</p><p><b>Color</b>: Multicolor</p><p><b>Pattern Type</b>: Ditsy Floral</p><p><b>Length</b>: Crop</p><p><b>Season</b>: Spring/Summer</p><p><b>Details</b>: Tie Front</p><p><b>Sleeve Type</b>: Flounce Sleeve</p><p><b>Sleeve Length</b>: Long Sleeve</p><p><b>Fit Type</b>: Regular Fit</p><p><b>Neckline</b>: V neck</p><p><b>Placket Type</b>: Placket</p><p><b>Sheer</b>: Semi-Sheer</p><p><b>Material</b>: Mesh</p><p><b>Composition</b>: 65% Cotton</p><p><b>Composition</b>: 35% Polyester</p><p><b>Fabric</b>: Medium Stretch</p><p><b>Care Instructions</b>: Machine wash or professional dry clean</p>,img/Women_Tops/rw2106228110787811.jpg,,Size#S:M:L:,25.77,,,,1,1,,,Women Tops,,Ditsy Floral Tie Front Crop Top,Ditsy Floral Tie Front Crop Top,Ditsy Floral Tie Front Crop Top,,,,,,,,,
OKHPAZX0066,Solid Paperbag Waist Shorts With Belt,,<p><b>Style</b>: Casual</p><p><b>Color</b>: Black</p><p><b>Pattern Type</b>: Plain</p><p><b>Season</b>: Summer</p><p><b>Type</b>: Wide Leg</p><p><b>Details</b>: Grommet Eyelet</p><p><b>Details</b>: Paper Bag Waist</p><p><b>Waist Line</b>: High Waist</p><p><b>Fit Type</b>: Regular Fit</p><p><b>Sheer</b>: No</p><p><b>Closure Type</b>: Elastic Waist</p><p><b>Material</b>: Cotton</p><p><b>Composition</b>: 65% Cotton</p><p><b>Composition</b>: 35% Polyester</p><p><b>Fabric</b>: Non-Stretch</p><p><b>Care Instructions</b>: Machine wash or professional dry clean</p>,img/Shorts/rwshorts25210413627.jpg,,Size#S:M:L:,30.37,,,,1,1,,,Shorts,,Solid Paperbag Waist Shorts With Belt,Solid Paperbag Waist Shorts With Belt,Solid Paperbag Waist Shorts With Belt,,,,,,,,,
OKHPAZX0067,Chinese Dragon Graphic Split Skirt,,<p><b>Style</b>: Casual</p><p><b>Color</b>: Black</p><p><b>Pattern Type</b>: Animal</p><p><b>Length</b>: Mini</p><p><b>Type</b>: Straight</p><p><b>Season</b>: Summer</p><p><b>Details</b>: Split</p><p><b>Waist Line</b>: Natural</p><p><b>Sheer</b>: No</p><p><b>Material</b>: Polyester</p><p><b>Composition</b>: 95% Polyester</p><p><b>Composition</b>: 5% Spandex</p><p><b>Fabric</b>: Non-Stretch</p><p><b>Care Instructions</b>: Machine wash or professional dry clean</p>,img/Skirts/rwskirt25210408229.jpg,,Size#XS:S:M:L:,30.82,,,,1,1,,,Skirts,,Chinese Dragon Graphic Split Skirt,Chinese Dragon Graphic Split Skirt,Chinese Dragon Graphic Split Skirt,,,,,,,,,
OKHPAZX0068,Bohemian Turquoise Handmade Beaded Crystal Bracelet Square Beaded Metal Pendant Multi-layer Bracelet,,<p>Style: Bohemian</p><p>Type: Bracelet</p><p>Main Color: 5 Colors for your choose</p><p>Chain Length: 18cm/7.08in</p><p>Weight: About 30g</p><p>Material: Beads</p><p>1 X Bracelet</p>,img/Bracelets/SKUF42669.jpg,,Size#,14.29,,,,1,1,,,Bracelets,,Bohemian Turquoise Handmade Beaded Crystal Bracelet Square Beaded Metal Pendant Multi-layer Bracelet,Bohemian Turquoise Handmade Beaded Crystal Bracelet Square Beaded Metal Pendant Multi-layer Bracelet,Bohemian Turquoise Handmade Beaded Crystal Bracelet Square Beaded Metal Pendant Multi-layer Bracelet,,,,,,,,,
OKHPAZX0069,Vintage Star Moon Women Ring Adjustable Open Inlaid Diamonds Finger Ring Jewelry Gift,,"<p>Style: Vintage</p><p>Type: Ring</p><p>Color: Gold, Rose Gold, Silver</p><p>Weight: 2.36g</p><p>Size: About 2 cm / 0.79 in </p><p>Material: Alloy</p><p>1 x Ring</p>",img/Rings/SKUH01937.jpg,,Size#,13.01,,,,1,1,,,Rings,,Vintage Star Moon Women Ring Adjustable Open Inlaid Diamonds Finger Ring Jewelry Gift,Vintage Star Moon Women Ring Adjustable Open Inlaid Diamonds Finger Ring Jewelry Gift,Vintage Star Moon Women Ring Adjustable Open Inlaid Diamonds Finger Ring Jewelry Gift,,,,,,,,,
