v_sku,v_name,v_short_description,v_description,v_image,v_url,v_attribute,v_price,v_specials_price,v_specials_expire_date,v_date_added,v_in_stock,v_status,v_viewed,v_ordered,v_category_sku,v_sort_order,v_meta_title,v_meta_keywords,v_meta_description,v_brand_filter,v_class_filter,v_color_filter,v_gender_filter,v_material_filter,v_year_filter,v_origin_filter,v_series_filter,v_spec_filter
OKHPAZX0070,Women Red PU Leather Abstract Stick Figure Pattern Money Clips Card-slots Wallet,,"<p>Color:Orange, Green, Black, Blue, Red</p><p>Wallets Style:Clasp Closure</p><p>Wallet Type:Money Clip, Phone Holder</p><p>Material:Faux Fur, PU</p><p>Style:Casual</p>",img/Wallets/SKUH34026.jpg,,Size#,65.7,,,,1,1,,,Wallets,,Women Red PU Leather Abstract Stick Figure Pattern Money Clips Card-slots Wallet,Women Red PU Leather Abstract Stick Figure Pattern Money Clips Card-slots Wallet,Women Red PU Leather Abstract Stick Figure Pattern Money Clips Card-slots Wallet,,,,,,,,,
OKHPAZX0071,Women Elegant Rhinestone Backless Chunky Heel Mules Shoes,,"<p>Color:Yellow, Black, Grey</p><p>Closure Type:Slip-On</p><p>Heel Type:Chunky Heel</p><p>Heel Height:1-3cm In Flat</p><p>Toe Type:Pointed</p><p>Pattern:Scenery</p><p>Design Element:Rhinestone, Pattern</p><p>Upper Material:PU</p><p>Style:Elegant</p><p>Outsole Material:Rubber</p><p>Occasion:Holiday</p><p>Function:Hard-wearing</p><p>Season:Summer, Autumn</p>",img/Heels/SKUH80167.jpg,,Size#US 5:US 6:US 7:US 8:,59.65,,,,1,1,,,Heels,,Women Elegant Rhinestone Backless Chunky Heel Mules Shoes,Women Elegant Rhinestone Backless Chunky Heel Mules Shoes,Women Elegant Rhinestone Backless Chunky Heel Mules Shoes,,,,,,,,,
OKHPAZX0072,Men Outdoor Walking Breathable Non Slip Soft Quick Drying Beach Diving Snorkeling Water Shoes,,"<p>Color:Black, Blue, Grey, Green, Golden</p><p>Upper Material:Knitted</p><p>Outsole Material:Rubber</p><p>Type:Water Shoes</p><p>Function:Breathable, Quick Dry, Slip Resistant</p><p>Occasion:Outdoor, Beach, Sport, Upstream</p><p>Closure Type:Hook & Loop</p><p>Season:Summer, Spring&Fall</p><p>Toe Type:Round</p>",img/Sneakers__Athletic/SKUH16556.jpg,,Size#US 6.5:US 7.5:US 8:US 8.5:US 9:US 10:US 10.5:,56.67,,,,1,1,,,Sneakers & Athletic,,Men Outdoor Walking Breathable Non Slip Soft Quick Drying Beach Diving Snorkeling Water Shoes,Men Outdoor Walking Breathable Non Slip Soft Quick Drying Beach Diving Snorkeling Water Shoes,Men Outdoor Walking Breathable Non Slip Soft Quick Drying Beach Diving Snorkeling Water Shoes,,,,,,,,,
OKHPAZX0073,Plaid Print Tie Detail A-Line Dress,,<p><b>Style</b>: Preppy</p><p><b>Color</b>: Multicolor</p><p><b>Pattern Type</b>: Tartan</p><p><b>Length</b>: Short</p><p><b>Season</b>: Spring/Fall</p><p><b>Type</b>: Shirt</p><p><b>Details</b>: Zipper</p><p><b>Details</b>: Button Front</p><p><b>Sleeve Length</b>: Long Sleeve</p><p><b>Neckline</b>: Collar</p><p><b>Waist Line</b>: High Waist</p><p><b>Fit Type</b>: Regular Fit</p><p><b>Sleeve Type</b>: Regular Sleeve</p><p><b>Sheer</b>: No</p><p><b>Hem Shaped</b>: Flared</p><p><b>Material</b>: Polyester</p><p><b>Composition</b>: 95% Polyester</p><p><b>Composition</b>: 5% Elastane</p><p><b>Fabric</b>: Non-Stretch</p><p><b>Care Instructions</b>: Machine wash or professional dry clean</p>,img/Dresses/swdress25210602133.jpg,,Size#XS:S:M:L:,24.11,,,,1,1,,,Dresses,,Plaid Print Tie Detail A-Line Dress,Plaid Print Tie Detail A-Line Dress,Plaid Print Tie Detail A-Line Dress,,,,,,,,,
OKHPAZX0074,Marble Print Frill Trim Mesh Crop Top,,<p><b>Style</b>: Casual</p><p><b>Color</b>: Green</p><p><b>Pattern Type</b>: All Over Print</p><p><b>Length</b>: Crop</p><p><b>Season</b>: Summer</p><p><b>Details</b>: Lettuce Trim</p><p><b>Details</b>: Sheer</p><p><b>Details</b>: Contrast Binding</p><p><b>Neckline</b>: Round Neck</p><p><b>Sleeve Length</b>: Short Sleeve</p><p><b>Fit Type</b>: Slim Fit</p><p><b>Sleeve Type</b>: Regular Sleeve</p><p><b>Placket Type</b>: Pullovers</p><p><b>Sheer</b>: Yes</p><p><b>Material</b>: Mesh</p><p><b>Composition</b>: 100% Polyester</p><p><b>Fabric</b>: Slight Stretch</p><p><b>Care Instructions</b>: Machine wash or professional dry clean</p>,img/Women_Tops/swtop07210604123.jpg,,Size#XS:S:M:L:XL:,32.37,,,,1,1,,,Women Tops,,Marble Print Frill Trim Mesh Crop Top,Marble Print Frill Trim Mesh Crop Top,Marble Print Frill Trim Mesh Crop Top,,,,,,,,,
OKHPAZX0075,Argyle Pattern Tie Front Shorts,,<p><b>Style</b>: Sporty</p><p><b>Color</b>: Multicolor</p><p><b>Pattern Type</b>: Geometric</p><p><b>Season</b>: Summer</p><p><b>Type</b>: Track Shorts</p><p><b>Details</b>: Knot</p><p><b>Waist Line</b>: Natural</p><p><b>Fit Type</b>: Regular Fit</p><p><b>Sheer</b>: No</p><p><b>Closure Type</b>: Elastic Waist</p><p><b>Material</b>: Cotton Blends</p><p><b>Composition</b>: 65% Cotton</p><p><b>Composition</b>: 35% Polyester</p><p><b>Fabric</b>: Slight Stretch</p><p><b>Care Instructions</b>: Machine wash or professional dry clean</p>,img/Shorts/rwshorts25210511896.jpg,,Size#S:M:L:,31.95,,,,1,1,,,Shorts,,Argyle Pattern Tie Front Shorts,Argyle Pattern Tie Front Shorts,Argyle Pattern Tie Front Shorts,,,,,,,,,
OKHPAZX0076,Ruched Drawstring Pencil Skirt,,<p><b>Style</b>: Casual</p><p><b>Color</b>: Black</p><p><b>Pattern Type</b>: Plain</p><p><b>Length</b>: Midi</p><p><b>Type</b>: Pencil</p><p><b>Season</b>: Spring/Summer/Fall</p><p><b>Details</b>: Drawstring</p><p><b>Details</b>: Ruched</p><p><b>Waist Line</b>: High Waist</p><p><b>Sheer</b>: No</p><p><b>Belt</b>: No</p><p><b>Material</b>: Rayon</p><p><b>Composition</b>: 95% Rayon</p><p><b>Composition</b>: 5% Spandex</p><p><b>Fabric</b>: Slight Stretch</p><p><b>Care Instructions</b>: Machine wash or professional dry clean</p>,img/Skirts/swskirt07200825831.jpg,,Size#XS:S:M:L:XL:,31.96,,,,1,1,,,Skirts,,Ruched Drawstring Pencil Skirt,Ruched Drawstring Pencil Skirt,Ruched Drawstring Pencil Skirt,,,,,,,,,
OKHPAZX0077, Bohemian Shell Conch Starfish Pendant Chain Bracelet Retro Bead Metal Charm Bracelet for Women,,"<p>Style: Bohemian</p><p>Type: Chain Bracelet</p><p>Main Color: Gold</p><p>Weight: About 12.72g</p><p>Size: 25cm+7.5cm/9.84'+2.95'</p><p>Material: Alloy,Shell</p><p>1 x Bracelet</p>",img/Bracelets/SKUC28634.jpg,,Size#,24.29,,,,1,1,,,Bracelets,, Bohemian Shell Conch Starfish Pendant Chain Bracelet Retro Bead Metal Charm Bracelet for Women, Bohemian Shell Conch Starfish Pendant Chain Bracelet Retro Bead Metal Charm Bracelet for Women, Bohemian Shell Conch Starfish Pendant Chain Bracelet Retro Bead Metal Charm Bracelet for Women,,,,,,,,,
OKHPAZX0078,14 Pcs Vintage Trendy Yin Yang Relief Elephant Geometric Shape Alloy Ring Set,,"<p>Style: Vintage,Trendy</p><p>Type: Ring</p><p>Weight: 32.9 g</p><p>Size: As the picture shown</p><p>Material: Alloy</p><p>Quantity: 14 pcs</p><p>Package Includes:</p><p>1 x Ring Set</p><p>Notice:</p>",img/Rings/SKUI17793.jpg,,Size#,27.76,,,,1,1,,,Rings,,14 Pcs Vintage Trendy Yin Yang Relief Elephant Geometric Shape Alloy Ring Set,14 Pcs Vintage Trendy Yin Yang Relief Elephant Geometric Shape Alloy Ring Set,14 Pcs Vintage Trendy Yin Yang Relief Elephant Geometric Shape Alloy Ring Set,,,,,,,,,
OKHPAZX0079,RFID Men And Women Genuine Leather 24 Card Slot Wallet Multifunction Passport Purse,,"<p>Color:Coffee, Black, Brown, Blue, Red</p><p>Style:Vintage</p><p>Decoration:Genuine Leather</p>",img/Wallets/SKU879644.jpg,,Size#,68.19,,,,1,1,,,Wallets,,RFID Men And Women Genuine Leather 24 Card Slot Wallet Multifunction Passport Purse,RFID Men And Women Genuine Leather 24 Card Slot Wallet Multifunction Passport Purse,RFID Men And Women Genuine Leather 24 Card Slot Wallet Multifunction Passport Purse,,,,,,,,,
OKHPAZX0080,SOCOFY Big Head Genuine Sheep Leather Bloom Flower Pattern Buckle Strap Soft Casual Pumps,,"<p>Color:Blue</p><p>Type:Mary Jane</p><p>Closure Type:Hasp</p><p>Heel Type:Block Heel</p><p>Heel Height:3-5cm In Low Heel</p><p>Toe Type:Round</p><p>Pattern:Calico</p><p>Design Element:Floral, Print</p><p>Upper Material:Leather</p><p>Style:Casual</p><p>Outsole Material:Rubber</p><p>Structure:Ankle Strap</p><p>Occasion:Date, Party</p><p>Function:Soft</p><p>Season:Summer, Spring</p>",img/Heels/SKUA93582.jpg,,Size#US 5:US 6:US 7:US 8:US 9:US 10:US 11:,65.84,,,,1,1,,,Heels,,SOCOFY Big Head Genuine Sheep Leather Bloom Flower Pattern Buckle Strap Soft Casual Pumps,SOCOFY Big Head Genuine Sheep Leather Bloom Flower Pattern Buckle Strap Soft Casual Pumps,SOCOFY Big Head Genuine Sheep Leather Bloom Flower Pattern Buckle Strap Soft Casual Pumps,,,,,,,,,
OKHPAZX0081,Men Brief Side Stripe Color Blocking Lace-up Chunky Sneakers,,"<p>Color:Black, Grey, Green</p><p>Upper Material:Mesh, PU</p><p>Outsole Material:Rubber</p><p>Type:Chunky Sneaker shoes</p><p>Function:Breathable, Soft, Hard-wearing</p><p>Occasion:Outdoor, Daily, Sport</p><p>Closure Type:Lace-up</p><p>Season:All Season</p><p>Toe Type:Round</p>",img/Sneakers__Athletic/SKUH13801.jpg,,Size#US 6.5:US 7.5:US 8:US 8.5:US 9:US 10:,64.87,,,,1,1,,,Sneakers & Athletic,,Men Brief Side Stripe Color Blocking Lace-up Chunky Sneakers,Men Brief Side Stripe Color Blocking Lace-up Chunky Sneakers,Men Brief Side Stripe Color Blocking Lace-up Chunky Sneakers,,,,,,,,,
OKHPAZX0082,Solid Ribbed Dress,,<p><b>Style</b>: Casual</p><p><b>Color</b>: Chocolate Brown</p><p><b>Pattern Type</b>: Plain</p><p><b>Length</b>: Short</p><p><b>Season</b>: Summer</p><p><b>Type</b>: Fitted</p><p><b>Details</b>: Rib-Knit</p><p><b>Sleeve Length</b>: Short Sleeve</p><p><b>Neckline</b>: Collar</p><p><b>Waist Line</b>: Natural</p><p><b>Fit Type</b>: Slim Fit</p><p><b>Sleeve Type</b>: Regular Sleeve</p><p><b>Sheer</b>: No</p><p><b>Hem Shaped</b>: Pencil</p><p><b>Material</b>: Polyester</p><p><b>Composition</b>: 95% Polyester</p><p><b>Composition</b>: 5% Spandex</p><p><b>Fabric</b>: Medium Stretch</p><p><b>Care Instructions</b>: Machine wash or professional dry clean</p>,img/Dresses/rwdress25210401409.jpg,,Size#S:M:L:,24.47,,,,1,1,,,Dresses,,Solid Ribbed Dress,Solid Ribbed Dress,Solid Ribbed Dress,,,,,,,,,
OKHPAZX0083,One Shoulder Knot Crop Top,,<p><b>Style</b>: Sexy</p><p><b>Color</b>: Hot Pink</p><p><b>Pattern Type</b>: Plain</p><p><b>Length</b>: Crop</p><p><b>Season</b>: Summer</p><p><b>Details</b>: Knot</p><p><b>Neckline</b>: One Shoulder</p><p><b>Sleeve Length</b>: Sleeveless</p><p><b>Fit Type</b>: Slim Fit</p><p><b>Placket Type</b>: Pullovers</p><p><b>Body</b>: Unlined</p><p><b>Material</b>: Polyester</p><p><b>Composition</b>: 65% Polyester</p><p><b>Composition</b>: 30% Cotton</p><p><b>Composition</b>: 5% Spandex</p><p><b>Fabric</b>: Slight Stretch</p><p><b>Care Instructions</b>: Machine wash or professional dry clean</p><p><b>Style</b>: Sexy</p><p><b>Color</b>: White</p><p><b>Pattern Type</b>: Plain</p><p><b>Length</b>: Crop</p><p><b>Season</b>: Summer</p><p><b>Details</b>: Knot</p><p><b>Neckline</b>: One Shoulder</p><p><b>Sleeve Length</b>: Sleeveless</p><p><b>Fit Type</b>: Slim Fit</p><p><b>Placket Type</b>: Pullovers</p><p><b>Body</b>: Unlined</p><p><b>Material</b>: Polyester</p><p><b>Composition</b>: 65% Polyester</p><p><b>Composition</b>: 30% Cotton</p><p><b>Composition</b>: 5% Spandex</p><p><b>Fabric</b>: Slight Stretch</p><p><b>Care Instructions</b>: Machine wash or professional dry clean</p><p><b>Style</b>: Casual</p><p><b>Color</b>: Black</p><p><b>Pattern Type</b>: Plain</p><p><b>Length</b>: Crop</p><p><b>Season</b>: Summer</p><p><b>Details</b>: Cut Out</p><p><b>Details</b>: Knot</p><p><b>Neckline</b>: One Shoulder</p><p><b>Sleeve Length</b>: Sleeveless</p><p><b>Fit Type</b>: Slim Fit</p><p><b>Body</b>: Unlined</p><p><b>Material</b>: Polyester</p><p><b>Composition</b>: 65% Polyester</p><p><b>Composition</b>: 30% Cotton</p><p><b>Composition</b>: 5% Spandex</p><p><b>Fabric</b>: Slight Stretch</p><p><b>Care Instructions</b>: Machine wash or professional dry clean</p>,img/Women_Tops/swvest00190808111.jpg,,Size#XS:S:M:L:,24.58,,,,1,1,,,Women Tops,,One Shoulder Knot Crop Top,One Shoulder Knot Crop Top,One Shoulder Knot Crop Top,,,,,,,,,
OKHPAZX0084,Solid Belted Shorts,,<p><b>Style</b>: Casual</p><p><b>Color</b>: Rust Brown</p><p><b>Pattern Type</b>: Plain</p><p><b>Type</b>: Straight Leg</p><p><b>Season</b>: Summer</p><p><b>Waist Line</b>: Natural</p><p><b>Fit Type</b>: Regular Fit</p><p><b>Sheer</b>: No</p><p><b>Closure Type</b>: Button Fly</p><p><b>Belt</b>: Yes</p><p><b>Material</b>: Polyester</p><p><b>Composition</b>: 100% Polyester</p><p><b>Fabric</b>: Non-Stretch</p><p><b>Care Instructions</b>: Machine wash or professional dry clean</p>,img/Shorts/sW210528384423732.jpg,,Size#S:M:L:,31.34,,,,1,1,,,Shorts,,Solid Belted Shorts,Solid Belted Shorts,Solid Belted Shorts,,,,,,,,,
OKHPAZX0085,Plaid Drawstring Ruched Skirt,,<p><b>Style</b>: Preppy</p><p><b>Color</b>: Multicolor</p><p><b>Pattern Type</b>: Plaid</p><p><b>Length</b>: Mini</p><p><b>Type</b>: Bodycon</p><p><b>Season</b>: Summer</p><p><b>Details</b>: Drawstring</p><p><b>Details</b>: Ruched</p><p><b>Waist Line</b>: Natural</p><p><b>Sheer</b>: No</p><p><b>Material</b>: Cotton Blends</p><p><b>Composition</b>: 65% Cotton</p><p><b>Composition</b>: 35% Polyester</p><p><b>Fabric</b>: Medium Stretch</p><p><b>Care Instructions</b>: Machine wash or professional dry clean</p>,img/Skirts/sW210618145194226.jpg,,Size#S:M:L:,26.75,,,,1,1,,,Skirts,,Plaid Drawstring Ruched Skirt,Plaid Drawstring Ruched Skirt,Plaid Drawstring Ruched Skirt,,,,,,,,,
OKHPAZX0086,5 Pcs Trendy Bohemian Silver Geometric-shape Alloy Bracelet Set,,"<p>Style: Trendy,Bohemian</p><p>Type: Bracelet</p><p>Color: Silver</p><p>Weight: 10 g</p><p>Size: Opening Adjustable / Perimeter About 18 cm / 7.08 in</p><p>Material: Alloy</p><p>Quantity: 5 pcs</p><p>Package Includes:</p><p>1 x Bracelet Set</p><p>Notice:</p>",img/Bracelets/SKUI17571.jpg,,Size#,26.28,,,,1,1,,,Bracelets,,5 Pcs Trendy Bohemian Silver Geometric-shape Alloy Bracelet Set,5 Pcs Trendy Bohemian Silver Geometric-shape Alloy Bracelet Set,5 Pcs Trendy Bohemian Silver Geometric-shape Alloy Bracelet Set,,,,,,,,,
OKHPAZX0087,Alloy S925 Silver Vintage Love Ring Two Hands Embrace Jewelry Open Ring,,"<p>Style: Vintage</p><p>Type: Rings</p><p>Color: Gold</p><p>Weight: 5g</p><p> Size: Adjustable</p><p>Material: Alloy,S925 Sliver</p><p>Package Includes:</p><p>1 x Rings</p><p>Notice:</p>",img/Rings/SKUH57363.jpg,,Size#,17.6,,,,1,1,,,Rings,,Alloy S925 Silver Vintage Love Ring Two Hands Embrace Jewelry Open Ring,Alloy S925 Silver Vintage Love Ring Two Hands Embrace Jewelry Open Ring,Alloy S925 Silver Vintage Love Ring Two Hands Embrace Jewelry Open Ring,,,,,,,,,
OKHPAZX0088,6.3 Inch Phone Holder Waterproof Running Outdoor Cycling Sport Coin Key Wrist Wallet Arm Bag,,"<p>Color:Pink, Green, Grey, Purple</p><p>Material:Nylon</p><p>Style:Casual</p>",img/Wallets/SKUF47898.jpg,,Size#M:L:,64.54,,,,1,1,,,Wallets,,6.3 Inch Phone Holder Waterproof Running Outdoor Cycling Sport Coin Key Wrist Wallet Arm Bag,6.3 Inch Phone Holder Waterproof Running Outdoor Cycling Sport Coin Key Wrist Wallet Arm Bag,6.3 Inch Phone Holder Waterproof Running Outdoor Cycling Sport Coin Key Wrist Wallet Arm Bag,,,,,,,,,
OKHPAZX0089,Women Sequins Embellished Mesh Fabric Chunky Heel Slingback Comfy Slip On Muller Heels,,"<p>Color:Silver, Golden</p><p>Type:Slingback Heels shoes</p><p>Closure Type:Hook & Loop</p><p>Heel Type:Chunky Heel</p><p>Heel Height:5-8cm In Heel</p><p>Pattern:Solid</p><p>Design Element:Sequined</p><p>Upper Material:Mesh</p><p>Style:Casual, Elegant</p><p>Outsole Material:Rubber</p><p>Occasion:Holiday, Casual</p><p>Function:Hard-wearing</p><p>Season:Summer</p>",img/Heels/SKUH92376.jpg,,Size#US 5:US 6:US 7:US 8:US 9:US 10:US 11:US 12:,65.17,,,,1,1,,,Heels,,Women Sequins Embellished Mesh Fabric Chunky Heel Slingback Comfy Slip On Muller Heels,Women Sequins Embellished Mesh Fabric Chunky Heel Slingback Comfy Slip On Muller Heels,Women Sequins Embellished Mesh Fabric Chunky Heel Slingback Comfy Slip On Muller Heels,,,,,,,,,
OKHPAZX0090,Men Non Slip Braethable Mesh Fabric Lace-up Outdoor Hiking Shoes,,"<p>Color:Black, Grey</p><p>Upper Material:Mesh</p><p>Outsole Material:TPR</p><p>Type:Outdoor Shoes, Walking Shoes, Hiking Shoes</p><p>Function:Breathable, Hard-wearing, Sport, Slip Resistant</p><p>Occasion:Outdoor, Sport, Camping & Hiking</p><p>Closure Type:Lace-up</p><p>Season:All Season</p><p>Toe Type:Round</p>",img/Sneakers__Athletic/SKUH33005.jpg,,Size#US 6.5:US 7.5:US 8:US 8.5:US 9:US 10:US 10.5:,52.6,,,,1,1,,,Sneakers & Athletic,,Men Non Slip Braethable Mesh Fabric Lace-up Outdoor Hiking Shoes,Men Non Slip Braethable Mesh Fabric Lace-up Outdoor Hiking Shoes,Men Non Slip Braethable Mesh Fabric Lace-up Outdoor Hiking Shoes,,,,,,,,,
OKHPAZX0091,Daisy Contrast Lace Dress,,<p><b>Style</b>: Boho</p><p><b>Color</b>: Mint Green</p><p><b>Pattern Type</b>: Floral</p><p><b>Pattern Type</b>: All Over Print</p><p><b>Length</b>: Short</p><p><b>Season</b>: Summer</p><p><b>Type</b>: Cami</p><p><b>Details</b>: Contrast Lace</p><p><b>Details</b>: Shirred</p><p><b>Sleeve Length</b>: Sleeveless</p><p><b>Waist Line</b>: Natural</p><p><b>Fit Type</b>: Slim Fit</p><p><b>Neckline</b>: Straps</p><p><b>Sheer</b>: No</p><p><b>Hem Shaped</b>: Flared</p><p><b>Material</b>: Polyester</p><p><b>Composition</b>: 100% Polyester</p><p><b>Fabric</b>: Non-Stretch</p><p><b>Care Instructions</b>: Machine wash or professional dry clean</p>,img/Dresses/rwdress25210512856.jpg,,Size#S:M:L:,23.24,,,,1,1,,,Dresses,,Daisy Contrast Lace Dress,Daisy Contrast Lace Dress,Daisy Contrast Lace Dress,,,,,,,,,
OKHPAZX0092,Butterfly Embroidery Crop Tube Top,,<p><b>Style</b>: Sexy</p><p><b>Color</b>: Purple</p><p><b>Pattern Type</b>: Animal</p><p><b>Length</b>: Crop</p><p><b>Season</b>: Summer</p><p><b>Details</b>: Contrast Lace</p><p><b>Details</b>: Embroidery</p><p><b>Sleeve Length</b>: Sleeveless</p><p><b>Fit Type</b>: Slim Fit</p><p><b>Neckline</b>: Strapless</p><p><b>Placket Type</b>: Placket</p><p><b>Sheer</b>: Semi-Sheer</p><p><b>Material</b>: Schiffy</p><p><b>Composition</b>: 95% Polyester</p><p><b>Composition</b>: 5% Spandex</p><p><b>Fabric</b>: High Stretch</p><p><b>Care Instructions</b>: Machine wash or professional dry clean</p>,img/Women_Tops/rwtop25210601593.jpg,,Size#S:M:L:,27.53,,,,1,1,,,Women Tops,,Butterfly Embroidery Crop Tube Top,Butterfly Embroidery Crop Tube Top,Butterfly Embroidery Crop Tube Top,,,,,,,,,
OKHPAZX0093,Knot Waist Allover Print Shorts,,<p><b>Style</b>: Casual</p><p><b>Color</b>: Multicolor</p><p><b>Pattern Type</b>: All Over Print</p><p><b>Season</b>: Summer</p><p><b>Type</b>: Track Shorts</p><p><b>Details</b>: Knot</p><p><b>Waist Line</b>: Natural</p><p><b>Fit Type</b>: Regular Fit</p><p><b>Sheer</b>: No</p><p><b>Closure Type</b>: Elastic Waist</p><p><b>Material</b>: Polyester</p><p><b>Composition</b>: 92% Polyester</p><p><b>Composition</b>: 8% Spandex</p><p><b>Fabric</b>: Slight Stretch</p><p><b>Care Instructions</b>: Machine wash or professional dry clean</p>,img/Shorts/swshorts07210113665.jpg,,Size#XS:S:M:L:XL:,30.73,,,,1,1,,,Shorts,,Knot Waist Allover Print Shorts,Knot Waist Allover Print Shorts,Knot Waist Allover Print Shorts,,,,,,,,,
OKHPAZX0094,Plaid Godet Skirt,,<p><b>Style</b>: Preppy</p><p><b>Color</b>: Pink</p><p><b>Pattern Type</b>: Plaid</p><p><b>Length</b>: Short</p><p><b>Type</b>: A Line</p><p><b>Season</b>: Summer</p><p><b>Details</b>: Pleated</p><p><b>Waist Line</b>: Natural</p><p><b>Sheer</b>: No</p><p><b>Material</b>: Polyester</p><p><b>Composition</b>: 100% Polyester</p><p><b>Fabric</b>: Non-Stretch</p><p><b>Care Instructions</b>: Machine wash or professional dry clean</p>,img/Skirts/rw2107157793586194.jpg,,Size#S:M:L:,23.49,,,,1,1,,,Skirts,,Plaid Godet Skirt,Plaid Godet Skirt,Plaid Godet Skirt,,,,,,,,,
OKHPAZX0095,Fashion Charm Bracelet Cross Madonna Snowflake Chain Gold Bracelet Jewelry for Women,,<p>Style: Trendy</p><p>Type: Charm Bracelet</p><p>Main Color: Gold</p><p>Weight: About 10g </p><p>Material: Alloy</p><p>Size: About 21 + 7.5cm / 8.26 + 2.95'</p><p>1 x Bracelet</p>,img/Bracelets/SKUA54576.jpg,,Size#,18.48,,,,1,1,,,Bracelets,,Fashion Charm Bracelet Cross Madonna Snowflake Chain Gold Bracelet Jewelry for Women,Fashion Charm Bracelet Cross Madonna Snowflake Chain Gold Bracelet Jewelry for Women,Fashion Charm Bracelet Cross Madonna Snowflake Chain Gold Bracelet Jewelry for Women,,,,,,,,,
OKHPAZX0096,9 Pcs Vintage Statement Ring Set Helm Leaf Gem Knuckle Rings for Her Bohemian Jewelry for Women,,"<p>Style: Vintage</p><p>Type: Ring Set</p><p>Weight: About 15.1g</p><p>Main Color: Silver, Gold </p><p>Material: Zinc Alloy, Acrylic, Rhinestone</p><p>Size: As the picture shows below</p><p>9 Pieces of Ring</p>",img/Rings/SKU816322.jpg,,Size#,12.59,,,,1,1,,,Rings,,9 Pcs Vintage Statement Ring Set Helm Leaf Gem Knuckle Rings for Her Bohemian Jewelry for Women,9 Pcs Vintage Statement Ring Set Helm Leaf Gem Knuckle Rings for Her Bohemian Jewelry for Women,9 Pcs Vintage Statement Ring Set Helm Leaf Gem Knuckle Rings for Her Bohemian Jewelry for Women,,,,,,,,,
OKHPAZX0097,Women 19 Card Slot Genuine Leather Long Wallet Vintage Phone Purse Solid Coin Purse,,"<p>Color:Coffee, Red, Khaki</p><p>Style:Vintage</p><p>Decoration:Genuine Leather</p>",img/Wallets/SKU982852.jpg,,Size#,61.3,,,,1,1,,,Wallets,,Women 19 Card Slot Genuine Leather Long Wallet Vintage Phone Purse Solid Coin Purse,Women 19 Card Slot Genuine Leather Long Wallet Vintage Phone Purse Solid Coin Purse,Women 19 Card Slot Genuine Leather Long Wallet Vintage Phone Purse Solid Coin Purse,,,,,,,,,
OKHPAZX0098,Sequins Mary Jane Mid Heel Strap Buckle Pumps,,"<p>Color:Red</p><p>Closure Type:Slip-On</p><p>Toe Type:Round</p><p>Upper Material:PU</p><p>Style:Elegant</p><p>Outsole Material:Rubber</p><p>Occasion:Party, Wedding</p>",img/Heels/SKU649673.jpg,,Size#US 5:US 6:US 7:US 8:US 9:US 10:,62.01,,,,1,1,,,Heels,,Sequins Mary Jane Mid Heel Strap Buckle Pumps,Sequins Mary Jane Mid Heel Strap Buckle Pumps,Sequins Mary Jane Mid Heel Strap Buckle Pumps,,,,,,,,,
OKHPAZX0099,Men Color Blocking Round Toe Lace-up Non Slip Platform Sneakers,,"<p>Color:Black, Grey, Red</p><p>Upper Material:PU</p><p>Outsole Material:Rubber</p><p>Type:Walking Shoes</p><p>Function:Hard-wearing, Sport, Slip Resistant</p><p>Occasion:Outdoor, Sport</p><p>Closure Type:Lace-up</p><p>Season:All Season</p><p>Toe Type:Round</p>",img/Sneakers__Athletic/SKUH33037.jpg,,Size#US 6.5:US 7.5:US 8:US 8.5:US 9:US 10:,65.3,,,,1,1,,,Sneakers & Athletic,,Men Color Blocking Round Toe Lace-up Non Slip Platform Sneakers,Men Color Blocking Round Toe Lace-up Non Slip Platform Sneakers,Men Color Blocking Round Toe Lace-up Non Slip Platform Sneakers,,,,,,,,,
OKHPAZX0100,Letter Graphic Lettuce Edge Rib-knit Bardot Dress,,<p><b>Style</b>: Casual</p><p><b>Color</b>: Mustard Yellow</p><p><b>Pattern Type</b>: Letter</p><p><b>Length</b>: Mini</p><p><b>Season</b>: Summer</p><p><b>Type</b>: Bodycon</p><p><b>Details</b>: Lettuce Trim</p><p><b>Details</b>: Rib-Knit</p><p><b>Neckline</b>: Off the Shoulder</p><p><b>Sleeve Length</b>: Short Sleeve</p><p><b>Waist Line</b>: Natural</p><p><b>Fit Type</b>: Slim Fit</p><p><b>Sleeve Type</b>: Regular Sleeve</p><p><b>Sheer</b>: No</p><p><b>Hem Shaped</b>: Pencil</p><p><b>Material</b>: Cotton</p><p><b>Composition</b>: 95% Cotton</p><p><b>Composition</b>: 5% Spandex</p><p><b>Fabric</b>: Slight Stretch</p><p><b>Care Instructions</b>: Machine wash or professional dry clean</p>,img/Dresses/swdress07200724032.jpg,,Size#XS:S:M:L:XL:,31.5,,,,1,1,,,Dresses,,Letter Graphic Lettuce Edge Rib-knit Bardot Dress,Letter Graphic Lettuce Edge Rib-knit Bardot Dress,Letter Graphic Lettuce Edge Rib-knit Bardot Dress,,,,,,,,,
OKHPAZX0101,Solid Cut Out Knot Back Crop Top,,<p><b>Style</b>: Casual</p><p><b>Color</b>: Olive Green</p><p><b>Pattern Type</b>: Plain</p><p><b>Length</b>: Crop</p><p><b>Season</b>: Spring/Summer</p><p><b>Details</b>: Cut Out</p><p><b>Details</b>: Tie Back</p><p><b>Details</b>: Rib-Knit</p><p><b>Neckline</b>: Halter</p><p><b>Sleeve Length</b>: Long Sleeve</p><p><b>Sleeve Type</b>: Raglan Sleeve</p><p><b>Fit Type</b>: Slim Fit</p><p><b>Placket Type</b>: Pullovers</p><p><b>Sheer</b>: No</p><p><b>Material</b>: Polyester</p><p><b>Composition</b>: 90% Polyester</p><p><b>Composition</b>: 10% Elastane</p><p><b>Fabric</b>: High Stretch</p><p><b>Care Instructions</b>: Machine wash or professional dry clean</p>,img/Women_Tops/swtop25210611076.jpg,,Size#XS:S:M:L:,22.7,,,,1,1,,,Women Tops,,Solid Cut Out Knot Back Crop Top,Solid Cut Out Knot Back Crop Top,Solid Cut Out Knot Back Crop Top,,,,,,,,,
OKHPAZX0102,Letter Contrast Binding Shorts,,<p><b>Style</b>: Casual</p><p><b>Color</b>: Apricot</p><p><b>Pattern Type</b>: Letter</p><p><b>Season</b>: Summer</p><p><b>Type</b>: Track Shorts</p><p><b>Details</b>: Contrast Binding</p><p><b>Waist Line</b>: Natural</p><p><b>Fit Type</b>: Regular Fit</p><p><b>Sheer</b>: No</p><p><b>Closure Type</b>: Elastic Waist</p><p><b>Material</b>: Polyester</p><p><b>Composition</b>: 95% Polyester</p><p><b>Composition</b>: 5% Spandex</p><p><b>Fabric</b>: Slight Stretch</p><p><b>Care Instructions</b>: Machine wash or professional dry clean</p>,img/Shorts/rW210610567384441.jpg,,Size#S:M:L:,22.82,,,,1,1,,,Shorts,,Letter Contrast Binding Shorts,Letter Contrast Binding Shorts,Letter Contrast Binding Shorts,,,,,,,,,
OKHPAZX0103,Satin Jacquard Drawstring Ruched Skirt,,<p><b>Style</b>: Casual</p><p><b>Color</b>: Dark Green</p><p><b>Pattern Type</b>: Plain</p><p><b>Length</b>: Mini</p><p><b>Type</b>: Bodycon</p><p><b>Season</b>: Summer</p><p><b>Details</b>: Drawstring</p><p><b>Details</b>: Ruched</p><p><b>Waist Line</b>: Natural</p><p><b>Sheer</b>: No</p><p><b>Material</b>: Satin</p><p><b>Composition</b>: 65% Cotton</p><p><b>Composition</b>: 35% Polyester</p><p><b>Fabric</b>: Non-Stretch</p><p><b>Care Instructions</b>: Machine wash or professional dry clean</p>,img/Skirts/sW210601629740624.jpg,,Size#XS:S:M:L:,31.41,,,,1,1,,,Skirts,,Satin Jacquard Drawstring Ruched Skirt,Satin Jacquard Drawstring Ruched Skirt,Satin Jacquard Drawstring Ruched Skirt,,,,,,,,,
