v_sku,v_name,v_short_description,v_description,v_image,v_url,v_attribute,v_price,v_specials_price,v_specials_expire_date,v_date_added,v_in_stock,v_status,v_viewed,v_ordered,v_category_sku,v_sort_order,v_meta_title,v_meta_keywords,v_meta_description,v_brand_filter,v_class_filter,v_color_filter,v_gender_filter,v_material_filter,v_year_filter,v_origin_filter,v_series_filter,v_spec_filter
SXCNVQZ0072,Men's Large Size Lace Up Breathbale Running Shoes Casual Sneakers,,"<p>Color:Black, Grey, White, Red</p><p>Upper Material:Knitted</p><p>Outsole Material:Rubber</p><p>Type:Running Shoes</p><p>Function:Breathable, Soft</p><p>Occasion:Sport</p><p>Closure Type:Lace-up</p><p>Season:Summer, Spring&Fall</p><p>Toe Type:Round</p>",img/Sneakers__Athletic/SKUA12675.jpg,,Size#US 8:US 8.5:US 9:US 10:US 10.5:US 11:,49.77,,,,1,1,,,Sneakers & Athletic,,Men's Large Size Lace Up Breathbale Running Shoes Casual Sneakers,Men's Large Size Lace Up Breathbale Running Shoes Casual Sneakers,Men's Large Size Lace Up Breathbale Running Shoes Casual Sneakers,,,,,,,,,
SXCNVQZ0073,Solid Fold Skirt,,<p><b>Style</b>: Casual</p><p><b>Color</b>: Rust Brown</p><p><b>Pattern Type</b>: Plain</p><p><b>Length</b>: Short</p><p><b>Type</b>: A Line</p><p><b>Season</b>: Summer</p><p><b>Waist Line</b>: High Waist</p><p><b>Sheer</b>: No</p><p><b>Material</b>: Polyester</p><p><b>Composition</b>: 95% Polyester</p><p><b>Composition</b>: 5% Spandex</p><p><b>Fabric</b>: Non-Stretch</p><p><b>Care Instructions</b>: Machine wash or professional dry clean</p>,img/Skirts/rw2107018825317295.jpg,,Size#XS:S:M:L:,30.81,,,,1,1,,,Skirts,,Solid Fold Skirt,Solid Fold Skirt,Solid Fold Skirt,,,,,,,,,
SXCNVQZ0074,Plaid Straight Leg Pants,,<p><b>Style</b>: Preppy</p><p><b>Color</b>: Redwood</p><p><b>Pattern Type</b>: Plaid</p><p><b>Length</b>: Cropped</p><p><b>Type</b>: Straight Leg</p><p><b>Season</b>: Spring/Summer/Fall</p><p><b>Waist Line</b>: Natural</p><p><b>Fit Type</b>: Regular Fit</p><p><b>Closure Type</b>: Button Fly</p><p><b>Material</b>: Polyester</p><p><b>Composition</b>: 80% Polyester</p><p><b>Composition</b>: 20% Cotton</p><p><b>Care Instructions</b>: Machine wash or professional dry clean</p>,img/Pants/rwpants03200824706.jpg,,Size#S:M:L:,25.24,,,,1,1,,,Pants,,Plaid Straight Leg Pants,Plaid Straight Leg Pants,Plaid Straight Leg Pants,,,,,,,,,
SXCNVQZ0075,Mushroom Print Button Front Blouse,,<p><b>Style</b>: Casual</p><p><b>Color</b>: Multicolor</p><p><b>Pattern Type</b>: Fruit&Vegetable</p><p><b>Pattern Type</b>: All Over Print</p><p><b>Length</b>: Long</p><p><b>Season</b>: Summer</p><p><b>Type</b>: Shirt</p><p><b>Details</b>: Button Front</p><p><b>Neckline</b>: Collar</p><p><b>Fit Type</b>: Regular Fit</p><p><b>Sleeve Length</b>: Short Sleeve</p><p><b>Sleeve Type</b>: Regular Sleeve</p><p><b>Sheer</b>: No</p><p><b>Placket Type</b>: Placket</p><p><b>Material</b>: Polyester</p><p><b>Composition</b>: 100% Polyester</p><p><b>Fabric</b>: Non-Stretch</p><p><b>Care Instructions</b>: Machine wash or professional dry clean</p><p><b>Style</b>: Casual</p><p><b>Color</b>: Multicolor</p><p><b>Pattern Type</b>: Fruit&Vegetable</p><p><b>Length</b>: Regular</p><p><b>Season</b>: Summer</p><p><b>Type</b>: Shirt</p><p><b>Details</b>: Button Front</p><p><b>Neckline</b>: Collar</p><p><b>Fit Type</b>: Regular Fit</p><p><b>Sleeve Length</b>: Short Sleeve</p><p><b>Sleeve Type</b>: Drop Shoulder</p><p><b>Sheer</b>: No</p><p><b>Placket Type</b>: Placket</p><p><b>Material</b>: Polyester</p><p><b>Composition</b>: 100% Polyester</p><p><b>Fabric</b>: Non-Stretch</p><p><b>Care Instructions</b>: Machine wash or professional dry clean</p><p><b>Style</b>: Casual</p><p><b>Color</b>: Multicolor</p><p><b>Pattern Type</b>: Fruit&Vegetable</p><p><b>Pattern Type</b>: All Over Print</p><p><b>Length</b>: Long</p><p><b>Season</b>: Summer</p><p><b>Type</b>: Shirt</p><p><b>Details</b>: Button Front</p><p><b>Neckline</b>: Collar</p><p><b>Fit Type</b>: Regular Fit</p><p><b>Sleeve Length</b>: Short Sleeve</p><p><b>Sleeve Type</b>: Regular Sleeve</p><p><b>Sheer</b>: No</p><p><b>Placket Type</b>: Placket</p><p><b>Material</b>: Polyester</p><p><b>Composition</b>: 100% Polyester</p><p><b>Fabric</b>: Non-Stretch</p><p><b>Care Instructions</b>: Machine wash or professional dry clean</p>,img/Blouses/rwblouse25210525876.jpg,,Size#XS:S:M:L:XL:XXL:,27.4,,,,1,1,,,Blouses,,Mushroom Print Button Front Blouse,Mushroom Print Button Front Blouse,Mushroom Print Button Front Blouse,,,,,,,,,
SXCNVQZ0076,Striped Cami Dress,,<p><b>Style</b>: Sexy</p><p><b>Color</b>: Multicolor</p><p><b>Pattern Type</b>: Striped</p><p><b>Length</b>: Mini</p><p><b>Season</b>: Summer</p><p><b>Type</b>: Bodycon</p><p><b>Details</b>: Rib-Knit</p><p><b>Sleeve Length</b>: Sleeveless</p><p><b>Neckline</b>: Spaghetti Strap</p><p><b>Waist Line</b>: Natural</p><p><b>Fit Type</b>: Slim Fit</p><p><b>Sheer</b>: No</p><p><b>Hem Shaped</b>: Pencil</p><p><b>Material</b>: Polyester</p><p><b>Composition</b>: 97% Polyester</p><p><b>Composition</b>: 3% Spandex</p><p><b>Fabric</b>: High Stretch</p><p><b>Care Instructions</b>: Machine wash or professional dry clean</p>,img/Dresses/rwdress25210510124.jpg,,Size#S:M:L:,28.83,,,,1,1,,,Dresses,,Striped Cami Dress,Striped Cami Dress,Striped Cami Dress,,,,,,,,,
SXCNVQZ0077,Punk Multilayer Unisex Bracelets Wooden Beads Maple Leaf Casual Bracelet for Men Gift,,"<p>Type: Multilayer Bracelet</p><p>Main Color: Black</p><p>Weight: About 15g</p><p>Chain Length: About 17cm / 6.69' (Adjustable)</p><p>
	Diameter Size: About 6cm / 2.36'</p><p>
	</p><p>1 x </p>",img/Bracelets/SKU821863.jpg,,Size#,15.6,,,,1,1,,,Bracelets,,Punk Multilayer Unisex Bracelets Wooden Beads Maple Leaf Casual Bracelet for Men Gift,Punk Multilayer Unisex Bracelets Wooden Beads Maple Leaf Casual Bracelet for Men Gift,Punk Multilayer Unisex Bracelets Wooden Beads Maple Leaf Casual Bracelet for Men Gift,,,,,,,,,
SXCNVQZ0078,Rhinestone Letter Charm Necklace,,<p><b>Type</b>: Pendant Necklaces</p><p><b>Details</b>: Rhinestone</p><p><b>Material</b>: Alloy</p><p><b>Color</b>: Silver</p><p><b>Metal Color</b>: Silver</p>,img/Pendant_Necklaces/swneck18200527418.jpg,,Size#,24.99,,,,1,1,,,Pendant Necklaces,,Rhinestone Letter Charm Necklace,Rhinestone Letter Charm Necklace,Rhinestone Letter Charm Necklace,,,,,,,,,
SXCNVQZ0079,Women Genuine Leather 12 Card Slots Patchwork Floral Photo Card Money Clip Coin Purse Multifunctional Wallet,,"<p>Color:Pink, Orange, Green, Black, Blue</p><p>Wallets Style:Clasp Closure</p><p>Wallet Type:Money Clip, ID Wallets</p><p>Material:Faux Fur, PU</p><p>Style:Casual</p>",img/Wallets/SKUG05328.jpg,,Size#,57.59,,,,1,1,,,Wallets,,Women Genuine Leather 12 Card Slots Patchwork Floral Photo Card Money Clip Coin Purse Multifunctional Wallet,Women Genuine Leather 12 Card Slots Patchwork Floral Photo Card Money Clip Coin Purse Multifunctional Wallet,Women Genuine Leather 12 Card Slots Patchwork Floral Photo Card Money Clip Coin Purse Multifunctional Wallet,,,,,,,,,
SXCNVQZ0080,Women's Metal Leather Solid Color Soft Loafers Shoes,,"<p>Color:Black</p><p>Type:Loafers</p><p>Closure Type:Slip-On</p><p>Heel Type:Flat</p><p>Heel Height:1-3cm In Flat</p><p>Toe Type:Round</p><p>Pattern:Solid</p><p>Design Element:Metal</p><p>Upper Material:PU</p><p>Style:Casual</p><p>Outsole Material:Rubber</p><p>Structure:Slip-On</p><p>Occasion:Casual</p><p>Function:Antiskid, Soft, Hard-wearing</p><p>Season:Summer, Autumn, Spring</p>",img/Flats/SKUG01983.jpg,,Size#US 5:US 6:US 7:US 8:US 9:,49.89,,,,1,1,,,Flats,,Women's Metal Leather Solid Color Soft Loafers Shoes,Women's Metal Leather Solid Color Soft Loafers Shoes,Women's Metal Leather Solid Color Soft Loafers Shoes,,,,,,,,,
SXCNVQZ0081,Men Letter Pattern Round Toe Lace-up Breathable Mesh Fabric Chunky Sneaker Shoes,,"<p>Color:Black, Green, Dark Green</p><p>Upper Material:Mesh</p><p>Outsole Material:Rubber</p><p>Type:Chunky Sneaker shoes</p><p>Function:Hard-wearing, Sport</p><p>Occasion:Outdoor, Sport</p><p>Closure Type:Lace-up</p><p>Season:All Season</p><p>Toe Type:Round</p>",img/Sneakers__Athletic/SKUH33951.jpg,,Size#US 6.5:US 7.5:US 8:US 8.5:US 9:US 10:,56.13,,,,1,1,,,Sneakers & Athletic,,Men Letter Pattern Round Toe Lace-up Breathable Mesh Fabric Chunky Sneaker Shoes,Men Letter Pattern Round Toe Lace-up Breathable Mesh Fabric Chunky Sneaker Shoes,Men Letter Pattern Round Toe Lace-up Breathable Mesh Fabric Chunky Sneaker Shoes,,,,,,,,,
SXCNVQZ0082,Solid Popper Detail Skirt,,<p><b>Style</b>: Casual</p><p><b>Color</b>: Black</p><p><b>Pattern Type</b>: Plain</p><p><b>Length</b>: Mini</p><p><b>Type</b>: A Line</p><p><b>Season</b>: Summer</p><p><b>Details</b>: Cut Out</p><p><b>Details</b>: Grommet Eyelet</p><p><b>Waist Line</b>: High Waist</p><p><b>Sheer</b>: No</p><p><b>Material</b>: Cotton</p><p><b>Composition</b>: 65% Cotton</p><p><b>Composition</b>: 35% Polyester</p><p><b>Fabric</b>: Non-Stretch</p><p><b>Care Instructions</b>: Machine wash or professional dry clean</p>,img/Skirts/rw2107026733112113.jpg,,Size#S:M:L:,24.86,,,,1,1,,,Skirts,,Solid Popper Detail Skirt,Solid Popper Detail Skirt,Solid Popper Detail Skirt,,,,,,,,,
SXCNVQZ0083,Paisley Drawstring Pants,,<p><b>Style</b>: Boho</p><p><b>Color</b>: Multicolor</p><p><b>Pattern Type</b>: Paisley</p><p><b>Length</b>: Cropped</p><p><b>Type</b>: Straight Leg</p><p><b>Season</b>: Spring/Summer/Fall</p><p><b>Details</b>: Drawstring</p><p><b>Details</b>: Tie Front</p><p><b>Waist Line</b>: High Waist</p><p><b>Fit Type</b>: Regular Fit</p><p><b>Sheer</b>: No</p><p><b>Closure Type</b>: Drawstring Waist</p><p><b>Material</b>: Polyester</p><p><b>Composition</b>: 100% Polyester</p><p><b>Fabric</b>: Non-Stretch</p><p><b>Care Instructions</b>: Machine wash or professional dry clean</p>,img/Pants/rwpants25210521876.jpg,,Size#S:M:L:,29.01,,,,1,1,,,Pants,,Paisley Drawstring Pants,Paisley Drawstring Pants,Paisley Drawstring Pants,,,,,,,,,
SXCNVQZ0084,Demon Print Oversized Shirt,,<p><b>Style</b>: Casual</p><p><b>Color</b>: Baby Pink</p><p><b>Pattern Type</b>: Cartoon</p><p><b>Pattern Type</b>: Halloween</p><p><b>Pattern Type</b>: All Over Print</p><p><b>Length</b>: Regular</p><p><b>Season</b>: Summer</p><p><b>Type</b>: Shirt</p><p><b>Details</b>: Button Front</p><p><b>Neckline</b>: Collar</p><p><b>Fit Type</b>: Oversized</p><p><b>Sleeve Length</b>: Short Sleeve</p><p><b>Sleeve Type</b>: Regular Sleeve</p><p><b>Sheer</b>: No</p><p><b>Placket Type</b>: Placket</p><p><b>Material</b>: Cotton</p><p><b>Composition</b>: 65% Cotton</p><p><b>Composition</b>: 35% Polyester</p><p><b>Fabric</b>: Non-Stretch</p><p><b>Care Instructions</b>: Machine wash or professional dry clean</p><p><b>Style</b>: Casual</p><p><b>Color</b>: Black</p><p><b>Pattern Type</b>: Halloween</p><p><b>Length</b>: Regular</p><p><b>Season</b>: Summer</p><p><b>Type</b>: Shirt</p><p><b>Details</b>: Button Front</p><p><b>Neckline</b>: Collar</p><p><b>Sleeve Length</b>: Long Sleeve</p><p><b>Fit Type</b>: Oversized</p><p><b>Sleeve Type</b>: Drop Shoulder</p><p><b>Sheer</b>: No</p><p><b>Placket Type</b>: Placket</p><p><b>Material</b>: Cotton</p><p><b>Composition</b>: 65% Cotton</p><p><b>Composition</b>: 35% Polyester</p><p><b>Fabric</b>: Non-Stretch</p><p><b>Care Instructions</b>: Machine wash or professional dry clean</p>,img/Blouses/rwblouse03200908263.jpg,,Size#XS:S:M:L:XL:,24.26,,,,1,1,,,Blouses,,Demon Print Oversized Shirt,Demon Print Oversized Shirt,Demon Print Oversized Shirt,,,,,,,,,
SXCNVQZ0085,Off Shoulder Button Front Lettuce Edge Dress,,<p><b>Style</b>: Casual</p><p><b>Color</b>: Maroon</p><p><b>Pattern Type</b>: Plain</p><p><b>Length</b>: Short</p><p><b>Season</b>: Summer</p><p><b>Type</b>: Bodycon</p><p><b>Details</b>: Lettuce Trim</p><p><b>Details</b>: Rib-Knit</p><p><b>Details</b>: Button Front</p><p><b>Neckline</b>: Off the Shoulder</p><p><b>Sleeve Length</b>: Short Sleeve</p><p><b>Waist Line</b>: Natural</p><p><b>Fit Type</b>: Slim Fit</p><p><b>Sleeve Type</b>: Regular Sleeve</p><p><b>Sheer</b>: No</p><p><b>Hem Shaped</b>: Pencil</p><p><b>Material</b>: Cotton</p><p><b>Composition</b>: 95% Cotton</p><p><b>Composition</b>: 5% Spandex</p><p><b>Fabric</b>: Slight Stretch</p><p><b>Care Instructions</b>: Machine wash or professional dry clean</p><p><b>Style</b>: Casual</p><p><b>Color</b>: Mustard Yellow</p><p><b>Pattern Type</b>: Plain</p><p><b>Length</b>: Short</p><p><b>Season</b>: Summer</p><p><b>Type</b>: Bodycon</p><p><b>Details</b>: Lettuce Trim</p><p><b>Details</b>: Rib-Knit</p><p><b>Details</b>: Button Front</p><p><b>Neckline</b>: Off the Shoulder</p><p><b>Sleeve Length</b>: Short Sleeve</p><p><b>Waist Line</b>: Natural</p><p><b>Fit Type</b>: Slim Fit</p><p><b>Sleeve Type</b>: Regular Sleeve</p><p><b>Sheer</b>: No</p><p><b>Hem Shaped</b>: Pencil</p><p><b>Material</b>: Cotton</p><p><b>Composition</b>: 95% Cotton</p><p><b>Composition</b>: 5% Spandex</p><p><b>Fabric</b>: Slight Stretch</p><p><b>Care Instructions</b>: Machine wash or professional dry clean</p><p><b>Style</b>: Casual</p><p><b>Color</b>: Black</p><p><b>Pattern Type</b>: Plain</p><p><b>Length</b>: Short</p><p><b>Season</b>: Summer</p><p><b>Type</b>: Bodycon</p><p><b>Details</b>: Lettuce Trim</p><p><b>Details</b>: Rib-Knit</p><p><b>Details</b>: Button Front</p><p><b>Neckline</b>: Off the Shoulder</p><p><b>Sleeve Length</b>: Short Sleeve</p><p><b>Waist Line</b>: Natural</p><p><b>Fit Type</b>: Slim Fit</p><p><b>Sleeve Type</b>: Regular Sleeve</p><p><b>Sheer</b>: No</p><p><b>Hem Shaped</b>: Pencil</p><p><b>Material</b>: Cotton</p><p><b>Composition</b>: 95% Cotton</p><p><b>Composition</b>: 5% Spandex</p><p><b>Fabric</b>: Slight Stretch</p><p><b>Care Instructions</b>: Machine wash or professional dry clean</p>,img/Dresses/swdress07200805014.jpg,,Size#XS:S:M:L:XL:,29.62,,,,1,1,,,Dresses,,Off Shoulder Button Front Lettuce Edge Dress,Off Shoulder Button Front Lettuce Edge Dress,Off Shoulder Button Front Lettuce Edge Dress,,,,,,,,,
SXCNVQZ0086,Vintage Alloy Carved Anklet Bohemia Adjustable Ancient Coin Tassel Women Bracelet,,<p>Style: Vintage </p><p>Type: Anklets</p><p>Color: Ancient Silver</p><p>Weight: 47g</p><p>Size: As the picture shown</p><p>Material: Alloy</p><p>1 x Bracelet </p>,img/Bracelets/SKUG10298.jpg,,Size#,26.46,,,,1,1,,,Bracelets,,Vintage Alloy Carved Anklet Bohemia Adjustable Ancient Coin Tassel Women Bracelet,Vintage Alloy Carved Anklet Bohemia Adjustable Ancient Coin Tassel Women Bracelet,Vintage Alloy Carved Anklet Bohemia Adjustable Ancient Coin Tassel Women Bracelet,,,,,,,,,
SXCNVQZ0087,Rhinestone Star & Moon Pendant Necklace,,<p><b>Type</b>: Pendant Necklaces</p><p><b>Details</b>: Rhinestone</p><p><b>Details</b>: Star</p><p><b>Material</b>: Alloy</p><p><b>Type</b>: Layer Sets</p><p><b>Color</b>: Silver</p><p><b>Metal Color</b>: Silver</p><p><b>Style</b>: Casual</p>,img/Pendant_Necklaces/swneck18201028624.jpg,,Size#,24.29,,,,1,1,,,Pendant Necklaces,,Rhinestone Star & Moon Pendant Necklace,Rhinestone Star & Moon Pendant Necklace,Rhinestone Star & Moon Pendant Necklace,,,,,,,,,
SXCNVQZ0088,Women Embroidery Wallet Multi-function 4 Card Slot Lovely Coin Purse,,"<p>Color:Pink, Black, Grey, Blue, Red</p><p>Material:PU</p>",img/Wallets/SKUB63387.jpg,,Size#S:,64.16,,,,1,1,,,Wallets,,Women Embroidery Wallet Multi-function 4 Card Slot Lovely Coin Purse,Women Embroidery Wallet Multi-function 4 Card Slot Lovely Coin Purse,Women Embroidery Wallet Multi-function 4 Card Slot Lovely Coin Purse,,,,,,,,,
SXCNVQZ0089,Firework Cutout Casual Brief Slip On Non-slip Comfortable Best Flat Loafers Shoes For Women,,"<p>Color:Khaki, Orange, Green, Red, Brown</p><p>Type:Loafers</p><p>Closure Type:Slip-On</p><p>Heel Type:Flat</p><p>Heel Height:1-3cm In Flat</p><p>Toe Type:Round</p><p>Pattern:Solid</p><p>Design Element:Hollow out, Pattern</p><p>Upper Material:PU</p><p>Style:Casual, Natural</p><p>Outsole Material:Rubber</p><p>Structure:Slip-On</p><p>Occasion:Casual</p><p>Function:Breathable, Hard-wearing</p><p>Season:Summer, Spring</p>",img/Flats/SKUH25604.jpg,,Size#US 5:US 6:US 7:US 8:US 9:,61.49,,,,1,1,,,Flats,,Firework Cutout Casual Brief Slip On Non-slip Comfortable Best Flat Loafers Shoes For Women,Firework Cutout Casual Brief Slip On Non-slip Comfortable Best Flat Loafers Shoes For Women,Firework Cutout Casual Brief Slip On Non-slip Comfortable Best Flat Loafers Shoes For Women,,,,,,,,,
SXCNVQZ0090,Men Mesh Fabric Non Slip Elastic Lace Casual Water Shoes,,"<p>Color:Black, Brown, Blue, Grey, Green</p><p>Upper Material:Mesh, Cloth</p><p>Function:Slip Resistant</p><p>Closure Type:Lace-up</p><p>Toe Type:Round</p>",img/Sneakers__Athletic/SKUE64944.jpg,,Size#US 6.5:US 7.5:US 8:US 8.5:US 9:US 10:US 10.5:US 11:US 11.5:,50.16,,,,1,1,,,Sneakers & Athletic,,Men Mesh Fabric Non Slip Elastic Lace Casual Water Shoes,Men Mesh Fabric Non Slip Elastic Lace Casual Water Shoes,Men Mesh Fabric Non Slip Elastic Lace Casual Water Shoes,,,,,,,,,
SXCNVQZ0091,Strawberry & Gingham Print Skirt,,<p><b>Style</b>: Preppy</p><p><b>Color</b>: Multicolor</p><p><b>Pattern Type</b>: Gingham</p><p><b>Pattern Type</b>: Fruit&Vegetable</p><p><b>Length</b>: Mini</p><p><b>Type</b>: Straight</p><p><b>Season</b>: Summer</p><p><b>Details</b>: Split</p><p><b>Waist Line</b>: High Waist</p><p><b>Sheer</b>: No</p><p><b>Material</b>: Polyester</p><p><b>Composition</b>: 100% Polyester</p><p><b>Fabric</b>: Medium Stretch</p><p><b>Care Instructions</b>: Machine wash or professional dry clean</p>,img/Skirts/sW210607313434033.jpg,,Size#S:M:L:,26.49,,,,1,1,,,Skirts,,Strawberry & Gingham Print Skirt,Strawberry & Gingham Print Skirt,Strawberry & Gingham Print Skirt,,,,,,,,,
SXCNVQZ0092,Contrast Plaid Cargo Pants,,<p><b>Style</b>: Casual</p><p><b>Color</b>: Multicolor</p><p><b>Pattern Type</b>: Plaid</p><p><b>Length</b>: Long</p><p><b>Season</b>: All</p><p><b>Type</b>: Cargo Pants</p><p><b>Details</b>: Pocket</p><p><b>Waist Line</b>: Natural</p><p><b>Fit Type</b>: Regular Fit</p><p><b>Sheer</b>: No</p><p><b>Closure Type</b>: Elastic Waist</p><p><b>Material</b>: Cotton</p><p><b>Composition</b>: 65% Cotton</p><p><b>Composition</b>: 35% Polyester</p><p><b>Fabric</b>: Non-Stretch</p><p><b>Care Instructions</b>: Machine wash or professional dry clean</p>,img/Pants/rwpants25210518077.jpg,,Size#XS:S:M:L:,29.92,,,,1,1,,,Pants,,Contrast Plaid Cargo Pants,Contrast Plaid Cargo Pants,Contrast Plaid Cargo Pants,,,,,,,,,
SXCNVQZ0093,Allover Print Ruffle Hem Peplum Blouse,,<p><b>Style</b>: Boho</p><p><b>Color</b>: Red</p><p><b>Pattern Type</b>: All Over Print</p><p><b>Length</b>: Regular</p><p><b>Season</b>: Summer</p><p><b>Type</b>: Peplum</p><p><b>Details</b>: Ruffle Hem</p><p><b>Sleeve Type</b>: Butterfly Sleeve</p><p><b>Fit Type</b>: Regular Fit</p><p><b>Sleeve Length</b>: Short Sleeve</p><p><b>Neckline</b>: V neck</p><p><b>Sheer</b>: No</p><p><b>Placket Type</b>: Pullovers</p><p><b>Material</b>: Polyester</p><p><b>Composition</b>: 97% Polyester</p><p><b>Composition</b>: 3% Spandex</p><p><b>Fabric</b>: Non-Stretch</p><p><b>Care Instructions</b>: Machine wash or professional dry clean</p>,img/Blouses/swblouse03200427698.jpg,,Size#S:M:L:XL:,23.57,,,,1,1,,,Blouses,,Allover Print Ruffle Hem Peplum Blouse,Allover Print Ruffle Hem Peplum Blouse,Allover Print Ruffle Hem Peplum Blouse,,,,,,,,,
SXCNVQZ0094,Plaid Frill Trim Cami Dress Without Blouse,,<p><b>Style</b>: Preppy</p><p><b>Color</b>: Dark Green</p><p><b>Pattern Type</b>: Plaid</p><p><b>Length</b>: Mini</p><p><b>Season</b>: Spring/Summer</p><p><b>Type</b>: Pinafore</p><p><b>Details</b>: Ruffle Hem</p><p><b>Details</b>: Zipper</p><p><b>Sleeve Length</b>: Sleeveless</p><p><b>Neckline</b>: Spaghetti Strap</p><p><b>Waist Line</b>: High Waist</p><p><b>Fit Type</b>: Regular Fit</p><p><b>Sheer</b>: No</p><p><b>Hem Shaped</b>: Flounce</p><p><b>Material</b>: Polyester</p><p><b>Composition</b>: 100% Polyester</p><p><b>Fabric</b>: Non-Stretch</p><p><b>Care Instructions</b>: Machine wash or professional dry clean</p>,img/Dresses/swdress25210527379.jpg,,Size#XS:S:M:L:,31.42,,,,1,1,,,Dresses,,Plaid Frill Trim Cami Dress Without Blouse,Plaid Frill Trim Cami Dress Without Blouse,Plaid Frill Trim Cami Dress Without Blouse,,,,,,,,,
SXCNVQZ0095,Bohemian Multilayer Bracelet Animal Elephant Heart Colorful Tassel Beaded Pendant Bracelet for Women,,"<p>
	</p><p>
	</p><p>
	</p><p>
	</p><p>
	</p><p>
	</p><p>
	</p><p>
	</p><p>
</p><p>
	 </p><p>Notice:</p>",img/Bracelets/SKUA21093.jpg,,Size#,14.77,,,,1,1,,,Bracelets,,Bohemian Multilayer Bracelet Animal Elephant Heart Colorful Tassel Beaded Pendant Bracelet for Women,Bohemian Multilayer Bracelet Animal Elephant Heart Colorful Tassel Beaded Pendant Bracelet for Women,Bohemian Multilayer Bracelet Animal Elephant Heart Colorful Tassel Beaded Pendant Bracelet for Women,,,,,,,,,
SXCNVQZ0096,2pcs Snake Pendant Necklace,,<p><b>Type</b>: Pendant Necklaces</p><p><b>Material</b>: Alloy</p><p><b>Color</b>: Multicolor</p><p><b>Style</b>: Casual</p>,img/Pendant_Necklaces/rwneck18210326286.jpg,,Size#,17.38,,,,1,1,,,Pendant Necklaces,,2pcs Snake Pendant Necklace,2pcs Snake Pendant Necklace,2pcs Snake Pendant Necklace,,,,,,,,,
SXCNVQZ0097,Women Genuine Leather RFID Anti Theft 9 Card Slots Wallet Purse,,"<p>Color:Pink, Yellow, Black, Blue</p><p>Style:Casual</p>",img/Wallets/SKUF29996.jpg,,Size#,63.86,,,,1,1,,,Wallets,,Women Genuine Leather RFID Anti Theft 9 Card Slots Wallet Purse,Women Genuine Leather RFID Anti Theft 9 Card Slots Wallet Purse,Women Genuine Leather RFID Anti Theft 9 Card Slots Wallet Purse,,,,,,,,,
SXCNVQZ0098,SOCOFY Vintage Paisley Contrast Splicing Leather Elastic Strap Slip on Wedge Casual Shoes,,"<p>Color:Blue</p><p>Type:Loafers</p><p>Closure Type:Slip-On</p><p>Heel Type:Flat</p><p>Heel Height:1-3cm In Flat</p><p>Toe Type:Round</p><p>Pattern:Tribal, Striped, Calico</p><p>Design Element:Print</p><p>Upper Material:Leather</p><p>Style:Bohemia</p><p>Outsole Material:Rubber</p><p>Structure:Cross Strap, Closed Toe, Elastic Band</p><p>Occasion:Daily</p><p>Function:Breathable, Soft</p><p>Season:Autumn, Spring</p>",img/Flats/SKUF57899.jpg,,Size#US 5:US 6:US 7:US 8:US 9.5:US 10.5:US 11.5:,64.03,,,,1,1,,,Flats,,SOCOFY Vintage Paisley Contrast Splicing Leather Elastic Strap Slip on Wedge Casual Shoes,SOCOFY Vintage Paisley Contrast Splicing Leather Elastic Strap Slip on Wedge Casual Shoes,SOCOFY Vintage Paisley Contrast Splicing Leather Elastic Strap Slip on Wedge Casual Shoes,,,,,,,,,
SXCNVQZ0099,Men Outdoor Hollow Out Microfiber Leather Hiking Shoes,,"<p>Color:Black, Grey</p><p>Upper Material:PU</p><p>Outsole Material:Rubber</p><p>Type:Outdoor Shoes, Hiking Shoes</p><p>Function:Breathable, Hard-wearing, Sport, Slip Resistant</p><p>Occasion:Outdoor, Sport, Camping & Hiking</p><p>Closure Type:Lace-up</p><p>Season:All Season</p><p>Toe Type:Round</p>",img/Sneakers__Athletic/SKUH36962.jpg,,Size#US 6.5:US 7.5:US 8:US 8.5:US 9:US 10:US 10.5:US 11:US 11.5:,50.65,,,,1,1,,,Sneakers & Athletic,,Men Outdoor Hollow Out Microfiber Leather Hiking Shoes,Men Outdoor Hollow Out Microfiber Leather Hiking Shoes,Men Outdoor Hollow Out Microfiber Leather Hiking Shoes,,,,,,,,,
SXCNVQZ0100,Tartan Lace Up Lace Trim Skirt,,<p><b>Style</b>: Preppy</p><p><b>Color</b>: Black and White</p><p><b>Pattern Type</b>: Plaid</p><p><b>Length</b>: Short</p><p><b>Type</b>: A Line</p><p><b>Season</b>: Summer</p><p><b>Details</b>: Lace Up</p><p><b>Details</b>: Contrast Lace</p><p><b>Waist Line</b>: Natural</p><p><b>Sheer</b>: No</p><p><b>Material</b>: Polyester</p><p><b>Composition</b>: 95% Polyester</p><p><b>Composition</b>: 5% Elastane</p><p><b>Fabric</b>: Non-Stretch</p><p><b>Care Instructions</b>: Machine wash or professional dry clean</p>,img/Skirts/sW210608194111441.jpg,,Size#S:M:L:,26.58,,,,1,1,,,Skirts,,Tartan Lace Up Lace Trim Skirt,Tartan Lace Up Lace Trim Skirt,Tartan Lace Up Lace Trim Skirt,,,,,,,,,
SXCNVQZ0101,Tie Dye Split Hem Drawstring Waist Pants,,<p><b>Style</b>: Casual</p><p><b>Color</b>: Multicolor</p><p><b>Pattern Type</b>: Tie Dye</p><p><b>Length</b>: Long</p><p><b>Type</b>: Wide Leg</p><p><b>Season</b>: All</p><p><b>Details</b>: Drawstring</p><p><b>Details</b>: Split</p><p><b>Waist Line</b>: High Waist</p><p><b>Fit Type</b>: Loose</p><p><b>Sheer</b>: No</p><p><b>Closure Type</b>: Drawstring Waist</p><p><b>Body</b>: Unlined</p><p><b>Material</b>: Polyester</p><p><b>Composition</b>: 95% Polyester</p><p><b>Composition</b>: 5% Elastane</p><p><b>Fabric</b>: Slight Stretch</p><p><b>Care Instructions</b>: Machine wash or professional dry clean</p>,img/Pants/swpants30210325839.jpg,,Size#S:M:L:XL:,31.8,,,,1,1,,,Pants,,Tie Dye Split Hem Drawstring Waist Pants,Tie Dye Split Hem Drawstring Waist Pants,Tie Dye Split Hem Drawstring Waist Pants,,,,,,,,,
