v_sku,v_name,v_short_description,v_description,v_image,v_url,v_attribute,v_price,v_specials_price,v_specials_expire_date,v_date_added,v_in_stock,v_status,v_viewed,v_ordered,v_category_sku,v_sort_order,v_meta_title,v_meta_keywords,v_meta_description,v_brand_filter,v_class_filter,v_color_filter,v_gender_filter,v_material_filter,v_year_filter,v_origin_filter,v_series_filter,v_spec_filter
THJFOBY0032,4pcs Lock & Safety Pin Pendant Necklace,,<p><b>Type</b>: Pendant Necklaces</p><p><b>Details</b>: Rhinestone</p><p><b>Material</b>: Alloy</p><p><b>Color</b>: Silver</p><p><b>Style</b>: Glamorous</p>,img/Pendant_Necklaces/swneck18201029719.jpg,,Size#,25.02,,,,1,1,,,Pendant Necklaces,,4pcs Lock & Safety Pin Pendant Necklace,4pcs Lock & Safety Pin Pendant Necklace,4pcs Lock & Safety Pin Pendant Necklace,,,,,,,,,
THJFOBY0033,Statement Colorful Hollow Teardrop Spiral Earrings Stainless Steel Drop Earrings Fashion Jewelry,,"<p>Style: Statement</p><p>Type: Ear Drop</p><p>Weight: About 7g</p><p>Material: Stainless Steel</p><p>Main Color: Blue, Colorful</p><p>Size: About 9.7cm * 3cm / 3.82' * 1.18'</p><p>1 Pair of Earrings</p>",img/Earrings/SKU885129.jpg,,Size#,15.19,,,,1,1,,,Earrings,,Statement Colorful Hollow Teardrop Spiral Earrings Stainless Steel Drop Earrings Fashion Jewelry,Statement Colorful Hollow Teardrop Spiral Earrings Stainless Steel Drop Earrings Fashion Jewelry,Statement Colorful Hollow Teardrop Spiral Earrings Stainless Steel Drop Earrings Fashion Jewelry,,,,,,,,,
THJFOBY0034,Women Striped Casual Canvas Handbag Crossbody Bag,,"<p>Bag Type:Satchel</p><p>Color:Blue, Black</p><p>Material:Canvas</p><p>Style:Casual</p><p>Hardness:Soft</p>",img/Handbags/SKUE82660.jpg,,Size#,60.26,,,,1,1,,,Handbags,,Women Striped Casual Canvas Handbag Crossbody Bag,Women Striped Casual Canvas Handbag Crossbody Bag,Women Striped Casual Canvas Handbag Crossbody Bag,,,,,,,,,
THJFOBY0035,Women Comfy Breathable Knitted Pointed Toe Ballet Shoes Soft Sole Slip On Flats,,"<p>Color:Red, Black, Blue</p><p>Type:Ballet Flat</p><p>Closure Type:Slip-On</p><p>Heel Type:Flat</p><p>Heel Height:1-3cm In Flat</p><p>Toe Type:Pointed</p><p>Pattern:Other</p><p>Design Element:Simple</p><p>Upper Material:Knitted</p><p>Style:Casual, Elegant</p><p>Outsole Material:PU</p><p>Structure:Slip-On</p><p>Occasion:Holiday, Casual</p><p>Function:Antiskid, Soft</p><p>Season:Spring&Summer, Autumn</p>",img/Flats/SKUG33642.jpg,,Size#US 5:US 6:US 7:US 8:US 9:US 10:,65.44,,,,1,1,,,Flats,,Women Comfy Breathable Knitted Pointed Toe Ballet Shoes Soft Sole Slip On Flats,Women Comfy Breathable Knitted Pointed Toe Ballet Shoes Soft Sole Slip On Flats,Women Comfy Breathable Knitted Pointed Toe Ballet Shoes Soft Sole Slip On Flats,,,,,,,,,
THJFOBY0036,Women Summer Holiday Fashion Print Comfy Slip On Casual Beach Cork Slippers,,"<p>Color:Yellow, Black, Brown, White</p><p>Closure Type:Slip-On</p><p>Heel Type:Flat</p><p>Heel Height:1-3cm In Flat</p><p>Toe Type:Opened</p><p>Pattern:Animal-print</p><p>Design Element:Print</p><p>Upper Material:PU</p><p>Style:Casual</p><p>Outsole Material:Rubber</p><p>Occasion:Beach, Holiday, Casual</p><p>Function:Hard-wearing</p><p>Season:Summer</p>",img/Slippers/SKUH70813.jpg,,Size#US 5:US 6:US 7:US 8:US 9:US 10:US 11:US 12:,51.5,,,,1,1,,,Slippers,,Women Summer Holiday Fashion Print Comfy Slip On Casual Beach Cork Slippers,Women Summer Holiday Fashion Print Comfy Slip On Casual Beach Cork Slippers,Women Summer Holiday Fashion Print Comfy Slip On Casual Beach Cork Slippers,,,,,,,,,
THJFOBY0037,Letter Polo Dress,,<p><b>Style</b>: Preppy</p><p><b>Color</b>: White</p><p><b>Type</b>: A Line</p><p><b>Sleeve Length</b>: Short Sleeve</p><p><b>Neckline</b>: Collar</p><p><b>Sheer</b>: No</p><p><b>Hem Shaped</b>: Flared</p><p><b>Material</b>: Polyester</p><p><b>Composition</b>: 65% Polyester</p><p><b>Composition</b>: 30% Cotton</p><p><b>Composition</b>: 5% Elastane</p><p><b>Fabric</b>: Slight Stretch</p><p><b>Care Instructions</b>: Machine wash or professional dry clean</p>,img/Dresses/sW210617858647733.jpg,,Size#S:M:L:,29.23,,,,1,1,,,Dresses,,Letter Polo Dress,Letter Polo Dress,Letter Polo Dress,,,,,,,,,
THJFOBY0038,Sun & Moon Graphic Tee,,<p><b>Style</b>: Casual</p><p><b>Color</b>: Multicolor</p><p><b>Pattern Type</b>: Tie Dye</p><p><b>Pattern Type</b>: Graphic</p><p><b>Length</b>: Regular</p><p><b>Season</b>: Summer</p><p><b>Neckline</b>: Round Neck</p><p><b>Sleeve Length</b>: Short Sleeve</p><p><b>Fit Type</b>: Regular Fit</p><p><b>Sleeve Type</b>: Drop Shoulder</p><p><b>Placket Type</b>: Pullovers</p><p><b>Sheer</b>: No</p><p><b>Material</b>: Cotton</p><p><b>Composition</b>: 65% Cotton</p><p><b>Composition</b>: 35% Polyester</p><p><b>Fabric</b>: Slight Stretch</p><p><b>Care Instructions</b>: Machine wash or professional dry clean</p><p><b>Style</b>: Casual</p><p><b>Color</b>: Dark Grey</p><p><b>Pattern Type</b>: Graphic</p><p><b>Length</b>: Regular</p><p><b>Season</b>: Summer</p><p><b>Neckline</b>: Round Neck</p><p><b>Sleeve Length</b>: Short Sleeve</p><p><b>Fit Type</b>: Regular Fit</p><p><b>Sleeve Type</b>: Regular Sleeve</p><p><b>Placket Type</b>: Pullovers</p><p><b>Sheer</b>: No</p><p><b>Material</b>: Cotton</p><p><b>Composition</b>: 65% Cotton</p><p><b>Composition</b>: 35% Polyester</p><p><b>Fabric</b>: Slight Stretch</p><p><b>Care Instructions</b>: Machine wash or professional dry clean</p>,img/T___Shirts/rwtee03210326434.jpg,,Size#XS:S:M:L:,30.85,,,,1,1,,,T-Shirts,,Sun & Moon Graphic Tee,Sun & Moon Graphic Tee,Sun & Moon Graphic Tee,,,,,,,,,
THJFOBY0039,Corduroy Colorblock Pocket Shorts,,<p><b>Style</b>: Casual</p><p><b>Color</b>: Multicolor</p><p><b>Pattern Type</b>: Colorblock</p><p><b>Type</b>: Straight Leg</p><p><b>Season</b>: Spring/Summer/Fall</p><p><b>Waist Line</b>: Natural</p><p><b>Fit Type</b>: Regular Fit</p><p><b>Sheer</b>: No</p><p><b>Closure Type</b>: Elastic Waist</p><p><b>Material</b>: Corduroy</p><p><b>Composition</b>: 100% Polyester</p><p><b>Fabric</b>: Non-Stretch</p><p><b>Care Instructions</b>: Machine wash or professional dry clean</p>,img/Shorts/rwshorts25210407312.jpg,,Size#S:M:L:,22.27,,,,1,1,,,Shorts,,Corduroy Colorblock Pocket Shorts,Corduroy Colorblock Pocket Shorts,Corduroy Colorblock Pocket Shorts,,,,,,,,,
THJFOBY0040,Graphic Mesh Crop Top,,<p><b>Style</b>: Casual</p><p><b>Color</b>: Multicolor</p><p><b>Pattern Type</b>: Graphic</p><p><b>Length</b>: Crop</p><p><b>Season</b>: Spring/Summer</p><p><b>Sleeve Length</b>: Long Sleeve</p><p><b>Fit Type</b>: Regular Fit</p><p><b>Neckline</b>: Round Neck</p><p><b>Sleeve Type</b>: Regular Sleeve</p><p><b>Placket Type</b>: Pullovers</p><p><b>Sheer</b>: Yes</p><p><b>Material</b>: Mesh</p><p><b>Composition</b>: 65% Cotton</p><p><b>Composition</b>: 35% Polyester</p><p><b>Fabric</b>: Medium Stretch</p><p><b>Care Instructions</b>: Machine wash or professional dry clean</p>,img/Women_Tops/sW210611557566444.jpg,,Size#S:M:L:,30.61,,,,1,1,,,Women Tops,,Graphic Mesh Crop Top,Graphic Mesh Crop Top,Graphic Mesh Crop Top,,,,,,,,,
THJFOBY0041,Colorful Rhinestone Decor Necklace,,<p><b>Type</b>: Pendant Necklaces</p><p><b>Details</b>: Rhinestone</p><p><b>Material</b>: Alloy</p><p><b>Color</b>: Gold</p><p><b>Metal Color</b>: Gold</p><p><b>Style</b>: Glamorous</p>,img/Pendant_Necklaces/swneck18200601877.jpg,,Size#,16.81,,,,1,1,,,Pendant Necklaces,,Colorful Rhinestone Decor Necklace,Colorful Rhinestone Decor Necklace,Colorful Rhinestone Decor Necklace,,,,,,,,,
THJFOBY0042,Fashion Plated 925 Silver Rose Earrings Creative Petal Leaf Wedding Women Earrings,,<p>Style: Fashion</p><p>Type: Women Earrings</p><p>Main Color: Silver</p><p>Weight: 4g</p><p>Size: About 3.1*1.2cm / 1.22*0.47'</p><p>Material: Metal</p><p>1 x Women Earrings</p>,img/Earrings/SKUF95607.jpg,,Size#,24.79,,,,1,1,,,Earrings,,Fashion Plated 925 Silver Rose Earrings Creative Petal Leaf Wedding Women Earrings,Fashion Plated 925 Silver Rose Earrings Creative Petal Leaf Wedding Women Earrings,Fashion Plated 925 Silver Rose Earrings Creative Petal Leaf Wedding Women Earrings,,,,,,,,,
THJFOBY0043,Women Casual Stripe Canvas Contrast Color Multi-pocket Handbag Shoulder Bag,,<p>Bag Type:Tote</p><p>Material:Canvas</p><p>Style:Casual</p><p>Hardness:Soft</p>,img/Handbags/SKU262489.jpg,,Size#,56.49,,,,1,1,,,Handbags,,Women Casual Stripe Canvas Contrast Color Multi-pocket Handbag Shoulder Bag,Women Casual Stripe Canvas Contrast Color Multi-pocket Handbag Shoulder Bag,Women Casual Stripe Canvas Contrast Color Multi-pocket Handbag Shoulder Bag,,,,,,,,,
THJFOBY0044,LOSTISY Plus Size Women Casual Breathable Tassel Flat Loafers,,"<p>Color:Green, Red, Black, Blue</p><p>Type:Loafers</p><p>Closure Type:Slip-On</p><p>Heel Type:Flat</p><p>Heel Height:1-3cm In Flat</p><p>Toe Type:Closed Toe, Round</p><p>Pattern:Solid</p><p>Design Element:Tassel</p><p>Upper Material:PU</p><p>Style:Casual</p><p>Outsole Material:Rubber</p><p>Structure:Slip-On</p><p>Occasion:Daily</p><p>Function:Breathable, Soft</p><p>Season:All Season</p>",img/Flats/SKUC26478.jpg,,Size#US 5:US 6:US 7:US 8:US 9:US 10:US 11:US 12:,65.82,,,,1,1,,,Flats,,LOSTISY Plus Size Women Casual Breathable Tassel Flat Loafers,LOSTISY Plus Size Women Casual Breathable Tassel Flat Loafers,LOSTISY Plus Size Women Casual Breathable Tassel Flat Loafers,,,,,,,,,
THJFOBY0045,Women Casual Butterfly Knot Espadrilles Straw Platform Slippers,,"<p>Color:Beige, Pink, Blue</p><p>Heel Type:Platforms</p><p>Toe Type:Opened, Peep Toe</p><p>Upper Material:PU</p><p>Outsole Material:Rubber</p><p>Function:Breathable</p><p>Season:Summer</p>",img/Slippers/SKUF41144.jpg,,Size#US 5:US 6:US 7:US 8:US 9:US 10:US 11:US 12:,60.78,,,,1,1,,,Slippers,,Women Casual Butterfly Knot Espadrilles Straw Platform Slippers,Women Casual Butterfly Knot Espadrilles Straw Platform Slippers,Women Casual Butterfly Knot Espadrilles Straw Platform Slippers,,,,,,,,,
THJFOBY0046,Solid Tie Shoulder Split Dress,,<p><b>Style</b>: Casual</p><p><b>Color</b>: Mint Green</p><p><b>Pattern Type</b>: Plain</p><p><b>Length</b>: Mini</p><p><b>Season</b>: Summer</p><p><b>Type</b>: Cami</p><p><b>Details</b>: Knot</p><p><b>Details</b>: Split</p><p><b>Sleeve Length</b>: Sleeveless</p><p><b>Neckline</b>: Spaghetti Strap</p><p><b>Waist Line</b>: Natural</p><p><b>Fit Type</b>: Regular Fit</p><p><b>Sheer</b>: No</p><p><b>Hem Shaped</b>: Straight</p><p><b>Material</b>: Cotton</p><p><b>Composition</b>: 65% Cotton</p><p><b>Composition</b>: 35% Polyester</p><p><b>Fabric</b>: Non-Stretch</p><p><b>Care Instructions</b>: Machine wash or professional dry clean</p>,img/Dresses/rwdress25210526029.jpg,,Size#S:M:L:,31.79,,,,1,1,,,Dresses,,Solid Tie Shoulder Split Dress,Solid Tie Shoulder Split Dress,Solid Tie Shoulder Split Dress,,,,,,,,,
THJFOBY0047,Sun & Moon Graphic 2 In 1 Tee,,<p><b>Style</b>: Casual</p><p><b>Color</b>: Black</p><p><b>Pattern Type</b>: Striped</p><p><b>Pattern Type</b>: Graphic</p><p><b>Length</b>: Crop</p><p><b>Season</b>: Spring/Fall</p><p><b>Sleeve Length</b>: Long Sleeve</p><p><b>Neckline</b>: Collar</p><p><b>Fit Type</b>: Regular Fit</p><p><b>Sleeve Type</b>: Drop Shoulder</p><p><b>Placket Type</b>: Pullovers</p><p><b>Sheer</b>: No</p><p><b>Material</b>: Polyester</p><p><b>Composition</b>: 65% Polyester</p><p><b>Composition</b>: 30% Cotton</p><p><b>Composition</b>: 5% Spandex</p><p><b>Fabric</b>: Slight Stretch</p><p><b>Care Instructions</b>: Machine wash or professional dry clean</p>,img/T___Shirts/rwtee01201028492.jpg,,Size#XS:S:M:L:XL:,30.0,,,,1,1,,,T-Shirts,,Sun & Moon Graphic 2 In 1 Tee,Sun & Moon Graphic 2 In 1 Tee,Sun & Moon Graphic 2 In 1 Tee,,,,,,,,,
THJFOBY0048,Elastic Waist Slant Pocket Tartan Shorts,,<p><b>Style</b>: Casual</p><p><b>Color</b>: Multicolor</p><p><b>Pattern Type</b>: Tartan</p><p><b>Type</b>: Straight Leg</p><p><b>Season</b>: Summer</p><p><b>Details</b>: Pocket</p><p><b>Waist Line</b>: High Waist</p><p><b>Fit Type</b>: Regular Fit</p><p><b>Sheer</b>: No</p><p><b>Closure Type</b>: Elastic Waist</p><p><b>Material</b>: Cotton</p><p><b>Composition</b>: 80% Cotton</p><p><b>Composition</b>: 20% Polyester</p><p><b>Fabric</b>: Non-Stretch</p><p><b>Care Instructions</b>: Machine wash or professional dry clean</p>,img/Shorts/swshorts07201228216.jpg,,Size#XS:S:M:L:XL:,22.39,,,,1,1,,,Shorts,,Elastic Waist Slant Pocket Tartan Shorts,Elastic Waist Slant Pocket Tartan Shorts,Elastic Waist Slant Pocket Tartan Shorts,,,,,,,,,
THJFOBY0049,Cobweb Mesh Top,,<p><b>Style</b>: Sexy</p><p><b>Color</b>: Black</p><p><b>Pattern Type</b>: Graphic</p><p><b>Length</b>: Regular</p><p><b>Season</b>: Spring/Summer</p><p><b>Sleeve Length</b>: Long Sleeve</p><p><b>Fit Type</b>: Regular Fit</p><p><b>Neckline</b>: Stand Collar</p><p><b>Sleeve Type</b>: Regular Sleeve</p><p><b>Placket Type</b>: Pullovers</p><p><b>Sheer</b>: Yes</p><p><b>Material</b>: Polyester</p><p><b>Composition</b>: 100% Polyester</p><p><b>Fabric</b>: Medium Stretch</p><p><b>Care Instructions</b>: Machine wash or professional dry clean</p>,img/Women_Tops/rwtop25210518006.jpg,,Size#S:M:L:,23.39,,,,1,1,,,Women Tops,,Cobweb Mesh Top,Cobweb Mesh Top,Cobweb Mesh Top,,,,,,,,,
THJFOBY0050,Gun Pendant Necklace,,<p><b>Type</b>: Pendant Necklaces</p><p><b>Material</b>: Alloy</p><p><b>Color</b>: Silver</p><p><b>Metal Color</b>: Silver</p><p><b>Style</b>: Casual</p>,img/Pendant_Necklaces/rwneck18200826096.jpg,,Size#,24.27,,,,1,1,,,Pendant Necklaces,,Gun Pendant Necklace,Gun Pendant Necklace,Gun Pendant Necklace,,,,,,,,,
THJFOBY0051,Vintage Metal Bullet Pendant Earrings Temperament Turquoise Earrings,,<p>Style: Vintage</p><p>Type: Earrings</p><p>Color: Green.</p><p>Material:</p><p>Alloy.</p><p>1 x Earrings</p>,img/Earrings/SKUH32984.jpg,,Size#,14.61,,,,1,1,,,Earrings,,Vintage Metal Bullet Pendant Earrings Temperament Turquoise Earrings,Vintage Metal Bullet Pendant Earrings Temperament Turquoise Earrings,Vintage Metal Bullet Pendant Earrings Temperament Turquoise Earrings,,,,,,,,,
THJFOBY0052,Brenice Women National Style Flower Decoration Handbag PU Leather Sling Bag,,"<p>Bag Type:Satchel</p><p>Color:Black, Green, White, Purple, Red</p><p>Material:PU</p><p>Style:Vintage</p><p>Hardness:Hard</p>",img/Handbags/SKU785456.jpg,,Size#,70.49,,,,1,1,,,Handbags,,Brenice Women National Style Flower Decoration Handbag PU Leather Sling Bag,Brenice Women National Style Flower Decoration Handbag PU Leather Sling Bag,Brenice Women National Style Flower Decoration Handbag PU Leather Sling Bag,,,,,,,,,
THJFOBY0053,SOCOFY Folkways Pattern Genuine Leather Splicing Jacquard Comfortable Elastic Band Flat Shoes,,"<p>Color:Blue</p><p>Type:Loafers</p><p>Closure Type:Elastic Band</p><p>Heel Type:Flat</p><p>Heel Height:1-3cm In Flat</p><p>Toe Type:Round</p><p>Pattern:Calico, Leaf</p><p>Design Element:Patchwork</p><p>Upper Material:Leather</p><p>Style:Casual, Retro, Classic, Elegant</p><p>Outsole Material:Rubber</p><p>Structure:Slip-On</p><p>Occasion:Daily</p><p>Function:Soft</p><p>Season:Summer, Autumn</p>",img/Flats/SKUC26423.jpg,,Size#US 5:US 6:US 7:US 8:US 9:US 10:US 11:,60.25,,,,1,1,,,Flats,,SOCOFY Folkways Pattern Genuine Leather Splicing Jacquard Comfortable Elastic Band Flat Shoes,SOCOFY Folkways Pattern Genuine Leather Splicing Jacquard Comfortable Elastic Band Flat Shoes,SOCOFY Folkways Pattern Genuine Leather Splicing Jacquard Comfortable Elastic Band Flat Shoes,,,,,,,,,
THJFOBY0054,Women Sweet Casual Clip Toe Comfy Soft Sole Flat Strappy Slippers,,"<p>Color:White</p><p>Heel Type:Flat</p><p>Toe Type:Clip Toe</p><p>Upper Material:PU</p><p>Outsole Material:Rubber</p><p>Occasion:Beach</p><p>Function:Breathable, Soft</p><p>Season:Summer</p>",img/Slippers/SKUF16830.jpg,,Size#US 5:US 6:US 7:US 8:US 9:US 10:US 11:US 12:,59.66,,,,1,1,,,Slippers,,Women Sweet Casual Clip Toe Comfy Soft Sole Flat Strappy Slippers,Women Sweet Casual Clip Toe Comfy Soft Sole Flat Strappy Slippers,Women Sweet Casual Clip Toe Comfy Soft Sole Flat Strappy Slippers,,,,,,,,,
THJFOBY0055,Ditsy Floral Shirred Ruched Bust Dress,,<p><b>Style</b>: Boho</p><p><b>Color</b>: Blue</p><p><b>Pattern Type</b>: Ditsy Floral</p><p><b>Length</b>: Short</p><p><b>Season</b>: Summer</p><p><b>Type</b>: A Line</p><p><b>Details</b>: Frill</p><p><b>Details</b>: Knot</p><p><b>Details</b>: Shirred</p><p><b>Sleeve Length</b>: Sleeveless</p><p><b>Waist Line</b>: High Waist</p><p><b>Fit Type</b>: Regular Fit</p><p><b>Neckline</b>: Scoop Neck</p><p><b>Sheer</b>: No</p><p><b>Hem Shaped</b>: Flounce</p><p><b>Material</b>: Polyester</p><p><b>Composition</b>: 100% Polyester</p><p><b>Fabric</b>: Non-Stretch</p><p><b>Care Instructions</b>: Machine wash or professional dry clean</p>,img/Dresses/rwdress25210524997.jpg,,Size#S:M:L:,24.02,,,,1,1,,,Dresses,,Ditsy Floral Shirred Ruched Bust Dress,Ditsy Floral Shirred Ruched Bust Dress,Ditsy Floral Shirred Ruched Bust Dress,,,,,,,,,
THJFOBY0056,Cartoon Figure Graphic Tee,,<p><b>Style</b>: Casual</p><p><b>Color</b>: Baby Pink</p><p><b>Pattern Type</b>: Figure</p><p><b>Length</b>: Regular</p><p><b>Season</b>: Summer</p><p><b>Neckline</b>: Round Neck</p><p><b>Sleeve Length</b>: Short Sleeve</p><p><b>Fit Type</b>: Regular Fit</p><p><b>Sleeve Type</b>: Regular Sleeve</p><p><b>Placket Type</b>: Pullovers</p><p><b>Sheer</b>: No</p><p><b>Material</b>: Cotton</p><p><b>Composition</b>: 100% Cotton</p><p><b>Fabric</b>: Slight Stretch</p><p><b>Care Instructions</b>: Machine wash or professional dry clean</p>,img/T___Shirts/rw2106281580972009.jpg,,Size#S:M:L:XL:XXL:,32.53,,,,1,1,,,T-Shirts,,Cartoon Figure Graphic Tee,Cartoon Figure Graphic Tee,Cartoon Figure Graphic Tee,,,,,,,,,
THJFOBY0057,Floral & Figure Print Shorts,,<p><b>Style</b>: Boho</p><p><b>Color</b>: Multicolor</p><p><b>Pattern Type</b>: All Over Print</p><p><b>Type</b>: Straight Leg</p><p><b>Season</b>: Summer</p><p><b>Waist Line</b>: High Waist</p><p><b>Fit Type</b>: Regular Fit</p><p><b>Sheer</b>: No</p><p><b>Closure Type</b>: Elastic Waist</p><p><b>Material</b>: Polyester</p><p><b>Composition</b>: 95% Polyester</p><p><b>Composition</b>: 5% Elastane</p><p><b>Fabric</b>: Non-Stretch</p><p><b>Care Instructions</b>: Machine wash or professional dry clean</p>,img/Shorts/swshorts25210510021.jpg,,Size#XS:S:M:L:,32.25,,,,1,1,,,Shorts,,Floral & Figure Print Shorts,Floral & Figure Print Shorts,Floral & Figure Print Shorts,,,,,,,,,
THJFOBY0058,Marble Print Lettuce Trim Crop Mesh Top,,<p><b>Style</b>: Casual</p><p><b>Color</b>: Multicolor</p><p><b>Pattern Type</b>: Marble</p><p><b>Length</b>: Crop</p><p><b>Season</b>: Spring/Summer</p><p><b>Details</b>: Lettuce Trim</p><p><b>Sleeve Length</b>: Long Sleeve</p><p><b>Fit Type</b>: Slim Fit</p><p><b>Neckline</b>: Stand Collar</p><p><b>Sleeve Type</b>: Regular Sleeve</p><p><b>Placket Type</b>: Pullovers</p><p><b>Sheer</b>: Yes</p><p><b>Material</b>: Mesh</p><p><b>Composition</b>: 100% Polyester</p><p><b>Fabric</b>: Slight Stretch</p><p><b>Care Instructions</b>: Machine wash or professional dry clean</p>,img/Women_Tops/swtop07210615638.jpg,,Size#Petite XXS:Petite XS:Petite S:Petite M:Petite L:,26.38,,,,1,1,,,Women Tops,,Marble Print Lettuce Trim Crop Mesh Top,Marble Print Lettuce Trim Crop Mesh Top,Marble Print Lettuce Trim Crop Mesh Top,,,,,,,,,
THJFOBY0059,Poker Design Chain Necklace,,<p><b>Material</b>: Alloy</p><p><b>Type</b>: Chain Necklaces</p><p><b>Color</b>: Silver</p><p><b>Metal Color</b>: Silver</p><p><b>Style</b>: Casual</p><p><b>Type</b>: Pendant Necklaces</p><p><b>Material</b>: Alloy</p><p><b>Color</b>: Silver</p><p><b>Metal Color</b>: Silver</p><p><b>Style</b>: Casual</p>,img/Pendant_Necklaces/rwneck03201230028.jpg,,Size#,12.05,,,,1,1,,,Pendant Necklaces,,Poker Design Chain Necklace,Poker Design Chain Necklace,Poker Design Chain Necklace,,,,,,,,,
THJFOBY0060,Vintage Drop-Shaped Women Earrings Colored Glass Chalcedony Pendant Earrings,,"<p>Style: Vintage </p><p>Type: Earrings</p><p>Color: Ancient Silver</p><p>Weight: 7g</p><p>Size: About 3.8*2.1 cm / 1.50*0.83''</p><p>Material: 925 Silver Plated, Glass</p><p>1 x Earrings</p>",img/Earrings/SKUG15302.jpg,,Size#,20.63,,,,1,1,,,Earrings,,Vintage Drop-Shaped Women Earrings Colored Glass Chalcedony Pendant Earrings,Vintage Drop-Shaped Women Earrings Colored Glass Chalcedony Pendant Earrings,Vintage Drop-Shaped Women Earrings Colored Glass Chalcedony Pendant Earrings,,,,,,,,,
THJFOBY0061,Women Multi-pocket Waterproof Hardware Crossbody Bag Shoulder Bag Handbag Tote,,"<p>Bag Type:Tote</p><p>Color:Blue, Coffee, Black, Brown, Pink, Grey, Beige, Purple, Red</p><p>Material:PU, Faux Fur</p><p>Style:Casual</p><p>Pattern:Solid</p><p>Decoration:Hardware</p><p>Capacity:4A Magazine, 13.3 Inch Laptop</p><p>Hardness:Soft</p>",img/Handbags/SKUG16591.jpg,,Size#,73.6,,,,1,1,,,Handbags,,Women Multi-pocket Waterproof Hardware Crossbody Bag Shoulder Bag Handbag Tote,Women Multi-pocket Waterproof Hardware Crossbody Bag Shoulder Bag Handbag Tote,Women Multi-pocket Waterproof Hardware Crossbody Bag Shoulder Bag Handbag Tote,,,,,,,,,
THJFOBY0062,Women Casual Soft Breathable Stitching Round Toe Hook Loop Loafers Shoes,,"<p>Color:Red, Beige, Black, White, Blue, Grey</p><p>Type:Loafers</p><p>Closure Type:Hook & Loop</p><p>Heel Type:Flat</p><p>Heel Height:1-3cm In Flat</p><p>Toe Type:Round</p><p>Pattern:Other, Solid</p><p>Design Element:Hollow out, Stitching</p><p>Upper Material:PU</p><p>Style:Casual, Brief</p><p>Outsole Material:Rubber</p><p>Structure:Hook & Loop</p><p>Occasion:Outdoor, Casual</p><p>Function:Breathable, Antiskid, Soft, Hard-wearing</p><p>Season:Summer, Spring</p>",img/Flats/SKUG89490.jpg,,Size#US 5:US 6:US 7:US 8:US 9:US 10:US 11:,61.25,,,,1,1,,,Flats,,Women Casual Soft Breathable Stitching Round Toe Hook Loop Loafers Shoes,Women Casual Soft Breathable Stitching Round Toe Hook Loop Loafers Shoes,Women Casual Soft Breathable Stitching Round Toe Hook Loop Loafers Shoes,,,,,,,,,
THJFOBY0063,Women Home Non Slip Comfy Leaky Hollow Out Massage Bathroom Slippers,,"<p>Color:Green, Yellow, Black, Pink, Blue</p><p>Closure Type:Slip-On</p><p>Heel Type:Flat</p><p>Heel Height:1-3cm In Flat</p><p>Toe Type:Opened</p><p>Pattern:Solid</p><p>Design Element:Hollow out</p><p>Upper Material:PVC</p><p>Style:Casual</p><p>Outsole Material:PVC</p><p>Structure:Slip-On</p><p>Occasion:Home, Casual</p><p>Decoration:Hollow Out</p><p>Function:Breathable, Hard-wearing</p><p>Season:Summer</p>",img/Slippers/SKUH40964.jpg,,Size#US 5:US 6:US 7:US 8:US 9:US 10:,61.8,,,,1,1,,,Slippers,,Women Home Non Slip Comfy Leaky Hollow Out Massage Bathroom Slippers,Women Home Non Slip Comfy Leaky Hollow Out Massage Bathroom Slippers,Women Home Non Slip Comfy Leaky Hollow Out Massage Bathroom Slippers,,,,,,,,,
THJFOBY0064,Ditsy Floral Ruffle Belted Dress,,<p><b>Style</b>: Boho</p><p><b>Color</b>: Dusty Pink</p><p><b>Pattern Type</b>: Ditsy Floral</p><p><b>Length</b>: Mini</p><p><b>Season</b>: Summer</p><p><b>Type</b>: Cami</p><p><b>Details</b>: Ruffle</p><p><b>Details</b>: Wrap</p><p><b>Details</b>: Belted</p><p><b>Sleeve Length</b>: Sleeveless</p><p><b>Neckline</b>: Spaghetti Strap</p><p><b>Waist Line</b>: High Waist</p><p><b>Fit Type</b>: Regular Fit</p><p><b>Sheer</b>: No</p><p><b>Hem Shaped</b>: Flared</p><p><b>Material</b>: Cotton</p><p><b>Composition</b>: 65% Cotton</p><p><b>Composition</b>: 35% Polyester</p><p><b>Fabric</b>: Non-Stretch</p><p><b>Care Instructions</b>: Machine wash or professional dry clean</p>,img/Dresses/rw2106211639568452.jpg,,Size#S:M:L:,24.52,,,,1,1,,,Dresses,,Ditsy Floral Ruffle Belted Dress,Ditsy Floral Ruffle Belted Dress,Ditsy Floral Ruffle Belted Dress,,,,,,,,,
THJFOBY0065,Solid Lace Up Tee,,<p><b>Style</b>: Casual</p><p><b>Color</b>: White</p><p><b>Pattern Type</b>: Plain</p><p><b>Length</b>: Crop</p><p><b>Season</b>: Spring/Fall</p><p><b>Details</b>: Criss Cross</p><p><b>Details</b>: Rib-Knit</p><p><b>Sleeve Length</b>: Long Sleeve</p><p><b>Neckline</b>: Round Neck</p><p><b>Fit Type</b>: Slim Fit</p><p><b>Sleeve Type</b>: Regular Sleeve</p><p><b>Placket Type</b>: Pullovers</p><p><b>Sheer</b>: No</p><p><b>Material</b>: Polyester</p><p><b>Composition</b>: 80% Polyester</p><p><b>Composition</b>: 20% Cotton</p><p><b>Fabric</b>: High Stretch</p><p><b>Care Instructions</b>: Machine wash or professional dry clean</p>,img/T___Shirts/rwtee25210616909.jpg,,Size#S:M:L:XL:,31.38,,,,1,1,,,T-Shirts,,Solid Lace Up Tee,Solid Lace Up Tee,Solid Lace Up Tee,,,,,,,,,
THJFOBY0066,Contrast Binding Track Shorts,,<p><b>Style</b>: Casual</p><p><b>Color</b>: Khaki</p><p><b>Type</b>: Track Shorts</p><p><b>Season</b>: Spring/Summer/Fall</p><p><b>Details</b>: Contrast Binding</p><p><b>Waist Line</b>: Natural</p><p><b>Fit Type</b>: Regular Fit</p><p><b>Sheer</b>: No</p><p><b>Closure Type</b>: Elastic Waist</p><p><b>Material</b>: Fleece</p><p><b>Composition</b>: 100% Polyester</p><p><b>Fabric</b>: Slight Stretch</p><p><b>Care Instructions</b>: Machine wash or professional dry clean</p>,img/Shorts/rw2106221718639440.jpg,,Size#S:M:L:,25.6,,,,1,1,,,Shorts,,Contrast Binding Track Shorts,Contrast Binding Track Shorts,Contrast Binding Track Shorts,,,,,,,,,
THJFOBY0067,Self Tie Flounce Sleeve Crop Top,,<p><b>Style</b>: Casual</p><p><b>Color</b>: Black</p><p><b>Pattern Type</b>: Plain</p><p><b>Length</b>: Crop</p><p><b>Season</b>: Spring/Summer</p><p><b>Details</b>: Ruched</p><p><b>Details</b>: Tie Back</p><p><b>Sleeve Type</b>: Flounce Sleeve</p><p><b>Sleeve Length</b>: Long Sleeve</p><p><b>Neckline</b>: Off the Shoulder</p><p><b>Fit Type</b>: Regular Fit</p><p><b>Placket Type</b>: Pullovers</p><p><b>Sheer</b>: No</p><p><b>Material</b>: Polyester</p><p><b>Composition</b>: 100% Polyester</p><p><b>Fabric</b>: Non-Stretch</p><p><b>Care Instructions</b>: Machine wash or professional dry clean</p>,img/Women_Tops/rwtop03200907645.jpg,,Size#S:M:L:,32.71,,,,1,1,,,Women Tops,,Self Tie Flounce Sleeve Crop Top,Self Tie Flounce Sleeve Crop Top,Self Tie Flounce Sleeve Crop Top,,,,,,,,,
