v_sku,v_name,v_short_description,v_description,v_image,v_url,v_attribute,v_price,v_specials_price,v_specials_expire_date,v_date_added,v_in_stock,v_status,v_viewed,v_ordered,v_category_sku,v_sort_order,v_meta_title,v_meta_keywords,v_meta_description,v_brand_filter,v_class_filter,v_color_filter,v_gender_filter,v_material_filter,v_year_filter,v_origin_filter,v_series_filter,v_spec_filter
THJFOBY0136,Gingham Cami Dress,,<p><b>Style</b>: Boho</p><p><b>Color</b>: Orange</p><p><b>Pattern Type</b>: Gingham</p><p><b>Length</b>: Maxi</p><p><b>Season</b>: Summer</p><p><b>Type</b>: Cami</p><p><b>Details</b>: Ruffle Hem</p><p><b>Sleeve Length</b>: Sleeveless</p><p><b>Neckline</b>: Spaghetti Strap</p><p><b>Waist Line</b>: High Waist</p><p><b>Fit Type</b>: Regular Fit</p><p><b>Sheer</b>: No</p><p><b>Hem Shaped</b>: Flounce</p><p><b>Material</b>: Cotton</p><p><b>Composition</b>: 100% Cotton</p><p><b>Fabric</b>: Non-Stretch</p><p><b>Care Instructions</b>: Machine wash or professional dry clean</p>,img/Dresses/swdress07210605373.jpg,,Size#XS:S:M:L:XL:,31.07,,,,1,1,,,Dresses,,Gingham Cami Dress,Gingham Cami Dress,Gingham Cami Dress,,,,,,,,,
THJFOBY0137,Cartoon Figure Graphic Crop Tee,,<p><b>Style</b>: Casual</p><p><b>Color</b>: Black</p><p><b>Pattern Type</b>: Figure</p><p><b>Length</b>: Crop</p><p><b>Season</b>: Summer</p><p><b>Neckline</b>: Round Neck</p><p><b>Sleeve Length</b>: Short Sleeve</p><p><b>Fit Type</b>: Regular Fit</p><p><b>Sleeve Type</b>: Regular Sleeve</p><p><b>Placket Type</b>: Pullovers</p><p><b>Sheer</b>: No</p><p><b>Material</b>: Polyester</p><p><b>Composition</b>: 80% Polyester</p><p><b>Composition</b>: 15% Cotton</p><p><b>Composition</b>: 5% Elastane</p><p><b>Fabric</b>: Slight Stretch</p><p><b>Care Instructions</b>: Machine wash or professional dry clean</p>,img/T___Shirts/rwtee25210616430.jpg,,Size#S:M:L:,26.4,,,,1,1,,,T-Shirts,,Cartoon Figure Graphic Crop Tee,Cartoon Figure Graphic Crop Tee,Cartoon Figure Graphic Crop Tee,,,,,,,,,
THJFOBY0138,Paisley Print Drawstring Front Shorts,,<p><b>Style</b>: Casual</p><p><b>Color</b>: Coffee Brown</p><p><b>Pattern Type</b>: Paisley</p><p><b>Season</b>: Summer</p><p><b>Type</b>: Biker Shorts</p><p><b>Details</b>: Drawstring</p><p><b>Waist Line</b>: High Waist</p><p><b>Fit Type</b>: Skinny</p><p><b>Sheer</b>: No</p><p><b>Closure Type</b>: Elastic Waist</p><p><b>Material</b>: Polyester</p><p><b>Composition</b>: 91% Polyester</p><p><b>Composition</b>: 9% Elastane</p><p><b>Fabric</b>: High Stretch</p><p><b>Care Instructions</b>: Machine wash or professional dry clean</p>,img/Shorts/swshorts44210414004.jpg,,Size#XS:S:M:L:,30.14,,,,1,1,,,Shorts,,Paisley Print Drawstring Front Shorts,Paisley Print Drawstring Front Shorts,Paisley Print Drawstring Front Shorts,,,,,,,,,
THJFOBY0139,Solid One Shoulder Top,,<p><b>Style</b>: Sexy</p><p><b>Color</b>: Black</p><p><b>Pattern Type</b>: Plain</p><p><b>Length</b>: Crop</p><p><b>Season</b>: Summer</p><p><b>Details</b>: Cut Out</p><p><b>Details</b>: Rib-Knit</p><p><b>Neckline</b>: One Shoulder</p><p><b>Sleeve Length</b>: Sleeveless</p><p><b>Fit Type</b>: Slim Fit</p><p><b>Placket Type</b>: Pullovers</p><p><b>Sheer</b>: No</p><p><b>Material</b>: Polyester</p><p><b>Composition</b>: 95% Polyester</p><p><b>Composition</b>: 5% Elastane</p><p><b>Fabric</b>: High Stretch</p><p><b>Care Instructions</b>: Machine wash or professional dry clean</p>,img/Women_Tops/sW210531348895144.jpg,,Size#S:M:L:,24.47,,,,1,1,,,Women Tops,,Solid One Shoulder Top,Solid One Shoulder Top,Solid One Shoulder Top,,,,,,,,,
THJFOBY0140,1pc Eagle & Sky Pattern Ball Pendant Necklace,,<p><b>Composition</b>: 80% Glass</p><p><b>Composition</b>: 20% Alloy</p><p><b>Type</b>: Pendant Necklaces</p><p><b>Material</b>: Resin</p><p><b>Color</b>: Silver</p><p><b>Metal Color</b>: Silver</p><p><b>Style</b>: Casual</p>,img/Pendant_Necklaces/swneck18191231103.jpg,,Size#,24.3,,,,1,1,,,Pendant Necklaces,,1pc Eagle & Sky Pattern Ball Pendant Necklace,1pc Eagle & Sky Pattern Ball Pendant Necklace,1pc Eagle & Sky Pattern Ball Pendant Necklace,,,,,,,,,
THJFOBY0141,Trendy Cartilage Earrings Simple Style Punk No Piercing Ear Clip Earrings for Women Men,,"<p>Style: Trendy</p><p>Type: Ear Clip</p><p>Weight: About 4.2g</p><p>Material: Zinc Alloy</p><p>Size: About 1.4cm x 0.4cm / 0.55' x 0.16'</p><p>Color: Steel Color, Black, Gold, Colorful, Blue</p><p>1 Pair of Earrings</p>",img/Earrings/SKU948452.jpg,,Size#,26.98,,,,1,1,,,Earrings,,Trendy Cartilage Earrings Simple Style Punk No Piercing Ear Clip Earrings for Women Men,Trendy Cartilage Earrings Simple Style Punk No Piercing Ear Clip Earrings for Women Men,Trendy Cartilage Earrings Simple Style Punk No Piercing Ear Clip Earrings for Women Men,,,,,,,,,
THJFOBY0142,Women Faux Leather Three-piece Set Handbag Shoulder Bag Clutch Bag,,"<p>Bag Type:Bag Set</p><p>Color:Black, Brown, Grey, Red</p><p>Material:PU</p><p>Style:Vintage</p><p>Hardness:Soft, Hard</p>",img/Handbags/SKUA52892.jpg,,Size#,70.02,,,,1,1,,,Handbags,,Women Faux Leather Three-piece Set Handbag Shoulder Bag Clutch Bag,Women Faux Leather Three-piece Set Handbag Shoulder Bag Clutch Bag,Women Faux Leather Three-piece Set Handbag Shoulder Bag Clutch Bag,,,,,,,,,
THJFOBY0143,Women Casual Print Leopard Pattern Square Toe Canvas Loafers Shoes,,"<p>Color:Green, Light Green</p><p>Type:Loafers</p><p>Closure Type:Elastic Band</p><p>Heel Type:Flat</p><p>Heel Height:1-3cm In Flat</p><p>Toe Type:Square</p><p>Pattern:Animal-print, Leopard, Plants</p><p>Design Element:Pattern, Print</p><p>Upper Material:Canvas</p><p>Style:Casual</p><p>Outsole Material:Rubber</p><p>Structure:Elastic Band</p><p>Occasion:Casual</p><p>Function:Antiskid, Hard-wearing</p><p>Season:All Season</p>",img/Flats/SKUG98102.jpg,,Size#US 5:US 6:US 8:US 9:US 10:US 11:US 12:,62.35,,,,1,1,,,Flats,,Women Casual Print Leopard Pattern Square Toe Canvas Loafers Shoes,Women Casual Print Leopard Pattern Square Toe Canvas Loafers Shoes,Women Casual Print Leopard Pattern Square Toe Canvas Loafers Shoes,,,,,,,,,
THJFOBY0144,Plus Size Color Splicing Bow Round Toe Flat Summer Slippers For Women,,"<p>Color:Red, Yellow, Golden</p><p>Type:Slides Slipper</p><p>Closure Type:Slip-On</p><p>Heel Type:Flat</p><p>Heel Height:1-3cm In Flat</p><p>Toe Type:Round</p><p>Pattern:Other</p><p>Design Element:Splice, Bowknot</p><p>Upper Material:PU</p><p>Style:Casual</p><p>Outsole Material:Rubber</p><p>Structure:Slip-On</p><p>Occasion:Casual</p><p>Decoration:Bowknot</p><p>Function:Antiskid, Light Weight</p><p>Season:Summer</p>",img/Slippers/SKUH61843.jpg,,Size#US 5:US 6:US 7:US 8:US 9:US 10:US 11:US 12:,55.38,,,,1,1,,,Slippers,,Plus Size Color Splicing Bow Round Toe Flat Summer Slippers For Women,Plus Size Color Splicing Bow Round Toe Flat Summer Slippers For Women,Plus Size Color Splicing Bow Round Toe Flat Summer Slippers For Women,,,,,,,,,
THJFOBY0145,Solid Ring Decor Ruched Dress,,<p><b>Style</b>: Sexy</p><p><b>Color</b>: Cadet Blue</p><p><b>Pattern Type</b>: Plain</p><p><b>Length</b>: Mini</p><p><b>Season</b>: Summer</p><p><b>Type</b>: Bodycon</p><p><b>Details</b>: Ruched</p><p><b>Details</b>: Drawstring</p><p><b>Details</b>: Rib-Knit</p><p><b>Sleeve Length</b>: Sleeveless</p><p><b>Neckline</b>: Spaghetti Strap</p><p><b>Waist Line</b>: Natural</p><p><b>Fit Type</b>: Slim Fit</p><p><b>Sheer</b>: No</p><p><b>Hem Shaped</b>: Pencil</p><p><b>Material</b>: Polyester</p><p><b>Composition</b>: 65% Polyester</p><p><b>Composition</b>: 30% Cotton</p><p><b>Composition</b>: 5% Elastane</p><p><b>Fabric</b>: Slight Stretch</p><p><b>Care Instructions</b>: Machine wash or professional dry clean</p>,img/Dresses/rwdress25210610937.jpg,,Size#S:M:L:,28.86,,,,1,1,,,Dresses,,Solid Ring Decor Ruched Dress,Solid Ring Decor Ruched Dress,Solid Ring Decor Ruched Dress,,,,,,,,,
THJFOBY0146,Cartoon Graphic Crop Tee,,<p><b>Style</b>: Casual</p><p><b>Color</b>: Baby Pink</p><p><b>Pattern Type</b>: Cartoon</p><p><b>Length</b>: Crop</p><p><b>Season</b>: Summer</p><p><b>Neckline</b>: Round Neck</p><p><b>Sleeve Length</b>: Short Sleeve</p><p><b>Fit Type</b>: Slim Fit</p><p><b>Sleeve Type</b>: Regular Sleeve</p><p><b>Placket Type</b>: Pullovers</p><p><b>Sheer</b>: No</p><p><b>Material</b>: Cotton</p><p><b>Composition</b>: 65% Cotton</p><p><b>Composition</b>: 35% Polyester</p><p><b>Fabric</b>: Slight Stretch</p><p><b>Care Instructions</b>: Machine wash or professional dry clean</p>,img/T___Shirts/rw2106285356958905.jpg,,Size#XS:S:M:L:,28.77,,,,1,1,,,T-Shirts,,Cartoon Graphic Crop Tee,Cartoon Graphic Crop Tee,Cartoon Graphic Crop Tee,,,,,,,,,
THJFOBY0147,Shirred Waist Schiffy Shorts,,<p><b>Style</b>: Boho</p><p><b>Color</b>: Beige</p><p><b>Pattern Type</b>: Plain</p><p><b>Type</b>: Straight Leg</p><p><b>Season</b>: Summer</p><p><b>Details</b>: Frill</p><p><b>Details</b>: Eyelet Embroidery</p><p><b>Waist Line</b>: High Waist</p><p><b>Fit Type</b>: Regular Fit</p><p><b>Sheer</b>: No</p><p><b>Closure Type</b>: Elastic Waist</p><p><b>Material</b>: Schiffy</p><p><b>Composition</b>: 100% Cotton</p><p><b>Fabric</b>: Non-Stretch</p><p><b>Care Instructions</b>: Machine wash or professional dry clean</p>,img/Shorts/swshorts07210603960.jpg,,Size#XS:S:M:L:XL:,29.96,,,,1,1,,,Shorts,,Shirred Waist Schiffy Shorts,Shirred Waist Schiffy Shorts,Shirred Waist Schiffy Shorts,,,,,,,,,
THJFOBY0148,Ruched Front Crop Top,,<p><b>Style</b>: Casual</p><p><b>Color</b>: Black</p><p><b>Pattern Type</b>: Plain</p><p><b>Length</b>: Crop</p><p><b>Season</b>: Summer</p><p><b>Details</b>: Frill</p><p><b>Details</b>: Ruched</p><p><b>Sleeve Type</b>: Puff Sleeve</p><p><b>Sleeve Length</b>: Short Sleeve</p><p><b>Fit Type</b>: Slim Fit</p><p><b>Neckline</b>: Sweetheart</p><p><b>Placket Type</b>: Pullovers</p><p><b>Sheer</b>: No</p><p><b>Material</b>: Cotton</p><p><b>Composition</b>: 65% Cotton</p><p><b>Composition</b>: 35% Polyester</p><p><b>Fabric</b>: Slight Stretch</p><p><b>Care Instructions</b>: Machine wash or professional dry clean</p>,img/Women_Tops/rwtop03210125250.jpg,,Size#XS:S:M:L:,23.0,,,,1,1,,,Women Tops,,Ruched Front Crop Top,Ruched Front Crop Top,Ruched Front Crop Top,,,,,,,,,
THJFOBY0149,Beaded Flower Charm Necklace,,<p><b>Details</b>: Flowers</p><p><b>Type</b>: Pendant Necklaces</p><p><b>Material</b>: Iron</p><p><b>Color</b>: Purple</p><p><b>Metal Color</b>: Gold</p><p><b>Style</b>: Boho</p>,img/Pendant_Necklaces/swneck18200721087.jpg,,Size#,15.57,,,,1,1,,,Pendant Necklaces,,Beaded Flower Charm Necklace,Beaded Flower Charm Necklace,Beaded Flower Charm Necklace,,,,,,,,,
THJFOBY0150,Bohemian Goddess Moon Sun Earrings Gold Rhinestone Ear Drop For Women,,"<p>Style:Bohemian</p><p>Type:Earrings</p><p>Main Color:Gold </p><p>Weight: about 20g</p><p>Material:Zinc Alloy,Rhinestone</p><p>1 Pair of Earrings</p>",img/Earrings/SKUC00940.jpg,,Size#,25.22,,,,1,1,,,Earrings,,Bohemian Goddess Moon Sun Earrings Gold Rhinestone Ear Drop For Women,Bohemian Goddess Moon Sun Earrings Gold Rhinestone Ear Drop For Women,Bohemian Goddess Moon Sun Earrings Gold Rhinestone Ear Drop For Women,,,,,,,,,
THJFOBY0151,Women Print Multifunction Multi-Layers Earphone Hole Crossbody Bag HandBag,,<p>Bag Type:Satchel</p><p>Color:Multicolor</p><p>Style:Casual</p><p>Hardness:Soft</p>,img/Handbags/SKUG31625.jpg,,Size#,73.32,,,,1,1,,,Handbags,,Women Print Multifunction Multi-Layers Earphone Hole Crossbody Bag HandBag,Women Print Multifunction Multi-Layers Earphone Hole Crossbody Bag HandBag,Women Print Multifunction Multi-Layers Earphone Hole Crossbody Bag HandBag,,,,,,,,,
THJFOBY0152,Women Casual Sequined Bow Single Shoes Cute Square-toe Ballet Flats,,"<p>Color:Green, Black, Pink</p><p>Type:Ballet Flat</p><p>Closure Type:Slip-On</p><p>Heel Type:Flat</p><p>Heel Height:1-3cm In Flat</p><p>Toe Type:Square</p><p>Pattern:Other</p><p>Design Element:Sequined, Bowknot</p><p>Upper Material:PU</p><p>Style:Casual, Sweet/Cute</p><p>Outsole Material:Rubber</p><p>Structure:Slip-On</p><p>Occasion:Date, Casual, Daily</p><p>Function:Soft, Hard-wearing</p><p>Season:Summer, Autumn, Spring</p>",img/Flats/SKUI11407.jpg,,Size#US 5:US 6:US 7:US 8:,56.06,,,,1,1,,,Flats,,Women Casual Sequined Bow Single Shoes Cute Square-toe Ballet Flats,Women Casual Sequined Bow Single Shoes Cute Square-toe Ballet Flats,Women Casual Sequined Bow Single Shoes Cute Square-toe Ballet Flats,,,,,,,,,
THJFOBY0153,Soft Furry Sole Shoes Non-slip For Women Home Outdoor Slippers Flip Flops,,"<p>Color:Tan, Red, Yellow, Black, Pink, Blue, Grey</p><p>Heel Type:Flat</p><p>Toe Type:Clip Toe</p><p>Outsole Material:Rubber</p><p>Occasion:Home</p><p>Function:Soft</p><p>Season:Summer</p>",img/Slippers/SKUF69195.jpg,,Size#US 5:US 6:US 7:US 8:US 9:US 10:US 11:US 12:US 13:,55.33,,,,1,1,,,Slippers,,Soft Furry Sole Shoes Non-slip For Women Home Outdoor Slippers Flip Flops,Soft Furry Sole Shoes Non-slip For Women Home Outdoor Slippers Flip Flops,Soft Furry Sole Shoes Non-slip For Women Home Outdoor Slippers Flip Flops,,,,,,,,,
THJFOBY0154,Ditsy Floral Cold Shoulder Dress,,<p><b>Style</b>: Boho</p><p><b>Color</b>: Black</p><p><b>Pattern Type</b>: Ditsy Floral</p><p><b>Length</b>: Short</p><p><b>Season</b>: Summer</p><p><b>Type</b>: A Line</p><p><b>Sleeve Length</b>: Short Sleeve</p><p><b>Neckline</b>: Spaghetti Strap</p><p><b>Waist Line</b>: Natural</p><p><b>Fit Type</b>: Regular Fit</p><p><b>Sheer</b>: No</p><p><b>Hem Shaped</b>: Flared</p><p><b>Material</b>: Cotton Blends</p><p><b>Composition</b>: 65% Cotton</p><p><b>Composition</b>: 35% Polyester</p><p><b>Fabric</b>: Non-Stretch</p><p><b>Care Instructions</b>: Machine wash or professional dry clean</p>,img/Dresses/rwdress25210608549.jpg,,Size#S:M:L:,31.46,,,,1,1,,,Dresses,,Ditsy Floral Cold Shoulder Dress,Ditsy Floral Cold Shoulder Dress,Ditsy Floral Cold Shoulder Dress,,,,,,,,,
THJFOBY0155,Letter Graphic Oversized Tee,,<p><b>Style</b>: Casual</p><p><b>Color</b>: Black</p><p><b>Pattern Type</b>: Letter</p><p><b>Pattern Type</b>: Graphic</p><p><b>Length</b>: Long</p><p><b>Season</b>: Summer</p><p><b>Neckline</b>: Round Neck</p><p><b>Sleeve Length</b>: Short Sleeve</p><p><b>Fit Type</b>: Oversized</p><p><b>Sleeve Type</b>: Drop Shoulder</p><p><b>Placket Type</b>: Pullovers</p><p><b>Sheer</b>: No</p><p><b>Material</b>: Polyester</p><p><b>Composition</b>: 62.3% Polyester</p><p><b>Composition</b>: 34% Cotton</p><p><b>Composition</b>: 3.7% Spandex</p><p><b>Fabric</b>: Slight Stretch</p><p><b>Care Instructions</b>: Machine wash or professional dry clean</p>,img/T___Shirts/rwtee25210331864.jpg,,Size#S:M:L:,25.86,,,,1,1,,,T-Shirts,,Letter Graphic Oversized Tee,Letter Graphic Oversized Tee,Letter Graphic Oversized Tee,,,,,,,,,
THJFOBY0156,Colorblock Fire Print Shorts,,<p><b>Style</b>: Casual</p><p><b>Color</b>: Multicolor</p><p><b>Pattern Type</b>: Colorblock</p><p><b>Pattern Type</b>: Fire</p><p><b>Season</b>: Summer</p><p><b>Type</b>: Track Shorts</p><p><b>Waist Line</b>: Natural</p><p><b>Fit Type</b>: Regular Fit</p><p><b>Sheer</b>: No</p><p><b>Closure Type</b>: Elastic Waist</p><p><b>Material</b>: Cotton Blends</p><p><b>Composition</b>: 65% Cotton</p><p><b>Composition</b>: 35% Polyester</p><p><b>Fabric</b>: Slight Stretch</p><p><b>Care Instructions</b>: Machine wash or professional dry clean</p>,img/Shorts/rw2107061954811646.jpg,,Size#S:M:L:,24.95,,,,1,1,,,Shorts,,Colorblock Fire Print Shorts,Colorblock Fire Print Shorts,Colorblock Fire Print Shorts,,,,,,,,,
THJFOBY0157,Eye Graphic Mesh Crop Top,,<p><b>Style</b>: Sexy</p><p><b>Color</b>: Multicolor</p><p><b>Pattern Type</b>: Figure</p><p><b>Length</b>: Crop</p><p><b>Season</b>: Summer</p><p><b>Details</b>: Lettuce Trim</p><p><b>Neckline</b>: Round Neck</p><p><b>Sleeve Length</b>: Short Sleeve</p><p><b>Fit Type</b>: Slim Fit</p><p><b>Sleeve Type</b>: Regular Sleeve</p><p><b>Placket Type</b>: Pullovers</p><p><b>Sheer</b>: Semi-Sheer</p><p><b>Material</b>: Mesh</p><p><b>Composition</b>: 100% Polyester</p><p><b>Fabric</b>: High Stretch</p><p><b>Care Instructions</b>: Machine wash or professional dry clean</p>,img/Women_Tops/sW210617743424322.jpg,,Size#S:M:L:,27.41,,,,1,1,,,Women Tops,,Eye Graphic Mesh Crop Top,Eye Graphic Mesh Crop Top,Eye Graphic Mesh Crop Top,,,,,,,,,
THJFOBY0158,Metal Bar Pendant Link Necklace,,<p><b>Composition</b>: Metal</p><p><b>Type</b>: Pendant Necklaces</p><p><b>Color</b>: Gold</p><p><b>Metal Color</b>: Gold</p><p><b>Style</b>: Casual</p>,img/Pendant_Necklaces/necklaceNC160317305.jpg,,Size#,21.33,,,,1,1,,,Pendant Necklaces,,Metal Bar Pendant Link Necklace,Metal Bar Pendant Link Necklace,Metal Bar Pendant Link Necklace,,,,,,,,,
THJFOBY0159,1 Pair Punk Alien Model Stud Earrings Metal Ear Stud Double Sided Earrings for Women Gift,,"<p>Style: Trendy</p><p>Type: Ear Stud</p><p>Material: Zinc Alloy</p><p>Weight: About 13g</p><p>Main Color: Silver, Black, Gold </p><p>Size: About 4.3cm x 2.5cm / 1.69' x 0.98'</p><p>1 Pairs of Earrings</p>",img/Earrings/SKU830368.jpg,,Size#,15.0,,,,1,1,,,Earrings,,1 Pair Punk Alien Model Stud Earrings Metal Ear Stud Double Sided Earrings for Women Gift,1 Pair Punk Alien Model Stud Earrings Metal Ear Stud Double Sided Earrings for Women Gift,1 Pair Punk Alien Model Stud Earrings Metal Ear Stud Double Sided Earrings for Women Gift,,,,,,,,,
THJFOBY0160,Women Genuine Leather Handbag High End Tote Bag Bucket Bag,,"<p>Bag Type:Tote</p><p>Color:Blue, Black, Red</p><p>Material:PU</p><p>Style:Casual</p><p>Hardness:Soft</p>",img/Handbags/SKU683499.jpg,,Size#,58.33,,,,1,1,,,Handbags,,Women Genuine Leather Handbag High End Tote Bag Bucket Bag,Women Genuine Leather Handbag High End Tote Bag Bucket Bag,Women Genuine Leather Handbag High End Tote Bag Bucket Bag,,,,,,,,,
THJFOBY0161,Women Tassel Decor Slip Resistant Casual Ladies Creepers Brogue Shoes,,"<p>Color:Khaki, Yellow, Pink, Blue, Grey</p><p>Closure Type:Lace-up</p><p>Heel Type:Flat</p><p>Heel Height:1-3cm In Flat</p><p>Toe Type:Round</p><p>Pattern:Color Block</p><p>Design Element:Tassel</p><p>Upper Material:PU</p><p>Style:Casual</p><p>Outsole Material:Rubber</p><p>Function:Hard-wearing</p><p>Season:Summer</p>",img/Flats/SKUF07038.jpg,,Size#US 5:US 6:US 7:US 8:US 9:US 10:US 11:US 12:,50.99,,,,1,1,,,Flats,,Women Tassel Decor Slip Resistant Casual Ladies Creepers Brogue Shoes,Women Tassel Decor Slip Resistant Casual Ladies Creepers Brogue Shoes,Women Tassel Decor Slip Resistant Casual Ladies Creepers Brogue Shoes,,,,,,,,,
THJFOBY0162,Hotmarzz Lovers Casual Beach Slippers Non Slip Sandals,,"<p>Color:Red</p><p>Type:ClipToe Slippers</p><p>Heel Type:Flat</p><p>Heel Height:1-3cm In Flat</p><p>Toe Type:Round</p><p>Pattern:Other</p><p>Design Element:Simple</p><p>Upper Material:PU</p><p>Style:Casual</p><p>Outsole Material:Rubber</p><p>Structure:Clip Toe</p><p>Occasion:Beach</p><p>Function:Breathable, Antiskid</p><p>Season:Summer</p>",img/Slippers/SKU257059.jpg,,Size#US 7:US 8:US 9:US 10:US 11:US 12:US 13:,58.18,,,,1,1,,,Slippers,,Hotmarzz Lovers Casual Beach Slippers Non Slip Sandals,Hotmarzz Lovers Casual Beach Slippers Non Slip Sandals,Hotmarzz Lovers Casual Beach Slippers Non Slip Sandals,,,,,,,,,
THJFOBY0163,Plaid Button Front Dress,,<p><b>Style</b>: Preppy</p><p><b>Color</b>: Multicolor</p><p><b>Pattern Type</b>: Plaid</p><p><b>Length</b>: Mini</p><p><b>Season</b>: Summer</p><p><b>Type</b>: Fitted</p><p><b>Details</b>: Button Front</p><p><b>Sleeve Length</b>: Short Sleeve</p><p><b>Neckline</b>: Lapel</p><p><b>Waist Line</b>: Natural</p><p><b>Fit Type</b>: Regular Fit</p><p><b>Sleeve Type</b>: Regular Sleeve</p><p><b>Sheer</b>: No</p><p><b>Hem Shaped</b>: Straight</p><p><b>Material</b>: Cotton</p><p><b>Composition</b>: 65% Cotton</p><p><b>Composition</b>: 35% Polyester</p><p><b>Fabric</b>: Non-Stretch</p><p><b>Care Instructions</b>: Machine wash or professional dry clean</p>,img/Dresses/rwdress25210607367.jpg,,Size#XS:S:M:L:,28.86,,,,1,1,,,Dresses,,Plaid Button Front Dress,Plaid Button Front Dress,Plaid Button Front Dress,,,,,,,,,
THJFOBY0164,Letter Graphic Drawstring Raglan Sleeve Tee,,<p><b>Style</b>: Casual</p><p><b>Color</b>: Multicolor</p><p><b>Pattern Type</b>: Letter</p><p><b>Pattern Type</b>: Colorblock</p><p><b>Length</b>: Crop</p><p><b>Season</b>: Summer</p><p><b>Details</b>: Drawstring</p><p><b>Details</b>: Ruched</p><p><b>Sleeve Type</b>: Raglan Sleeve</p><p><b>Neckline</b>: Round Neck</p><p><b>Sleeve Length</b>: Short Sleeve</p><p><b>Fit Type</b>: Slim Fit</p><p><b>Placket Type</b>: Pullovers</p><p><b>Sheer</b>: No</p><p><b>Material</b>: Polyester</p><p><b>Composition</b>: 95% Polyester</p><p><b>Composition</b>: 5% Spandex</p><p><b>Fabric</b>: High Stretch</p><p><b>Care Instructions</b>: Machine wash or professional dry clean</p>,img/T___Shirts/sW210607489564633.jpg,,Size#XS:S:M:L:,27.91,,,,1,1,,,T-Shirts,,Letter Graphic Drawstring Raglan Sleeve Tee,Letter Graphic Drawstring Raglan Sleeve Tee,Letter Graphic Drawstring Raglan Sleeve Tee,,,,,,,,,
THJFOBY0165,Letter Embroidery Shorts,,<p><b>Style</b>: Casual</p><p><b>Color</b>: Khaki</p><p><b>Pattern Type</b>: Letter</p><p><b>Season</b>: Summer</p><p><b>Type</b>: Track Shorts</p><p><b>Details</b>: Embroidery</p><p><b>Waist Line</b>: Natural</p><p><b>Fit Type</b>: Regular Fit</p><p><b>Sheer</b>: No</p><p><b>Closure Type</b>: Elastic Waist</p><p><b>Material</b>: Polyester</p><p><b>Composition</b>: 100% Polyester</p><p><b>Fabric</b>: Medium Stretch</p><p><b>Care Instructions</b>: Machine wash or professional dry clean</p>,img/Shorts/rwshorts25210524858.jpg,,Size#S:M:L:,27.51,,,,1,1,,,Shorts,,Letter Embroidery Shorts,Letter Embroidery Shorts,Letter Embroidery Shorts,,,,,,,,,
THJFOBY0166,Floral Embroidery Mesh Crop Tube Top,,<p><b>Style</b>: Sexy</p><p><b>Color</b>: Multicolor</p><p><b>Pattern Type</b>: Floral</p><p><b>Length</b>: Crop</p><p><b>Season</b>: Summer</p><p><b>Details</b>: Embroidery</p><p><b>Sleeve Length</b>: Sleeveless</p><p><b>Fit Type</b>: Slim Fit</p><p><b>Neckline</b>: Strapless</p><p><b>Placket Type</b>: Placket</p><p><b>Sheer</b>: Yes</p><p><b>Material</b>: Schiffy</p><p><b>Composition</b>: 95% Polyester</p><p><b>Composition</b>: 5% Spandex</p><p><b>Fabric</b>: Slight Stretch</p><p><b>Care Instructions</b>: Machine wash or professional dry clean</p><p><b>Style</b>: Sexy</p><p><b>Color</b>: Red and White</p><p><b>Pattern Type</b>: Floral</p><p><b>Length</b>: Crop</p><p><b>Season</b>: Summer</p><p><b>Details</b>: Embroidery</p><p><b>Sleeve Length</b>: Sleeveless</p><p><b>Fit Type</b>: Slim Fit</p><p><b>Neckline</b>: Strapless</p><p><b>Placket Type</b>: Placket</p><p><b>Sheer</b>: Yes</p><p><b>Material</b>: Schiffy</p><p><b>Composition</b>: 95% Polyester</p><p><b>Composition</b>: 5% Spandex</p><p><b>Fabric</b>: Slight Stretch</p><p><b>Care Instructions</b>: Machine wash or professional dry clean</p><p><b>Style</b>: Sexy</p><p><b>Color</b>: Black and White</p><p><b>Pattern Type</b>: Floral</p><p><b>Length</b>: Crop</p><p><b>Season</b>: Summer</p><p><b>Details</b>: Embroidery</p><p><b>Sleeve Length</b>: Sleeveless</p><p><b>Fit Type</b>: Slim Fit</p><p><b>Neckline</b>: Strapless</p><p><b>Placket Type</b>: Placket</p><p><b>Sheer</b>: Yes</p><p><b>Material</b>: Schiffy</p><p><b>Composition</b>: 95% Polyester</p><p><b>Composition</b>: 5% Spandex</p><p><b>Fabric</b>: Slight Stretch</p><p><b>Care Instructions</b>: Machine wash or professional dry clean</p><p><b>Style</b>: Casual</p><p><b>Color</b>: Blue and White</p><p><b>Pattern Type</b>: Floral</p><p><b>Length</b>: Crop</p><p><b>Season</b>: Summer</p><p><b>Details</b>: Embroidery</p><p><b>Sleeve Length</b>: Sleeveless</p><p><b>Fit Type</b>: Slim Fit</p><p><b>Neckline</b>: Strapless</p><p><b>Placket Type</b>: Pullovers</p><p><b>Sheer</b>: Yes</p><p><b>Material</b>: Schiffy</p><p><b>Composition</b>: 95% Polyester</p><p><b>Composition</b>: 5% Spandex</p><p><b>Fabric</b>: Slight Stretch</p><p><b>Care Instructions</b>: Machine wash or professional dry clean</p>,img/Women_Tops/rwtop25210507545.jpg,,Size#S:M:L:,23.83,,,,1,1,,,Women Tops,,Floral Embroidery Mesh Crop Tube Top,Floral Embroidery Mesh Crop Tube Top,Floral Embroidery Mesh Crop Tube Top,,,,,,,,,
THJFOBY0167,Eye Pendant Necklace,,<p><b>Type</b>: Pendant Necklaces</p><p><b>Material</b>: Alloy</p><p><b>Color</b>: Gold</p><p><b>Metal Color</b>: Gold</p><p><b>Style</b>: Casual</p>,img/Pendant_Necklaces/swneck18201026098.jpg,,Size#,13.26,,,,1,1,,,Pendant Necklaces,,Eye Pendant Necklace,Eye Pendant Necklace,Eye Pendant Necklace,,,,,,,,,
THJFOBY0168,3 Pairs/6 Pairs Vintage Bohemian Multiple Types Of Shapes Alloy Earrings Set,,"<p>Style: Vintage,Bohemian </p><p>Type: Earrings Set</p><p>Weight: 50 g</p><p>Size: As the picture shown </p><p>Material: Alloy </p><p>Quantity: 3 Pairs / 6 Pairs </p><p>Package Includes:</p><p>1 x Earrings Set</p><p>Notice:</p>",img/Earrings/SKUH93925.jpg,,Size#,20.92,,,,1,1,,,Earrings,,3 Pairs/6 Pairs Vintage Bohemian Multiple Types Of Shapes Alloy Earrings Set,3 Pairs/6 Pairs Vintage Bohemian Multiple Types Of Shapes Alloy Earrings Set,3 Pairs/6 Pairs Vintage Bohemian Multiple Types Of Shapes Alloy Earrings Set,,,,,,,,,
THJFOBY0169,Women Pumpkin Skull Halloween Large Capacity Neoprene Handbag Shoulder Bag Tote,,<p>Bag Type:Tote</p><p>Color:Multicolor</p><p>Capacity:14 Inch Laptop</p><p>Hardness:Soft</p>,img/Handbags/SKUG30341.jpg,,Size#,69.72,,,,1,1,,,Handbags,,Women Pumpkin Skull Halloween Large Capacity Neoprene Handbag Shoulder Bag Tote,Women Pumpkin Skull Halloween Large Capacity Neoprene Handbag Shoulder Bag Tote,Women Pumpkin Skull Halloween Large Capacity Neoprene Handbag Shoulder Bag Tote,,,,,,,,,
