v_sku,v_name,v_short_description,v_description,v_image,v_url,v_attribute,v_price,v_specials_price,v_specials_expire_date,v_date_added,v_in_stock,v_status,v_viewed,v_ordered,v_category_sku,v_sort_order,v_meta_title,v_meta_keywords,v_meta_description,v_brand_filter,v_class_filter,v_color_filter,v_gender_filter,v_material_filter,v_year_filter,v_origin_filter,v_series_filter,v_spec_filter
THJFOBY0001,Frill Trim Gigot Sleeve Ruched Mesh Overlay Dress,,<p><b>Style</b>: Glamorous</p><p><b>Color</b>: Black</p><p><b>Pattern Type</b>: Plain</p><p><b>Length</b>: Short</p><p><b>Season</b>: Spring/Summer</p><p><b>Type</b>: Bodycon</p><p><b>Details</b>: Sheer</p><p><b>Details</b>: Ruched</p><p><b>Details</b>: Frill</p><p><b>Sleeve Length</b>: Long Sleeve</p><p><b>Sleeve Type</b>: Leg-of-mutton Sleeve</p><p><b>Neckline</b>: Square Neck</p><p><b>Waist Line</b>: Natural</p><p><b>Fit Type</b>: Slim Fit</p><p><b>Sheer</b>: No</p><p><b>Hem Shaped</b>: Pencil</p><p><b>Body</b>: Lined</p><p><b>Material</b>: Mesh</p><p><b>Composition</b>: 95% Polyester</p><p><b>Composition</b>: 5% Spandex</p><p><b>Fabric</b>: Slight Stretch</p><p><b>Care Instructions</b>: Machine wash or professional dry clean</p>,img/Dresses/swdress07190929987.jpg,,Size#XS:S:M:L:XL:,32.23,,,,1,1,,,Dresses,,Frill Trim Gigot Sleeve Ruched Mesh Overlay Dress,Frill Trim Gigot Sleeve Ruched Mesh Overlay Dress,Frill Trim Gigot Sleeve Ruched Mesh Overlay Dress,,,,,,,,,
THJFOBY0002,Graphic Print Tee,,<p><b>Style</b>: Casual</p><p><b>Color</b>: Yellow</p><p><b>Pattern Type</b>: Graphic</p><p><b>Length</b>: Regular</p><p><b>Season</b>: Summer</p><p><b>Neckline</b>: Round Neck</p><p><b>Sleeve Length</b>: Short Sleeve</p><p><b>Fit Type</b>: Regular Fit</p><p><b>Sleeve Type</b>: Regular Sleeve</p><p><b>Placket Type</b>: Pullovers</p><p><b>Sheer</b>: No</p><p><b>Material</b>: Cotton</p><p><b>Composition</b>: 100% Cotton</p><p><b>Fabric</b>: Slight Stretch</p><p><b>Care Instructions</b>: Machine wash or professional dry clean</p><p><b>Style</b>: Casual</p><p><b>Color</b>: Baby Blue</p><p><b>Pattern Type</b>: Graphic</p><p><b>Length</b>: Regular</p><p><b>Season</b>: Summer</p><p><b>Neckline</b>: Round Neck</p><p><b>Sleeve Length</b>: Short Sleeve</p><p><b>Fit Type</b>: Regular Fit</p><p><b>Sleeve Type</b>: Regular Sleeve</p><p><b>Placket Type</b>: Pullovers</p><p><b>Sheer</b>: No</p><p><b>Material</b>: Cotton</p><p><b>Composition</b>: 100% Cotton</p><p><b>Fabric</b>: Slight Stretch</p><p><b>Care Instructions</b>: Machine wash or professional dry clean</p><p><b>Style</b>: Casual</p><p><b>Color</b>: Lilac Purple</p><p><b>Pattern Type</b>: Graphic</p><p><b>Length</b>: Regular</p><p><b>Season</b>: Summer</p><p><b>Neckline</b>: Round Neck</p><p><b>Sleeve Length</b>: Short Sleeve</p><p><b>Fit Type</b>: Regular Fit</p><p><b>Sleeve Type</b>: Regular Sleeve</p><p><b>Placket Type</b>: Pullovers</p><p><b>Sheer</b>: No</p><p><b>Material</b>: Cotton</p><p><b>Composition</b>: 100% Cotton</p><p><b>Fabric</b>: Slight Stretch</p><p><b>Care Instructions</b>: Machine wash or professional dry clean</p><p><b>Style</b>: Casual</p><p><b>Color</b>: White</p><p><b>Pattern Type</b>: Graphic</p><p><b>Length</b>: Regular</p><p><b>Season</b>: Summer</p><p><b>Neckline</b>: Round Neck</p><p><b>Sleeve Length</b>: Short Sleeve</p><p><b>Fit Type</b>: Regular Fit</p><p><b>Sleeve Type</b>: Regular Sleeve</p><p><b>Placket Type</b>: Pullovers</p><p><b>Sheer</b>: No</p><p><b>Material</b>: Cotton</p><p><b>Composition</b>: 100% Cotton</p><p><b>Fabric</b>: Slight Stretch</p><p><b>Care Instructions</b>: Machine wash or professional dry clean</p>,img/T___Shirts/rwtee25210510282.jpg,,Size#S:M:L:XL:,22.57,,,,1,1,,,T-Shirts,,Graphic Print Tee,Graphic Print Tee,Graphic Print Tee,,,,,,,,,
THJFOBY0003,Tied Paperbag Waist Cuffed Shorts,,<p><b>Style</b>: Casual</p><p><b>Color</b>: Grey</p><p><b>Pattern Type</b>: Plain</p><p><b>Season</b>: Summer</p><p><b>Type</b>: Wide Leg</p><p><b>Details</b>: Frill</p><p><b>Details</b>: Knot</p><p><b>Details</b>: Paper Bag Waist</p><p><b>Waist Line</b>: High Waist</p><p><b>Fit Type</b>: Regular Fit</p><p><b>Sheer</b>: No</p><p><b>Closure Type</b>: Elastic Waist</p><p><b>Material</b>: Polyester</p><p><b>Composition</b>: 57% Polyester</p><p><b>Composition</b>: 43% Cotton</p><p><b>Fabric</b>: Non-Stretch</p><p><b>Care Instructions</b>: Machine wash or professional dry clean</p>,img/Shorts/swshorts07200424025.jpg,,Size#XS:S:M:L:,22.99,,,,1,1,,,Shorts,,Tied Paperbag Waist Cuffed Shorts,Tied Paperbag Waist Cuffed Shorts,Tied Paperbag Waist Cuffed Shorts,,,,,,,,,
THJFOBY0004,Solid Frill Crop Bardot Top,,<p><b>Style</b>: Boho</p><p><b>Color</b>: Khaki</p><p><b>Pattern Type</b>: Plain</p><p><b>Length</b>: Crop</p><p><b>Season</b>: Summer</p><p><b>Details</b>: Frill</p><p><b>Sleeve Type</b>: Flounce Sleeve</p><p><b>Neckline</b>: Off the Shoulder</p><p><b>Fit Type</b>: Regular Fit</p><p><b>Sleeve Length</b>: Short Sleeve</p><p><b>Placket Type</b>: Pullovers</p><p><b>Sheer</b>: No</p><p><b>Material</b>: Polyester</p><p><b>Composition</b>: 90% Polyester</p><p><b>Composition</b>: 10% Spandex</p><p><b>Fabric</b>: Slight Stretch</p><p><b>Care Instructions</b>: Machine wash or professional dry clean</p><p><b>Style</b>: Casual</p><p><b>Color</b>: Black</p><p><b>Pattern Type</b>: Plain</p><p><b>Length</b>: Crop</p><p><b>Season</b>: Summer</p><p><b>Details</b>: Frill</p><p><b>Neckline</b>: Off the Shoulder</p><p><b>Sleeve Type</b>: Puff Sleeve</p><p><b>Fit Type</b>: Regular Fit</p><p><b>Sleeve Length</b>: Short Sleeve</p><p><b>Placket Type</b>: Pullovers</p><p><b>Sheer</b>: No</p><p><b>Material</b>: Polyester</p><p><b>Composition</b>: 90% Polyester</p><p><b>Composition</b>: 10% Spandex</p><p><b>Fabric</b>: Slight Stretch</p><p><b>Care Instructions</b>: Machine wash or professional dry clean</p>,img/Women_Tops/swtop30210409275.jpg,,Size#S:M:L:XL:,31.84,,,,1,1,,,Women Tops,,Solid Frill Crop Bardot Top,Solid Frill Crop Bardot Top,Solid Frill Crop Bardot Top,,,,,,,,,
THJFOBY0005,Heart Chain Necklace,,<p><b>Details</b>: Heart</p><p><b>Type</b>: Pendant Necklaces</p><p><b>Material</b>: Alloy</p><p><b>Color</b>: Black</p><p><b>Style</b>: Casual</p>,img/Pendant_Necklaces/rwneck18210207588.jpg,,Size#,26.88,,,,1,1,,,Pendant Necklaces,,Heart Chain Necklace,Heart Chain Necklace,Heart Chain Necklace,,,,,,,,,
THJFOBY0006,Elegant Pink Flower Womens Cuff Earrings Fashion Silver Gold Color Piercing Clip Earrings,,"<p>Style: Elegant</p><p>Type: Ear Cuff</p><p>Main Color: Silver, Gold</p><p>Weight: About 10g</p><p>Size: About 4.4cm x 2cm / 1.73' x 0.79'</p><p>Material: Zinc Alloy, Rhinestone</p><p>1 Pair of Earrings</p>",img/Earrings/SKU986816.jpg,,Size#,18.57,,,,1,1,,,Earrings,,Elegant Pink Flower Womens Cuff Earrings Fashion Silver Gold Color Piercing Clip Earrings,Elegant Pink Flower Womens Cuff Earrings Fashion Silver Gold Color Piercing Clip Earrings,Elegant Pink Flower Womens Cuff Earrings Fashion Silver Gold Color Piercing Clip Earrings,,,,,,,,,
THJFOBY0007,Women Ethnic Embroidered Canvas Peacock Handbag Crossbody Bag,,"<p>Color:Blue, Black, Red</p><p>Material:Canvas</p><p>Pattern:Animal-print</p><p>Capacity:4A Magazine</p><p>Hardness:Soft</p>",img/Handbags/SKUG21959.jpg,,Size#,65.12,,,,1,1,,,Handbags,,Women Ethnic Embroidered Canvas Peacock Handbag Crossbody Bag,Women Ethnic Embroidered Canvas Peacock Handbag Crossbody Bag,Women Ethnic Embroidered Canvas Peacock Handbag Crossbody Bag,,,,,,,,,
THJFOBY0008,LOSTISY Plus Size Women Loafers Round Toe Casual Hollow Stitching Slip-on Flats,,"<p>Color:Beige, Black, Pink, Blue</p><p>Type:Loafers</p><p>Closure Type:Slip-On</p><p>Heel Type:Flat</p><p>Heel Height:1-3cm In Flat</p><p>Toe Type:Closed Toe, Round</p><p>Pattern:Solid</p><p>Design Element:Splice, Hollow out, Stitching</p><p>Upper Material:PU</p><p>Style:European Style, Casual</p><p>Outsole Material:Rubber</p><p>Structure:Wide Fit, Closed Toe, Slip-On</p><p>Occasion:Casual</p><p>Function:Breathable, Soft</p><p>Season:Summer, Spring</p>",img/Flats/SKUF95910.jpg,,Size#US 5:US 6:US 7:US 8:US 9:US 10:US 11:US 12:,64.7,,,,1,1,,,Flats,,LOSTISY Plus Size Women Loafers Round Toe Casual Hollow Stitching Slip-on Flats,LOSTISY Plus Size Women Loafers Round Toe Casual Hollow Stitching Slip-on Flats,LOSTISY Plus Size Women Loafers Round Toe Casual Hollow Stitching Slip-on Flats,,,,,,,,,
THJFOBY0009,Plus Size Women Casual Orthopedic Bunion Corrector Clip Toe Wedges Sandals,,<p>Color:Blue</p><p>Heel Type:Wedges Heel</p><p>Toe Type:Clip Toe</p><p>Upper Material:PU</p><p>Outsole Material:PU</p><p>Season:Summer</p>,img/Slippers/SKUF40310.jpg,,Size#US 5:US 6:US 7:US 8:US 9:US 10:US 11:US 12:,51.07,,,,1,1,,,Slippers,,Plus Size Women Casual Orthopedic Bunion Corrector Clip Toe Wedges Sandals,Plus Size Women Casual Orthopedic Bunion Corrector Clip Toe Wedges Sandals,Plus Size Women Casual Orthopedic Bunion Corrector Clip Toe Wedges Sandals,,,,,,,,,
THJFOBY0010,Plaid Ruched Bust Tie Shoulder Cami Dress,,<p><b>Style</b>: Preppy</p><p><b>Color</b>: Burgundy</p><p><b>Pattern Type</b>: Plaid</p><p><b>Length</b>: Mini</p><p><b>Season</b>: Summer</p><p><b>Type</b>: Cami</p><p><b>Details</b>: Knot</p><p><b>Details</b>: Split</p><p><b>Details</b>: Ruched Bust</p><p><b>Sleeve Length</b>: Sleeveless</p><p><b>Neckline</b>: Spaghetti Strap</p><p><b>Waist Line</b>: Natural</p><p><b>Fit Type</b>: Regular Fit</p><p><b>Sheer</b>: No</p><p><b>Hem Shaped</b>: Straight</p><p><b>Material</b>: Cotton</p><p><b>Composition</b>: 65% Cotton</p><p><b>Composition</b>: 35% Polyester</p><p><b>Fabric</b>: Slight Stretch</p><p><b>Care Instructions</b>: Machine wash or professional dry clean</p>,img/Dresses/rW210511357938048.jpg,,Size#XS:S:M:L:,23.12,,,,1,1,,,Dresses,,Plaid Ruched Bust Tie Shoulder Cami Dress,Plaid Ruched Bust Tie Shoulder Cami Dress,Plaid Ruched Bust Tie Shoulder Cami Dress,,,,,,,,,
THJFOBY0011,Heart-Cut Out Ribbed Lettuce Trim Tee,,<p><b>Style</b>: Casual</p><p><b>Color</b>: Black</p><p><b>Pattern Type</b>: Plain</p><p><b>Length</b>: Crop</p><p><b>Season</b>: Summer</p><p><b>Details</b>: Cut Out</p><p><b>Details</b>: Frill</p><p><b>Sleeve Length</b>: Short Sleeve</p><p><b>Fit Type</b>: Slim Fit</p><p><b>Neckline</b>: Stand Collar</p><p><b>Sleeve Type</b>: Regular Sleeve</p><p><b>Placket Type</b>: Pullovers</p><p><b>Sheer</b>: No</p><p><b>Material</b>: Polyester</p><p><b>Composition</b>: 65% Polyester</p><p><b>Composition</b>: 35% Cotton</p><p><b>Fabric</b>: Slight Stretch</p><p><b>Care Instructions</b>: Machine wash or professional dry clean</p><p><b>Style</b>: Casual</p><p><b>Color</b>: Baby Pink</p><p><b>Pattern Type</b>: Plain</p><p><b>Length</b>: Crop</p><p><b>Season</b>: Summer</p><p><b>Details</b>: Cut Out</p><p><b>Details</b>: Frill</p><p><b>Sleeve Length</b>: Short Sleeve</p><p><b>Fit Type</b>: Slim Fit</p><p><b>Neckline</b>: Stand Collar</p><p><b>Sleeve Type</b>: Regular Sleeve</p><p><b>Placket Type</b>: Pullovers</p><p><b>Sheer</b>: No</p><p><b>Material</b>: Polyester</p><p><b>Composition</b>: 65% Polyester</p><p><b>Composition</b>: 35% Cotton</p><p><b>Fabric</b>: Slight Stretch</p><p><b>Care Instructions</b>: Machine wash or professional dry clean</p>,img/T___Shirts/rwtee03210121647.jpg,,Size#S:M:L:,22.61,,,,1,1,,,T-Shirts,,Heart-Cut Out Ribbed Lettuce Trim Tee,Heart-Cut Out Ribbed Lettuce Trim Tee,Heart-Cut Out Ribbed Lettuce Trim Tee,,,,,,,,,
THJFOBY0012,Mushroom Embroidery Corduroy Shorts,,<p><b>Color</b>: Brown</p><p><b>Season</b>: Spring/Summer/Fall</p><p><b>Sheer</b>: No</p><p><b>Material</b>: Corduroy</p><p><b>Composition</b>: 65% Cotton</p><p><b>Composition</b>: 35% Polyester</p><p><b>Fabric</b>: Non-Stretch</p><p><b>Care Instructions</b>: Machine wash or professional dry clean</p>,img/Shorts/sW210615742606796.jpg,,Size#S:M:L:,31.28,,,,1,1,,,Shorts,,Mushroom Embroidery Corduroy Shorts,Mushroom Embroidery Corduroy Shorts,Mushroom Embroidery Corduroy Shorts,,,,,,,,,
THJFOBY0013,Puff Sleeve Tie Front Crop Top,,<p><b>Style</b>: Boho</p><p><b>Color</b>: Baby Blue</p><p><b>Pattern Type</b>: Plain</p><p><b>Length</b>: Crop</p><p><b>Season</b>: Summer</p><p><b>Details</b>: Tie Front</p><p><b>Details</b>: Ruched Bust</p><p><b>Sleeve Type</b>: Puff Sleeve</p><p><b>Fit Type</b>: Regular Fit</p><p><b>Neckline</b>: Scoop Neck</p><p><b>Sleeve Length</b>: Short Sleeve</p><p><b>Placket Type</b>: Placket</p><p><b>Sheer</b>: No</p><p><b>Hem Shaped</b>: Slit</p><p><b>Material</b>: Polyester</p><p><b>Composition</b>: 100% Polyester</p><p><b>Fabric</b>: Non-Stretch</p><p><b>Care Instructions</b>: Machine wash or professional dry clean</p>,img/Women_Tops/swtop04210107330.jpg,,Size#XS:S:M:L:,30.94,,,,1,1,,,Women Tops,,Puff Sleeve Tie Front Crop Top,Puff Sleeve Tie Front Crop Top,Puff Sleeve Tie Front Crop Top,,,,,,,,,
THJFOBY0014,Mushroom Charm Necklace,,<p><b>Material</b>: Metal</p><p><b>Details</b>: Pearls</p><p><b>Type</b>: Pendant Necklaces</p><p><b>Color</b>: Silver</p><p><b>Metal Color</b>: Silver</p><p><b>Style</b>: Casual</p>,img/Pendant_Necklaces/swneck18210122373.jpg,,Size#,16.15,,,,1,1,,,Pendant Necklaces,,Mushroom Charm Necklace,Mushroom Charm Necklace,Mushroom Charm Necklace,,,,,,,,,
THJFOBY0015,Trendy Small Daisy Flower Ear Hook Geometric Metal Flower Rhinestone Cute Earrings,,<p>Style: Trendy</p><p>Type: Earrings</p><p>Main Color: 3 Colors for your choose</p><p>Szie:As the picture shows</p><p>Weight: About 10g</p><p>Material: Alloy</p><p>1 X Earrings</p>,img/Earrings/SKUE26535.jpg,,Size#,18.64,,,,1,1,,,Earrings,,Trendy Small Daisy Flower Ear Hook Geometric Metal Flower Rhinestone Cute Earrings,Trendy Small Daisy Flower Ear Hook Geometric Metal Flower Rhinestone Cute Earrings,Trendy Small Daisy Flower Ear Hook Geometric Metal Flower Rhinestone Cute Earrings,,,,,,,,,
THJFOBY0016,4 PCS Women PU Leather Handbag Tassel Leisure Crossbody Bag Solid Shoulder Bag,,"<p>Bag Type:Bag Set</p><p>Color:Blue, Black, Brown, Green, Pink, Grey, Red</p><p>Material:PU</p><p>Style:Casual</p><p>Decoration:Tassel</p><p>Hardness:Hard</p>",img/Handbags/SKUA52875.jpg,,Size#,58.9,,,,1,1,,,Handbags,,4 PCS Women PU Leather Handbag Tassel Leisure Crossbody Bag Solid Shoulder Bag,4 PCS Women PU Leather Handbag Tassel Leisure Crossbody Bag Solid Shoulder Bag,4 PCS Women PU Leather Handbag Tassel Leisure Crossbody Bag Solid Shoulder Bag,,,,,,,,,
THJFOBY0017,LOSTISY Large Size Pure Color Slip On Vintage Casual Flat Loafers,,"<p>Color:Green, Camel, Black, White</p><p>Type:Loafers</p><p>Closure Type:Slip-On</p><p>Heel Type:Flat</p><p>Heel Height:1-3cm In Flat</p><p>Toe Type:Round</p><p>Pattern:Solid</p><p>Design Element:Simple</p><p>Upper Material:PU</p><p>Style:Casual</p><p>Outsole Material:Rubber</p><p>Structure:Slip-On</p><p>Occasion:Daily</p><p>Function:Antiskid, Soft</p><p>Season:Summer, Spring</p>",img/Flats/SKU747121.jpg,,Size#US 5:US 6:US 7:US 8:US 9:US 10:US 11:US 12:,58.38,,,,1,1,,,Flats,,LOSTISY Large Size Pure Color Slip On Vintage Casual Flat Loafers,LOSTISY Large Size Pure Color Slip On Vintage Casual Flat Loafers,LOSTISY Large Size Pure Color Slip On Vintage Casual Flat Loafers,,,,,,,,,
THJFOBY0018,Women Lightweight Mules Slip On Waterproof Non Slip Backless Slippers,,"<p>Color:Red, Purple, Pink, White, Grey</p><p>Closure Type:Slip-On</p><p>Heel Type:Flat</p><p>Heel Height:1-3cm In Flat</p><p>Toe Type:Round</p><p>Pattern:Solid</p><p>Design Element:Buckle</p><p>Upper Material:EVA Foam</p><p>Style:Casual</p><p>Outsole Material:EVA</p><p>Structure:Sling Back</p><p>Occasion:Home</p><p>Function:Breathable, Backless, Antiskid, Light Weight</p><p>Season:Summer</p>",img/Slippers/SKUF64397.jpg,,Size#US 5:US 6:US 7:US 8:US 9:,52.33,,,,1,1,,,Slippers,,Women Lightweight Mules Slip On Waterproof Non Slip Backless Slippers,Women Lightweight Mules Slip On Waterproof Non Slip Backless Slippers,Women Lightweight Mules Slip On Waterproof Non Slip Backless Slippers,,,,,,,,,
THJFOBY0019,Daisy Tie Shoulder Dress,,<p><b>Style</b>: Boho</p><p><b>Color</b>: Blue</p><p><b>Pattern Type</b>: Floral</p><p><b>Pattern Type</b>: All Over Print</p><p><b>Length</b>: Mini</p><p><b>Season</b>: Summer</p><p><b>Type</b>: Cami</p><p><b>Details</b>: Knot</p><p><b>Details</b>: Split</p><p><b>Sleeve Length</b>: Sleeveless</p><p><b>Neckline</b>: Spaghetti Strap</p><p><b>Waist Line</b>: High Waist</p><p><b>Fit Type</b>: Regular Fit</p><p><b>Sheer</b>: No</p><p><b>Hem Shaped</b>: Straight</p><p><b>Material</b>: Polyester</p><p><b>Composition</b>: 100% Polyester</p><p><b>Fabric</b>: Non-Stretch</p><p><b>Care Instructions</b>: Machine wash or professional dry clean</p>,img/Dresses/rwdress25210511009.jpg,,Size#XS:S:M:L:,25.06,,,,1,1,,,Dresses,,Daisy Tie Shoulder Dress,Daisy Tie Shoulder Dress,Daisy Tie Shoulder Dress,,,,,,,,,
THJFOBY0020,ROMWE X Vincenttrinidadart Cat Graphic Tie Dye Tee,,<p><b>Style</b>: Casual</p><p><b>Color</b>: Pink</p><p><b>Pattern Type</b>: Tie Dye</p><p><b>Pattern Type</b>: Cartoon</p><p><b>Length</b>: Regular</p><p><b>Season</b>: Summer</p><p><b>Neckline</b>: Round Neck</p><p><b>Sleeve Length</b>: Short Sleeve</p><p><b>Fit Type</b>: Regular Fit</p><p><b>Sleeve Type</b>: Drop Shoulder</p><p><b>Placket Type</b>: Pullovers</p><p><b>Sheer</b>: No</p><p><b>Material</b>: Polyester</p><p><b>Composition</b>: 100% Polyester</p><p><b>Fabric</b>: Medium Stretch</p><p><b>Care Instructions</b>: Machine wash or professional dry clean</p>,img/T___Shirts/rw2106227662244956.jpg,,Size#S:M:L:,30.73,,,,1,1,,,T-Shirts,,ROMWE X Vincenttrinidadart Cat Graphic Tie Dye Tee,ROMWE X Vincenttrinidadart Cat Graphic Tie Dye Tee,ROMWE X Vincenttrinidadart Cat Graphic Tie Dye Tee,,,,,,,,,
THJFOBY0021,Ditsy Floral & Plaid Print Shorts,,<p><b>Style</b>: Boho</p><p><b>Color</b>: Green</p><p><b>Pattern Type</b>: Plaid</p><p><b>Pattern Type</b>: Ditsy Floral</p><p><b>Type</b>: Straight Leg</p><p><b>Season</b>: Summer</p><p><b>Details</b>: Knot</p><p><b>Waist Line</b>: High Waist</p><p><b>Fit Type</b>: Regular Fit</p><p><b>Sheer</b>: No</p><p><b>Closure Type</b>: Elastic Waist</p><p><b>Material</b>: Viscose</p><p><b>Composition</b>: 50% Polyester</p><p><b>Composition</b>: 50% Viscose</p><p><b>Fabric</b>: Non-Stretch</p><p><b>Care Instructions</b>: Machine wash or professional dry clean</p>,img/Shorts/swshorts07210508291.jpg,,Size#XS:S:M:L:XL:,25.15,,,,1,1,,,Shorts,,Ditsy Floral & Plaid Print Shorts,Ditsy Floral & Plaid Print Shorts,Ditsy Floral & Plaid Print Shorts,,,,,,,,,
THJFOBY0022,Colorblock Cut Out Front One Shoulder Crop Top,,<p><b>Style</b>: Casual</p><p><b>Color</b>: Multicolor</p><p><b>Pattern Type</b>: Colorblock</p><p><b>Length</b>: Crop</p><p><b>Season</b>: Summer</p><p><b>Details</b>: Cut Out</p><p><b>Neckline</b>: One Shoulder</p><p><b>Sleeve Length</b>: Sleeveless</p><p><b>Fit Type</b>: Slim Fit</p><p><b>Placket Type</b>: Pullovers</p><p><b>Sheer</b>: No</p><p><b>Material</b>: Polyester</p><p><b>Composition</b>: 91% Polyester</p><p><b>Composition</b>: 9% Elastane</p><p><b>Fabric</b>: High Stretch</p><p><b>Care Instructions</b>: Machine wash or professional dry clean</p><p><b>Style</b>: Casual</p><p><b>Color</b>: Pink</p><p><b>Pattern Type</b>: Colorblock</p><p><b>Length</b>: Crop</p><p><b>Season</b>: Summer</p><p><b>Details</b>: Cut Out</p><p><b>Neckline</b>: One Shoulder</p><p><b>Sleeve Length</b>: Sleeveless</p><p><b>Fit Type</b>: Slim Fit</p><p><b>Placket Type</b>: Pullovers</p><p><b>Sheer</b>: No</p><p><b>Material</b>: Polyester</p><p><b>Composition</b>: 91% Polyester</p><p><b>Composition</b>: 9% Elastane</p><p><b>Fabric</b>: High Stretch</p><p><b>Care Instructions</b>: Machine wash or professional dry clean</p>,img/Women_Tops/swtop44210519724.jpg,,Size#XS:S:M:L:,24.0,,,,1,1,,,Women Tops,,Colorblock Cut Out Front One Shoulder Crop Top,Colorblock Cut Out Front One Shoulder Crop Top,Colorblock Cut Out Front One Shoulder Crop Top,,,,,,,,,
THJFOBY0023,Disc Charm Layered Necklace,,<p><b>Details</b>: Geometric</p><p><b>Material</b>: Metal</p><p><b>Type</b>: Pendant Necklaces</p><p><b>Details</b>: Round</p><p><b>Type</b>: Layer Sets</p><p><b>Color</b>: Gold</p><p><b>Metal Color</b>: Gold</p><p><b>Style</b>: Casual</p>,img/Pendant_Necklaces/swneck18210105034.jpg,,Size#,12.46,,,,1,1,,,Pendant Necklaces,,Disc Charm Layered Necklace,Disc Charm Layered Necklace,Disc Charm Layered Necklace,,,,,,,,,
THJFOBY0024,18K Gold Plated Zircon Earrings,,"<p>Style: Trendy</p><p>Type: Hoop Earrings</p><p>Material: Gold Plated, Zircon</p><p>Color: Gold</p><p>Diameter: About 1.1cm</p><p>Width: About 0.2cm   </p><p>Weight: About 10g</p>",img/Earrings/SKU298394.jpg,,Size#,11.15,,,,1,1,,,Earrings,,18K Gold Plated Zircon Earrings,18K Gold Plated Zircon Earrings,18K Gold Plated Zircon Earrings,,,,,,,,,
THJFOBY0025,Women Genuine Leather Vintage Personalized Handbag Crossbody Bag,,"<p>Bag Type:Satchel</p><p>Color:Yellow, Coffee, Black, Green, Red</p><p>Material:Cow Leather</p><p>Style:Vintage</p><p>Hardness:Hard</p>",img/Handbags/SKUA50575.jpg,,Size#,56.38,,,,1,1,,,Handbags,,Women Genuine Leather Vintage Personalized Handbag Crossbody Bag,Women Genuine Leather Vintage Personalized Handbag Crossbody Bag,Women Genuine Leather Vintage Personalized Handbag Crossbody Bag,,,,,,,,,
THJFOBY0026,Women Multicolor Print Cat Square Toe Canvas Loafers Flat Shoes,,"<p>Color:Green, Red, Yellow, Black, Pink, Blue</p><p>Type:Loafers</p><p>Closure Type:Slip-On, Elastic Band</p><p>Heel Type:Flat</p><p>Heel Height:1-3cm In Flat</p><p>Toe Type:Square</p><p>Pattern:Animal-print, Cat</p><p>Design Element:Pattern, Print</p><p>Upper Material:Canvas</p><p>Style:Casual, Stylish</p><p>Outsole Material:Rubber</p><p>Structure:Elastic Band</p><p>Occasion:Casual</p><p>Function:Antiskid, Hard-wearing</p><p>Season:All Season</p>",img/Flats/SKUG95796.jpg,,Size#US 5:US 6:US 7:US 8:US 9:US 10:US 11:US 12:,54.21,,,,1,1,,,Flats,,Women Multicolor Print Cat Square Toe Canvas Loafers Flat Shoes,Women Multicolor Print Cat Square Toe Canvas Loafers Flat Shoes,Women Multicolor Print Cat Square Toe Canvas Loafers Flat Shoes,,,,,,,,,
THJFOBY0027,Women Solid Color Buckle Outdoors Casual Flip Flips,,"<p>Color:Red, Black, Pink, Blue</p><p>Type:Flip Flops</p><p>Closure Type:Slip-On</p><p>Heel Type:Platforms</p><p>Heel Height:1-3cm In Flat</p><p>Toe Type:Clip Toe</p><p>Pattern:Solid</p><p>Design Element:Buckle</p><p>Upper Material:PU</p><p>Style:Casual</p><p>Outsole Material:EVA</p><p>Occasion:Casual</p><p>Function:Soft</p><p>Season:Summer, Spring</p>",img/Slippers/SKUH36793.jpg,,Size#US 5:US 6:US 7:US 8:US 9:US 10:US 11:US 12:,60.27,,,,1,1,,,Slippers,,Women Solid Color Buckle Outdoors Casual Flip Flips,Women Solid Color Buckle Outdoors Casual Flip Flips,Women Solid Color Buckle Outdoors Casual Flip Flips,,,,,,,,,
THJFOBY0028,2pcs Solid Cami Dress,,<p><b>Style</b>: Sexy</p><p><b>Color</b>: Multicolor</p><p><b>Pattern Type</b>: Plain</p><p><b>Length</b>: Short</p><p><b>Season</b>: Summer</p><p><b>Type</b>: Bodycon</p><p><b>Details</b>: Rib-Knit</p><p><b>Sleeve Length</b>: Sleeveless</p><p><b>Neckline</b>: Spaghetti Strap</p><p><b>Waist Line</b>: Natural</p><p><b>Fit Type</b>: Slim Fit</p><p><b>Sheer</b>: No</p><p><b>Hem Shaped</b>: Pencil</p><p><b>Material</b>: Polyester</p><p><b>Composition</b>: 95% Polyester</p><p><b>Composition</b>: 5% Spandex</p><p><b>Fabric</b>: High Stretch</p><p><b>Care Instructions</b>: Machine wash or professional dry clean</p>,img/Dresses/rwdress25210419193.jpg,,Size#S:M:L:,24.03,,,,1,1,,,Dresses,,2pcs Solid Cami Dress,2pcs Solid Cami Dress,2pcs Solid Cami Dress,,,,,,,,,
THJFOBY0029,Butterfly & Floral Graphic Tee,,<p><b>Style</b>: Casual</p><p><b>Color</b>: Black</p><p><b>Pattern Type</b>: Floral</p><p><b>Pattern Type</b>: Animal</p><p><b>Length</b>: Long</p><p><b>Season</b>: Summer</p><p><b>Neckline</b>: Round Neck</p><p><b>Sleeve Length</b>: Short Sleeve</p><p><b>Fit Type</b>: Regular Fit</p><p><b>Sleeve Type</b>: Drop Shoulder</p><p><b>Placket Type</b>: Pullovers</p><p><b>Sheer</b>: No</p><p><b>Material</b>: Polyester</p><p><b>Composition</b>: 62.3% Polyester</p><p><b>Composition</b>: 34% Cotton</p><p><b>Composition</b>: 3.7% Spandex</p><p><b>Fabric</b>: Slight Stretch</p><p><b>Care Instructions</b>: Machine wash or professional dry clean</p>,img/T___Shirts/rwtee25210604646.jpg,,Size#S:M:L:XL:,25.34,,,,1,1,,,T-Shirts,,Butterfly & Floral Graphic Tee,Butterfly & Floral Graphic Tee,Butterfly & Floral Graphic Tee,,,,,,,,,
THJFOBY0030,Two Tone Letter Shorts,,<p><b>Style</b>: Casual</p><p><b>Color</b>: Multicolor</p><p><b>Pattern Type</b>: Letter</p><p><b>Pattern Type</b>: Colorblock</p><p><b>Season</b>: Summer</p><p><b>Type</b>: Track Shorts</p><p><b>Waist Line</b>: Natural</p><p><b>Fit Type</b>: Regular Fit</p><p><b>Sheer</b>: No</p><p><b>Closure Type</b>: Elastic Waist</p><p><b>Material</b>: Polyester</p><p><b>Composition</b>: 97% Polyester</p><p><b>Composition</b>: 3% Elastane</p><p><b>Fabric</b>: Slight Stretch</p><p><b>Care Instructions</b>: Machine wash or professional dry clean</p>,img/Shorts/rwshorts25210414715.jpg,,Size#S:M:L:,30.26,,,,1,1,,,Shorts,,Two Tone Letter Shorts,Two Tone Letter Shorts,Two Tone Letter Shorts,,,,,,,,,
THJFOBY0031,Sheer Lettuce Trim Mesh Top,,<p><b>Style</b>: Casual</p><p><b>Color</b>: Multicolor</p><p><b>Pattern Type</b>: Tie Dye</p><p><b>Length</b>: Crop</p><p><b>Season</b>: Spring/Summer</p><p><b>Details</b>: Lettuce Trim</p><p><b>Details</b>: Sheer</p><p><b>Sleeve Length</b>: Long Sleeve</p><p><b>Fit Type</b>: Regular Fit</p><p><b>Neckline</b>: Round Neck</p><p><b>Sleeve Type</b>: Regular Sleeve</p><p><b>Placket Type</b>: Pullovers</p><p><b>Sheer</b>: Semi-Sheer</p><p><b>Material</b>: Mesh</p><p><b>Composition</b>: 94% Polyester</p><p><b>Composition</b>: 6% Elastane</p><p><b>Fabric</b>: Medium Stretch</p><p><b>Care Instructions</b>: Machine wash or professional dry clean</p>,img/Women_Tops/swtop30210521793.jpg,,Size#S:M:L:XL:,23.4,,,,1,1,,,Women Tops,,Sheer Lettuce Trim Mesh Top,Sheer Lettuce Trim Mesh Top,Sheer Lettuce Trim Mesh Top,,,,,,,,,
