v_sku,v_name,v_short_description,v_description,v_image,v_url,v_attribute,v_price,v_specials_price,v_specials_expire_date,v_date_added,v_in_stock,v_status,v_viewed,v_ordered,v_category_sku,v_sort_order,v_meta_title,v_meta_keywords,v_meta_description,v_brand_filter,v_class_filter,v_color_filter,v_gender_filter,v_material_filter,v_year_filter,v_origin_filter,v_series_filter,v_spec_filter
THJFOBY0068,Butterfly Charm Necklace,,<p><b>Type</b>: Pendant Necklaces</p><p><b>Material</b>: Stainless Steel</p><p><b>Details</b>: Butterfly</p><p><b>Color</b>: Silver</p><p><b>Metal Color</b>: Silver</p><p><b>Style</b>: Casual</p>,img/Pendant_Necklaces/swneck18201008179.jpg,,Size#,28.7,,,,1,1,,,Pendant Necklaces,,Butterfly Charm Necklace,Butterfly Charm Necklace,Butterfly Charm Necklace,,,,,,,,,
THJFOBY0069,3 Pairs Vintage Bohemian Tassel Multiple Types Of Shapes Alloy Earrings Set,,"<p>Style: Vintage,Bohemian </p><p>Type: Earrings Set</p><p>Weight: 50 g</p><p>Size: As the picture shown </p><p>Material: Alloy </p><p>Quantity: 3 Pairs </p><p>Package Includes:</p><p>1 x Earrings Set</p><p>Notice:</p>",img/Earrings/SKUH93911.jpg,,Size#,19.44,,,,1,1,,,Earrings,,3 Pairs Vintage Bohemian Tassel Multiple Types Of Shapes Alloy Earrings Set,3 Pairs Vintage Bohemian Tassel Multiple Types Of Shapes Alloy Earrings Set,3 Pairs Vintage Bohemian Tassel Multiple Types Of Shapes Alloy Earrings Set,,,,,,,,,
THJFOBY0070,Women Argyle Large Capacity Crossbody Bag Handbag Shoulder Bag Satchel Bag,,"<p>Bag Type:Satchel</p><p>Color:Blue, Black, Purple, Red</p><p>Material:Nylon</p><p>Style:Casual</p><p>Pattern:Solid</p><p>Hardness:Soft</p>",img/Handbags/SKUG17520.jpg,,Size#,63.21,,,,1,1,,,Handbags,,Women Argyle Large Capacity Crossbody Bag Handbag Shoulder Bag Satchel Bag,Women Argyle Large Capacity Crossbody Bag Handbag Shoulder Bag Satchel Bag,Women Argyle Large Capacity Crossbody Bag Handbag Shoulder Bag Satchel Bag,,,,,,,,,
THJFOBY0071,SOCOFY Leather Floral Cutouts Zipper Slip on Loafers Non-slip Flat Shoes,,"<p>Color:Red</p><p>Closure Type:Slip-On, Zipper, Elastic Band</p><p>Toe Type:Round</p><p>Upper Material:Leather</p><p>Style:Retro</p><p>Outsole Material:Rubber</p><p>Occasion:Daily</p><p>Function:Soft</p><p>Season:Summer</p>",img/Flats/SKUE76087.jpg,,Size#US 5:US 6:US 7:US 8:US 9.5:US 10.5:US 11.5:,51.73,,,,1,1,,,Flats,,SOCOFY Leather Floral Cutouts Zipper Slip on Loafers Non-slip Flat Shoes,SOCOFY Leather Floral Cutouts Zipper Slip on Loafers Non-slip Flat Shoes,SOCOFY Leather Floral Cutouts Zipper Slip on Loafers Non-slip Flat Shoes,,,,,,,,,
THJFOBY0072,Women Casual Sport Lightweight Breathable Soft Sole Flip Flops Slippers,,"<p>Color:Beige, Black, Pink, Blue</p><p>Type:Flip Flops</p><p>Closure Type:Slip-On</p><p>Heel Type:Flat</p><p>Heel Height:1-3cm In Flat</p><p>Toe Type:Clip Toe</p><p>Pattern:Solid</p><p>Design Element:Simple</p><p>Upper Material:PU</p><p>Style:Casual</p><p>Outsole Material:PU</p><p>Structure:Clip Toe, Slip-On</p><p>Occasion:Casual</p><p>Function:Breathable, Antiskid, Soft, Light Weight</p><p>Season:Summer, Autumn, Spring</p>",img/Slippers/SKUH65758.jpg,,Size#US 5:US 6:US 7:US 8:US 9:US 10:US 11:,64.06,,,,1,1,,,Slippers,,Women Casual Sport Lightweight Breathable Soft Sole Flip Flops Slippers,Women Casual Sport Lightweight Breathable Soft Sole Flip Flops Slippers,Women Casual Sport Lightweight Breathable Soft Sole Flip Flops Slippers,,,,,,,,,
THJFOBY0073,Heart Leopard Drawstring Side Tube Dress,,<p><b>Style</b>: Sexy</p><p><b>Color</b>: Black</p><p><b>Pattern Type</b>: Heart</p><p><b>Pattern Type</b>: Leopard</p><p><b>Length</b>: Mini</p><p><b>Season</b>: Summer</p><p><b>Type</b>: Bodycon</p><p><b>Details</b>: Ruched</p><p><b>Details</b>: Drawstring</p><p><b>Details</b>: Rib-Knit</p><p><b>Sleeve Length</b>: Sleeveless</p><p><b>Waist Line</b>: Natural</p><p><b>Fit Type</b>: Slim Fit</p><p><b>Neckline</b>: Strapless</p><p><b>Sheer</b>: No</p><p><b>Hem Shaped</b>: Pencil</p><p><b>Material</b>: Cotton Blends</p><p><b>Composition</b>: 65% Cotton</p><p><b>Composition</b>: 35% Polyester</p><p><b>Fabric</b>: Medium Stretch</p><p><b>Care Instructions</b>: Machine wash or professional dry clean</p>,img/Dresses/sW210521507333391.jpg,,Size#S:M:L:,32.93,,,,1,1,,,Dresses,,Heart Leopard Drawstring Side Tube Dress,Heart Leopard Drawstring Side Tube Dress,Heart Leopard Drawstring Side Tube Dress,,,,,,,,,
THJFOBY0074,ROMWE X Betsydoodles Milk Box Graphic Crop Tee,,<p><b>Style</b>: Cute</p><p><b>Color</b>: Blue and White</p><p><b>Pattern Type</b>: Colorblock</p><p><b>Pattern Type</b>: Graphic</p><p><b>Length</b>: Crop</p><p><b>Season</b>: Summer</p><p><b>Sleeve Type</b>: Raglan Sleeve</p><p><b>Neckline</b>: Round Neck</p><p><b>Sleeve Length</b>: Short Sleeve</p><p><b>Fit Type</b>: Regular Fit</p><p><b>Placket Type</b>: Pullovers</p><p><b>Sheer</b>: No</p><p><b>Material</b>: Polyester</p><p><b>Composition</b>: 80% Polyester</p><p><b>Composition</b>: 20% Cotton</p><p><b>Fabric</b>: Medium Stretch</p><p><b>Care Instructions</b>: Machine wash or professional dry clean</p>,img/T___Shirts/rwtee25210426697.jpg,,Size#XS:S:M:L:,25.22,,,,1,1,,,T-Shirts,,ROMWE X Betsydoodles Milk Box Graphic Crop Tee,ROMWE X Betsydoodles Milk Box Graphic Crop Tee,ROMWE X Betsydoodles Milk Box Graphic Crop Tee,,,,,,,,,
THJFOBY0075,Buttoned Suit Shorts,,<p><b>Style</b>: Casual</p><p><b>Color</b>: Pink</p><p><b>Pattern Type</b>: Plain</p><p><b>Type</b>: Straight Leg</p><p><b>Season</b>: Summer</p><p><b>Details</b>: Button</p><p><b>Details</b>: Zipper</p><p><b>Waist Line</b>: High Waist</p><p><b>Fit Type</b>: Regular Fit</p><p><b>Sheer</b>: No</p><p><b>Closure Type</b>: Zipper Fly</p><p><b>Material</b>: Polyester</p><p><b>Composition</b>: 95% Polyester</p><p><b>Composition</b>: 5% Elastane</p><p><b>Fabric</b>: Non-Stretch</p><p><b>Care Instructions</b>: Machine wash or professional dry clean</p>,img/Shorts/swshorts44210531855.jpg,,Size#XS:S:M:L:,23.28,,,,1,1,,,Shorts,,Buttoned Suit Shorts,Buttoned Suit Shorts,Buttoned Suit Shorts,,,,,,,,,
THJFOBY0076,Floral Print Ruffle Crop Top,,<p><b>Style</b>: Boho</p><p><b>Color</b>: Multicolor</p><p><b>Pattern Type</b>: Floral</p><p><b>Pattern Type</b>: All Over Print</p><p><b>Length</b>: Regular</p><p><b>Season</b>: Summer</p><p><b>Details</b>: Ruffle Hem</p><p><b>Neckline</b>: Deep V Neck</p><p><b>Fit Type</b>: Regular Fit</p><p><b>Sleeve Length</b>: Sleeveless</p><p><b>Placket Type</b>: Placket</p><p><b>Sheer</b>: No</p><p><b>Material</b>: Cotton Blends</p><p><b>Composition</b>: 65% Cotton</p><p><b>Composition</b>: 35% Polyester</p><p><b>Fabric</b>: Medium Stretch</p><p><b>Care Instructions</b>: Machine wash or professional dry clean</p>,img/Women_Tops/sW210615802191862.jpg,,Size#XS:S:M:L:,28.35,,,,1,1,,,Women Tops,,Floral Print Ruffle Crop Top,Floral Print Ruffle Crop Top,Floral Print Ruffle Crop Top,,,,,,,,,
THJFOBY0077,Rhinestone Pendant Necklace,,<p><b>Type</b>: Pendant Necklaces</p><p><b>Details</b>: Rhinestone</p><p><b>Material</b>: Rhinestone</p><p><b>Material</b>: Alloy</p><p><b>Color</b>: Gold</p><p><b>Metal Color</b>: Gold</p><p><b>Style</b>: Casual</p>,img/Pendant_Necklaces/rwneck18210428586.jpg,,Size#,11.97,,,,1,1,,,Pendant Necklaces,,Rhinestone Pendant Necklace,Rhinestone Pendant Necklace,Rhinestone Pendant Necklace,,,,,,,,,
THJFOBY0078,Vintage Round-shape Inlaid Opal Alloy Earrings,,"<p>Style: Vintage</p><p>Type: Earrings</p><p>Color: Silver</p><p>Weight: 20 g</p><p>Size: About 6*2.5 cm / 2.36*0.98 in</p><p>Material: Alloy,Opal</p><p>Package Includes:</p><p>1 x Earrings</p><p>Notice:</p>",img/Earrings/SKUI28399.jpg,,Size#,28.64,,,,1,1,,,Earrings,,Vintage Round-shape Inlaid Opal Alloy Earrings,Vintage Round-shape Inlaid Opal Alloy Earrings,Vintage Round-shape Inlaid Opal Alloy Earrings,,,,,,,,,
THJFOBY0079,Women Multifunction Clothing Compartment 14 Inch Laptop Bag Shoulder Bag Travel Bag Tote,,"<p>Bag Type:Tote</p><p>Color:Blue, Black, Pink, Grey, Red</p><p>Material:PU, Faux Fur</p><p>Style:Casual</p><p>Pattern:Solid</p><p>Capacity:14 Inch Laptop</p><p>Hardness:Soft</p>",img/Handbags/SKUG67660.jpg,,Size#,67.91,,,,1,1,,,Handbags,,Women Multifunction Clothing Compartment 14 Inch Laptop Bag Shoulder Bag Travel Bag Tote,Women Multifunction Clothing Compartment 14 Inch Laptop Bag Shoulder Bag Travel Bag Tote,Women Multifunction Clothing Compartment 14 Inch Laptop Bag Shoulder Bag Travel Bag Tote,,,,,,,,,
THJFOBY0080,Elegant Casual Lace Floral Round Toe Breathable Flats Best Shoes For Flat Feet Women,,"<p>Color:White</p><p>Type:Loafers</p><p>Closure Type:Slip-On</p><p>Heel Type:Flat</p><p>Heel Height:1-3cm In Flat</p><p>Toe Type:Round</p><p>Pattern:Calico</p><p>Design Element:Floral</p><p>Upper Material:Lace</p><p>Style:Casual, Elegant</p><p>Outsole Material:Rubber</p><p>Structure:Slip-On</p><p>Occasion:Date, Casual</p><p>Function:Breathable, Antiskid, Hard-wearing</p><p>Season:Summer, Spring</p>",img/Flats/SKUH16383.jpg,,Size#US 4:US 5:US 6:US 7:US 8:,50.24,,,,1,1,,,Flats,,Elegant Casual Lace Floral Round Toe Breathable Flats Best Shoes For Flat Feet Women,Elegant Casual Lace Floral Round Toe Breathable Flats Best Shoes For Flat Feet Women,Elegant Casual Lace Floral Round Toe Breathable Flats Best Shoes For Flat Feet Women,,,,,,,,,
THJFOBY0081,Large Size Women Casual Leopard Clip Toe Platform Sandals,,"<p>Color:Khaki, Khaki, Orange, Orange, Yellow, Yellow, Purple, Purple, Black, Black</p><p>Closure Type:Slip-On, Slip-On</p><p>Heel Type:Wedges Heel, Wedges Heel</p><p>Heel Height:1-3cm In Flat, 1-3cm In Flat</p><p>Toe Type:Clip Toe, Clip Toe</p><p>Pattern:Other, Other</p><p>Design Element:Simple, Simple</p><p>Upper Material:PU, PU</p><p>Style:Casual, Casual</p><p>Outsole Material:PU, PU</p><p>Structure:Clip Toe, Clip Toe</p><p>Occasion:Beach, Beach</p><p>Function:Bunion, Bunion</p><p>Season:Summer, Summer, Autumn, Autumn, Spring, Spring</p>",img/Slippers/SKUB95735.jpg,,Size#US 5:US 6:US 7:US 8:US 9:US 10:US 11:US 12:,56.01,,,,1,1,,,Slippers,,Large Size Women Casual Leopard Clip Toe Platform Sandals,Large Size Women Casual Leopard Clip Toe Platform Sandals,Large Size Women Casual Leopard Clip Toe Platform Sandals,,,,,,,,,
THJFOBY0082,Contrast Collar Tee Dress,,<p><b>Style</b>: Casual</p><p><b>Color</b>: Khaki</p><p><b>Pattern Type</b>: Colorblock</p><p><b>Length</b>: Short</p><p><b>Season</b>: Summer</p><p><b>Type</b>: Fitted</p><p><b>Details</b>: Contrast Collar</p><p><b>Sleeve Length</b>: Short Sleeve</p><p><b>Waist Line</b>: Natural</p><p><b>Fit Type</b>: Regular Fit</p><p><b>Sleeve Type</b>: Regular Sleeve</p><p><b>Neckline</b>: Polo</p><p><b>Sheer</b>: No</p><p><b>Hem Shaped</b>: Straight</p><p><b>Material</b>: Polyester</p><p><b>Composition</b>: 65% Polyester</p><p><b>Composition</b>: 35% Cotton</p><p><b>Fabric</b>: Slight Stretch</p><p><b>Care Instructions</b>: Machine wash or professional dry clean</p><p><b>Style</b>: Casual</p><p><b>Color</b>: Black</p><p><b>Pattern Type</b>: Colorblock</p><p><b>Length</b>: Short</p><p><b>Season</b>: Summer</p><p><b>Type</b>: Tee</p><p><b>Details</b>: Contrast Collar</p><p><b>Sleeve Length</b>: Short Sleeve</p><p><b>Waist Line</b>: Natural</p><p><b>Fit Type</b>: Regular Fit</p><p><b>Sleeve Type</b>: Regular Sleeve</p><p><b>Neckline</b>: Polo</p><p><b>Sheer</b>: No</p><p><b>Hem Shaped</b>: Straight</p><p><b>Material</b>: Polyester</p><p><b>Composition</b>: 65% Polyester</p><p><b>Composition</b>: 35% Cotton</p><p><b>Fabric</b>: Slight Stretch</p><p><b>Care Instructions</b>: Machine wash or professional dry clean</p>,img/Dresses/rwdress25210526246.jpg,,Size#S:M:L:,32.26,,,,1,1,,,Dresses,,Contrast Collar Tee Dress,Contrast Collar Tee Dress,Contrast Collar Tee Dress,,,,,,,,,
THJFOBY0083,Letter Butterfly Graphic Tee,,<p><b>Style</b>: Casual</p><p><b>Color</b>: Black</p><p><b>Pattern Type</b>: Letter</p><p><b>Pattern Type</b>: Animal</p><p><b>Length</b>: Regular</p><p><b>Season</b>: Summer</p><p><b>Neckline</b>: Round Neck</p><p><b>Sleeve Length</b>: Short Sleeve</p><p><b>Fit Type</b>: Regular Fit</p><p><b>Sleeve Type</b>: Regular Sleeve</p><p><b>Placket Type</b>: Pullovers</p><p><b>Sheer</b>: No</p><p><b>Material</b>: Cotton</p><p><b>Composition</b>: 100% Cotton</p><p><b>Fabric</b>: Slight Stretch</p><p><b>Care Instructions</b>: Machine wash or professional dry clean</p><p><b>Style</b>: Casual</p><p><b>Color</b>: Apricot</p><p><b>Pattern Type</b>: Letter</p><p><b>Pattern Type</b>: Animal</p><p><b>Length</b>: Regular</p><p><b>Season</b>: Summer</p><p><b>Neckline</b>: Round Neck</p><p><b>Sleeve Length</b>: Short Sleeve</p><p><b>Fit Type</b>: Regular Fit</p><p><b>Sleeve Type</b>: Regular Sleeve</p><p><b>Placket Type</b>: Pullovers</p><p><b>Sheer</b>: No</p><p><b>Material</b>: Cotton</p><p><b>Composition</b>: 100% Cotton</p><p><b>Fabric</b>: Slight Stretch</p><p><b>Care Instructions</b>: Machine wash or professional dry clean</p><p><b>Style</b>: Casual</p><p><b>Color</b>: White</p><p><b>Pattern Type</b>: Letter</p><p><b>Pattern Type</b>: Animal</p><p><b>Length</b>: Regular</p><p><b>Season</b>: Summer</p><p><b>Neckline</b>: Round Neck</p><p><b>Sleeve Length</b>: Short Sleeve</p><p><b>Fit Type</b>: Regular Fit</p><p><b>Sleeve Type</b>: Regular Sleeve</p><p><b>Placket Type</b>: Pullovers</p><p><b>Sheer</b>: No</p><p><b>Material</b>: Cotton</p><p><b>Composition</b>: 100% Cotton</p><p><b>Fabric</b>: Slight Stretch</p><p><b>Care Instructions</b>: Machine wash or professional dry clean</p>,img/T___Shirts/rwtee25210609412.jpg,,Size#S:M:L:XL:XXL:,26.57,,,,1,1,,,T-Shirts,,Letter Butterfly Graphic Tee,Letter Butterfly Graphic Tee,Letter Butterfly Graphic Tee,,,,,,,,,
THJFOBY0084,Mushroom Print Belted Shorts,,<p><b>Style</b>: Casual</p><p><b>Color</b>: Multicolor</p><p><b>Pattern Type</b>: Fruit&Vegetable</p><p><b>Season</b>: Summer</p><p><b>Type</b>: Wide Leg</p><p><b>Details</b>: Belted</p><p><b>Details</b>: Paper Bag Waist</p><p><b>Waist Line</b>: Natural</p><p><b>Fit Type</b>: Regular Fit</p><p><b>Sheer</b>: No</p><p><b>Closure Type</b>: Elastic Waist</p><p><b>Material</b>: Polyester</p><p><b>Composition</b>: 100% Polyester</p><p><b>Fabric</b>: Non-Stretch</p><p><b>Care Instructions</b>: Machine wash or professional dry clean</p>,img/Shorts/rw2107120669062993.jpg,,Size#S:M:L:,30.08,,,,1,1,,,Shorts,,Mushroom Print Belted Shorts,Mushroom Print Belted Shorts,Mushroom Print Belted Shorts,,,,,,,,,
THJFOBY0085,Red Sparkly Glitter Tube Top,,<p><b>Style</b>: Sexy</p><p><b>Color</b>: Red</p><p><b>Pattern Type</b>: Plain</p><p><b>Length</b>: Crop</p><p><b>Season</b>: Summer</p><p><b>Details</b>: Drawstring</p><p><b>Sleeve Length</b>: Sleeveless</p><p><b>Fit Type</b>: Slim Fit</p><p><b>Neckline</b>: Strapless</p><p><b>Placket Type</b>: Pullovers</p><p><b>Material</b>: Polyester</p><p><b>Composition</b>: 65% Polyester</p><p><b>Composition</b>: 35% Cotton</p><p><b>Fabric</b>: Slight Stretch</p><p><b>Care Instructions</b>: Machine wash or professional dry clean</p>,img/Women_Tops/swtop01190904470.jpg,,Size#S:M:L:XL:XXL:,29.78,,,,1,1,,,Women Tops,,Red Sparkly Glitter Tube Top,Red Sparkly Glitter Tube Top,Red Sparkly Glitter Tube Top,,,,,,,,,
THJFOBY0086,Cartoon Bear Paw Pendant Necklace,,<p><b>Type</b>: Pendant Necklaces</p><p><b>Material</b>: Alloy</p><p><b>Color</b>: Gold</p><p><b>Metal Color</b>: Gold</p><p><b>Style</b>: Casual</p>,img/Pendant_Necklaces/swneck18200924022.jpg,,Size#,23.85,,,,1,1,,,Pendant Necklaces,,Cartoon Bear Paw Pendant Necklace,Cartoon Bear Paw Pendant Necklace,Cartoon Bear Paw Pendant Necklace,,,,,,,,,
THJFOBY0087,6 Pairs Vintage Trendy Multiple Types Of Shapes Alloy Earrings Set,,"<p>Style: Vintage,Trendy</p><p>Type: Earrings Set</p><p>Weight: 60 g</p><p>Material: Alloy </p><p>Quantity: 6 Pairs </p><p>Package Includes:</p><p>1 x Earrings Set</p><p>Notice:</p>",img/Earrings/SKUH93895.jpg,,Size#,20.44,,,,1,1,,,Earrings,,6 Pairs Vintage Trendy Multiple Types Of Shapes Alloy Earrings Set,6 Pairs Vintage Trendy Multiple Types Of Shapes Alloy Earrings Set,6 Pairs Vintage Trendy Multiple Types Of Shapes Alloy Earrings Set,,,,,,,,,
THJFOBY0088,Women Waterproof Patchwork Casual Shoulder Bag Handbag,,"<p>Bag Type:Satchel</p><p>Color:Blue, Black, Green, Purple, Red, Orange</p><p>Material:Nylon</p><p>Style:Casual</p><p>Decoration:Other</p><p>Hardness:Soft</p>",img/Handbags/SKUF06292.jpg,,Size#,73.53,,,,1,1,,,Handbags,,Women Waterproof Patchwork Casual Shoulder Bag Handbag,Women Waterproof Patchwork Casual Shoulder Bag Handbag,Women Waterproof Patchwork Casual Shoulder Bag Handbag,,,,,,,,,
THJFOBY0089,Women Casual Soft Breathable Hollow Hook Loop Flats,,"<p>Color:Beige, Black, Brown, White, Blue</p><p>Closure Type:Hook & Loop</p><p>Toe Type:Round</p><p>Upper Material:PU</p><p>Style:Casual</p><p>Outsole Material:Rubber</p><p>Occasion:Daily</p><p>Function:Breathable, Soft</p><p>Season:Summer</p>",img/Flats/SKUF64544.jpg,,Size#US 5:US 6:US 7:US 8:US 9:US 10:US 11:,65.91,,,,1,1,,,Flats,,Women Casual Soft Breathable Hollow Hook Loop Flats,Women Casual Soft Breathable Hollow Hook Loop Flats,Women Casual Soft Breathable Hollow Hook Loop Flats,,,,,,,,,
THJFOBY0090,Plus Size Women Knitted Artificial Flower Cloth Flat Shoes Casual Firework Design Slippers,,"<p>Color:Beige</p><p>Type:Garden Shoes</p><p>Closure Type:Slip-On</p><p>Heel Type:Flat</p><p>Heel Height:1-3cm In Flat</p><p>Toe Type:Round</p><p>Pattern:Calico</p><p>Design Element:Floral</p><p>Upper Material:Cloth, Knitted</p><p>Style:Casual</p><p>Outsole Material:Rubber</p><p>Structure:Slip-On</p><p>Occasion:Beach, Holiday</p><p>Function:Hard-wearing</p><p>Season:Summer</p>",img/Slippers/SKUI18650.jpg,,Size#US 5:US 6:US 7:US 8:US 9:US 10:US 11:US 12:,55.24,,,,1,1,,,Slippers,,Plus Size Women Knitted Artificial Flower Cloth Flat Shoes Casual Firework Design Slippers,Plus Size Women Knitted Artificial Flower Cloth Flat Shoes Casual Firework Design Slippers,Plus Size Women Knitted Artificial Flower Cloth Flat Shoes Casual Firework Design Slippers,,,,,,,,,
THJFOBY0091,Floral Print Button Front Belted Cami Dress,,<p><b>Style</b>: Boho</p><p><b>Color</b>: Multicolor</p><p><b>Pattern Type</b>: Floral</p><p><b>Length</b>: Short</p><p><b>Season</b>: Summer</p><p><b>Type</b>: Cami</p><p><b>Details</b>: Belted</p><p><b>Details</b>: Button Front</p><p><b>Sleeve Length</b>: Sleeveless</p><p><b>Neckline</b>: Spaghetti Strap</p><p><b>Waist Line</b>: Natural</p><p><b>Fit Type</b>: Slim Fit</p><p><b>Sheer</b>: No</p><p><b>Hem Shaped</b>: Straight</p><p><b>Material</b>: Polyester</p><p><b>Composition</b>: 100% Polyester</p><p><b>Fabric</b>: Medium Stretch</p><p><b>Care Instructions</b>: Machine wash or professional dry clean</p><p><b>Style</b>: Boho</p><p><b>Color</b>: Multicolor</p><p><b>Pattern Type</b>: Floral</p><p><b>Length</b>: Short</p><p><b>Season</b>: Summer</p><p><b>Type</b>: Cami</p><p><b>Details</b>: Belted</p><p><b>Details</b>: Button Front</p><p><b>Sleeve Length</b>: Sleeveless</p><p><b>Neckline</b>: Spaghetti Strap</p><p><b>Waist Line</b>: Natural</p><p><b>Fit Type</b>: Slim Fit</p><p><b>Sheer</b>: No</p><p><b>Hem Shaped</b>: Flared</p><p><b>Material</b>: Polyester</p><p><b>Composition</b>: 100% Polyester</p><p><b>Fabric</b>: Medium Stretch</p><p><b>Care Instructions</b>: Machine wash or professional dry clean</p>,img/Dresses/rwdress25210602993.jpg,,Size#XS:S:M:L:,25.16,,,,1,1,,,Dresses,,Floral Print Button Front Belted Cami Dress,Floral Print Button Front Belted Cami Dress,Floral Print Button Front Belted Cami Dress,,,,,,,,,
THJFOBY0092,Raglan Sleeve Crop Top,,<p><b>Style</b>: Casual</p><p><b>Color</b>: Multicolor</p><p><b>Pattern Type</b>: Colorblock</p><p><b>Length</b>: Crop</p><p><b>Season</b>: Summer</p><p><b>Sleeve Type</b>: Raglan Sleeve</p><p><b>Neckline</b>: Round Neck</p><p><b>Sleeve Length</b>: Short Sleeve</p><p><b>Fit Type</b>: Regular Fit</p><p><b>Placket Type</b>: Pullovers</p><p><b>Sheer</b>: No</p><p><b>Material</b>: Polyester</p><p><b>Composition</b>: 65% Polyester</p><p><b>Composition</b>: 35% Cotton</p><p><b>Fabric</b>: Medium Stretch</p><p><b>Care Instructions</b>: Machine wash or professional dry clean</p>,img/T___Shirts/rwtee03210122752.jpg,,Size#S:M:L:,30.44,,,,1,1,,,T-Shirts,,Raglan Sleeve Crop Top,Raglan Sleeve Crop Top,Raglan Sleeve Crop Top,,,,,,,,,
THJFOBY0093,Elastic Waist Solid Track Shorts,,<p><b>Style</b>: Sporty</p><p><b>Color</b>: Light Grey</p><p><b>Pattern Type</b>: Plain</p><p><b>Season</b>: Summer</p><p><b>Type</b>: Track Shorts</p><p><b>Waist Line</b>: High Waist</p><p><b>Fit Type</b>: Regular Fit</p><p><b>Sheer</b>: No</p><p><b>Closure Type</b>: Elastic Waist</p><p><b>Material</b>: Polyester</p><p><b>Composition</b>: 63% Polyester</p><p><b>Composition</b>: 32% Cotton</p><p><b>Composition</b>: 5% Elastane</p><p><b>Fabric</b>: Slight Stretch</p><p><b>Care Instructions</b>: Machine wash or professional dry clean</p>,img/Shorts/swshorts07210529653.jpg,,Size#Petite XXS:Petite XS:Petite S:Petite M:Petite L:,26.67,,,,1,1,,,Shorts,,Elastic Waist Solid Track Shorts,Elastic Waist Solid Track Shorts,Elastic Waist Solid Track Shorts,,,,,,,,,
THJFOBY0094,Sun & Moon Print Mesh Crop Top,,<p><b>Style</b>: Sexy</p><p><b>Color</b>: Black</p><p><b>Pattern Type</b>: Graphic</p><p><b>Length</b>: Crop</p><p><b>Season</b>: Spring/Summer</p><p><b>Sleeve Length</b>: Long Sleeve</p><p><b>Neckline</b>: Round Neck</p><p><b>Fit Type</b>: Slim Fit</p><p><b>Sleeve Type</b>: Regular Sleeve</p><p><b>Placket Type</b>: Pullovers</p><p><b>Sheer</b>: Yes</p><p><b>Material</b>: Mesh</p><p><b>Composition</b>: 65% Cotton</p><p><b>Composition</b>: 35% Polyester</p><p><b>Fabric</b>: Slight Stretch</p><p><b>Care Instructions</b>: Machine wash or professional dry clean</p>,img/Women_Tops/rw2106230938811855.jpg,,Size#XS:S:M:L:,28.67,,,,1,1,,,Women Tops,,Sun & Moon Print Mesh Crop Top,Sun & Moon Print Mesh Crop Top,Sun & Moon Print Mesh Crop Top,,,,,,,,,
THJFOBY0095,Faux Pearl Pendant Link Necklace,,<p><b>Details</b>: Pearls</p><p><b>Type</b>: Pendant Necklaces</p><p><b>Color</b>: Silver</p><p><b>Metal Color</b>: Silver</p><p><b>Style</b>: Casual</p>,img/Pendant_Necklaces/necklacenc17111305.jpg,,Size#,21.05,,,,1,1,,,Pendant Necklaces,,Faux Pearl Pendant Link Necklace,Faux Pearl Pendant Link Necklace,Faux Pearl Pendant Link Necklace,,,,,,,,,
THJFOBY0096,Vintage Metal Lace Cut Agate Earrings Geometric Triangle Drop-shaped Swing Earrings,,<p>Style: Vintage</p><p>Type: Earrings</p><p>Color: Antique Silver</p><p>Weight: 7g</p><p>Size: About 38mm*20mm/ 1.49*0.78in</p><p>Material: Alloy</p><p>1 x Earrings</p>,img/Earrings/SKUG15333.jpg,,Size#,13.47,,,,1,1,,,Earrings,,Vintage Metal Lace Cut Agate Earrings Geometric Triangle Drop-shaped Swing Earrings,Vintage Metal Lace Cut Agate Earrings Geometric Triangle Drop-shaped Swing Earrings,Vintage Metal Lace Cut Agate Earrings Geometric Triangle Drop-shaped Swing Earrings,,,,,,,,,
THJFOBY0097,4 PCS PU Leather High-end Handbags For Women Shoulder Bags,,"<p>Bag Type:Bag Set</p><p>Color:Black, Brown</p><p>Material:PU</p><p>Style:Casual</p><p>Decoration:Tassel</p><p>Hardness:Hard</p>",img/Handbags/SKU670218.jpg,,Size#,57.15,,,,1,1,,,Handbags,,4 PCS PU Leather High-end Handbags For Women Shoulder Bags,4 PCS PU Leather High-end Handbags For Women Shoulder Bags,4 PCS PU Leather High-end Handbags For Women Shoulder Bags,,,,,,,,,
THJFOBY0098,Women's Leather Casual Slip On Flat Loafers Shoes,,"<p>Color:Black, Pink, White, Blue</p><p>Type:Loafers</p><p>Closure Type:Slip-On</p><p>Heel Type:Flat</p><p>Heel Height:1-3cm In Flat</p><p>Toe Type:Round</p><p>Pattern:Solid</p><p>Design Element:Simple</p><p>Upper Material:PU</p><p>Style:Casual</p><p>Outsole Material:Rubber</p><p>Structure:Slip-On</p><p>Occasion:Casual</p><p>Function:Breathable, Antiskid, Soft, Hard-wearing</p><p>Season:Summer, Autumn, Spring</p>",img/Flats/SKUG05319.jpg,,Size#US 5:US 6:US 7:US 8:US 9:US 10:,58.12,,,,1,1,,,Flats,,Women's Leather Casual Slip On Flat Loafers Shoes,Women's Leather Casual Slip On Flat Loafers Shoes,Women's Leather Casual Slip On Flat Loafers Shoes,,,,,,,,,
THJFOBY0099,Women Casual Cross Band Peep Toe Platform Slippers,,"<p>Color:Yellow, Black, Pink, Blue</p><p>Heel Type:Platforms</p><p>Toe Type:Peep Toe</p><p>Outsole Material:Rubber</p><p>Function:Breathable</p><p>Season:Summer</p>",img/Slippers/SKUF36317.jpg,,Size#US 5:US 6:US 7:US 8:US 9:US 10:US 11:US 12:,57.29,,,,1,1,,,Slippers,,Women Casual Cross Band Peep Toe Platform Slippers,Women Casual Cross Band Peep Toe Platform Slippers,Women Casual Cross Band Peep Toe Platform Slippers,,,,,,,,,
THJFOBY0100,Solid Shirred Knot Dress,,<p><b>Style</b>: Casual</p><p><b>Color</b>: Baby Blue</p><p><b>Pattern Type</b>: Plain</p><p><b>Length</b>: Short</p><p><b>Season</b>: Summer</p><p><b>Type</b>: Cami</p><p><b>Details</b>: Ruffle</p><p><b>Details</b>: Knot</p><p><b>Details</b>: Shirred</p><p><b>Sleeve Length</b>: Sleeveless</p><p><b>Waist Line</b>: High Waist</p><p><b>Fit Type</b>: Slim Fit</p><p><b>Neckline</b>: Straps</p><p><b>Sheer</b>: No</p><p><b>Hem Shaped</b>: Flared</p><p><b>Material</b>: Cotton</p><p><b>Composition</b>: 65% Cotton</p><p><b>Composition</b>: 35% Polyester</p><p><b>Fabric</b>: Non-Stretch</p><p><b>Care Instructions</b>: Machine wash or professional dry clean</p>,img/Dresses/rwdress25210616982.jpg,,Size#XS:S:M:L:,32.77,,,,1,1,,,Dresses,,Solid Shirred Knot Dress,Solid Shirred Knot Dress,Solid Shirred Knot Dress,,,,,,,,,
