v_sku,v_name,v_short_description,v_description,v_image,v_url,v_attribute,v_price,v_specials_price,v_specials_expire_date,v_date_added,v_in_stock,v_status,v_viewed,v_ordered,v_category_sku,v_sort_order,v_meta_title,v_meta_keywords,v_meta_description,v_brand_filter,v_class_filter,v_color_filter,v_gender_filter,v_material_filter,v_year_filter,v_origin_filter,v_series_filter,v_spec_filter
XAOMUFR0069,3pcs Sun Charm Necklace,,<p><b>Details</b>: Pearls</p><p><b>Type</b>: Pendant Necklaces</p><p><b>Details</b>: Rhinestone</p><p><b>Material</b>: Alloy</p><p><b>Color</b>: Gold</p><p><b>Metal Color</b>: Gold</p><p><b>Style</b>: Casual</p>,img/Pendant_Necklaces/swneck18201008927.jpg,,Size#,26.97,,,,1,1,,,Pendant Necklaces,,3pcs Sun Charm Necklace,3pcs Sun Charm Necklace,3pcs Sun Charm Necklace,,,,,,,,,
XAOMUFR0070,Baby Diaper Nappy Backpack Large Capacity Waterproof Nappy Changing Bag Baby Care Mother Organizer,,"<p>Color:Black, Red</p><p>Material:Nylon</p><p>Style:Casual</p><p>Capacity:4A Magazine, 14 Inch Laptop, 15.6 Inch Laptop, 13.3 Inch Laptop</p>",img/Backpack/SKUE87161.jpg,,Size#,62.38,,,,1,1,,,Backpack,,Baby Diaper Nappy Backpack Large Capacity Waterproof Nappy Changing Bag Baby Care Mother Organizer,Baby Diaper Nappy Backpack Large Capacity Waterproof Nappy Changing Bag Baby Care Mother Organizer,Baby Diaper Nappy Backpack Large Capacity Waterproof Nappy Changing Bag Baby Care Mother Organizer,,,,,,,,,
XAOMUFR0071,Women Casual Breathable Hollow Slip On Flats,,"<p>Color:Green, Red, Beige, Black, White</p><p>Closure Type:Slip-On</p><p>Toe Type:Round</p><p>Upper Material:PU</p><p>Style:Casual</p><p>Outsole Material:Rubber</p><p>Occasion:Daily</p><p>Function:Soft</p><p>Season:Summer</p>",img/Flats/SKUF64553.jpg,,Size#US 5:US 6:US 7:US 8:US 9:,59.57,,,,1,1,,,Flats,,Women Casual Breathable Hollow Slip On Flats,Women Casual Breathable Hollow Slip On Flats,Women Casual Breathable Hollow Slip On Flats,,,,,,,,,
XAOMUFR0072,Large Size Women Fashion Casual Colorful Sequined Hollow Sandals Antiskid Soft Comfy High Heels,,"<p>Color:Beige, Black</p><p>Type:Peep-toe Pumps shoes</p><p>Closure Type:Slip-On</p><p>Heel Type:Stiletto Heel</p><p>Heel Height:5-8cm In Heel</p><p>Toe Type:Round</p><p>Pattern:Other</p><p>Design Element:Hollow out, Sequined</p><p>Style:Casual, Fashion</p><p>Outsole Material:Rubber</p><p>Structure:Slip-On</p><p>Occasion:Casual</p><p>Function:Antiskid, Soft, Hard-wearing</p><p>Season:Summer, Spring</p>",img/Heels/SKUI18588.jpg,,Size#US 5:US 6:US 7:US 8:US 9:US 10:US 11:US 12:,59.07,,,,1,1,,,Heels,,Large Size Women Fashion Casual Colorful Sequined Hollow Sandals Antiskid Soft Comfy High Heels,Large Size Women Fashion Casual Colorful Sequined Hollow Sandals Antiskid Soft Comfy High Heels,Large Size Women Fashion Casual Colorful Sequined Hollow Sandals Antiskid Soft Comfy High Heels,,,,,,,,,
XAOMUFR0073,Colorblock Fire Print Shorts,,<p><b>Style</b>: Casual</p><p><b>Color</b>: Multicolor</p><p><b>Pattern Type</b>: Colorblock</p><p><b>Pattern Type</b>: Fire</p><p><b>Season</b>: Summer</p><p><b>Type</b>: Track Shorts</p><p><b>Waist Line</b>: Natural</p><p><b>Fit Type</b>: Regular Fit</p><p><b>Sheer</b>: No</p><p><b>Closure Type</b>: Elastic Waist</p><p><b>Material</b>: Cotton Blends</p><p><b>Composition</b>: 65% Cotton</p><p><b>Composition</b>: 35% Polyester</p><p><b>Fabric</b>: Slight Stretch</p><p><b>Care Instructions</b>: Machine wash or professional dry clean</p>,img/Shorts/rw2107061954811646.jpg,,Size#S:M:L:,23.14,,,,1,1,,,Shorts,,Colorblock Fire Print Shorts,Colorblock Fire Print Shorts,Colorblock Fire Print Shorts,,,,,,,,,
XAOMUFR0074,Ditsy Floral Chiffon Self-Tie Crop Top,,<p><b>Style</b>: Casual</p><p><b>Color</b>: Multicolor</p><p><b>Pattern Type</b>: Ditsy Floral</p><p><b>Length</b>: Crop</p><p><b>Season</b>: Summer</p><p><b>Type</b>: Top</p><p><b>Details</b>: Knot</p><p><b>Details</b>: Wrap</p><p><b>Sleeve Type</b>: Butterfly Sleeve</p><p><b>Sleeve Length</b>: Cap Sleeve</p><p><b>Fit Type</b>: Regular Fit</p><p><b>Neckline</b>: V neck</p><p><b>Placket Type</b>: Pullovers</p><p><b>Composition</b>: 65% Polyester</p><p><b>Composition</b>: 35% Cotton</p><p><b>Fabric</b>: Non-Stretch</p><p><b>Care Instructions</b>: Machine wash or professional dry clean</p>,img/Blouses/rblo180619303.jpg,,Size#S:M:L:XL:,30.66,,,,1,1,,,Blouses,,Ditsy Floral Chiffon Self-Tie Crop Top,Ditsy Floral Chiffon Self-Tie Crop Top,Ditsy Floral Chiffon Self-Tie Crop Top,,,,,,,,,
XAOMUFR0075,Heart Graphic Ringer Crop Halter Top,,<p><b>Style</b>: Casual</p><p><b>Color</b>: Multicolor</p><p><b>Pattern Type</b>: Heart</p><p><b>Length</b>: Crop</p><p><b>Season</b>: Summer</p><p><b>Type</b>: Halter</p><p><b>Details</b>: Tie Back</p><p><b>Details</b>: Contrast Binding</p><p><b>Neckline</b>: Halter</p><p><b>Fit Type</b>: Slim Fit</p><p><b>Sheer</b>: No</p><p><b>Material</b>: Polyester</p><p><b>Composition</b>: 65% Polyester</p><p><b>Composition</b>: 35% Cotton</p><p><b>Fabric</b>: Slight Stretch</p><p><b>Care Instructions</b>: Machine wash or professional dry clean</p>,img/Tank_Tops__Camis/rwvest25210528107.jpg,,Size#S:M:L:,25.94,,,,1,1,,,Tank Tops & Cam's,,Heart Graphic Ringer Crop Halter Top,Heart Graphic Ringer Crop Halter Top,Heart Graphic Ringer Crop Halter Top,,,,,,,,,
XAOMUFR0076,Eye Graphic Mesh Crop Top,,<p><b>Style</b>: Sexy</p><p><b>Color</b>: Multicolor</p><p><b>Pattern Type</b>: Figure</p><p><b>Length</b>: Crop</p><p><b>Season</b>: Summer</p><p><b>Details</b>: Lettuce Trim</p><p><b>Neckline</b>: Round Neck</p><p><b>Sleeve Length</b>: Short Sleeve</p><p><b>Fit Type</b>: Slim Fit</p><p><b>Sleeve Type</b>: Regular Sleeve</p><p><b>Placket Type</b>: Pullovers</p><p><b>Sheer</b>: Semi-Sheer</p><p><b>Material</b>: Mesh</p><p><b>Composition</b>: 100% Polyester</p><p><b>Fabric</b>: High Stretch</p><p><b>Care Instructions</b>: Machine wash or professional dry clean</p>,img/Women_Tops/sW210617743424322.jpg,,Size#S:M:L:,30.71,,,,1,1,,,Women Tops,,Eye Graphic Mesh Crop Top,Eye Graphic Mesh Crop Top,Eye Graphic Mesh Crop Top,,,,,,,,,
XAOMUFR0077,1 Pair Punk Alien Model Stud Earrings Metal Ear Stud Double Sided Earrings for Women Gift,,"<p>Style: Trendy</p><p>Type: Ear Stud</p><p>Material: Zinc Alloy</p><p>Weight: About 13g</p><p>Main Color: Silver, Black, Gold </p><p>Size: About 4.3cm x 2.5cm / 1.69' x 0.98'</p><p>1 Pairs of Earrings</p>",img/Earrings/SKU830368.jpg,,Size#,11.19,,,,1,1,,,Earrings,,1 Pair Punk Alien Model Stud Earrings Metal Ear Stud Double Sided Earrings for Women Gift,1 Pair Punk Alien Model Stud Earrings Metal Ear Stud Double Sided Earrings for Women Gift,1 Pair Punk Alien Model Stud Earrings Metal Ear Stud Double Sided Earrings for Women Gift,,,,,,,,,
XAOMUFR0078,Metal Bar Pendant Link Necklace,,<p><b>Composition</b>: Metal</p><p><b>Type</b>: Pendant Necklaces</p><p><b>Color</b>: Gold</p><p><b>Metal Color</b>: Gold</p><p><b>Style</b>: Casual</p>,img/Pendant_Necklaces/necklaceNC160317305.jpg,,Size#,19.26,,,,1,1,,,Pendant Necklaces,,Metal Bar Pendant Link Necklace,Metal Bar Pendant Link Necklace,Metal Bar Pendant Link Necklace,,,,,,,,,
XAOMUFR0079,Women Dacron Large Capacity Cat Pattern Printing Backpack,,"<p>Color:Pink, White</p><p>Style:Casual</p><p>Pattern:Cat</p><p>Capacity:14 Inch Laptop</p>",img/Backpack/SKUG83977.jpg,,Size#,70.71,,,,1,1,,,Backpack,,Women Dacron Large Capacity Cat Pattern Printing Backpack,Women Dacron Large Capacity Cat Pattern Printing Backpack,Women Dacron Large Capacity Cat Pattern Printing Backpack,,,,,,,,,
XAOMUFR0080,Women Tassel Decor Slip Resistant Casual Ladies Creepers Brogue Shoes,,"<p>Color:Khaki, Yellow, Pink, Blue, Grey</p><p>Closure Type:Lace-up</p><p>Heel Type:Flat</p><p>Heel Height:1-3cm In Flat</p><p>Toe Type:Round</p><p>Pattern:Color Block</p><p>Design Element:Tassel</p><p>Upper Material:PU</p><p>Style:Casual</p><p>Outsole Material:Rubber</p><p>Function:Hard-wearing</p><p>Season:Summer</p>",img/Flats/SKUF07038.jpg,,Size#US 5:US 6:US 7:US 8:US 9:US 10:US 11:US 12:,64.56,,,,1,1,,,Flats,,Women Tassel Decor Slip Resistant Casual Ladies Creepers Brogue Shoes,Women Tassel Decor Slip Resistant Casual Ladies Creepers Brogue Shoes,Women Tassel Decor Slip Resistant Casual Ladies Creepers Brogue Shoes,,,,,,,,,
XAOMUFR0081,Plush Open Toe Snakeskin Buckle Sandals Pumps,,"<p>Color:Beige, Black</p><p>Heel Type:Stiletto Heel</p><p>Upper Material:PU</p><p>Style:Stylish, Elegant</p><p>Outsole Material:Rubber</p>",img/Heels/SKUA62232.jpg,,Size#US 5:US 6:US 7:US 8:US 9:US 10:US 11:,59.58,,,,1,1,,,Heels,,Plush Open Toe Snakeskin Buckle Sandals Pumps,Plush Open Toe Snakeskin Buckle Sandals Pumps,Plush Open Toe Snakeskin Buckle Sandals Pumps,,,,,,,,,
XAOMUFR0082,Knot Waist Ruffle Hem Shorts,,<p><b>Style</b>: Casual</p><p><b>Color</b>: White</p><p><b>Pattern Type</b>: Plain</p><p><b>Season</b>: Summer</p><p><b>Type</b>: Wide Leg</p><p><b>Details</b>: Drawstring</p><p><b>Details</b>: Ruffle Hem</p><p><b>Waist Line</b>: High Waist</p><p><b>Fit Type</b>: Loose</p><p><b>Sheer</b>: No</p><p><b>Closure Type</b>: Drawstring Waist</p><p><b>Material</b>: Polyester</p><p><b>Composition</b>: 63% Polyester</p><p><b>Composition</b>: 32% Cotton</p><p><b>Composition</b>: 5% Elastane</p><p><b>Fabric</b>: Slight Stretch</p><p><b>Care Instructions</b>: Machine wash or professional dry clean</p>,img/Shorts/swshorts07210525310.jpg,,Size#XS:S:M:L:XL:,30.56,,,,1,1,,,Shorts,,Knot Waist Ruffle Hem Shorts,Knot Waist Ruffle Hem Shorts,Knot Waist Ruffle Hem Shorts,,,,,,,,,
XAOMUFR0083,Ruffled Off-the-Shoulder Smocked Crop Top,,<p><b>Style</b>: Boho</p><p><b>Color</b>: White</p><p><b>Pattern Type</b>: Plain</p><p><b>Length</b>: Crop</p><p><b>Season</b>: Summer</p><p><b>Type</b>: Top</p><p><b>Details</b>: Frill</p><p><b>Details</b>: Shirred</p><p><b>Neckline</b>: Off the Shoulder</p><p><b>Fit Type</b>: Regular Fit</p><p><b>Sleeve Length</b>: Short Sleeve</p><p><b>Placket Type</b>: Pullovers</p><p><b>Body</b>: Lined</p><p><b>Composition</b>: 100% Polyester</p><p><b>Fabric</b>: Non-Stretch</p><p><b>Care Instructions</b>: Machine wash or professional dry clean</p>,img/Blouses/swblouse04190522346.jpg,,Size#XS:S:M:L:,23.6,,,,1,1,,,Blouses,,Ruffled Off-the-Shoulder Smocked Crop Top,Ruffled Off-the-Shoulder Smocked Crop Top,Ruffled Off-the-Shoulder Smocked Crop Top,,,,,,,,,
XAOMUFR0084,Satin Tie Front Peekaboo Cami Top,,<p><b>Style</b>: Sexy</p><p><b>Color</b>: White</p><p><b>Pattern Type</b>: Plain</p><p><b>Length</b>: Crop</p><p><b>Season</b>: Summer</p><p><b>Type</b>: Cami</p><p><b>Details</b>: Cut Out</p><p><b>Details</b>: Criss Cross</p><p><b>Details</b>: Tie Front</p><p><b>Fit Type</b>: Slim Fit</p><p><b>Neckline</b>: Spaghetti Strap</p><p><b>Sheer</b>: No</p><p><b>Material</b>: Satin</p><p><b>Composition</b>: 96% Polyester</p><p><b>Composition</b>: 4% Spandex</p><p><b>Fabric</b>: Slight Stretch</p><p><b>Care Instructions</b>: Machine wash or professional dry clean</p>,img/Tank_Tops__Camis/swvest44210107345.jpg,,Size#XS:S:M:L:,30.68,,,,1,1,,,Tank Tops & Cam's,,Satin Tie Front Peekaboo Cami Top,Satin Tie Front Peekaboo Cami Top,Satin Tie Front Peekaboo Cami Top,,,,,,,,,
XAOMUFR0085,Tie Front Tropical Print Top,,<p><b>Style</b>: Boho</p><p><b>Color</b>: Multicolor</p><p><b>Pattern Type</b>: Tropical</p><p><b>Length</b>: Crop</p><p><b>Season</b>: Summer</p><p><b>Details</b>: Tie Front</p><p><b>Sleeve Type</b>: Batwing Sleeve</p><p><b>Neckline</b>: Deep V Neck</p><p><b>Fit Type</b>: Regular Fit</p><p><b>Sleeve Length</b>: Short Sleeve</p><p><b>Placket Type</b>: Placket</p><p><b>Sheer</b>: No</p><p><b>Chest pad</b>: No Padding</p><p><b>Material</b>: Polyester</p><p><b>Composition</b>: 100% Polyester</p><p><b>Fabric</b>: Non-Stretch</p><p><b>Care Instructions</b>: Machine wash or professional dry clean</p>,img/Women_Tops/swtop07210111963.jpg,,Size#XS:S:M:L:,27.52,,,,1,1,,,Women Tops,,Tie Front Tropical Print Top,Tie Front Tropical Print Top,Tie Front Tropical Print Top,,,,,,,,,
XAOMUFR0086,Vintage Pearl Inlaid tassels Women Earrings Tree Relief Pendant Earrings,,"<p>Style: Vintage</p><p>Type: Earrings</p><p>Color: Ancient Silver </p><p>Weight: 10g</p><p>Size: About 6.4*1.6 cm / 2.52*0.63''</p><p>Material: 925 Silver Plated, Pearl</p><p>1 x Earrings</p>",img/Earrings/SKUG24474.jpg,,Size#,20.18,,,,1,1,,,Earrings,,Vintage Pearl Inlaid tassels Women Earrings Tree Relief Pendant Earrings,Vintage Pearl Inlaid tassels Women Earrings Tree Relief Pendant Earrings,Vintage Pearl Inlaid tassels Women Earrings Tree Relief Pendant Earrings,,,,,,,,,
XAOMUFR0087,Contrast Heart Pendant Chain Necklace,,<p><b>Type</b>: Pendant Necklaces</p><p><b>Color</b>: Silver</p><p><b>Metal Color</b>: Silver</p><p><b>Style</b>: Casual</p>,img/Pendant_Necklaces/necklacenc171128308.jpg,,Size#,11.13,,,,1,1,,,Pendant Necklaces,,Contrast Heart Pendant Chain Necklace,Contrast Heart Pendant Chain Necklace,Contrast Heart Pendant Chain Necklace,,,,,,,,,
XAOMUFR0088,Women Dacron Waterproof Patchwork Laptop Pocket AntiTheft Backpack,,"<p>Style:Preppy, Casual</p><p>Pattern:Solid</p><p>Capacity:4A Magazine</p>",img/Backpack/SKUF24347.jpg,,Size#,71.28,,,,1,1,,,Backpack,,Women Dacron Waterproof Patchwork Laptop Pocket AntiTheft Backpack,Women Dacron Waterproof Patchwork Laptop Pocket AntiTheft Backpack,Women Dacron Waterproof Patchwork Laptop Pocket AntiTheft Backpack,,,,,,,,,
XAOMUFR0089,SOCOFY Flower Tassel Soft Leather Slip On Flat Casual Vintage Shoes,,"<p>Color:Red, Yellow, Purple, Black, Blue</p><p>Type:Loafers, Mule</p><p>Closure Type:Slip-On</p><p>Heel Type:Flat</p><p>Heel Height:1-3cm In Flat</p><p>Toe Type:Round</p><p>Pattern:Calico</p><p>Design Element:Floral</p><p>Upper Material:Leather</p><p>Style:Elegant</p><p>Outsole Material:Rubber</p><p>Structure:Slip-On</p><p>Occasion:Daily</p><p>Function:Breathable, Soft</p><p>Season:Summer, Autumn, Spring</p>",img/Flats/SKU575125.jpg,,Size#US 5:US 6:US 7:US 8:US 9:US 10:,64.56,,,,1,1,,,Flats,,SOCOFY Flower Tassel Soft Leather Slip On Flat Casual Vintage Shoes,SOCOFY Flower Tassel Soft Leather Slip On Flat Casual Vintage Shoes,SOCOFY Flower Tassel Soft Leather Slip On Flat Casual Vintage Shoes,,,,,,,,,
XAOMUFR0090,Large Size Buckle Chunky Heel Retro Casual Pumps,,"<p>Color:Red, Brown, Blue</p><p>Type:Mary Jane</p><p>Closure Type:Buckle</p><p>Heel Type:Chunky Heel</p><p>Heel Height:3-5cm In Low Heel</p><p>Toe Type:Square</p><p>Pattern:Solid</p><p>Upper Material:PU</p><p>Style:Casual</p><p>Outsole Material:Rubber</p><p>Occasion:Casual</p><p>Function:Breathable</p><p>Season:Summer, Spring&Fall</p>",img/Heels/SKUC26190.jpg,,Size#US 5:US 6:US 7:US 8:US 9:US 10:US 11:US 12:,59.38,,,,1,1,,,Heels,,Large Size Buckle Chunky Heel Retro Casual Pumps,Large Size Buckle Chunky Heel Retro Casual Pumps,Large Size Buckle Chunky Heel Retro Casual Pumps,,,,,,,,,
XAOMUFR0091,ROMWE X Vwpstd Letter Graphic Two Tone Shorts,,<p><b>Style</b>: Casual</p><p><b>Color</b>: Multicolor</p><p><b>Pattern Type</b>: Colorblock</p><p><b>Pattern Type</b>: Graphic</p><p><b>Season</b>: Summer</p><p><b>Type</b>: Track Shorts</p><p><b>Waist Line</b>: Natural</p><p><b>Fit Type</b>: Regular Fit</p><p><b>Sheer</b>: No</p><p><b>Closure Type</b>: Elastic Waist</p><p><b>Material</b>: Polyester</p><p><b>Composition</b>: 95% Polyester</p><p><b>Composition</b>: 5% Spandex</p><p><b>Fabric</b>: Non-Stretch</p><p><b>Care Instructions</b>: Machine wash or professional dry clean</p>,img/Shorts/rwshorts25210603236.jpg,,Size#S:M:L:,29.29,,,,1,1,,,Shorts,,ROMWE X Vwpstd Letter Graphic Two Tone Shorts,ROMWE X Vwpstd Letter Graphic Two Tone Shorts,ROMWE X Vwpstd Letter Graphic Two Tone Shorts,,,,,,,,,
XAOMUFR0092,Solid Drawstring Puff Sleeve Sweetheart Neck Crop Blouse,,<p><b>Style</b>: Casual</p><p><b>Color</b>: White</p><p><b>Pattern Type</b>: Plain</p><p><b>Length</b>: Crop</p><p><b>Season</b>: Summer</p><p><b>Type</b>: Top</p><p><b>Details</b>: Drawstring</p><p><b>Details</b>: Ruched</p><p><b>Sleeve Type</b>: Puff Sleeve</p><p><b>Fit Type</b>: Regular Fit</p><p><b>Sleeve Length</b>: Short Sleeve</p><p><b>Neckline</b>: Sweetheart</p><p><b>Sheer</b>: No</p><p><b>Placket Type</b>: Pullovers</p><p><b>Material</b>: Cotton</p><p><b>Composition</b>: 65% Cotton</p><p><b>Composition</b>: 35% Polyester</p><p><b>Fabric</b>: Non-Stretch</p><p><b>Care Instructions</b>: Machine wash or professional dry clean</p>,img/Blouses/rW210513375169913.jpg,,Size#S:M:L:,30.59,,,,1,1,,,Blouses,,Solid Drawstring Puff Sleeve Sweetheart Neck Crop Blouse,Solid Drawstring Puff Sleeve Sweetheart Neck Crop Blouse,Solid Drawstring Puff Sleeve Sweetheart Neck Crop Blouse,,,,,,,,,
XAOMUFR0093,Heart Graphic Drawstring Ruched Ribbed Tank Top,,<p><b>Style</b>: Casual</p><p><b>Color</b>: Black</p><p><b>Pattern Type</b>: Heart</p><p><b>Length</b>: Crop</p><p><b>Season</b>: Summer</p><p><b>Type</b>: Tank</p><p><b>Details</b>: Drawstring</p><p><b>Details</b>: Ruched</p><p><b>Details</b>: Rib-Knit</p><p><b>Neckline</b>: Scoop Neck</p><p><b>Fit Type</b>: Slim Fit</p><p><b>Sheer</b>: No</p><p><b>Material</b>: Cotton Blends</p><p><b>Composition</b>: 65% Cotton</p><p><b>Composition</b>: 35% Polyester</p><p><b>Fabric</b>: Medium Stretch</p><p><b>Care Instructions</b>: Machine wash or professional dry clean</p>,img/Tank_Tops__Camis/rwvest25210604942.jpg,,Size#S:M:L:,29.02,,,,1,1,,,Tank Tops & Cam's,,Heart Graphic Drawstring Ruched Ribbed Tank Top,Heart Graphic Drawstring Ruched Ribbed Tank Top,Heart Graphic Drawstring Ruched Ribbed Tank Top,,,,,,,,,
XAOMUFR0094,Ditsy Floral Off The Shoulder Shirred Crop Top,,<p><b>Style</b>: Boho</p><p><b>Color</b>: Red</p><p><b>Pattern Type</b>: Ditsy Floral</p><p><b>Length</b>: Crop</p><p><b>Season</b>: Summer</p><p><b>Details</b>: Shirred</p><p><b>Neckline</b>: Off the Shoulder</p><p><b>Sleeve Length</b>: Short Sleeve</p><p><b>Fit Type</b>: Slim Fit</p><p><b>Sleeve Type</b>: Regular Sleeve</p><p><b>Placket Type</b>: Pullovers</p><p><b>Sheer</b>: No</p><p><b>Body</b>: Unlined</p><p><b>Material</b>: Polyester</p><p><b>Composition</b>: 100% Polyester</p><p><b>Fabric</b>: Slight Stretch</p><p><b>Care Instructions</b>: Machine wash or professional dry clean</p>,img/Women_Tops/rwtop25210608093.jpg,,Size#S:M:L:XL:,31.59,,,,1,1,,,Women Tops,,Ditsy Floral Off The Shoulder Shirred Crop Top,Ditsy Floral Off The Shoulder Shirred Crop Top,Ditsy Floral Off The Shoulder Shirred Crop Top,,,,,,,,,
XAOMUFR0095,Vintage Geometric Metal Handmade Natural Stone Pendant Earrings Blue Irregular Marble Pattern Earrings,,<p>Style: Vintage</p><p>Type: Earrings</p><p>Main Color: Blue</p><p>Weight: 8g</p><p>Size: 35mm*8.5mm/1.37*0.33in</p><p>Material: Alloy</p><p>1 X Earrings</p>,img/Earrings/SKUF42311.jpg,,Size#,25.76,,,,1,1,,,Earrings,,Vintage Geometric Metal Handmade Natural Stone Pendant Earrings Blue Irregular Marble Pattern Earrings,Vintage Geometric Metal Handmade Natural Stone Pendant Earrings Blue Irregular Marble Pattern Earrings,Vintage Geometric Metal Handmade Natural Stone Pendant Earrings Blue Irregular Marble Pattern Earrings,,,,,,,,,
XAOMUFR0096,Letter Charm Necklace,,<p><b>Type</b>: Pendant Necklaces</p><p><b>Material</b>: Alloy</p><p><b>Color</b>: Gold</p><p><b>Metal Color</b>: Gold</p><p><b>Style</b>: Casual</p><p><b>Type</b>: Pendant Necklaces</p><p><b>Material</b>: Alloy</p><p><b>Color</b>: Silver</p><p><b>Metal Color</b>: Silver</p><p><b>Style</b>: Casual</p>,img/Pendant_Necklaces/swneck18200922658.jpg,,Size#,14.94,,,,1,1,,,Pendant Necklaces,,Letter Charm Necklace,Letter Charm Necklace,Letter Charm Necklace,,,,,,,,,
XAOMUFR0097,Women 3Pcs Printed Dinosaur School Backpack Meal Bag Pencil Case,,<p>Color:Green</p><p>Material:Nylon</p><p>Style:Preppy</p><p>Capacity:4A Magazine</p>,img/Backpack/SKUF36365.jpg,,Size#,61.57,,,,1,1,,,Backpack,,Women 3Pcs Printed Dinosaur School Backpack Meal Bag Pencil Case,Women 3Pcs Printed Dinosaur School Backpack Meal Bag Pencil Case,Women 3Pcs Printed Dinosaur School Backpack Meal Bag Pencil Case,,,,,,,,,
XAOMUFR0098,Women Casual Soft Rivet Slip On Round Toe Flat Loafers,,<p>Color:Pink</p><p>Closure Type:Slip-On</p><p>Toe Type:Round</p><p>Upper Material:PU</p><p>Style:Casual</p><p>Outsole Material:PU</p><p>Occasion:Daily</p><p>Function:Soft</p><p>Season:Summer</p>,img/Flats/SKUF41162.jpg,,Size#US 4:US 5:US 6:US 7:US 8:US 9:US 10:US 11:US 12:,60.55,,,,1,1,,,Flats,,Women Casual Soft Rivet Slip On Round Toe Flat Loafers,Women Casual Soft Rivet Slip On Round Toe Flat Loafers,Women Casual Soft Rivet Slip On Round Toe Flat Loafers,,,,,,,,,
XAOMUFR0099,SOCOFY Fresh Natural Style Flowers Printed Cowhide Leather Comfy Wearable Lace Up Casual Pumps,,"<p>Color:Green</p><p>Type:Oxfords, Loafers</p><p>Closure Type:Lace-up</p><p>Heel Type:Chunky Heel</p><p>Heel Height:3-5cm In Low Heel</p><p>Toe Type:Round</p><p>Pattern:Calico</p><p>Design Element:Pattern, Stitching</p><p>Style:Casual, Natural</p><p>Outsole Material:Rubber</p><p>Structure:Lace-up</p><p>Occasion:Party, Casual</p><p>Function:Hard-wearing</p><p>Season:Summer, Spring&Fall</p>",img/Heels/SKUG97834.jpg,,Size#US 5:US 6:US 7:US 8:US 9.5:US 10.5:US 11.5:,64.92,,,,1,1,,,Heels,,SOCOFY Fresh Natural Style Flowers Printed Cowhide Leather Comfy Wearable Lace Up Casual Pumps,SOCOFY Fresh Natural Style Flowers Printed Cowhide Leather Comfy Wearable Lace Up Casual Pumps,SOCOFY Fresh Natural Style Flowers Printed Cowhide Leather Comfy Wearable Lace Up Casual Pumps,,,,,,,,,
XAOMUFR0100,Striped Belted Paperbag Waist Shorts,,<p><b>Style</b>: Boho</p><p><b>Color</b>: Multicolor</p><p><b>Pattern Type</b>: Striped</p><p><b>Season</b>: Summer</p><p><b>Type</b>: Wide Leg</p><p><b>Details</b>: Belted</p><p><b>Details</b>: Paper Bag Waist</p><p><b>Fit Type</b>: Loose</p><p><b>Waist Line</b>: Natural</p><p><b>Sheer</b>: No</p><p><b>Closure Type</b>: Elastic Waist</p><p><b>Belt</b>: Yes</p><p><b>Material</b>: Polyester</p><p><b>Composition</b>: 95% Polyester</p><p><b>Composition</b>: 5% Spandex</p><p><b>Fabric</b>: Slight Stretch</p><p><b>Care Instructions</b>: Machine wash or professional dry clean</p>,img/Shorts/swshorts23201230415.jpg,,Size#S:M:L:XL:,29.8,,,,1,1,,,Shorts,,Striped Belted Paperbag Waist Shorts,Striped Belted Paperbag Waist Shorts,Striped Belted Paperbag Waist Shorts,,,,,,,,,
XAOMUFR0101,Solid Button Front Fake Pocket Blouse,,<p><b>Style</b>: Casual</p><p><b>Color</b>: Beige</p><p><b>Pattern Type</b>: Plain</p><p><b>Length</b>: Regular</p><p><b>Season</b>: Spring/Fall</p><p><b>Type</b>: Shirt</p><p><b>Details</b>: Button Front</p><p><b>Neckline</b>: Collar</p><p><b>Sleeve Length</b>: Long Sleeve</p><p><b>Fit Type</b>: Regular Fit</p><p><b>Sleeve Type</b>: Regular Sleeve</p><p><b>Sheer</b>: No</p><p><b>Placket Type</b>: Placket</p><p><b>Material</b>: Polyester</p><p><b>Composition</b>: 95% Polyester</p><p><b>Composition</b>: 5% Elastane</p><p><b>Fabric</b>: Slight Stretch</p><p><b>Care Instructions</b>: Machine wash or professional dry clean</p>,img/Blouses/sW210608353651612.jpg,,Size#S:M:L:,29.86,,,,1,1,,,Blouses,,Solid Button Front Fake Pocket Blouse,Solid Button Front Fake Pocket Blouse,Solid Button Front Fake Pocket Blouse,,,,,,,,,
XAOMUFR0102,Solid Criss Cross Crop Cami,,<p><b>Style</b>: Casual</p><p><b>Color</b>: White</p><p><b>Pattern Type</b>: Plain</p><p><b>Length</b>: Crop</p><p><b>Season</b>: Summer</p><p><b>Type</b>: Cami</p><p><b>Details</b>: Criss Cross</p><p><b>Fit Type</b>: Slim Fit</p><p><b>Neckline</b>: Spaghetti Strap</p><p><b>Sheer</b>: No</p><p><b>Material</b>: Polyester</p><p><b>Composition</b>: 90% Polyester</p><p><b>Composition</b>: 10% Spandex</p><p><b>Fabric</b>: High Stretch</p><p><b>Care Instructions</b>: Machine wash or professional dry clean</p><p><b>Style</b>: Casual</p><p><b>Color</b>: Black</p><p><b>Pattern Type</b>: Plain</p><p><b>Length</b>: Crop</p><p><b>Season</b>: Summer</p><p><b>Type</b>: Cami</p><p><b>Details</b>: Criss Cross</p><p><b>Fit Type</b>: Slim Fit</p><p><b>Neckline</b>: Spaghetti Strap</p><p><b>Sheer</b>: No</p><p><b>Material</b>: Polyester</p><p><b>Composition</b>: 90% Polyester</p><p><b>Composition</b>: 10% Spandex</p><p><b>Fabric</b>: High Stretch</p><p><b>Care Instructions</b>: Machine wash or professional dry clean</p>,img/Tank_Tops__Camis/rwvest03200730340.jpg,,Size#XS:S:M:L:XL:XXL:,26.65,,,,1,1,,,Tank Tops & Cam's,,Solid Criss Cross Crop Cami,Solid Criss Cross Crop Cami,Solid Criss Cross Crop Cami,,,,,,,,,
XAOMUFR0103,Tropical Shirred Tube Top,,<p><b>Style</b>: Boho</p><p><b>Color</b>: Multicolor</p><p><b>Pattern Type</b>: Plants</p><p><b>Length</b>: Crop</p><p><b>Season</b>: Summer</p><p><b>Details</b>: Shirred</p><p><b>Sleeve Length</b>: Sleeveless</p><p><b>Fit Type</b>: Slim Fit</p><p><b>Neckline</b>: Strapless</p><p><b>Placket Type</b>: Pullovers</p><p><b>Sheer</b>: No</p><p><b>Material</b>: Cotton</p><p><b>Composition</b>: 65% Cotton</p><p><b>Composition</b>: 35% Polyester</p><p><b>Fabric</b>: Non-Stretch</p><p><b>Care Instructions</b>: Machine wash or professional dry clean</p>,img/Women_Tops/rw2106232249775174.jpg,,Size#S:M:L:,32.97,,,,1,1,,,Women Tops,,Tropical Shirred Tube Top,Tropical Shirred Tube Top,Tropical Shirred Tube Top,,,,,,,,,
XAOMUFR0104,Vintage White Moonstone Pendant Earrings Metal Rhinestone Dripping Earrings,,"<p>Style : Vintage</p><p>Type : Earrings</p><p>Main Color : Purple,Black,Red</p><p>Szie : 2.8cm/1.1in</p><p>Weight : About 8.37g</p><p>Material : Alloy,Moonstone</p><p>1 X Earrings</p>",img/Earrings/SKUE37712.jpg,,Size#,12.91,,,,1,1,,,Earrings,,Vintage White Moonstone Pendant Earrings Metal Rhinestone Dripping Earrings,Vintage White Moonstone Pendant Earrings Metal Rhinestone Dripping Earrings,Vintage White Moonstone Pendant Earrings Metal Rhinestone Dripping Earrings,,,,,,,,,
