v_sku,v_name,v_short_description,v_description,v_image,v_url,v_attribute,v_price,v_specials_price,v_specials_expire_date,v_date_added,v_in_stock,v_status,v_viewed,v_ordered,v_category_sku,v_sort_order,v_meta_title,v_meta_keywords,v_meta_description,v_brand_filter,v_class_filter,v_color_filter,v_gender_filter,v_material_filter,v_year_filter,v_origin_filter,v_series_filter,v_spec_filter
XAOMUFR0001,Letter Cartoon Bear Graphic Shorts,,<p><b>Style</b>: Casual</p><p><b>Color</b>: Black</p><p><b>Pattern Type</b>: Letter</p><p><b>Pattern Type</b>: Cartoon</p><p><b>Season</b>: Summer</p><p><b>Type</b>: Track Shorts</p><p><b>Waist Line</b>: Natural</p><p><b>Fit Type</b>: Regular Fit</p><p><b>Sheer</b>: No</p><p><b>Closure Type</b>: Elastic Waist</p><p><b>Material</b>: Cotton</p><p><b>Composition</b>: 65% Cotton</p><p><b>Composition</b>: 35% Polyester</p><p><b>Fabric</b>: Medium Stretch</p><p><b>Care Instructions</b>: Machine wash or professional dry clean</p>,img/Shorts/sW210602587841350.jpg,,Size#S:M:L:,28.84,,,,1,1,,,Shorts,,Letter Cartoon Bear Graphic Shorts,Letter Cartoon Bear Graphic Shorts,Letter Cartoon Bear Graphic Shorts,,,,,,,,,
XAOMUFR0002,Tartan Oversized Shirt,,<p><b>Style</b>: Preppy</p><p><b>Color</b>: Multicolor</p><p><b>Pattern Type</b>: Tartan</p><p><b>Length</b>: Long</p><p><b>Season</b>: Spring/Fall</p><p><b>Type</b>: Shirt</p><p><b>Details</b>: Button Front</p><p><b>Neckline</b>: Collar</p><p><b>Sleeve Length</b>: Long Sleeve</p><p><b>Fit Type</b>: Oversized</p><p><b>Sleeve Type</b>: Drop Shoulder</p><p><b>Sheer</b>: No</p><p><b>Placket Type</b>: Placket</p><p><b>Material</b>: Polyester</p><p><b>Composition</b>: 65% Polyester</p><p><b>Composition</b>: 35% Cotton</p><p><b>Fabric</b>: Non-Stretch</p><p><b>Care Instructions</b>: Machine wash or professional dry clean</p>,img/Blouses/rwblouse01200925848.jpg,,Size#XS:S:M:L:XL:,23.39,,,,1,1,,,Blouses,,Tartan Oversized Shirt,Tartan Oversized Shirt,Tartan Oversized Shirt,,,,,,,,,
XAOMUFR0003,Colorblock Ribbed Tank Top,,<p><b>Style</b>: Casual</p><p><b>Color</b>: Brown</p><p><b>Pattern Type</b>: Colorblock</p><p><b>Length</b>: Crop</p><p><b>Season</b>: Summer</p><p><b>Type</b>: Tank</p><p><b>Details</b>: Cut Out</p><p><b>Details</b>: Rib-Knit</p><p><b>Neckline</b>: Round Neck</p><p><b>Fit Type</b>: Slim Fit</p><p><b>Sheer</b>: No</p><p><b>Material</b>: Polyester</p><p><b>Composition</b>: 95% Polyester</p><p><b>Composition</b>: 5% Spandex</p><p><b>Fabric</b>: High Stretch</p><p><b>Care Instructions</b>: Machine wash or professional dry clean</p><p><b>Style</b>: Casual</p><p><b>Color</b>: Multicolor</p><p><b>Pattern Type</b>: Colorblock</p><p><b>Length</b>: Crop</p><p><b>Season</b>: Summer</p><p><b>Type</b>: Tank</p><p><b>Details</b>: Cut Out</p><p><b>Details</b>: Rib-Knit</p><p><b>Neckline</b>: Round Neck</p><p><b>Fit Type</b>: Slim Fit</p><p><b>Sheer</b>: No</p><p><b>Material</b>: Polyester</p><p><b>Composition</b>: 95% Polyester</p><p><b>Composition</b>: 5% Spandex</p><p><b>Fabric</b>: High Stretch</p><p><b>Care Instructions</b>: Machine wash or professional dry clean</p><p><b>Style</b>: Casual</p><p><b>Color</b>: Multicolor</p><p><b>Pattern Type</b>: Colorblock</p><p><b>Length</b>: Crop</p><p><b>Season</b>: Summer</p><p><b>Type</b>: Tank</p><p><b>Details</b>: Cut Out</p><p><b>Details</b>: Rib-Knit</p><p><b>Neckline</b>: Round Neck</p><p><b>Fit Type</b>: Slim Fit</p><p><b>Sheer</b>: No</p><p><b>Material</b>: Polyester</p><p><b>Composition</b>: 95% Polyester</p><p><b>Composition</b>: 5% Spandex</p><p><b>Fabric</b>: High Stretch</p><p><b>Care Instructions</b>: Machine wash or professional dry clean</p><p><b>Style</b>: Casual</p><p><b>Color</b>: Multicolor</p><p><b>Pattern Type</b>: Colorblock</p><p><b>Length</b>: Crop</p><p><b>Season</b>: Summer</p><p><b>Type</b>: Tank</p><p><b>Details</b>: Cut Out</p><p><b>Details</b>: Rib-Knit</p><p><b>Neckline</b>: Round Neck</p><p><b>Fit Type</b>: Slim Fit</p><p><b>Sheer</b>: No</p><p><b>Material</b>: Polyester</p><p><b>Composition</b>: 95% Polyester</p><p><b>Composition</b>: 5% Spandex</p><p><b>Fabric</b>: High Stretch</p><p><b>Care Instructions</b>: Machine wash or professional dry clean</p>,img/Tank_Tops__Camis/rwvest25210609812.jpg,,Size#XS:S:M:L:,32.32,,,,1,1,,,Tank Tops & Cam's,,Colorblock Ribbed Tank Top,Colorblock Ribbed Tank Top,Colorblock Ribbed Tank Top,,,,,,,,,
XAOMUFR0004,Lace Tie Front Top,,<p><b>Style</b>: Sexy</p><p><b>Color</b>: Khaki</p><p><b>Length</b>: Crop</p><p><b>Season</b>: Summer</p><p><b>Details</b>: Tie Front</p><p><b>Fit Type</b>: Regular Fit</p><p><b>Sleeve Length</b>: Short Sleeve</p><p><b>Neckline</b>: V neck</p><p><b>Sleeve Type</b>: Regular Sleeve</p><p><b>Placket Type</b>: Placket</p><p><b>Sheer</b>: No</p><p><b>Material</b>: Mesh</p><p><b>Composition</b>: 65% Polyester</p><p><b>Composition</b>: 30% Cotton</p><p><b>Composition</b>: 5% Elastane</p><p><b>Fabric</b>: Slight Stretch</p><p><b>Care Instructions</b>: Machine wash or professional dry clean</p>,img/Women_Tops/rwtop25210618592.jpg,,Size#S:M:L:,28.64,,,,1,1,,,Women Tops,,Lace Tie Front Top,Lace Tie Front Top,Lace Tie Front Top,,,,,,,,,
XAOMUFR0005,Trendy Cherry Pendant Earrings Transparent Dried Petal Fruit Shape Earrings,,"<p>Style: </p><p>Elegant,</p><p>Trendy.</p><p>Type: Earrings</p><p>Color: Red.</p><p>Weight:16.2</p><p>g</p><p>Size: </p><p>About </p><p>8cm /3.15 in</p><p>Material: Glaze.</p><p>1 x Earrings</p>",img/Earrings/SKUH35758.jpg,,Size#,18.65,,,,1,1,,,Earrings,,Trendy Cherry Pendant Earrings Transparent Dried Petal Fruit Shape Earrings,Trendy Cherry Pendant Earrings Transparent Dried Petal Fruit Shape Earrings,Trendy Cherry Pendant Earrings Transparent Dried Petal Fruit Shape Earrings,,,,,,,,,
XAOMUFR0006,Bottle Flower Pendant Chain Necklace,,<p><b>Type</b>: Pendant Necklaces</p><p><b>Color</b>: Multicolor</p><p><b>Metal Color</b>: Silver</p><p><b>Style</b>: Boho</p>,img/Pendant_Necklaces/necklacenc180307322.jpg,,Size#,21.34,,,,1,1,,,Pendant Necklaces,,Bottle Flower Pendant Chain Necklace,Bottle Flower Pendant Chain Necklace,Bottle Flower Pendant Chain Necklace,,,,,,,,,
XAOMUFR0007,Women Oxford Patchwork Waterproof Anti theft Mommy Handbag Shoulder Bag Backpack,,"<p>Color:Blue, Black, Beige, Pink</p><p>Style:Preppy, Casual</p><p>Decoration:Other</p><p>Capacity:4A Magazine</p>",img/Backpack/SKUF24363.jpg,,Size#,70.6,,,,1,1,,,Backpack,,Women Oxford Patchwork Waterproof Anti theft Mommy Handbag Shoulder Bag Backpack,Women Oxford Patchwork Waterproof Anti theft Mommy Handbag Shoulder Bag Backpack,Women Oxford Patchwork Waterproof Anti theft Mommy Handbag Shoulder Bag Backpack,,,,,,,,,
XAOMUFR0008,Women Sweet Casual Calico Band Hook Loop Hollow Out Comfortable Comfotable Flat Loafers Shoes,,"<p>Color:Orange, Green, Red, Pink, White</p><p>Type:Loafers</p><p>Closure Type:Hook & Loop</p><p>Heel Type:Flat</p><p>Heel Height:1-3cm In Flat</p><p>Toe Type:Round</p><p>Pattern:Calico, Floral</p><p>Design Element:Hollow out, Floral</p><p>Upper Material:PU</p><p>Style:Casual, Retro, Sweet/Cute</p><p>Outsole Material:Rubber</p><p>Structure:Hook & Loop</p><p>Occasion:Casual</p><p>Function:Breathable, Hard-wearing</p><p>Season:All Season</p>",img/Flats/SKUH25573.jpg,,Size#US 5:US 6:US 7:US 8:US 9:,51.49,,,,1,1,,,Flats,,Women Sweet Casual Calico Band Hook Loop Hollow Out Comfortable Comfotable Flat Loafers Shoes,Women Sweet Casual Calico Band Hook Loop Hollow Out Comfortable Comfotable Flat Loafers Shoes,Women Sweet Casual Calico Band Hook Loop Hollow Out Comfortable Comfotable Flat Loafers Shoes,,,,,,,,,
XAOMUFR0009,SOCOFY Retro Hand Stitching Printed Cowhide Leather Comfy Wearable Lace Up Casual Pumps,,"<p>Color:Brown</p><p>Type:Loafers</p><p>Closure Type:Lace-up</p><p>Heel Type:Chunky Heel</p><p>Heel Height:3-5cm In Low Heel</p><p>Toe Type:Round</p><p>Pattern:Calico</p><p>Design Element:Print, Stitching</p><p>Style:Casual, Retro</p><p>Outsole Material:Rubber</p><p>Structure:Lace-up</p><p>Occasion:Party, Casual</p><p>Function:Hard-wearing</p><p>Season:Summer, Spring&Fall</p>",img/Heels/SKUG97931.jpg,,Size#US 5:US 6:US 7:US 8:US 9.5:US 10.5:US 11.5:,57.76,,,,1,1,,,Heels,,SOCOFY Retro Hand Stitching Printed Cowhide Leather Comfy Wearable Lace Up Casual Pumps,SOCOFY Retro Hand Stitching Printed Cowhide Leather Comfy Wearable Lace Up Casual Pumps,SOCOFY Retro Hand Stitching Printed Cowhide Leather Comfy Wearable Lace Up Casual Pumps,,,,,,,,,
XAOMUFR0010,Ditsy Floral Contrast Binding Shorts,,<p><b>Style</b>: Casual</p><p><b>Color</b>: Black and White</p><p><b>Pattern Type</b>: Ditsy Floral</p><p><b>Type</b>: Straight Leg</p><p><b>Season</b>: Summer</p><p><b>Details</b>: Drawstring</p><p><b>Details</b>: Contrast Binding</p><p><b>Waist Line</b>: Natural</p><p><b>Fit Type</b>: Regular Fit</p><p><b>Sheer</b>: No</p><p><b>Closure Type</b>: Drawstring Waist</p><p><b>Material</b>: Polyester</p><p><b>Composition</b>: 100% Polyester</p><p><b>Fabric</b>: Non-Stretch</p><p><b>Care Instructions</b>: Machine wash or professional dry clean</p>,img/Shorts/swshorts25210508999.jpg,,Size#XS:S:M:L:,25.46,,,,1,1,,,Shorts,,Ditsy Floral Contrast Binding Shorts,Ditsy Floral Contrast Binding Shorts,Ditsy Floral Contrast Binding Shorts,,,,,,,,,
XAOMUFR0011,ROMWE X Ilustrata Cartoon Graphic Button Front Blouse,,<p><b>Style</b>: Casual</p><p><b>Color</b>: Black</p><p><b>Pattern Type</b>: Graphic</p><p><b>Length</b>: Long</p><p><b>Season</b>: Summer</p><p><b>Type</b>: Shirt</p><p><b>Details</b>: Button Front</p><p><b>Neckline</b>: Collar</p><p><b>Fit Type</b>: Regular Fit</p><p><b>Sleeve Length</b>: Short Sleeve</p><p><b>Sleeve Type</b>: Regular Sleeve</p><p><b>Sheer</b>: No</p><p><b>Placket Type</b>: Placket</p><p><b>Material</b>: Polyester</p><p><b>Composition</b>: 100% Polyester</p><p><b>Fabric</b>: Non-Stretch</p><p><b>Care Instructions</b>: Machine wash or professional dry clean</p>,img/Blouses/sW210617603998968.jpg,,Size#S:M:L:,22.09,,,,1,1,,,Blouses,,ROMWE X Ilustrata Cartoon Graphic Button Front Blouse,ROMWE X Ilustrata Cartoon Graphic Button Front Blouse,ROMWE X Ilustrata Cartoon Graphic Button Front Blouse,,,,,,,,,
XAOMUFR0012,Solid Lace Up Tank Top,,<p><b>Style</b>: Casual</p><p><b>Color</b>: Black</p><p><b>Pattern Type</b>: Plain</p><p><b>Length</b>: Crop</p><p><b>Season</b>: Summer</p><p><b>Type</b>: Tank</p><p><b>Details</b>: Lace Up</p><p><b>Fit Type</b>: Regular Fit</p><p><b>Neckline</b>: Scoop Neck</p><p><b>Sheer</b>: No</p><p><b>Material</b>: Polyester</p><p><b>Composition</b>: 95% Polyester</p><p><b>Composition</b>: 5% Spandex</p><p><b>Fabric</b>: Medium Stretch</p><p><b>Care Instructions</b>: Machine wash or professional dry clean</p>,img/Tank_Tops__Camis/rwvest25210526861.jpg,,Size#S:M:L:,32.94,,,,1,1,,,Tank Tops & Cam's,,Solid Lace Up Tank Top,Solid Lace Up Tank Top,Solid Lace Up Tank Top,,,,,,,,,
XAOMUFR0013,Solid Off The Shoulder Hanky Hem Top,,<p><b>Style</b>: Sexy</p><p><b>Color</b>: White</p><p><b>Pattern Type</b>: Plain</p><p><b>Length</b>: Crop</p><p><b>Season</b>: Summer</p><p><b>Neckline</b>: Off the Shoulder</p><p><b>Fit Type</b>: Slim Fit</p><p><b>Placket Type</b>: Pullovers</p><p><b>Sheer</b>: No</p><p><b>Belt</b>: No</p><p><b>Body</b>: Unlined</p><p><b>Chest pad</b>: No Padding</p><p><b>Material</b>: Polyester</p><p><b>Composition</b>: 91% Polyester</p><p><b>Composition</b>: 9% Elastane</p><p><b>Fabric</b>: High Stretch</p><p><b>Care Instructions</b>: Machine wash or professional dry clean</p>,img/Women_Tops/swtop44210527450.jpg,,Size#XS:S:M:L:,24.88,,,,1,1,,,Women Tops,,Solid Off The Shoulder Hanky Hem Top,Solid Off The Shoulder Hanky Hem Top,Solid Off The Shoulder Hanky Hem Top,,,,,,,,,
XAOMUFR0014,Vintage Resin Printed Pendant Earrings Metal Irregular Water Drop Earrings,,<p>Style: Vintage</p><p>Type: Earrings</p><p>Main Color: Gold</p><p>Weight: About 20g</p><p>Material: Alloy</p><p>1 X Earrings</p>,img/Earrings/SKUF26116.jpg,,Size#,11.7,,,,1,1,,,Earrings,,Vintage Resin Printed Pendant Earrings Metal Irregular Water Drop Earrings,Vintage Resin Printed Pendant Earrings Metal Irregular Water Drop Earrings,Vintage Resin Printed Pendant Earrings Metal Irregular Water Drop Earrings,,,,,,,,,
XAOMUFR0015,Crystal Pendant Necklace,,<p><b>Details</b>: Crystal</p><p><b>Type</b>: Pendant Necklaces</p><p><b>Material</b>: Alloy</p><p><b>Color</b>: Gold</p><p><b>Metal Color</b>: Gold</p><p><b>Style</b>: Casual</p><p><b>Details</b>: Crystal</p><p><b>Type</b>: Pendant Necklaces</p><p><b>Material</b>: Alloy</p><p><b>Color</b>: Silver</p><p><b>Metal Color</b>: Silver</p><p><b>Style</b>: Casual</p>,img/Pendant_Necklaces/rwneck18210421661.jpg,,Size#,15.02,,,,1,1,,,Pendant Necklaces,,Crystal Pendant Necklace,Crystal Pendant Necklace,Crystal Pendant Necklace,,,,,,,,,
XAOMUFR0016,Women Cat Shadow Pattern Printing Backpack,,<p>Color:Black</p><p>Style:Casual</p><p>Pattern:Cat</p><p>Capacity:15.6 Inch Laptop</p>,img/Backpack/SKUG76893.jpg,,Size#,56.92,,,,1,1,,,Backpack,,Women Cat Shadow Pattern Printing Backpack,Women Cat Shadow Pattern Printing Backpack,Women Cat Shadow Pattern Printing Backpack,,,,,,,,,
XAOMUFR0017,Women's Pure Black And White Side Comfortable Flat Oxfords Shoes,,"<p>Color:Black</p><p>Type:Oxfords</p><p>Closure Type:Lace-up</p><p>Heel Type:Flat</p><p>Heel Height:1-3cm In Flat</p><p>Toe Type:Round</p><p>Pattern:Solid</p><p>Design Element:Side Stripe</p><p>Upper Material:Leather</p><p>Style:Casual</p><p>Outsole Material:PU</p><p>Structure:Lace-up</p><p>Occasion:Casual</p><p>Function:Breathable, Hard-wearing</p><p>Season:Summer, Autumn, Spring</p>",img/Flats/SKUG05236.jpg,,Size#US 5:US 6:US 7:US 8:US 9:,55.63,,,,1,1,,,Flats,,Women's Pure Black And White Side Comfortable Flat Oxfords Shoes,Women's Pure Black And White Side Comfortable Flat Oxfords Shoes,Women's Pure Black And White Side Comfortable Flat Oxfords Shoes,,,,,,,,,
XAOMUFR0018,Women Color Block Comfy Breathable Wearable Buckle Strap Peep Toe Pumps,,"<p>Color:Red, Beige</p><p>Type:Peep-toe Pumps shoes</p><p>Heel Type:Chunky Heel</p><p>Heel Height:5-8cm In Heel</p><p>Pattern:Animal-print</p><p>Design Element:Hollow out, Print</p><p>Upper Material:PU</p><p>Style:Casual</p><p>Outsole Material:Rubber</p><p>Structure:Buckle</p><p>Occasion:Party, Casual</p><p>Function:Breathable</p><p>Season:Summer</p>",img/Heels/SKUF06022.jpg,,Size#US 5:US 6:US 7:US 8:US 9:US 10:US 11:US 12:,61.76,,,,1,1,,,Heels,,Women Color Block Comfy Breathable Wearable Buckle Strap Peep Toe Pumps,Women Color Block Comfy Breathable Wearable Buckle Strap Peep Toe Pumps,Women Color Block Comfy Breathable Wearable Buckle Strap Peep Toe Pumps,,,,,,,,,
XAOMUFR0019,Shirred Waist Patchwork Shorts,,<p><b>Style</b>: Boho</p><p><b>Color</b>: Multicolor</p><p><b>Pattern Type</b>: Paisley</p><p><b>Pattern Type</b>: Patchwork</p><p><b>Season</b>: Summer</p><p><b>Type</b>: Wide Leg</p><p><b>Details</b>: Shirred</p><p><b>Waist Line</b>: High Waist</p><p><b>Fit Type</b>: Loose</p><p><b>Sheer</b>: No</p><p><b>Closure Type</b>: Elastic Waist</p><p><b>Material</b>: Polyester</p><p><b>Composition</b>: 92% Polyester</p><p><b>Composition</b>: 8% Spandex</p><p><b>Fabric</b>: Non-Stretch</p><p><b>Care Instructions</b>: Machine wash or professional dry clean</p>,img/Shorts/swshorts07210109486.jpg,,Size#XS:S:M:L:XL:,31.53,,,,1,1,,,Shorts,,Shirred Waist Patchwork Shorts,Shirred Waist Patchwork Shorts,Shirred Waist Patchwork Shorts,,,,,,,,,
XAOMUFR0020,Vertical Striped Florals Longline Shirt,,<p><b>Style</b>: Boho</p><p><b>Color</b>: Multicolor</p><p><b>Pattern Type</b>: Floral</p><p><b>Length</b>: Long</p><p><b>Season</b>: Spring/Fall</p><p><b>Type</b>: Tunic</p><p><b>Details</b>: Button</p><p><b>Neckline</b>: Collar</p><p><b>Sleeve Length</b>: Long Sleeve</p><p><b>Fit Type</b>: Regular Fit</p><p><b>Composition</b>: 97% Polyester</p><p><b>Composition</b>: 3% Spandex</p><p><b>Fabric</b>: Non-Stretch</p><p><b>Care Instructions</b>: Machine wash or professional dry clean</p>,img/Blouses/blouse180312303.jpg,,Size#M:L:XL:XXL:,25.0,,,,1,1,,,Blouses,,Vertical Striped Florals Longline Shirt,Vertical Striped Florals Longline Shirt,Vertical Striped Florals Longline Shirt,,,,,,,,,
XAOMUFR0021,Floral Print Crop Cami,,<p><b>Style</b>: Boho</p><p><b>Color</b>: Multicolor</p><p><b>Pattern Type</b>: Floral</p><p><b>Pattern Type</b>: All Over Print</p><p><b>Length</b>: Crop</p><p><b>Season</b>: Summer</p><p><b>Type</b>: Cami</p><p><b>Details</b>: Rib-Knit</p><p><b>Fit Type</b>: Slim Fit</p><p><b>Neckline</b>: Spaghetti Strap</p><p><b>Sheer</b>: No</p><p><b>Material</b>: Cotton</p><p><b>Composition</b>: 65% Cotton</p><p><b>Composition</b>: 35% Polyester</p><p><b>Fabric</b>: Slight Stretch</p><p><b>Care Instructions</b>: Machine wash or professional dry clean</p><p><b>Style</b>: Boho</p><p><b>Color</b>: Multicolor</p><p><b>Pattern Type</b>: Floral</p><p><b>Pattern Type</b>: All Over Print</p><p><b>Length</b>: Crop</p><p><b>Season</b>: Summer</p><p><b>Type</b>: Cami</p><p><b>Details</b>: Rib-Knit</p><p><b>Fit Type</b>: Slim Fit</p><p><b>Neckline</b>: Spaghetti Strap</p><p><b>Sheer</b>: No</p><p><b>Material</b>: Cotton</p><p><b>Composition</b>: 65% Cotton</p><p><b>Composition</b>: 35% Polyester</p><p><b>Fabric</b>: Slight Stretch</p><p><b>Care Instructions</b>: Machine wash or professional dry clean</p>,img/Tank_Tops__Camis/rwvest25210603584.jpg,,Size#S:M:L:,22.67,,,,1,1,,,Tank Tops & Cam's,,Floral Print Crop Cami,Floral Print Crop Cami,Floral Print Crop Cami,,,,,,,,,
XAOMUFR0022,Solid Backless Tie Front Top,,<p><b>Style</b>: Casual</p><p><b>Color</b>: Baby Blue</p><p><b>Pattern Type</b>: Plain</p><p><b>Length</b>: Crop</p><p><b>Season</b>: Summer</p><p><b>Details</b>: Backless</p><p><b>Details</b>: Tie Front</p><p><b>Neckline</b>: Deep V Neck</p><p><b>Sleeve Type</b>: Puff Sleeve</p><p><b>Fit Type</b>: Regular Fit</p><p><b>Sleeve Length</b>: Short Sleeve</p><p><b>Placket Type</b>: Placket</p><p><b>Sheer</b>: No</p><p><b>Material</b>: Polyester</p><p><b>Composition</b>: 100% Polyester</p><p><b>Fabric</b>: Non-Stretch</p><p><b>Care Instructions</b>: Machine wash or professional dry clean</p>,img/Women_Tops/rwtop25210520531.jpg,,Size#XS:S:M:L:XL:,26.49,,,,1,1,,,Women Tops,,Solid Backless Tie Front Top,Solid Backless Tie Front Top,Solid Backless Tie Front Top,,,,,,,,,
XAOMUFR0023,Antique Gold Bronze Sun Drop Ethnic Earrings Boho Retro Style Pendant Earrings for Women,,<p>Material: </p><p>Main Color: </p><p>Weight: About 4.08g</p><p>Size: About 6.8cm x 2.5cm / 2.68' x 0.98'</p><p>1 Pair of Earrings</p>,img/Earrings/SKU901062.jpg,,Size#,28.61,,,,1,1,,,Earrings,,Antique Gold Bronze Sun Drop Ethnic Earrings Boho Retro Style Pendant Earrings for Women,Antique Gold Bronze Sun Drop Ethnic Earrings Boho Retro Style Pendant Earrings for Women,Antique Gold Bronze Sun Drop Ethnic Earrings Boho Retro Style Pendant Earrings for Women,,,,,,,,,
XAOMUFR0024,Plant Design Round Charm Necklace,,<p><b>Type</b>: Pendant Necklaces</p><p><b>Details</b>: Round</p><p><b>Material</b>: Alloy</p><p><b>Color</b>: Green</p><p><b>Metal Color</b>: Gold</p><p><b>Style</b>: Boho</p>,img/Pendant_Necklaces/swneck18200923452.jpg,,Size#,27.89,,,,1,1,,,Pendant Necklaces,,Plant Design Round Charm Necklace,Plant Design Round Charm Necklace,Plant Design Round Charm Necklace,,,,,,,,,
XAOMUFR0025,Women Travel Backpack Large Capacity Shoulder Bag,,"<p>Color:Black, Khaki</p><p>Material:Nylon</p><p>Style:Preppy</p><p>Decoration:Hardware</p>",img/Backpack/SKUB74223.jpg,,Size#L:,67.21,,,,1,1,,,Backpack,,Women Travel Backpack Large Capacity Shoulder Bag,Women Travel Backpack Large Capacity Shoulder Bag,Women Travel Backpack Large Capacity Shoulder Bag,,,,,,,,,
XAOMUFR0026,Women Breathable Lace Flowers Back-zip Flat Loafers,,"<p>Color:Khaki, Black, White</p><p>Type:Loafers</p><p>Closure Type:Back-zip</p><p>Heel Type:Flat</p><p>Heel Height:1-3cm In Flat</p><p>Toe Type:Round</p><p>Pattern:Floral</p><p>Design Element:Hollow out, Lace</p><p>Upper Material:Lace</p><p>Style:Casual</p><p>Outsole Material:Rubber</p><p>Occasion:Casual</p><p>Function:Antiskid</p><p>Season:Summer, Autumn, Spring</p>",img/Flats/SKUH80003.jpg,,Size#US 5:US 6:US 7:US 8:US 9:,49.11,,,,1,1,,,Flats,,Women Breathable Lace Flowers Back-zip Flat Loafers,Women Breathable Lace Flowers Back-zip Flat Loafers,Women Breathable Lace Flowers Back-zip Flat Loafers,,,,,,,,,
XAOMUFR0027,SOCOFY Retro Floral Pattern Stitching Cowhide Leather Ankle Metal Buckle Strap Hook Loop Chunky Heel Pumps,,"<p>Color:Red</p><p>Type:Mary Jane</p><p>Closure Type:Hook & Loop</p><p>Heel Type:Chunky Heel</p><p>Heel Height:5-8cm In Heel</p><p>Toe Type:Round</p><p>Pattern:Calico</p><p>Design Element:Floral, Stitching</p><p>Upper Material:Cloth</p><p>Style:Casual, Retro, Classic, Elegant</p><p>Outsole Material:Rubber</p><p>Structure:Hook & Loop, Ankle Strap, Buckle</p><p>Occasion:Party, Casual</p><p>Function:Hard-wearing</p><p>Season:Summer, Spring&Fall</p>",img/Heels/SKUH00622.jpg,,Size#US 5:US 6:US 7:US 8:US 9.5:US 10.5:US 11.5:,63.7,,,,1,1,,,Heels,,SOCOFY Retro Floral Pattern Stitching Cowhide Leather Ankle Metal Buckle Strap Hook Loop Chunky Heel Pumps,SOCOFY Retro Floral Pattern Stitching Cowhide Leather Ankle Metal Buckle Strap Hook Loop Chunky Heel Pumps,SOCOFY Retro Floral Pattern Stitching Cowhide Leather Ankle Metal Buckle Strap Hook Loop Chunky Heel Pumps,,,,,,,,,
XAOMUFR0028,2pcs Solid Dolphin Shorts,,<p><b>Style</b>: Casual</p><p><b>Color</b>: Multicolor</p><p><b>Pattern Type</b>: Plain</p><p><b>Season</b>: Summer</p><p><b>Type</b>: Track Shorts</p><p><b>Details</b>: Knot</p><p><b>Details</b>: Rib-Knit</p><p><b>Waist Line</b>: Natural</p><p><b>Fit Type</b>: Regular Fit</p><p><b>Sheer</b>: No</p><p><b>Closure Type</b>: Elastic Waist</p><p><b>Material</b>: Cotton</p><p><b>Composition</b>: 65% Cotton</p><p><b>Composition</b>: 35% Polyester</p><p><b>Fabric</b>: Slight Stretch</p><p><b>Care Instructions</b>: Machine wash or professional dry clean</p>,img/Shorts/rwshorts25210604763.jpg,,Size#S:M:L:,28.14,,,,1,1,,,Shorts,,2pcs Solid Dolphin Shorts,2pcs Solid Dolphin Shorts,2pcs Solid Dolphin Shorts,,,,,,,,,
XAOMUFR0029,Tartan Print Letter Patched Blouse,,<p><b>Style</b>: Casual</p><p><b>Color</b>: Black</p><p><b>Pattern Type</b>: Plaid</p><p><b>Pattern Type</b>: Letter</p><p><b>Length</b>: Long</p><p><b>Season</b>: Summer</p><p><b>Type</b>: Shirt</p><p><b>Details</b>: Patched</p><p><b>Details</b>: Button Front</p><p><b>Neckline</b>: Collar</p><p><b>Sleeve Length</b>: Half Sleeve</p><p><b>Fit Type</b>: Oversized</p><p><b>Sleeve Type</b>: Regular Sleeve</p><p><b>Sheer</b>: Yes</p><p><b>Placket Type</b>: Placket</p><p><b>Material</b>: Cotton</p><p><b>Composition</b>: 100% Cotton</p><p><b>Fabric</b>: Non-Stretch</p><p><b>Care Instructions</b>: Machine wash or professional dry clean</p><p><b>Style</b>: Preppy</p><p><b>Color</b>: Red</p><p><b>Pattern Type</b>: Plaid</p><p><b>Pattern Type</b>: Letter</p><p><b>Length</b>: Long</p><p><b>Season</b>: Summer</p><p><b>Type</b>: Shirt</p><p><b>Details</b>: Patched</p><p><b>Details</b>: Button Front</p><p><b>Neckline</b>: Collar</p><p><b>Sleeve Length</b>: Half Sleeve</p><p><b>Fit Type</b>: Oversized</p><p><b>Sleeve Type</b>: Regular Sleeve</p><p><b>Sheer</b>: Yes</p><p><b>Placket Type</b>: Placket</p><p><b>Material</b>: Cotton</p><p><b>Composition</b>: 100% Cotton</p><p><b>Fabric</b>: Non-Stretch</p><p><b>Care Instructions</b>: Machine wash or professional dry clean</p><p><b>Style</b>: Preppy</p><p><b>Color</b>: Khaki</p><p><b>Pattern Type</b>: Plaid</p><p><b>Pattern Type</b>: Letter</p><p><b>Length</b>: Long</p><p><b>Season</b>: Summer</p><p><b>Type</b>: Shirt</p><p><b>Details</b>: Patched</p><p><b>Details</b>: Button Front</p><p><b>Neckline</b>: Collar</p><p><b>Sleeve Length</b>: Half Sleeve</p><p><b>Fit Type</b>: Oversized</p><p><b>Sleeve Type</b>: Regular Sleeve</p><p><b>Sheer</b>: Yes</p><p><b>Placket Type</b>: Placket</p><p><b>Material</b>: Cotton</p><p><b>Composition</b>: 100% Cotton</p><p><b>Fabric</b>: Non-Stretch</p><p><b>Care Instructions</b>: Machine wash or professional dry clean</p>,img/Blouses/swblouse30210513757.jpg,,Size#S:M:L:XL:,29.35,,,,1,1,,,Blouses,,Tartan Print Letter Patched Blouse,Tartan Print Letter Patched Blouse,Tartan Print Letter Patched Blouse,,,,,,,,,
XAOMUFR0030,Contrast Stitch Lettuce Edge Tank Top,,<p><b>Style</b>: Casual</p><p><b>Color</b>: Black</p><p><b>Length</b>: Crop</p><p><b>Season</b>: Summer</p><p><b>Type</b>: Tank</p><p><b>Details</b>: Lettuce Trim</p><p><b>Details</b>: Rib-Knit</p><p><b>Neckline</b>: Round Neck</p><p><b>Fit Type</b>: Slim Fit</p><p><b>Sheer</b>: No</p><p><b>Material</b>: Polyester</p><p><b>Composition</b>: 70% Polyester</p><p><b>Composition</b>: 25% Cotton</p><p><b>Composition</b>: 5% Spandex</p><p><b>Fabric</b>: Slight Stretch</p><p><b>Care Instructions</b>: Machine wash or professional dry clean</p>,img/Tank_Tops__Camis/swvest07201111805.jpg,,Size#XS:S:M:L:XL:,32.02,,,,1,1,,,Tank Tops & Cam's,,Contrast Stitch Lettuce Edge Tank Top,Contrast Stitch Lettuce Edge Tank Top,Contrast Stitch Lettuce Edge Tank Top,,,,,,,,,
XAOMUFR0031,Floral Print Criss Cross Crop Top,,<p><b>Style</b>: Boho</p><p><b>Color</b>: Multicolor</p><p><b>Pattern Type</b>: Floral</p><p><b>Pattern Type</b>: All Over Print</p><p><b>Length</b>: Crop</p><p><b>Season</b>: Summer</p><p><b>Details</b>: Criss Cross</p><p><b>Details</b>: Wrap</p><p><b>Fit Type</b>: Regular Fit</p><p><b>Sleeve Length</b>: Short Sleeve</p><p><b>Neckline</b>: V neck</p><p><b>Sleeve Type</b>: Regular Sleeve</p><p><b>Placket Type</b>: Placket</p><p><b>Sheer</b>: No</p><p><b>Material</b>: Cotton</p><p><b>Composition</b>: 65% Cotton</p><p><b>Composition</b>: 35% Polyester</p><p><b>Fabric</b>: High Stretch</p><p><b>Care Instructions</b>: Machine wash or professional dry clean</p>,img/Women_Tops/rwtop25210607269.jpg,,Size#S:M:L:XL:,32.88,,,,1,1,,,Women Tops,,Floral Print Criss Cross Crop Top,Floral Print Criss Cross Crop Top,Floral Print Criss Cross Crop Top,,,,,,,,,
