v_sku,v_name,v_short_description,v_description,v_image,v_url,v_attribute,v_price,v_specials_price,v_specials_expire_date,v_date_added,v_in_stock,v_status,v_viewed,v_ordered,v_category_sku,v_sort_order,v_meta_title,v_meta_keywords,v_meta_description,v_brand_filter,v_class_filter,v_color_filter,v_gender_filter,v_material_filter,v_year_filter,v_origin_filter,v_series_filter,v_spec_filter
XAOMUFR0138,Slogan Embroidery Crop Tank Top,,<p><b>Style</b>: Casual</p><p><b>Color</b>: Black</p><p><b>Pattern Type</b>: Slogan</p><p><b>Length</b>: Crop</p><p><b>Season</b>: Summer</p><p><b>Type</b>: Tank</p><p><b>Details</b>: Embroidery</p><p><b>Neckline</b>: Round Neck</p><p><b>Fit Type</b>: Slim Fit</p><p><b>Sheer</b>: No</p><p><b>Material</b>: Polyester</p><p><b>Composition</b>: 65% Polyester</p><p><b>Composition</b>: 35% Cotton</p><p><b>Fabric</b>: Slight Stretch</p><p><b>Care Instructions</b>: Machine wash or professional dry clean</p>,img/Tank_Tops__Camis/rwvest03201230515.jpg,,Size#XS:S:M:L:XL:XXL:,27.19,,,,1,1,,,Tank Tops & Cam's,,Slogan Embroidery Crop Tank Top,Slogan Embroidery Crop Tank Top,Slogan Embroidery Crop Tank Top,,,,,,,,,
XAOMUFR0139,Striped Print Colorblock One Shoulder Crop Top,,<p><b>Style</b>: Sexy</p><p><b>Color</b>: Multicolor</p><p><b>Pattern Type</b>: Colorblock</p><p><b>Pattern Type</b>: Striped</p><p><b>Length</b>: Crop</p><p><b>Season</b>: Summer</p><p><b>Details</b>: Rib-Knit</p><p><b>Details</b>: Contrast Binding</p><p><b>Neckline</b>: One Shoulder</p><p><b>Sleeve Length</b>: Sleeveless</p><p><b>Fit Type</b>: Slim Fit</p><p><b>Placket Type</b>: Pullovers</p><p><b>Sheer</b>: No</p><p><b>Material</b>: Viscose</p><p><b>Composition</b>: 95% Viscose</p><p><b>Composition</b>: 5% Elastane</p><p><b>Fabric</b>: Slight Stretch</p><p><b>Care Instructions</b>: Machine wash or professional dry clean</p>,img/Women_Tops/swtop07210609263.jpg,,Size#XS:S:M:L:XL:,28.94,,,,1,1,,,Women Tops,,Striped Print Colorblock One Shoulder Crop Top,Striped Print Colorblock One Shoulder Crop Top,Striped Print Colorblock One Shoulder Crop Top,,,,,,,,,
XAOMUFR0140,Vintage Pearl Shell Women Earrings 925 Silver Plated Peridot Lapis Pendant Earrings,,"<p>Style: Vintage </p><p>Type: Earrings</p><p>Color: Ancient Silver</p><p>Weight: 9.5g</p><p>Size: About 5.5*1.2 cm / 2.17*0.47''</p><p>Material: 925 Silver Plated, Peridot, Pearl, Lapis </p><p>1 x Earrings</p>",img/Earrings/SKUG15274.jpg,,Size#,20.95,,,,1,1,,,Earrings,,Vintage Pearl Shell Women Earrings 925 Silver Plated Peridot Lapis Pendant Earrings,Vintage Pearl Shell Women Earrings 925 Silver Plated Peridot Lapis Pendant Earrings,Vintage Pearl Shell Women Earrings 925 Silver Plated Peridot Lapis Pendant Earrings,,,,,,,,,
XAOMUFR0141,6pcs Heart & Moon Pendant Necklace,,<p><b>Details</b>: Round</p><p><b>Material</b>: Alloy</p><p><b>Type</b>: Chain Necklaces</p><p><b>Color</b>: Gold</p><p><b>Style</b>: Casual</p><p><b>Material</b>: Alloy</p><p><b>Type</b>: Chain Necklaces</p><p><b>Color</b>: Multicolor</p><p><b>Style</b>: Casual</p><p><b>Details</b>: Heart</p><p><b>Details</b>: Pearls</p><p><b>Type</b>: Pendant Necklaces</p><p><b>Details</b>: Star</p><p><b>Material</b>: Alloy</p><p><b>Details</b>: Butterfly</p><p><b>Color</b>: Silver</p><p><b>Metal Color</b>: Silver</p><p><b>Style</b>: Casual</p>,img/Pendant_Necklaces/rwneck03210106438.jpg,,Size#,17.42,,,,1,1,,,Pendant Necklaces,,6pcs Heart & Moon Pendant Necklace,6pcs Heart & Moon Pendant Necklace,6pcs Heart & Moon Pendant Necklace,,,,,,,,,
XAOMUFR0142,Women Solid Chain Large Capacity Ribbon Backpack,,"<p>Color:Blue, Grey, Black, Green, Pink</p><p>Material:Canvas</p><p>Style:Preppy</p>",img/Backpack/SKUB60598.jpg,,Size#,59.39,,,,1,1,,,Backpack,,Women Solid Chain Large Capacity Ribbon Backpack,Women Solid Chain Large Capacity Ribbon Backpack,Women Solid Chain Large Capacity Ribbon Backpack,,,,,,,,,
XAOMUFR0143,SOCOFY Natural Tie-dye Comfy Round Toe Stitching Leather Wearable Soft Sole Elastic Slip-on Flat Loafers Shoes,,"<p>Color:Blue</p><p>Type:Loafers</p><p>Closure Type:Slip-On</p><p>Heel Type:Flat</p><p>Heel Height:1-3cm In Flat</p><p>Toe Type:Round</p><p>Pattern:Tie-dye</p><p>Design Element:Print</p><p>Upper Material:Leather, Cloth</p><p>Style:Casual</p><p>Outsole Material:Rubber</p><p>Structure:Slip-On</p><p>Occasion:Daily</p><p>Function:Soft</p><p>Season:Summer, Spring&Fall</p>",img/Flats/SKUG51699.jpg,,Size#US 5:US 6:US 7:US 8:US 9.5:US 10.5:US 11.5:,60.78,,,,1,1,,,Flats,,SOCOFY Natural Tie-dye Comfy Round Toe Stitching Leather Wearable Soft Sole Elastic Slip-on Flat Loafers Shoes,SOCOFY Natural Tie-dye Comfy Round Toe Stitching Leather Wearable Soft Sole Elastic Slip-on Flat Loafers Shoes,SOCOFY Natural Tie-dye Comfy Round Toe Stitching Leather Wearable Soft Sole Elastic Slip-on Flat Loafers Shoes,,,,,,,,,
XAOMUFR0144,SOCOFY Printing Hollow Out Pattern Mid Heel Buckle Ankle Leather Pumps,,"<p>Color:Grey</p><p>Type:Mary Jane</p><p>Closure Type:Buckle</p><p>Heel Type:Chunky Heel</p><p>Heel Height:3-5cm In Low Heel</p><p>Toe Type:Round</p><p>Pattern:Calico, Leaf</p><p>Design Element:Pleated</p><p>Upper Material:Leather</p><p>Style:Retro, Bohemia</p><p>Outsole Material:Rubber</p><p>Structure:Buckle</p><p>Occasion:Date, Prom, Casual, Versatile</p><p>Function:Hard-wearing</p><p>Season:Summer, Autumn, Spring</p>",img/Heels/SKU853294.jpg,,Size#US 5:US 6:US 7:US 8:US 9:US 10:US 11:,50.34,,,,1,1,,,Heels,,SOCOFY Printing Hollow Out Pattern Mid Heel Buckle Ankle Leather Pumps,SOCOFY Printing Hollow Out Pattern Mid Heel Buckle Ankle Leather Pumps,SOCOFY Printing Hollow Out Pattern Mid Heel Buckle Ankle Leather Pumps,,,,,,,,,
XAOMUFR0145,Floral And Galaxy Print Drawstring Track Shorts,,<p><b>Style</b>: Casual</p><p><b>Color</b>: Dark Grey</p><p><b>Pattern Type</b>: Floral</p><p><b>Pattern Type</b>: Galaxy</p><p><b>Season</b>: Summer</p><p><b>Type</b>: Track Shorts</p><p><b>Details</b>: Drawstring</p><p><b>Details</b>: Pocket</p><p><b>Waist Line</b>: High Waist</p><p><b>Fit Type</b>: Regular Fit</p><p><b>Sheer</b>: No</p><p><b>Closure Type</b>: Drawstring Waist</p><p><b>Body</b>: Unlined</p><p><b>Material</b>: Polyester</p><p><b>Composition</b>: 95% Polyester</p><p><b>Composition</b>: 5% Elastane</p><p><b>Fabric</b>: Non-Stretch</p><p><b>Care Instructions</b>: Machine wash or professional dry clean</p>,img/Shorts/swshorts23210507273.jpg,,Size#S:M:L:XL:,30.1,,,,1,1,,,Shorts,,Floral And Galaxy Print Drawstring Track Shorts,Floral And Galaxy Print Drawstring Track Shorts,Floral And Galaxy Print Drawstring Track Shorts,,,,,,,,,
XAOMUFR0146,Plaid Button Front Drawstring Blouse,,<p><b>Style</b>: Preppy</p><p><b>Color</b>: Multicolor</p><p><b>Pattern Type</b>: Plaid</p><p><b>Length</b>: Regular</p><p><b>Season</b>: Spring/Fall</p><p><b>Type</b>: Shirt</p><p><b>Details</b>: Drawstring</p><p><b>Details</b>: Pocket</p><p><b>Details</b>: Button Front</p><p><b>Neckline</b>: Hooded</p><p><b>Sleeve Length</b>: Long Sleeve</p><p><b>Fit Type</b>: Regular Fit</p><p><b>Sleeve Type</b>: Drop Shoulder</p><p><b>Sheer</b>: No</p><p><b>Placket Type</b>: Placket</p><p><b>Belt</b>: No</p><p><b>Body</b>: Unlined</p><p><b>Material</b>: Cotton</p><p><b>Composition</b>: 65% Cotton</p><p><b>Composition</b>: 35% Polyester</p><p><b>Fabric</b>: Non-Stretch</p><p><b>Care Instructions</b>: Machine wash or professional dry clean</p>,img/Blouses/rwblouse00201110797.jpg,,Size#S:M:L:XL:,23.3,,,,1,1,,,Blouses,,Plaid Button Front Drawstring Blouse,Plaid Button Front Drawstring Blouse,Plaid Button Front Drawstring Blouse,,,,,,,,,
XAOMUFR0147,Daisy Contrast Binding Crop Cami,,<p><b>Style</b>: Casual</p><p><b>Color</b>: Black</p><p><b>Pattern Type</b>: Floral</p><p><b>Length</b>: Crop</p><p><b>Season</b>: Summer</p><p><b>Type</b>: Cami</p><p><b>Details</b>: Appliques</p><p><b>Details</b>: Rib-Knit</p><p><b>Details</b>: Contrast Binding</p><p><b>Fit Type</b>: Slim Fit</p><p><b>Neckline</b>: Straps</p><p><b>Sheer</b>: No</p><p><b>Material</b>: Polyester</p><p><b>Composition</b>: 95% Polyester</p><p><b>Composition</b>: 5% Elastane</p><p><b>Fabric</b>: High Stretch</p><p><b>Care Instructions</b>: Machine wash or professional dry clean</p>,img/Tank_Tops__Camis/rwvest25210429924.jpg,,Size#XS:S:M:L:,31.28,,,,1,1,,,Tank Tops & Cam's,,Daisy Contrast Binding Crop Cami,Daisy Contrast Binding Crop Cami,Daisy Contrast Binding Crop Cami,,,,,,,,,
XAOMUFR0148,Scallop Trim Lace Tube Top,,<p><b>Style</b>: Sexy</p><p><b>Color</b>: White</p><p><b>Pattern Type</b>: Plain</p><p><b>Length</b>: Crop</p><p><b>Season</b>: Summer</p><p><b>Details</b>: Sheer</p><p><b>Fit Type</b>: Regular Fit</p><p><b>Sleeve Length</b>: Sleeveless</p><p><b>Neckline</b>: Strapless</p><p><b>Placket Type</b>: Pullovers</p><p><b>Sheer</b>: No</p><p><b>Material</b>: Lace</p><p><b>Composition</b>: 100% Polyester</p><p><b>Fabric</b>: Medium Stretch</p><p><b>Care Instructions</b>: Machine wash or professional dry clean</p>,img/Women_Tops/swtop23210406687.jpg,,Size#S:M:L:,24.31,,,,1,1,,,Women Tops,,Scallop Trim Lace Tube Top,Scallop Trim Lace Tube Top,Scallop Trim Lace Tube Top,,,,,,,,,
XAOMUFR0149,925 Sterling Silver Vintage Earrings Magnolia Long Flower Dangle Earrings Ethnic Jewelry for Women,,"<p>Style: Vintage</p><p>
	Type: Dangle Earrings</p><p>Main Color: Silver</p><p>Weight: About 4.5g</p><p>Size: About 5.3cm x 2cm / 2.08' x 0.78'</p><p>Material: S925 Silver,</p><p> Platinum Plating, Gold Plating</p><p>1 Pair of Earrings</p>",img/Earrings/SKU534053.jpg,,Size#,24.93,,,,1,1,,,Earrings,,925 Sterling Silver Vintage Earrings Magnolia Long Flower Dangle Earrings Ethnic Jewelry for Women,925 Sterling Silver Vintage Earrings Magnolia Long Flower Dangle Earrings Ethnic Jewelry for Women,925 Sterling Silver Vintage Earrings Magnolia Long Flower Dangle Earrings Ethnic Jewelry for Women,,,,,,,,,
XAOMUFR0150,Heart Pendant Necklace,,<p><b>Details</b>: Heart</p><p><b>Material</b>: Metal</p><p><b>Type</b>: Pendant Necklaces</p><p><b>Color</b>: Gold</p><p><b>Metal Color</b>: Gold</p><p><b>Style</b>: Fashionable</p>,img/Pendant_Necklaces/rwneck18210519189.jpg,,Size#,15.25,,,,1,1,,,Pendant Necklaces,,Heart Pendant Necklace,Heart Pendant Necklace,Heart Pendant Necklace,,,,,,,,,
XAOMUFR0151,Waterproof Leisure Large Capacity Casual Backpack For Women,,"<p>Color:Brown, Black, Green, Khaki, Red</p><p>Material:Faux Fur, PU</p><p>Style:Casual</p><p>Pattern:Solid</p>",img/Backpack/SKUE38471.jpg,,Size#,72.57,,,,1,1,,,Backpack,,Waterproof Leisure Large Capacity Casual Backpack For Women,Waterproof Leisure Large Capacity Casual Backpack For Women,Waterproof Leisure Large Capacity Casual Backpack For Women,,,,,,,,,
XAOMUFR0152,LOSTISY Big Size Soft Multi-Way Wearing Pure Color Flat Loafers,,"<p>Color:Orange, Red, Yellow, Black, Coffee, White, Navy, Blue</p><p>Type:Loafers</p><p>Closure Type:Slip-On</p><p>Heel Type:Flat</p><p>Heel Height:1-3cm In Flat</p><p>Toe Type:Round</p><p>Pattern:Other</p><p>Design Element:Simple</p><p>Upper Material:Leather</p><p>Style:Casual</p><p>Outsole Material:Rubber</p><p>Structure:Slip-On</p><p>Occasion:Home, Daily</p><p>Function:Soft</p><p>Season:All Season</p>",img/Flats/SKU573298.jpg,,Size#US 5:US 6:US 7:US 8:US 9:US 10:US 11:US 12:US 13:,51.86,,,,1,1,,,Flats,,LOSTISY Big Size Soft Multi-Way Wearing Pure Color Flat Loafers,LOSTISY Big Size Soft Multi-Way Wearing Pure Color Flat Loafers,LOSTISY Big Size Soft Multi-Way Wearing Pure Color Flat Loafers,,,,,,,,,
XAOMUFR0153,Women Casual Mesh Breathable Chunky Heel Hollow Out Peep-toe Pumps Shoes,,"<p>Color:Yellow, Black</p><p>Type:Peep-toe Pumps shoes</p><p>Closure Type:Back-zip</p><p>Heel Type:Chunky Heel, Block Heel</p><p>Heel Height:3-5cm In Low Heel</p><p>Toe Type:Round</p><p>Pattern:Leopard, Solid, Joint</p><p>Design Element:Hollow out, Fishnet</p><p>Upper Material:Mesh</p><p>Style:Casual, Stylish</p><p>Outsole Material:Rubber</p><p>Structure:Slip-On</p><p>Occasion:Casual</p><p>Function:Breathable</p><p>Season:Summer, Spring</p>",img/Heels/SKUG97724.jpg,,Size#US 5:US 6:US 7:US 8:US 9:US 10:US 11:US 12:,50.02,,,,1,1,,,Heels,,Women Casual Mesh Breathable Chunky Heel Hollow Out Peep-toe Pumps Shoes,Women Casual Mesh Breathable Chunky Heel Hollow Out Peep-toe Pumps Shoes,Women Casual Mesh Breathable Chunky Heel Hollow Out Peep-toe Pumps Shoes,,,,,,,,,
XAOMUFR0154,3pcs Contrast Binding Dolphin Shorts,,<p><b>Style</b>: Sporty</p><p><b>Color</b>: Multicolor</p><p><b>Season</b>: Summer</p><p><b>Type</b>: Track Shorts</p><p><b>Details</b>: Contrast Binding</p><p><b>Waist Line</b>: Natural</p><p><b>Fit Type</b>: Regular Fit</p><p><b>Sheer</b>: No</p><p><b>Closure Type</b>: Elastic Waist</p><p><b>Material</b>: Polyester</p><p><b>Composition</b>: 65% Polyester</p><p><b>Composition</b>: 35% Cotton</p><p><b>Fabric</b>: Slight Stretch</p><p><b>Care Instructions</b>: Machine wash or professional dry clean</p>,img/Shorts/rwshorts25210428463.jpg,,Size#S:M:L:,25.26,,,,1,1,,,Shorts,,3pcs Contrast Binding Dolphin Shorts,3pcs Contrast Binding Dolphin Shorts,3pcs Contrast Binding Dolphin Shorts,,,,,,,,,
XAOMUFR0155,Schiffy Eyelet Panel Petal Sleeve Top,,<p><b>Style</b>: Casual</p><p><b>Color</b>: Blue and White</p><p><b>Pattern Type</b>: Striped</p><p><b>Season</b>: Summer</p><p><b>Type</b>: Top</p><p><b>Details</b>: Button</p><p><b>Sleeve Type</b>: Petal Sleeve</p><p><b>Sleeve Length</b>: Cap Sleeve</p><p><b>Fit Type</b>: Regular Fit</p><p><b>Neckline</b>: Round Neck</p><p><b>Composition</b>: 65% Cotton</p><p><b>Composition</b>: 35% Polyester</p><p><b>Fabric</b>: Non-Stretch</p><p><b>Care Instructions</b>: Machine wash or professional dry clean</p><p><b>Style</b>: Casual</p><p><b>Color</b>: White</p><p><b>Pattern Type</b>: Plain</p><p><b>Length</b>: Regular</p><p><b>Season</b>: Summer</p><p><b>Type</b>: Top</p><p><b>Details</b>: Button</p><p><b>Details</b>: Eyelet Embroidery</p><p><b>Sleeve Type</b>: Petal Sleeve</p><p><b>Sleeve Length</b>: Cap Sleeve</p><p><b>Fit Type</b>: Regular Fit</p><p><b>Neckline</b>: Stand Collar</p><p><b>Placket Type</b>: Half Placket</p><p><b>Composition</b>: 65% Cotton</p><p><b>Composition</b>: 35% Polyester</p><p><b>Fabric</b>: Non-Stretch</p><p><b>Care Instructions</b>: Machine wash or professional dry clean</p>,img/Blouses/blouse170712108.jpg,,Size#S:M:L:XL:,31.5,,,,1,1,,,Blouses,,Schiffy Eyelet Panel Petal Sleeve Top,Schiffy Eyelet Panel Petal Sleeve Top,Schiffy Eyelet Panel Petal Sleeve Top,,,,,,,,,
XAOMUFR0156,Floral Graphic Contrast Lace Cami,,<p><b>Style</b>: Boho</p><p><b>Color</b>: Multicolor</p><p><b>Pattern Type</b>: Floral</p><p><b>Length</b>: Crop</p><p><b>Season</b>: Summer</p><p><b>Type</b>: Cami</p><p><b>Details</b>: Contrast Lace</p><p><b>Details</b>: Ruffle Hem</p><p><b>Details</b>: Bow Back</p><p><b>Fit Type</b>: Slim Fit</p><p><b>Neckline</b>: Spaghetti Strap</p><p><b>Sheer</b>: No</p><p><b>Material</b>: Polyester</p><p><b>Composition</b>: 80% Polyester</p><p><b>Composition</b>: 20% Cotton</p><p><b>Fabric</b>: Slight Stretch</p><p><b>Care Instructions</b>: Machine wash or professional dry clean</p>,img/Tank_Tops__Camis/rwvest25210616207.jpg,,Size#XS:S:M:L:,32.12,,,,1,1,,,Tank Tops & Cam's,,Floral Graphic Contrast Lace Cami,Floral Graphic Contrast Lace Cami,Floral Graphic Contrast Lace Cami,,,,,,,,,
XAOMUFR0157,2 In 1 Solid Belted Top,,<p><b>Style</b>: Casual</p><p><b>Color</b>: Black</p><p><b>Pattern Type</b>: Plain</p><p><b>Length</b>: Crop</p><p><b>Season</b>: Spring/Summer</p><p><b>Details</b>: Rib-Knit</p><p><b>Sleeve Length</b>: Long Sleeve</p><p><b>Neckline</b>: Scoop Neck</p><p><b>Fit Type</b>: Slim Fit</p><p><b>Sleeve Type</b>: Regular Sleeve</p><p><b>Placket Type</b>: Pullovers</p><p><b>Sheer</b>: No</p><p><b>Material</b>: Polyester</p><p><b>Composition</b>: 95% Polyester</p><p><b>Composition</b>: 5% Elastane</p><p><b>Fabric</b>: High Stretch</p><p><b>Care Instructions</b>: Machine wash or professional dry clean</p>,img/Women_Tops/swtop25210529941.jpg,,Size#XS:S:M:L:,27.46,,,,1,1,,,Women Tops,,2 In 1 Solid Belted Top,2 In 1 Solid Belted Top,2 In 1 Solid Belted Top,,,,,,,,,
XAOMUFR0158,Fashion Spiral Earrings Heart-shaped Retro Earrings Exaggerated Gear Women Earrings,,"<p>Style:Trendy,Fashion</p><p>Type:Earrings</p><p>Color:Gold,Sliver</p><p>Weight: about 7g</p><p>Size:4.5cm * 4cm/1.77' * 1.57' </p><p>Material:Zinc Alloy</p><p>1 Pair of Earrings</p>",img/Earrings/SKUA79916.jpg,,Size#,25.02,,,,1,1,,,Earrings,,Fashion Spiral Earrings Heart-shaped Retro Earrings Exaggerated Gear Women Earrings,Fashion Spiral Earrings Heart-shaped Retro Earrings Exaggerated Gear Women Earrings,Fashion Spiral Earrings Heart-shaped Retro Earrings Exaggerated Gear Women Earrings,,,,,,,,,
XAOMUFR0159,3pcs Letter Charm Necklace,,<p><b>Type</b>: Pendant Necklaces</p><p><b>Material</b>: Alloy</p><p><b>Color</b>: Gold</p><p><b>Metal Color</b>: Gold</p><p><b>Style</b>: Casual</p>,img/Pendant_Necklaces/swneck18200703132.jpg,,Size#,13.7,,,,1,1,,,Pendant Necklaces,,3pcs Letter Charm Necklace,3pcs Letter Charm Necklace,3pcs Letter Charm Necklace,,,,,,,,,
XAOMUFR0160,Women Sports Bag Fish Bone Pattern Bluetooth Speaker Nylon Embroidered Bag Novelty Bags Backpack,,"<p>Color:Blue, Grey, Black</p><p>Style:Casual</p><p>Pattern:Cartoon</p><p>Capacity:4A Magazine</p>",img/Backpack/SKUH39254.jpg,,Size#,58.34,,,,1,1,,,Backpack,,Women Sports Bag Fish Bone Pattern Bluetooth Speaker Nylon Embroidered Bag Novelty Bags Backpack,Women Sports Bag Fish Bone Pattern Bluetooth Speaker Nylon Embroidered Bag Novelty Bags Backpack,Women Sports Bag Fish Bone Pattern Bluetooth Speaker Nylon Embroidered Bag Novelty Bags Backpack,,,,,,,,,
XAOMUFR0161,LOSTISY Suede Pure Color Slip On Stitching Flat Soft Shoes For Women,,"<p>Color:Green, Brown</p><p>Type:Loafers</p><p>Closure Type:Slip-On</p><p>Heel Type:Flat</p><p>Heel Height:1-3cm In Flat</p><p>Toe Type:Round</p><p>Pattern:Solid</p><p>Design Element:Stitching</p><p>Upper Material:Suede</p><p>Style:Casual</p><p>Outsole Material:Rubber</p><p>Structure:Slip-On</p><p>Occasion:Casual, Daily</p><p>Function:Soft</p><p>Season:All Season</p>",img/Flats/SKU465818.jpg,,Size#US 5:US 6:US 7:US 8:US 9:US 10:US 11:,51.21,,,,1,1,,,Flats,,LOSTISY Suede Pure Color Slip On Stitching Flat Soft Shoes For Women,LOSTISY Suede Pure Color Slip On Stitching Flat Soft Shoes For Women,LOSTISY Suede Pure Color Slip On Stitching Flat Soft Shoes For Women,,,,,,,,,
XAOMUFR0162,Socofy Retro Floral Print Elegant Leather Color Block Pointed Toe Cone Heel Business Shoes Lace Up Low Heel Pumps,,"<p>Color:Blue</p><p>Type:Business Shoes</p><p>Closure Type:Lace-up</p><p>Heel Type:Cone Heel</p><p>Heel Height:3-5cm In Low Heel</p><p>Toe Type:Pointed</p><p>Pattern:Color Block, Floral</p><p>Design Element:Splice, Print</p><p>Upper Material:Leather</p><p>Style:Retro, Broguo, Business, Elegant</p><p>Outsole Material:Rubber</p><p>Structure:Lace-up</p><p>Occasion:Date, Prom, Party, Versatile, Shopping</p><p>Function:Hard-wearing</p><p>Season:Summer, Autumn, Spring</p>",img/Heels/SKUH93444.jpg,,Size#US 6:US 7:US 8:US 9.5:US 10.5:US 11.5:,51.01,,,,1,1,,,Heels,,Socofy Retro Floral Print Elegant Leather Color Block Pointed Toe Cone Heel Business Shoes Lace Up Low Heel Pumps,Socofy Retro Floral Print Elegant Leather Color Block Pointed Toe Cone Heel Business Shoes Lace Up Low Heel Pumps,Socofy Retro Floral Print Elegant Leather Color Block Pointed Toe Cone Heel Business Shoes Lace Up Low Heel Pumps,,,,,,,,,
XAOMUFR0163,Mushroom Print Belted Shorts,,<p><b>Style</b>: Casual</p><p><b>Color</b>: Multicolor</p><p><b>Pattern Type</b>: Fruit&Vegetable</p><p><b>Season</b>: Summer</p><p><b>Type</b>: Wide Leg</p><p><b>Details</b>: Belted</p><p><b>Details</b>: Paper Bag Waist</p><p><b>Waist Line</b>: Natural</p><p><b>Fit Type</b>: Regular Fit</p><p><b>Sheer</b>: No</p><p><b>Closure Type</b>: Elastic Waist</p><p><b>Material</b>: Polyester</p><p><b>Composition</b>: 100% Polyester</p><p><b>Fabric</b>: Non-Stretch</p><p><b>Care Instructions</b>: Machine wash or professional dry clean</p>,img/Shorts/rw2107120669062993.jpg,,Size#S:M:L:,31.6,,,,1,1,,,Shorts,,Mushroom Print Belted Shorts,Mushroom Print Belted Shorts,Mushroom Print Belted Shorts,,,,,,,,,
XAOMUFR0164,Ruffle Armhole Flower Embroidered Striped Top,,<p><b>Style</b>: Boho</p><p><b>Style</b>: Cute</p><p><b>Color</b>: Blue</p><p><b>Pattern Type</b>: Striped</p><p><b>Pattern Type</b>: Floral</p><p><b>Length</b>: Regular</p><p><b>Season</b>: Summer</p><p><b>Type</b>: Top</p><p><b>Details</b>: Ruffle</p><p><b>Details</b>: Embroidery</p><p><b>Sleeve Length</b>: Cap Sleeve</p><p><b>Neckline</b>: Notched</p><p><b>Fit Type</b>: Regular Fit</p><p><b>Sheer</b>: No</p><p><b>Placket Type</b>: Pullovers</p><p><b>Material</b>: Cotton</p><p><b>Composition</b>: 100% Cotton</p><p><b>Fabric</b>: Non-Stretch</p><p><b>Care Instructions</b>: Machine wash or professional dry clean</p>,img/Blouses/swblouse07200227202.jpg,,Size#XS:S:M:L:XL:,24.22,,,,1,1,,,Blouses,,Ruffle Armhole Flower Embroidered Striped Top,Ruffle Armhole Flower Embroidered Striped Top,Ruffle Armhole Flower Embroidered Striped Top,,,,,,,,,
XAOMUFR0165,Paisley Print Hanky Hem Halter Top,,<p><b>Style</b>: Sexy</p><p><b>Color</b>: Black</p><p><b>Pattern Type</b>: Paisley</p><p><b>Length</b>: Crop</p><p><b>Season</b>: Summer</p><p><b>Type</b>: Halter</p><p><b>Details</b>: Tie Back</p><p><b>Neckline</b>: Halter</p><p><b>Fit Type</b>: Slim Fit</p><p><b>Sheer</b>: No</p><p><b>Material</b>: Polyester</p><p><b>Composition</b>: 100% Polyester</p><p><b>Fabric</b>: Non-Stretch</p><p><b>Care Instructions</b>: Machine wash or professional dry clean</p>,img/Tank_Tops__Camis/sW210607567783048.jpg,,Size#S:M:L:,27.09,,,,1,1,,,Tank Tops & Cam's,,Paisley Print Hanky Hem Halter Top,Paisley Print Hanky Hem Halter Top,Paisley Print Hanky Hem Halter Top,,,,,,,,,
XAOMUFR0166,Red Sparkly Glitter Tube Top,,<p><b>Style</b>: Sexy</p><p><b>Color</b>: Red</p><p><b>Pattern Type</b>: Plain</p><p><b>Length</b>: Crop</p><p><b>Season</b>: Summer</p><p><b>Details</b>: Drawstring</p><p><b>Sleeve Length</b>: Sleeveless</p><p><b>Fit Type</b>: Slim Fit</p><p><b>Neckline</b>: Strapless</p><p><b>Placket Type</b>: Pullovers</p><p><b>Material</b>: Polyester</p><p><b>Composition</b>: 65% Polyester</p><p><b>Composition</b>: 35% Cotton</p><p><b>Fabric</b>: Slight Stretch</p><p><b>Care Instructions</b>: Machine wash or professional dry clean</p>,img/Women_Tops/swtop01190904470.jpg,,Size#S:M:L:XL:XXL:,25.33,,,,1,1,,,Women Tops,,Red Sparkly Glitter Tube Top,Red Sparkly Glitter Tube Top,Red Sparkly Glitter Tube Top,,,,,,,,,
XAOMUFR0167,6 Pairs Vintage Trendy Multiple Types Of Shapes Alloy Earrings Set,,"<p>Style: Vintage,Trendy</p><p>Type: Earrings Set</p><p>Weight: 60 g</p><p>Material: Alloy </p><p>Quantity: 6 Pairs </p><p>Package Includes:</p><p>1 x Earrings Set</p><p>Notice:</p>",img/Earrings/SKUH93895.jpg,,Size#,20.68,,,,1,1,,,Earrings,,6 Pairs Vintage Trendy Multiple Types Of Shapes Alloy Earrings Set,6 Pairs Vintage Trendy Multiple Types Of Shapes Alloy Earrings Set,6 Pairs Vintage Trendy Multiple Types Of Shapes Alloy Earrings Set,,,,,,,,,
XAOMUFR0168,Cartoon Bear Paw Pendant Necklace,,<p><b>Type</b>: Pendant Necklaces</p><p><b>Material</b>: Alloy</p><p><b>Color</b>: Gold</p><p><b>Metal Color</b>: Gold</p><p><b>Style</b>: Casual</p>,img/Pendant_Necklaces/swneck18200924022.jpg,,Size#,11.5,,,,1,1,,,Pendant Necklaces,,Cartoon Bear Paw Pendant Necklace,Cartoon Bear Paw Pendant Necklace,Cartoon Bear Paw Pendant Necklace,,,,,,,,,
XAOMUFR0169,Women Multi-Carry Anti theft Tassel Multi-pocket Crossbody Bag Backpack,,"<p>Color:Brown, Grey, Black, Green, Red</p><p>Material:PU</p>",img/Backpack/SKUF43456.jpg,,Size#,73.03,,,,1,1,,,Backpack,,Women Multi-Carry Anti theft Tassel Multi-pocket Crossbody Bag Backpack,Women Multi-Carry Anti theft Tassel Multi-pocket Crossbody Bag Backpack,Women Multi-Carry Anti theft Tassel Multi-pocket Crossbody Bag Backpack,,,,,,,,,
XAOMUFR0170,Women Casual Soft Breathable Hollow Hook Loop Flats,,"<p>Color:Beige, Black, Brown, White, Blue</p><p>Closure Type:Hook & Loop</p><p>Toe Type:Round</p><p>Upper Material:PU</p><p>Style:Casual</p><p>Outsole Material:Rubber</p><p>Occasion:Daily</p><p>Function:Breathable, Soft</p><p>Season:Summer</p>",img/Flats/SKUF64544.jpg,,Size#US 5:US 6:US 7:US 8:US 9:US 10:US 11:,52.07,,,,1,1,,,Flats,,Women Casual Soft Breathable Hollow Hook Loop Flats,Women Casual Soft Breathable Hollow Hook Loop Flats,Women Casual Soft Breathable Hollow Hook Loop Flats,,,,,,,,,
XAOMUFR0171,Women Pointed Toe Flower Carved Hollow Out Synthetic Suede Splicing Mesh Comfy Chunky Heel Ankle Boots,,"<p>Color:Black</p><p>Closure Type:Back-zip</p><p>Heel Type:Chunky Heel</p><p>Heel Height:5-8cm In Heel</p><p>Toe Type:Pointed</p><p>Pattern:Solid</p><p>Design Element:Hollow out</p><p>Upper Material:Mesh</p><p>Style:Casual, Elegant</p><p>Outsole Material:Rubber</p><p>Occasion:Casual</p><p>Function:Breathable, Hard-wearing</p><p>Season:Summer, Spring&Fall</p>",img/Heels/SKUH89686.jpg,,Size#US 5:US 6:US 7:US 8:US 9:US 10:US 11:,49.78,,,,1,1,,,Heels,,Women Pointed Toe Flower Carved Hollow Out Synthetic Suede Splicing Mesh Comfy Chunky Heel Ankle Boots,Women Pointed Toe Flower Carved Hollow Out Synthetic Suede Splicing Mesh Comfy Chunky Heel Ankle Boots,Women Pointed Toe Flower Carved Hollow Out Synthetic Suede Splicing Mesh Comfy Chunky Heel Ankle Boots,,,,,,,,,
