v_sku,v_name,v_short_description,v_description,v_image,v_url,v_attribute,v_price,v_specials_price,v_specials_expire_date,v_date_added,v_in_stock,v_status,v_viewed,v_ordered,v_category_sku,v_sort_order,v_meta_title,v_meta_keywords,v_meta_description,v_brand_filter,v_class_filter,v_color_filter,v_gender_filter,v_material_filter,v_year_filter,v_origin_filter,v_series_filter,v_spec_filter
YWQSPFD0130,Ditsy Floral Chiffon Self-Tie Crop Top,,<p><b>Style</b>: Casual</p><p><b>Color</b>: Multicolor</p><p><b>Pattern Type</b>: Ditsy Floral</p><p><b>Length</b>: Crop</p><p><b>Season</b>: Summer</p><p><b>Type</b>: Top</p><p><b>Details</b>: Knot</p><p><b>Details</b>: Wrap</p><p><b>Sleeve Type</b>: Butterfly Sleeve</p><p><b>Sleeve Length</b>: Cap Sleeve</p><p><b>Fit Type</b>: Regular Fit</p><p><b>Neckline</b>: V neck</p><p><b>Placket Type</b>: Pullovers</p><p><b>Composition</b>: 65% Polyester</p><p><b>Composition</b>: 35% Cotton</p><p><b>Fabric</b>: Non-Stretch</p><p><b>Care Instructions</b>: Machine wash or professional dry clean</p>,img/Blouses/rblo180619303.jpg,,Size#S:M:L:XL:,25.32,,,,1,1,,,Blouses,,Ditsy Floral Chiffon Self-Tie Crop Top,Ditsy Floral Chiffon Self-Tie Crop Top,Ditsy Floral Chiffon Self-Tie Crop Top,,,,,,,,,
YWQSPFD0131,Vintage Cuff Bracelets Babysbreath Sakura Dry Flower Glass Wax Rope Ethnic Jewelry for Women,,"<p>
	</p><p>
	</p><p>
</p><p>Notice:</p>",img/Bracelets/SKUA18013.jpg,,Size#,26.21,,,,1,1,,,Bracelets,,Vintage Cuff Bracelets Babysbreath Sakura Dry Flower Glass Wax Rope Ethnic Jewelry for Women,Vintage Cuff Bracelets Babysbreath Sakura Dry Flower Glass Wax Rope Ethnic Jewelry for Women,Vintage Cuff Bracelets Babysbreath Sakura Dry Flower Glass Wax Rope Ethnic Jewelry for Women,,,,,,,,,
YWQSPFD0132,Sweet Pink Flower Charm Letters Engraved Finger Rings Engagement Wedding Jewelry for Women,,"<p>Style: Trendy</p><p>Type: Finger Ring</p><p>Main Color: Silver</p><p>Weight: About 4g</p><p>Material: Zinc Alloy</p><p>Ring Size: 6 / 7 / 8</p><p>(Please see the size reference for size conversion and detail information.)</p><p>1 x Ring</p><p>
	</p>",img/Rings/SKU988085.jpg,,Size#6:7:8:,17.85,,,,1,1,,,Rings,,Sweet Pink Flower Charm Letters Engraved Finger Rings Engagement Wedding Jewelry for Women,Sweet Pink Flower Charm Letters Engraved Finger Rings Engagement Wedding Jewelry for Women,Sweet Pink Flower Charm Letters Engraved Finger Rings Engagement Wedding Jewelry for Women,,,,,,,,,
YWQSPFD0133,Women Genuine Leather High-end Long Wallet Double Zipper 12 Card Slot Phone Bag Solid Coin Purse,,"<p>Color:Green, Red</p><p>Style:Vintage</p><p>Decoration:Genuine Leather</p>",img/Wallets/SKU973178.jpg,,Size#,56.81,,,,1,1,,,Wallets,,Women Genuine Leather High-end Long Wallet Double Zipper 12 Card Slot Phone Bag Solid Coin Purse,Women Genuine Leather High-end Long Wallet Double Zipper 12 Card Slot Phone Bag Solid Coin Purse,Women Genuine Leather High-end Long Wallet Double Zipper 12 Card Slot Phone Bag Solid Coin Purse,,,,,,,,,
YWQSPFD0134,SOCOFY Elegant Floral Colorful Genuine Leather Splicing Winebowl Heel Fisherman Sandals,,"<p>Color:Green, Red</p><p>Type:Gladiator sandals</p><p>Closure Type:Buckle, Hasp</p><p>Heel Type:Cone Heel</p><p>Heel Height:3-5cm In Low Heel</p><p>Toe Type:Round</p><p>Pattern:Striped, Calico</p><p>Design Element:Floral, Side Stripe</p><p>Upper Material:Leather</p><p>Style:Classic, Bohemia, Elegant</p><p>Outsole Material:Rubber</p><p>Structure:Buckle</p><p>Occasion:Party, Daily</p><p>Decoration:Flower, Hollow Out</p><p>Function:Soft</p><p>Season:Summer</p>",img/Sandals/SKUC08706.jpg,,Size#US 5:US 6:US 7:US 8:US 9:US 10:US 11:,54.76,,,,1,1,,,Sandals,,SOCOFY Elegant Floral Colorful Genuine Leather Splicing Winebowl Heel Fisherman Sandals,SOCOFY Elegant Floral Colorful Genuine Leather Splicing Winebowl Heel Fisherman Sandals,SOCOFY Elegant Floral Colorful Genuine Leather Splicing Winebowl Heel Fisherman Sandals,,,,,,,,,
YWQSPFD0135,Women Tassel Decor Slip Resistant Casual Ladies Creepers Brogue Shoes,,"<p>Color:Khaki, Yellow, Pink, Blue, Grey</p><p>Closure Type:Lace-up</p><p>Heel Type:Flat</p><p>Heel Height:1-3cm In Flat</p><p>Toe Type:Round</p><p>Pattern:Color Block</p><p>Design Element:Tassel</p><p>Upper Material:PU</p><p>Style:Casual</p><p>Outsole Material:Rubber</p><p>Function:Hard-wearing</p><p>Season:Summer</p>",img/Flats/SKUF07038.jpg,,Size#US 5:US 6:US 7:US 8:US 9:US 10:US 11:US 12:,55.33,,,,1,1,,,Flats,,Women Tassel Decor Slip Resistant Casual Ladies Creepers Brogue Shoes,Women Tassel Decor Slip Resistant Casual Ladies Creepers Brogue Shoes,Women Tassel Decor Slip Resistant Casual Ladies Creepers Brogue Shoes,,,,,,,,,
YWQSPFD0136,Solid Ribbed Crop Cami,,<p><b>Style</b>: Casual</p><p><b>Color</b>: Dusty Blue</p><p><b>Pattern Type</b>: Plain</p><p><b>Length</b>: Crop</p><p><b>Season</b>: Summer</p><p><b>Type</b>: Cami</p><p><b>Details</b>: Rib-Knit</p><p><b>Fit Type</b>: Slim Fit</p><p><b>Neckline</b>: Spaghetti Strap</p><p><b>Sheer</b>: No</p><p><b>Material</b>: Cotton</p><p><b>Composition</b>: 65% Cotton</p><p><b>Composition</b>: 35% Polyester</p><p><b>Fabric</b>: Slight Stretch</p><p><b>Care Instructions</b>: Machine wash or professional dry clean</p>,img/Tank_Tops__Camis/rw2106212575301099.jpg,,Size#XS:S:M:L:,27.15,,,,1,1,,,Tank Tops & Cam's,,Solid Ribbed Crop Cami,Solid Ribbed Crop Cami,Solid Ribbed Crop Cami,,,,,,,,,
YWQSPFD0137,Butterfly & Letter Graphic Asymmetrical Hem Crop Tee,,<p><b>Style</b>: Casual</p><p><b>Color</b>: Apricot</p><p><b>Pattern Type</b>: Letter</p><p><b>Pattern Type</b>: Animal</p><p><b>Length</b>: Crop</p><p><b>Season</b>: Summer</p><p><b>Neckline</b>: Round Neck</p><p><b>Sleeve Length</b>: Short Sleeve</p><p><b>Fit Type</b>: Regular Fit</p><p><b>Sleeve Type</b>: Regular Sleeve</p><p><b>Hem Shaped</b>: Asymmetrical</p><p><b>Placket Type</b>: Pullovers</p><p><b>Sheer</b>: No</p><p><b>Material</b>: Cotton Blends</p><p><b>Composition</b>: 80% Polyester</p><p><b>Composition</b>: 20% Cotton</p><p><b>Fabric</b>: Medium Stretch</p><p><b>Care Instructions</b>: Machine wash or professional dry clean</p>,img/T___Shirts/rw2106305055500450.jpg,,Size#XS:S:M:L:,24.8,,,,1,1,,,T-Shirts,,Butterfly & Letter Graphic Asymmetrical Hem Crop Tee,Butterfly & Letter Graphic Asymmetrical Hem Crop Tee,Butterfly & Letter Graphic Asymmetrical Hem Crop Tee,,,,,,,,,
YWQSPFD0138,White Drawstring Crop Top,,<p><b>Style</b>: Casual</p><p><b>Color</b>: White</p><p><b>Pattern Type</b>: Plain</p><p><b>Length</b>: Crop</p><p><b>Season</b>: Summer</p><p><b>Details</b>: Drawstring</p><p><b>Details</b>: Lettuce Trim</p><p><b>Fit Type</b>: Regular Fit</p><p><b>Sleeve Length</b>: Short Sleeve</p><p><b>Neckline</b>: V neck</p><p><b>Placket Type</b>: Pullovers</p><p><b>Sheer</b>: No</p><p><b>Belt</b>: No</p><p><b>Body</b>: Unlined</p><p><b>Material</b>: Cotton</p><p><b>Composition</b>: 65% Cotton</p><p><b>Composition</b>: 35% Polyester</p><p><b>Fabric</b>: Slight Stretch</p><p><b>Care Instructions</b>: Machine wash or professional dry clean</p>,img/Women_Tops/rwtop03200520270.jpg,,Size#S:M:L:,22.46,,,,1,1,,,Women Tops,,White Drawstring Crop Top,White Drawstring Crop Top,White Drawstring Crop Top,,,,,,,,,
YWQSPFD0139,Mushroom Print Button Front Blouse,,<p><b>Style</b>: Casual</p><p><b>Color</b>: Multicolor</p><p><b>Pattern Type</b>: Fruit&Vegetable</p><p><b>Pattern Type</b>: All Over Print</p><p><b>Length</b>: Long</p><p><b>Season</b>: Summer</p><p><b>Type</b>: Shirt</p><p><b>Details</b>: Button Front</p><p><b>Neckline</b>: Collar</p><p><b>Fit Type</b>: Regular Fit</p><p><b>Sleeve Length</b>: Short Sleeve</p><p><b>Sleeve Type</b>: Regular Sleeve</p><p><b>Sheer</b>: No</p><p><b>Placket Type</b>: Placket</p><p><b>Material</b>: Polyester</p><p><b>Composition</b>: 100% Polyester</p><p><b>Fabric</b>: Non-Stretch</p><p><b>Care Instructions</b>: Machine wash or professional dry clean</p><p><b>Style</b>: Casual</p><p><b>Color</b>: Multicolor</p><p><b>Pattern Type</b>: Fruit&Vegetable</p><p><b>Length</b>: Regular</p><p><b>Season</b>: Summer</p><p><b>Type</b>: Shirt</p><p><b>Details</b>: Button Front</p><p><b>Neckline</b>: Collar</p><p><b>Fit Type</b>: Regular Fit</p><p><b>Sleeve Length</b>: Short Sleeve</p><p><b>Sleeve Type</b>: Drop Shoulder</p><p><b>Sheer</b>: No</p><p><b>Placket Type</b>: Placket</p><p><b>Material</b>: Polyester</p><p><b>Composition</b>: 100% Polyester</p><p><b>Fabric</b>: Non-Stretch</p><p><b>Care Instructions</b>: Machine wash or professional dry clean</p><p><b>Style</b>: Casual</p><p><b>Color</b>: Multicolor</p><p><b>Pattern Type</b>: Fruit&Vegetable</p><p><b>Pattern Type</b>: All Over Print</p><p><b>Length</b>: Long</p><p><b>Season</b>: Summer</p><p><b>Type</b>: Shirt</p><p><b>Details</b>: Button Front</p><p><b>Neckline</b>: Collar</p><p><b>Fit Type</b>: Regular Fit</p><p><b>Sleeve Length</b>: Short Sleeve</p><p><b>Sleeve Type</b>: Regular Sleeve</p><p><b>Sheer</b>: No</p><p><b>Placket Type</b>: Placket</p><p><b>Material</b>: Polyester</p><p><b>Composition</b>: 100% Polyester</p><p><b>Fabric</b>: Non-Stretch</p><p><b>Care Instructions</b>: Machine wash or professional dry clean</p>,img/Blouses/rwblouse25210525876.jpg,,Size#XS:S:M:L:XL:XXL:,27.71,,,,1,1,,,Blouses,,Mushroom Print Button Front Blouse,Mushroom Print Button Front Blouse,Mushroom Print Button Front Blouse,,,,,,,,,
YWQSPFD0140,Punk Multilayer Unisex Bracelets Wooden Beads Maple Leaf Casual Bracelet for Men Gift,,"<p>Type: Multilayer Bracelet</p><p>Main Color: Black</p><p>Weight: About 15g</p><p>Chain Length: About 17cm / 6.69' (Adjustable)</p><p>
	Diameter Size: About 6cm / 2.36'</p><p>
	</p><p>1 x </p>",img/Bracelets/SKU821863.jpg,,Size#,24.23,,,,1,1,,,Bracelets,,Punk Multilayer Unisex Bracelets Wooden Beads Maple Leaf Casual Bracelet for Men Gift,Punk Multilayer Unisex Bracelets Wooden Beads Maple Leaf Casual Bracelet for Men Gift,Punk Multilayer Unisex Bracelets Wooden Beads Maple Leaf Casual Bracelet for Men Gift,,,,,,,,,
YWQSPFD0141,Alloy Vintage Silver S925 Exaggerated Large Flower Ring Open Ring,,"<p>Style: Vintage</p><p>Type: Ring</p><p>Color: Silver</p><p>Weight: 8g</p><p>Length:Adjustable</p><p>Material: Alloy,S925</p><p>Package Includes:</p><p>1 x Ring</p><p>Notice:</p>",img/Rings/SKUH75893.jpg,,Size#,21.16,,,,1,1,,,Rings,,Alloy Vintage Silver S925 Exaggerated Large Flower Ring Open Ring,Alloy Vintage Silver S925 Exaggerated Large Flower Ring Open Ring,Alloy Vintage Silver S925 Exaggerated Large Flower Ring Open Ring,,,,,,,,,
YWQSPFD0142,Women Genuine Leather 12 Card Slots Patchwork Floral Photo Card Money Clip Coin Purse Multifunctional Wallet,,"<p>Color:Pink, Orange, Green, Black, Blue</p><p>Wallets Style:Clasp Closure</p><p>Wallet Type:Money Clip, ID Wallets</p><p>Material:Faux Fur, PU</p><p>Style:Casual</p>",img/Wallets/SKUG05328.jpg,,Size#,65.8,,,,1,1,,,Wallets,,Women Genuine Leather 12 Card Slots Patchwork Floral Photo Card Money Clip Coin Purse Multifunctional Wallet,Women Genuine Leather 12 Card Slots Patchwork Floral Photo Card Money Clip Coin Purse Multifunctional Wallet,Women Genuine Leather 12 Card Slots Patchwork Floral Photo Card Money Clip Coin Purse Multifunctional Wallet,,,,,,,,,
YWQSPFD0143,Women Flowers Decor Casual Comfy Clip Toe Strappy Flat Sandals,,<p>Color:White</p><p>Closure Type:Slip-On</p><p>Toe Type:Clip Toe</p><p>Upper Material:PU</p><p>Style:Casual</p><p>Outsole Material:Rubber</p><p>Occasion:Beach</p><p>Function:Soft</p><p>Season:Summer</p>,img/Sandals/SKUF16843.jpg,,Size#US 5:US 6:US 7:US 8:US 9:US 10:US 11:US 12:,62.49,,,,1,1,,,Sandals,,Women Flowers Decor Casual Comfy Clip Toe Strappy Flat Sandals,Women Flowers Decor Casual Comfy Clip Toe Strappy Flat Sandals,Women Flowers Decor Casual Comfy Clip Toe Strappy Flat Sandals,,,,,,,,,
YWQSPFD0144,Women's Metal Leather Solid Color Soft Loafers Shoes,,"<p>Color:Black</p><p>Type:Loafers</p><p>Closure Type:Slip-On</p><p>Heel Type:Flat</p><p>Heel Height:1-3cm In Flat</p><p>Toe Type:Round</p><p>Pattern:Solid</p><p>Design Element:Metal</p><p>Upper Material:PU</p><p>Style:Casual</p><p>Outsole Material:Rubber</p><p>Structure:Slip-On</p><p>Occasion:Casual</p><p>Function:Antiskid, Soft, Hard-wearing</p><p>Season:Summer, Autumn, Spring</p>",img/Flats/SKUG01983.jpg,,Size#US 5:US 6:US 7:US 8:US 9:,61.16,,,,1,1,,,Flats,,Women's Metal Leather Solid Color Soft Loafers Shoes,Women's Metal Leather Solid Color Soft Loafers Shoes,Women's Metal Leather Solid Color Soft Loafers Shoes,,,,,,,,,
YWQSPFD0145,Leopard Halter Crop Top,,<p><b>Style</b>: Sexy</p><p><b>Color</b>: Multicolor</p><p><b>Pattern Type</b>: Leopard</p><p><b>Length</b>: Crop</p><p><b>Season</b>: Summer</p><p><b>Type</b>: Halter</p><p><b>Details</b>: Backless</p><p><b>Details</b>: Asymmetrical</p><p><b>Details</b>: Tie Back</p><p><b>Neckline</b>: Halter</p><p><b>Fit Type</b>: Slim Fit</p><p><b>Sheer</b>: No</p><p><b>Material</b>: Polyester</p><p><b>Composition</b>: 93% Polyester</p><p><b>Composition</b>: 7% Spandex</p><p><b>Fabric</b>: Slight Stretch</p><p><b>Care Instructions</b>: Machine wash or professional dry clean</p>,img/Tank_Tops__Camis/swvest07201208404.jpg,,Size#XS:S:M:L:XL:,28.3,,,,1,1,,,Tank Tops & Cam's,,Leopard Halter Crop Top,Leopard Halter Crop Top,Leopard Halter Crop Top,,,,,,,,,
YWQSPFD0146,Figure Graphic Crop Tee,,<p><b>Style</b>: Casual</p><p><b>Color</b>: Green</p><p><b>Pattern Type</b>: Figure</p><p><b>Length</b>: Crop</p><p><b>Season</b>: Summer</p><p><b>Neckline</b>: Round Neck</p><p><b>Sleeve Length</b>: Short Sleeve</p><p><b>Fit Type</b>: Regular Fit</p><p><b>Sleeve Type</b>: Regular Sleeve</p><p><b>Placket Type</b>: Pullovers</p><p><b>Sheer</b>: No</p><p><b>Material</b>: Cotton</p><p><b>Composition</b>: 100% Cotton</p><p><b>Fabric</b>: Slight Stretch</p><p><b>Care Instructions</b>: Machine wash or professional dry clean</p><p><b>Style</b>: Casual</p><p><b>Color</b>: Black</p><p><b>Pattern Type</b>: Figure</p><p><b>Length</b>: Crop</p><p><b>Season</b>: Summer</p><p><b>Neckline</b>: Round Neck</p><p><b>Sleeve Length</b>: Short Sleeve</p><p><b>Fit Type</b>: Regular Fit</p><p><b>Sleeve Type</b>: Regular Sleeve</p><p><b>Placket Type</b>: Pullovers</p><p><b>Sheer</b>: No</p><p><b>Material</b>: Cotton</p><p><b>Composition</b>: 100% Cotton</p><p><b>Fabric</b>: Slight Stretch</p><p><b>Care Instructions</b>: Machine wash or professional dry clean</p>,img/T___Shirts/rwtee25210326236.jpg,,Size#S:M:L:XL:,31.86,,,,1,1,,,T-Shirts,,Figure Graphic Crop Tee,Figure Graphic Crop Tee,Figure Graphic Crop Tee,,,,,,,,,
YWQSPFD0147,Floral Graphic Tie Front Top,,<p><b>Style</b>: Boho</p><p><b>Color</b>: Multicolor</p><p><b>Pattern Type</b>: Floral</p><p><b>Length</b>: Crop</p><p><b>Season</b>: Summer</p><p><b>Details</b>: Tie Front</p><p><b>Fit Type</b>: Regular Fit</p><p><b>Sleeve Length</b>: Short Sleeve</p><p><b>Neckline</b>: V neck</p><p><b>Sleeve Type</b>: Regular Sleeve</p><p><b>Placket Type</b>: Placket</p><p><b>Sheer</b>: No</p><p><b>Material</b>: Polyester</p><p><b>Composition</b>: 95% Polyester</p><p><b>Composition</b>: 5% Spandex</p><p><b>Fabric</b>: Non-Stretch</p><p><b>Care Instructions</b>: Machine wash or professional dry clean</p>,img/Women_Tops/sW210616233488860.jpg,,Size#XS:S:M:L:,23.03,,,,1,1,,,Women Tops,,Floral Graphic Tie Front Top,Floral Graphic Tie Front Top,Floral Graphic Tie Front Top,,,,,,,,,
YWQSPFD0148,Ditsy Floral Tie Front Peplum Blouse,,<p><b>Style</b>: Boho</p><p><b>Color</b>: Rose Red</p><p><b>Pattern Type</b>: Ditsy Floral</p><p><b>Length</b>: Crop</p><p><b>Season</b>: Summer</p><p><b>Type</b>: Peplum</p><p><b>Details</b>: Ruffle Hem</p><p><b>Details</b>: Tie Front</p><p><b>Sleeve Type</b>: Butterfly Sleeve</p><p><b>Fit Type</b>: Regular Fit</p><p><b>Sleeve Length</b>: Short Sleeve</p><p><b>Neckline</b>: V neck</p><p><b>Sheer</b>: No</p><p><b>Placket Type</b>: Pullovers</p><p><b>Material</b>: Polyester</p><p><b>Composition</b>: 100% Polyester</p><p><b>Fabric</b>: Non-Stretch</p><p><b>Care Instructions</b>: Machine wash or professional dry clean</p><p><b>Style</b>: Boho</p><p><b>Color</b>: Green</p><p><b>Pattern Type</b>: Ditsy Floral</p><p><b>Length</b>: Regular</p><p><b>Season</b>: Summer</p><p><b>Type</b>: Peplum</p><p><b>Details</b>: Ruffle Hem</p><p><b>Details</b>: Knot</p><p><b>Fit Type</b>: Regular Fit</p><p><b>Sleeve Length</b>: Short Sleeve</p><p><b>Neckline</b>: V neck</p><p><b>Sleeve Type</b>: Regular Sleeve</p><p><b>Sheer</b>: No</p><p><b>Placket Type</b>: Placket</p><p><b>Material</b>: Polyester</p><p><b>Composition</b>: 100% Polyester</p><p><b>Fabric</b>: Non-Stretch</p><p><b>Care Instructions</b>: Machine wash or professional dry clean</p><p><b>Style</b>: Boho</p><p><b>Color</b>: Mustard Yellow</p><p><b>Pattern Type</b>: Ditsy Floral</p><p><b>Length</b>: Crop</p><p><b>Season</b>: Summer</p><p><b>Type</b>: Peplum</p><p><b>Details</b>: Ruffle Hem</p><p><b>Details</b>: Tie Front</p><p><b>Sleeve Type</b>: Butterfly Sleeve</p><p><b>Fit Type</b>: Regular Fit</p><p><b>Sleeve Length</b>: Short Sleeve</p><p><b>Neckline</b>: V neck</p><p><b>Sheer</b>: No</p><p><b>Placket Type</b>: Pullovers</p><p><b>Material</b>: Polyester</p><p><b>Composition</b>: 100% Polyester</p><p><b>Fabric</b>: Non-Stretch</p><p><b>Care Instructions</b>: Machine wash or professional dry clean</p>,img/Blouses/swblouse01200714928.jpg,,Size#S:M:L:XL:,29.73,,,,1,1,,,Blouses,,Ditsy Floral Tie Front Peplum Blouse,Ditsy Floral Tie Front Peplum Blouse,Ditsy Floral Tie Front Peplum Blouse,,,,,,,,,
YWQSPFD0149,Trendy Metal Round Natural Landscape Print Glass Multi-layer Bracelet,,<p>﻿</p><p>Style: Trendy</p><p>Type: Bracelet</p><p>Color: Black</p><p>Weight: 15g</p><p>Size: Adjustable</p><p>Material: Leather</p><p>1 X Earrings</p>,img/Bracelets/SKUG48786.jpg,,Size#,22.05,,,,1,1,,,Bracelets,,Trendy Metal Round Natural Landscape Print Glass Multi-layer Bracelet,Trendy Metal Round Natural Landscape Print Glass Multi-layer Bracelet,Trendy Metal Round Natural Landscape Print Glass Multi-layer Bracelet,,,,,,,,,
YWQSPFD0150,Vintage Moonstone Finger Ring Trendy Finger Accessories Gift Jewelry for Women,,"<p>Style: Vintage</p><p>Main Color: Blue</p><p>Weight: About 7g</p><p>Type: Finger Ring</p><p>Material: </p><p>Copper, Resin</p><p>Ring Size: 6 / 7 / 8 </p><p>1 x Ring</p><p>
	</p>",img/Rings/SKU991160.jpg,,Size#6:7:8:,12.36,,,,1,1,,,Rings,,Vintage Moonstone Finger Ring Trendy Finger Accessories Gift Jewelry for Women,Vintage Moonstone Finger Ring Trendy Finger Accessories Gift Jewelry for Women,Vintage Moonstone Finger Ring Trendy Finger Accessories Gift Jewelry for Women,,,,,,,,,
YWQSPFD0151,Women Genuine Leather Casual Cute Animal Pig Pattern Mini Hand Carry Coin Bag Keychain Wallet Storage Bag,,"<p>Color:Black, Grey, Blue, Red</p><p>Wallet Type:Keychain Wallet, Coin Purse</p><p>Material:Cow Leather</p><p>Style:Casual</p>",img/Wallets/SKUG54564.jpg,,Size#,61.91,,,,1,1,,,Wallets,,Women Genuine Leather Casual Cute Animal Pig Pattern Mini Hand Carry Coin Bag Keychain Wallet Storage Bag,Women Genuine Leather Casual Cute Animal Pig Pattern Mini Hand Carry Coin Bag Keychain Wallet Storage Bag,Women Genuine Leather Casual Cute Animal Pig Pattern Mini Hand Carry Coin Bag Keychain Wallet Storage Bag,,,,,,,,,
YWQSPFD0152,SOCOFY Vintage Floral Hand Painted Genuine Leather Stitching Soft Buckle Strap Sandals,,"<p>Color:Red</p><p>Type:Hand made Sandals</p><p>Closure Type:Hasp</p><p>Heel Type:Block Heel</p><p>Heel Height:1-3cm In Flat</p><p>Toe Type:Opened</p><p>Pattern:Floral</p><p>Design Element:Floral, Print</p><p>Upper Material:Leather</p><p>Style:Retro</p><p>Outsole Material:Rubber</p><p>Structure:Wide Band</p><p>Occasion:Daily</p><p>Decoration:Flower</p><p>Function:Soft</p><p>Season:Summer</p>",img/Sandals/SKUB55799.jpg,,Size#US 5:US 6:US 7:US 8:US 9.5:US 10.5:US 11.5:,51.91,,,,1,1,,,Sandals,,SOCOFY Vintage Floral Hand Painted Genuine Leather Stitching Soft Buckle Strap Sandals,SOCOFY Vintage Floral Hand Painted Genuine Leather Stitching Soft Buckle Strap Sandals,SOCOFY Vintage Floral Hand Painted Genuine Leather Stitching Soft Buckle Strap Sandals,,,,,,,,,
YWQSPFD0153,Women Casual Soft Handmade Floral Genuine Leather Flats,,"<p>Color:Red, Yellow, Purple, Black, Blue, Grey</p><p>Closure Type:Slip-On</p><p>Toe Type:Round</p><p>Upper Material:Leather</p><p>Style:Casual</p><p>Occasion:Daily</p><p>Function:Breathable, Soft</p><p>Season:Summer</p>",img/Flats/SKU985764.jpg,,Size#US 5:US 6:US 7:US 8:US 9:,51.11,,,,1,1,,,Flats,,Women Casual Soft Handmade Floral Genuine Leather Flats,Women Casual Soft Handmade Floral Genuine Leather Flats,Women Casual Soft Handmade Floral Genuine Leather Flats,,,,,,,,,
YWQSPFD0154,ROMWE X Tacikworks Stitching Trim Letter Graphic Tank Top,,<p><b>Style</b>: Casual</p><p><b>Color</b>: Coffee Brown</p><p><b>Pattern Type</b>: Letter</p><p><b>Pattern Type</b>: Cartoon</p><p><b>Length</b>: Crop</p><p><b>Season</b>: Summer</p><p><b>Type</b>: Tank</p><p><b>Fit Type</b>: Regular Fit</p><p><b>Neckline</b>: Round Neck</p><p><b>Sheer</b>: No</p><p><b>Material</b>: Polyester</p><p><b>Composition</b>: 65% Polyester</p><p><b>Composition</b>: 35% Cotton</p><p><b>Fabric</b>: High Stretch</p><p><b>Care Instructions</b>: Machine wash or professional dry clean</p><p><b>Style</b>: Casual</p><p><b>Color</b>: Mint Green</p><p><b>Pattern Type</b>: Letter</p><p><b>Pattern Type</b>: Graphic</p><p><b>Length</b>: Crop</p><p><b>Season</b>: Summer</p><p><b>Type</b>: Tank</p><p><b>Neckline</b>: Round Neck</p><p><b>Fit Type</b>: Slim Fit</p><p><b>Sheer</b>: No</p><p><b>Material</b>: Polyester</p><p><b>Composition</b>: 65% Polyester</p><p><b>Composition</b>: 35% Cotton</p><p><b>Fabric</b>: High Stretch</p><p><b>Care Instructions</b>: Machine wash or professional dry clean</p><p><b>Style</b>: Casual</p><p><b>Color</b>: Black</p><p><b>Pattern Type</b>: Letter</p><p><b>Pattern Type</b>: Graphic</p><p><b>Length</b>: Crop</p><p><b>Season</b>: Summer</p><p><b>Type</b>: Tank</p><p><b>Neckline</b>: Round Neck</p><p><b>Fit Type</b>: Slim Fit</p><p><b>Sheer</b>: No</p><p><b>Material</b>: Polyester</p><p><b>Composition</b>: 65% Polyester</p><p><b>Composition</b>: 35% Cotton</p><p><b>Fabric</b>: High Stretch</p><p><b>Care Instructions</b>: Machine wash or professional dry clean</p><p><b>Style</b>: Casual</p><p><b>Color</b>: Red</p><p><b>Pattern Type</b>: Letter</p><p><b>Pattern Type</b>: Graphic</p><p><b>Length</b>: Crop</p><p><b>Season</b>: Summer</p><p><b>Type</b>: Tank</p><p><b>Neckline</b>: Round Neck</p><p><b>Fit Type</b>: Slim Fit</p><p><b>Sheer</b>: No</p><p><b>Material</b>: Polyester</p><p><b>Composition</b>: 65% Polyester</p><p><b>Composition</b>: 35% Cotton</p><p><b>Fabric</b>: High Stretch</p><p><b>Care Instructions</b>: Machine wash or professional dry clean</p><p><b>Style</b>: Casual</p><p><b>Color</b>: Apricot</p><p><b>Pattern Type</b>: Letter</p><p><b>Pattern Type</b>: Cartoon</p><p><b>Length</b>: Crop</p><p><b>Season</b>: Summer</p><p><b>Type</b>: Tank</p><p><b>Fit Type</b>: Regular Fit</p><p><b>Neckline</b>: Round Neck</p><p><b>Sheer</b>: No</p><p><b>Material</b>: Polyester</p><p><b>Composition</b>: 65% Polyester</p><p><b>Composition</b>: 35% Cotton</p><p><b>Fabric</b>: High Stretch</p><p><b>Care Instructions</b>: Machine wash or professional dry clean</p>,img/Tank_Tops__Camis/rwvest25210428884.jpg,,Size#S:M:L:XL:,25.66,,,,1,1,,,Tank Tops & Cam's,,ROMWE X Tacikworks Stitching Trim Letter Graphic Tank Top,ROMWE X Tacikworks Stitching Trim Letter Graphic Tank Top,ROMWE X Tacikworks Stitching Trim Letter Graphic Tank Top,,,,,,,,,
YWQSPFD0155,Cartoon Figure Graphic Crop Tee,,<p><b>Style</b>: Casual</p><p><b>Color</b>: Black</p><p><b>Pattern Type</b>: Figure</p><p><b>Length</b>: Crop</p><p><b>Season</b>: Summer</p><p><b>Neckline</b>: Round Neck</p><p><b>Sleeve Length</b>: Short Sleeve</p><p><b>Fit Type</b>: Regular Fit</p><p><b>Sleeve Type</b>: Regular Sleeve</p><p><b>Placket Type</b>: Pullovers</p><p><b>Sheer</b>: No</p><p><b>Material</b>: Polyester</p><p><b>Composition</b>: 80% Polyester</p><p><b>Composition</b>: 15% Cotton</p><p><b>Composition</b>: 5% Elastane</p><p><b>Fabric</b>: Slight Stretch</p><p><b>Care Instructions</b>: Machine wash or professional dry clean</p>,img/T___Shirts/rwtee25210616430.jpg,,Size#S:M:L:,29.63,,,,1,1,,,T-Shirts,,Cartoon Figure Graphic Crop Tee,Cartoon Figure Graphic Crop Tee,Cartoon Figure Graphic Crop Tee,,,,,,,,,
YWQSPFD0156,Solid One Shoulder Top,,<p><b>Style</b>: Sexy</p><p><b>Color</b>: Black</p><p><b>Pattern Type</b>: Plain</p><p><b>Length</b>: Crop</p><p><b>Season</b>: Summer</p><p><b>Details</b>: Cut Out</p><p><b>Details</b>: Rib-Knit</p><p><b>Neckline</b>: One Shoulder</p><p><b>Sleeve Length</b>: Sleeveless</p><p><b>Fit Type</b>: Slim Fit</p><p><b>Placket Type</b>: Pullovers</p><p><b>Sheer</b>: No</p><p><b>Material</b>: Polyester</p><p><b>Composition</b>: 95% Polyester</p><p><b>Composition</b>: 5% Elastane</p><p><b>Fabric</b>: High Stretch</p><p><b>Care Instructions</b>: Machine wash or professional dry clean</p>,img/Women_Tops/sW210531348895144.jpg,,Size#S:M:L:,22.32,,,,1,1,,,Women Tops,,Solid One Shoulder Top,Solid One Shoulder Top,Solid One Shoulder Top,,,,,,,,,
YWQSPFD0157,Lightning Button Front Blouse,,<p><b>Style</b>: Casual</p><p><b>Color</b>: Multicolor</p><p><b>Pattern Type</b>: Graphic</p><p><b>Length</b>: Long</p><p><b>Season</b>: Summer</p><p><b>Type</b>: Shirt</p><p><b>Details</b>: Button Front</p><p><b>Neckline</b>: Collar</p><p><b>Fit Type</b>: Regular Fit</p><p><b>Sleeve Length</b>: Short Sleeve</p><p><b>Sleeve Type</b>: Regular Sleeve</p><p><b>Sheer</b>: No</p><p><b>Placket Type</b>: Placket</p><p><b>Material</b>: Polyester</p><p><b>Composition</b>: 100% Polyester</p><p><b>Fabric</b>: Non-Stretch</p><p><b>Care Instructions</b>: Machine wash or professional dry clean</p>,img/Blouses/rw2106228121322385.jpg,,Size#S:M:L:,25.76,,,,1,1,,,Blouses,,Lightning Button Front Blouse,Lightning Button Front Blouse,Lightning Button Front Blouse,,,,,,,,,
