v_sku,v_name,v_short_description,v_description,v_image,v_url,v_attribute,v_price,v_specials_price,v_specials_expire_date,v_date_added,v_in_stock,v_status,v_viewed,v_ordered,v_category_sku,v_sort_order,v_meta_title,v_meta_keywords,v_meta_description,v_brand_filter,v_class_filter,v_color_filter,v_gender_filter,v_material_filter,v_year_filter,v_origin_filter,v_series_filter,v_spec_filter
YWQSPFD0065,Cartoon Dinosaur Tee,,<p><b>Style</b>: Casual</p><p><b>Color</b>: Black</p><p><b>Pattern Type</b>: Cartoon</p><p><b>Length</b>: Regular</p><p><b>Season</b>: Summer</p><p><b>Neckline</b>: Round Neck</p><p><b>Sleeve Length</b>: Short Sleeve</p><p><b>Fit Type</b>: Regular Fit</p><p><b>Sleeve Type</b>: Regular Sleeve</p><p><b>Placket Type</b>: Pullovers</p><p><b>Sheer</b>: No</p><p><b>Material</b>: Cotton</p><p><b>Composition</b>: 100% Cotton</p><p><b>Fabric</b>: Slight Stretch</p><p><b>Care Instructions</b>: Machine wash or professional dry clean</p><p><b>Style</b>: Casual</p><p><b>Color</b>: White</p><p><b>Pattern Type</b>: Cartoon</p><p><b>Length</b>: Regular</p><p><b>Season</b>: Summer</p><p><b>Neckline</b>: Round Neck</p><p><b>Sleeve Length</b>: Short Sleeve</p><p><b>Fit Type</b>: Regular Fit</p><p><b>Sleeve Type</b>: Regular Sleeve</p><p><b>Placket Type</b>: Pullovers</p><p><b>Sheer</b>: No</p><p><b>Material</b>: Cotton</p><p><b>Composition</b>: 100% Cotton</p><p><b>Fabric</b>: Slight Stretch</p><p><b>Care Instructions</b>: Machine wash or professional dry clean</p><p><b>Style</b>: Casual</p><p><b>Color</b>: Coral Orange</p><p><b>Pattern Type</b>: Cartoon</p><p><b>Length</b>: Regular</p><p><b>Season</b>: Summer</p><p><b>Neckline</b>: Round Neck</p><p><b>Sleeve Length</b>: Short Sleeve</p><p><b>Fit Type</b>: Regular Fit</p><p><b>Sleeve Type</b>: Regular Sleeve</p><p><b>Placket Type</b>: Pullovers</p><p><b>Sheer</b>: No</p><p><b>Material</b>: Cotton</p><p><b>Composition</b>: 100% Cotton</p><p><b>Fabric</b>: Slight Stretch</p><p><b>Care Instructions</b>: Machine wash or professional dry clean</p><p><b>Style</b>: Casual</p><p><b>Color</b>: Yellow</p><p><b>Pattern Type</b>: Cartoon</p><p><b>Length</b>: Regular</p><p><b>Season</b>: Summer</p><p><b>Neckline</b>: Round Neck</p><p><b>Sleeve Length</b>: Short Sleeve</p><p><b>Fit Type</b>: Regular Fit</p><p><b>Sleeve Type</b>: Regular Sleeve</p><p><b>Placket Type</b>: Pullovers</p><p><b>Sheer</b>: No</p><p><b>Material</b>: Cotton</p><p><b>Composition</b>: 100% Cotton</p><p><b>Fabric</b>: Slight Stretch</p><p><b>Care Instructions</b>: Machine wash or professional dry clean</p>,img/T___Shirts/rwtee03210302514.jpg,,Size#S:M:L:XL:,25.05,,,,1,1,,,T-Shirts,,Cartoon Dinosaur Tee,Cartoon Dinosaur Tee,Cartoon Dinosaur Tee,,,,,,,,,
YWQSPFD0066,Tie Front Tropical Print Top,,<p><b>Style</b>: Boho</p><p><b>Color</b>: Multicolor</p><p><b>Pattern Type</b>: Tropical</p><p><b>Length</b>: Crop</p><p><b>Season</b>: Summer</p><p><b>Details</b>: Tie Front</p><p><b>Sleeve Type</b>: Batwing Sleeve</p><p><b>Neckline</b>: Deep V Neck</p><p><b>Fit Type</b>: Regular Fit</p><p><b>Sleeve Length</b>: Short Sleeve</p><p><b>Placket Type</b>: Placket</p><p><b>Sheer</b>: No</p><p><b>Chest pad</b>: No Padding</p><p><b>Material</b>: Polyester</p><p><b>Composition</b>: 100% Polyester</p><p><b>Fabric</b>: Non-Stretch</p><p><b>Care Instructions</b>: Machine wash or professional dry clean</p>,img/Women_Tops/swtop07210111963.jpg,,Size#XS:S:M:L:,27.06,,,,1,1,,,Women Tops,,Tie Front Tropical Print Top,Tie Front Tropical Print Top,Tie Front Tropical Print Top,,,,,,,,,
YWQSPFD0067,Ruffled Off-the-Shoulder Smocked Crop Top,,<p><b>Style</b>: Boho</p><p><b>Color</b>: White</p><p><b>Pattern Type</b>: Plain</p><p><b>Length</b>: Crop</p><p><b>Season</b>: Summer</p><p><b>Type</b>: Top</p><p><b>Details</b>: Frill</p><p><b>Details</b>: Shirred</p><p><b>Neckline</b>: Off the Shoulder</p><p><b>Fit Type</b>: Regular Fit</p><p><b>Sleeve Length</b>: Short Sleeve</p><p><b>Placket Type</b>: Pullovers</p><p><b>Body</b>: Lined</p><p><b>Composition</b>: 100% Polyester</p><p><b>Fabric</b>: Non-Stretch</p><p><b>Care Instructions</b>: Machine wash or professional dry clean</p>,img/Blouses/swblouse04190522346.jpg,,Size#XS:S:M:L:,32.39,,,,1,1,,,Blouses,,Ruffled Off-the-Shoulder Smocked Crop Top,Ruffled Off-the-Shoulder Smocked Crop Top,Ruffled Off-the-Shoulder Smocked Crop Top,,,,,,,,,
YWQSPFD0068,Black Braided Leather Bracelet Multilayer Weave Adjustable Bracelets Wing Turquoise Beads Bracelet,,"<p>Style: Punk</p><p>Type: Multilayer Bracelet</p><p>
	</p><p>Material: Leather, Stone</p><p>, Zinc Alloy</p><p>Chain Length: About 17cm + 16cm / 6.69' + 6.29' ( Adjustable )</p><p>1 x Bracelet</p>",img/Bracelets/SKU897897.jpg,,Size#,12.96,,,,1,1,,,Bracelets,,Black Braided Leather Bracelet Multilayer Weave Adjustable Bracelets Wing Turquoise Beads Bracelet,Black Braided Leather Bracelet Multilayer Weave Adjustable Bracelets Wing Turquoise Beads Bracelet,Black Braided Leather Bracelet Multilayer Weave Adjustable Bracelets Wing Turquoise Beads Bracelet,,,,,,,,,
YWQSPFD0069,Punk Angel's Wings Ring Statement Full Rhinestone Adjustable Unique Engagement Rings for Women,,"<p>Style: Statement</p><p>Type: Finger Ring</p><p>Material: Zinc Alloy, Rhinestone</p><p>Main Color: Blue, White, Pink, Red</p><p>1 x Ring</p>",img/Rings/SKU897585.jpg,,Size#,26.48,,,,1,1,,,Rings,,Punk Angel's Wings Ring Statement Full Rhinestone Adjustable Unique Engagement Rings for Women,Punk Angel's Wings Ring Statement Full Rhinestone Adjustable Unique Engagement Rings for Women,Punk Angel's Wings Ring Statement Full Rhinestone Adjustable Unique Engagement Rings for Women,,,,,,,,,
YWQSPFD0070,Women Cute Mouse Pattern Prints Money Clip Multi-card Slots Purse Wallet,,"<p>Color:Pink, Yellow, Green, Black, Blue</p><p>Wallets Style:Clasp Closure</p><p>Wallet Type:Money Clip, ID Wallets, Coin Purse</p><p>Material:Faux Fur, PU</p><p>Style:Casual</p><p>Pattern:Animal-print</p>",img/Wallets/SKUG62313.jpg,,Size#,63.38,,,,1,1,,,Wallets,,Women Cute Mouse Pattern Prints Money Clip Multi-card Slots Purse Wallet,Women Cute Mouse Pattern Prints Money Clip Multi-card Slots Purse Wallet,Women Cute Mouse Pattern Prints Money Clip Multi-card Slots Purse Wallet,,,,,,,,,
YWQSPFD0071,Women Causal Lightweight Platform Buckle Cross Flat Sandals,,"<p>Color:Beige, Black, Pink, White</p><p>Toe Type:Opened, Round</p><p>Upper Material:PU</p><p>Style:Casual</p><p>Outsole Material:Rubber</p><p>Occasion:Daily</p><p>Function:Soft</p><p>Season:Summer</p>",img/Sandals/SKUB41821.jpg,,Size#US 5:US 6:US 7:US 8:US 9:,54.63,,,,1,1,,,Sandals,,Women Causal Lightweight Platform Buckle Cross Flat Sandals,Women Causal Lightweight Platform Buckle Cross Flat Sandals,Women Causal Lightweight Platform Buckle Cross Flat Sandals,,,,,,,,,
YWQSPFD0072,SOCOFY Flower Tassel Soft Leather Slip On Flat Casual Vintage Shoes,,"<p>Color:Red, Yellow, Purple, Black, Blue</p><p>Type:Loafers, Mule</p><p>Closure Type:Slip-On</p><p>Heel Type:Flat</p><p>Heel Height:1-3cm In Flat</p><p>Toe Type:Round</p><p>Pattern:Calico</p><p>Design Element:Floral</p><p>Upper Material:Leather</p><p>Style:Elegant</p><p>Outsole Material:Rubber</p><p>Structure:Slip-On</p><p>Occasion:Daily</p><p>Function:Breathable, Soft</p><p>Season:Summer, Autumn, Spring</p>",img/Flats/SKU575125.jpg,,Size#US 5:US 6:US 7:US 8:US 9:US 10:,53.47,,,,1,1,,,Flats,,SOCOFY Flower Tassel Soft Leather Slip On Flat Casual Vintage Shoes,SOCOFY Flower Tassel Soft Leather Slip On Flat Casual Vintage Shoes,SOCOFY Flower Tassel Soft Leather Slip On Flat Casual Vintage Shoes,,,,,,,,,
YWQSPFD0073,Letter Embroidery Tank Top,,<p><b>Style</b>: Casual</p><p><b>Color</b>: Navy Blue</p><p><b>Pattern Type</b>: Letter</p><p><b>Length</b>: Crop</p><p><b>Season</b>: Summer</p><p><b>Type</b>: Tank</p><p><b>Details</b>: Embroidery</p><p><b>Neckline</b>: Scoop Neck</p><p><b>Fit Type</b>: Slim Fit</p><p><b>Sheer</b>: No</p><p><b>Material</b>: Cotton</p><p><b>Composition</b>: 65% Cotton</p><p><b>Composition</b>: 35% Polyester</p><p><b>Fabric</b>: Slight Stretch</p><p><b>Care Instructions</b>: Machine wash or professional dry clean</p><p><b>Style</b>: Casual</p><p><b>Color</b>: White</p><p><b>Pattern Type</b>: Letter</p><p><b>Length</b>: Crop</p><p><b>Season</b>: Summer</p><p><b>Type</b>: Tank</p><p><b>Details</b>: Embroidery</p><p><b>Neckline</b>: Scoop Neck</p><p><b>Fit Type</b>: Slim Fit</p><p><b>Sheer</b>: No</p><p><b>Material</b>: Cotton</p><p><b>Composition</b>: 65% Cotton</p><p><b>Composition</b>: 35% Polyester</p><p><b>Fabric</b>: Slight Stretch</p><p><b>Care Instructions</b>: Machine wash or professional dry clean</p><p><b>Style</b>: Casual</p><p><b>Color</b>: Grey</p><p><b>Pattern Type</b>: Letter</p><p><b>Length</b>: Crop</p><p><b>Season</b>: Summer</p><p><b>Type</b>: Tank</p><p><b>Details</b>: Embroidery</p><p><b>Neckline</b>: Scoop Neck</p><p><b>Fit Type</b>: Slim Fit</p><p><b>Sheer</b>: No</p><p><b>Material</b>: Cotton</p><p><b>Composition</b>: 65% Cotton</p><p><b>Composition</b>: 35% Polyester</p><p><b>Fabric</b>: Slight Stretch</p><p><b>Care Instructions</b>: Machine wash or professional dry clean</p>,img/Tank_Tops__Camis/rwvest01210315945.jpg,,Size#XS:S:M:L:,28.6,,,,1,1,,,Tank Tops & Cam's,,Letter Embroidery Tank Top,Letter Embroidery Tank Top,Letter Embroidery Tank Top,,,,,,,,,
YWQSPFD0074,Graphic Oversized Tee,,<p><b>Style</b>: Casual</p><p><b>Color</b>: Black</p><p><b>Pattern Type</b>: Graphic</p><p><b>Length</b>: Long</p><p><b>Season</b>: Summer</p><p><b>Neckline</b>: Round Neck</p><p><b>Sleeve Length</b>: Short Sleeve</p><p><b>Fit Type</b>: Oversized</p><p><b>Sleeve Type</b>: Drop Shoulder</p><p><b>Placket Type</b>: Pullovers</p><p><b>Sheer</b>: No</p><p><b>Material</b>: Cotton</p><p><b>Composition</b>: 100% Cotton</p><p><b>Fabric</b>: Slight Stretch</p><p><b>Care Instructions</b>: Machine wash or professional dry clean</p><p><b>Style</b>: Casual</p><p><b>Color</b>: White</p><p><b>Pattern Type</b>: Graphic</p><p><b>Length</b>: Long</p><p><b>Season</b>: Summer</p><p><b>Neckline</b>: Round Neck</p><p><b>Sleeve Length</b>: Short Sleeve</p><p><b>Fit Type</b>: Oversized</p><p><b>Sleeve Type</b>: Drop Shoulder</p><p><b>Placket Type</b>: Pullovers</p><p><b>Sheer</b>: No</p><p><b>Material</b>: Cotton</p><p><b>Composition</b>: 100% Cotton</p><p><b>Fabric</b>: Slight Stretch</p><p><b>Care Instructions</b>: Machine wash or professional dry clean</p>,img/T___Shirts/rwtee25210617210.jpg,,Size#S:M:L:,29.16,,,,1,1,,,T-Shirts,,Graphic Oversized Tee,Graphic Oversized Tee,Graphic Oversized Tee,,,,,,,,,
YWQSPFD0075,2pcs Solid Crop Tube Top,,<p><b>Style</b>: Casual</p><p><b>Color</b>: Black and White</p><p><b>Pattern Type</b>: Plain</p><p><b>Length</b>: Crop</p><p><b>Season</b>: Summer</p><p><b>Sleeve Length</b>: Sleeveless</p><p><b>Fit Type</b>: Slim Fit</p><p><b>Neckline</b>: Strapless</p><p><b>Placket Type</b>: Pullovers</p><p><b>Sheer</b>: No</p><p><b>Material</b>: Polyester</p><p><b>Composition</b>: 100% Polyester</p><p><b>Fabric</b>: High Stretch</p><p><b>Care Instructions</b>: Machine wash or professional dry clean</p>,img/Women_Tops/rwtop01210319845.jpg,,Size#XS:S:M:L:,22.02,,,,1,1,,,Women Tops,,2pcs Solid Crop Tube Top,2pcs Solid Crop Tube Top,2pcs Solid Crop Tube Top,,,,,,,,,
YWQSPFD0076,Tie Dye Button Front Pocket Blouse,,<p><b>Style</b>: Casual</p><p><b>Color</b>: Black and White</p><p><b>Pattern Type</b>: Tie Dye</p><p><b>Length</b>: Regular</p><p><b>Season</b>: Summer</p><p><b>Type</b>: Shirt</p><p><b>Details</b>: Pocket</p><p><b>Details</b>: Button Front</p><p><b>Neckline</b>: Collar</p><p><b>Fit Type</b>: Oversized</p><p><b>Sleeve Length</b>: Short Sleeve</p><p><b>Sleeve Type</b>: Regular Sleeve</p><p><b>Sheer</b>: No</p><p><b>Placket Type</b>: Placket</p><p><b>Material</b>: Polyester</p><p><b>Composition</b>: 100% Polyester</p><p><b>Fabric</b>: Non-Stretch</p><p><b>Care Instructions</b>: Machine wash or professional dry clean</p>,img/Blouses/rwblouse25210510040.jpg,,Size#S:M:L:,25.3,,,,1,1,,,Blouses,,Tie Dye Button Front Pocket Blouse,Tie Dye Button Front Pocket Blouse,Tie Dye Button Front Pocket Blouse,,,,,,,,,
YWQSPFD0077,Vintage Tree Of Life Theme Pattern Butterfly Geometric Shape Hand-braided Glass PU Alloy Multi-layer Bracelet,,"<p>Style: Vintage</p><p>Type: Bracelet </p><p>Weight: 18 g</p><p>Length: About 16+5 cm / 6.30+1.97 in</p><p>Pendant Size: About 2.5 cm / 0.98 in</p><p>Material: Alloy,Glass,PU </p><p>Package Includes:</p><p>1 x Bracelet</p><p>Notice:</p>",img/Bracelets/SKUH97999.jpg,,Size#,24.78,,,,1,1,,,Bracelets,,Vintage Tree Of Life Theme Pattern Butterfly Geometric Shape Hand-braided Glass PU Alloy Multi-layer Bracelet,Vintage Tree Of Life Theme Pattern Butterfly Geometric Shape Hand-braided Glass PU Alloy Multi-layer Bracelet,Vintage Tree Of Life Theme Pattern Butterfly Geometric Shape Hand-braided Glass PU Alloy Multi-layer Bracelet,,,,,,,,,
YWQSPFD0078,Vintage Alloy Golden Leaves-shape Silver Blue Amber Ring,,<p>Ring Size: 6 / 7 / 8/ 9/ 10</p>,img/Rings/SKUH57361.jpg,,Size#6:7:8:9:10:,25.28,,,,1,1,,,Rings,,Vintage Alloy Golden Leaves-shape Silver Blue Amber Ring,Vintage Alloy Golden Leaves-shape Silver Blue Amber Ring,Vintage Alloy Golden Leaves-shape Silver Blue Amber Ring,,,,,,,,,
YWQSPFD0079,Women 15 Card Slots Patchwork Long Wallet Purse,,"<p>Color:Pink, Black, Brown, Blue, Red</p><p>Material:PU</p><p>Style:Casual</p>",img/Wallets/SKUD61629.jpg,,Size#,70.46,,,,1,1,,,Wallets,,Women 15 Card Slots Patchwork Long Wallet Purse,Women 15 Card Slots Patchwork Long Wallet Purse,Women 15 Card Slots Patchwork Long Wallet Purse,,,,,,,,,
YWQSPFD0080,SOCOFY Leather Bohemian Cutout Flower Pattern Hook Loop Open Toe Casual Comfy Wedge Sandals,,"<p>Color:Blue</p><p>Type:Wedges  Sandals</p><p>Closure Type:Hook & Loop</p><p>Heel Type:Wedges Heel</p><p>Heel Height:5-8cm In Heel</p><p>Toe Type:Opened</p><p>Pattern:Plants</p><p>Design Element:Print</p><p>Upper Material:Leather</p><p>Style:Bohemia</p><p>Outsole Material:Rubber</p><p>Structure:Hook & Loop, T-strap, Opened</p><p>Occasion:Daily</p><p>Decoration:Hollow Out</p><p>Function:Soft</p><p>Season:Spring&Summer</p>",img/Sandals/SKUF20409.jpg,,Size#US 5:US 6:US 7:US 8:US 9.5:US 10.5:US 11.5:,62.93,,,,1,1,,,Sandals,,SOCOFY Leather Bohemian Cutout Flower Pattern Hook Loop Open Toe Casual Comfy Wedge Sandals,SOCOFY Leather Bohemian Cutout Flower Pattern Hook Loop Open Toe Casual Comfy Wedge Sandals,SOCOFY Leather Bohemian Cutout Flower Pattern Hook Loop Open Toe Casual Comfy Wedge Sandals,,,,,,,,,
YWQSPFD0081,Casual Soft Comfortable Flats Solid Color Pearl Inlay Loafers Shoes For Women,,"<p>Color:Black</p><p>Type:Loafers</p><p>Closure Type:Slip-On</p><p>Heel Type:Flat</p><p>Heel Height:1-3cm In Flat</p><p>Toe Type:Round</p><p>Pattern:Solid</p><p>Upper Material:PU</p><p>Style:Casual</p><p>Outsole Material:Rubber</p><p>Occasion:Daily</p><p>Function:Antiskid, Soft, Hard-wearing</p><p>Season:Summer, Autumn</p>",img/Flats/SKUH92796.jpg,,Size#US 5:US 6:US 7:US 8:US 9:US 10:US 11:US 12:,60.07,,,,1,1,,,Flats,,Casual Soft Comfortable Flats Solid Color Pearl Inlay Loafers Shoes For Women,Casual Soft Comfortable Flats Solid Color Pearl Inlay Loafers Shoes For Women,Casual Soft Comfortable Flats Solid Color Pearl Inlay Loafers Shoes For Women,,,,,,,,,
YWQSPFD0082,Floral Print Ring Detail Halter Top,,<p><b>Style</b>: Boho</p><p><b>Color</b>: Multicolor</p><p><b>Pattern Type</b>: Floral</p><p><b>Pattern Type</b>: All Over Print</p><p><b>Length</b>: Crop</p><p><b>Season</b>: Summer</p><p><b>Type</b>: Halter</p><p><b>Details</b>: Knot</p><p><b>Details</b>: Ring</p><p><b>Neckline</b>: Halter</p><p><b>Fit Type</b>: Slim Fit</p><p><b>Sheer</b>: No</p><p><b>Material</b>: Polyester</p><p><b>Composition</b>: 80% Polyester</p><p><b>Composition</b>: 20% Cotton</p><p><b>Fabric</b>: Non-Stretch</p><p><b>Care Instructions</b>: Machine wash or professional dry clean</p>,img/Tank_Tops__Camis/rw2107033323160179.jpg,,Size#S:M:L:,23.73,,,,1,1,,,Tank Tops & Cam's,,Floral Print Ring Detail Halter Top,Floral Print Ring Detail Halter Top,Floral Print Ring Detail Halter Top,,,,,,,,,
YWQSPFD0083,Solid Lace Up Tee,,<p><b>Style</b>: Casual</p><p><b>Color</b>: White</p><p><b>Pattern Type</b>: Plain</p><p><b>Length</b>: Crop</p><p><b>Season</b>: Spring/Fall</p><p><b>Details</b>: Criss Cross</p><p><b>Details</b>: Rib-Knit</p><p><b>Sleeve Length</b>: Long Sleeve</p><p><b>Neckline</b>: Round Neck</p><p><b>Fit Type</b>: Slim Fit</p><p><b>Sleeve Type</b>: Regular Sleeve</p><p><b>Placket Type</b>: Pullovers</p><p><b>Sheer</b>: No</p><p><b>Material</b>: Polyester</p><p><b>Composition</b>: 80% Polyester</p><p><b>Composition</b>: 20% Cotton</p><p><b>Fabric</b>: High Stretch</p><p><b>Care Instructions</b>: Machine wash or professional dry clean</p>,img/T___Shirts/rwtee25210616909.jpg,,Size#S:M:L:XL:,27.81,,,,1,1,,,T-Shirts,,Solid Lace Up Tee,Solid Lace Up Tee,Solid Lace Up Tee,,,,,,,,,
YWQSPFD0084,Self Tie Flounce Sleeve Crop Top,,<p><b>Style</b>: Casual</p><p><b>Color</b>: Black</p><p><b>Pattern Type</b>: Plain</p><p><b>Length</b>: Crop</p><p><b>Season</b>: Spring/Summer</p><p><b>Details</b>: Ruched</p><p><b>Details</b>: Tie Back</p><p><b>Sleeve Type</b>: Flounce Sleeve</p><p><b>Sleeve Length</b>: Long Sleeve</p><p><b>Neckline</b>: Off the Shoulder</p><p><b>Fit Type</b>: Regular Fit</p><p><b>Placket Type</b>: Pullovers</p><p><b>Sheer</b>: No</p><p><b>Material</b>: Polyester</p><p><b>Composition</b>: 100% Polyester</p><p><b>Fabric</b>: Non-Stretch</p><p><b>Care Instructions</b>: Machine wash or professional dry clean</p>,img/Women_Tops/rwtop03200907645.jpg,,Size#S:M:L:,24.53,,,,1,1,,,Women Tops,,Self Tie Flounce Sleeve Crop Top,Self Tie Flounce Sleeve Crop Top,Self Tie Flounce Sleeve Crop Top,,,,,,,,,
YWQSPFD0085,Plaid Button Front Blouse,,<p><b>Style</b>: Preppy</p><p><b>Color</b>: Dark Green</p><p><b>Pattern Type</b>: Plaid</p><p><b>Length</b>: Long</p><p><b>Season</b>: Spring/Fall</p><p><b>Type</b>: Shirt</p><p><b>Details</b>: Button Front</p><p><b>Neckline</b>: Collar</p><p><b>Sleeve Length</b>: Long Sleeve</p><p><b>Fit Type</b>: Regular Fit</p><p><b>Sleeve Type</b>: Regular Sleeve</p><p><b>Sheer</b>: No</p><p><b>Placket Type</b>: Placket</p><p><b>Material</b>: Polyester</p><p><b>Composition</b>: 100% Polyester</p><p><b>Fabric</b>: Non-Stretch</p><p><b>Care Instructions</b>: Machine wash or professional dry clean</p>,img/Blouses/rw2106216784451553.jpg,,Size#S:M:L:,29.73,,,,1,1,,,Blouses,,Plaid Button Front Blouse,Plaid Button Front Blouse,Plaid Button Front Blouse,,,,,,,,,
YWQSPFD0086,5 Pcs Vintage Trendy Love Tortoise Hollow Geometric Pineapple Shape Beaded Ceramics Alloy Bracelet Set,,<p>Weight: 25 g</p>,img/Bracelets/SKUH97929.jpg,,Size#,25.78,,,,1,1,,,Bracelets,,5 Pcs Vintage Trendy Love Tortoise Hollow Geometric Pineapple Shape Beaded Ceramics Alloy Bracelet Set,5 Pcs Vintage Trendy Love Tortoise Hollow Geometric Pineapple Shape Beaded Ceramics Alloy Bracelet Set,5 Pcs Vintage Trendy Love Tortoise Hollow Geometric Pineapple Shape Beaded Ceramics Alloy Bracelet Set,,,,,,,,,
YWQSPFD0087,Vintage Alloy Rose-shape Carved Branch Rings,,"<p>Style: Vintage</p><p>Type: Earrings</p><p>Color: Silver,S925</p><p>Weight: 4g</p><p>Size:6/ 7/ 8/ 9/ 10</p><p>Material: Alloy,S925</p><p>Package Includes:</p><p>1 x Rings</p><p>Notice:</p>",img/Rings/SKUH75889.jpg,,Size#6:7:8:9:10:,25.53,,,,1,1,,,Rings,,Vintage Alloy Rose-shape Carved Branch Rings,Vintage Alloy Rose-shape Carved Branch Rings,Vintage Alloy Rose-shape Carved Branch Rings,,,,,,,,,
YWQSPFD0088,Women Cute Cat Pattern Prints Multi-card Slots Purse Wallet,,"<p>Color:Pink, Yellow, Green, Black, Blue</p><p>Wallets Style:Clasp Closure</p><p>Wallet Type:Money Clip, ID Wallets, Coin Purse</p><p>Material:Faux Fur, PU</p><p>Style:Casual</p><p>Pattern:Cat</p>",img/Wallets/SKUG62307.jpg,,Size#,56.01,,,,1,1,,,Wallets,,Women Cute Cat Pattern Prints Multi-card Slots Purse Wallet,Women Cute Cat Pattern Prints Multi-card Slots Purse Wallet,Women Cute Cat Pattern Prints Multi-card Slots Purse Wallet,,,,,,,,,
YWQSPFD0089,Women Casual Clip Toe Solid Color Block Heel Buckle Sandals,,"<p>Color:Yellow, Black, White</p><p>Type:Thong Sandal</p><p>Closure Type:Buckle</p><p>Heel Type:Chunky Heel</p><p>Heel Height:3-5cm In Low Heel</p><p>Toe Type:Clip Toe</p><p>Pattern:Solid</p><p>Upper Material:PU</p><p>Style:Casual, Elegant</p><p>Outsole Material:Rubber</p><p>Occasion:Casual, Daily</p><p>Function:Hard-wearing</p><p>Season:Summer</p>",img/Sandals/SKUB87431.jpg,,Size#US 5:US 6:US 7:US 8:US 9:US 10:US 11:,59.54,,,,1,1,,,Sandals,,Women Casual Clip Toe Solid Color Block Heel Buckle Sandals,Women Casual Clip Toe Solid Color Block Heel Buckle Sandals,Women Casual Clip Toe Solid Color Block Heel Buckle Sandals,,,,,,,,,
YWQSPFD0090,SOCOFY Leather Floral Cutouts Zipper Slip on Loafers Non-slip Flat Shoes,,"<p>Color:Red</p><p>Closure Type:Slip-On, Zipper, Elastic Band</p><p>Toe Type:Round</p><p>Upper Material:Leather</p><p>Style:Retro</p><p>Outsole Material:Rubber</p><p>Occasion:Daily</p><p>Function:Soft</p><p>Season:Summer</p>",img/Flats/SKUE76087.jpg,,Size#US 5:US 6:US 7:US 8:US 9.5:US 10.5:US 11.5:,63.45,,,,1,1,,,Flats,,SOCOFY Leather Floral Cutouts Zipper Slip on Loafers Non-slip Flat Shoes,SOCOFY Leather Floral Cutouts Zipper Slip on Loafers Non-slip Flat Shoes,SOCOFY Leather Floral Cutouts Zipper Slip on Loafers Non-slip Flat Shoes,,,,,,,,,
YWQSPFD0091,Solid Zip Front Tank Top,,<p><b>Style</b>: Casual</p><p><b>Color</b>: Black</p><p><b>Pattern Type</b>: Plain</p><p><b>Length</b>: Crop</p><p><b>Season</b>: Summer</p><p><b>Type</b>: Tank</p><p><b>Details</b>: Ring</p><p><b>Details</b>: Zipper</p><p><b>Details</b>: Rib-Knit</p><p><b>Neckline</b>: Scoop Neck</p><p><b>Fit Type</b>: Slim Fit</p><p><b>Sheer</b>: No</p><p><b>Material</b>: Cotton Blends</p><p><b>Composition</b>: 65% Cotton</p><p><b>Composition</b>: 35% Polyester</p><p><b>Fabric</b>: Medium Stretch</p><p><b>Care Instructions</b>: Machine wash or professional dry clean</p>,img/Tank_Tops__Camis/rw2107048262616668.jpg,,Size#S:M:L:,24.3,,,,1,1,,,Tank Tops & Cam's,,Solid Zip Front Tank Top,Solid Zip Front Tank Top,Solid Zip Front Tank Top,,,,,,,,,
YWQSPFD0092,Cartoon Graphic Drawstring Crop Tee,,<p><b>Style</b>: Casual</p><p><b>Color</b>: Black</p><p><b>Pattern Type</b>: Cartoon</p><p><b>Length</b>: Crop</p><p><b>Season</b>: Spring/Fall</p><p><b>Details</b>: Drawstring</p><p><b>Details</b>: Ruched</p><p><b>Sleeve Length</b>: Long Sleeve</p><p><b>Neckline</b>: Round Neck</p><p><b>Fit Type</b>: Regular Fit</p><p><b>Sleeve Type</b>: Regular Sleeve</p><p><b>Placket Type</b>: Pullovers</p><p><b>Sheer</b>: No</p><p><b>Material</b>: Polyester</p><p><b>Composition</b>: 80% Polyester</p><p><b>Composition</b>: 20% Cotton</p><p><b>Fabric</b>: Slight Stretch</p><p><b>Care Instructions</b>: Machine wash or professional dry clean</p>,img/T___Shirts/sW210618532814735.jpg,,Size#S:M:L:,28.85,,,,1,1,,,T-Shirts,,Cartoon Graphic Drawstring Crop Tee,Cartoon Graphic Drawstring Crop Tee,Cartoon Graphic Drawstring Crop Tee,,,,,,,,,
YWQSPFD0093,Two Tone Tie Front Ribbed Crop Top,,<p><b>Style</b>: Casual</p><p><b>Color</b>: Multicolor</p><p><b>Pattern Type</b>: Colorblock</p><p><b>Length</b>: Crop</p><p><b>Season</b>: Summer</p><p><b>Details</b>: Rib-Knit</p><p><b>Details</b>: Tie Front</p><p><b>Sleeve Length</b>: Sleeveless</p><p><b>Fit Type</b>: Slim Fit</p><p><b>Neckline</b>: Spaghetti Strap</p><p><b>Placket Type</b>: Placket</p><p><b>Sheer</b>: No</p><p><b>Material</b>: Polyester</p><p><b>Composition</b>: 100% Polyester</p><p><b>Fabric</b>: High Stretch</p><p><b>Care Instructions</b>: Machine wash or professional dry clean</p>,img/Women_Tops/rwtop01210316233.jpg,,Size#XS:S:M:L:,24.45,,,,1,1,,,Women Tops,,Two Tone Tie Front Ribbed Crop Top,Two Tone Tie Front Ribbed Crop Top,Two Tone Tie Front Ribbed Crop Top,,,,,,,,,
YWQSPFD0094,Cold Shoulder Frill Trim Floral Top,,<p><b>Style</b>: Boho</p><p><b>Color</b>: Multicolor</p><p><b>Pattern Type</b>: Floral</p><p><b>Length</b>: Regular</p><p><b>Season</b>: Summer</p><p><b>Type</b>: Top</p><p><b>Details</b>: Button</p><p><b>Details</b>: Frill</p><p><b>Sleeve Type</b>: Raglan Sleeve</p><p><b>Neckline</b>: Cold Shoulder</p><p><b>Fit Type</b>: Regular Fit</p><p><b>Sleeve Length</b>: Short Sleeve</p><p><b>Sheer</b>: No</p><p><b>Placket Type</b>: Pullovers</p><p><b>Material</b>: Polyester</p><p><b>Composition</b>: 100% Polyester</p><p><b>Fabric</b>: Non-Stretch</p><p><b>Care Instructions</b>: Machine wash or professional dry clean</p>,img/Blouses/swblouse07210113063.jpg,,Size#XS:S:M:L:,26.58,,,,1,1,,,Blouses,,Cold Shoulder Frill Trim Floral Top,Cold Shoulder Frill Trim Floral Top,Cold Shoulder Frill Trim Floral Top,,,,,,,,,
YWQSPFD0095,4 Pcs Trendy Bohemian Shell Irregular Colorful Beaded Chain Alloy Bracelet Set,,"<p>Style: Trendy,Bohemian</p><p>Type: Bracelet</p><p>Weight: 25 g</p><p>Size: As the picture shown</p><p>Material: Alloy</p><p>Quantity: 4 pcs</p><p>Package Includes:</p><p>1 x Bracelet Set</p><p>Notice:</p>",img/Bracelets/SKUI17574.jpg,,Size#,16.91,,,,1,1,,,Bracelets,,4 Pcs Trendy Bohemian Shell Irregular Colorful Beaded Chain Alloy Bracelet Set,4 Pcs Trendy Bohemian Shell Irregular Colorful Beaded Chain Alloy Bracelet Set,4 Pcs Trendy Bohemian Shell Irregular Colorful Beaded Chain Alloy Bracelet Set,,,,,,,,,
YWQSPFD0096,Alloy Vintage Flower Ring Engraved Wildflower Engagement Ring,,<p>Style: Vintage</p><p>Type: Rings</p><p>Color: Golden</p><p>Weight: 7g</p><p>Material:  Alloy</p><p>Package Includes:</p><p>1 x Rings</p><p>Notice:</p>,img/Rings/SKUH57385.jpg,,Size##7:#8:#9:#10:6:,14.33,,,,1,1,,,Rings,,Alloy Vintage Flower Ring Engraved Wildflower Engagement Ring,Alloy Vintage Flower Ring Engraved Wildflower Engagement Ring,Alloy Vintage Flower Ring Engraved Wildflower Engagement Ring,,,,,,,,,
