v_sku,v_name,v_short_description,v_description,v_image,v_url,v_attribute,v_price,v_specials_price,v_specials_expire_date,v_date_added,v_in_stock,v_status,v_viewed,v_ordered,v_category_sku,v_sort_order,v_meta_title,v_meta_keywords,v_meta_description,v_brand_filter,v_class_filter,v_color_filter,v_gender_filter,v_material_filter,v_year_filter,v_origin_filter,v_series_filter,v_spec_filter
YWQSPFD0001,Skeleton Print Drawstring Halter Top,,<p><b>Style</b>: Casual</p><p><b>Color</b>: Black</p><p><b>Pattern Type</b>: Halloween</p><p><b>Length</b>: Crop</p><p><b>Season</b>: Summer</p><p><b>Type</b>: Halter</p><p><b>Details</b>: Drawstring</p><p><b>Details</b>: Ruched</p><p><b>Details</b>: Rib-Knit</p><p><b>Neckline</b>: Halter</p><p><b>Fit Type</b>: Slim Fit</p><p><b>Sheer</b>: No</p><p><b>Material</b>: Polyester</p><p><b>Composition</b>: 100% Polyester</p><p><b>Fabric</b>: Slight Stretch</p><p><b>Care Instructions</b>: Machine wash or professional dry clean</p>,img/Tank_Tops__Camis/rW210607295084153.jpg,,Size#S:M:L:,26.22,,,,1,1,,,Tank Tops & Cam's,,Skeleton Print Drawstring Halter Top,Skeleton Print Drawstring Halter Top,Skeleton Print Drawstring Halter Top,,,,,,,,,
YWQSPFD0002,Cartoon Graphic Crop Tee,,<p><b>Style</b>: Casual</p><p><b>Color</b>: Baby Pink</p><p><b>Pattern Type</b>: Cartoon</p><p><b>Length</b>: Crop</p><p><b>Season</b>: Summer</p><p><b>Neckline</b>: Round Neck</p><p><b>Sleeve Length</b>: Short Sleeve</p><p><b>Fit Type</b>: Slim Fit</p><p><b>Sleeve Type</b>: Regular Sleeve</p><p><b>Placket Type</b>: Pullovers</p><p><b>Sheer</b>: No</p><p><b>Material</b>: Cotton</p><p><b>Composition</b>: 65% Cotton</p><p><b>Composition</b>: 35% Polyester</p><p><b>Fabric</b>: Slight Stretch</p><p><b>Care Instructions</b>: Machine wash or professional dry clean</p>,img/T___Shirts/rw2106285356958905.jpg,,Size#XS:S:M:L:,29.64,,,,1,1,,,T-Shirts,,Cartoon Graphic Crop Tee,Cartoon Graphic Crop Tee,Cartoon Graphic Crop Tee,,,,,,,,,
YWQSPFD0003,Ruched Front Crop Top,,<p><b>Style</b>: Casual</p><p><b>Color</b>: Black</p><p><b>Pattern Type</b>: Plain</p><p><b>Length</b>: Crop</p><p><b>Season</b>: Summer</p><p><b>Details</b>: Frill</p><p><b>Details</b>: Ruched</p><p><b>Sleeve Type</b>: Puff Sleeve</p><p><b>Sleeve Length</b>: Short Sleeve</p><p><b>Fit Type</b>: Slim Fit</p><p><b>Neckline</b>: Sweetheart</p><p><b>Placket Type</b>: Pullovers</p><p><b>Sheer</b>: No</p><p><b>Material</b>: Cotton</p><p><b>Composition</b>: 65% Cotton</p><p><b>Composition</b>: 35% Polyester</p><p><b>Fabric</b>: Slight Stretch</p><p><b>Care Instructions</b>: Machine wash or professional dry clean</p>,img/Women_Tops/rwtop03210125250.jpg,,Size#XS:S:M:L:,27.77,,,,1,1,,,Women Tops,,Ruched Front Crop Top,Ruched Front Crop Top,Ruched Front Crop Top,,,,,,,,,
YWQSPFD0004,Polka Dot Knot Milkmaid Blouse,,<p><b>Style</b>: Casual</p><p><b>Color</b>: Dusty Blue</p><p><b>Pattern Type</b>: Polka Dot</p><p><b>Length</b>: Crop</p><p><b>Season</b>: Summer</p><p><b>Type</b>: Top</p><p><b>Details</b>: Frill</p><p><b>Details</b>: Knot</p><p><b>Sleeve Type</b>: Puff Sleeve</p><p><b>Sleeve Length</b>: Short Sleeve</p><p><b>Fit Type</b>: Slim Fit</p><p><b>Neckline</b>: Sweetheart</p><p><b>Sheer</b>: No</p><p><b>Placket Type</b>: Pullovers</p><p><b>Material</b>: Cotton Blends</p><p><b>Composition</b>: 65% Cotton</p><p><b>Composition</b>: 35% Polyester</p><p><b>Fabric</b>: Non-Stretch</p><p><b>Care Instructions</b>: Machine wash or professional dry clean</p>,img/Blouses/rwblouse25210512658.jpg,,Size#S:M:L:XL:,32.05,,,,1,1,,,Blouses,,Polka Dot Knot Milkmaid Blouse,Polka Dot Knot Milkmaid Blouse,Polka Dot Knot Milkmaid Blouse,,,,,,,,,
YWQSPFD0005,Vintage Multicolor Beautiful Butterfly Pattern Print Butterfly Braided Gemstone Multi-layer Bracelet,,"<p>Style: Retro </p><p>Type: Bracelet</p><p>Main Color: 4 colors for your choose</p><p>Chain Length: 17cm+5cm/6.69inch+1.97inch</p><p>Weight: About 14g</p><p>Material: Alloy, glass</p><p>1 X Bracelet</p>",img/Bracelets/SKUH11007.jpg,,Size#,18.5,,,,1,1,,,Bracelets,,Vintage Multicolor Beautiful Butterfly Pattern Print Butterfly Braided Gemstone Multi-layer Bracelet,Vintage Multicolor Beautiful Butterfly Pattern Print Butterfly Braided Gemstone Multi-layer Bracelet,Vintage Multicolor Beautiful Butterfly Pattern Print Butterfly Braided Gemstone Multi-layer Bracelet,,,,,,,,,
YWQSPFD0006,Vintage Silver Plated Animal Women Ring Cute Adjustable Open Cat Ring Jewelry Gift,,<p>Style: Vintage </p><p>Type: Ring</p><p>Color: Silver</p><p>Weight: 10g</p><p>Size: Adjustable</p><p>Material: Alloy</p><p>1 x Ring</p>,img/Rings/SKUG83525.jpg,,Size#,14.94,,,,1,1,,,Rings,,Vintage Silver Plated Animal Women Ring Cute Adjustable Open Cat Ring Jewelry Gift,Vintage Silver Plated Animal Women Ring Cute Adjustable Open Cat Ring Jewelry Gift,Vintage Silver Plated Animal Women Ring Cute Adjustable Open Cat Ring Jewelry Gift,,,,,,,,,
YWQSPFD0007,Women Vintage Genuine Leather Cow Lether Multi-card Slots Money Clips Wallet,,"<p>Color:Orange, Black, Purple, Blue, Red</p><p>Wallet Type:ID Wallets</p><p>Material:Cow Leather</p><p>Style:Vintage</p><p>Pattern:Solid</p>",img/Wallets/SKUH12677.jpg,,Size#,68.48,,,,1,1,,,Wallets,,Women Vintage Genuine Leather Cow Lether Multi-card Slots Money Clips Wallet,Women Vintage Genuine Leather Cow Lether Multi-card Slots Money Clips Wallet,Women Vintage Genuine Leather Cow Lether Multi-card Slots Money Clips Wallet,,,,,,,,,
YWQSPFD0008,Women Caual Opened Toe Hasp Woven Decoration Espadrille Wedges Sandals,,"<p>Color:Black</p><p>Type:Wedges  Sandals</p><p>Closure Type:Hasp</p><p>Heel Type:Wedges Heel</p><p>Heel Height:5-8cm In Heel</p><p>Toe Type:Opened</p><p>Pattern:Other</p><p>Design Element:Woven</p><p>Upper Material:PU</p><p>Style:Casual, Brief</p><p>Outsole Material:Rubber</p><p>Structure:Buckle</p><p>Occasion:Casual</p><p>Function:Hard-wearing</p><p>Season:Summer</p>",img/Sandals/SKUH58798.jpg,,Size#US 5:US 7:US 8:US 9:US 10:,54.42,,,,1,1,,,Sandals,,Women Caual Opened Toe Hasp Woven Decoration Espadrille Wedges Sandals,Women Caual Opened Toe Hasp Woven Decoration Espadrille Wedges Sandals,Women Caual Opened Toe Hasp Woven Decoration Espadrille Wedges Sandals,,,,,,,,,
YWQSPFD0009,Women Casual Sequined Bow Single Shoes Cute Square-toe Ballet Flats,,"<p>Color:Green, Black, Pink</p><p>Type:Ballet Flat</p><p>Closure Type:Slip-On</p><p>Heel Type:Flat</p><p>Heel Height:1-3cm In Flat</p><p>Toe Type:Square</p><p>Pattern:Other</p><p>Design Element:Sequined, Bowknot</p><p>Upper Material:PU</p><p>Style:Casual, Sweet/Cute</p><p>Outsole Material:Rubber</p><p>Structure:Slip-On</p><p>Occasion:Date, Casual, Daily</p><p>Function:Soft, Hard-wearing</p><p>Season:Summer, Autumn, Spring</p>",img/Flats/SKUI11407.jpg,,Size#US 5:US 6:US 7:US 8:,56.65,,,,1,1,,,Flats,,Women Casual Sequined Bow Single Shoes Cute Square-toe Ballet Flats,Women Casual Sequined Bow Single Shoes Cute Square-toe Ballet Flats,Women Casual Sequined Bow Single Shoes Cute Square-toe Ballet Flats,,,,,,,,,
YWQSPFD0010,Solid Halter Top,,<p><b>Style</b>: Casual</p><p><b>Color</b>: Chocolate Brown</p><p><b>Pattern Type</b>: Plain</p><p><b>Length</b>: Crop</p><p><b>Season</b>: Summer</p><p><b>Type</b>: Halter</p><p><b>Details</b>: Knot</p><p><b>Neckline</b>: Halter</p><p><b>Fit Type</b>: Slim Fit</p><p><b>Sheer</b>: No</p><p><b>Material</b>: Polyester</p><p><b>Composition</b>: 95% Polyester</p><p><b>Composition</b>: 5% Elastane</p><p><b>Fabric</b>: Slight Stretch</p><p><b>Care Instructions</b>: Machine wash or professional dry clean</p><p><b>Style</b>: Casual</p><p><b>Color</b>: Lime Green</p><p><b>Pattern Type</b>: Plain</p><p><b>Length</b>: Crop</p><p><b>Season</b>: Summer</p><p><b>Type</b>: Halter</p><p><b>Details</b>: Knot</p><p><b>Neckline</b>: Halter</p><p><b>Fit Type</b>: Slim Fit</p><p><b>Sheer</b>: No</p><p><b>Material</b>: Polyester</p><p><b>Composition</b>: 95% Polyester</p><p><b>Composition</b>: 5% Elastane</p><p><b>Fabric</b>: Slight Stretch</p><p><b>Care Instructions</b>: Machine wash or professional dry clean</p><p><b>Style</b>: Casual</p><p><b>Color</b>: Baby Pink</p><p><b>Pattern Type</b>: Plain</p><p><b>Length</b>: Crop</p><p><b>Season</b>: Summer</p><p><b>Type</b>: Halter</p><p><b>Details</b>: Knot</p><p><b>Neckline</b>: Halter</p><p><b>Fit Type</b>: Slim Fit</p><p><b>Sheer</b>: No</p><p><b>Material</b>: Polyester</p><p><b>Composition</b>: 95% Polyester</p><p><b>Composition</b>: 5% Elastane</p><p><b>Fabric</b>: Slight Stretch</p><p><b>Care Instructions</b>: Machine wash or professional dry clean</p>,img/Tank_Tops__Camis/rwvest25210611918.jpg,,Size#XS:S:M:L:XL:,28.35,,,,1,1,,,Tank Tops & Cam's,,Solid Halter Top,Solid Halter Top,Solid Halter Top,,,,,,,,,
YWQSPFD0011,Letter Crop Tee,,<p><b>Style</b>: Casual</p><p><b>Color</b>: Mint Green</p><p><b>Pattern Type</b>: Letter</p><p><b>Length</b>: Crop</p><p><b>Season</b>: Summer</p><p><b>Neckline</b>: Round Neck</p><p><b>Sleeve Length</b>: Short Sleeve</p><p><b>Fit Type</b>: Regular Fit</p><p><b>Sleeve Type</b>: Regular Sleeve</p><p><b>Placket Type</b>: Pullovers</p><p><b>Sheer</b>: No</p><p><b>Material</b>: Cotton</p><p><b>Composition</b>: 65% Cotton</p><p><b>Composition</b>: 35% Polyester</p><p><b>Fabric</b>: Slight Stretch</p><p><b>Care Instructions</b>: Machine wash or professional dry clean</p>,img/T___Shirts/rwtee25210531860.jpg,,Size#S:M:L:,25.62,,,,1,1,,,T-Shirts,,Letter Crop Tee,Letter Crop Tee,Letter Crop Tee,,,,,,,,,
YWQSPFD0012,Solid Drawstring Ruched Ribbed Crop Tube Top,,<p><b>Style</b>: Casual</p><p><b>Color</b>: Baby Pink</p><p><b>Pattern Type</b>: Plain</p><p><b>Length</b>: Crop</p><p><b>Season</b>: Summer</p><p><b>Details</b>: Drawstring</p><p><b>Details</b>: Ruched</p><p><b>Details</b>: Rib-Knit</p><p><b>Sleeve Length</b>: Sleeveless</p><p><b>Fit Type</b>: Slim Fit</p><p><b>Neckline</b>: Strapless</p><p><b>Placket Type</b>: Pullovers</p><p><b>Sheer</b>: No</p><p><b>Material</b>: Polyester</p><p><b>Composition</b>: 95% Polyester</p><p><b>Composition</b>: 5% Elastane</p><p><b>Fabric</b>: Slight Stretch</p><p><b>Care Instructions</b>: Machine wash or professional dry clean</p>,img/Women_Tops/rwtop25210531292.jpg,,Size#XS:S:M:L:,31.44,,,,1,1,,,Women Tops,,Solid Drawstring Ruched Ribbed Crop Tube Top,Solid Drawstring Ruched Ribbed Crop Tube Top,Solid Drawstring Ruched Ribbed Crop Tube Top,,,,,,,,,
YWQSPFD0013,Cow Print Button Front Crop Blouse,,<p><b>Style</b>: Casual</p><p><b>Color</b>: Black and White</p><p><b>Pattern Type</b>: All Over Print</p><p><b>Length</b>: Crop</p><p><b>Season</b>: Summer</p><p><b>Type</b>: Shirt</p><p><b>Details</b>: Button Front</p><p><b>Neckline</b>: Collar</p><p><b>Fit Type</b>: Regular Fit</p><p><b>Sleeve Length</b>: Short Sleeve</p><p><b>Sleeve Type</b>: Regular Sleeve</p><p><b>Sheer</b>: No</p><p><b>Placket Type</b>: Placket</p><p><b>Body</b>: No</p><p><b>Material</b>: Polyester</p><p><b>Composition</b>: 100% Polyester</p><p><b>Coating</b>: 100% Polyester</p><p><b>Fabric</b>: Slight Stretch</p><p><b>Care Instructions</b>: Machine wash or professional dry clean</p>,img/Blouses/rwblouse25210604043.jpg,,Size#S:M:L:,30.17,,,,1,1,,,Blouses,,Cow Print Button Front Crop Blouse,Cow Print Button Front Crop Blouse,Cow Print Button Front Crop Blouse,,,,,,,,,
YWQSPFD0014,Ethnic Hand-woven Ceramic Beads Bracelet Geometric Metal Flower Ceramic Beads Pendant Bracelet,,"<p>Style:Ethnic</p><p>Type:Bracelet</p><p>Color:Red,Green</p><p>Weight: About 35g</p><p>Size:Adjustable</p><p>Material:Wax line</p><p>1 x Bracelet</p>",img/Bracelets/SKUF23471.jpg,,Size#,13.78,,,,1,1,,,Bracelets,,Ethnic Hand-woven Ceramic Beads Bracelet Geometric Metal Flower Ceramic Beads Pendant Bracelet,Ethnic Hand-woven Ceramic Beads Bracelet Geometric Metal Flower Ceramic Beads Pendant Bracelet,Ethnic Hand-woven Ceramic Beads Bracelet Geometric Metal Flower Ceramic Beads Pendant Bracelet,,,,,,,,,
YWQSPFD0015,Vintage 14K Rose Gold Hollow Flower Ring Retro Alloy Engagement Ring,,"<p>Style:Elegant,Retro.</p><p>Type: Ring</p><p>Color: </p><p>Silver</p><p>.</p><p>Diameter Length: About 16.5/ 17.3/ 18.1/ 18.9/ 19.8 mm</p><p>Material: Alloy</p><p>Ring Size: 6 /7 / 8 / 9 / 10</p><p>(Please see the size reference for size conversion and detail information.)</p><p>Package Includes:</p><p>1 x Ring</p>",img/Rings/SKUH02220.jpg,,Size#6:7:8:9:10:,15.24,,,,1,1,,,Rings,,Vintage 14K Rose Gold Hollow Flower Ring Retro Alloy Engagement Ring,Vintage 14K Rose Gold Hollow Flower Ring Retro Alloy Engagement Ring,Vintage 14K Rose Gold Hollow Flower Ring Retro Alloy Engagement Ring,,,,,,,,,
YWQSPFD0016,RFID Men And Women Genuine Leather 24 Card Slot Large Capacity Card Holder Passport Case,,"<p>Color:Yellow, Coffee, Green, Black, Blue, Red, Khaki</p><p>Style:Vintage</p><p>Decoration:Genuine Leather</p>",img/Wallets/SKU821850.jpg,,Size#,59.89,,,,1,1,,,Wallets,,RFID Men And Women Genuine Leather 24 Card Slot Large Capacity Card Holder Passport Case,RFID Men And Women Genuine Leather 24 Card Slot Large Capacity Card Holder Passport Case,RFID Men And Women Genuine Leather 24 Card Slot Large Capacity Card Holder Passport Case,,,,,,,,,
YWQSPFD0017,Women Outdoor & Indoor Water Shoes Slip-On Lightweight Breathable Non Slip Casual Beach Sandals,,"<p>Color:Black, Multicolor, White</p><p>Closure Type:Slip-On</p><p>Heel Type:Flat</p><p>Heel Height:1-3cm In Flat</p><p>Toe Type:Round</p><p>Pattern:Dot</p><p>Design Element:Hollow out, Print</p><p>Upper Material:EVA Foam</p><p>Style:Casual</p><p>Outsole Material:EVA</p><p>Occasion:Upstream, Outdoor, Beach, Casual</p><p>Function:Antiskid, Light Weight</p><p>Season:Summer, Spring&Fall</p>",img/Sandals/SKUH54388.jpg,,Size#US 5:US 6:US 7:US 8:US 9:US 10:US 11:US 12:US 13:,58.08,,,,1,1,,,Sandals,,Women Outdoor & Indoor Water Shoes Slip-On Lightweight Breathable Non Slip Casual Beach Sandals,Women Outdoor & Indoor Water Shoes Slip-On Lightweight Breathable Non Slip Casual Beach Sandals,Women Outdoor & Indoor Water Shoes Slip-On Lightweight Breathable Non Slip Casual Beach Sandals,,,,,,,,,
YWQSPFD0018,Women Comfy Printing Animal-print Floral Square Toe Flat Loafers Shoes,,"<p>Color:Green, Beige, Blue, Light Green</p><p>Type:Loafers</p><p>Closure Type:Elastic Band</p><p>Heel Type:Flat</p><p>Heel Height:1-3cm In Flat</p><p>Toe Type:Square</p><p>Pattern:Animal-print, Floral</p><p>Design Element:Pattern, Print</p><p>Upper Material:Canvas</p><p>Style:Casual, Stylish</p><p>Outsole Material:Rubber</p><p>Structure:Elastic Band</p><p>Occasion:Casual</p><p>Function:Antiskid, Hard-wearing</p><p>Season:All Season</p>",img/Flats/SKUG95804.jpg,,Size#US 5:US 6:US 7:US 8:US 9:US 10:US 11:US 12:,52.13,,,,1,1,,,Flats,,Women Comfy Printing Animal-print Floral Square Toe Flat Loafers Shoes,Women Comfy Printing Animal-print Floral Square Toe Flat Loafers Shoes,Women Comfy Printing Animal-print Floral Square Toe Flat Loafers Shoes,,,,,,,,,
YWQSPFD0019,Tie Back Backless Crop Tank Top,,<p><b>Style</b>: Casual</p><p><b>Color</b>: Dusty Pink</p><p><b>Pattern Type</b>: Plain</p><p><b>Length</b>: Crop</p><p><b>Season</b>: Summer</p><p><b>Type</b>: Tank</p><p><b>Details</b>: Backless</p><p><b>Details</b>: Tie Back</p><p><b>Neckline</b>: Round Neck</p><p><b>Fit Type</b>: Slim Fit</p><p><b>Sheer</b>: No</p><p><b>Material</b>: Polyester</p><p><b>Composition</b>: 95% Polyester</p><p><b>Composition</b>: 5% Spandex</p><p><b>Fabric</b>: Slight Stretch</p><p><b>Care Instructions</b>: Machine wash or professional dry clean</p>,img/Tank_Tops__Camis/swvest25210107308.jpg,,Size#XS:S:M:L:,24.81,,,,1,1,,,Tank Tops & Cam's,,Tie Back Backless Crop Tank Top,Tie Back Backless Crop Tank Top,Tie Back Backless Crop Tank Top,,,,,,,,,
YWQSPFD0020,Lettuce Edge Drawstring Crop Top,,<p><b>Style</b>: Casual</p><p><b>Color</b>: Black</p><p><b>Pattern Type</b>: Plain</p><p><b>Length</b>: Crop</p><p><b>Season</b>: Summer</p><p><b>Details</b>: Drawstring</p><p><b>Details</b>: Lettuce Trim</p><p><b>Details</b>: Ruched</p><p><b>Details</b>: Rib-Knit</p><p><b>Sleeve Length</b>: Short Sleeve</p><p><b>Neckline</b>: V neck</p><p><b>Fit Type</b>: Regular Fit</p><p><b>Sleeve Type</b>: Regular Sleeve</p><p><b>Placket Type</b>: Pullovers</p><p><b>Sheer</b>: No</p><p><b>Belt</b>: No</p><p><b>Body</b>: Unlined</p><p><b>Material</b>: Polyester</p><p><b>Composition</b>: 95% Polyester</p><p><b>Composition</b>: 5% Spandex</p><p><b>Fabric</b>: Slight Stretch</p><p><b>Care Instructions</b>: Machine wash or professional dry clean</p><p><b>Style</b>: Casual</p><p><b>Color</b>: Lilac Purple</p><p><b>Pattern Type</b>: Plain</p><p><b>Length</b>: Crop</p><p><b>Season</b>: Summer</p><p><b>Details</b>: Drawstring</p><p><b>Details</b>: Lettuce Trim</p><p><b>Details</b>: Ruched</p><p><b>Details</b>: Rib-Knit</p><p><b>Sleeve Length</b>: Short Sleeve</p><p><b>Neckline</b>: V neck</p><p><b>Fit Type</b>: Regular Fit</p><p><b>Sleeve Type</b>: Regular Sleeve</p><p><b>Placket Type</b>: Pullovers</p><p><b>Sheer</b>: No</p><p><b>Belt</b>: No</p><p><b>Body</b>: Unlined</p><p><b>Material</b>: Polyester</p><p><b>Composition</b>: 95% Polyester</p><p><b>Composition</b>: 5% Spandex</p><p><b>Fabric</b>: Slight Stretch</p><p><b>Care Instructions</b>: Machine wash or professional dry clean</p>,img/T___Shirts/rwtee25210409996.jpg,,Size#S:M:L:,23.83,,,,1,1,,,T-Shirts,,Lettuce Edge Drawstring Crop Top,Lettuce Edge Drawstring Crop Top,Lettuce Edge Drawstring Crop Top,,,,,,,,,
YWQSPFD0021,Striped Crisscross Tie Back Crop Top,,<p><b>Style</b>: Casual</p><p><b>Color</b>: Black and White</p><p><b>Pattern Type</b>: Striped</p><p><b>Length</b>: Crop</p><p><b>Season</b>: Summer</p><p><b>Details</b>: Criss Cross</p><p><b>Details</b>: Tie Back</p><p><b>Fit Type</b>: Regular Fit</p><p><b>Sleeve Length</b>: Short Sleeve</p><p><b>Neckline</b>: V neck</p><p><b>Sleeve Type</b>: Regular Sleeve</p><p><b>Placket Type</b>: Pullovers</p><p><b>Sheer</b>: No</p><p><b>Material</b>: Cotton</p><p><b>Composition</b>: 95% Cotton</p><p><b>Composition</b>: 5% Elastane</p><p><b>Fabric</b>: Medium Stretch</p><p><b>Care Instructions</b>: Machine wash or professional dry clean</p>,img/Women_Tops/swtop25210525733.jpg,,Size#XS:S:M:L:,32.22,,,,1,1,,,Women Tops,,Striped Crisscross Tie Back Crop Top,Striped Crisscross Tie Back Crop Top,Striped Crisscross Tie Back Crop Top,,,,,,,,,
YWQSPFD0022,Ditsy Floral Smocked Lettuce-Edge Top,,<p><b>Style</b>: Boho</p><p><b>Color</b>: Redwood</p><p><b>Pattern Type</b>: Ditsy Floral</p><p><b>Length</b>: Crop</p><p><b>Season</b>: Spring/Summer</p><p><b>Type</b>: Top</p><p><b>Details</b>: Frill</p><p><b>Details</b>: Shirred</p><p><b>Sleeve Length</b>: Long Sleeve</p><p><b>Fit Type</b>: Regular Fit</p><p><b>Neckline</b>: Square Neck</p><p><b>Sleeve Type</b>: Regular Sleeve</p><p><b>Sheer</b>: No</p><p><b>Placket Type</b>: Pullovers</p><p><b>Material</b>: Chiffon</p><p><b>Composition</b>: 65% Polyester</p><p><b>Composition</b>: 35% Cotton</p><p><b>Fabric</b>: Non-Stretch</p><p><b>Care Instructions</b>: Machine wash or professional dry clean</p>,img/Blouses/swblouse03191106173.jpg,,Size#S:M:L:XL:,27.4,,,,1,1,,,Blouses,,Ditsy Floral Smocked Lettuce-Edge Top,Ditsy Floral Smocked Lettuce-Edge Top,Ditsy Floral Smocked Lettuce-Edge Top,,,,,,,,,
YWQSPFD0023,Fashion Colorful Rhinestones Beads Bracelets Vintage Turquoise Bangle Bracelet Gift for Women,,"<p>Type: </p><p>Weight: about 25g</p><p>Size: about 17cm</p><p>
	</p><p>Material: Zinc Alloy, Turquoise, Rhinestones</p><p>1 x Bracelet</p>",img/Bracelets/SKU970398.jpg,,Size#,15.53,,,,1,1,,,Bracelets,,Fashion Colorful Rhinestones Beads Bracelets Vintage Turquoise Bangle Bracelet Gift for Women,Fashion Colorful Rhinestones Beads Bracelets Vintage Turquoise Bangle Bracelet Gift for Women,Fashion Colorful Rhinestones Beads Bracelets Vintage Turquoise Bangle Bracelet Gift for Women,,,,,,,,,
YWQSPFD0024,10pcs Vintage Knuckle Tribal Ethnic Stone Joint Unique Ring,,<p>Style: Punk Ring</p><p>Material: Alloy</p><p>Color: Steel Color</p><p>Weight: about 14g</p><p>Size: As the picture</p><p>1 x 10pcs Ring</p>,img/Rings/SKU450035.jpg,,Size#,21.44,,,,1,1,,,Rings,,10pcs Vintage Knuckle Tribal Ethnic Stone Joint Unique Ring,10pcs Vintage Knuckle Tribal Ethnic Stone Joint Unique Ring,10pcs Vintage Knuckle Tribal Ethnic Stone Joint Unique Ring,,,,,,,,,
YWQSPFD0025,Vintage Flap Magnetic Button Snake Pattern Stitch Craft Wearable 6.5 Inch Phone Bag Crossbody Bag Wallet,,"<p>Color:Coffee</p><p>Wallets Style:Magnetic Closure</p><p>Material:Faux Fur, PU</p><p>Style:Business, Vintage</p>",img/Wallets/SKUI09708.jpg,,Size#,67.73,,,,1,1,,,Wallets,,Vintage Flap Magnetic Button Snake Pattern Stitch Craft Wearable 6.5 Inch Phone Bag Crossbody Bag Wallet,Vintage Flap Magnetic Button Snake Pattern Stitch Craft Wearable 6.5 Inch Phone Bag Crossbody Bag Wallet,Vintage Flap Magnetic Button Snake Pattern Stitch Craft Wearable 6.5 Inch Phone Bag Crossbody Bag Wallet,,,,,,,,,
YWQSPFD0026,Large Size Women Casual Closed Toe Elastic Band Flat Sandals,,"<p>Color:Red, Black, Brown</p><p>Closure Type:Elastic Band</p><p>Heel Type:Flat</p><p>Heel Height:1-3cm In Flat</p><p>Toe Type:Round</p><p>Pattern:Solid</p><p>Design Element:Buckle</p><p>Upper Material:PU</p><p>Style:Casual, Retro</p><p>Outsole Material:Rubber</p><p>Structure:Closed Toe</p><p>Occasion:Daily</p><p>Function:Soft</p><p>Season:Summer</p>",img/Sandals/SKUC43906.jpg,,Size#US 5:US 6:US 7:US 8:US 9:US 10:US 11:US 12:,62.67,,,,1,1,,,Sandals,,Large Size Women Casual Closed Toe Elastic Band Flat Sandals,Large Size Women Casual Closed Toe Elastic Band Flat Sandals,Large Size Women Casual Closed Toe Elastic Band Flat Sandals,,,,,,,,,
YWQSPFD0027,Women Casual Flowers Breathable Mesh Flat Shoes,,"<p>Color:Red, Brown</p><p>Closure Type:Slip-On</p><p>Toe Type:Round</p><p>Upper Material:Mesh</p><p>Style:Casual</p><p>Outsole Material:PU</p><p>Occasion:Daily</p><p>Function:Breathable</p><p>Season:Summer</p>",img/Flats/SKUC85466.jpg,,Size#US 5:US 6:US 7:US 8:US 9:US 10:,61.48,,,,1,1,,,Flats,,Women Casual Flowers Breathable Mesh Flat Shoes,Women Casual Flowers Breathable Mesh Flat Shoes,Women Casual Flowers Breathable Mesh Flat Shoes,,,,,,,,,
YWQSPFD0028,Solid Ribbed Tank Top,,<p><b>Style</b>: Basics</p><p><b>Color</b>: Mint Green</p><p><b>Pattern Type</b>: Plain</p><p><b>Length</b>: Crop</p><p><b>Season</b>: Summer</p><p><b>Type</b>: Tank</p><p><b>Details</b>: Rib-Knit</p><p><b>Fit Type</b>: Slim Fit</p><p><b>Neckline</b>: Square Neck</p><p><b>Sheer</b>: No</p><p><b>Material</b>: Polyester</p><p><b>Composition</b>: 95% Polyester</p><p><b>Composition</b>: 5% Spandex</p><p><b>Fabric</b>: High Stretch</p><p><b>Care Instructions</b>: Machine wash or professional dry clean</p>,img/Tank_Tops__Camis/rwvest25210602684.jpg,,Size#XS:S:M:L:,24.31,,,,1,1,,,Tank Tops & Cam's,,Solid Ribbed Tank Top,Solid Ribbed Tank Top,Solid Ribbed Tank Top,,,,,,,,,
YWQSPFD0029,Tie Dye Crop Tee,,<p><b>Style</b>: Casual</p><p><b>Color</b>: Multicolor</p><p><b>Pattern Type</b>: Tie Dye</p><p><b>Length</b>: Crop</p><p><b>Season</b>: Summer</p><p><b>Neckline</b>: Round Neck</p><p><b>Sleeve Length</b>: Short Sleeve</p><p><b>Fit Type</b>: Regular Fit</p><p><b>Sleeve Type</b>: Drop Shoulder</p><p><b>Placket Type</b>: Pullovers</p><p><b>Sheer</b>: No</p><p><b>Material</b>: Polyester</p><p><b>Composition</b>: 65% Polyester</p><p><b>Composition</b>: 35% Cotton</p><p><b>Fabric</b>: High Stretch</p><p><b>Care Instructions</b>: Machine wash or professional dry clean</p>,img/T___Shirts/rwtee03210114853.jpg,,Size#XS:S:M:L:XL:XXL:,25.37,,,,1,1,,,T-Shirts,,Tie Dye Crop Tee,Tie Dye Crop Tee,Tie Dye Crop Tee,,,,,,,,,
YWQSPFD0030,Solid Crisscross Tie Back Crop Wrap Top,,<p><b>Style</b>: Casual</p><p><b>Color</b>: Coffee Brown</p><p><b>Pattern Type</b>: Plain</p><p><b>Length</b>: Crop</p><p><b>Season</b>: Spring/Summer</p><p><b>Details</b>: Tie Back</p><p><b>Details</b>: Wrap</p><p><b>Details</b>: Rib-Knit</p><p><b>Neckline</b>: Deep V Neck</p><p><b>Sleeve Length</b>: Long Sleeve</p><p><b>Fit Type</b>: Slim Fit</p><p><b>Sleeve Type</b>: Regular Sleeve</p><p><b>Placket Type</b>: Placket</p><p><b>Sheer</b>: No</p><p><b>Material</b>: Polyester</p><p><b>Composition</b>: 95% Polyester</p><p><b>Composition</b>: 5% Elastane</p><p><b>Fabric</b>: High Stretch</p><p><b>Care Instructions</b>: Machine wash or professional dry clean</p>,img/Women_Tops/swtop25210527403.jpg,,Size#XS:S:M:L:,31.01,,,,1,1,,,Women Tops,,Solid Crisscross Tie Back Crop Wrap Top,Solid Crisscross Tie Back Crop Wrap Top,Solid Crisscross Tie Back Crop Wrap Top,,,,,,,,,
YWQSPFD0031,Swiss Dot Button Front Lace Trim Blouse,,<p><b>Style</b>: Casual</p><p><b>Color</b>: Beige</p><p><b>Length</b>: Crop</p><p><b>Season</b>: Summer</p><p><b>Type</b>: Top</p><p><b>Details</b>: Contrast Lace</p><p><b>Details</b>: Button Front</p><p><b>Sleeve Type</b>: Puff Sleeve</p><p><b>Neckline</b>: Deep V Neck</p><p><b>Fit Type</b>: Regular Fit</p><p><b>Sleeve Length</b>: Short Sleeve</p><p><b>Sheer</b>: No</p><p><b>Placket Type</b>: Placket</p><p><b>Material</b>: Cotton</p><p><b>Composition</b>: 65% Cotton</p><p><b>Composition</b>: 35% Polyester</p><p><b>Fabric</b>: Non-Stretch</p><p><b>Care Instructions</b>: Machine wash or professional dry clean</p>,img/Blouses/rwblouse25210602906.jpg,,Size#S:M:L:,25.01,,,,1,1,,,Blouses,,Swiss Dot Button Front Lace Trim Blouse,Swiss Dot Button Front Lace Trim Blouse,Swiss Dot Button Front Lace Trim Blouse,,,,,,,,,
YWQSPFD0032,Retro Amber Blue Dragonfly Braided Bracelet Time Gemstone Infinite Symbol Printed Leather Bracelet,,"<p>Style: Retro </p><p>Type: Bracelet</p><p>Main Color: 4 Colors for your choose</p><p>Chain Length: 17cm+5cm/6.69inch+1.97inch</p><p>Weight: About 14g</p><p>Material: Alloy, glass</p><p>1 X Bracelet</p>",img/Bracelets/SKUF64496.jpg,,Size#,11.76,,,,1,1,,,Bracelets,,Retro Amber Blue Dragonfly Braided Bracelet Time Gemstone Infinite Symbol Printed Leather Bracelet,Retro Amber Blue Dragonfly Braided Bracelet Time Gemstone Infinite Symbol Printed Leather Bracelet,Retro Amber Blue Dragonfly Braided Bracelet Time Gemstone Infinite Symbol Printed Leather Bracelet,,,,,,,,,
